"Title","Description","Description HTML","Primary Description","Detail URL","Location","Skill","Insight","Job State","Poster Id","Company Name","Company Logo","Created At","Scraped At"
"Senior Labor Economist","SHRM is a member-driven catalyst for creating better workplaces where people and businesses thrive together. As the trusted authority on all things work, SHRM is the foremost expert, researcher, advocate, and thought leader on issues and innovations impacting today’s evolving workplaces.  With nearly 340,000 members in 180 countries, SHRM touches the lives of more than 362 million workers and their families globally.

Summary

As a Senior Labor Economist at SHRM, you will play a critical role in conducting in-depth research and analysis on labor market trends, policies, and issues affecting our industry. Reporting to the Chief Economist, you will lead research projects, provide expert insights, and contribute to the organization's advocacy efforts with policymakers and stakeholders across Capitol Hill and the Executive Branch.

 responsibilities: 

 Conduct quantitative and qualitative analysis of labor market data, including employment trends, wage dynamics, workforce demographics, and labor policy impacts.  Lead research projects to assess the economic implications of proposed policies and regulations on the industry and its workforce.  Develop economic models and forecasts to support decision-making and strategic planning within the organization.  Produce high-quality research reports, policy briefs, and presentations for internal and external audiences.  Collaborate with cross-functional teams to integrate economic analysis into advocacy campaigns, policy initiatives, and communications efforts.  Design new and creative methods for communicating economic trends with the media and key audiences turning to SHRM as the preeminent thought leader in all things work.  Serve as a subject matter expert on labor market issues, providing insights and recommendations to internal stakeholders and external partners. 

 Education & Experience Requirements 

 Master's or Ph.D. in Economics, Labor Economics, Business Economics, or a related field required.  5-7 years of experience conducting labor market research and analysis, preferably in a policy-oriented setting. 

 Knowledge, Skills & Abilities 

 Strong quantitative skills, including proficiency in statistical analysis and econometric modeling.  Experience working with labor market data sources, such as BLS, Census Bureau, and proprietary datasets.  Excellent written and verbal communication skills, with the ability to distill complex economic concepts into clear and concise messages for diverse audiences.  Proven ability to manage multiple projects simultaneously and deliver high-quality work under tight deadlines.  Collaborative team player with a passion for using economic research to inform policy and advocacy efforts. 

 Additional Notes 

 Physical Requirements  (adjust this section as necessary)

 Must be able to perform essential duties satisfactorily with reasonable accommodations.  Work is generally done sitting, talking, hearing, and typing. Visual acuity to use a keyboard, prepare and analyze data and figures; transcribing, viewing a computer terminal; extensive reading. 

 Work environment  (adjust this section as necessary)

 Work is regularly performed in a combination of office and conference settings and routinely uses standard office equipment.  Expected travel is 0-10% of the time. 

The hiring range for this position is $114,000 to $148,000 per year. This range is an estimate and the actual salary may vary based on the candidate's experience, skills, and qualifications. SHRM offers a competitive and comprehensive total rewards package. The benefits for this position include professional growth and development, health, dental, vision, well-being, health savings, flexible spending, retirement, open leave, and annual discretionary bonus and incentives.

Our employment practices are in accordance with the laws that prohibit discrimination against qualified individuals on the basis of race, religion, color, gender, age, national origin, physical or mental disability, genetic information, veteran’s status, marital status, gender identity and expression, sexual orientation, or any other status protected by applicable law.

SHRM is an equal opportunity employer (Minority/Female/Disabled/Veteran).

We do not sponsor applicants for work visas.

Apply Now","SHRM is a member-driven catalyst for creating better workplaces where people and businesses thrive together. As the trusted authority on all things work, SHRM is the foremost expert, researcher, advocate, and thought leader on issues and innovations impacting today’s evolving workplaces.  With nearly 340,000 members in 180 countries, SHRM touches the lives of more than 362 million workers and their families globally.

<strong>Summary

</strong>As a Senior Labor Economist at SHRM, you will play a critical role in conducting in-depth research and analysis on labor market trends, policies, and issues affecting our industry. Reporting to the Chief Economist, you will lead research projects, provide expert insights, and contribute to the organization's advocacy efforts with policymakers and stakeholders across Capitol Hill and the Executive Branch.

<strong> responsibilities: 

</strong><ul><li> Conduct quantitative and qualitative analysis of labor market data, including employment trends, wage dynamics, workforce demographics, and labor policy impacts. </li><li> Lead research projects to assess the economic implications of proposed policies and regulations on the industry and its workforce. </li><li> Develop economic models and forecasts to support decision-making and strategic planning within the organization. </li><li> Produce high-quality research reports, policy briefs, and presentations for internal and external audiences. </li><li> Collaborate with cross-functional teams to integrate economic analysis into advocacy campaigns, policy initiatives, and communications efforts. </li><li> Design new and creative methods for communicating economic trends with the media and key audiences turning to SHRM as the preeminent thought leader in all things work. </li><li> Serve as a subject matter expert on labor market issues, providing insights and recommendations to internal stakeholders and external partners. 

</li></ul><strong> Education & Experience Requirements 

</strong><ul><li> Master's or Ph.D. in Economics, Labor Economics, Business Economics, or a related field required. </li><li> 5-7 years of experience conducting labor market research and analysis, preferably in a policy-oriented setting. 

</li></ul><strong> Knowledge, Skills & Abilities 

</strong><ul><li> Strong quantitative skills, including proficiency in statistical analysis and econometric modeling. </li><li> Experience working with labor market data sources, such as BLS, Census Bureau, and proprietary datasets. </li><li> Excellent written and verbal communication skills, with the ability to distill complex economic concepts into clear and concise messages for diverse audiences. </li><li> Proven ability to manage multiple projects simultaneously and deliver high-quality work under tight deadlines. </li><li> Collaborative team player with a passion for using economic research to inform policy and advocacy efforts. 

</li></ul><strong> Additional Notes 

</strong><strong> Physical Requirements </strong> (adjust this section as necessary)

<ul><li> Must be able to perform essential duties satisfactorily with reasonable accommodations. </li><li> Work is generally done sitting, talking, hearing, and typing. Visual acuity to use a keyboard, prepare and analyze data and figures; transcribing, viewing a computer terminal; extensive reading. 

</li></ul><strong> Work environment </strong> (adjust this section as necessary)

<ul><li> Work is regularly performed in a combination of office and conference settings and routinely uses standard office equipment. </li><li> Expected travel is 0-10% of the time. 

</li></ul>The hiring range for this position is $114,000 to $148,000 per year. This range is an estimate and the actual salary may vary based on the candidate's experience, skills, and qualifications. SHRM offers a competitive and comprehensive total rewards package. The benefits for this position include professional growth and development, health, dental, vision, well-being, health savings, flexible spending, retirement, open leave, and annual discretionary bonus and incentives.

Our employment practices are in accordance with the laws that prohibit discrimination against qualified individuals on the basis of race, religion, color, gender, age, national origin, physical or mental disability, genetic information, veteran’s status, marital status, gender identity and expression, sexual orientation, or any other status protected by applicable law.

SHRM is an equal opportunity employer (Minority/Female/Disabled/Veteran).

We do not sponsor applicants for work visas.

Apply Now","SHRM","https://www.linkedin.com/jobs/view/3830533098/","Alexandria, Virginia, United States","Skills: Quantitative Analytics, Econometric Modeling, +8 more","201-500 employees · Human Resources Services
1 school alum works here","LISTED","33467942","SHRM","https://media.licdn.com/dms/image/D4E0BAQHXj8EKoyfXOg/company-logo_400_400/0/1704291976724/shrm_logo?e=1718236800&v=beta&t=80JzhP4W9xSbRwSjS7rmrD50gJacX_bFml2sQADPRlU","2024-02-14T21:35:02.000Z","2024-03-08T02:07:37.219Z"
"Sr Consultant - Economic Litigation ","If you seek a fast-paced, people-first firm with a collaborative culture, StoneTurn may be the right place for you. StoneTurn, a global professional services firm, works with law firms, corporations, and government agencies in solving the most complex and consequential business issues. StoneTurn has earned the trust of clients and regulators worldwide by deploying multidisciplinary teams of industry leaders to provide unique expertise with forensics and investigations, risk and compliance, data and technology, economic and dispute advisory, and strategic business consulting. Founded in 2004, StoneTurn operates from offices across five continents and is widely lauded for its commitment to collaboration, integrity, and independence. StoneTurn is seeking a qualified Senior Consultant to join our Economic Litigation Consulting Practice. Job Summary In this role you will be responsible for advanced economic analyses and managing portions of client engagements. You will add value to our team by having previous experience in economic consulting within the litigation environment. This position requires you to be a person with strong interpersonal, communication and technical skills.  ResponsibilitiesPerform economic and statistical analysis relating to expert reports in complex antitrust, class-action and commercial litigation matters.Organize, manipulate and analyze large and/or unstructured datasets utilizing statistical software.Develop and communicate work product, both orally and in writing to management and clients.Compile and analyze facts and circumstances to formulate, substantiate and critique various damages theories, claims or conclusions.Draft reports noting findings including, but not limited to the preparation of tables, exhibits and data visualizations.Understand and incorporate client needs and objectives into work plans and work product.Develop and maintain client relationships and relationships with firm executives.Supervise, mentor and develop Consultants and Interns.Required QualificationsBachelor’s degree in economics, statistics, or related quantitative field with demonstrated coursework in economics. Understands and can apply intermediate economic, statistical, and econometric concepts.A minimum of two (2) years of statistical programming experience utilizing Stata, preferably in a dispute consulting environment. The ability to work with large structured and unstructured datasets that are imported from a variety of formats. Excellent prioritization skills.Demonstrated record of working well in both team and independent atmospheresStrong written and verbal communication skills.Must be flexible with work schedule and requirements of client service projects.Supervisory experience a plus.Desirable qualificationsMaster’s degree in economics or statisticsFamiliarity with other statistical software: SAS, R, or similarSQL proficiency a plus.Familiarity with Tableau a plus. We offer competitive compensation and benefit packages. Applicants for employment in US must have work authorization that does not now or in the future require sponsorship by StoneTurn.StoneTurn provides equal employment opportunities (EEO) to all employees and applicants for employment without regard to race, color, religion, sex, national origin, age, disability, veteran status or genetics.  For additional information, go to www.stoneturn.com.","<p>If you seek a fast-paced, people-first firm with a collaborative culture, StoneTurn may be the right place for you.</p><p> </p><p>StoneTurn, a global professional services firm, works with law firms, corporations, and government agencies in solving the most complex and consequential business issues. StoneTurn has earned the trust of clients and regulators worldwide by deploying multidisciplinary teams of industry leaders to provide unique expertise with forensics and investigations, risk and compliance, data and technology, economic and dispute advisory, and strategic business consulting. Founded in 2004, StoneTurn operates from offices across five continents and is widely lauded for its commitment to collaboration, integrity, and independence.</p><p><strong> </strong></p><p><strong>StoneTurn is seeking a qualified Senior Consultant to join our Economic Litigation Consulting Practice.</strong></p><p> </p><p><strong>Job Summary</strong></p><p> </p><p>In this role you will be responsible for advanced economic analyses and managing portions of client engagements. You will add value to our team by having previous experience in economic consulting within the litigation environment. This position requires you to be a person with strong interpersonal, communication and technical skills. </p><p> </p><p><strong>Responsibilities</strong></p><ul><li>Perform economic and statistical analysis relating to expert reports in complex antitrust, class-action and commercial litigation matters.</li><li>Organize, manipulate and analyze large and/or unstructured datasets utilizing statistical software.</li><li>Develop and communicate work product, both orally and in writing to management and clients.</li><li>Compile and analyze facts and circumstances to formulate, substantiate and critique various damages theories, claims or conclusions.</li><li>Draft reports noting findings including, but not limited to the preparation of tables, exhibits and data visualizations.</li><li>Understand and incorporate client needs and objectives into work plans and work product.</li><li>Develop and maintain client relationships and relationships with firm executives.</li><li>Supervise, mentor and develop Consultants and Interns.</li></ul><p><strong>Required Qualifications</strong></p><ul><li>Bachelor’s degree in economics, statistics, or related quantitative field with demonstrated coursework in economics. </li><li>Understands and can apply intermediate economic, statistical, and econometric concepts.</li><li>A minimum of two (2) years of statistical programming experience utilizing Stata, preferably in a dispute consulting environment. </li><li>The ability to work with large structured and unstructured datasets that are imported from a variety of formats. </li><li>Excellent prioritization skills.</li><li>Demonstrated record of working well in both team and independent atmospheres</li><li>Strong written and verbal communication skills.</li><li>Must be flexible with work schedule and requirements of client service projects.</li><li>Supervisory experience a plus.</li></ul><p><strong>Desirable qualifications</strong></p><ul><li>Master’s degree in economics or statistics</li><li>Familiarity with other statistical software: SAS, R, or similar</li><li>SQL proficiency a plus.</li><li>Familiarity with Tableau a plus. </li></ul><p>We offer competitive compensation and benefit packages. </p><p>Applicants for employment in US must have work authorization that does not now or in the future require sponsorship by StoneTurn.</p><p>StoneTurn provides equal employment opportunities (EEO) to all employees and applicants for employment without regard to race, color, religion, sex, national origin, age, disability, veteran status or genetics. </p><p> </p><p>For additional information, go to <undefined>www.stoneturn.com</undefined>.</p>","StoneTurn","https://www.linkedin.com/jobs/view/3839318587/","Los Angeles, California, United States","6 of 10 skills match your profile - you may be a good fit","51-200 employees · Business Consulting and Services
3 school alumni work here","LISTED","2152220","StoneTurn","https://media.licdn.com/dms/image/C560BAQGUcDxkPkSfTQ/company-logo_400_400/0/1654722442983/stoneturn_group_llp_logo?e=1718236800&v=beta&t=eOLUMmUgbL7FW3mWRabJFQ0KjbV2PCrhKpzJMuiC8sA","2024-02-27T17:19:51.000Z","2024-03-08T02:07:37.219Z"
