"Title","Description","Description HTML","Primary Description","Detail URL","Location","Skill","Insight","Job State","Poster Id","Company Name","Company Logo","Created At","Scraped At"
"Junior Economic Researcher","SHRM is a member-driven catalyst for creating better workplaces where people and businesses thrive together. As the trusted authority on all things work, SHRM is the foremost expert, researcher, advocate, and thought leader on issues and innovations impacting today’s evolving workplaces.  With nearly 340,000 members in 180 countries, SHRM touches the lives of more than 362 million workers and their families globally.

Summary

As a Junior Economic Researcher at SHRM, you will have the opportunity to support our team of economists in conducting research, analyzing data, and producing insights that inform policy decisions and industry strategies. This role offers valuable hands-on experience in economic analysis and research within a dynamic and fast-paced environment.

 Responsibilities: 

 Assist senior economists in conducting research on a wide range of economic issues, including labor market trends, regulatory impacts, and industry dynamics.  Collect and analyze data from various sources, including government datasets, surveys, and academic literature.  Prepare charts, graphs, and other visualizations to illustrate key findings and trends.  Contribute to the development of research reports, whitepapers, and presentations for internal and external audiences.  Support ongoing projects and initiatives within the Economics team, including data maintenance, literature reviews, and administrative tasks.  Stay current on economic trends, policy developments, and industry news to inform research activities and discussions. 

 Education & Experience Requirements 

 Bachelor’s degree in economics, data sciences, statistics, or a related field required.  Previous research experience or coursework in economics is preferred but not required. 

 Knowledge, Skills & Abilities 

 Strong analytical skills and attention to detail, with the ability to manipulate and analyze large datasets.  Proficiency in statistical software (e.g., Stata, R, Python) and Microsoft Excel.  Excellent written and verbal communication skills, with the ability to effectively communicate complex ideas to diverse audiences.  Ability to work independently and collaboratively in a team environment, managing multiple tasks and deadlines.  Eagerness to learn and grow in a fast-paced, intellectually stimulating environment. 

Physical Requirements

 Must be able to perform essential duties satisfactorily with reasonable accommodations.  Work is generally done sitting, talking, hearing, and typing. Visual acuity to use a keyboard, prepare and analyze data and figures; transcribing, viewing a computer terminal; extensive reading. 

 Work environment 

 Work is regularly performed in a combination of office and conference settings and routinely uses standard office equipment.  Expected travel is 0-10% of the time. 

The hiring range for this position is $65,500 to $85,000 per year. This range is an estimate and the actual salary may vary based on the candidate's experience, skills, and qualifications. SHRM offers a competitive and comprehensive total rewards package. The benefits for this position include professional growth and development, health, dental, vision, well-being, health savings, flexible spending, retirement, open leave, and annual discretionary bonus and incentives.

Our employment practices are in accordance with the laws that prohibit discrimination against qualified individuals on the basis of race, religion, color, gender, age, national origin, physical or mental disability, genetic information, veteran’s status, marital status, gender identity and expression, sexual orientation, or any other status protected by applicable law.

SHRM is an equal opportunity employer (Minority/Female/Disabled/Veteran).

We do not sponsor applicants for work visas.

Apply Now","SHRM is a member-driven catalyst for creating better workplaces where people and businesses thrive together. As the trusted authority on all things work, SHRM is the foremost expert, researcher, advocate, and thought leader on issues and innovations impacting today’s evolving workplaces.  With nearly 340,000 members in 180 countries, SHRM touches the lives of more than 362 million workers and their families globally.

<strong>Summary

</strong>As a Junior Economic Researcher at SHRM, you will have the opportunity to support our team of economists in conducting research, analyzing data, and producing insights that inform policy decisions and industry strategies. This role offers valuable hands-on experience in economic analysis and research within a dynamic and fast-paced environment.

<strong> Responsibilities: 

</strong><ul><li> Assist senior economists in conducting research on a wide range of economic issues, including labor market trends, regulatory impacts, and industry dynamics. </li><li> Collect and analyze data from various sources, including government datasets, surveys, and academic literature. </li><li> Prepare charts, graphs, and other visualizations to illustrate key findings and trends. </li><li> Contribute to the development of research reports, whitepapers, and presentations for internal and external audiences. </li><li> Support ongoing projects and initiatives within the Economics team, including data maintenance, literature reviews, and administrative tasks. </li><li> Stay current on economic trends, policy developments, and industry news to inform research activities and discussions. 

</li></ul><strong> Education & Experience Requirements 

</strong><ul><li> Bachelor’s degree in economics, data sciences, statistics, or a related field required. </li><li> Previous research experience or coursework in economics is preferred but not required. 

</li></ul><strong> Knowledge, Skills & Abilities 

</strong><ul><li> Strong analytical skills and attention to detail, with the ability to manipulate and analyze large datasets. </li><li> Proficiency in statistical software (e.g., Stata, R, Python) and Microsoft Excel. </li><li> Excellent written and verbal communication skills, with the ability to effectively communicate complex ideas to diverse audiences. </li><li> Ability to work independently and collaboratively in a team environment, managing multiple tasks and deadlines. </li><li> Eagerness to learn and grow in a fast-paced, intellectually stimulating environment. 

</li></ul><strong>Physical Requirements

</strong><ul><li> Must be able to perform essential duties satisfactorily with reasonable accommodations. </li><li> Work is generally done sitting, talking, hearing, and typing. Visual acuity to use a keyboard, prepare and analyze data and figures; transcribing, viewing a computer terminal; extensive reading. 

</li></ul><strong> Work environment 

</strong><ul><li> Work is regularly performed in a combination of office and conference settings and routinely uses standard office equipment. </li><li> Expected travel is 0-10% of the time. 

</li></ul>The hiring range for this position is $65,500 to $85,000 per year. This range is an estimate and the actual salary may vary based on the candidate's experience, skills, and qualifications. SHRM offers a competitive and comprehensive total rewards package. The benefits for this position include professional growth and development, health, dental, vision, well-being, health savings, flexible spending, retirement, open leave, and annual discretionary bonus and incentives.

Our employment practices are in accordance with the laws that prohibit discrimination against qualified individuals on the basis of race, religion, color, gender, age, national origin, physical or mental disability, genetic information, veteran’s status, marital status, gender identity and expression, sexual orientation, or any other status protected by applicable law.

SHRM is an equal opportunity employer (Minority/Female/Disabled/Veteran).

We do not sponsor applicants for work visas.

Apply Now","SHRM","https://www.linkedin.com/jobs/view/3830527907/","Alexandria, Virginia, United States","Skills: Data Analysis, Statistics, +8 more","201-500 employees · Human Resources Services
1 school alum works here","LISTED","33467942","SHRM","https://media.licdn.com/dms/image/D4E0BAQHXj8EKoyfXOg/company-logo_400_400/0/1704291976724/shrm_logo?e=1718236800&v=beta&t=80JzhP4W9xSbRwSjS7rmrD50gJacX_bFml2sQADPRlU","2024-02-14T21:35:01.000Z","2024-03-08T02:07:37.219Z"
"Senior Economist-Health Preference Assessment (Remotely based anywhere in the US))","Overview

RTI International is an independent nonprofit research institute dedicated to conducting innovative, multidisciplinary research that improves the human condition with a worldwide staff of nearly 6,000. Universities in North Carolina founded RTI in 1958 as the first scientific organization in and centerpiece of the Research Triangle Park, NC, USA.

RTI Health Solutions (RTI-HS), a business unit of RTI International, is an independent and internationally recognized research organization. We provide scientifically rigorous research and consulting services to pharmaceutical, biotechnology, medical device and diagnostics companies. Our research and consulting services focus on gathering evidence, analyzing results, increasing understanding, and providing greater clarity to help reveal the benefits, risks, value, and potential of our client’s products. Our various practice areas include: Market Access and Outcomes Strategy, Patient-Centered Outcomes Assessment, Health Economics, Pharmacoepidemiology, Biostatistics, Surveys and Observational Studies, and Health Preference Assessment.

Our Health Preference Assessment (HPA) program is currently seeking to add a Senior Research Economist to an already dynamic team.

HPA has a reputation for conducting high-quality preference research in a collegial working environment. The HPA Group specializes in developing surveys to elicit and quantify preferences of patients, physicians, and other health-care stakeholders for features and outcomes of medical and pharmaceutical interventions using rigorous stated-preference methods. The studies apply discrete-choice experiments, threshold technique, best-worst scaling, contingent-valuation, and other preference methods. HPA staff members are internationally recognized thought leaders in this research area and their work is published in high-level clinical and health-economic journals.

At RTI Health Solutions, you will be provided the opportunity to conduct meaningful work in a collaborative, cross functional environment. We are focused on your career development and provide a generous benefits packages that includes tuition reimbursement, parental leave, paid time off, medical/dental, and 401K.

Responsibilities

Lead and manage projects and project tasks as part of a project team.Study and survey design and development, development of protocols and statistical analysis plans, analysis of discrete-choice and other stated-preference data, interpretation of results, and preparation of technical reports and manuscriptsLead and contribute to the health preference assessment scientific literature and mentoring team members in developing scientific statureWrite proposalsManage project budgets and timelines, project teams, and communicate with study sponsors during all phases of a project, including presentations to study sponsors and at industry and academic conferences

Qualifications

A PhD in a quantitative social-science field such as economics, health economics, health policy, patient-reported outcomes, operations research, or statistics with at least 5 years of related professional experience, or;A Master’s level degree in one of these fields with at least at least 10 years or related professional experienceProficiency in the design and analysis of discrete-choice experiment surveys and other stated-preference methods.Experience leading projects with commercial clients or large academic teams.Exceptional oral and written communication skillsExperience in leading survey-research projectsDemonstrated experience performing quantitative research.Experience with a variety of preference methods.

EEO & Pay Equity Statements

As a global employer of choice, RTI is committed to equity, diversity, inclusion and belonging in the workplace and the communities and markets where we serve our mission. We value diversity of thought, culture, background and perspective and welcome applicants without regard to race, color, religion, sex, age, marital status, sexual orientation, gender identity, national origin, creed, citizenship status, disability, protected veteran status, or any other classification protected by applicable discrimination laws or RTI policy.

We are proud to be an equal opportunity employer. All qualified applicants will receive consideration for employment without regard to race, color, religion, sex, sexual orientation, gender identity, national origin, disability status, protected veteran status, or any other characteristic protected by law. Further information is available here.

RTI International is an independent, nonprofit research institute dedicated to improving the human condition. Clients rely on us to answer questions that demand an objective and multidisciplinary approach and one that integrates expertise across the social and laboratory sciences, engineering, and international development. We believe in the promise of science, and we are inspired every day to deliver on that promise for the good of people, communities, and businesses around the world. For more information, visit www.rti.org.

For USA Job Postings Only: RTI participates in the US Government E-Verify program. Further information regarding the E-Verify program and laws that are designed to protect you against discrimination relating to your legal right to work in the US can be found here.

For San Francisco, CA USA Job Postings Only: Pursuant to the San Francisco Fair Chance Ordinance, we will consider for employment qualified applicants with arrest and conviction records. Further information is available here.

The anticipated pay range for this role is listed below. Our pay ranges represent national averages and may vary by location as a geographic differential may be applied to some locations within the United States.

RTI considers multiple factors when making an offer including, for example: established salary range, internal budget, business needs, and education and years of work experience possessed by the applicant. Further, salary is merely one element to our offer.

At RTI, we demonstrate our commitment to rewarding individual and team achievement through a total rewards package. This package includes (among other things) a competitive base salary, a generous paid time off policy, merit based annual increases, bonus opportunities and a robust recognition program. Other benefits include a competitive range of insurance plans (including health, dental, life, and short-term and long-term disability), access to a retirement savings program such as a 401(k) plan, paid parental leave for all parents, financial assistance with adoption expenses or infertility treatments, financial reimbursement for education and developmental opportunities, an employee assistance program, and numerous other offerings to support a healthy work-life balance.

Equal Pay Act Minimum/Range

$135,000-$185,000

","<strong>Overview

</strong>RTI International is an independent nonprofit research institute dedicated to conducting innovative, multidisciplinary research that improves the human condition with a worldwide staff of nearly 6,000. Universities in North Carolina founded RTI in 1958 as the first scientific organization in and centerpiece of the Research Triangle Park, NC, USA.

RTI Health Solutions (RTI-HS), a business unit of RTI International, is an independent and internationally recognized research organization. We provide scientifically rigorous research and consulting services to pharmaceutical, biotechnology, medical device and diagnostics companies. Our research and consulting services focus on gathering evidence, analyzing results, increasing understanding, and providing greater clarity to help reveal the benefits, risks, value, and potential of our client’s products. Our various practice areas include: Market Access and Outcomes Strategy, Patient-Centered Outcomes Assessment, Health Economics, Pharmacoepidemiology, Biostatistics, Surveys and Observational Studies, and Health Preference Assessment.

Our Health Preference Assessment (HPA) program is currently seeking to add a Senior Research Economist to an already dynamic team.

HPA has a reputation for conducting high-quality preference research in a collegial working environment. The HPA Group specializes in developing surveys to elicit and quantify preferences of patients, physicians, and other health-care stakeholders for features and outcomes of medical and pharmaceutical interventions using rigorous stated-preference methods. The studies apply discrete-choice experiments, threshold technique, best-worst scaling, contingent-valuation, and other preference methods. HPA staff members are internationally recognized thought leaders in this research area and their work is published in high-level clinical and health-economic journals.

At RTI Health Solutions, you will be provided the opportunity to conduct meaningful work in a collaborative, cross functional environment. We are focused on your career development and provide a generous benefits packages that includes tuition reimbursement, parental leave, paid time off, medical/dental, and 401K.

<strong>Responsibilities

</strong><ul><li>Lead and manage projects and project tasks as part of a project team.</li><li>Study and survey design and development, development of protocols and statistical analysis plans, analysis of discrete-choice and other stated-preference data, interpretation of results, and preparation of technical reports and manuscripts</li><li>Lead and contribute to the health preference assessment scientific literature and mentoring team members in developing scientific stature</li><li>Write proposals</li><li>Manage project budgets and timelines, project teams, and communicate with study sponsors during all phases of a project, including presentations to study sponsors and at industry and academic conferences

</li></ul><strong>Qualifications

</strong><ul><li>A PhD in a quantitative social-science field such as economics, health economics, health policy, patient-reported outcomes, operations research, or statistics with at least 5 years of related professional experience, or;</li><li>A Master’s level degree in one of these fields with at least at least 10 years or related professional experience</li><li>Proficiency in the design and analysis of discrete-choice experiment surveys and other stated-preference methods.</li><li>Experience leading projects with commercial clients or large academic teams.</li><li>Exceptional oral and written communication skills</li><li>Experience in leading survey-research projects</li><li>Demonstrated experience performing quantitative research.</li><li>Experience with a variety of preference methods.

</li></ul>EEO & Pay Equity Statements

As a global employer of choice, RTI is committed to equity, diversity, inclusion and belonging in the workplace and the communities and markets where we serve our mission. We value diversity of thought, culture, background and perspective and welcome applicants without regard to race, color, religion, sex, age, marital status, sexual orientation, gender identity, national origin, creed, citizenship status, disability, protected veteran status, or any other classification protected by applicable discrimination laws or RTI policy.

We are proud to be an equal opportunity employer. All qualified applicants will receive consideration for employment without regard to race, color, religion, sex, sexual orientation, gender identity, national origin, disability status, protected veteran status, or any other characteristic protected by law. Further information is available here.

RTI International is an independent, nonprofit research institute dedicated to improving the human condition. Clients rely on us to answer questions that demand an objective and multidisciplinary approach and one that integrates expertise across the social and laboratory sciences, engineering, and international development. We believe in the promise of science, and we are inspired every day to deliver on that promise for the good of people, communities, and businesses around the world. For more information, visit www.rti.org.

For USA Job Postings Only: RTI participates in the US Government E-Verify program. Further information regarding the E-Verify program and laws that are designed to protect you against discrimination relating to your legal right to work in the US can be found here.

For San Francisco, CA USA Job Postings Only: Pursuant to the San Francisco Fair Chance Ordinance, we will consider for employment qualified applicants with arrest and conviction records. Further information is available here.

The anticipated pay range for this role is listed below. Our pay ranges represent national averages and may vary by location as a geographic differential may be applied to some locations within the United States.

RTI considers multiple factors when making an offer including, for example: established salary range, internal budget, business needs, and education and years of work experience possessed by the applicant. Further, salary is merely one element to our offer.

At RTI, we demonstrate our commitment to rewarding individual and team achievement through a total rewards package. This package includes (among other things) a competitive base salary, a generous paid time off policy, merit based annual increases, bonus opportunities and a robust recognition program. Other benefits include a competitive range of insurance plans (including health, dental, life, and short-term and long-term disability), access to a retirement savings program such as a 401(k) plan, paid parental leave for all parents, financial assistance with adoption expenses or infertility treatments, financial reimbursement for education and developmental opportunities, an employee assistance program, and numerous other offerings to support a healthy work-life balance.

Equal Pay Act Minimum/Range

$135,000-$185,000

","RTI International","https://www.linkedin.com/jobs/view/3806482882/","Durham, North Carolina, United States","Skills: Research Projects, Quantitative Research, +8 more","5,001-10,000 employees · Research Services
21 school alumni work here","LISTED","4908024","RTI International","https://media.licdn.com/dms/image/D560BAQHCp0VixIs1nw/company-logo_400_400/0/1688390906753/rti_international_logo?e=1718236800&v=beta&t=LXrMFVNteTasy3rDUx0yoFNhHL-ekUCCB6nwewt9z_Y","2024-01-19T21:15:56.000Z","2024-03-08T02:07:37.219Z"
