"Title","Description","Description HTML","Primary Description","Detail URL","Location","Skill","Insight","Job State","Poster Id","Company Name","Company Logo","Created At","Scraped At"
"Principal Economist, Last Mile Delivery Tech","Description

We are looking for a Principal Economist to join the World Wide Last Mile Team. This leader will be an industrial organization economist who makes convincing, data-driven decisions. They will develop innovative pricing strategies for our Delivery Service Partners. They will be a pragmatic visionary who can identify opportunities and lead the team to translate them into workable, scalable product and process solutions.

The ideal candidate will generate ideas and solve problems independently, and possess the ability to use economics to inform business decisions.

About The Team

At Amazon, we're working to be the most Customer-centric company on earth. One customer experience that we’re constantly looking to take to a new level is how we fulfill and deliver their orders. Our goal is to exceed the expectations of all our customers by ensuring that their orders, no matter how large or small are delivered where and when they need them, as quickly, accurately, and cost effectively as possible.

To meet this goal, Amazon is continually striving to innovate and provide best in class service levels through the introduction of pioneering new products and services in the last mile delivery space. We are doing this by building a world class last mile operation, significantly complimented by Amazon Delivery Service Partner Program (DSP). Amazon DSP connects aspiring entrepreneurs with opportunities, resources, and coaching to help them build and scale their own logistics businesses.

We are open to hiring candidates to work out of one of the following locations:

Bellevue, WA, USA

Basic Qualifications

 PhD in Economics or related field Experience in the field of Industrial Organization 10+ years related research experience

Preferred Qualifications

 Strong research track record, drives results Thinks strategically, but stays on top of tactical execution Effective verbal and written communications skills Exhibits business judgment Has relentlessly high standards

Amazon is committed to a diverse and inclusive workplace. Amazon is an equal opportunity employer and does not discriminate on the basis of race, national origin, gender, gender identity, sexual orientation, protected veteran status, disability, age, or other legally protected status. For individuals with disabilities who would like to request an accommodation, please visit https://www.amazon.jobs/en/disability/us.

Our compensation reflects the cost of labor across several US geographic markets. The base pay for this position ranges from $151,500/year in our lowest geographic market up to $294,700/year in our highest geographic market. Pay is based on a number of factors including market location and may vary depending on job-related knowledge, skills, and experience. Amazon is a total compensation company. Dependent on the position offered, equity, sign-on payments, and other forms of compensation may be provided as part of a total compensation package, in addition to a full range of medical, financial, and/or other benefits. For more information, please visit https://www.aboutamazon.com/workplace/employee-benefits. Applicants should apply via our internal or external career site.


Company - Amazon.com Services LLC

Job ID: A2458631","<strong>Description

</strong>We are looking for a Principal Economist to join the World Wide Last Mile Team. This leader will be an industrial organization economist who makes convincing, data-driven decisions. They will develop innovative pricing strategies for our Delivery Service Partners. They will be a pragmatic visionary who can identify opportunities and lead the team to translate them into workable, scalable product and process solutions.

The ideal candidate will generate ideas and solve problems independently, and possess the ability to use economics to inform business decisions.

<strong>About The Team

</strong>At Amazon, we're working to be the most Customer-centric company on earth. One customer experience that we’re constantly looking to take to a new level is how we fulfill and deliver their orders. Our goal is to exceed the expectations of all our customers by ensuring that their orders, no matter how large or small are delivered where and when they need them, as quickly, accurately, and cost effectively as possible.

To meet this goal, Amazon is continually striving to innovate and provide best in class service levels through the introduction of pioneering new products and services in the last mile delivery space. We are doing this by building a world class last mile operation, significantly complimented by Amazon Delivery Service Partner Program (DSP). Amazon DSP connects aspiring entrepreneurs with opportunities, resources, and coaching to help them build and scale their own logistics businesses.

We are open to hiring candidates to work out of one of the following locations:

Bellevue, WA, USA

<strong>Basic Qualifications

</strong><ul><li> PhD in Economics or related field</li><li> Experience in the field of Industrial Organization</li><li> 10+ years related research experience

</li></ul><strong>Preferred Qualifications

</strong><ul><li> Strong research track record, drives results</li><li> Thinks strategically, but stays on top of tactical execution</li><li> Effective verbal and written communications skills</li><li> Exhibits business judgment</li><li> Has relentlessly high standards

</li></ul>Amazon is committed to a diverse and inclusive workplace. Amazon is an equal opportunity employer and does not discriminate on the basis of race, national origin, gender, gender identity, sexual orientation, protected veteran status, disability, age, or other legally protected status. For individuals with disabilities who would like to request an accommodation, please visit https://www.amazon.jobs/en/disability/us.

Our compensation reflects the cost of labor across several US geographic markets. The base pay for this position ranges from $151,500/year in our lowest geographic market up to $294,700/year in our highest geographic market. Pay is based on a number of factors including market location and may vary depending on job-related knowledge, skills, and experience. Amazon is a total compensation company. Dependent on the position offered, equity, sign-on payments, and other forms of compensation may be provided as part of a total compensation package, in addition to a full range of medical, financial, and/or other benefits. For more information, please visit https://www.aboutamazon.com/workplace/employee-benefits. Applicants should apply via our internal or external career site.


<strong>Company</strong> - Amazon.com Services LLC

Job ID: A2458631","Amazon","https://www.linkedin.com/jobs/view/3727248902/","Bellevue, Washington, United States","Skills: Strategic Thinking, Statistics, +8 more","10,001+ employees · Software Development
14 connections work here · 451 school alumni work here","LISTED","7745488","Amazon","https://media.licdn.com/dms/image/C560BAQHTvZwCx4p2Qg/company-logo_400_400/0/1630640869849/amazon_logo?e=1718236800&v=beta&t=HXNEpnXRTma-jD9P36Cg3sBudEOp81b0_9mEZhVucJo","2023-10-02T22:34:22.000Z","2024-03-08T02:07:37.219Z"
"Senior Manager, Economist, People Experience and Technology Central Science","Description

The Central Science Team within Amazon’s People Experience and Technology org (PXTCS) uses economics, behavioral science, statistics, and machine learning to proactively identify mechanisms and process improvements which simultaneously improve Amazon and the lives, well-being, and the value of work to Amazonians. We are an interdisciplinary team, which combines the talents of science and engineering to develop and deliver solutions that measurably achieve this goal.

We are looking for a Senior Economics Manager who is able to provide structure around complex business problems, hone those complex problems into specific, scientific questions, and test those questions to generate insights. The ideal candidate will work with various science, engineering, operations, and analytics teams to estimate models and algorithms on large scale data, design pilots and measure their impact, and transform successful prototypes into improved policies and programs at scale. They will lead teams of researchers to produce robust, objective research results and insights which can be communicated to a broad audience inside and outside of Amazon.

Ideal candidates will work closely with business partners to develop science that solves the most important business challenges. They will work well in a team setting with individuals from diverse disciplines and backgrounds. They will serve as an ambassador for science and a scientific resource for business teams, so that scientific processes permeate throughout the HR organization to the benefit of Amazonians and Amazon. Ideal candidates will own the development of scientific models and manage the data analysis, modeling, and experimentation that is necessary for estimating and validating models. They will be customer-centric – clearly communicating scientific approaches and findings to business leaders, listening to and incorporate their feedback, and delivering successful scientific solutions.

We are open to hiring candidates to work out of one of the following locations:

Arlington, VA, USA | Seattle, WA, USA

Basic Qualifications

 PhD in economics, statistics, quantitative marketing, or related field. 10+ years of professional experience working with large data sets, understanding of statistical analysis, modeling techniques, data mining and business and/or public policy analysis.

Preferred Qualifications

 Proven track record in research and solution of business problems, leveraging techniques from economics or related disciplines. Demonstrable experience in any of the following areas of applied economics (multiple areas preferred): reduced-form causal analysis, predictive modeling and causal ML algorithms, forecasting, hazard models, health and insurance economics, education economics, labor economics, and behavioral economics, designing and administering large-scale social science surveys. Demonstrated ability to lead a team of economists and data scientists to deliver high quality research results on time. Demonstrated ability to communicate research to clients in business and/or public policy. Strong publication and presentation record in top-tier economic, public policy, statistical, or ML publications and conferences. Excellent written and oral communication skills with technical, business, and public policy people, and ability to speak at a level appropriate for the audience.

Amazon is committed to a diverse and inclusive workplace. Amazon is an equal opportunity employer and does not discriminate on the basis of race, national origin, gender, gender identity, sexual orientation, protected veteran status, disability, age, or other legally protected status. For individuals with disabilities who would like to request an accommodation, please visit https://www.amazon.jobs/en/disability/us.

Our compensation reflects the cost of labor across several US geographic markets. The base pay for this position ranges from $166,700/year in our lowest geographic market up to $324,100/year in our highest geographic market. Pay is based on a number of factors including market location and may vary depending on job-related knowledge, skills, and experience. Amazon is a total compensation company. Dependent on the position offered, equity, sign-on payments, and other forms of compensation may be provided as part of a total compensation package, in addition to a full range of medical, financial, and/or other benefits. For more information, please visit https://www.aboutamazon.com/workplace/employee-benefits. Applicants should apply via our internal or external career site.


Company - Amazon.com Services LLC

Job ID: A2446986","<strong>Description

</strong>The Central Science Team within Amazon’s People Experience and Technology org (PXTCS) uses economics, behavioral science, statistics, and machine learning to proactively identify mechanisms and process improvements which simultaneously improve Amazon and the lives, well-being, and the value of work to Amazonians. We are an interdisciplinary team, which combines the talents of science and engineering to develop and deliver solutions that measurably achieve this goal.

We are looking for a Senior Economics Manager who is able to provide structure around complex business problems, hone those complex problems into specific, scientific questions, and test those questions to generate insights. The ideal candidate will work with various science, engineering, operations, and analytics teams to estimate models and algorithms on large scale data, design pilots and measure their impact, and transform successful prototypes into improved policies and programs at scale. They will lead teams of researchers to produce robust, objective research results and insights which can be communicated to a broad audience inside and outside of Amazon.

Ideal candidates will work closely with business partners to develop science that solves the most important business challenges. They will work well in a team setting with individuals from diverse disciplines and backgrounds. They will serve as an ambassador for science and a scientific resource for business teams, so that scientific processes permeate throughout the HR organization to the benefit of Amazonians and Amazon. Ideal candidates will own the development of scientific models and manage the data analysis, modeling, and experimentation that is necessary for estimating and validating models. They will be customer-centric – clearly communicating scientific approaches and findings to business leaders, listening to and incorporate their feedback, and delivering successful scientific solutions.

We are open to hiring candidates to work out of one of the following locations:

Arlington, VA, USA | Seattle, WA, USA

<strong>Basic Qualifications

</strong><ul><li> PhD in economics, statistics, quantitative marketing, or related field.</li><li> 10+ years of professional experience working with large data sets, understanding of statistical analysis, modeling techniques, data mining and business and/or public policy analysis.

</li></ul><strong>Preferred Qualifications

</strong><ul><li> Proven track record in research and solution of business problems, leveraging techniques from economics or related disciplines.</li><li> Demonstrable experience in any of the following areas of applied economics (multiple areas preferred): reduced-form causal analysis, predictive modeling and causal ML algorithms, forecasting, hazard models, health and insurance economics, education economics, labor economics, and behavioral economics, designing and administering large-scale social science surveys.</li><li> Demonstrated ability to lead a team of economists and data scientists to deliver high quality research results on time.</li><li> Demonstrated ability to communicate research to clients in business and/or public policy.</li><li> Strong publication and presentation record in top-tier economic, public policy, statistical, or ML publications and conferences.</li><li> Excellent written and oral communication skills with technical, business, and public policy people, and ability to speak at a level appropriate for the audience.

</li></ul>Amazon is committed to a diverse and inclusive workplace. Amazon is an equal opportunity employer and does not discriminate on the basis of race, national origin, gender, gender identity, sexual orientation, protected veteran status, disability, age, or other legally protected status. For individuals with disabilities who would like to request an accommodation, please visit https://www.amazon.jobs/en/disability/us.

Our compensation reflects the cost of labor across several US geographic markets. The base pay for this position ranges from $166,700/year in our lowest geographic market up to $324,100/year in our highest geographic market. Pay is based on a number of factors including market location and may vary depending on job-related knowledge, skills, and experience. Amazon is a total compensation company. Dependent on the position offered, equity, sign-on payments, and other forms of compensation may be provided as part of a total compensation package, in addition to a full range of medical, financial, and/or other benefits. For more information, please visit https://www.aboutamazon.com/workplace/employee-benefits. Applicants should apply via our internal or external career site.


<strong>Company</strong> - Amazon.com Services LLC

Job ID: A2446986","Amazon","https://www.linkedin.com/jobs/view/3714382800/","Seattle, Washington, United States","Skills: Pattern Recognition, Policy Analysis, +8 more","10,001+ employees · Software Development
14 connections work here · 451 school alumni work here","LISTED","7745488","Amazon","https://media.licdn.com/dms/image/C560BAQHTvZwCx4p2Qg/company-logo_400_400/0/1630640869849/amazon_logo?e=1718236800&v=beta&t=HXNEpnXRTma-jD9P36Cg3sBudEOp81b0_9mEZhVucJo","2023-09-15T22:33:45.000Z","2024-03-08T02:07:37.219Z"
"Senior Economist","Description

Amazon.com strives to be Earth's most customer-centric company where customers can shop in our stores to find and discover anything they want to buy. We hire the world's brightest minds, offering them a fast paced, technologically sophisticated and friendly work environment.

Economists at Amazon partner closely with senior management, business stakeholders, scientist and engineers, and economist leadership to solve key business problems ranging from Amazon Web Services, Kindle, Prime, inventory planning, international retail, third party merchants, search, pricing, labor and employment planning, effective benefits (health, retirement, etc.) and beyond. Amazon Economists build econometric models using our world class data systems and apply approaches from a variety of skillsets – applied macro/time series, applied micro, econometric theory, empirical IO, empirical health, labor, public economics and related fields are all highly valued skillsets at Amazon. You will work in a fast moving environment to solve business problems as a member of either a cross-functional team embedded within a business unit or a central science and economics organization. You will be expected to develop techniques that apply econometrics to large data sets, address quantitative problems, and contribute to the design of automated systems around the company.

We are open to hiring candidates to work out of one of the following locations:

Seattle, WA, USA

Basic Qualifications

 PhD in economics or equivalent

Preferred Qualifications

 Advanced expertise and knowledge of applying observational causal interference methods Strong background in statistics methodology, applications to business problems, and/or big data. Ability to work in a fast-paced business environment. Strong research track record. Effective verbal and written communications skills with both economists and non-economist audiences.

Amazon is committed to a diverse and inclusive workplace. Amazon is an equal opportunity employer and does not discriminate on the basis of race, national origin, gender, gender identity, sexual orientation, protected veteran status, disability, age, or other legally protected status. For individuals with disabilities who would like to request an accommodation, please visit https://www.amazon.jobs/en/disability/us.

Our compensation reflects the cost of labor across several US geographic markets. The base pay for this position ranges from $127,300/year in our lowest geographic market up to $247,600/year in our highest geographic market. Pay is based on a number of factors including market location and may vary depending on job-related knowledge, skills, and experience. Amazon is a total compensation company. Dependent on the position offered, equity, sign-on payments, and other forms of compensation may be provided as part of a total compensation package, in addition to a full range of medical, financial, and/or other benefits. For more information, please visit https://www.aboutamazon.com/workplace/employee-benefits. Applicants should apply via our internal or external career site.


Company - Amazon.com Services LLC

Job ID: A2349802","<strong>Description

</strong>Amazon.com strives to be Earth's most customer-centric company where customers can shop in our stores to find and discover anything they want to buy. We hire the world's brightest minds, offering them a fast paced, technologically sophisticated and friendly work environment.

Economists at Amazon partner closely with senior management, business stakeholders, scientist and engineers, and economist leadership to solve key business problems ranging from Amazon Web Services, Kindle, Prime, inventory planning, international retail, third party merchants, search, pricing, labor and employment planning, effective benefits (health, retirement, etc.) and beyond. Amazon Economists build econometric models using our world class data systems and apply approaches from a variety of skillsets – applied macro/time series, applied micro, econometric theory, empirical IO, empirical health, labor, public economics and related fields are all highly valued skillsets at Amazon. You will work in a fast moving environment to solve business problems as a member of either a cross-functional team embedded within a business unit or a central science and economics organization. You will be expected to develop techniques that apply econometrics to large data sets, address quantitative problems, and contribute to the design of automated systems around the company.

We are open to hiring candidates to work out of one of the following locations:

Seattle, WA, USA

<strong>Basic Qualifications

</strong><ul><li> PhD in economics or equivalent

</li></ul><strong>Preferred Qualifications

</strong><ul><li> Advanced expertise and knowledge of applying observational causal interference methods</li><li> Strong background in statistics methodology, applications to business problems, and/or big data.</li><li> Ability to work in a fast-paced business environment.</li><li> Strong research track record.</li><li> Effective verbal and written communications skills with both economists and non-economist audiences.

</li></ul>Amazon is committed to a diverse and inclusive workplace. Amazon is an equal opportunity employer and does not discriminate on the basis of race, national origin, gender, gender identity, sexual orientation, protected veteran status, disability, age, or other legally protected status. For individuals with disabilities who would like to request an accommodation, please visit https://www.amazon.jobs/en/disability/us.

Our compensation reflects the cost of labor across several US geographic markets. The base pay for this position ranges from $127,300/year in our lowest geographic market up to $247,600/year in our highest geographic market. Pay is based on a number of factors including market location and may vary depending on job-related knowledge, skills, and experience. Amazon is a total compensation company. Dependent on the position offered, equity, sign-on payments, and other forms of compensation may be provided as part of a total compensation package, in addition to a full range of medical, financial, and/or other benefits. For more information, please visit https://www.aboutamazon.com/workplace/employee-benefits. Applicants should apply via our internal or external career site.


<strong>Company</strong> - Amazon.com Services LLC

Job ID: A2349802","Amazon","https://www.linkedin.com/jobs/view/3693067877/","Seattle, Washington, United States","Skills: Statistics, Analytics, +8 more","10,001+ employees · Software Development
14 connections work here · 451 school alumni work here","LISTED","7745488","Amazon","https://media.licdn.com/dms/image/C560BAQHTvZwCx4p2Qg/company-logo_400_400/0/1630640869849/amazon_logo?e=1718236800&v=beta&t=HXNEpnXRTma-jD9P36Cg3sBudEOp81b0_9mEZhVucJo","2023-08-22T22:49:49.000Z","2024-03-08T02:07:37.219Z"
