"Title","Description","Description HTML","Primary Description","Detail URL","Location","Skill","Insight","Job State","Poster Id","Company Name","Company Logo","Created At","Scraped At"
"Quantitative Team Manager","Job DescriptionPOSITION SUMMARY:Quantitative Team Manager works closely with members of the Psychometrics and Quantitative Research team (PQR) to support and lead a broad range of complex, high-stakes large-scale research activities related to Psychometric and quantitative research projects in language testing and applied linguistics projects. The Quantitative Team Manager supervisees the Quantitative analysts on the PQR team who work with researchers and Psychometricians in analyzing data and generating reports for WIDA ACCESS, a large scale, high stakes K-12 assessment of English language proficiency. ESSENTIAL DUTIESManage and lead project teams in the preparation of data for analysis and reporting, including acting as the liaison with the client on data delivery, preparing data file layouts, collecting, entering, scoring, transforming, receiving, validating, cleaning, merging, restructuring of data while taking appropriate steps to ensure quality.Supervise PQR analysts.Manage and maintain team calendar and internal project timelines for the PQR team.Organize and manage the weekly PQR meeting and CAL-WIDA Psychometric meeting.Serve as PQR data specialist. Duties include serving as primary data point of contact with clients, managing master datasets and/or databases ensuring master datasets are created, saved and stored appropriately, and identifying, drafting, and updating procedures for producing and analyzing datasets.Lead the technical work as relates to the WIDA ACCESS Annual Technical Reports. Duties include orienting team members to processes and procedures for producing tables, managing staff assignments, documenting ATR QC, and supporting senior PQR staff as the client liaison.With the support of the Senior Director of Psychometrics and Quantitative Research, draft and revise quantitative analysis procedures.Conduct data analysis using statistical software such as SPSS, R and Winsteps.QualificationsEDUCATION AND EXPERIENCERequiredMaster’s degree from an accredited college or university, in Educational or Psychological Research, Applied Linguistics, Language Assessment, Educational or Psychological Assessment, or a related field, with at least six (6) years of relevant experience as technical lead or/and team management.Experience with advanced data processing and statistical analyses, research methodologies, and high-stakes large-scale assessments.Minimum of five years of extensive experience in programming using statistical software such as SPSS, R, Winsteps, Stata, and SAS.Experience working with MS Excel, in a professional position or extended research project.Extensive experience working with large quantitative data sets.Extensive experience with following quality control procedures and documenting workflow.Experience with educational assessment, especially language assessment and/or online adaptive assessment.Demonstrated experience supervising junior level staff/data analysts.Demonstrated experience in managing project tasks and timelines.KNOWLEDGE, SKILLS & ABILITIESProficient in programming using SPSS, R and IRT software such as Winsteps.Expertise in using advanced features of MS Excel.Expertise with Microsoft Office software, desktop publishing, and MS Project.Ability to work independently as well as cooperatively in a fast-paced team environment.Excellent organization, planning, and time management skills.Excellent oral and interpersonal communication.Background and interest in assessment.
","<p><strong>Job Description</strong></p><p><strong>POSITION SUMMARY:</strong></p><p>Quantitative Team Manager works closely with members of the Psychometrics and Quantitative Research team (PQR) to support and lead a broad range of complex, high-stakes large-scale research activities related to Psychometric and quantitative research projects in language testing and applied linguistics projects.<i> </i>The Quantitative Team Manager supervisees the Quantitative analysts on the PQR team who work with researchers and Psychometricians in analyzing data and generating reports for WIDA ACCESS, a large scale, high stakes K-12 assessment of English language proficiency.</p><p> </p><p><strong>ESSENTIAL DUTIES</strong></p><ul><li>Manage and lead project teams in the preparation of data for analysis and reporting, including acting as the liaison with the client on data delivery, preparing data file layouts, collecting, entering, scoring, transforming, receiving, validating, cleaning, merging, restructuring of data while taking appropriate steps to ensure quality.</li><li>Supervise PQR analysts.</li><li>Manage and maintain team calendar and internal project timelines for the PQR team.</li><li>Organize and manage the weekly PQR meeting and CAL-WIDA Psychometric meeting.</li><li>Serve as PQR data specialist. Duties include serving as primary data point of contact with clients, managing master datasets and/or databases ensuring master datasets are created, saved and stored appropriately, and identifying, drafting, and updating procedures for producing and analyzing datasets.</li><li>Lead the technical work as relates to the WIDA ACCESS Annual Technical Reports. Duties include orienting team members to processes and procedures for producing tables, managing staff assignments, documenting ATR QC, and supporting senior PQR staff as the client liaison.</li><li>With the support of the Senior Director of Psychometrics and Quantitative Research, draft and revise quantitative analysis procedures.</li><li>Conduct data analysis using statistical software such as SPSS, R and Winsteps.</li></ul><strong>Qualifications</strong><p><strong>EDUCATION AND EXPERIENCE</strong></p><p><undefined>Required</undefined></p><ul><li>Master’s degree from an accredited college or university, in Educational or Psychological Research, Applied Linguistics, Language Assessment, Educational or Psychological Assessment, or a related field, with at least six (6) years of relevant experience as technical lead or/and team management.</li><li>Experience with advanced data processing and statistical analyses, research methodologies, and high-stakes large-scale assessments.</li><li>Minimum of five years of extensive experience in programming using statistical software such as SPSS, R, Winsteps, Stata, and SAS.</li><li>Experience working with MS Excel, in a professional position or extended research project.</li><li>Extensive experience working with large quantitative data sets.</li><li>Extensive experience with following quality control procedures and documenting workflow.</li><li>Experience with educational assessment, especially language assessment and/or online adaptive assessment.</li><li>Demonstrated experience supervising junior level staff/data analysts.</li><li>Demonstrated experience in managing project tasks and timelines.</li></ul><p><strong>KNOWLEDGE, SKILLS & ABILITIES</strong></p><ul><li>Proficient in programming using SPSS, R and IRT software such as Winsteps.</li><li>Expertise in using advanced features of MS Excel.</li><li>Expertise with Microsoft Office software, desktop publishing, and MS Project.</li><li>Ability to work independently as well as cooperatively in a fast-paced team environment.</li><li>Excellent organization, planning, and time management skills.</li><li>Excellent oral and interpersonal communication.</li><li>Background and interest in assessment.</li></ul><li>
</li>","Center for Applied Linguistics · Washington DC-Baltimore Area (Hybrid)","https://www.linkedin.com/jobs/view/3906703771/","Washington DC-Baltimore Area","Skills: Leadership, Onboarding, +6 more","11-50 employees
2 school alumni work here","LISTED","658009838","Center for Applied Linguistics","https://media.licdn.com/dms/image/C4E0BAQGTAARoFbz8Qg/company-logo_400_400/0/1630580549211/center_for_applied_linguistics_logo?e=1722470400&v=beta&t=BP0a1_dcqNPNsOCCKGxUQqGpNR9w9lQfwa4kpcyIgX4","2024-04-20T12:12:50.000Z","2024-04-30T00:06:04.487Z"
"Senior Researcher, Product Experience (Growth)","Netflix is one of the world's leading streaming entertainment services, with over 260 million members in over 190 countries enjoying TV series, documentaries, feature films, and mobile games across various genres and languages. Members can play, pause, and resume watching as they want, anytime, anywhere, and change their plans anytime.

The Product Experience Research team is central in uncovering compelling ways to engage and entertain our global members. This Senior Research role supports Growth, which strives to better attract new members to Netflix and explore new monetization opportunities worldwide. Specifically, this role will focus on how Netflix can deliver better value to more members through new ad-supported offerings.

This is an opportunity to lead innovative research with demonstrable impact on a global scale. You will be responsible for defining, leading, analyzing, and socializing research studies that generate insights to empower business decisions across the company. You’ll partner with cross-functional teams passionate about delivering the most engaging, innovative, and inclusive experiences.


In This Role, You Will


Identify, prioritize, and lead research roadmaps that generate insights to inform monetization strategies across the company.Partner with cross-functional teams, including Product, Ads, Product Marketing, Design, Data Science, Strategy Planning & Analysis, and Brand to proactively develop research initiatives.Define, design, execute, and socialize a range of research studies that build a strong understanding of existing and future audiences and their experiences worldwide.Identify best practices in existing and emerging research methodologies.



About You


Demonstrable experience in product research and/or user experience (UX) research informing growth and monetization strategy. Experience supporting subscription businesses or ad-supported online products preferred.Mixed methods research expertise including hands-on experience leading end-to-end quantitative and qualitative research studiesA balance of creative and analytical skills with the ability to proactively define research questions, identify appropriate methods, execute studies, and synthesize findings.Strong communicator with a bias toward action to proactively collaborate with multiple teams across the company.Passionate about translating findings into actionable strategic business recommendationsGlobal research experience is highly preferred but not required.


Tags: ResearchSite

Our compensation structure consists solely of an annual salary; we do not have bonuses. You choose each year how much of your compensation you want in salary versus stock options. To determine your personal top of market compensation, we rely on market indicators and consider your specific job family, background, skills, and experience to determine your compensation in the market range. The range for this role is $110,000 - $440,000.

Netflix provides comprehensive benefits including Health Plans, Mental Health support, a 401(k) Retirement Plan with employer match, Stock Option Program, Disability Programs, Health Savings and Flexible Spending Accounts, Family-forming benefits, and Life and Serious Injury Benefits. We also offer paid leave of absence programs. Full-time hourly employees accrue 35 days annually for paid time off to be used for vacation, holidays, and sick paid time off. Full-time salaried employees are immediately entitled to flexible time off. See more detail about our Benefits here.

Netflix is a unique culture and environment. Learn more here.

We are an equal-opportunity employer and celebrate diversity, recognizing that diversity of thought and background builds stronger teams. We approach diversity and inclusion seriously and thoughtfully. We do not discriminate on the basis of race, religion, color, ancestry, national origin, caste, sex, sexual orientation, gender, gender identity or expression, age, disability, medical condition, pregnancy, genetic makeup, marital status, or military service.","Netflix is one of the world's leading streaming entertainment services, with over 260 million members in over 190 countries enjoying TV series, documentaries, feature films, and mobile games across various genres and languages. Members can play, pause, and resume watching as they want, anytime, anywhere, and change their plans anytime.

The Product Experience Research team is central in uncovering compelling ways to engage and entertain our global members. This Senior Research role supports Growth, which strives to better attract new members to Netflix and explore new monetization opportunities worldwide. Specifically, this role will focus on how Netflix can deliver better value to more members through new ad-supported offerings.

This is an opportunity to lead innovative research with demonstrable impact on a global scale. You will be responsible for defining, leading, analyzing, and socializing research studies that generate insights to empower business decisions across the company. You’ll partner with cross-functional teams passionate about delivering the most engaging, innovative, and inclusive experiences.


<strong>In This Role, You Will


</strong><ul><li>Identify, prioritize, and lead research roadmaps that generate insights to inform monetization strategies across the company.</li><li>Partner with cross-functional teams, including Product, Ads, Product Marketing, Design, Data Science, Strategy Planning & Analysis, and Brand to proactively develop research initiatives.</li><li>Define, design, execute, and socialize a range of research studies that build a strong understanding of existing and future audiences and their experiences worldwide.</li><li>Identify best practices in existing and emerging research methodologies.



</li></ul><strong>About You


</strong><ul><li>Demonstrable experience in product research and/or user experience (UX) research informing growth and monetization strategy. Experience supporting subscription businesses or ad-supported online products preferred.</li><li>Mixed methods research expertise including hands-on experience leading end-to-end quantitative and qualitative research studies</li><li>A balance of creative and analytical skills with the ability to proactively define research questions, identify appropriate methods, execute studies, and synthesize findings.</li><li>Strong communicator with a bias toward action to proactively collaborate with multiple teams across the company.</li><li>Passionate about translating findings into actionable strategic business recommendations</li><li>Global research experience is highly preferred but not required.


</li></ul>Tags: ResearchSite

Our compensation structure consists solely of an annual salary; we do not have bonuses. You choose each year how much of your compensation you want in salary versus stock options. To determine your personal top of market compensation, we rely on market indicators and consider your specific job family, background, skills, and experience to determine your compensation in the market range. The range for this role is $110,000 - $440,000.

Netflix provides comprehensive benefits including Health Plans, Mental Health support, a 401(k) Retirement Plan with employer match, Stock Option Program, Disability Programs, Health Savings and Flexible Spending Accounts, Family-forming benefits, and Life and Serious Injury Benefits. We also offer paid leave of absence programs. Full-time hourly employees accrue 35 days annually for paid time off to be used for vacation, holidays, and sick paid time off. Full-time salaried employees are immediately entitled to flexible time off. See more detail about our Benefits here.

Netflix is a unique culture and environment. Learn more here.

We are an equal-opportunity employer and celebrate diversity, recognizing that diversity of thought and background builds stronger teams. We approach diversity and inclusion seriously and thoughtfully. We do not discriminate on the basis of race, religion, color, ancestry, national origin, caste, sex, sexual orientation, gender, gender identity or expression, age, disability, medical condition, pregnancy, genetic makeup, marital status, or military service.","Netflix · Los Gatos, CA","https://www.linkedin.com/jobs/view/3819156659/","Los Gatos, California, United States","6 of 10 skills match your profile - you may be a good fit","10,001+ employees · Entertainment Providers
23 school alumni work here","LISTED","368130583","Netflix","https://media.licdn.com/dms/image/C4E0BAQEVb0ZISWk8vQ/company-logo_400_400/0/1631355051964?e=1722470400&v=beta&t=Nr9hwwd5ZP_uWNJjl22l3O5KQyD-xIgh5IN_TEiC5aI","2024-02-01T02:38:03.000Z","2024-04-30T00:06:04.487Z"
"Cognitive Scientist","**THIS IS AN EQUITY-ONLY OPPORTUNITY**
About Boost Education, Inc. DBA LearnableWe help people boost their lives by having digital tutors for everything. We are finally in the right moment to disrupt the human-machine relationship with massive, personalized interactions.Our platform, driven by the latest advancements in AI and cognitive science, is set to change how people learn, work, and grow. Rooted in a vision to democratize education for 3.4 billion learners worldwide, Learnable is poised to become a leader in the global e-learning market.
Exciting Phase of GrowthLearnable is in an exciting growth phase; it is currently part of the 18-week Built in Miami accelerator program by Venture Miami, aimed at fostering innovation in education and learning solutions. This participation underscores our commitment to enhancing learning outcomes and showcases our potential to influential investors and industry leaders. As we progress through the accelerator program, we leverage extensive market research, ongoing product validation, and innovative e-learning solutions to address the pressing educational challenges. With a high-fidelity prototype personalizing learning experiences, Learnable is uniquely positioned to dominate the e-learning market.
The OpportunityThis role is integral to developing and refining our cognitive science-driven learning platform. You will be at the forefront of creating engaging, practical educational experiences that are scientifically validated to enhance learning and retention.
Role & Responsibilities:
Research and Development: Lead initiatives to integrate cognitive science theories and findings into our digital tutor platform.Learning Experience Design: Design educational content and strategies that align with cognitive principles to maximize learning efficiency and engagement.Data-Driven Personalization: Develop algorithms and models for personalizing learning experiences based on cognitive profiles and learning behaviors.Assessment and Evaluation: Design and validate assessment tools to measure learning outcomes and cognitive development.Cross-functional collaboration: Work closely with AI developers, product managers, and educational experts to ensure our educational products' scientific accuracy and practical effectiveness.

Requirements:
Ph.D. in Cognitive Science, Psychology, Neuroscience, or a related field.Demonstrated experience in applied cognitive research, preferably in an educational technology context.Strong analytical skills and proficiency in experimental design and statistical analysis.Excellent communication skills, capable of conveying complex scientific concepts to non-expert audiences.Commitment to Learnable's mission of transforming learning through innovative technology.CompensationEquity compensation is a big part of the package, with details to be discussed during the interview. This role offers a unique opportunity to significantly impact Learnable's growth and success.
Join Our MissionWe invite you to apply if you're ready to contribute to a mission that transforms learning globally.
Application Deadline: May 31, 2024We recognize the critical role that timing plays in our growth and are actively reviewing applications continuously. We are aligned with our forward momentum, so we are keen to quickly bring the ideal candidate who matches our vision and drive on board. We encourage you to submit your application quickly to ensure you are considered soon.
","<p><strong>**THIS IS AN EQUITY-ONLY OPPORTUNITY**</strong></p><p>
</p><p><strong>About Boost Education, Inc. DBA Learnable</strong></p><p>We help people boost their lives by having digital tutors for everything. We are finally in the right moment to disrupt the human-machine relationship with massive, personalized interactions.</p><p>Our platform, driven by the latest advancements in AI and cognitive science, is set to change how people learn, work, and grow. Rooted in a vision to democratize education for 3.4 billion learners worldwide, Learnable is poised to become a leader in the global e-learning market.</p><p>
</p><p><strong>Exciting Phase of Growth</strong></p><p>Learnable is in an exciting growth phase; it is currently part of the 18-week Built in Miami accelerator program by Venture Miami, aimed at fostering innovation in education and learning solutions. This participation underscores our commitment to enhancing learning outcomes and showcases our potential to influential investors and industry leaders. As we progress through the accelerator program, we leverage extensive market research, ongoing product validation, and innovative e-learning solutions to address the pressing educational challenges. With a high-fidelity prototype personalizing learning experiences, Learnable is uniquely positioned to dominate the e-learning market.</p><p>
</p><p><strong>The Opportunity</strong></p><p>This role is integral to developing and refining our cognitive science-driven learning platform. You will be at the forefront of creating engaging, practical educational experiences that are scientifically validated to enhance learning and retention.</p><p>
</p><p><strong>Role & Responsibilities:</strong></p><p>
</p><ul><li><strong>Research and Development:</strong> Lead initiatives to integrate cognitive science theories and findings into our digital tutor platform.</li><li><strong>Learning Experience Design</strong>: Design educational content and strategies that align with cognitive principles to maximize learning efficiency and engagement.</li><li><strong>Data-Driven Personalization:</strong> Develop algorithms and models for personalizing learning experiences based on cognitive profiles and learning behaviors.</li><li><strong>Assessment and Evaluation:</strong> Design and validate assessment tools to measure learning outcomes and cognitive development.</li><li><strong>Cross-functional collaboration:</strong> Work closely with AI developers, product managers, and educational experts to ensure our educational products' scientific accuracy and practical effectiveness.</li></ul><p>
</p><p>
</p><p><strong>Requirements:</strong></p><p>
</p><ul><li>Ph.D. in Cognitive Science, Psychology, Neuroscience, or a related field.</li><li>Demonstrated experience in applied cognitive research, preferably in an educational technology context.</li><li>Strong analytical skills and proficiency in experimental design and statistical analysis.</li><li>Excellent communication skills, capable of conveying complex scientific concepts to non-expert audiences.</li><li>Commitment to Learnable's mission of transforming learning through innovative technology.</li></ul><p><strong>Compensation</strong></p><p>Equity compensation is a big part of the package, with details to be discussed during the interview. This role offers a unique opportunity to significantly impact Learnable's growth and success.</p><p>
</p><p><strong>Join Our Mission</strong></p><p>We invite you to apply if you're ready to contribute to a mission that transforms learning globally.</p><p>
</p><p><strong>Application Deadline: May 31, 2024</strong></p><p>We recognize the critical role that timing plays in our growth and are actively reviewing applications continuously. We are aligned with our forward momentum, so we are keen to quickly bring the ideal candidate who matches our vision and drive on board. We encourage you to submit your application quickly to ensure you are considered soon.</p><p>
</p>","Boost Education, Inc · Miami-Fort Lauderdale Area (Hybrid)","https://www.linkedin.com/jobs/view/3911954757/","Miami-Fort Lauderdale Area","Skills: Cognitive Science, Adaptive Learning, +3 more","1-10 employees","LISTED","1841270","Boost Education, Inc","https://media.licdn.com/dms/image/D4E0BAQHX9XhTtIyM8w/company-logo_400_400/0/1707338715819?e=1722470400&v=beta&t=vGzodxXYca9mG_uoZrSZRZVQNidbtHhYYZp_eAPOw2M","2024-04-26T16:17:24.000Z","2024-04-30T00:06:04.487Z"
