"Title","Description","Description HTML","Primary Description","Detail URL","Location","Skill","Insight","Job State","Poster Id","Company Name","Company Logo","Created At","Scraped At"
"Principal Economist","Principal Economist – competitive salary - New York, United States (hybrid)
A world-renowned consultancy is seeking a Principal Economist to join its New York City based team. They tackle intricate challenges related to competition, strategy, and intellectual property, particularly for prominent technology companies and global brands. Their expertise is evident in their involvement in groundbreaking technology cases that shape consumer behavior, influence regulatory laws, and have a profound impact on global society.
Role 
In this role, you'll engage with significant concepts for top-tier industry clients, expanding both your professional network and reputation, while fostering relationships that endure.
Collaborating with esteemed academic experts from renowned universities, you'll lead project teams in addressing clients' distinctive business challenges. Your focus will be on crafting solutions that effectively tackle complex strategic problems or provide answers to critical business questions.
Advanced data modelling and econometric methods will play a pivotal role in shaping the project, as you and your team extract and compile data from various sources to generate distinctive insights into the client's opportunity. You'll embrace career-defining challenges, bringing structure to ambiguity, and guiding both their teams and the client toward a successful outcome.
Qualifications
MBA, JD, or PhD in Economics, Econometrics, or other related fieldsRelevant experience (competition/antitrust) following educational studies, and preferably in the consulting spaceStrong analytical skills, coupled with a deep comprehension of financial and operational dynamicsCapability to oversee multiple intricate work streams and collaborate across organizational boundariesDemonstrated leadership skills, and team player attitude who can collaborate with multiple functional areasIntellectually and technology-curiousStrong written and oral communication skills
Interested? Please apply below or reach out to Grace Provenzano at gprovenzano@chisquare-group.com for more information.
By applying to this advert you agree to your personal details being held on file in relation to this and other future relevant opportunities.","<p><strong>Principal Economist – competitive salary - New York, United States (hybrid)</strong></p><p>
</p><p>A world-renowned consultancy is seeking a Principal Economist to join its New York City based team. They tackle intricate challenges related to competition, strategy, and intellectual property, particularly for prominent technology companies and global brands. Their expertise is evident in their involvement in groundbreaking technology cases that shape consumer behavior, influence regulatory laws, and have a profound impact on global society.</p><p>
</p><p><strong>Role </strong></p><p>
</p><p>In this role, you'll engage with significant concepts for top-tier industry clients, expanding both your professional network and reputation, while fostering relationships that endure.</p><p>
</p><p>Collaborating with esteemed academic experts from renowned universities, you'll lead project teams in addressing clients' distinctive business challenges. Your focus will be on crafting solutions that effectively tackle complex strategic problems or provide answers to critical business questions.</p><p>
</p><p>Advanced data modelling and econometric methods will play a pivotal role in shaping the project, as you and your team extract and compile data from various sources to generate distinctive insights into the client's opportunity. You'll embrace career-defining challenges, bringing structure to ambiguity, and guiding both their teams and the client toward a successful outcome.</p><p>
</p><p><strong>Qualifications</strong></p><p>
</p><ul><li>MBA, JD, or PhD in Economics, Econometrics, or other related fields</li><li>Relevant experience (competition/antitrust) following educational studies, and preferably in the consulting space</li><li>Strong analytical skills, coupled with a deep comprehension of financial and operational dynamics</li><li>Capability to oversee multiple intricate work streams and collaborate across organizational boundaries</li><li>Demonstrated leadership skills, and team player attitude who can collaborate with multiple functional areas</li><li>Intellectually and technology-curious</li><li>Strong written and oral communication skills</li></ul><p>
</p><p>Interested? Please apply below or reach out to Grace Provenzano at <undefined>gprovenzano@chisquare-group.com</undefined> for more information.</p><p>
</p><p>By applying to this advert you agree to your personal details being held on file in relation to this and other future relevant opportunities.</p>","Chi Square Economics · New York, United States (Hybrid)","https://www.linkedin.com/jobs/view/3882814379/","New York, United States","Skills: Analytical Skills, Statistics, +8 more","1-10 employees · Staffing and Recruiting","LISTED","623812090","Chi Square Economics","https://media.licdn.com/dms/image/C4D0BAQETdMOsidZpYw/company-logo_400_400/0/1630561625281/chi_square_economics_logo?e=1720656000&v=beta&t=S_5OQFW52PU4_CuOdcOJn3wj4em8Hjppi2yZWpY2cMw","2024-04-04T11:57:31.000Z","2024-04-05T01:14:13.637Z"
"Economist, AWS Marketing Science","Description

Amazon Web Services (AWS) is building a world-class marketing organization, and we are looking for an experienced Economist to join the central data and science organization for AWS Marketing.

This candidate will develop innovative solutions to measure the return on marketing investments. They will work closely with business leaders, scientists, and engineers to translate business and functional requirements into concrete deliverables, including the design, development, testing, and deployment of innovative measurement solutions. They will interact with functional leaders owning events (e.g. re:Invent, summits, webinars), paid media (paid search, paid social, display), AWS-owned channels (email, website, console) as well as lead management organization to drive the development, fine-tuning and adoption of the consistent measurement framework across these diverse initiatives.

We seek candidates with an entrepreneurial spirit who want to make a big impact on AWS growth. They will develop strong working relationships and thrive in a collaborative team environment. They will have the creativity, curiosity, and strong judgment to work on high-impact, high-visibility products to improve the experience of AWS leads and customers.

Key job responsibilities

 Apply your expertise in causal inference and ML to develop systems to measure B2B marketing impact Develop and execute science products from concept, prototype to production incorporating feedback from customers, scientists and business leaders Identify new opportunities for leveraging economic insights and models in the marketing space Write technical white papers and business-facing documents to clearly explain complex technical concepts to audiences with diverse business/scientific backgrounds

We are open to hiring candidates to work out of one of the following locations:

Arlington, VA, USA | Austin, TX, USA | New York City, NY, USA | Seattle, WA, USA

Basic Qualifications

 PhD in economics or equivalent Experience working with software developers and product managers

Preferred Qualifications

 2+ years of industry, consulting, government, or academic research experience Knowledge of at least one statistical software package such as R, Stata, Matlab, SAS Experience with handling of large datasets Experience in Marketing Measurement

Amazon is committed to a diverse and inclusive workplace. Amazon is an equal opportunity employer and does not discriminate on the basis of race, national origin, gender, gender identity, sexual orientation, protected veteran status, disability, age, or other legally protected status. For individuals with disabilities who would like to request an accommodation, please visit https://www.amazon.jobs/en/disability/us.

Our compensation reflects the cost of labor across several US geographic markets. The base pay for this position ranges from $124,100/year in our lowest geographic market up to $212,800/year in our highest geographic market. Pay is based on a number of factors including market location and may vary depending on job-related knowledge, skills, and experience. Amazon is a total compensation company. Dependent on the position offered, equity, sign-on payments, and other forms of compensation may be provided as part of a total compensation package, in addition to a full range of medical, financial, and/or other benefits. For more information, please visit https://www.aboutamazon.com/workplace/employee-benefits. This position will remain posted until filled. Applicants should apply via our internal or external career site.



Company - Amazon Web Services, Inc.

Job ID: A2595199","<strong>Description

</strong>Amazon Web Services (AWS) is building a world-class marketing organization, and we are looking for an experienced Economist to join the central data and science organization for AWS Marketing.

This candidate will develop innovative solutions to measure the return on marketing investments. They will work closely with business leaders, scientists, and engineers to translate business and functional requirements into concrete deliverables, including the design, development, testing, and deployment of innovative measurement solutions. They will interact with functional leaders owning events (e.g. re:Invent, summits, webinars), paid media (paid search, paid social, display), AWS-owned channels (email, website, console) as well as lead management organization to drive the development, fine-tuning and adoption of the consistent measurement framework across these diverse initiatives.

We seek candidates with an entrepreneurial spirit who want to make a big impact on AWS growth. They will develop strong working relationships and thrive in a collaborative team environment. They will have the creativity, curiosity, and strong judgment to work on high-impact, high-visibility products to improve the experience of AWS leads and customers.

Key job responsibilities

<ul><li> Apply your expertise in causal inference and ML to develop systems to measure B2B marketing impact</li><li> Develop and execute science products from concept, prototype to production incorporating feedback from customers, scientists and business leaders</li><li> Identify new opportunities for leveraging economic insights and models in the marketing space</li><li> Write technical white papers and business-facing documents to clearly explain complex technical concepts to audiences with diverse business/scientific backgrounds

</li></ul>We are open to hiring candidates to work out of one of the following locations:

Arlington, VA, USA | Austin, TX, USA | New York City, NY, USA | Seattle, WA, USA

<strong>Basic Qualifications

</strong><ul><li> PhD in economics or equivalent</li><li> Experience working with software developers and product managers

</li></ul><strong>Preferred Qualifications

</strong><ul><li> 2+ years of industry, consulting, government, or academic research experience</li><li> Knowledge of at least one statistical software package such as R, Stata, Matlab, SAS</li><li> Experience with handling of large datasets</li><li> Experience in Marketing Measurement

</li></ul>Amazon is committed to a diverse and inclusive workplace. Amazon is an equal opportunity employer and does not discriminate on the basis of race, national origin, gender, gender identity, sexual orientation, protected veteran status, disability, age, or other legally protected status. For individuals with disabilities who would like to request an accommodation, please visit https://www.amazon.jobs/en/disability/us.

Our compensation reflects the cost of labor across several US geographic markets. The base pay for this position ranges from $124,100/year in our lowest geographic market up to $212,800/year in our highest geographic market. Pay is based on a number of factors including market location and may vary depending on job-related knowledge, skills, and experience. Amazon is a total compensation company. Dependent on the position offered, equity, sign-on payments, and other forms of compensation may be provided as part of a total compensation package, in addition to a full range of medical, financial, and/or other benefits. For more information, please visit https://www.aboutamazon.com/workplace/employee-benefits. This position will remain posted until filled. Applicants should apply via our internal or external career site.



<strong>Company</strong> - Amazon Web Services, Inc.

Job ID: A2595199","Amazon Web Services (AWS) · Austin, TX","https://www.linkedin.com/jobs/view/3877267549/","Austin, Texas, United States","Skills: SAS (Software), Academic Research, +8 more","10,001+ employees · IT Services and IT Consulting
2 connections work here · 246 school alumni work here","LISTED","7745488","Amazon Web Services (AWS)","https://media.licdn.com/dms/image/C560BAQER_QnUTXrPJw/company-logo_400_400/0/1670264051233/amazon_web_services_logo?e=1720656000&v=beta&t=gfgUQul59jGrn-VfGOdufK-1e2TiXA-loLVQzGpo_Mk","2024-04-01T14:16:12.000Z","2024-04-05T01:14:13.637Z"
