"Title","Description","Description HTML","Primary Description","Detail URL","Location","Skill","Insight","Job State","Poster Id","Company Name","Company Logo","Created At","Scraped At"
"Economist, Global Media and Entertainment (GME) Science","Description

Amazon’s Global Media and Entertainment (GME) organization is creating a future of entertainment where creative content, innovation, and commerce come together. We leverage Amazon’s unique expertise across video, music, gaming, and more to create a truly immersive entertainment experience. Our team, GME Science, is focused on building science tools to optimize Amazon’s entertainment offerings, so that we can provide a great customer experience while operating as a sustainable and profitable business. We push ourselves to Think Big, building ambitious models that create value in multiple GME businesses.

This role will expand our team’s marketing measurement work. Offsite marketing is a major expense for every GME business, but given business constraints and observational noise, evaluating the impact of a given campaign is challenging. Our team works with measurement teams in each business as well as central measurement teams to build foundational marketing measurement science and adapt it for unique use cases.

Our Team Wrestles With Questions Like

 What’s the ROI of a particular experimental design in marketing, considering the costs of running it and the benefits from validation and calibration? How can we ensure that diverse marketing measurement approaches used across Amazon are truly comparable with one another, for pan-Amazon optimization? How should we understand the costs and benefits of onsite vs. offsite marketing? How much impact does a campaign run by one business have on other Amazon businesses?

To be successful in this role, you will need effective communication, an ability to work closely with stakeholders across our many GME partner teams, and the skill to translate data-driven findings into actionable insights. This includes developing a deep understanding of our business context, which is ambiguous and can change quickly. Your work will be used by decision-makers across GME to deliver the best entertainment experience for our customers, which means we have a high bar. Our healthy team culture is supportive and fast-paced, and we prioritize learning, growth, and helping each other to continuously raise the bar.

Impact and Career Growth

In today’s entertainment landscape, critical decisions are made with data and economic models. You’ll help GME leaders ask the right questions, and then deliver data-driven answers, creating the future of GME at Amazon. You’ll help define a long-term science vision in this space and translate it into an actionable roadmap. This role combines science leadership, organizational ability, technical strength, product focus, and business understanding – a perfect recipe for career growth as an economist in tech.

Key job responsibilities

 Design and build econometric models, especially causal models, to measure the value of the business and its many features Develop science products from concept to prototype to production, incorporating feedback from scientists and business partners Independently identify and pursue new opportunities to leverage economic insights across GME businesses Write business and technical documents communicating business context, methods, and results to business leadership and other scientists Serve as a technical reviewer for our team and related teams, including document and code reviews

We are open to hiring candidates to work out of one of the following locations:

Culver City, CA, USA | New York, NY, USA | Seattle, WA, USA

Basic Qualifications

 PhD in economics or equivalent

Preferred Qualifications

 2+ years of industry, consulting, government, or academic research experience Experience with marketing measurement models. Knowledge of Python, Spark/PySpark, in addition to any statistical software (e.g. R, Stata). Experience with AWS tools such as Sagemaker, EMR, and S3.

Amazon is committed to a diverse and inclusive workplace. Amazon is an equal opportunity employer and does not discriminate on the basis of race, national origin, gender, gender identity, sexual orientation, protected veteran status, disability, age, or other legally protected status. For individuals with disabilities who would like to request an accommodation, please visit https://www.amazon.jobs/en/disability/us.

Our compensation reflects the cost of labor across several US geographic markets. The base pay for this position ranges from $124,100/year in our lowest geographic market up to $212,800/year in our highest geographic market. Pay is based on a number of factors including market location and may vary depending on job-related knowledge, skills, and experience. Amazon is a total compensation company. Dependent on the position offered, equity, sign-on payments, and other forms of compensation may be provided as part of a total compensation package, in addition to a full range of medical, financial, and/or other benefits. For more information, please visit https://www.aboutamazon.com/workplace/employee-benefits. This position will remain posted until filled. Applicants should apply via our internal or external career site.



Company - Amazon.com Services LLC

Job ID: A2601221","<strong>Description

</strong>Amazon’s Global Media and Entertainment (GME) organization is creating a future of entertainment where creative content, innovation, and commerce come together. We leverage Amazon’s unique expertise across video, music, gaming, and more to create a truly immersive entertainment experience. Our team, GME Science, is focused on building science tools to optimize Amazon’s entertainment offerings, so that we can provide a great customer experience while operating as a sustainable and profitable business. We push ourselves to Think Big, building ambitious models that create value in multiple GME businesses.

This role will expand our team’s marketing measurement work. Offsite marketing is a major expense for every GME business, but given business constraints and observational noise, evaluating the impact of a given campaign is challenging. Our team works with measurement teams in each business as well as central measurement teams to build foundational marketing measurement science and adapt it for unique use cases.

<strong>Our Team Wrestles With Questions Like

</strong><ul><li> What’s the ROI of a particular experimental design in marketing, considering the costs of running it and the benefits from validation and calibration?</li><li> How can we ensure that diverse marketing measurement approaches used across Amazon are truly comparable with one another, for pan-Amazon optimization?</li><li> How should we understand the costs and benefits of onsite vs. offsite marketing?</li><li> How much impact does a campaign run by one business have on other Amazon businesses?

</li></ul>To be successful in this role, you will need effective communication, an ability to work closely with stakeholders across our many GME partner teams, and the skill to translate data-driven findings into actionable insights. This includes developing a deep understanding of our business context, which is ambiguous and can change quickly. Your work will be used by decision-makers across GME to deliver the best entertainment experience for our customers, which means we have a high bar. Our healthy team culture is supportive and fast-paced, and we prioritize learning, growth, and helping each other to continuously raise the bar.

Impact and Career Growth

In today’s entertainment landscape, critical decisions are made with data and economic models. You’ll help GME leaders ask the right questions, and then deliver data-driven answers, creating the future of GME at Amazon. You’ll help define a long-term science vision in this space and translate it into an actionable roadmap. This role combines science leadership, organizational ability, technical strength, product focus, and business understanding – a perfect recipe for career growth as an economist in tech.

Key job responsibilities

<ul><li> Design and build econometric models, especially causal models, to measure the value of the business and its many features</li><li> Develop science products from concept to prototype to production, incorporating feedback from scientists and business partners</li><li> Independently identify and pursue new opportunities to leverage economic insights across GME businesses</li><li> Write business and technical documents communicating business context, methods, and results to business leadership and other scientists</li><li> Serve as a technical reviewer for our team and related teams, including document and code reviews

</li></ul>We are open to hiring candidates to work out of one of the following locations:

Culver City, CA, USA | New York, NY, USA | Seattle, WA, USA

<strong>Basic Qualifications

</strong><ul><li> PhD in economics or equivalent

</li></ul><strong>Preferred Qualifications

</strong><ul><li> 2+ years of industry, consulting, government, or academic research experience</li><li> Experience with marketing measurement models.</li><li> Knowledge of Python, Spark/PySpark, in addition to any statistical software (e.g. R, Stata).</li><li> Experience with AWS tools such as Sagemaker, EMR, and S3.

</li></ul>Amazon is committed to a diverse and inclusive workplace. Amazon is an equal opportunity employer and does not discriminate on the basis of race, national origin, gender, gender identity, sexual orientation, protected veteran status, disability, age, or other legally protected status. For individuals with disabilities who would like to request an accommodation, please visit https://www.amazon.jobs/en/disability/us.

Our compensation reflects the cost of labor across several US geographic markets. The base pay for this position ranges from $124,100/year in our lowest geographic market up to $212,800/year in our highest geographic market. Pay is based on a number of factors including market location and may vary depending on job-related knowledge, skills, and experience. Amazon is a total compensation company. Dependent on the position offered, equity, sign-on payments, and other forms of compensation may be provided as part of a total compensation package, in addition to a full range of medical, financial, and/or other benefits. For more information, please visit https://www.aboutamazon.com/workplace/employee-benefits. This position will remain posted until filled. Applicants should apply via our internal or external career site.



<strong>Company</strong> - Amazon.com Services LLC

Job ID: A2601221","Amazon · New York, United States","https://www.linkedin.com/jobs/view/3879387495/","New York, United States","Skills: Academic Research, Development Economics, +8 more","10,001+ employees · Software Development
15 connections work here · 475 school alumni work here","LISTED","7745488","Amazon","https://media.licdn.com/dms/image/C560BAQHTvZwCx4p2Qg/company-logo_400_400/0/1630640869849/amazon_logo?e=1720656000&v=beta&t=tqCldN5WC3j44d1J0mmU93nCcJ-sUCmPfSypvUa5Ceg","2024-04-02T12:00:11.000Z","2024-04-05T01:14:13.637Z"
"Principal Economist, Device Economics","Description

Amazon Device Economics is looking for a senior economic expert in causal inference to advance the economic valuation methodologies in the Amazon Devices organization. This is a thought leadership position to help set the long-term vision, drive methods innovation, and influence cross-org methods alignment. This role is also an expert in modeling and measuring customer value with proven capacity to innovate, scale measurement, and mentor talent.

This candidate will also work closely with Amazon Devices executive leadership in finance and product development to devise science roadmaps for innovation and simplification, and adoption of insights to influence important resource allocation and prioritization decisions. Excellent communication skills (verbal and written) are required to ensure success of this collaboration. The candidate must be passionate about advancing science for business and customer impact.

Key job responsibilities

 Advance valuation methodology within Devices, and in collaboration with centralized valuation teams. Motivate and drive data generation to size. Drive innovation and closed loop measurement for methods innovation. Enable product development to scale valuation approach.

A day in the life

 Propose and refine valuation methodology, and review with Devices finance customers. Brief Devices executives about valuation approaches, providing options to address strategic priorities. Collaborate with and influence the broader scientific methodology community.

About The Team

Amazon Devices designs and builds Amazon first-party consumer electronics products to delight and engage customers. Amazon Devices represents a highly complex space with 100+ products across several product categories (e-readers [Kindle], tablets [Fire Tablets], smart speakers and audio assistants [Echo], wifi routers [eero], and video doorbells and cameras [Ring and Blink]), for sale both online and in offline retailers in many regions. The space becomes more complex with dynamic product offerings that include new product launches, new marketplace launches, and improvements to existing devices through software improvements.

The Devices Economics team leads in analyzing these complex marketplace dynamics to enable science-driven decision making in the Devices org. Device Economics achieves this by combining economic expertise with macroeconomic trends, including scientific applications for use by internal analysts and providing deep understanding of customer preferences. Our team’s outputs inform product development decisions, investments in future product categories, product pricing and promotion, and bundling across complementary product lines. We have achieved substantial impact on the Devices business, and will achieve more with the right leader in this space.

We are open to hiring candidates to work out of one of the following locations:

Arlington, VA, USA | Seattle, WA, USA

Basic Qualifications

 PhD in Economics, Statistics, or other quantitative field. 8 + years of experience in analytics and applied economics. Proficient in a general programming language.

Preferred Qualifications

 Experience in developing and executing an analytic vision to solve business-relevant problems. Experience in building analytic or scientific data products or solutions. Written and verbal communications skills to convey complicated process and systems to business partners and senior leadership. Applicants with considerably more and broader, experience, are also strongly encouraged. Expert in statistical and programming software including: Python, or Spark. Expert at industry analyses, including experience with product bundling, substitution, and pricing. Experience with causal machine learning in performant applications. Strong track record in performing high-quality analysis of data at scale.

Amazon is committed to a diverse and inclusive workplace. Amazon is an equal opportunity employer and does not discriminate on the basis of race, national origin, gender, gender identity, sexual orientation, protected veteran status, disability, age, or other legally protected status. For individuals with disabilities who would like to request an accommodation, please visit https://www.amazon.jobs/en/disability/us.

Our compensation reflects the cost of labor across several US geographic markets. The base pay for this position ranges from $151,500/year in our lowest geographic market up to $294,700/year in our highest geographic market. Pay is based on a number of factors including market location and may vary depending on job-related knowledge, skills, and experience. Amazon is a total compensation company. Dependent on the position offered, equity, sign-on payments, and other forms of compensation may be provided as part of a total compensation package, in addition to a full range of medical, financial, and/or other benefits. For more information, please visit https://www.aboutamazon.com/workplace/employee-benefits. Applicants should apply via our internal or external career site.



Company - Amazon.com Services LLC

Job ID: A2535601","<strong>Description

</strong>Amazon Device Economics is looking for a senior economic expert in causal inference to advance the economic valuation methodologies in the Amazon Devices organization. This is a thought leadership position to help set the long-term vision, drive methods innovation, and influence cross-org methods alignment. This role is also an expert in modeling and measuring customer value with proven capacity to innovate, scale measurement, and mentor talent.

This candidate will also work closely with Amazon Devices executive leadership in finance and product development to devise science roadmaps for innovation and simplification, and adoption of insights to influence important resource allocation and prioritization decisions. Excellent communication skills (verbal and written) are required to ensure success of this collaboration. The candidate must be passionate about advancing science for business and customer impact.

Key job responsibilities

<ul><li> Advance valuation methodology within Devices, and in collaboration with centralized valuation teams.</li><li> Motivate and drive data generation to size.</li><li> Drive innovation and closed loop measurement for methods innovation.</li><li> Enable product development to scale valuation approach.

</li></ul>A day in the life

<ul><li> Propose and refine valuation methodology, and review with Devices finance customers.</li><li> Brief Devices executives about valuation approaches, providing options to address strategic priorities.</li><li> Collaborate with and influence the broader scientific methodology community.

</li></ul><strong>About The Team

</strong>Amazon Devices designs and builds Amazon first-party consumer electronics products to delight and engage customers. Amazon Devices represents a highly complex space with 100+ products across several product categories (e-readers [Kindle], tablets [Fire Tablets], smart speakers and audio assistants [Echo], wifi routers [eero], and video doorbells and cameras [Ring and Blink]), for sale both online and in offline retailers in many regions. The space becomes more complex with dynamic product offerings that include new product launches, new marketplace launches, and improvements to existing devices through software improvements.

The Devices Economics team leads in analyzing these complex marketplace dynamics to enable science-driven decision making in the Devices org. Device Economics achieves this by combining economic expertise with macroeconomic trends, including scientific applications for use by internal analysts and providing deep understanding of customer preferences. Our team’s outputs inform product development decisions, investments in future product categories, product pricing and promotion, and bundling across complementary product lines. We have achieved substantial impact on the Devices business, and will achieve more with the right leader in this space.

We are open to hiring candidates to work out of one of the following locations:

Arlington, VA, USA | Seattle, WA, USA

<strong>Basic Qualifications

</strong><ul><li> PhD in Economics, Statistics, or other quantitative field.</li><li> 8 + years of experience in analytics and applied economics.</li><li> Proficient in a general programming language.

</li></ul><strong>Preferred Qualifications

</strong><ul><li> Experience in developing and executing an analytic vision to solve business-relevant problems.</li><li> Experience in building analytic or scientific data products or solutions.</li><li> Written and verbal communications skills to convey complicated process and systems to business partners and senior leadership.</li><li> Applicants with considerably more and broader, experience, are also strongly encouraged.</li><li> Expert in statistical and programming software including: Python, or Spark.</li><li> Expert at industry analyses, including experience with product bundling, substitution, and pricing.</li><li> Experience with causal machine learning in performant applications.</li><li> Strong track record in performing high-quality analysis of data at scale.

</li></ul>Amazon is committed to a diverse and inclusive workplace. Amazon is an equal opportunity employer and does not discriminate on the basis of race, national origin, gender, gender identity, sexual orientation, protected veteran status, disability, age, or other legally protected status. For individuals with disabilities who would like to request an accommodation, please visit https://www.amazon.jobs/en/disability/us.

Our compensation reflects the cost of labor across several US geographic markets. The base pay for this position ranges from $151,500/year in our lowest geographic market up to $294,700/year in our highest geographic market. Pay is based on a number of factors including market location and may vary depending on job-related knowledge, skills, and experience. Amazon is a total compensation company. Dependent on the position offered, equity, sign-on payments, and other forms of compensation may be provided as part of a total compensation package, in addition to a full range of medical, financial, and/or other benefits. For more information, please visit https://www.aboutamazon.com/workplace/employee-benefits. Applicants should apply via our internal or external career site.



<strong>Company</strong> - Amazon.com Services LLC

Job ID: A2535601","Amazon · Arlington, VA","https://www.linkedin.com/jobs/view/3877286181/","Arlington, Virginia, United States","Skills: Analytics, Applied Economics, +8 more","10,001+ employees · Software Development
15 connections work here · 475 school alumni work here","LISTED","7745488","Amazon","https://media.licdn.com/dms/image/C560BAQHTvZwCx4p2Qg/company-logo_400_400/0/1630640869849/amazon_logo?e=1720656000&v=beta&t=tqCldN5WC3j44d1J0mmU93nCcJ-sUCmPfSypvUa5Ceg","2024-04-01T14:23:53.000Z","2024-04-05T01:14:13.637Z"
