"Title","Description","Description HTML","Primary Description","Detail URL","Location","Skill","Insight","Job State","Poster Id","Company Name","Company Logo","Created At","Scraped At"
"Economist, AWS Marketing Science","Description

Amazon Web Services (AWS) is building a world-class marketing organization, and we are looking for an experienced Economist to join the central data and science organization for AWS Marketing.

This candidate will develop innovative solutions to measure the return on marketing investments. They will work closely with business leaders, scientists, and engineers to translate business and functional requirements into concrete deliverables, including the design, development, testing, and deployment of innovative measurement solutions. They will interact with functional leaders owning events (e.g. re:Invent, summits, webinars), paid media (paid search, paid social, display), AWS-owned channels (email, website, console) as well as lead management organization to drive the development, fine-tuning and adoption of the consistent measurement framework across these diverse initiatives.

We seek candidates with an entrepreneurial spirit who want to make a big impact on AWS growth. They will develop strong working relationships and thrive in a collaborative team environment. They will have the creativity, curiosity, and strong judgment to work on high-impact, high-visibility products to improve the experience of AWS leads and customers.

Key job responsibilities

 Apply your expertise in causal inference and ML to develop systems to measure B2B marketing impact Develop and execute science products from concept, prototype to production incorporating feedback from customers, scientists and business leaders Identify new opportunities for leveraging economic insights and models in the marketing space Write technical white papers and business-facing documents to clearly explain complex technical concepts to audiences with diverse business/scientific backgrounds

We are open to hiring candidates to work out of one of the following locations:

Arlington, VA, USA | Austin, TX, USA | New York City, NY, USA | Seattle, WA, USA

Basic Qualifications

 PhD in economics or equivalent Experience working with software developers and product managers

Preferred Qualifications

 2+ years of industry, consulting, government, or academic research experience Knowledge of at least one statistical software package such as R, Stata, Matlab, SAS Experience with handling of large datasets Experience in Marketing Measurement

Amazon is committed to a diverse and inclusive workplace. Amazon is an equal opportunity employer and does not discriminate on the basis of race, national origin, gender, gender identity, sexual orientation, protected veteran status, disability, age, or other legally protected status. For individuals with disabilities who would like to request an accommodation, please visit https://www.amazon.jobs/en/disability/us.

Our compensation reflects the cost of labor across several US geographic markets. The base pay for this position ranges from $124,100/year in our lowest geographic market up to $212,800/year in our highest geographic market. Pay is based on a number of factors including market location and may vary depending on job-related knowledge, skills, and experience. Amazon is a total compensation company. Dependent on the position offered, equity, sign-on payments, and other forms of compensation may be provided as part of a total compensation package, in addition to a full range of medical, financial, and/or other benefits. For more information, please visit https://www.aboutamazon.com/workplace/employee-benefits. This position will remain posted until filled. Applicants should apply via our internal or external career site.



Company - Amazon Web Services, Inc.

Job ID: A2595199","<strong>Description

</strong>Amazon Web Services (AWS) is building a world-class marketing organization, and we are looking for an experienced Economist to join the central data and science organization for AWS Marketing.

This candidate will develop innovative solutions to measure the return on marketing investments. They will work closely with business leaders, scientists, and engineers to translate business and functional requirements into concrete deliverables, including the design, development, testing, and deployment of innovative measurement solutions. They will interact with functional leaders owning events (e.g. re:Invent, summits, webinars), paid media (paid search, paid social, display), AWS-owned channels (email, website, console) as well as lead management organization to drive the development, fine-tuning and adoption of the consistent measurement framework across these diverse initiatives.

We seek candidates with an entrepreneurial spirit who want to make a big impact on AWS growth. They will develop strong working relationships and thrive in a collaborative team environment. They will have the creativity, curiosity, and strong judgment to work on high-impact, high-visibility products to improve the experience of AWS leads and customers.

Key job responsibilities

<ul><li> Apply your expertise in causal inference and ML to develop systems to measure B2B marketing impact</li><li> Develop and execute science products from concept, prototype to production incorporating feedback from customers, scientists and business leaders</li><li> Identify new opportunities for leveraging economic insights and models in the marketing space</li><li> Write technical white papers and business-facing documents to clearly explain complex technical concepts to audiences with diverse business/scientific backgrounds

</li></ul>We are open to hiring candidates to work out of one of the following locations:

Arlington, VA, USA | Austin, TX, USA | New York City, NY, USA | Seattle, WA, USA

<strong>Basic Qualifications

</strong><ul><li> PhD in economics or equivalent</li><li> Experience working with software developers and product managers

</li></ul><strong>Preferred Qualifications

</strong><ul><li> 2+ years of industry, consulting, government, or academic research experience</li><li> Knowledge of at least one statistical software package such as R, Stata, Matlab, SAS</li><li> Experience with handling of large datasets</li><li> Experience in Marketing Measurement

</li></ul>Amazon is committed to a diverse and inclusive workplace. Amazon is an equal opportunity employer and does not discriminate on the basis of race, national origin, gender, gender identity, sexual orientation, protected veteran status, disability, age, or other legally protected status. For individuals with disabilities who would like to request an accommodation, please visit https://www.amazon.jobs/en/disability/us.

Our compensation reflects the cost of labor across several US geographic markets. The base pay for this position ranges from $124,100/year in our lowest geographic market up to $212,800/year in our highest geographic market. Pay is based on a number of factors including market location and may vary depending on job-related knowledge, skills, and experience. Amazon is a total compensation company. Dependent on the position offered, equity, sign-on payments, and other forms of compensation may be provided as part of a total compensation package, in addition to a full range of medical, financial, and/or other benefits. For more information, please visit https://www.aboutamazon.com/workplace/employee-benefits. This position will remain posted until filled. Applicants should apply via our internal or external career site.



<strong>Company</strong> - Amazon Web Services, Inc.

Job ID: A2595199","Amazon Web Services (AWS) · Arlington, VA","https://www.linkedin.com/jobs/view/3877265593/","Arlington, Virginia, United States","Skills: SAS (Software), Academic Research, +8 more","10,001+ employees · IT Services and IT Consulting
2 connections work here · 246 school alumni work here","LISTED","7745488","Amazon Web Services (AWS)","https://media.licdn.com/dms/image/C560BAQER_QnUTXrPJw/company-logo_400_400/0/1670264051233/amazon_web_services_logo?e=1720656000&v=beta&t=gfgUQul59jGrn-VfGOdufK-1e2TiXA-loLVQzGpo_Mk","2024-04-01T14:16:12.000Z","2024-04-05T01:14:13.637Z"
"Labor Economist","The Communications and Research Division at the Idaho Department of Labor has an opportunity for a full-time Labor Economist located in the Pocatello local office. As a customer-facing expert on economic and labor market related matters, the Labor Economist fills an important role at the Idaho Department of Labor. In the course of their everyday job duties, they contribute to the growth of the Idaho economy by providing labor market insight that facilitates strategic decision-making that can lead to business expansions, job creation and wage increases.
The ideal candidate for the Labor Economist position must be as equally comfortable talking to employers about determining competitive wages as they are developing complex economic impact analysis. Labor Economists are expected to develop compelling insight from complex economic concepts that can be easily understood by the general public through written reports, presentations and interviews with media outlets. Labor Economists are also expected to work independently and on teams. They often collaborate with staff from various divisions of the Idaho Department of Labor, other state agencies, the federal government and non-governmental agencies such as economic development organizations.
Example of Duties
TeamworkBe the business and front-end representative for labor market and economic inquires and initiatives.Flexible and adaptable to changing needs.Work well under pressure and tight deadlines.Analyze policy recommendations for impact and form recommendations and alternatives to aid in policy decisions.Work well and contribute to the efforts of internal and external teams to provide support for economic development for the region.CommunicationOrganize data into reports with graphic illustrations.Deliver dynamic presentations and trainings concerning complex economic issues in basic terms to a wide audience.Provide information, analysis, and interpretation of economic, demographic, and statistical data to businesses, public and private education institutions, chambers of commerce, area workforce investment boards, local offices, elected officials, and government agencies.Advise management regarding economic issues and trends affecting the local labor market and provides technical support to local communities for planning, business expansion, and grant applications.ResearchDevelop and evaluate forecasts to ensure models reflect changing socioeconomic factors and compile and distribute statistical data, reports, and manuals for use by federal, state, and local government, businesses, and elected officials.Identify and study need for economic and labor market research projects.Select, review and analyze economic, labor market and statistical data and prepare reports of findings for both internal and external publication.Establish a contact network to determine employment trends and economic and demographic data.Identify and assess Labor Market Information and occupational needs for training programs.
Minimum Qualifications:  You must possess all the minimum qualifications below to pass the exam for this position. Please make sure your resume supports how you meet the minimum qualifications for this position. Failure to do this may disqualify you from being considered for this position.
Good knowledge of:Research and statistical methodologies. Typically gained by successfully completing at least one upper division college-level course relating to research methods and applied statistics; OR have at least one year of experience performing research with statistics to develop economic, social science, business or related insight.Economic principles. Typically gained by successfully completing at least one upper division college-level course relating to economic principles; OR have at least one year of experience in an economic or related field.
Experience:Collecting and analyzing social, economic, and/or labor market data, and writing and preparing technical reports. Typically gained by at least one year of experience collecting and analyzing economic, labor market and/or social data.Organizing and conducting workshops and making presentations.
Supplemental InformationOur ideal candidate will have:Bachelor's degree in Economics.Applied Statistics or related field.Background in business.Valid driver's license.","<p>The Communications and Research Division at the Idaho Department of Labor has an opportunity for a full-time Labor Economist located in the Pocatello local office. As a customer-facing expert on economic and labor market related matters, the Labor Economist fills an important role at the Idaho Department of Labor. In the course of their everyday job duties, they contribute to the growth of the Idaho economy by providing labor market insight that facilitates strategic decision-making that can lead to business expansions, job creation and wage increases.</p><p>
</p><p>The ideal candidate for the Labor Economist position must be as equally comfortable talking to employers about determining competitive wages as they are developing complex economic impact analysis. Labor Economists are expected to develop compelling insight from complex economic concepts that can be easily understood by the general public through written reports, presentations and interviews with media outlets. Labor Economists are also expected to work independently and on teams. They often collaborate with staff from various divisions of the Idaho Department of Labor, other state agencies, the federal government and non-governmental agencies such as economic development organizations.</p><p>
</p><p><strong>Example of Duties</strong></p><p>
</p><p><strong>Teamwork</strong></p><ul><li>Be the business and front-end representative for labor market and economic inquires and initiatives.</li><li>Flexible and adaptable to changing needs.</li><li>Work well under pressure and tight deadlines.</li><li>Analyze policy recommendations for impact and form recommendations and alternatives to aid in policy decisions.</li><li>Work well and contribute to the efforts of internal and external teams to provide support for economic development for the region.</li></ul><p><strong>Communication</strong></p><ul><li>Organize data into reports with graphic illustrations.</li><li>Deliver dynamic presentations and trainings concerning complex economic issues in basic terms to a wide audience.</li><li>Provide information, analysis, and interpretation of economic, demographic, and statistical data to businesses, public and private education institutions, chambers of commerce, area workforce investment boards, local offices, elected officials, and government agencies.</li><li>Advise management regarding economic issues and trends affecting the local labor market and provides technical support to local communities for planning, business expansion, and grant applications.</li></ul><p><strong>Research</strong></p><ul><li>Develop and evaluate forecasts to ensure models reflect changing socioeconomic factors and compile and distribute statistical data, reports, and manuals for use by federal, state, and local government, businesses, and elected officials.</li><li>Identify and study need for economic and labor market research projects.</li><li>Select, review and analyze economic, labor market and statistical data and prepare reports of findings for both internal and external publication.</li><li>Establish a contact network to determine employment trends and economic and demographic data.</li><li>Identify and assess Labor Market Information and occupational needs for training programs.</li></ul><p>
</p><p><strong><undefined>Minimum Qualifications: </undefined> <i>You must possess all the minimum qualifications below to pass the exam for this position. Please make sure your resume supports how you meet the minimum qualifications for this position. Failure to do this may disqualify you from being considered for this position.</i></strong></p><p>
</p><p><strong>Good knowledge of:</strong></p><ul><li><strong>Research and statistical methodologies. </strong><i>Typically gained by successfully completing at least one upper division college-level course relating to research methods and applied statistics; OR have at least one year of experience performing research with statistics to develop economic, social science, business or related insight.</i></li><li><strong>Economic principles. </strong><i>Typically gained by</i><i><strong> </i></strong><i>successfully completing at least one upper division college-level course relating to economic principles; OR have at least one year of experience in an economic or related field.</i></li></ul><p>
</p><strong>Experience:</strong><ul><li><strong>Collecting and analyzing social, economic, and/or labor market data, and writing and preparing technical reports. </strong><i>Typically gained by at least one year of experience collecting and analyzing economic, labor market and/or social data.</i></li><strong><li>Organizing and conducting workshops and making presentations.</strong></li></ul><p>
</p><p><strong>Supplemental Information</strong></p><p>Our ideal candidate will have:</p><ul><li>Bachelor's degree in Economics.</li><li>Applied Statistics or related field.</li><li>Background in business.</li><li>Valid driver's license.</li></ul>","Idaho Department of Labor · Pocatello, ID (On-site)","https://www.linkedin.com/jobs/view/3876927004/","Pocatello, Idaho, United States","Skills: Statistics, Research Skills, +4 more","501-1,000 employees","LISTED","788302386","Idaho Department of Labor","https://media.licdn.com/dms/image/C4D0BAQFl3BwCdisorg/company-logo_400_400/0/1631300386820?e=1720656000&v=beta&t=j6kQ3BLJLMc_QPlvgqJsX72jA4WQCAavhUuuANPMiB8","2024-04-01T18:13:46.000Z","2024-04-05T01:14:13.637Z"
