"Title","Description","Description HTML","Primary Description","Detail URL","Location","Skill","Insight","Job State","Poster Id","Company Name","Company Logo","Created At","Scraped At"
"Director, Behavioral Scientist","Job Description

About Behavioral Sciences

The Ipsos Behavior Science Center consists of talent with both academic as well as market research industry experience who work across all of Ipsos, as well as with Ipsos clients, to develop and apply behavioral science to understand how consumers actually behave (as opposed to stated behavior).

What makes this role important at Ipsos?

The Ipsos Behavioral Science Center is looking for a Scientist to join our team of expert practitioners. Our primary mission is to partner with Ipsos research teams to integrate and leverage Behavioral Science theories, frameworks, and methods to create holistic, innovative, and actionable solutions for our clients.

One of our core values and points of differentiation in the market is our ability to couple scientific rigor with applied solutions. We prefer PhDs in behavioral science (e.g., social/cognitive psychology, health psychology/behavioral health, public health, marketing-consumer behavior, behavioral economics), but are looking first and foremost for people with a passion for the intersection of consumer behavior and health psychology and a desire to translate academic principles to real-world challenges.

What you can expect to be doing:

Your primary role will be working with senior team members to execute day-to-day project needs and develop new business. Specifically, you will:

Conduct literature searches and reviewsCreate research implements (surveys, experiments, qualitative guides)Analyze data Assist with the design and content of client deliverables Source “real/in-market” examples of BeSci principles for project specific topicsAbility to translate academic theories into client friendly recommendationsFacilitate training workshops and client working sessionsBuild relationships with internal stakeholders and external clients

In addition to your day-to-day tasks, we seek someone who will ultimately contribute to our thought leadership, product development, and evangelism for behavioral science.

This might be the job for you if you have:

Strong passion for Behavioral Science, problem solving, and a desire to understand and apply how patients, physicians, and providers make healthcare decisionsAn understanding of behavioral health theories and frameworks and an ability to apply a scientific lens to understanding patient, physician, and insurer motivations and decisionsSome experience in market research, ideally working with clientsDemonstrated track-record of excellence in previous work (academic, professional, or personal)Advanced degree in psychology, marketing, anthropology, public health, or behavioral science (PhD preferred)Comfort using statistical software (Excel, SPSS, STATA, R, etc.) to perform data analysis and create data visualizationsProfessional experience in marketing, insights, applying interventions, or consulting is a plusAbility to manage multiple projects and meet deadlinesPositive attitude and can-do spirit; willingness to challenge conventional thinkingWorks well with others in a close-team environment – open to providing and receiving feedbackExcellent oral and written communication skills (i.e., emails, PowerPoint, meetings, presentations, etc.)Design skills a plus

If you don’t meet 100% of the requirements, we encourage all who feel they might be a fit for the opportunity to apply. We may consider a variety of backgrounds for a particular role and are also committed to considering candidates for available positions throughout our organization, not just the one you’re applying to!

In accordance with NY/CO/CA/WA law, the estimated base salary range for this role is $145,000 to $155,000. Your final base salary will be determined based on several non-discriminatory factors which may include but are not limited to location, work experience, skills, knowledge, education and/or certifications.

What’s in it for you:

At Ipsos you’ll experience opportunities for Career Development, an exceptional benefits package (including generous PTO, healthcare plans, wellness benefits), a flexible workplace policy, and a strong collaborative culture.

To find out more about all the great reasons to work at Ipsos, how we’re making an impact around the world, and more about our benefits and employee programs, please visit:  Why Work at Ipsos | US

Commitment to Diversity

Ipsos recognizes the necessity of building an inclusive culture that values each employee’s individuality and diverse perspectives. For more than 40 years, our mission has been to generate and analyze data about society, markets, brands, and behaviors to provide our clients with the insights that elevate their understanding of the world. This could not be fulfilled without Ipsos’ diverse employees who compile and analyze this data—they are the essence of who we are and what we do.

We are committed to providing equal opportunity to all employees, creating an environment that promotes inclusion, and enabling employees from all walks of life to flourish. Ipsos encourages our employees to act in a respectful and responsible manner, in line with code of best practices concerning diversity and inclusion, human rights, equality, and civility for every individual.

Ipsos is An Equal Opportunity Employer. All qualified applicants will receive consideration for employment without regard to age, race, color, religion, sex, sexual orientation, gender identity, national origin, protected veteran status, or any other protected class and will not be discriminated against on the basis of disability.

About Us

Ipsos is one of the world’s largest research companies and currently the only one primarily managed by researchers, ranking as a #1 full-service research organization for four consecutive years . With over 75 different data-driven solutions, and presence in 90 markets, Ipsos brings together research, implementation, methodological, and subject-matter experts from around the world, combining thematic and technical experts to deliver top-quality research and insights. Simply speaking, we help the biggest companies solve some of their biggest problems, serving more than 5000 clients across the globe by providing research, data, and insights on their target markets. And we’re proud to share we’ve received our Great Place to Work Certification in 2022 & 2023!

Organization

The Ipsos Behavior Science Center consists of talent with both academic as well as market research industry experience who work across all of Ipsos, as well as with Ipsos clients, to develop and apply behavioral science to understand how consumers actually behave (as opposed to stated behavior).

","<strong>Job Description

</strong><strong>About Behavioral Sciences

</strong>The Ipsos Behavior Science Center consists of talent with both academic as well as market research industry experience who work across all of Ipsos, as well as with Ipsos clients, to develop and apply behavioral science to understand how consumers <i>actually</i> behave (as opposed to stated behavior).

<strong>What makes this role important at Ipsos?

</strong>The Ipsos Behavioral Science Center is looking for a Scientist to join our team of expert practitioners. Our primary mission is to partner with Ipsos research teams to integrate and leverage Behavioral Science theories, frameworks, and methods to create holistic, innovative, and actionable solutions for our clients.

One of our core values and points of differentiation in the market is our ability to couple scientific rigor with applied solutions. We prefer PhDs in behavioral science (e.g., social/cognitive psychology, health psychology/behavioral health, public health, marketing-consumer behavior, behavioral economics), but are looking first and foremost for people with a passion for the intersection of consumer behavior and health psychology and a desire to translate academic principles to real-world challenges.

<strong>What you can expect to be doing:

</strong>Your primary role will be working with senior team members to execute day-to-day project needs and develop new business. Specifically, you will:

<ul><li>Conduct literature searches and reviews</li><li>Create research implements (surveys, experiments, qualitative guides)</li><li>Analyze data </li><li>Assist with the design and content of client deliverables </li><li>Source “real/in-market” examples of BeSci principles for project specific topics</li><li>Ability to translate academic theories into client friendly recommendations</li><li>Facilitate training workshops and client working sessions</li><li>Build relationships with internal stakeholders and external clients

</li></ul>In addition to your day-to-day tasks, we seek someone who will ultimately contribute to our thought leadership, product development, and evangelism for behavioral science.

<strong>This might be the job for you if you have:

</strong><ul><li>Strong passion for Behavioral Science, problem solving, and a desire to understand and apply how patients, physicians, and providers make healthcare decisions</li><li>An understanding of behavioral health theories and frameworks and an ability to apply a scientific lens to understanding patient, physician, and insurer motivations and decisions</li><li>Some experience in market research, ideally working with clients</li><li>Demonstrated track-record of excellence in previous work (academic, professional, or personal)</li><li>Advanced degree in psychology, marketing, anthropology, public health, or behavioral science (PhD preferred)</li><li>Comfort using statistical software (Excel, SPSS, STATA, R, etc.) to perform data analysis and create data visualizations</li><li>Professional experience in marketing, insights, applying interventions, or consulting is a plus</li><li>Ability to manage multiple projects and meet deadlines</li><li>Positive attitude and can-do spirit; willingness to challenge conventional thinking</li><li>Works well with others in a close-team environment – open to providing and receiving feedback</li><li>Excellent oral and written communication skills (i.e., emails, PowerPoint, meetings, presentations, etc.)</li><li>Design skills a plus

</li></ul><i>If you don’t meet 100% of the requirements, we encourage all who feel they might be a fit for the opportunity to apply. We may consider a variety of backgrounds for a particular role and are also committed to considering candidates for available positions throughout our organization, not just the one you’re applying to!

</i><i>In accordance with NY/CO/CA/WA law, the estimated base salary range for this role is $145,000 to $155,000. Your final base salary will be determined based on several non-discriminatory factors which may include but are not limited to location, work experience, skills, knowledge, education and/or certifications.

</i><strong>What’s in it for you:

</strong><i>At Ipsos you’ll experience opportunities for Career Development, an exceptional benefits package (including generous PTO, healthcare plans, wellness benefits), a flexible workplace policy, and a strong collaborative culture.

</i><i>To find out more about all the great reasons to work at Ipsos, how we’re making an impact around the world, and more about our benefits and employee programs, please visit: </i> Why Work at Ipsos | US

<strong>Commitment to Diversity

</strong>Ipsos recognizes the necessity of building an inclusive culture that values each employee’s individuality and diverse perspectives. For more than 40 years, our mission has been to generate and analyze data about society, markets, brands, and behaviors to provide our clients with the insights that elevate their understanding of the world. This could not be fulfilled without Ipsos’ diverse employees who compile and analyze this data—they are the essence of who we are and what we do.

We are committed to providing equal opportunity to all employees, creating an environment that promotes inclusion, and enabling employees from all walks of life to flourish. Ipsos encourages our employees to act in a respectful and responsible manner, in line with code of best practices concerning diversity and inclusion, human rights, equality, and civility for every individual.

Ipsos is An Equal Opportunity Employer. All qualified applicants will receive consideration for employment without regard to age, race, color, religion, sex, sexual orientation, gender identity, national origin, protected veteran status, or any other protected class and will not be discriminated against on the basis of disability.

<strong>About Us

</strong>Ipsos is one of the world’s largest research companies and currently the only one primarily managed by researchers, ranking as a #1 full-service research organization for four consecutive years . With over 75 different data-driven solutions, and presence in 90 markets, Ipsos brings together research, implementation, methodological, and subject-matter experts from around the world, combining thematic and technical experts to deliver top-quality research and insights. Simply speaking, we help the biggest companies solve some of their biggest problems, serving more than 5000 clients across the globe by providing research, data, and insights on their target markets. And we’re proud to share we’ve received our Great Place to Work Certification in 2022 & 2023!

<strong>Organization

</strong>The Ipsos Behavior Science Center consists of talent with both academic as well as market research industry experience who work across all of Ipsos, as well as with Ipsos clients, to develop and apply behavioral science to understand how consumers <i>actually</i> behave (as opposed to stated behavior).

","Ipsos North America · New York, NY (Hybrid)","https://www.linkedin.com/jobs/view/3877412041/","New York, New York, United States","Skills: Market Research, Research Skills, +8 more","5,001-10,000 employees · Market Research
4 school alumni work here","LISTED","109148397","Ipsos North America","https://media.licdn.com/dms/image/C560BAQExE4BbZ7NgQw/company-logo_400_400/0/1630617672275/ipsos_in_north_america_logo?e=1722470400&v=beta&t=q_FD0YsWZgryIgrFpYCgSjVlgJk__GJDn3iVY5GOXK4","2024-04-02T02:58:19.000Z","2024-04-30T00:06:04.487Z"
"Senior Data Scientist (L5), Games","Now is an amazing time to join Netflix as we seek to entertain the world. We have over 260 million paid members in over 190 countries, and we won’t stop there. Games are our next big frontier and an incredible opportunity for us to deliver new experiences to delight and entertain our quickly growing membership. You will be jumping in at the very beginning of this adventure and be in a position to help us redefine what a Netflix subscription means for our members around the world.

Data Science and Engineering (‘DSE’) at Netflix is aimed at using data, analytics, and sciences to improve various aspects of our business. We are looking for a Senior Data Scientist to join our Games DSE team, leading experimentation and advanced data science needs. This role will be partnering closely with our Game studio stakeholders to drive data informed decisions by building predictive models, conducting statistical analysis and deriving business insights. As a member of this team, you will also play a critical role in presenting insights that shape our decision making and ensure decisions are sound from a statistical perspective.


What You Will Do


Partner with our Game stakeholders (e.g., Netflix Games Development team, Game Developers, Game Strategy, Planning & Analysis team) on advanced analytic initiatives (e.g., prediction modeling, causal inference, experimentation etc)Lead the design, analysis, and interpretation of experiments that shape decision-making around Games at NetflixProactively perform data exploration to discover innovation and testing opportunitiesDrive and implement high impact projects end to endPresent your research and insights to key stakeholdersWork with business stakeholders to connect analysis to key decisions that affect the business to influence and drive impact to the businessBalance handling ad hoc requests while also driving larger projects forward



Who You Are


You have at least 2 years of experience working in the Games industry as a Data ScientistAt least 5 years of experience with a PhD degree in Statistics, Econometrics, Mathematics, Engineering or a relevant quantitative field or 8+ years of experience with a Master degree in those fieldsYou have statistical skills utilized in A/B testing, analyzing observational data, and statistical modelingYou are comfortable working with large data sets and analyzing complex data with SQL and other tools such as Python or RYou have good business acumen on product innovations and excellent problem solving skills to translate business requirements to data science problemsYou have a strong bias to action, delivering results quickly with iteration instead of waiting for perfectionYou are a fast learner and are comfortable with ambiguous requestsYou have exceptional communication skills and can manage stakeholder priorities directly Willing to mentor junior data scientists on the team to accelerate team growth


Our compensation structure consists solely of an annual salary; we do not have bonuses. You choose each year how much of your compensation you want in salary versus stock options. To determine your personal top of market compensation, we rely on market indicators and consider your specific job family, background, skills, and experience to determine your compensation in the market range. The range for this role is $170,000 - $720,000.

Netflix provides comprehensive benefits including Health Plans, Mental Health support, a 401(k) Retirement Plan with employer match, Stock Option Program, Disability Programs, Health Savings and Flexible Spending Accounts, Family-forming benefits, and Life and Serious Injury Benefits. We also offer paid leave of absence programs. Full-time hourly employees accrue 35 days annually for paid time off to be used for vacation, holidays, and sick paid time off. Full-time salaried employees are immediately entitled to flexible time off. See more detail about our Benefits here.

Netflix is a unique culture and environment. Learn more here.

We are an equal-opportunity employer and celebrate diversity, recognizing that diversity of thought and background builds stronger teams. We approach diversity and inclusion seriously and thoughtfully. We do not discriminate on the basis of race, religion, color, ancestry, national origin, caste, sex, sexual orientation, gender, gender identity or expression, age, disability, medical condition, pregnancy, genetic makeup, marital status, or military service.","Now is an amazing time to join Netflix as we seek to entertain the world. We have over 260 million paid members in over 190 countries, and we won’t stop there. Games are our next big frontier and an incredible opportunity for us to deliver new experiences to delight and entertain our quickly growing membership. You will be jumping in at the very beginning of this adventure and be in a position to help us redefine what a Netflix subscription means for our members around the world.

Data Science and Engineering (‘DSE’) at Netflix is aimed at using data, analytics, and sciences to improve various aspects of our business. We are looking for a Senior Data Scientist to join our Games DSE team, leading experimentation and advanced data science needs. This role will be partnering closely with our Game studio stakeholders to drive data informed decisions by building predictive models, conducting statistical analysis and deriving business insights. As a member of this team, you will also play a critical role in presenting insights that shape our decision making and ensure decisions are sound from a statistical perspective.


<strong>What You Will Do


</strong><ul><li>Partner with our Game stakeholders (e.g., Netflix Games Development team, Game Developers, Game Strategy, Planning & Analysis team) on advanced analytic initiatives (e.g., prediction modeling, causal inference, experimentation etc)</li><li>Lead the design, analysis, and interpretation of experiments that shape decision-making around Games at Netflix</li><li>Proactively perform data exploration to discover innovation and testing opportunities</li><li>Drive and implement high impact projects end to end</li><li>Present your research and insights to key stakeholders</li><li>Work with business stakeholders to connect analysis to key decisions that affect the business to influence and drive impact to the business</li><li>Balance handling ad hoc requests while also driving larger projects forward



</li></ul><strong>Who You Are


</strong><ul><li>You have at least 2 years of experience working in the Games industry as a Data Scientist</li><li>At least 5 years of experience with a PhD degree in Statistics, Econometrics, Mathematics, Engineering or a relevant quantitative field or 8+ years of experience with a Master degree in those fields</li><li>You have statistical skills utilized in A/B testing, analyzing observational data, and statistical modeling</li><li>You are comfortable working with large data sets and analyzing complex data with SQL and other tools such as Python or R</li><li>You have good business acumen on product innovations and excellent problem solving skills to translate business requirements to data science problems</li><li>You have a strong bias to action, delivering results quickly with iteration instead of waiting for perfection</li><li>You are a fast learner and are comfortable with ambiguous requests</li><li>You have exceptional communication skills and can manage stakeholder priorities directly </li><li>Willing to mentor junior data scientists on the team to accelerate team growth


</li></ul>Our compensation structure consists solely of an annual salary; we do not have bonuses. You choose each year how much of your compensation you want in salary versus stock options. To determine your personal top of market compensation, we rely on market indicators and consider your specific job family, background, skills, and experience to determine your compensation in the market range. The range for this role is $170,000 - $720,000.

Netflix provides comprehensive benefits including Health Plans, Mental Health support, a 401(k) Retirement Plan with employer match, Stock Option Program, Disability Programs, Health Savings and Flexible Spending Accounts, Family-forming benefits, and Life and Serious Injury Benefits. We also offer paid leave of absence programs. Full-time hourly employees accrue 35 days annually for paid time off to be used for vacation, holidays, and sick paid time off. Full-time salaried employees are immediately entitled to flexible time off. See more detail about our Benefits here.

Netflix is a unique culture and environment. Learn more here.

We are an equal-opportunity employer and celebrate diversity, recognizing that diversity of thought and background builds stronger teams. We approach diversity and inclusion seriously and thoughtfully. We do not discriminate on the basis of race, religion, color, ancestry, national origin, caste, sex, sexual orientation, gender, gender identity or expression, age, disability, medical condition, pregnancy, genetic makeup, marital status, or military service.","Netflix · United States (Remote)","https://www.linkedin.com/jobs/view/3854803638/","United States","Skills: Data Science, Statistical Modeling, +8 more","10,001+ employees · Entertainment Providers
23 school alumni work here","LISTED","368130583","Netflix","https://media.licdn.com/dms/image/C4E0BAQEVb0ZISWk8vQ/company-logo_400_400/0/1631355051964?e=1722470400&v=beta&t=Nr9hwwd5ZP_uWNJjl22l3O5KQyD-xIgh5IN_TEiC5aI","2024-03-12T20:37:51.000Z","2024-04-30T00:06:04.487Z"
