"Title","Description","Description HTML","Primary Description","Detail URL","Location","Skill","Insight","Job State","Poster Id","Company Name","Company Logo","Created At","Scraped At"
"Senior Data Analyst","About Vouch

Insurance... sounds slow, old-fashioned, and unexciting. Exactly. Insurance is broken, and it's failing fast-moving, innovative startups.

Vouch is a new, technology-first insurance company backed with $160M in funding from world-class investors. Like Stripe for payments or Brex for credit cards, Vouch is creating the go-to business insurance for high-growth companies.

We're doing this by making insurance fast, responsive, and focused on our customers -high growth and innovative companies. Instead of printed PDF applications and week-long waits, Vouch is building new technology to solve real problems, writing policies that actually cover relevant startup scenarios, and designing simple experiences in an otherwise frustrating industry.

What does a work environment look like at Vouch?

Vouch is a Virtual First Workplace with San Francisco, Chicago, and New York City office locations. This role can be based anywhere in the U.S. as long as you can work our Vouch core collaboration hours (8:30 am-2:30 pm Pacific Time) when most internal meetings are held.

Role Responsibilities

As an insurance company, data is at the core of everything we do at Vouch. Data and analysis are critical to improving insurance design, underwriting, and outcomes for our clients. Data also drives our business operations and our financial decisions. As a Senior Data Analyst at Vouch, you’ll have the unique opportunity to build the foundational data structure, tools, and models to help all of our functions become increasingly data-driven. You will be part of the Analytics team and sit cross-functionally, working closely with the data team, finance, biz ops, and product managers who work across all our functions.

You will work with our teams + stakeholders to build and maintain key data sets and dashboards, and be the go-to person when we’re looking to do deep analysis or answer thorny data-driven business decisions; you’re dogmatic in chasing down the answer, even when it isn’t easy.

Job Duties

Develop an advanced understanding of Vouch's business model and its drivers, with a deep focus on a business unitConduct Discovery with cross-functional stakeholders to identify data and metrics they need to solve their business problemsCollaborate with Engineering, Data Engineering, Product, and relevant teams on data instrumentationPropose standardized definitions of data and metrics and get buy-in from stakeholdersDevelop analytical framework, single-source-of-truth data sets, and dashboards (in Mode) to empower stakeholders to perform their own analysisGrit: you are goal-oriented, purpose-driven, and are perseverant about achieving their goals, even in the face of adversityLead projects end-to-end from discovery to activation and post-launch in collaboration with a cross-functional team of Engineering, Product, Insurance, GTM, etc.Clearly documenting data models with source, description, and field definitions for better collaboration, maintainability, and usabilityServe as an evangelist for the product solution in question, including alignment with cross-functional stakeholdersTie goals back to business metrics such as written premium, conversion rates, or top-of-funnel growth

About You

3-6 years of experience working as a data analyst, data scientist, consulting, banking, or equivalent quantitative analytical roleBachelor’s or advanced degree in statistics, math, economics, computer science, finance, or equivalent practical experienceExpert SQL skills and experience with BI tools (Mode, Tableau, Looker, Qlikview, etc.)Experience with data transformation tooling (dbt is preferred)Strong communication skills and the ability to explain complex concepts to both technical and non-technical audiences; you can explain concepts to the leadership team or the BDR team and level set appropriatelyExperience working directly with business teams to define metrics, analyze problems, and propose solutionsAre excited to dig into our business processes to understand how data is generatedAre eager to learn new tools and improve your technical skill setHave empathy with our clients and internal partnersAre comfortable with multi-stakeholder environment and context-switchingTake initiative in problem-solving and chasing down solutionsExceptional communication and collaboration skills, with the ability to lead cross-functional meetings and drive consensus among stakeholdersStrategic thinking and a deep understanding of business drivers, with the ability to translate business requirements into actionable data strategies1+ years of professional experience with Python or R

Nice To Have

Insurance or financial services background Exposure to and passion for early-stage startups and/or high-growth environmentsPrevious experience working in user segmentation, attribution, funnel conversion, or similar business analytics problems

Vouch provides a number of benefits to help you bring your best self to work:

Competitive compensation and equity packagesHealth, dental, and vision insuranceParental leaveFlexible vacation time (Unlimited PTO)Wellness allowance ($80/month)Technology allowance ($100/month)

Salary Range

The pay range for this role is: $120,000 to $140,000 per year.

Our salary ranges are based on paying competitively for our size and industry and are one part of our total compensation package that also includes benefits and other perks. We also include stock options in all compensation packages and believe all Vouch employees should have the opportunity to become owners in the company.

Individual pay decisions are based on a number of factors, including qualifications for the role, experience level, skill set, location, and business need. The base pay range provided is subject to change and may be modified in the future.

Vouch believes in putting our people first and building a diverse team is at the front of everything that we do. We welcome people from different backgrounds, experiences, and perspectives. We are an equal opportunity employer and celebrate the diversity of our growing team. 

If you require reasonable accommodation in completing this application, interviewing, completing any pre-employment testing, or otherwise participating in the employee selection process, please direct your inquiries to recruiting@vouch.us.

","<strong>About Vouch

</strong>Insurance... sounds slow, old-fashioned, and unexciting. Exactly. Insurance is broken, and it's failing fast-moving, innovative startups.

Vouch is a new, technology-first insurance company backed with $160M in funding from world-class investors. Like Stripe for payments or Brex for credit cards, Vouch is creating the go-to business insurance for high-growth companies.

We're doing this by making insurance fast, responsive, and focused on our customers -high growth and innovative companies. Instead of printed PDF applications and week-long waits, Vouch is building new technology to solve real problems, writing policies that actually cover relevant startup scenarios, and designing simple experiences in an otherwise frustrating industry.

<strong>What does a work environment look like at Vouch?

</strong>Vouch is a Virtual First Workplace with San Francisco, Chicago, and New York City office locations. This role can be based anywhere in the U.S. as long as you can work our Vouch core collaboration hours (8:30 am-2:30 pm Pacific Time) when most internal meetings are held.

<strong>Role Responsibilities

</strong>As an insurance company, data is at the core of everything we do at Vouch. Data and analysis are critical to improving insurance design, underwriting, and outcomes for our clients. Data also drives our business operations and our financial decisions. As a Senior Data Analyst at Vouch, you’ll have the unique opportunity to build the foundational data structure, tools, and models to help all of our functions become increasingly data-driven. You will be part of the Analytics team and sit cross-functionally, working closely with the data team, finance, biz ops, and product managers who work across all our functions.

You will work with our teams + stakeholders to build and maintain key data sets and dashboards, and be the go-to person when we’re looking to do deep analysis or answer thorny data-driven business decisions; you’re dogmatic in chasing down the answer, even when it isn’t easy.

<strong>Job Duties

</strong><ul><li>Develop an advanced understanding of Vouch's business model and its drivers, with a deep focus on a business unit</li><li>Conduct Discovery with cross-functional stakeholders to identify data and metrics they need to solve their business problems</li><li>Collaborate with Engineering, Data Engineering, Product, and relevant teams on data instrumentation</li><li>Propose standardized definitions of data and metrics and get buy-in from stakeholders</li><li>Develop analytical framework, single-source-of-truth data sets, and dashboards (in Mode) to empower stakeholders to perform their own analysis</li><li>Grit: you are goal-oriented, purpose-driven, and are perseverant about achieving their goals, even in the face of adversity</li><li>Lead projects end-to-end from discovery to activation and post-launch in collaboration with a cross-functional team of Engineering, Product, Insurance, GTM, etc.</li><li>Clearly documenting data models with source, description, and field definitions for better collaboration, maintainability, and usability</li><li>Serve as an evangelist for the product solution in question, including alignment with cross-functional stakeholders</li><li>Tie goals back to business metrics such as written premium, conversion rates, or top-of-funnel growth

</li></ul><strong>About You

</strong><ul><li>3-6 years of experience working as a data analyst, data scientist, consulting, banking, or equivalent quantitative analytical role</li><li>Bachelor’s or advanced degree in statistics, math, economics, computer science, finance, or equivalent practical experience</li><li>Expert SQL skills and experience with BI tools (Mode, Tableau, Looker, Qlikview, etc.)</li><li>Experience with data transformation tooling (dbt is preferred)</li><li>Strong communication skills and the ability to explain complex concepts to both technical and non-technical audiences; you can explain concepts to the leadership team or the BDR team and level set appropriately</li><li>Experience working directly with business teams to define metrics, analyze problems, and propose solutions</li><li>Are excited to dig into our business processes to understand how data is generated</li><li>Are eager to learn new tools and improve your technical skill set</li><li>Have empathy with our clients and internal partners</li><li>Are comfortable with multi-stakeholder environment and context-switching</li><li>Take initiative in problem-solving and chasing down solutions</li><li>Exceptional communication and collaboration skills, with the ability to lead cross-functional meetings and drive consensus among stakeholders</li><li>Strategic thinking and a deep understanding of business drivers, with the ability to translate business requirements into actionable data strategies</li><li>1+ years of professional experience with Python or R

</li></ul><strong>Nice To Have

</strong><ul><li>Insurance or financial services background </li><li>Exposure to and passion for early-stage startups and/or high-growth environments</li><li>Previous experience working in user segmentation, attribution, funnel conversion, or similar business analytics problems

</li></ul><strong>Vouch provides a number of benefits to help you bring your best self to work:

</strong><ul><li>Competitive compensation and equity packages</li><li>Health, dental, and vision insurance</li><li>Parental leave</li><li>Flexible vacation time (Unlimited PTO)</li><li>Wellness allowance ($80/month)</li><li>Technology allowance ($100/month)

</li></ul><strong>Salary Range

</strong>The pay range for this role is: $120,000 to $140,000 per year.

Our salary ranges are based on paying competitively for our size and industry and are one part of our total compensation package that also includes benefits and other perks. We also include stock options in all compensation packages and believe all Vouch employees should have the opportunity to become owners in the company.

Individual pay decisions are based on a number of factors, including qualifications for the role, experience level, skill set, location, and business need. The base pay range provided is subject to change and may be modified in the future.

<i>Vouch believes in putting our people first and building a diverse team is at the front of everything that we do. We welcome people from different backgrounds, experiences, and perspectives. We are an equal opportunity employer and celebrate the diversity of our growing team. 

</i><i>If you require reasonable accommodation in completing this application, interviewing, completing any pre-employment testing, or otherwise participating in the employee selection process, please direct your inquiries to </i><i>recruiting@vouch.us</i>.

","Vouch Insurance","https://www.linkedin.com/jobs/view/3836579338/","United States","6 of 10 skills match your profile - you may be a good fit","201-500 employees · Insurance
2 school alumni work here","LISTED","53393342","Vouch Insurance","https://media.licdn.com/dms/image/C560BAQGUYuPmhBncMA/company-logo_400_400/0/1656613914270/vouch_group_logo?e=1716422400&v=beta&t=Ip85cMlw1zoq6FlCtW0QiT_ke2le96TxjkapXa4TxIw","2024-02-22T22:21:41.000Z","2024-02-22T22:36:18.464Z"
