"Title","Description","Description HTML","Primary Description","Detail URL","Location","Skill","Insight","Job State","Poster Id","Company Name","Company Logo","Created At","Scraped At"
"Data Analyst","JOB DESCRIPTION  The UNCF Fidelity Scholars Program (FSP) seeks a data analyst to engage in data collection, analysis and reporting to inform on program success and challenge areas. The data analyst will utilize a multitude of methodological approaches to manage and execute a range of research activities in line with FSP’s goals and objectives. The position requires a highly motivated and collaborative individual, who has a significant research background and possesses strong organizational, analytic, and writing abilities.  ABOUT UNCF  The United Negro College Fund (UNCF), the nation’s largest and most effective minority education organization, has been an engine of minority educational achievement for more than 70 years. UNCF’s mission is to build a robust and nationally recognized pipeline of black students who, because of UNCF support, become highly qualified college graduates. In addition, UNCF ensures that its member institutions remain respected models of best practices in moving students to and through college. Since its inception in 1944, UNCF has raised over $4.5 billion in private support, distributed more scholarships to help minorities attend school than any entity outside of the federal government, and enabled more than 425,000 minority and low-income students to graduate from UNCF’s member historically black colleges and universities (HBCUs) and launch professional careers. UNCF is committed to closing the educational attainment gap between African Americans and other populations by increasing postsecondary access and success for students from underrepresented groups, particularly low-income and first-generation students. PRIMARY RESPONSIBILITIES AND DUTIES:  Capturing, mining, analyzing and reporting on both qualitative and quantitative data.  Conduct quantitative and qualitative research on FSP related issues. Review and synthesize current literature when necessary.  Complete FSP related research and evaluation projects using a range of data analysis methods, including conducting qualitative interviews and focus groups, transcribing, synthesizing, and coding qualitative data.  Capture data from national databases (e.g. IPEDS) to contextualize FSP related data. Use appropriate statistical tools (e.g. Excel, R,SPSS, or other analysis programs) to create data visuals to illustrate data patterns. Serve as a writer and project manager for FSP related research projects.  Serve as a thought partner to leadership in study design and analytical support.  Create and manage databases to support FSP research activities. Develop expertise on the UNCF internal Salesforce database.  SUPERVISORY RESPONSIBILITIES  This position may periodically supervise interns. COMPETENCIES:To perform the job successfully, an individual should demonstrate the following competencies: Analytical – Synthesizes complex or diverse information; collects and researches data; Uses intuition and experience to complement data analyses.  Problem Solving - Identifies and resolves problems in a timely manner; Gathers and analyzes information skillfully; Develops alternative solutions; Works well in group problem-solving situations; Uses reason even when dealing with emotional topics.  Planning/Organizing - Prioritizes and plans work activities; Uses time efficiently; Sets goals and objectives; Develops realistic action plans.  Professionalism - Reacts well under pressure; Follows through on commitments.  Quality - Demonstrates accuracy and thoroughness; Looks for ways to improve and promote quality; Applies feedback to improve performance; Monitors own work to ensure quality.   QUALIFICATIONS:  EDUCATION and/or EXPERIENCE  Bachelor’s degree required; MS/MA or related degree or higher preferred in statistics, data science, higher education, or other fields with work that includes research methodologies.2+ years data analysis experience preferred.Advanced proficiency with MS Excel and PowerPoint required.Experience with modeling and analysis utilizing statistical programs. Ability to synthesize data and information from multiple sources including large data sets, develop insights and recommendations and convey complex information through the use of supporting tables, graphs and other visual representations required. Experience with large-scale higher education databases including IPEDS preferred.Experience employing both qualitative and quantitative research methods preferred.
Experience taking the lead to independently initiate, plan and drive multiple projects preferred.
Excellent communication skills, including the ability to simplify complex concepts in writing, visualizations, and verbal presentations tailored for diverse groups of stakeholders preferred. Qualifications and Skills
SOFTWARE SKILLS REQUIRED:Knowledge of O365 with intermediate to advanced knowledge in Word and Excel. Must be proficient in mail merges and correcting source or cell errors. Must be proficient in the manipulation of Excel formulas. WORK ENVIRONMENT Reasonable accommodations may be made to enable individuals with disabilities to perform the essential functions. The noise level in the work environment is usually moderate. COMPENSATION AND BENEFITS  Benefits include:Medical, Dental & VisionVacation, Sick & Personal Leave Life Insurance (Basic & Optional)Flex Spending Accounts403(b) Retirement AccountHoliday Savings Plan Salary Range: $58,700.00 To $66,400.00 per year (Salary is commensurate with experience.) UNCF is EOE M/F/D/V","<p><strong>JOB DESCRIPTION </strong></p><p> </p><p>The UNCF Fidelity Scholars Program (FSP) seeks a data analyst to engage in data collection, analysis and reporting to inform on program success and challenge areas. The data analyst will utilize a multitude of methodological approaches to manage and execute a range of research activities in line with FSP’s goals and objectives. The position requires a highly motivated and collaborative individual, who has a significant research background and possesses strong organizational, analytic, and writing abilities. </p><p> </p><p><strong>ABOUT UNCF </strong></p><p> </p><p>The United Negro College Fund (UNCF), the nation’s largest and most effective minority education organization, has been an engine of minority educational achievement for more than 70 years. UNCF’s mission is to build a robust and nationally recognized pipeline of black students who, because of UNCF support, become highly qualified college graduates. In addition, UNCF ensures that its member institutions remain respected models of best practices in moving students to and through college. Since its inception in 1944, UNCF has raised over $4.5 billion in private support, distributed more scholarships to help minorities attend school than any entity outside of the federal government, and enabled more than 425,000 minority and low-income students to graduate from UNCF’s member historically black colleges and universities (HBCUs) and launch professional careers. UNCF is committed to closing the educational attainment gap between African Americans and other populations by increasing postsecondary access and success for students from underrepresented groups, particularly low-income and first-generation students.</p><p> </p><p><strong>PRIMARY RESPONSIBILITIES AND DUTIES: </strong></p><p> </p><p>Capturing, mining, analyzing and reporting on both qualitative and quantitative data. </p><p> </p><p>Conduct quantitative and qualitative research on FSP related issues. Review and synthesize current literature when necessary. </p><p> </p><p>Complete FSP related research and evaluation projects using a range of data analysis methods, including conducting qualitative interviews and focus groups, transcribing, synthesizing, and coding qualitative data. </p><p> </p><p>Capture data from national databases (e.g. IPEDS) to contextualize FSP related data.</p><p> </p><p>Use appropriate statistical tools (e.g. Excel, R,SPSS, or other analysis programs) to create data visuals to illustrate data patterns.</p><p> </p><p>Serve as a writer and project manager for FSP related research projects. </p><p> </p><p>Serve as a thought partner to leadership in study design and analytical support. </p><p> </p><p>Create and manage databases to support FSP research activities.</p><p> </p><p>Develop expertise on the UNCF internal Salesforce database.</p><p> </p><p> </p><p><strong>SUPERVISORY RESPONSIBILITIES</strong> </p><p> </p><p>This position may periodically supervise interns.</p><p> </p><p><strong>COMPETENCIES:</strong></p><p>To perform the job successfully, an individual should demonstrate the following competencies: </p><p>Analytical – Synthesizes complex or diverse information; collects and researches data; Uses intuition and experience to complement data analyses. </p><p> </p><p>Problem Solving - Identifies and resolves problems in a timely manner; Gathers and analyzes information skillfully; Develops alternative solutions; Works well in group problem-solving situations; Uses reason even when dealing with emotional topics. </p><p> </p><p>Planning/Organizing - Prioritizes and plans work activities; Uses time efficiently; Sets goals and objectives; Develops realistic action plans. </p><p> </p><p>Professionalism - Reacts well under pressure; Follows through on commitments. </p><p> </p><p>Quality - Demonstrates accuracy and thoroughness; Looks for ways to improve and promote quality; Applies feedback to improve performance; Monitors own work to ensure quality. </p><p> </p><p> </p><p><strong>QUALIFICATIONS: </strong></p><p> </p><p><strong>EDUCATION and/or EXPERIENCE</strong> </p><p> </p><p>Bachelor’s degree required; MS/MA or related degree or higher preferred in statistics, data science, higher education, or other fields with work that includes research methodologies.</p><p>2+ years data analysis experience preferred.</p><p>Advanced proficiency with MS Excel and PowerPoint required.</p><p>Experience with modeling and analysis utilizing statistical programs. </p><p>Ability to synthesize data and information from multiple sources including large data sets, develop insights and recommendations and convey complex information through the use of supporting tables, graphs and other visual representations required. </p><p>Experience with large-scale higher education databases including IPEDS preferred.</p><p>Experience employing both qualitative and quantitative research methods preferred.</p><p>
</p><p>Experience taking the lead to independently initiate, plan and drive multiple projects preferred.</p><p>
</p><p>Excellent communication skills, including the ability to simplify complex concepts in writing, visualizations, and verbal presentations tailored for diverse groups of stakeholders preferred.</p><p><strong> </strong></p><p><undefined><strong>Qualifications and Skills</undefined></strong></p><p>
</p><p><strong>SOFTWARE SKILLS REQUIRED:</strong></p><p>Knowledge of O365 with intermediate to advanced knowledge in Word and Excel. Must be proficient in mail merges and correcting source or cell errors. Must be proficient in the manipulation of Excel formulas.</p><p> </p><p><strong>WORK ENVIRONMENT </strong></p><p>Reasonable accommodations may be made to enable individuals with disabilities to perform the essential functions. The noise level in the work environment is usually moderate.</p><p> </p><p><strong>COMPENSATION AND BENEFITS </strong></p><p><strong> </strong></p><p><strong>Benefits include:</strong></p><p>Medical, Dental & Vision</p><p>Vacation, Sick & Personal Leave </p><p>Life Insurance (Basic & Optional)</p><p>Flex Spending Accounts</p><p>403(b) Retirement Account</p><p>Holiday Savings Plan</p><p> </p><p><strong>Salary Range: </strong>$58,700.00 To $66,400.00 per year (Salary is commensurate with experience.)</p><p> </p><p>UNCF is EOE M/F/D/V</p>","UNCF","https://www.linkedin.com/jobs/view/3833142367/","Washington, District of Columbia, United States","Skills: Data Analytics, Data Science, +4 more","51-200 employees
2 school alumni work here","LISTED","436620913","UNCF","https://media.licdn.com/dms/image/C560BAQHHDcnd9X-S1Q/company-logo_400_400/0/1650922872012/united_negro_college_fund_logo?e=1716422400&v=beta&t=JFGwwbjkyTB10YNzw2RqpedNei4K_Gz9hjqCP0lx4KQ","2024-02-17T13:31:39.000Z","2024-02-22T22:36:18.464Z"
"Senior Data Analyst, External Games","Now is an amazing time to join Netflix as we seek to entertain the world. We have over 200 million paid members in over 190 countries, and we won’t stop there. Games are our next big frontier and an incredible opportunity for us to deliver new experiences to delight and entertain our quickly growing membership. You will be jumping in at the early stages of this adventure and be in a position to help us redefine what a Netflix subscription means for our members around the world.

Data Science and Engineering (‘DSE’) at Netflix is aimed at using data, analytics, and sciences to improve various aspects of our business. We are looking for a Senior Analytics Engineer to join our Games DSE team, leading end-to-end analytics & data needs for the Games space. This role will be partnering closely with our Game stakeholders to define key metrics, build and maintain key dashboards and analytic tools and scale data access across our stakeholder set. As an early member of the team, you will also help shape our overall Games Data Strategy at Netflix.


What You Will Do


Partner directly with our Game stakeholders (e.g., Netflix Games Studio, Games Product, Game Strategy, Planning & Analysis team) on data, metrics & analytics initiativesLead end-to-end development of reports/dashboards/tools used by your direct stakeholders and a diverse set of teams across the companyProactively perform data exploration and analytical deep dives to discover insights or future testing opportunitiesBe a bridge between the business and tech, scaling access to insights that can empower better decision-makingMaintain and rethink existing data solutions to service a wider variety of use cases Balance handling ad hoc requests while also driving larger projects forward



Who You Are


6+ years of experience in data analytics function in gaming industryExtensive experience in driving Live Service performance insightsYou are an engineering-minded analyst with a strong bias towards action, delivering results quickly with iteration instead of waiting for perfectionYou are comfortable taking vague requirements and crystallizing them into valuable tools, metrics, or analysis.You have strong technical skills in manipulating large data sets with complex SQL and Python (or similar languages), big data technologies (e.g., Hadoop, Spark) and visualization tools (e.g., Tableau)You are a self-starter that can work effectively in a fast-paced, ambiguous environment with changing priorities and minimally defined processesYou are experienced in managing stakeholder asks, expectations, and relationships across a variety of stakeholders


Our compensation structure consists solely of an annual salary; we do not have bonuses. You choose each year how much of your compensation you want in salary versus stock options. To determine your personal top of market compensation, we rely on market indicators and consider your specific job family, background, skills, and experience to determine your compensation in the market range. The range for this role is $170,000 - $720,000.

Netflix provides comprehensive benefits including Health Plans, Mental Health support, a 401(k) Retirement Plan with employer match, Stock Option Program, Disability Programs, Health Savings and Flexible Spending Accounts, Family-forming benefits, and Life and Serious Injury Benefits. We also offer paid leave of absence programs. Full-time hourly employees accrue 35 days annually for paid time off to be used for vacation, holidays, and sick paid time off. Full-time salaried employees are immediately entitled to flexible time off. See more detail about our Benefits here.

Netflix is a unique culture and environment. Learn more here.","Now is an amazing time to join Netflix as we seek to entertain the world. We have over 200 million paid members in over 190 countries, and we won’t stop there. Games are our next big frontier and an incredible opportunity for us to deliver new experiences to delight and entertain our quickly growing membership. You will be jumping in at the early stages of this adventure and be in a position to help us redefine what a Netflix subscription means for our members around the world.

Data Science and Engineering (‘DSE’) at Netflix is aimed at using data, analytics, and sciences to improve various aspects of our business. We are looking for a Senior Analytics Engineer to join our Games DSE team, leading end-to-end analytics & data needs for the Games space. This role will be partnering closely with our Game stakeholders to define key metrics, build and maintain key dashboards and analytic tools and scale data access across our stakeholder set. As an early member of the team, you will also help shape our overall Games Data Strategy at Netflix.


<strong>What You Will Do


</strong><ul><li>Partner directly with our Game stakeholders (e.g., Netflix Games Studio, Games Product, Game Strategy, Planning & Analysis team) on data, metrics & analytics initiatives</li><li>Lead end-to-end development of reports/dashboards/tools used by your direct stakeholders and a diverse set of teams across the company</li><li>Proactively perform data exploration and analytical deep dives to discover insights or future testing opportunities</li><li>Be a bridge between the business and tech, scaling access to insights that can empower better decision-making</li><li>Maintain and rethink existing data solutions to service a wider variety of use cases </li><li>Balance handling ad hoc requests while also driving larger projects forward



</li></ul><strong>Who You Are


</strong><ul><li>6+ years of experience in data analytics function in gaming industry</li><li>Extensive experience in driving Live Service performance insights</li><li>You are an engineering-minded analyst with a strong bias towards action, delivering results quickly with iteration instead of waiting for perfection</li><li>You are comfortable taking vague requirements and crystallizing them into valuable tools, metrics, or analysis.</li><li>You have strong technical skills in manipulating large data sets with complex SQL and Python (or similar languages), big data technologies (e.g., Hadoop, Spark) and visualization tools (e.g., Tableau)</li><li>You are a self-starter that can work effectively in a fast-paced, ambiguous environment with changing priorities and minimally defined processes</li><li>You are experienced in managing stakeholder asks, expectations, and relationships across a variety of stakeholders


</li></ul>Our compensation structure consists solely of an annual salary; we do not have bonuses. You choose each year how much of your compensation you want in salary versus stock options. To determine your personal top of market compensation, we rely on market indicators and consider your specific job family, background, skills, and experience to determine your compensation in the market range. The range for this role is $170,000 - $720,000.

Netflix provides comprehensive benefits including Health Plans, Mental Health support, a 401(k) Retirement Plan with employer match, Stock Option Program, Disability Programs, Health Savings and Flexible Spending Accounts, Family-forming benefits, and Life and Serious Injury Benefits. We also offer paid leave of absence programs. Full-time hourly employees accrue 35 days annually for paid time off to be used for vacation, holidays, and sick paid time off. Full-time salaried employees are immediately entitled to flexible time off. See more detail about our Benefits here.

Netflix is a unique culture and environment. Learn more here.","Netflix","https://www.linkedin.com/jobs/view/3818061255/","Los Angeles, California, United States","7 of 10 skills match your profile - you may be a good fit","10,001+ employees · Entertainment Providers
22 school alumni work here","LISTED","368130583","Netflix","https://media.licdn.com/dms/image/C4E0BAQEVb0ZISWk8vQ/company-logo_400_400/0/1631355051964?e=1716422400&v=beta&t=M0xglq7Le5015H4z6jhz_jB5Wp-CLhZ8B17zJqwEwsY","2024-01-30T20:37:41.000Z","2024-02-22T22:36:18.464Z"
