"Title","Description","Description HTML","Primary Description","Detail URL","Location","Skill","Insight","Job State","Poster Id","Company Name","Company Logo","Created At","Scraped At"
"Senior Data Analyst","WHO WE ARE:

ActBlue is a nonprofit that builds tech and infrastructure for Democratic campaigns, progressive-aligned causes, and people trying to make an impact in order to fuel long-term, people-powered change. If you’ve ever given online to a Democrat or progressive organization, chances are you’ve used our powerful online fundraising platform.

We put power in the hands of small-dollar donors and help thousands of groups — from presidential candidates to environmental organizations — build grassroots movements. We envision a democracy where everyone looking to make progressive people-powered change can easily and effectively deploy their resources, energy, and creativity to shape our country and futures. Each and every one of us, from the political activists to the tech innovators to the customer service pros, is fully committed to our mission.

THE OPPORTUNITY:

As a Senior Data Analyst, you will work with our analytics platform and data warehouse to analyze and interpret data, to provide insights in the form of data visualizations and written reports for the purposes of helping internal stakeholders deliver on strategic goals. We are actively recruiting for multiple Data Analysts.

WHAT YOU WILL DO:

Work directly with stakeholders to understand their data needs and translate metrics into actionable insightsCollaborate with customers within the following teams: Product, Finance, Outreach, Marketing, Communications, and other teamsBuild dashboards and reports that enable stakeholders to make data informed business decisions Regularly present insights and discoveries verbally, visually, and in writingSuggest and surface improvements to data modelsTroubleshoot issues in dashboards, reports, and other data deliverables Gather data requirements supporting new data product requests Collaborate with colleagues through code reviews and technical designAdd to existing dbt pipelines or create new ones from scratchServe as a resource and thought partner to colleagues Build and maintain subject matter expertise in ActBlue’s operations and generate recommendations on how to further grow ActBlue’s analytical capabilitiesAct as a deeply empathetic and knowledgeable partner to our stakeholders, committed to their mission successBe a ready and active participant in the on call rotation 

WHAT YOU'LL BRING:

3-5 years experience in a data analytics, business intelligence, or data science roleStrong comfort and proficiency in SQL and Python or R to solve for business problems 3+ years of working with business intelligence tools such as Mixpanel and LookerStrong ability to self prioritize, work independently, and balance competing priorities3+ years of analytics experience in marketing, product, finance, or salesDemonstrated ability to break down ambiguous analysis requests into logical sequences towards a solution Experience with statistical analysis and techniques such as logistic regression, forecasting, and significance testing OR Applied statistics or mathematical analysis in a business environment such as descriptive statistics, testing, and modeling (logisitic and linear regression) Experience with dbt a plusExperience with data modeling and data warehousing a plusExperience working on an Agile team a plusExperience with version control such as Github Outstanding stakeholder orientation and a strong desire to be of service.Pluses: political or non-profit experience either professional or volunteer 

LOCATION AND COMPENSATION: 

This posting is for a full-time, remote, salaried position. Travel may be required on a limited basis to attend all-staff and departmental retreats (1-2 times per year). Additional travel may be required for select positions. Our roles predominantly require availability during established business hours (Mon-Fri). Employees in this role are expected to be a part of an on-call rotation which will result in working nontraditional hours as needed.

ATS is currently authorized to support remote work employees in Arizona, California, Connecticut, Colorado, Florida, Georgia, Hawaii, Illinois, Maryland, Massachusetts, Michigan, Minnesota, Missouri, New Hampshire, New York, North Carolina, North Dakota, Ohio, Oregon, Pennsylvania, Rhode Island, South Carolina, Texas, Utah, Vermont, Virginia, Washington, Washington D.C. and Wisconsin.

Employees can expect to work with distributed teams across all U.S. time zones. Our roles require extended technology usage, and proficiency with virtual communication tools such as Zoom and Slack. Regular attendance in virtual meetings is inherent to every position.

Salary Range Details:

Salary Range: $141,906 - $153,026 

ActBlue is committed to consistent compensation practices across our organization. Final salary offers will take into account factors such as candidate experience, interview performance and current team salary parity.

BENEFITS:

Flexible work schedules and an unlimited time-off policyFully paid and trans-inclusive health, dental, and vision insurance for employees and their families; plus fully-paid health reimbursement arrangement to use for out of pocket expenses and fully-paid short- and long-term disability Fully paid basic and AD&D life insurance and a voluntary supplemental life insurance optionDependent and health care flexible spending account optionsEmployee Assistance Program (EAP) benefits for employees Automatic 2% Employer-paid 401K contribution, plus up to an additional 6% match on employee contributionsA minimum of three months paid medical, family and parental leave (for all new parents, adoptions included)Commuter or home-office benefits, including a $1,000 home-office setup allowance for all new full-time remote employeesAdditional perks including quarterly snack deliveries and digital subscriptions to the Boston Globe & New York Times

ActBlue is unable to sponsor work visas at this time.

Bargaining Unit position: The terms and conditions of this position are subject to a collective bargaining agreement with the Communications Workers of America, the exclusive bargaining agent of covered ActBlue Technical Services employees.

INCLUSION STATEMENT:

ActBlue is deeply committed to the principle of equal employment opportunity. We commit to retaining, developing, recruiting, and hiring a diverse staff community. We honor the dignity of all. We celebrate their unique qualities. And we recognize the wide range of human differences, backgrounds, and intersectional identities that enrich the workspace and help us better meet our mission. If you feel a connection to our mission and see your interests reflected in this job description we encourage you to apply - even if you don’t meet every requirement.

ActBlue is committed to providing reasonable accommodations to individuals with disabilities throughout the interview and employment process, including using our online system to apply for a position. If you would like to request an accommodation, please contact us at recruitment@actblue.com to get started.

ActBlue will never ask candidates to buy equipment, nor will we email from anything other than an actblue.com or actbluetech.com email address.","<strong>WHO WE ARE:

</strong>ActBlue is a nonprofit that builds tech and infrastructure for Democratic campaigns, progressive-aligned causes, and people trying to make an impact in order to fuel long-term, people-powered change. If you’ve ever given online to a Democrat or progressive organization, chances are you’ve used our powerful online fundraising platform.

We put power in the hands of small-dollar donors and help thousands of groups — from presidential candidates to environmental organizations — build grassroots movements. We envision a democracy where everyone looking to make progressive people-powered change can easily and effectively deploy their resources, energy, and creativity to shape our country and futures. Each and every one of us, from the political activists to the tech innovators to the customer service pros, is fully committed to our mission.

<strong>THE OPPORTUNITY:

</strong>As a Senior Data Analyst, you will work with our analytics platform and data warehouse to analyze and interpret data, to provide insights in the form of data visualizations and written reports for the purposes of helping internal stakeholders deliver on strategic goals. We are actively recruiting for multiple Data Analysts.

<strong>WHAT YOU WILL DO:

</strong><ul><li>Work directly with stakeholders to understand their data needs and translate metrics into actionable insights</li><li>Collaborate with customers within the following teams: Product, Finance, Outreach, Marketing, Communications, and other teams</li><li>Build dashboards and reports that enable stakeholders to make data informed business decisions </li><li>Regularly present insights and discoveries verbally, visually, and in writing</li><li>Suggest and surface improvements to data models</li><li>Troubleshoot issues in dashboards, reports, and other data deliverables </li><li>Gather data requirements supporting new data product requests </li><li>Collaborate with colleagues through code reviews and technical design</li><li>Add to existing dbt pipelines or create new ones from scratch</li><li>Serve as a resource and thought partner to colleagues </li><li>Build and maintain subject matter expertise in ActBlue’s operations and generate recommendations on how to further grow ActBlue’s analytical capabilities</li><li>Act as a deeply empathetic and knowledgeable partner to our stakeholders, committed to their mission success</li><li>Be a ready and active participant in the on call rotation 

</li></ul><strong>WHAT YOU'LL BRING:

</strong><ul><li>3-5 years experience in a data analytics, business intelligence, or data science role</li><li>Strong comfort and proficiency in SQL and Python or R to solve for business problems </li><li>3+ years of working with business intelligence tools such as Mixpanel and Looker</li><li>Strong ability to self prioritize, work independently, and balance competing priorities</li><li>3+ years of analytics experience in marketing, product, finance, or sales</li><li>Demonstrated ability to break down ambiguous analysis requests into logical sequences towards a solution </li><li>Experience with statistical analysis and techniques such as logistic regression, forecasting, and significance testing OR Applied statistics or mathematical analysis in a business environment such as descriptive statistics, testing, and modeling (logisitic and linear regression) </li><li>Experience with dbt a plus</li><li>Experience with data modeling and data warehousing a plus</li><li>Experience working on an Agile team a plus</li><li>Experience with version control such as Github </li><li>Outstanding stakeholder orientation and a strong desire to be of service.</li><li>Pluses: political or non-profit experience either professional or volunteer 

</li></ul><strong>LOCATION AND COMPENSATION: 

</strong>This posting is for a full-time, remote, salaried position. Travel may be required on a limited basis to attend all-staff and departmental retreats (1-2 times per year). Additional travel may be required for select positions. Our roles predominantly require availability during established business hours (Mon-Fri). Employees in this role are expected to be a part of an on-call rotation which will result in working nontraditional hours as needed.

ATS is currently authorized to support remote work employees in Arizona, California, Connecticut, Colorado, Florida, Georgia, Hawaii, Illinois, Maryland, Massachusetts, Michigan, Minnesota, Missouri, New Hampshire, New York, North Carolina, North Dakota, Ohio, Oregon, Pennsylvania, Rhode Island, South Carolina, Texas, Utah, Vermont, Virginia, Washington, Washington D.C. and Wisconsin.

Employees can expect to work with distributed teams across all U.S. time zones. Our roles require extended technology usage, and proficiency with virtual communication tools such as Zoom and Slack. Regular attendance in virtual meetings is inherent to every position.

<strong>Salary Range Details:

</strong><strong>Salary Range: $141,906 - $153,026 

</strong>ActBlue is committed to consistent compensation practices across our organization. Final salary offers will take into account factors such as candidate experience, interview performance and current team salary parity.

<strong>BENEFITS:

</strong><ul><li>Flexible work schedules and an unlimited time-off policy</li><li>Fully paid and trans-inclusive health, dental, and vision insurance for employees and their families; plus fully-paid health reimbursement arrangement to use for out of pocket expenses and fully-paid short- and long-term disability </li><li>Fully paid basic and AD&D life insurance and a voluntary supplemental life insurance option</li><li>Dependent and health care flexible spending account options</li><li>Employee Assistance Program (EAP) benefits for employees </li><li>Automatic 2% Employer-paid 401K contribution, plus up to an additional 6% match on employee contributions</li><li>A minimum of three months paid medical, family and parental leave (for all new parents, adoptions included)</li><li>Commuter or home-office benefits, including a $1,000 home-office setup allowance for all new full-time remote employees</li><li>Additional perks including quarterly snack deliveries and digital subscriptions to the Boston Globe & New York Times

</li></ul><strong>ActBlue is unable to sponsor work visas at this time.

</strong>Bargaining Unit position: The terms and conditions of this position are subject to a collective bargaining agreement with the Communications Workers of America, the exclusive bargaining agent of covered ActBlue Technical Services employees.

<strong>INCLUSION STATEMENT:

</strong>ActBlue is deeply committed to the principle of equal employment opportunity. We commit to retaining, developing, recruiting, and hiring a diverse staff community. We honor the dignity of all. We celebrate their unique qualities. And we recognize the wide range of human differences, backgrounds, and intersectional identities that enrich the workspace and help us better meet our mission. If you feel a connection to our mission and see your interests reflected in this job description we encourage you to apply - even if you don’t meet every requirement.

ActBlue is committed to providing reasonable accommodations to individuals with disabilities throughout the interview and employment process, including using our online system to apply for a position. If you would like to request an accommodation, please contact us at recruitment@actblue.com to get started.

<ul><li>ActBlue will never ask candidates to buy equipment, nor will we email from anything other than an actblue.com or actbluetech.com email address.</li></ul>","ActBlue · United States (Remote)","https://www.linkedin.com/jobs/view/3862518474/","United States","Skills: Data Analytics, Data Science, +8 more","201-500 employees · Political Organizations
8 school alumni work here","LISTED","88961087","ActBlue","https://media.licdn.com/dms/image/C4E0BAQF9a4m8jKbYkw/company-logo_400_400/0/1678471320665/actblue_logo?e=1718841600&v=beta&t=FNExo8m-ZZDY6zG5fKIjeoe6GvIyIV2LHWfYgvPfjj0","2024-03-18T16:20:39.000Z","2024-03-21T15:58:14.260Z"
"Data Analytics and Visualization Consultant","Are you a Federal Data Analytics/ Informatics subject matter expert with technical/functional Medicare Data Analytics experience? Do you want to help us transform the Medicare market as it embraces modularization, and we help our clients create a new future for Medicaid technology?

Work you'll do

Provide expertise on Medicare (preferably Claims) Healthcare Analytics

Develop healthcare data analysis visualizations and support data linkages to those visualizations

Perform data modeling, database development and management

Develop user stories and mockups for data visualization

Perform coding and testing of data visualizations using open source or visualization packages such as Tableau.

Drive client conversations around data design and analytics.

Implement technology-enabled business solutions for clients as part of a high-talent team.

The Team

Our Health Technology team implements repeatable solutions to solve our government clients' most critical health technology related issues. We advise on, design, implement and deploy solutions focused on government health agencies ""heart of the business"" issues including claims management, electronic health records, health information exchanges, health analytics and health case management.Our clients seek a fresh perspective on how to leverage reusable, interoperable and flexible solutions that will enable them to reduce costs, improve health outcomes and respond to public health crises. Professionals will use their deep health, government and technology consulting experience to strategically help solve our client's technology challenges.

Qualifications

Required:

2+ years of experience working within a Health Tech environment

Bachelor's degree from accredited college or university

Healthcare Data Informatics/ Analytics experience

Must be legally authorized to work in the United States without the need for employer sponsorship, now or at any time in the future

Desired:

Working knowledge of healthcare claims data, preferably Medicare data.

Technical data analysis skills, working with measures, statistical packages, and/or coding languages.

Experience developing healthcare data analysis visualizations and supporting data linkages to those visualizations.

Experience with data modeling and database development and management.

Experience coding and testing data visualizations using open source or visualization packages such as Tableau or SAS.

Strong communication and management skills.

Preferred Bachelor's Degree in healthcare and/or computer science or experience equivalent.

Ability to travel up to 50%

The wage range for this role takes into account the wide range of factors that are considered in making compensation decisions including but not limited to skill sets; experience and training; licensure and certifications; and other business and organizational needs. The disclosed range estimate has not been adjusted for the applicable geographic differential associated with the location at which the position may be filled. At Deloitte, it is not typical for an individual to be hired at or near the top of the range for their role and compensation decisions are dependent on the facts and circumstances of each case. A reasonable estimate of the current range is $80,000 to $130,000. You may also be eligible to participate in a discretionary annual incentive program, subject to the rules governing the program, whereby an award, if any, depends on various factors, including, without limitation, individual and organizational performance.

Information for applicants with a need for accommodation: https://www2.deloitte.com/us/en/pages/careers/articles/join-deloitte-assistance-for-disabled-applicants.html","Are you a Federal Data Analytics/ Informatics subject matter expert with technical/functional Medicare Data Analytics experience? Do you want to help us transform the Medicare market as it embraces modularization, and we help our clients create a new future for Medicaid technology?

<strong>Work you'll do

</strong>Provide expertise on Medicare (preferably Claims) Healthcare Analytics

Develop healthcare data analysis visualizations and support data linkages to those visualizations

Perform data modeling, database development and management

Develop user stories and mockups for data visualization

Perform coding and testing of data visualizations using open source or visualization packages such as Tableau.

Drive client conversations around data design and analytics.

Implement technology-enabled business solutions for clients as part of a high-talent team.

<strong>The Team

</strong>Our Health Technology team implements repeatable solutions to solve our government clients' most critical health technology related issues. We advise on, design, implement and deploy solutions focused on government health agencies ""heart of the business"" issues including claims management, electronic health records, health information exchanges, health analytics and health case management.Our clients seek a fresh perspective on how to leverage reusable, interoperable and flexible solutions that will enable them to reduce costs, improve health outcomes and respond to public health crises. Professionals will use their deep health, government and technology consulting experience to strategically help solve our client's technology challenges.

<strong>Qualifications

</strong><strong>Required:

</strong>2+ years of experience working within a Health Tech environment

Bachelor's degree from accredited college or university

Healthcare Data Informatics/ Analytics experience

Must be legally authorized to work in the United States without the need for employer sponsorship, now or at any time in the future

<strong>Desired:

</strong>Working knowledge of healthcare claims data, preferably Medicare data.

Technical data analysis skills, working with measures, statistical packages, and/or coding languages.

Experience developing healthcare data analysis visualizations and supporting data linkages to those visualizations.

Experience with data modeling and database development and management.

Experience coding and testing data visualizations using open source or visualization packages such as Tableau or SAS.

Strong communication and management skills.

Preferred Bachelor's Degree in healthcare and/or computer science or experience equivalent.

Ability to travel up to 50%

The wage range for this role takes into account the wide range of factors that are considered in making compensation decisions including but not limited to skill sets; experience and training; licensure and certifications; and other business and organizational needs. The disclosed range estimate has not been adjusted for the applicable geographic differential associated with the location at which the position may be filled. At Deloitte, it is not typical for an individual to be hired at or near the top of the range for their role and compensation decisions are dependent on the facts and circumstances of each case. A reasonable estimate of the current range is $80,000 to $130,000. You may also be eligible to participate in a discretionary annual incentive program, subject to the rules governing the program, whereby an award, if any, depends on various factors, including, without limitation, individual and organizational performance.

Information for applicants with a need for accommodation: https://www2.deloitte.com/us/en/pages/careers/articles/join-deloitte-assistance-for-disabled-applicants.html","Deloitte · Rockville, MD (Hybrid)","https://www.linkedin.com/jobs/view/3854359644/","Rockville, Maryland, United States","9 of 10 skills match your profile - you may be a good fit","10,001+ employees · Business Consulting and Services
5 connections work here · 205 school alumni work here","LISTED","18266078","Deloitte","https://media.licdn.com/dms/image/C560BAQGNtpblgQpJoQ/company-logo_400_400/0/1662120928214/deloitte_logo?e=1718841600&v=beta&t=oXb_H2vQvDDFaptzbh1upIrtf6FK1rzzCI67j0j9dnI","2024-03-14T20:59:04.000Z","2024-03-21T15:58:14.260Z"
