"Title","Description","Description HTML","Primary Description","Detail URL","Location","Skill","Insight","Job State","Poster Id","Company Name","Company Logo","Created At","Scraped At"
"Senior Data Analyst","Job Description:

Job Overview

The Sr Data Analyst will support the Client Analytics and Client Management team to provide analytical support to client account teams. The Sr Data Analyst will apply their knowledge of data analytics, research, and critical thinking to turn information into insights and recommended optimal solutions, empowering internal and external stakeholders to implement data driven fleet strategies.

Please note that this description is not all-encompassing as other ad hoc tasks are expected of the position.

Key Responsibilities/Essential Functions

Collaborate with internal and external stakeholders to help shape the strategic direction of the fleet by defining and tracking actionable initiatives that maximize savings, compliance, safety, and other defined goals.Strong analytical and quantitative skills, with a solid understanding of statistical methods and data analysis techniquesLeverage effective communication, data visualization, and presentation skills to deliver findings of analysis and explain complex statistical concepts to a non-technical audience.Work independently and with stakeholders to define ad hoc analyses and develop simple modeling tools and repeatable business process.Sift through the complexities of requests to create an understanding of end state to be presented before beginning the work.Monitor and evaluate the effectiveness of implemented initiatives and recommend adjustments, as necessary.Provide an attention to detail and ability to identify and correct errors in data.Utilize analytical, technical, time management and organization skills to help account teams communicate professionally, effectively and efficiently with clients and prospects using a full suite of internal tools and 3rd party software.Utilize Tableau to develop interactive dashboards, reports, and visualizations that effectively communicate complex data analysis findings to stakeholders.Train others on the Wheels tools and databases to provide an understanding of data access, fleet metrics, and fleet reports.Present Wheels tools with a high level of confidence and self-sufficiencyDevelop KPIs and benchmarking methods to assess the effectiveness of strategic initiatives.Partner with the Business Intelligence team to design, test, and implement tools and models

Leadership Responsibilities

This position has no leadership responsibilities.

COMPETENCIES

Comfort in presenting complex data to high level executives in an easy-to-understand story.Ability to use and present a wide variety of Wheels Analytics tools.Familiarity with SQL, Python, and TableauFamiliarity with the fleet industry a plus, including an understanding of industry-specific metrics, trends, and challenges.Proven experience in data analysis, preferably in a consulting or advisory role

Education/Experience & Knowledge/Skills

Bachelors Required; Preferences towards concentration in Finance, Computer Science, Business Administration, or an Analytical concentration2-4 years’ work experience with background in Finance/FP&A, Management Consulting, Computer Science, or Account Management

JOB SPECIFICATIONS/ PHYSICAL DEMANDS & WORK ENVIRONMENT

Leadership Responsibility: This position has no leadership responsibilities.

Work Environment: This position is in Alpharetta, GA or Des Plaines, IL and operates in a professional office environment.

Position Type/Standard Schedule: This is a Full-time position and hours of work are Monday through Friday; 8:30 a.m. to 5 p.m.

Travel: Occasional travel (less than 10%) is expected for this position to visit with client.

Physical Demands: While performing the duties of this job, the employee must regularly talk and hear, and use hands and fingers to operate call center tools.

DISCLAIMER

Please note this job description is not designed to cover or contain a comprehensive listing of activities, duties, or responsibilities that are required of the employee for this job. Duties, responsibilities, and activities may change at any time with or without notice.

EEO StatementWheels is a Drug-Free Workplace. All employment is contingent on successful completion of drug and background screening.

Wheels is an equal opportunity affirmative action employer and administers all personnel practices without regard to race, color, religion, sex, age, national origin, sexual orientation, gender identity or expression, marital status or domestic partnership status, disability, protected veteran status or military status, genetic information, or any other category protected under applicable law. Wheels is committed to taking affirmative steps to promote the employment and advancement of minorities, women, persons with disabilities and protected veterans.","<strong><strong>Job Description:

</strong></strong><strong>Job Overview

</strong>The Sr Data Analyst will support the Client Analytics and Client Management team to provide analytical support to client account teams. The Sr Data Analyst will apply their knowledge of data analytics, research, and critical thinking to turn information into insights and recommended optimal solutions, empowering internal and external stakeholders to implement data driven fleet strategies.

Please note that this description is not all-encompassing as other ad hoc tasks are expected of the position.

<strong>Key Responsibilities/Essential Functions

</strong><ul><li>Collaborate with internal and external stakeholders to help shape the strategic direction of the fleet by defining and tracking actionable initiatives that maximize savings, compliance, safety, and other defined goals.</li><li>Strong analytical and quantitative skills, with a solid understanding of statistical methods and data analysis techniques</li><li>Leverage effective communication, data visualization, and presentation skills to deliver findings of analysis and explain complex statistical concepts to a non-technical audience.</li><li>Work independently and with stakeholders to define ad hoc analyses and develop simple modeling tools and repeatable business process.</li><li>Sift through the complexities of requests to create an understanding of end state to be presented before beginning the work.</li><li>Monitor and evaluate the effectiveness of implemented initiatives and recommend adjustments, as necessary.</li><li>Provide an attention to detail and ability to identify and correct errors in data.</li><li>Utilize analytical, technical, time management and organization skills to help account teams communicate professionally, effectively and efficiently with clients and prospects using a full suite of internal tools and 3rd party software.</li><li>Utilize Tableau to develop interactive dashboards, reports, and visualizations that effectively communicate complex data analysis findings to stakeholders.</li><li>Train others on the Wheels tools and databases to provide an understanding of data access, fleet metrics, and fleet reports.</li><li>Present Wheels tools with a high level of confidence and self-sufficiency</li><li>Develop KPIs and benchmarking methods to assess the effectiveness of strategic initiatives.</li><li>Partner with the Business Intelligence team to design, test, and implement tools and models

</li></ul><strong>Leadership Responsibilities

</strong><ul><li>This position has no leadership responsibilities.

</li></ul><strong>COMPETENCIES

</strong><ul><li>Comfort in presenting complex data to high level executives in an easy-to-understand story.</li><li>Ability to use and present a wide variety of Wheels Analytics tools.</li><li>Familiarity with SQL, Python, and Tableau</li><li>Familiarity with the fleet industry a plus, including an understanding of industry-specific metrics, trends, and challenges.</li><li>Proven experience in data analysis, preferably in a consulting or advisory role

</li></ul><strong>Education/Experience & Knowledge/Skills

</strong><ul><li>Bachelors Required; Preferences towards concentration in Finance, Computer Science, Business Administration, or an Analytical concentration</li><li>2-4 years’ work experience with background in Finance/FP&A, Management Consulting, Computer Science, or Account Management

</li></ul><strong>JOB SPECIFICATIONS/ PHYSICAL DEMANDS & WORK ENVIRONMENT

</strong><strong>Leadership Responsibility:</strong> This position has no leadership responsibilities.

<strong>Work Environment</strong>: This position is in Alpharetta, GA or Des Plaines, IL and operates in a professional office environment.

<strong>Position Type/Standard Schedule:</strong> This is a Full-time position and hours of work are Monday through Friday; 8:30 a.m. to 5 p.m.

<strong>Travel:</strong> Occasional travel (less than 10%) is expected for this position to visit with client.

<strong>Physical Demands:</strong> While performing the duties of this job, the employee must regularly talk and hear, and use hands and fingers to operate call center tools.

<strong>DISCLAIMER

</strong>Please note this job description is not designed to cover or contain a comprehensive listing of activities, duties, or responsibilities that are required of the employee for this job. Duties, responsibilities, and activities may change at any time with or without notice.

<strong><strong>EEO Statement</strong></strong><strong><strong>Wheels is a Drug-Free Workplace. All employment is contingent on successful completion of drug and background screening.

Wheels is an equal opportunity affirmative action employer and administers all personnel practices without regard to race, color, religion, sex, age, national origin, sexual orientation, gender identity or expression, marital status or domestic partnership status, disability, protected veteran status or military status, genetic information, or any other category protected under applicable law. Wheels is committed to taking affirmative steps to promote the employment and advancement of minorities, women, persons with disabilities and protected veterans.</strong></strong>","Wheels, Inc.","https://www.linkedin.com/jobs/view/3797841731/","Alpharetta, Georgia, United States","6 of 10 skills match your profile - you may be a good fit","1,001-5,000 employees · Financial Services
3 school alumni work here","LISTED","2484084","Wheels, Inc.","https://media.licdn.com/dms/image/C560BAQF2QumlQDaV7g/company-logo_400_400/0/1677692522229/wheels_inc__logo?e=1716422400&v=beta&t=fi6Jx3s23Dj_2peXZibzQL8Sz34k8d6A9KYfUgAswCo","2024-01-03T17:16:22.000Z","2024-02-22T22:36:18.464Z"
"Senior Data Analyst","Company Overview

ID.me is a high-growth enterprise software company that simplifies how people prove and share their identity online. The company empowers people to control their data through a portable and trusted login, which means they don’t need to create a new password when visiting sites that have the ID.me button. ID.me’s digital identity network has over 117 million registered members, and is used by fourteen federal agencies, agencies in 30 states and over 600 corporations for secure identity proofing and verification.

ID.me’s technology meets the federal standards for consumer authentication set by the Commerce Department and is approved as a NIST 800-63-3 IAL2 / AAL2 credential service provider by the Kantara Initiative. In addition to helping people control their credentials and data, the company’s “No Identity Left Behind” initiative strives to expand digital access and inclusion for all people. The company offers multiple pathways to identity verification – online self-serve, live video chat agents, and in person. ID.me is passionate about building a robust identity network that does not compromise access for traditionally underserved groups.

ID.me has received numerous awards including Deloitte’s 2023 Technology Fast 500, Washington Business Journal’s Fastest Growing Companies, Entrepreneur Magazine’s 100 Brilliant Companies and Wall Street Journal’s Startup of the Year finalist. In recent quarters, ID.me announced it raised $132 million in Series D funding, led by Viking Global Investors with participation from CapitalG, Morgan Stanley Counterpoint, FTV Capital, PSP Growth, Auctus Investment Group, Moonshots Capital, and Scout Ventures. ID.me’s most recent round brings the total investment in ID.me to over $275 million since its founding in 2010.

Role Overview

ID.me is a digital identity network with a mission to make the world a more trusted place by facilitating transparent and efficient interactions between people and organizations. We are looking for a Senior Data Analyst to join our growing data team and support our company-wide initiatives by quickly delivering insights, reviewing and developing metrics, and contributing to the improvement of business processes to support our explosive growth.

The ideal candidate must be interested in supporting a wide array of business initiatives across the overall company.

Responsibilities


Collect, analyze, and explain data to key stakeholders and executive leadershipRun reports and gather valuable insights from various analytical and statistical tools to interpret data sets Identify trends across data and make recommendations to senior managementBe a data evangelist: collaborate with both technical and non-technical teammates to supplement decisions with quantitative evidenceAlways be auditing: build and maintain processes to track data and troubleshoot errors Build and automate tools to surface key data to stakeholders across a broad range of data literacy levelsProvide ad hoc analysis and forecasting as needed across a diverse set of teams

Ideal Qualifications


5+ years in data analytics, experience in a hyper-growth company is a plusBachelor’s degree in a quantitative field such as Accounting, Economics, Engineering, Finance, Math, Statistics or similarData-driven, detail-oriented nature with excellent analysis and problem-solving abilitiesPrevious experience using data to communicate business metrics and key performance indicators to stakeholdersExcellent verbal and written communication skills: the ability to present complex data in a digestible format to stakeholders of all data literacy levelsFluency with SQL data manipulation, preferably using an ETL tool such as dbt, and experience with building models in ExcelComfortable creating dashboards in a BI framework such as Tableau, Looker, Looker Studio, or comparable toolsAbility to handle multiple projects simultaneously: superb time management and prioritization ability Ability to work independently and autonomously, as well as part of a team

Ideal candidate will thrive in the following culture:


Must have an obsession for data Ability to thrive when there are changing priorities and shifting of gearsStrong oral and written communication skillsMust be a team player with a strong, self-managing work ethicMust be a self-starter with a passion for learning and continuous improvement

The annual base salary listed below for this role is based on experience, skills, education, relevant training and geographic location. Company bonus, incentive for sales roles, equity, and benefits are available depending on the role.

ID.me offers comprehensive medical, dental, vision, health savings account, flexible spending accounts (medical, limited purpose, dependent care, commuter benefit accounts), basic and voluntary life and AD&D insurance, 401(k) with company match, parental leave, ability to participate in unlimited paid time off subject to the terms and conditions of the PTO policy, including 8 company wide holidays, short and long-term disability insurance, accident and critical illness insurance, referral bonus policy, employee assistance program, pet insurance, travel assistant program, wellbeing and childcare discounts, benefit advocates, and a learning and development benefit.

The above represents the anticipated total rewards package for this job requisition. Final offers may vary from the amount listed based on qualifications, professional experiences, skills, education, relevant training, geographic location, and other job related factors.

Pay Range

$107,197—$140,726 USD

ID.me maintains a work environment free from discrimination, where employees are treated with dignity and respect. All ID.me employees share in the responsibility for fulfilling our commitment to equal employment opportunity. ID.me does not discriminate against any employee or applicant on the basis of age, ancestry, color, family or medical care leave, gender identity or expression, genetic information, marital status, medical condition, national origin, physical or mental disability, political affiliation, protected veteran status, race, religion, sex (including pregnancy), sexual orientation, or any other characteristic protected by applicable laws, regulations and ordinances. ID.me adheres to these principles in all aspects of employment, including recruitment, hiring, training, compensation, promotion, benefits, social and recreational programs, and discipline. In addition, ID.me's policy is to provide reasonable accommodation to qualified employees who have protected disabilities to the extent required by applicable laws, regulations and ordinances where a particular employee works. Upon request we will provide you with more information about such accommodations.

Please review our Privacy Policy, including our CCPA policy, at id.me/privacy. If you provide ID.me with any personally identifiable information you confirm that you have read and agree to be bound by the terms and conditions set out in our Privacy Policy.

ID.me participates in E-Verify.

","<strong>Company Overview

</strong>ID.me is a high-growth enterprise software company that simplifies how people prove and share their identity online. The company empowers people to control their data through a portable and trusted login, which means they don’t need to create a new password when visiting sites that have the ID.me button. ID.me’s digital identity network has over 117 million registered members, and is used by fourteen federal agencies, agencies in 30 states and over 600 corporations for secure identity proofing and verification.

ID.me’s technology meets the federal standards for consumer authentication set by the Commerce Department and is approved as a NIST 800-63-3 IAL2 / AAL2 credential service provider by the Kantara Initiative. In addition to helping people control their credentials and data, the company’s “No Identity Left Behind” initiative strives to expand digital access and inclusion for all people. The company offers multiple pathways to identity verification – online self-serve, live video chat agents, and in person. ID.me is passionate about building a robust identity network that does not compromise access for traditionally underserved groups.

ID.me has received numerous awards including Deloitte’s 2023 Technology Fast 500, Washington Business Journal’s Fastest Growing Companies, Entrepreneur Magazine’s 100 Brilliant Companies and Wall Street Journal’s Startup of the Year finalist. In recent quarters, ID.me announced it raised $132 million in Series D funding, led by Viking Global Investors with participation from CapitalG, Morgan Stanley Counterpoint, FTV Capital, PSP Growth, Auctus Investment Group, Moonshots Capital, and Scout Ventures. ID.me’s most recent round brings the total investment in ID.me to over $275 million since its founding in 2010.

<strong>Role Overview

</strong>ID.me is a digital identity network with a mission to make the world a more trusted place by facilitating transparent and efficient interactions between people and organizations. We are looking for a <strong>Senior</strong> <strong>Data Analyst</strong> to join our growing data team and support our company-wide initiatives by quickly delivering insights, reviewing and developing metrics, and contributing to the improvement of business processes to support our explosive growth.

The ideal candidate must be interested in supporting a wide array of business initiatives across the overall company.

<strong>Responsibilities


</strong><ul><li>Collect, analyze, and explain data to key stakeholders and executive leadership</li><li>Run reports and gather valuable insights from various analytical and statistical tools to interpret data sets </li><li>Identify trends across data and make recommendations to senior management</li><li>Be a data evangelist: collaborate with both technical and non-technical teammates to supplement decisions with quantitative evidence</li><li>Always be auditing: build and maintain processes to track data and troubleshoot errors </li><li>Build and automate tools to surface key data to stakeholders across a broad range of data literacy levels</li><li>Provide ad hoc analysis and forecasting as needed across a diverse set of teams

</li></ul><strong>Ideal Qualifications


</strong><ul><li>5+ years in data analytics, experience in a hyper-growth company is a plus</li><li>Bachelor’s degree in a quantitative field such as Accounting, Economics, Engineering, Finance, Math, Statistics or similar</li><li>Data-driven, detail-oriented nature with excellent analysis and problem-solving abilities</li><li>Previous experience using data to communicate business metrics and key performance indicators to stakeholders</li><li>Excellent verbal and written communication skills: the ability to present complex data in a digestible format to stakeholders of all data literacy levels</li><li>Fluency with SQL data manipulation, preferably using an ETL tool such as dbt, and experience with building models in Excel</li><li>Comfortable creating dashboards in a BI framework such as Tableau, Looker, Looker Studio, or comparable tools</li><li>Ability to handle multiple projects simultaneously: superb time management and prioritization ability </li><li>Ability to work independently and autonomously, as well as part of a team

</li></ul>Ideal candidate will thrive in the following culture:


<ul><li>Must have an obsession for data </li><li>Ability to thrive when there are changing priorities and shifting of gears</li><li>Strong oral and written communication skills</li><li>Must be a team player with a strong, self-managing work ethic</li><li>Must be a self-starter with a passion for learning and continuous improvement

</li></ul>The annual base salary listed below for this role is based on experience, skills, education, relevant training and geographic location. Company bonus, incentive for sales roles, equity, and benefits are available depending on the role.

ID.me offers comprehensive medical, dental, vision, health savings account, flexible spending accounts (medical, limited purpose, dependent care, commuter benefit accounts), basic and voluntary life and AD&D insurance, 401(k) with company match, parental leave, ability to participate in unlimited paid time off subject to the terms and conditions of the PTO policy, including 8 company wide holidays, short and long-term disability insurance, accident and critical illness insurance, referral bonus policy, employee assistance program, pet insurance, travel assistant program, wellbeing and childcare discounts, benefit advocates, and a learning and development benefit.

The above represents the anticipated total rewards package for this job requisition. Final offers may vary from the amount listed based on qualifications, professional experiences, skills, education, relevant training, geographic location, and other job related factors.

Pay Range

$107,197—$140,726 USD

ID.me maintains a work environment free from discrimination, where employees are treated with dignity and respect. All ID.me employees share in the responsibility for fulfilling our commitment to equal employment opportunity. ID.me does not discriminate against any employee or applicant on the basis of age, ancestry, color, family or medical care leave, gender identity or expression, genetic information, marital status, medical condition, national origin, physical or mental disability, political affiliation, protected veteran status, race, religion, sex (including pregnancy), sexual orientation, or any other characteristic protected by applicable laws, regulations and ordinances. ID.me adheres to these principles in all aspects of employment, including recruitment, hiring, training, compensation, promotion, benefits, social and recreational programs, and discipline. In addition, ID.me's policy is to provide reasonable accommodation to qualified employees who have protected disabilities to the extent required by applicable laws, regulations and ordinances where a particular employee works. Upon request we will provide you with more information about such accommodations.

Please review our Privacy Policy, including our CCPA policy, at id.me/privacy. If you provide ID.me with any personally identifiable information you confirm that you have read and agree to be bound by the terms and conditions set out in our Privacy Policy.

ID.me participates in E-Verify.

","ID.me","https://www.linkedin.com/jobs/view/3809432352/","McLean, Virginia, United States","Skills: Key Performance Indicators, Dashboards, +8 more","1,001-5,000 employees · Software Development","LISTED","325669099","ID.me","https://media.licdn.com/dms/image/C560BAQFysq8diBBrQw/company-logo_400_400/0/1631315092212?e=1716422400&v=beta&t=6UjebohTsEidyS-x-Imqw2xXBrosR9M2xo1S1r-HeiQ","2024-01-19T15:20:33.000Z","2024-02-22T22:36:18.464Z"
