"Title","Description","Description HTML","Primary Description","Detail URL","Location","Skill","Insight","Job State","Poster Id","Company Name","Company Logo","Created At","Scraped At"
"Sr. Data Analyst","Job Description

Sr. Data Analyst 

Lead I – Software Engineering 

Who We Are

Born digital, UST transforms lives through the power of technology. We walk alongside our clients and partners, embedding innovation and agility into everything they do. We help them create transformative experiences and human-centered solutions for a better world.

UST is a mission-driven group of over 39,000+ practical problem solvers and creative thinkers in over 30+ countries. Our entrepreneurial teams are empowered to innovate, act nimbly, and create a lasting and sustainable impact for our clients, their customers, and the communities in which we live.

With us, you’ll create a boundless impact that transforms your career—and the lives of people across the world.

Visit us at UST.com .

You Are

UST is looking for a qualified Senior Data Analyst to ensure quality delivery of end-to-end business solutions. The ideal candidate must possess an excellent background in extracting, transforming, and loading data into the warehouse. The candidate must possess excellent written and verbal communication skills with the ability and collaborate effectively with domain and technical experts in the team.

The Opportunity

Act creatively to develop applications and select appropriate technical options, optimizing application development, maintenance, and performance by employing design patterns and reusing proven solutions, accounting for others' developmental activitiesInterpret the application/feature/component design to develop the same in accordance with specifications.Code, debug, test, document, and communicate product/component/feature development stages.Validate results with user representatives; integrate and commissions the overall solutionSelect appropriate technical options for development such as reusing, improving, or reconfiguration existing components or creating your own solutionsOptimises efficiency, cost, and quality.Influence and improve customer satisfactionExplain and communicate the design/development to the customerPerform and evaluate test results against product specificationsBreak down complex problems into logical componentsDevelop user interfaces, business software componentsUse data modelsEstimate time and effort required for developing/debugging features/componentsPerform and evaluate tests in the customer or target environmentEstimate time and effort required for developing/debugging features/componentsPerform and evaluate tests in the customer or target environmentMake quick decisions on technical/project-related challengesManage a Team, mentor, and handle people-related issues in a teamMaintain high motivation levels and positive dynamics in the team.Interface with other teams, designers, and other parallel practicesSet goals for self and team. Provide feedback to team membersCreate and articulate impactful technical presentationsFollow a high level of business etiquette in emails and other business communicationDrive conference calls with customers addressing customer questionsProactively ask for and offer helpBuild confidence with customers by meeting the deliverables on time with quality.Make appropriate utilization of Software / Hardware’s.Manage a Team, mentor, and handle people-related issues in a teamMaintain high motivation levels and positive dynamics in the team.Interface with other teams, designers, and other parallel practices

What You Need

Experience analyzing business requirements and converting them into data requirements such as reports, and data lifecycle management. They will analyze and interpret complex data sets to inform business decisions. Experience with leading and mentoring junior data analysts as well as communicating findings and recommendations to stakeholders and managementAbility to work under pressure, determine dependencies, and risks, facilitate planning; and handle multiple tasks..Strong analytical and problem-solving abilities

Compensation can differ depending on factors including but not limited to the specific office location, role, skill set, education, and level of experience.  As required by local law, UST provides a reasonable range of compensation for roles that may be hired in California, Colorado, New York or Washington as set forth below.  

Role Location: Atlanta, GA 

What We Believe

We’re proud to embrace the same values that have shaped UST since the beginning. Since day one, we’ve been building enduring relationships and a culture of integrity. And today, it's those same values that are inspiring us to encourage innovation from everyone, to champion diversity and inclusion, and to place people at the center of everything we do.

Humility

We will listen, learn, be empathetic and help selflessly in our interactions with everyone.

Humanity

Through business, we will better the lives of those less fortunate than ourselves.

Integrity

We honor our commitments and act with responsibility in all our relationships.

Equal Employment Opportunity Statement

UST is an Equal Opportunity Employer.

All qualified applicants will receive consideration for employment without regard to race, color, religion, sex, sexual orientation, gender identity, national origin, disability, or status as a protected veteran.

UST reserves the right to periodically redefine your roles and responsibilities based on the requirements of the organization and/or your performance.","<strong>Job Description

</strong><strong>Sr. Data Analyst 

</strong><strong>Lead I – Software Engineering 

</strong><strong>Who We Are

</strong>Born digital, UST transforms lives through the power of technology. We walk alongside our clients and partners, embedding innovation and agility into everything they do. We help them create transformative experiences and human-centered solutions for a better world.

UST is a mission-driven group of over 39,000+ practical problem solvers and creative thinkers in over 30+ countries. Our entrepreneurial teams are empowered to innovate, act nimbly, and create a lasting and sustainable impact for our clients, their customers, and the communities in which we live.

With us, you’ll create a boundless impact that transforms your career—and the lives of people across the world.

Visit us at UST.com .

<strong>You Are

</strong>UST is looking for a qualified Senior Data Analyst to ensure quality delivery of end-to-end business solutions. The ideal candidate must possess an excellent background in extracting, transforming, and loading data into the warehouse. The candidate must possess excellent written and verbal communication skills with the ability and collaborate effectively with domain and technical experts in the team.

<strong>The Opportunity

</strong><ul><li>Act creatively to develop applications and select appropriate technical options, optimizing application development, maintenance, and performance by employing design patterns and reusing proven solutions, accounting for others' developmental activities</li><li>Interpret the application/feature/component design to develop the same in accordance with specifications.</li><li>Code, debug, test, document, and communicate product/component/feature development stages.</li><li>Validate results with user representatives; integrate and commissions the overall solution</li><li>Select appropriate technical options for development such as reusing, improving, or reconfiguration existing components or creating your own solutions</li><li>Optimises efficiency, cost, and quality.</li><li>Influence and improve customer satisfaction</li><li>Explain and communicate the design/development to the customer</li><li>Perform and evaluate test results against product specifications</li><li>Break down complex problems into logical components</li><li>Develop user interfaces, business software components</li><li>Use data models</li><li>Estimate time and effort required for developing/debugging features/components</li><li>Perform and evaluate tests in the customer or target environment</li><li>Estimate time and effort required for developing/debugging features/components</li><li>Perform and evaluate tests in the customer or target environment</li><li>Make quick decisions on technical/project-related challenges</li><li>Manage a Team, mentor, and handle people-related issues in a team</li><li>Maintain high motivation levels and positive dynamics in the team.</li><li>Interface with other teams, designers, and other parallel practices</li><li>Set goals for self and team. </li><li>Provide feedback to team members</li><li>Create and articulate impactful technical presentations</li><li>Follow a high level of business etiquette in emails and other business communication</li><li>Drive conference calls with customers addressing customer questions</li><li>Proactively ask for and offer help</li><li>Build confidence with customers by meeting the deliverables on time with quality.</li><li>Make appropriate utilization of Software / Hardware’s.</li><li>Manage a Team, mentor, and handle people-related issues in a team</li><li>Maintain high motivation levels and positive dynamics in the team.</li><li>Interface with other teams, designers, and other parallel practices

</li></ul><strong>What You Need

</strong><ul><li>Experience analyzing business requirements and converting them into data requirements such as reports, and data lifecycle management. They will analyze and interpret complex data sets to inform business decisions. </li><li>Experience with leading and mentoring junior data analysts as well as communicating findings and recommendations to stakeholders and management</li><li>Ability to work under pressure, determine dependencies, and risks, facilitate planning; and handle multiple tasks..</li><li>Strong analytical and problem-solving abilities

</li></ul>Compensation can differ depending on factors including but not limited to the specific office location, role, skill set, education, and level of experience.  As required by local law, UST provides a reasonable range of compensation for roles that may be hired in California, Colorado, New York or Washington as set forth below.  

<strong>Role Location: Atlanta, GA 

</strong><strong>What We Believe

</strong>We’re proud to embrace the same values that have shaped UST since the beginning. Since day one, we’ve been building enduring relationships and a culture of integrity. And today, it's those same values that are inspiring us to encourage innovation from everyone, to champion diversity and inclusion, and to place people at the center of everything we do.

<strong>Humility

</strong>We will listen, learn, be empathetic and help selflessly in our interactions with everyone.

<strong>Humanity

</strong>Through business, we will better the lives of those less fortunate than ourselves.

<strong>Integrity

</strong>We honor our commitments and act with responsibility in all our relationships.

<strong>Equal Employment Opportunity Statement

</strong>UST is an Equal Opportunity Employer.

All qualified applicants will receive consideration for employment without regard to race, color, religion, sex, sexual orientation, gender identity, national origin, disability, or status as a protected veteran.

UST reserves the right to periodically redefine your roles and responsibilities based on the requirements of the organization and/or your performance.","UST","https://www.linkedin.com/jobs/view/3832454638/","Atlanta, Georgia, United States","Skills: Business Analytics, Analytical Skills, +8 more","10,001+ employees · IT Services and IT Consulting
1 connection works here · 2 school alumni work here","LISTED","779788470","UST","https://media.licdn.com/dms/image/C4D0BAQEr-ib3Nn15Aw/company-logo_400_400/0/1648787427825/ustglobal_logo?e=1716422400&v=beta&t=81RYHWfb688FHbWXIhYEl6u_W1nysrVUGyT5rZbisA8","2024-02-16T16:51:48.000Z","2024-02-22T22:36:18.464Z"
