"Title","Description","Description HTML","Primary Description","Detail URL","Location","Skill","Insight","Job State","Poster Id","Company Name","Company Logo","Created At","Scraped At"
"Senior Human Factors Engineer","We are currently looking to fill a Senior Human Factors Engineer position. This role is focused on human factors evaluation of delivery systems, ensuring that assigned devices, labelling and packaging are designed to be safe and effective for use by intended users.

In this role, a typical day might include the following:

Developing human factors (HF) engineering strategies and leading HF activities on drug-device combination product program teams, including ethnography, heuristic analyses, requirements definition research, use-related risk analysis, formative usability studies and validation usability studies based on user needs and usability guidance principlesAuthoring, reviewing and editing study protocols and reports, research summaries, usability requirements and design control documentationPerforming task analysis, usability-related risk analyses, interface evaluations and providing design recommendationsConducting and being responsible for user inquiries, user studies, data gathering and data analysisWorking with other HF team members to develop and implement HF process improvements.

This Role Might Be For You If

You have a shown understanding of: FDA Human Factors Guidance, Design Controls, ANSI/AAMI HE75, ISO/IEC 62366 is a plus.You enjoy collaborating with internal multi-functional design team and external vendors as needed.You thrive in a dynamic work environment where you can have a positive impact on our patients lives.You are able to travel up to 25%.

In order to be considered for this position, you must hold a Bachelor’s degree in Biomedical Engineering or another relevant engineering discipline, Human Factors, Systems Engineering, Cognitive Psychology, Psychology or Applied Science

Engineer: 2 years of relevant work experience.Senior Engineer: 5 years of relevant work experience.Level is determined based on qualifications relevant to the role.

Does this sound like you? Apply now to take your first steps toward living the Regeneron Way! We have an inclusive and diverse culture that provides comprehensive benefits including health and wellness programs, fitness centers and equity awards, annual bonuses, and paid time off for eligible employees at all levels!

Regeneron is an equal opportunity employer and all qualified applicants will receive consideration for employment without regard to race, color, religion or belief (or lack thereof), sex, nationality, national or ethnic origin, civil status, age, citizenship status, membership of the Traveler community, sexual orientation, disability, genetic information, familial status, marital or registered civil partnership status, pregnancy or parental status, gender identity, gender reassignment, military or veteran status, or any other protected characteristic in accordance with applicable laws and regulations. We will ensure that individuals with disabilities are provided reasonable accommodations to participate in the job application process. Please contact us to discuss any accommodations you think you may need.

The salary ranges provided are shown in accordance with U.S. law and apply to U.S. based positions, where the hired candidate will be located in the U.S. If you are outside the U.S, please speak with your recruiter about salaries and benefits in your location.

Salary Range (annually)

$72,800.00 - $139,100.00","We are currently looking to fill a Senior Human Factors Engineer position. This role is focused on human factors evaluation of delivery systems, ensuring that assigned devices, labelling and packaging are designed to be safe and effective for use by intended users.

In this role, a typical day might include the following:

<ul><li>Developing human factors (HF) engineering strategies and leading HF activities on drug-device combination product program teams, including ethnography, heuristic analyses, requirements definition research, use-related risk analysis, formative usability studies and validation usability studies based on user needs and usability guidance principles</li><li>Authoring, reviewing and editing study protocols and reports, research summaries, usability requirements and design control documentation</li><li>Performing task analysis, usability-related risk analyses, interface evaluations and providing design recommendations</li><li>Conducting and being responsible for user inquiries, user studies, data gathering and data analysis</li><li>Working with other HF team members to develop and implement HF process improvements.

</li></ul><strong>This Role Might Be For You If

</strong><ul><li>You have a shown understanding of: FDA Human Factors Guidance, Design Controls, ANSI/AAMI HE75, ISO/IEC 62366 is a plus.</li><li>You enjoy collaborating with internal multi-functional design team and external vendors as needed.</li><li>You thrive in a dynamic work environment where you can have a positive impact on our patients lives.</li><li>You are able to travel up to 25%.

</li></ul>In order to be considered for this position, you must hold a Bachelor’s degree in Biomedical Engineering or another relevant engineering discipline, Human Factors, Systems Engineering, Cognitive Psychology, Psychology or Applied Science

<ul><li>Engineer: 2 years of relevant work experience.</li><li>Senior Engineer: 5 years of relevant work experience.</li><li>Level is determined based on qualifications relevant to the role.

</li></ul>Does this sound like you? Apply now to take your first steps toward living the Regeneron Way! We have an inclusive and diverse culture that provides comprehensive benefits including health and wellness programs, fitness centers and equity awards, annual bonuses, and paid time off for eligible employees at all levels!

Regeneron is an equal opportunity employer and all qualified applicants will receive consideration for employment without regard to race, color, religion or belief (or lack thereof), sex, nationality, national or ethnic origin, civil status, age, citizenship status, membership of the Traveler community, sexual orientation, disability, genetic information, familial status, marital or registered civil partnership status, pregnancy or parental status, gender identity, gender reassignment, military or veteran status, or any other protected characteristic in accordance with applicable laws and regulations. We will ensure that individuals with disabilities are provided reasonable accommodations to participate in the job application process. Please contact us to discuss any accommodations you think you may need.

The salary ranges provided are shown in accordance with U.S. law and apply to U.S. based positions, where the hired candidate will be located in the U.S. If you are outside the U.S, please speak with your recruiter about salaries and benefits in your location.

<strong><strong>Salary Range (annually)

</strong></strong>$72,800.00 - $139,100.00","Regeneron","https://www.linkedin.com/jobs/view/3832063959/","East Greenbush, New York, United States","Skills: User Interface Design, User Experience (UX), +8 more","10,001+ employees · Biotechnology
59 school alumni work here","LISTED","276784527","Regeneron","https://media.licdn.com/dms/image/C4E0BAQFbKFTvmuUfWQ/company-logo_400_400/0/1659625884545/regeneron_pharmaceuticals_logo?e=1716422400&v=beta&t=q_eMu7gKMs1of-yCZI8hDyE28QnfP7E3kOBPPvngAvk","2024-02-16T16:32:57.000Z","2024-02-22T22:37:26.156Z"
"Principal People Scientist, People Strategy & Analytics","West Creek 2 (12072), United States of America, Richmond, VirginiaPrincipal People Scientist, People Strategy & Analytics

The People Strategy and Analytics team at Capital One is on a mission to transform the associate experience – from hiring to onboarding to career development – so that all talent can flourish. As a Principal People Scientist on the People Strategy & Analytics team, you will use organizational science, measurement techniques, behavioral insights, and advanced analytics to help drive that transformation.

Our ideal candidate will display a strong balance of analytical and problem solving skills, business consulting, and communication competencies, as well as the ability to work in a dynamic team environment. You’ll be on a cross-functional team that includes analysts, data scientists, and other people scientists.

This role will primarily specialize in enterprise surveying & measurement design, but will also have frequent opportunities to collaborate with key HR partners in areas like Talent & Performance Management, People Leadership and Diversity, Inclusion, & Belonging. Projects will focus on improving the associate experience and unlocking best practices in the talent strategy space. A typical day will include client consultation, measurement design, program design, insights generation, and analysis.

 Your main responsibilities include, but are not limited to: 

Consultation: Bring your expertise in organizational science principles and analysis to help our clients frame problems, answer questions, and design solutions to improve the associate experience Design : Build and drive key programs and solutions for our partners, including strategies for measurement and validation Experimentation : Partner with clients and teams across Capital One to design experiments to understand key drivers of associates and behavior Insights & analysis : Analyze the impact of our programs and combine those insights with the latest thinking in organizational science to help our clients make data-driven, informed decisions 

 Successful team members demonstrate competencies in these areas: 

Purpose : You feel a deep personal connection to improving the associate experience and are motivated by applying organizational science in a mission-driven way Analytical thinking : A proven track record of decision making and problem solving based in analytics. Conceptual thinking skills must be complemented by a strong quantitative orientation. Identify opportunities for improvement and use data to make strategic and tactical recommendations. Execution : Develop and test hypotheses, design solutions, assess operational feasibility, support implementation efforts, and develop plans and tools for monitoring outcomes Partnership : Collaborate effectively with other team members and HR clients Business communication : Strong written and oral communication skills, including visualization skills (i.e., able to “tell the story” and highlight key insights in a clear and concise manner that is easily understood by stakeholders) Results focus : Drives for results and achieves important goals; applies strong organizational skills and detail orientation, even amidst ambiguity 

 Basic Qualifications: 

 Master's degree  At least 1 year of professional work experience in Industrial and Organizational Psychology OR Organizational Behavior OR Behavioral Science  At least 1 year of experience building statistical models in R OR Python programming language 

 Preferred Qualifications: 

 PhD in Industrial and Organizational Psychology or Organizational Behavior  2+ years professional work experience in Industrial and Organizational Psychology or Organizational Behavior  Knowledge of advanced statistical methodologies advanced statistical methodologies, including regression, or longitudinal analysis, or Bayesian modeling 

At this time, Capital One will not sponsor a new applicant for employment authorization for this position.

Capital One offers a comprehensive, competitive, and inclusive set of health, financial and other benefits that support your total well-being. Learn more at the Capital One Careers website . Eligibility varies based on full or part-time status, exempt or non-exempt status, and management level.

This role is expected to accept applications for a minimum of 5 business days.No agencies please. Capital One is an equal opportunity employer committed to diversity and inclusion in the workplace. All qualified applicants will receive consideration for employment without regard to sex (including pregnancy, childbirth or related medical conditions), race, color, age, national origin, religion, disability, genetic information, marital status, sexual orientation, gender identity, gender reassignment, citizenship, immigration status, protected veteran status, or any other basis prohibited under applicable federal, state or local law. Capital One promotes a drug-free workplace. Capital One will consider for employment qualified applicants with a criminal history in a manner consistent with the requirements of applicable laws regarding criminal background inquiries, including, to the extent applicable, Article 23-A of the New York Correction Law; San Francisco, California Police Code Article 49, Sections 4901-4920; New York City’s Fair Chance Act; Philadelphia’s Fair Criminal Records Screening Act; and other applicable federal, state, and local laws and regulations regarding criminal background inquiries.

If you have visited our website in search of information on employment opportunities or to apply for a position, and you require an accommodation, please contact Capital One Recruiting at 1-800-304-9102 or via email at RecruitingAccommodation@capitalone.com . All information you provide will be kept confidential and will be used only to the extent required to provide needed reasonable accommodations.

For technical support or questions about Capital One's recruiting process, please send an email to Careers@capitalone.com

Capital One does not provide, endorse nor guarantee and is not liable for third-party products, services, educational tools or other information available through this site.

Capital One Financial is made up of several different entities. Please note that any position posted in Canada is for Capital One Canada, any position posted in the United Kingdom is for Capital One Europe and any position posted in the Philippines is for Capital One Philippines Service Corp. (COPSSC).","West Creek 2 (12072), United States of America, Richmond, VirginiaPrincipal People Scientist, People Strategy & Analytics

The People Strategy and Analytics team at Capital One is on a mission to transform the associate experience – from hiring to onboarding to career development – so that all talent can flourish. As a Principal People Scientist on the People Strategy & Analytics team, you will use organizational science, measurement techniques, behavioral insights, and advanced analytics to help drive that transformation.

Our ideal candidate will display a strong balance of analytical and problem solving skills, business consulting, and communication competencies, as well as the ability to work in a dynamic team environment. You’ll be on a cross-functional team that includes analysts, data scientists, and other people scientists.

This role will primarily specialize in enterprise surveying & measurement design, but will also have frequent opportunities to collaborate with key HR partners in areas like Talent & Performance Management, People Leadership and Diversity, Inclusion, & Belonging. Projects will focus on improving the associate experience and unlocking best practices in the talent strategy space. A typical day will include client consultation, measurement design, program design, insights generation, and analysis.

<strong> Your main responsibilities include, but are not limited to: 

</strong><ul><li>Consultation: Bring your expertise in organizational science principles and analysis to help our clients frame problems, answer questions, and design solutions to improve the associate experience </li><li>Design : Build and drive key programs and solutions for our partners, including strategies for measurement and validation </li><li>Experimentation : Partner with clients and teams across Capital One to design experiments to understand key drivers of associates and behavior </li><li>Insights & analysis : Analyze the impact of our programs and combine those insights with the latest thinking in organizational science to help our clients make data-driven, informed decisions 

</li></ul><strong> Successful team members demonstrate competencies in these areas: 

</strong><ul><li>Purpose : You feel a deep personal connection to improving the associate experience and are motivated by applying organizational science in a mission-driven way </li><li>Analytical thinking : A proven track record of decision making and problem solving based in analytics. Conceptual thinking skills must be complemented by a strong quantitative orientation. Identify opportunities for improvement and use data to make strategic and tactical recommendations. </li><li>Execution : Develop and test hypotheses, design solutions, assess operational feasibility, support implementation efforts, and develop plans and tools for monitoring outcomes </li><li>Partnership : Collaborate effectively with other team members and HR clients </li><li>Business communication : Strong written and oral communication skills, including visualization skills (i.e., able to “tell the story” and highlight key insights in a clear and concise manner that is easily understood by stakeholders) </li><li>Results focus : Drives for results and achieves important goals; applies strong organizational skills and detail orientation, even amidst ambiguity 

</li></ul><strong> Basic Qualifications: 

</strong><ul><li> Master's degree </li><li> At least 1 year of professional work experience in Industrial and Organizational Psychology OR Organizational Behavior OR Behavioral Science </li><li> At least 1 year of experience building statistical models in R OR Python programming language 

</li></ul><strong> Preferred Qualifications: 

</strong><ul><li> PhD in Industrial and Organizational Psychology or Organizational Behavior </li><li> 2+ years professional work experience in Industrial and Organizational Psychology or Organizational Behavior </li><li> Knowledge of advanced statistical methodologies advanced statistical methodologies, including regression, or longitudinal analysis, or Bayesian modeling 

</li></ul><i>At this time, Capital One will not sponsor a new applicant for employment authorization for this position.

</i>Capital One offers a comprehensive, competitive, and inclusive set of health, financial and other benefits that support your total well-being. Learn more at the Capital One Careers website . Eligibility varies based on full or part-time status, exempt or non-exempt status, and management level.

This role is expected to accept applications for a minimum of 5 business days.No agencies please. Capital One is an equal opportunity employer committed to diversity and inclusion in the workplace. All qualified applicants will receive consideration for employment without regard to sex (including pregnancy, childbirth or related medical conditions), race, color, age, national origin, religion, disability, genetic information, marital status, sexual orientation, gender identity, gender reassignment, citizenship, immigration status, protected veteran status, or any other basis prohibited under applicable federal, state or local law. Capital One promotes a drug-free workplace. Capital One will consider for employment qualified applicants with a criminal history in a manner consistent with the requirements of applicable laws regarding criminal background inquiries, including, to the extent applicable, Article 23-A of the New York Correction Law; San Francisco, California Police Code Article 49, Sections 4901-4920; New York City’s Fair Chance Act; Philadelphia’s Fair Criminal Records Screening Act; and other applicable federal, state, and local laws and regulations regarding criminal background inquiries.

If you have visited our website in search of information on employment opportunities or to apply for a position, and you require an accommodation, please contact Capital One Recruiting at 1-800-304-9102 or via email at RecruitingAccommodation@capitalone.com . All information you provide will be kept confidential and will be used only to the extent required to provide needed reasonable accommodations.

For technical support or questions about Capital One's recruiting process, please send an email to Careers@capitalone.com

Capital One does not provide, endorse nor guarantee and is not liable for third-party products, services, educational tools or other information available through this site.

Capital One Financial is made up of several different entities. Please note that any position posted in Canada is for Capital One Canada, any position posted in the United Kingdom is for Capital One Europe and any position posted in the Philippines is for Capital One Philippines Service Corp. (COPSSC).","Capital One","https://www.linkedin.com/jobs/view/3814439576/","Richmond, Virginia, United States","Skills: Business Insights, Python (Programming Language), +8 more","10,001+ employees · Financial Services
75 school alumni work here","LISTED","355504302","Capital One","https://media.licdn.com/dms/image/C560BAQF0OgQyRZ9yAA/company-logo_400_400/0/1635782718446/capital_one_logo?e=1716422400&v=beta&t=8nAnd5uUdOosAu_cVMqwcYRT2XclZJodqwEPaH0xvPo","2024-01-26T19:14:15.000Z","2024-02-22T22:37:26.156Z"
