"Title","Description","Description HTML","Primary Description","Detail URL","Location","Skill","Insight","Job State","Poster Id","Company Name","Company Logo","Created At","Scraped At"
"User Risk Strategist","Who we are

About Stripe

Stripe is a financial infrastructure platform for businesses. Millions of companies - from the world’s largest enterprises to the most ambitious startups - use Stripe to accept payments, grow their revenue, and accelerate new business opportunities. Our mission is to increase the GDP of the internet, and we have a staggering amount of work ahead. That means you have an unprecedented opportunity to put the global economy within everyone's reach while doing the most important work of your career.

About The Team

As Stripe continues to develop innovative products that serve businesses of all sizes around the world, risk will increase in complexity and scale. The User Risk Strategy protects and advances Stripe’s business, brand, and mission by building and deploying industry-leading policies and practices that instill user and partner trust in Stripe while enabling business growth.

What you’ll do

As a member of the User Risk Strategy team, you will partner with cross-functional teams—including Risk, Product, Partnerships, Legal, Sales, and Data Science—to design and execute on strategies and projects to improve Stripe’s risk controls and user experience. You will provide expert guidance and analyses to the business and to our most strategic customers to enable Stripe to grow in a risk-conscious manner.

We are looking for someone who is passionate about navigating ambiguity, enabling business growth while balancing risk, and is skilled at identifying ways to improve user experience.

Responsibilities

Drive risk strategy for company-level strategic initiatives, including partnering with Stripe’s product, legal, operations, sales, and partnerships teams to solve risk problems and ensure a positive experience for Stripe’s usersPerform research and analysis to assess Stripe’s current risk performance and develop and prioritize long-term strategic plans for future growthEnable user onboarding to safely grow at scale, continuously optimizing for efficiency and effectiveness, and staying hyper focused on a positive user experienceChallenge the status quo and provide multiple alternative solutions and key execution criteriaRepresent Stripe in external engagements with our most critical partners and customersExecute special projects/ad hoc analyses as initiatives, products, risks, and opportunities are constantly evolving


Who you are

We're looking for someone who meets the minimum requirements to be considered for the role. If you meet these requirements, you are encouraged to apply. The preferred qualifications are a bonus, not a requirement.

Minimum Requirements

5+ years of professional experience, preferably in Financial Services, Payments or fintech industriesExperience in a related role (risk, compliance and/or product enablement)Experience in developing risk strategies and solutions and working with technical (product and engineering) and operations teams to implement themAbility to distill complex, ambiguous risk and policy problems into clear, concise, and reliable guidance for internal stakeholders and Stripe usersStrong stakeholder management skills, including experience influencing product/engineering, sales, data science, and operations teamsDemonstrated track record of deriving insights from complex or technical problem spaces and evangelizing actionable product recommendationsThe ability to take ownership, be accountable, and drive towards ambitious goalsEntrepreneurial and curious mindset, strong communication and interpersonal skillsAbility to operate independently, navigate ambiguity, and solve problems with the end user in mindStrong desire to work in a fast paced and innovative environment


Preferred Qualifications

 Proficiency in one of the following:Card network rules and regulations KYC/KYB, AML OFAC compliance Experience overseeing execution and delivery of highly-strategic programs; proven ability to take complex issues and turn them into actionable next steps, hold others accountable, and meet deadlinesExperience with data querying languages (e.g., SQL) and proficiency in quantitative analysis geared towards drawing actionable insights from complex datasetsAdvanced degree in law, business, policy or other related fieldExperience in translating business requirements to technical configurations

Hybrid work at Stripe

This role is available either in an office or a remote location (typically, 35+ miles or 56+ km from a Stripe office).

Office-assigned Stripes spend at least 50% of the time in a given month in their local office or with users. This hits a balance between bringing people together for in-person collaboration and learning from each other, while supporting flexibility about how to do this in a way that makes sense for individuals and their teams.

A remote location, in most cases, is defined as being 35 miles (56 kilometers) or more from one of our offices. While you would be welcome to come into the office for team/business meetings, on-sites, meet-ups, and events, our expectation is you would regularly work from home rather than a Stripe office. Stripe does not cover the cost of relocating to a remote location. We encourage you to apply for roles that match the location where you currently or plan to live.

Pay and benefits

The annual US base salary range for this role is $91,600 - $177,300. For sales roles, the range provided is the role’s On Target Earnings (""OTE"") range, meaning that the range includes both the sales commissions/sales bonuses target and annual base salary for the role. This salary range may be inclusive of several career levels at Stripe and will be narrowed during the interview process based on a number of factors, including the candidate’s experience, qualifications, and location. Applicants interested in this role and who are not located in the US may request the annual salary range for their location during the interview process.

Additional benefits for this role may include: equity, company bonus or sales commissions/bonuses; 401(k) plan; medical, dental, and vision benefits; and wellness stipends.","Who we are

<strong>About Stripe

</strong>Stripe is a financial infrastructure platform for businesses. Millions of companies - from the world’s largest enterprises to the most ambitious startups - use Stripe to accept payments, grow their revenue, and accelerate new business opportunities. Our mission is to increase the GDP of the internet, and we have a staggering amount of work ahead. That means you have an unprecedented opportunity to put the global economy within everyone's reach while doing the most important work of your career.

<strong>About The Team

</strong>As Stripe continues to develop innovative products that serve businesses of all sizes around the world, risk will increase in complexity and scale. The User Risk Strategy protects and advances Stripe’s business, brand, and mission by building and deploying industry-leading policies and practices that instill user and partner trust in Stripe while enabling business growth.

What you’ll do

As a member of the User Risk Strategy team, you will partner with cross-functional teams—including Risk, Product, Partnerships, Legal, Sales, and Data Science—to design and execute on strategies and projects to improve Stripe’s risk controls and user experience. You will provide expert guidance and analyses to the business and to our most strategic customers to enable Stripe to grow in a risk-conscious manner.

We are looking for someone who is passionate about navigating ambiguity, enabling business growth while balancing risk, and is skilled at identifying ways to improve user experience.

<strong>Responsibilities

</strong><ul><li>Drive risk strategy for company-level strategic initiatives, including partnering with Stripe’s product, legal, operations, sales, and partnerships teams to solve risk problems and ensure a positive experience for Stripe’s users</li><li>Perform research and analysis to assess Stripe’s current risk performance and develop and prioritize long-term strategic plans for future growth</li><li>Enable user onboarding to safely grow at scale, continuously optimizing for efficiency and effectiveness, and staying hyper focused on a positive user experience</li><li>Challenge the status quo and provide multiple alternative solutions and key execution criteria</li><li>Represent Stripe in external engagements with our most critical partners and customers</li><li>Execute special projects/ad hoc analyses as initiatives, products, risks, and opportunities are constantly evolving


</li></ul>Who you are

We're looking for someone who meets the minimum requirements to be considered for the role. If you meet these requirements, you are encouraged to apply. The preferred qualifications are a bonus, not a requirement.

<strong>Minimum Requirements

</strong><ul><li>5+ years of professional experience, preferably in Financial Services, Payments or fintech industries</li><li>Experience in a related role (risk, compliance and/or product enablement)</li><li>Experience in developing risk strategies and solutions and working with technical (product and engineering) and operations teams to implement them</li><li>Ability to distill complex, ambiguous risk and policy problems into clear, concise, and reliable guidance for internal stakeholders and Stripe users</li><li>Strong stakeholder management skills, including experience influencing product/engineering, sales, data science, and operations teams</li><li>Demonstrated track record of deriving insights from complex or technical problem spaces and evangelizing actionable product recommendations</li><li>The ability to take ownership, be accountable, and drive towards ambitious goals</li><li>Entrepreneurial and curious mindset, strong communication and interpersonal skills</li><li>Ability to operate independently, navigate ambiguity, and solve problems with the end user in mind</li><li>Strong desire to work in a fast paced and innovative environment


</li></ul><strong>Preferred Qualifications

</strong><ul><li> Proficiency in one of the following:</li><ul><li>Card network rules and regulations </li><li>KYC/KYB, AML OFAC compliance </li></ul><li>Experience overseeing execution and delivery of highly-strategic programs; proven ability to take complex issues and turn them into actionable next steps, hold others accountable, and meet deadlines</li><li>Experience with data querying languages (e.g., SQL) and proficiency in quantitative analysis geared towards drawing actionable insights from complex datasets</li><li>Advanced degree in law, business, policy or other related field</li><li>Experience in translating business requirements to technical configurations

</li></ul>Hybrid work at Stripe

This role is available either in an office or a remote location (typically, 35+ miles or 56+ km from a Stripe office).

Office-assigned Stripes spend at least 50% of the time in a given month in their local office or with users. This hits a balance between bringing people together for in-person collaboration and learning from each other, while supporting flexibility about how to do this in a way that makes sense for individuals and their teams.

A remote location, in most cases, is defined as being 35 miles (56 kilometers) or more from one of our offices. While you would be welcome to come into the office for team/business meetings, on-sites, meet-ups, and events, our expectation is you would regularly work from home rather than a Stripe office. Stripe does not cover the cost of relocating to a remote location. We encourage you to apply for roles that match the location where you currently or plan to live.

Pay and benefits

The annual US base salary range for this role is $91,600 - $177,300. For sales roles, the range provided is the role’s On Target Earnings (""OTE"") range, meaning that the range includes both the sales commissions/sales bonuses target and annual base salary for the role. This salary range may be inclusive of several career levels at Stripe and will be narrowed during the interview process based on a number of factors, including the candidate’s experience, qualifications, and location. Applicants interested in this role and who are not located in the US may request the annual salary range for their location during the interview process.

Additional benefits for this role may include: equity, company bonus or sales commissions/bonuses; 401(k) plan; medical, dental, and vision benefits; and wellness stipends.","Stripe · San Francisco, CA (On-site)","https://www.linkedin.com/jobs/view/3832776319/","San Francisco, California, United States","Skills: Business Insights, Stripe (Software), +8 more","1,001-5,000 employees · Technology, Information and Internet
14 school alumni work here","LISTED","113060463","Stripe","https://media.licdn.com/dms/image/C560BAQF1NNJs-2xA5g/company-logo_400_400/0/1630643399686/stripe_logo?e=1722470400&v=beta&t=_anhm8BD_E51tVAjD_PGLO7ifYuKaCraAEhmDxaYXPc","2024-02-16T22:35:19.000Z","2024-04-30T00:07:46.481Z"
"UX Researcher II","The Microsoft Azure Cloud Experiences team is looking for an experienced, motivated, and customer-focused UX Researcher II to help impact Azure - the world’s computer. You will join a passionate team that strives to deliver customer-centric, data-driven, and elegant experiences for complex enterprise scenarios with high business impact. We believe in inclusive and accessible designs and deliver world-class experiences for modern cloud-based applications and services. Our team’s mission is to empower our developers and enterprise customers to achieve more.

This opportunity will allow you to learn from and grow in a vibrant global community of designers, researchers, content designers, design engineers, product managers and developers.

Microsoft’s mission is to empower every person and every organization on the planet to achieve more. As employees we come together with a growth mindset, innovate to empower others, and collaborate to realize our shared goals. Each day we build on our values of respect, integrity, and accountability to create a culture of inclusion where everyone can thrive at work and beyond.

In alignment with our Microsoft values, we are committed to cultivating an inclusive work environment for all employees to positively impact our culture every day.

Responsibilities

You will use sense-making and apply statistical analysis to distill data for a feature area, then share accessible insights that improve design and engineering processes for that feature area.You will begin to conduct research that defines the customer in order to inform product strategy for a feature area. You’ll also help create new solutions and apply UX testing to uncover insights for continuous improvements, including for inclusivity and accessibility.You will study the entire funnel to gain insights into user behavior. Specifically, you’ll use analysis to understand churn and the reason for a feature area.You will collaborate in cross-disciplinary research efforts. This will involve mentoring other disciplines, providing research tools, recruiting programs for research, and helping put on large-scale customer learning events.

Other

Embody our Culture and Values

Qualifications

Required Qualifications: 

Bachelor's Degree in Human-Computer Interaction, Human Factors Engineering, Computer Science, Technical Communications, Information Science, Information Architecture, User Experience Design, Behavioral Science, Social Sciences, or related field AND 2+ years User Experience Research experienceOR Master's Degree in Human-Computer Interaction, Human Factors Engineering, Computer Science, Technical Communications, Information Science, Information Architecture, User Experience Design, Behavioral Science, Social Sciences, or related field AND 1+ year(s) User Experience Research experienceOR equivalent experience.
Other Requirements

Ability to meet Microsoft, customer and/or government security screening requirements are required for this role. These requirements include, but are not limited to the following specialized security screenings: Microsoft Cloud Background Check: This position will be required to pass the Microsoft Cloud background check upon hire/transfer and every two years thereafter.

Preferred Qualifications

Bachelor's Degree in Human-Computer Interaction, Human Factors Engineering, Computer Science, Technical Communications, Information Science, Information Architecture, User Experience Design, Behavioral Science, Social Sciences, or related field AND 5+ years User Experience Research experienceOR Master's Degree in Human-Computer Interaction, Human Factors Engineering, Computer Science, Technical Communications, Information Science, Information Architecture, User Experience Design, Behavioral Science, Social Sciences, or related field AND 3+ years User Experience Research experienceOR Doctorate in Human-Computer Interaction, Human Factors Engineering, Computer Science, Technical Communications, Information Science, Information Architecture, User Experience Design, Behavioral Science, Social Sciences, or related field AND 2+ years User Experience Research experienceOR equivalent experience.1+ year(s) relevant domain experience within technology sector.1+ year(s) experience in research methods impacting both product direction and detailed experience design.
UX Research IC3 - The typical base pay range for this role across the U.S. is USD $94,300 - $182,600 per year. There is a different range applicable to specific work locations, within the San Francisco Bay area and New York City metropolitan area, and the base pay range for this role in those locations is USD $120,900 - $198,600 per year.

Certain roles may be eligible for benefits and other compensation. Find additional benefits and pay information here: https://careers.microsoft.com/us/en/us-corporate-pay

Microsoft will accept applications for the role until April 29, 2024.

#Azurecorejobs

Microsoft is an equal opportunity employer. Consistent with applicable law, all qualified applicants will receive consideration for employment without regard to age, ancestry, citizenship, color, family or medical care leave, gender identity or expression, genetic information, immigration status, marital status, medical condition, national origin, physical or mental disability, political affiliation, protected veteran or military status, race, ethnicity, religion, sex (including pregnancy), sexual orientation, or any other characteristic protected by applicable local laws, regulations and ordinances. If you need assistance and/or a reasonable accommodation due to a disability during the application process, read more about requesting accommodations.","The Microsoft Azure Cloud Experiences team is looking for an experienced, motivated, and customer-focused <strong>UX Researcher II</strong> to help impact Azure - the world’s computer. You will join a passionate team that strives to deliver customer-centric, data-driven, and elegant experiences for complex enterprise scenarios with high business impact. We believe in inclusive and accessible designs and deliver world-class experiences for modern cloud-based applications and services. Our team’s mission is to empower our developers and enterprise customers to achieve more.

This opportunity will allow you to learn from and grow in a vibrant global community of designers, researchers, content designers, design engineers, product managers and developers.

Microsoft’s mission is to empower every person and every organization on the planet to achieve more. As employees we come together with a growth mindset, innovate to empower others, and collaborate to realize our shared goals. Each day we build on our values of respect, integrity, and accountability to create a culture of inclusion where everyone can thrive at work and beyond.

In alignment with our Microsoft values, we are committed to cultivating an inclusive work environment for all employees to positively impact our culture every day.

<strong>Responsibilities

</strong><ul><li>You will use sense-making and apply statistical analysis to distill data for a feature area, then share accessible insights that improve design and engineering processes for that feature area.</li><li>You will begin to conduct research that defines the customer in order to inform product strategy for a feature area. You’ll also help create new solutions and apply UX testing to uncover insights for continuous improvements, including for inclusivity and accessibility.</li><li>You will study the entire funnel to gain insights into user behavior. Specifically, you’ll use analysis to understand churn and the reason for a feature area.</li><li>You will collaborate in cross-disciplinary research efforts. This will involve mentoring other disciplines, providing research tools, recruiting programs for research, and helping put on large-scale customer learning events.

</li></ul><strong>Other

</strong><ul><li>Embody our Culture and Values

</li></ul><strong>Qualifications

</strong><strong>Required Qualifications: 

</strong><ul><li>Bachelor's Degree in Human-Computer Interaction, Human Factors Engineering, Computer Science, Technical Communications, Information Science, Information Architecture, User Experience Design, Behavioral Science, Social Sciences, or related field AND 2+ years User Experience Research experience</li><ul><li>OR Master's Degree in Human-Computer Interaction, Human Factors Engineering, Computer Science, Technical Communications, Information Science, Information Architecture, User Experience Design, Behavioral Science, Social Sciences, or related field AND 1+ year(s) User Experience Research experience</li><li>OR equivalent experience.
</li></ul></ul><strong>Other Requirements

</strong><ul><li>Ability to meet Microsoft, customer and/or government security screening requirements are required for this role. These requirements include, but are not limited to the following specialized security screenings: Microsoft Cloud Background Check: This position will be required to pass the Microsoft Cloud background check upon hire/transfer and every two years thereafter.

</li></ul><strong>Preferred Qualifications

</strong><ul><li>Bachelor's Degree in Human-Computer Interaction, Human Factors Engineering, Computer Science, Technical Communications, Information Science, Information Architecture, User Experience Design, Behavioral Science, Social Sciences, or related field AND 5+ years User Experience Research experience</li><ul><li>OR Master's Degree in Human-Computer Interaction, Human Factors Engineering, Computer Science, Technical Communications, Information Science, Information Architecture, User Experience Design, Behavioral Science, Social Sciences, or related field AND 3+ years User Experience Research experience</li><li>OR Doctorate in Human-Computer Interaction, Human Factors Engineering, Computer Science, Technical Communications, Information Science, Information Architecture, User Experience Design, Behavioral Science, Social Sciences, or related field AND 2+ years User Experience Research experience</li><li>OR equivalent experience.</li></ul><li>1+ year(s) relevant domain experience within technology sector.</li><li>1+ year(s) experience in research methods impacting both product direction and detailed experience design.
</li></ul>UX Research IC3 - The typical base pay range for this role across the U.S. is USD $94,300 - $182,600 per year. There is a different range applicable to specific work locations, within the San Francisco Bay area and New York City metropolitan area, and the base pay range for this role in those locations is USD $120,900 - $198,600 per year.

Certain roles may be eligible for benefits and other compensation. Find additional benefits and pay information here: https://careers.microsoft.com/us/en/us-corporate-pay

Microsoft will accept applications for the role until April 29, 2024.

#Azurecorejobs

Microsoft is an equal opportunity employer. Consistent with applicable law, all qualified applicants will receive consideration for employment without regard to age, ancestry, citizenship, color, family or medical care leave, gender identity or expression, genetic information, immigration status, marital status, medical condition, national origin, physical or mental disability, political affiliation, protected veteran or military status, race, ethnicity, religion, sex (including pregnancy), sexual orientation, or any other characteristic protected by applicable local laws, regulations and ordinances. If you need assistance and/or a reasonable accommodation due to a disability during the application process, read more about requesting accommodations.","Microsoft · Redmond, WA (Remote)","https://www.linkedin.com/jobs/view/3908307761/","Redmond, Washington, United States","Skills: User Interface Design, User Experience (UX), +8 more","10,001+ employees · Software Development
3 connections work here · 348 school alumni work here","LISTED","823990701","Microsoft","https://media.licdn.com/dms/image/C560BAQE88xCsONDULQ/company-logo_400_400/0/1630652622688/microsoft_logo?e=1722470400&v=beta&t=NfsoDmnvUBP3nz_8dGR5TsiguSwbaYYOWt1_psNvg2A","2024-04-27T10:35:54.000Z","2024-04-30T00:07:46.481Z"
