"Title","Description","Description HTML","Primary Description","Detail URL","Location","Skill","Insight","Job State","Poster Id","Company Name","Company Logo","Created At","Scraped At"
"Principal People Scientist, People Strategy & Analytics","West Creek 2 (12072), United States of America, Richmond, VirginiaPrincipal People Scientist, People Strategy & Analytics

The People Strategy and Analytics team at Capital One is on a mission to transform the associate experience – from hiring to onboarding to career development – so that all talent can flourish. As a Principal People Scientist on the People Strategy & Analytics team, you will use organizational science, measurement techniques, behavioral insights, and advanced analytics to help drive that transformation.

Our ideal candidate will display a strong balance of analytical and problem solving skills, business consulting, and communication competencies, as well as the ability to work in a dynamic team environment. You’ll be on a cross-functional team that includes analysts, data scientists, and other people scientists.

This role will primarily specialize in enterprise surveying & measurement design, but will also have frequent opportunities to collaborate with key HR partners in areas like Talent & Performance Management, People Leadership and Diversity, Inclusion, & Belonging. Projects will focus on improving the associate experience and unlocking best practices in the talent strategy space. A typical day will include client consultation, measurement design, program design, insights generation, and analysis.

 Your main responsibilities include, but are not limited to: 

Consultation: Bring your expertise in organizational science principles and analysis to help our clients frame problems, answer questions, and design solutions to improve the associate experience Design : Build and drive key programs and solutions for our partners, including strategies for measurement and validation Experimentation : Partner with clients and teams across Capital One to design experiments to understand key drivers of associates and behavior Insights & analysis : Analyze the impact of our programs and combine those insights with the latest thinking in organizational science to help our clients make data-driven, informed decisions 

 Successful team members demonstrate competencies in these areas: 

Purpose : You feel a deep personal connection to improving the associate experience and are motivated by applying organizational science in a mission-driven way Analytical thinking : A proven track record of decision making and problem solving based in analytics. Conceptual thinking skills must be complemented by a strong quantitative orientation. Identify opportunities for improvement and use data to make strategic and tactical recommendations. Execution : Develop and test hypotheses, design solutions, assess operational feasibility, support implementation efforts, and develop plans and tools for monitoring outcomes Partnership : Collaborate effectively with other team members and HR clients Business communication : Strong written and oral communication skills, including visualization skills (i.e., able to “tell the story” and highlight key insights in a clear and concise manner that is easily understood by stakeholders) Results focus : Drives for results and achieves important goals; applies strong organizational skills and detail orientation, even amidst ambiguity 

 Basic Qualifications: 

 Master's degree  At least 1 year of professional work experience in Industrial and Organizational Psychology OR Organizational Behavior OR Behavioral Science  At least 1 year of experience building statistical models in R OR Python programming language 

 Preferred Qualifications: 

 PhD in Industrial and Organizational Psychology or Organizational Behavior  2+ years professional work experience in Industrial and Organizational Psychology or Organizational Behavior  Knowledge of advanced statistical methodologies advanced statistical methodologies, including regression, or longitudinal analysis, or Bayesian modeling 

At this time, Capital One will not sponsor a new applicant for employment authorization for this position.

Capital One offers a comprehensive, competitive, and inclusive set of health, financial and other benefits that support your total well-being. Learn more at the Capital One Careers website . Eligibility varies based on full or part-time status, exempt or non-exempt status, and management level.

This role is expected to accept applications for a minimum of 5 business days.No agencies please. Capital One is an equal opportunity employer committed to diversity and inclusion in the workplace. All qualified applicants will receive consideration for employment without regard to sex (including pregnancy, childbirth or related medical conditions), race, color, age, national origin, religion, disability, genetic information, marital status, sexual orientation, gender identity, gender reassignment, citizenship, immigration status, protected veteran status, or any other basis prohibited under applicable federal, state or local law. Capital One promotes a drug-free workplace. Capital One will consider for employment qualified applicants with a criminal history in a manner consistent with the requirements of applicable laws regarding criminal background inquiries, including, to the extent applicable, Article 23-A of the New York Correction Law; San Francisco, California Police Code Article 49, Sections 4901-4920; New York City’s Fair Chance Act; Philadelphia’s Fair Criminal Records Screening Act; and other applicable federal, state, and local laws and regulations regarding criminal background inquiries.

If you have visited our website in search of information on employment opportunities or to apply for a position, and you require an accommodation, please contact Capital One Recruiting at 1-800-304-9102 or via email at RecruitingAccommodation@capitalone.com . All information you provide will be kept confidential and will be used only to the extent required to provide needed reasonable accommodations.

For technical support or questions about Capital One's recruiting process, please send an email to Careers@capitalone.com

Capital One does not provide, endorse nor guarantee and is not liable for third-party products, services, educational tools or other information available through this site.

Capital One Financial is made up of several different entities. Please note that any position posted in Canada is for Capital One Canada, any position posted in the United Kingdom is for Capital One Europe and any position posted in the Philippines is for Capital One Philippines Service Corp. (COPSSC).","West Creek 2 (12072), United States of America, Richmond, VirginiaPrincipal People Scientist, People Strategy & Analytics

The People Strategy and Analytics team at Capital One is on a mission to transform the associate experience – from hiring to onboarding to career development – so that all talent can flourish. As a Principal People Scientist on the People Strategy & Analytics team, you will use organizational science, measurement techniques, behavioral insights, and advanced analytics to help drive that transformation.

Our ideal candidate will display a strong balance of analytical and problem solving skills, business consulting, and communication competencies, as well as the ability to work in a dynamic team environment. You’ll be on a cross-functional team that includes analysts, data scientists, and other people scientists.

This role will primarily specialize in enterprise surveying & measurement design, but will also have frequent opportunities to collaborate with key HR partners in areas like Talent & Performance Management, People Leadership and Diversity, Inclusion, & Belonging. Projects will focus on improving the associate experience and unlocking best practices in the talent strategy space. A typical day will include client consultation, measurement design, program design, insights generation, and analysis.

<strong> Your main responsibilities include, but are not limited to: 

</strong><ul><li>Consultation: Bring your expertise in organizational science principles and analysis to help our clients frame problems, answer questions, and design solutions to improve the associate experience </li><li>Design : Build and drive key programs and solutions for our partners, including strategies for measurement and validation </li><li>Experimentation : Partner with clients and teams across Capital One to design experiments to understand key drivers of associates and behavior </li><li>Insights & analysis : Analyze the impact of our programs and combine those insights with the latest thinking in organizational science to help our clients make data-driven, informed decisions 

</li></ul><strong> Successful team members demonstrate competencies in these areas: 

</strong><ul><li>Purpose : You feel a deep personal connection to improving the associate experience and are motivated by applying organizational science in a mission-driven way </li><li>Analytical thinking : A proven track record of decision making and problem solving based in analytics. Conceptual thinking skills must be complemented by a strong quantitative orientation. Identify opportunities for improvement and use data to make strategic and tactical recommendations. </li><li>Execution : Develop and test hypotheses, design solutions, assess operational feasibility, support implementation efforts, and develop plans and tools for monitoring outcomes </li><li>Partnership : Collaborate effectively with other team members and HR clients </li><li>Business communication : Strong written and oral communication skills, including visualization skills (i.e., able to “tell the story” and highlight key insights in a clear and concise manner that is easily understood by stakeholders) </li><li>Results focus : Drives for results and achieves important goals; applies strong organizational skills and detail orientation, even amidst ambiguity 

</li></ul><strong> Basic Qualifications: 

</strong><ul><li> Master's degree </li><li> At least 1 year of professional work experience in Industrial and Organizational Psychology OR Organizational Behavior OR Behavioral Science </li><li> At least 1 year of experience building statistical models in R OR Python programming language 

</li></ul><strong> Preferred Qualifications: 

</strong><ul><li> PhD in Industrial and Organizational Psychology or Organizational Behavior </li><li> 2+ years professional work experience in Industrial and Organizational Psychology or Organizational Behavior </li><li> Knowledge of advanced statistical methodologies advanced statistical methodologies, including regression, or longitudinal analysis, or Bayesian modeling 

</li></ul><i>At this time, Capital One will not sponsor a new applicant for employment authorization for this position.

</i>Capital One offers a comprehensive, competitive, and inclusive set of health, financial and other benefits that support your total well-being. Learn more at the Capital One Careers website . Eligibility varies based on full or part-time status, exempt or non-exempt status, and management level.

This role is expected to accept applications for a minimum of 5 business days.No agencies please. Capital One is an equal opportunity employer committed to diversity and inclusion in the workplace. All qualified applicants will receive consideration for employment without regard to sex (including pregnancy, childbirth or related medical conditions), race, color, age, national origin, religion, disability, genetic information, marital status, sexual orientation, gender identity, gender reassignment, citizenship, immigration status, protected veteran status, or any other basis prohibited under applicable federal, state or local law. Capital One promotes a drug-free workplace. Capital One will consider for employment qualified applicants with a criminal history in a manner consistent with the requirements of applicable laws regarding criminal background inquiries, including, to the extent applicable, Article 23-A of the New York Correction Law; San Francisco, California Police Code Article 49, Sections 4901-4920; New York City’s Fair Chance Act; Philadelphia’s Fair Criminal Records Screening Act; and other applicable federal, state, and local laws and regulations regarding criminal background inquiries.

If you have visited our website in search of information on employment opportunities or to apply for a position, and you require an accommodation, please contact Capital One Recruiting at 1-800-304-9102 or via email at RecruitingAccommodation@capitalone.com . All information you provide will be kept confidential and will be used only to the extent required to provide needed reasonable accommodations.

For technical support or questions about Capital One's recruiting process, please send an email to Careers@capitalone.com

Capital One does not provide, endorse nor guarantee and is not liable for third-party products, services, educational tools or other information available through this site.

Capital One Financial is made up of several different entities. Please note that any position posted in Canada is for Capital One Canada, any position posted in the United Kingdom is for Capital One Europe and any position posted in the Philippines is for Capital One Philippines Service Corp. (COPSSC).","Capital One · McLean, VA","https://www.linkedin.com/jobs/view/3814443216/","McLean, Virginia, United States","Skills: Business Insights, Python (Programming Language), +8 more","10,001+ employees · Financial Services
78 school alumni work here","LISTED","355504302","Capital One","https://media.licdn.com/dms/image/C560BAQF0OgQyRZ9yAA/company-logo_400_400/0/1635782718446/capital_one_logo?e=1720656000&v=beta&t=vZjebwZCLZZmfahUZvM2PoePNeBHkRczw_nBSuQJqjo","2024-01-26T19:14:09.000Z","2024-04-11T16:11:18.151Z"
"Research Director","We’re Precision – an integrated strategy and marketing agency working with companies, causes, and candidates that change people’s minds and move them to action. We’ve helped win presidential elections, defined Fortune 50 brands, shaped public opinion, and created movements from the ground up. Don’t just break through. Break new ground.  Precision is committed to building a diverse team that will positively and authentically impact the communities we serve. Centering our strategies around the authentic voices and cultures of the communities we are engaging with is paramount to our work – and our work can only be as inclusive as our team is representative. We strongly encourage women, Black, Latino, Hispanic, Asian American, Native Hawaiian, Pacific Islander, Indigenous people, LGBTQ+, gender expansive or GNC folks, people of all ages, disabled people, and veterans to apply.  We are looking for someone who thrives in a fast-paced environment, wants to work in a team-oriented environment, and is inclined to seek out challenges and opportunities. As our Research Director, you will drive the execution of critical workstreams across a range of clients. You will mentor and collaborate closely with a team of analysts. Your primary responsibilities will be wrangling data from disparate sources to analyze, interpret, and extract key insights. Your duties also include crafting and delivering data-driven client presentations and project management.  What You Will Be Doing: Manage digital analytics, social listening, and secondary research projects from start to finish, ensuring successful, on-time completion of work. Craft and present reports, presentations, and memos for a wide range of stakeholders—both internal and external—that provide clear and actionable insights. Turn findings into insights, create narratives, and effectively communicate research results to drive strategy and enable clients to accomplish their objectives, including by working with colleagues on other teams. Run a work stream on a client team. Serve as a liaison to non-technical teams at the firm to help them understand our capabilities and how they can be applied to other projects. Complete and delegate work appropriately. Guide and mentor junior staff members.   Essential Qualifications: 4+ years of relevant experience in marketing communications, marketing performance analytics, digital media measurement (earned or owned), social media measurement, market research, or other related fields. Prior agency and/or large philanthropic organization experience a strong plus. Direct client management experience. Experience with large organizations and multiple stakeholders a plus. Experience working with multiple clients at the same time. Excellent written and verbal communication skills Meticulous attention to detail Creative, energetic, and possesses an entrepreneurial spirit. Ability to lead planning and execution of work across a diverse range of client projects. Expertise in Microsoft Office (Excel, PowerPoint) or Google Suite/Workspace (Sheets, Slides) Ability to turn data into insights and communicate them effectively across a diverse range of stakeholders. Competent in synthesizing and presenting research from several sources.  Preferred Qualifications (any of the following would be nice to haves): Social listening, media monitoring, and advanced metrics analysis including the use of Meltwater, Cision, Brandwatch, Talkwalker, Newswhip, YouScan, Infegy, Buzzsumo, Rival IQ, Netbase/Quid, or similar tools. Experience with audience insights or segmentation, including the use of Resonate, Audiense, DemographicsPro, ComScore, GWI, MRI, or similar tools. Data visualization and the use of Tableau, Power BI, Google Data Studio, or similar. Knowledge of native platform analytics tools including Facebook/Instagram Analytics, LinkedIn Analytics, etc. Advanced knowledge of macros, pivot tables, data visualization, and advanced formula-building in Excel or Google Sheets. Experience in voter file analysis. Competency in using SAS, SPSS, SQL, Python, or R for statistical analysis.   What We Will Give You: Competitive salaries Annual bonus opportunity New business bonuses Flexible hybrid remote/in-office plan Retirement plan with automatic 3% safe-harbor contribution from Precision Healthcare coverage - medical, dental, and vision, with 90% of costs covered by Precision Paid vacation and sick leave Paid parental leave Professional development stipend  Due to the pandemic, we required all employees to be vaccinated against COVID-19. We are currently working in a hybrid model and require staff to work in the office 50% of working day in the month. We are seeking applicants who live in the New York City or Washington, DC areas.  The salary range for this role is $85,000 – 105,000.","<p>We’re Precision – an integrated strategy and marketing agency working with companies, causes, and candidates that change people’s minds and move them to action. We’ve helped win presidential elections, defined Fortune 50 brands, shaped public opinion, and created movements from the ground up. Don’t just break through. Break new ground. </p><p> </p><p>Precision is committed to building a diverse team that will positively and authentically impact the communities we serve. Centering our strategies around the authentic voices and cultures of the communities we are engaging with is paramount to our work – and our work can only be as inclusive as our team is representative. We strongly encourage women, Black, Latino, Hispanic, Asian American, Native Hawaiian, Pacific Islander, Indigenous people, LGBTQ+, gender expansive or GNC folks, people of all ages, disabled people, and veterans to apply. </p><p> </p><p>We are looking for someone who thrives in a fast-paced environment, wants to work in a team-oriented environment, and is inclined to seek out challenges and opportunities. As our Research Director, you will drive the execution of critical workstreams across a range of clients. You will mentor and collaborate closely with a team of analysts. Your primary responsibilities will be wrangling data from disparate sources to analyze, interpret, and extract key insights. Your duties also include crafting and delivering data-driven client presentations and project management. </p><p> </p><p><i><strong>What You Will Be Doing:</i></strong> </p><ul><li>Manage digital analytics, social listening, and secondary research projects from start to finish, ensuring successful, on-time completion of work. </li><li>Craft and present reports, presentations, and memos for a wide range of stakeholders—both internal and external—that provide clear and actionable insights. </li><li>Turn findings into insights, create narratives, and effectively communicate research results to drive strategy and enable clients to accomplish their objectives, including by working with colleagues on other teams. </li><li>Run a work stream on a client team. </li><li>Serve as a liaison to non-technical teams at the firm to help them understand our capabilities and how they can be applied to other projects. </li><li>Complete and delegate work appropriately. </li><li>Guide and mentor junior staff members. </li></ul><p> </p><p> </p><p><i><strong>Essential Qualifications:</i></strong> </p><ul><li>4+ years of relevant experience in marketing communications, marketing performance analytics, digital media measurement (earned or owned), social media measurement, market research, or other related fields. Prior agency and/or large philanthropic organization experience a strong plus. </li><li>Direct client management experience. Experience with large organizations and multiple stakeholders a plus. </li><li>Experience working with multiple clients at the same time. </li><li>Excellent written and verbal communication skills </li><li>Meticulous attention to detail </li><li>Creative, energetic, and possesses an entrepreneurial spirit. </li><li>Ability to lead planning and execution of work across a diverse range of client projects. </li><li>Expertise in Microsoft Office (Excel, PowerPoint) or Google Suite/Workspace (Sheets, Slides) </li><li>Ability to turn data into insights and communicate them effectively across a diverse range of stakeholders. </li><li>Competent in synthesizing and presenting research from several sources. </li></ul><p> </p><p><i><strong>Preferred Qualifications (any of the following would be nice to haves):</i></strong> </p><ul><li>Social listening, media monitoring, and advanced metrics analysis including the use of Meltwater, Cision, Brandwatch, Talkwalker, Newswhip, YouScan, Infegy, Buzzsumo, Rival IQ, Netbase/Quid, or similar tools. </li><li>Experience with audience insights or segmentation, including the use of Resonate, Audiense, DemographicsPro, ComScore, GWI, MRI, or similar tools. </li><li>Data visualization and the use of Tableau, Power BI, Google Data Studio, or similar. </li><li>Knowledge of native platform analytics tools including Facebook/Instagram Analytics, LinkedIn Analytics, etc. </li><li>Advanced knowledge of macros, pivot tables, data visualization, and advanced formula-building in Excel or Google Sheets. </li><li>Experience in voter file analysis. </li><li>Competency in using SAS, SPSS, SQL, Python, or R for statistical analysis. </li></ul><p> </p><p> </p><p><i><strong>What We Will Give You:</i></strong> </p><ul><li>Competitive salaries </li><li>Annual bonus opportunity </li><li>New business bonuses </li><li>Flexible hybrid remote/in-office plan </li><li>Retirement plan with automatic 3% safe-harbor contribution from Precision </li><li>Healthcare coverage - medical, dental, and vision, with 90% of costs covered by Precision </li><li>Paid vacation and sick leave </li><li>Paid parental leave </li><li>Professional development stipend </li></ul><p> </p><p>Due to the pandemic, we required all employees to be vaccinated against COVID-19. We are currently working in a hybrid model and require staff to work in the office 50% of working day in the month. We are seeking applicants who live in the New York City or Washington, DC areas. </p><p> </p><p>The salary range for this role is $85,000 – 105,000.</p>","Precision · Washington, DC (Hybrid)","https://www.linkedin.com/jobs/view/3852325600/","Washington, District of Columbia, United States","Skills: Attention to Detail, VBA Excel, +5 more","51-200 employees","LISTED","11779720","Precision","https://media.licdn.com/dms/image/C4D0BAQGcDWs-elTdRw/company-logo_400_400/0/1630557268201/precision_strategies_logo?e=1720656000&v=beta&t=N7Zne8hkisJD_3WGHoSGXildz3nfcG_qWBRywz-AITM","2024-03-13T15:58:41.000Z","2024-04-11T16:11:18.151Z"
