"Title","Description","Description HTML","Primary Description","Detail URL","Location","Skill","Insight","Job State","Poster Id","Company Name","Company Logo","Created At","Scraped At"
"Senior Quantitative UX Researcher, Google Cloud","Note: By applying to this position you will have an opportunity to share your preferred working location from the following: Seattle, WA, USA; Cambridge, MA, USA; Kirkland, WA, USA; New York, NY, USA; Pittsburgh, PA, USA.Minimum qualifications:

Bachelor's degree in Human-Computer Interaction, Cognitive Science, Statistics, Psychology, Anthropology, related field, or equivalent practical experience. 5 years of experience in an applied research setting, or similar. Experience in programming languages used for data manipulation and computational statistics (Python, R, MATLAB, C++, Java, Go), and with SQL. Product research experience in an applied research setting. 

Preferred qualifications:

Master's or PhD degree in Human-Computer Interaction, Cognitive Science, Statistics, Psychology, Anthropology, or related field. 5 years of experience conducting UX research on products and working with executive leadership (e.g., Director level and above). 3 years of experience managing projects, and working in a large, matrixed organization. Excellent command of research questions within a given domain, and of technical tools for the analysis of data within that field. Proficiency in programming computational and statistical algorithms for large data sets. Demonstrated expertise in descriptive, inferential, and multivariate statistics, including t-test and ANOVA, and experimental design. 

About The Job

At Google, we follow a simple but vital premise: ""Focus on the user and all else will follow."" Quantitative User Experience Researchers make this possible.

Google User Experience (UX) is made up of multi-disciplinary teams of UX Designers, Researchers, Writers, Content Strategists, Program Managers, and Engineers who care deeply about the people who use our products. The UX team plays an integral part in gathering insights about the attitudes, emotions, needs, and behaviors of people who use our products to inspire and inform design. We collaborate closely with each other and with engineering and product management to create industry-leading products that deliver value for the people who use them, and for Google’s businesses.

As a Quantitative User Experience Researcher (Quant UXR), you’ll help inform your team of UXers, product managers, and engineers about user needs. You’ll play a critical role in creating useful, usable, and delightful products. You’ll work with stakeholders across functions and levels and have impact at all stages of product development.

You will investigate user behavior and user needs using empirical research methods such as logs analysis, survey research, path modeling, and regression analysis. Quant UXRs vary in background using skills from computer science, quantitative social science, econometrics, data science, survey research, psychology, human-computer interaction, and other fields. You’ll combine skills in behavioral research design, statistical methods, and general programming to improve user experience.

The Quant UXR community at Google will help you do your best work. You’ll have the opportunity to work with and learn from UXRs across Google through regular meetups, mentor programs, and access to internal research tools.

Google Cloud accelerates organizations’ ability to digitally transform their business with the best infrastructure, platform, industry solutions and expertise. We deliver enterprise-grade solutions that leverage Google’s cutting-edge technology – all on the cleanest cloud in the industry. Customers in more than 200 countries and territories turn to Google Cloud as their trusted partner to enable growth and solve their most critical business problems.

The US base salary range for this full-time position is $139,000-$208,000 + bonus + equity + benefits. Our salary ranges are determined by role, level, and location. The range displayed on each job posting reflects the minimum and maximum target for new hire salaries for the position across all US locations. Within the range, individual pay is determined by work location and additional factors, including job-related skills, experience, and relevant education or training. Your recruiter can share more about the specific salary range for your preferred location during the hiring process.

Please note that the compensation details listed in US role postings reflect the base salary only, and do not include bonus, equity, or benefits. Learn more about benefits at Google .

Responsibilities

Define and measure quantitative UX goals and metrics in collaboration with Designers, Qualitative Researchers, Data Scientists, Engineers and Program Managers. Develop code and statistical models to understand user experience. Conduct empirical research using methods from computer science, quantitative social science, statistics, econometrics, and other fields to understand user behavior and extract meaningful patterns from large data sets. Examine existing data and product designs to generate hypotheses and plans for high-impact research. Prioritize and drive research to improve user experience. Communicate findings to stakeholders in the company. Make research findings convincing and actionable for both research experts and non-experts. 


Google is proud to be an equal opportunity workplace and is an affirmative action employer. We are committed to equal employment opportunity regardless of race, color, ancestry, religion, sex, national origin, sexual orientation, age, citizenship, marital status, disability, gender identity or Veteran status. We also consider qualified applicants regardless of criminal histories, consistent with legal requirements. See also Google's EEO Policy and EEO is the Law. If you have a disability or special need that requires accommodation, please let us know by completing our Accommodations for Applicants form .","Note: By applying to this position you will have an opportunity to share your preferred working location from the following: <strong>Seattle, WA, USA; Cambridge, MA, USA; Kirkland, WA, USA; New York, NY, USA; Pittsburgh, PA, USA</strong>.<strong>Minimum qualifications:

</strong><ul><li>Bachelor's degree in Human-Computer Interaction, Cognitive Science, Statistics, Psychology, Anthropology, related field, or equivalent practical experience. </li><li>5 years of experience in an applied research setting, or similar. </li><li>Experience in programming languages used for data manipulation and computational statistics (Python, R, MATLAB, C++, Java, Go), and with SQL. </li><li>Product research experience in an applied research setting. 

</li></ul><strong>Preferred qualifications:

</strong><ul><li>Master's or PhD degree in Human-Computer Interaction, Cognitive Science, Statistics, Psychology, Anthropology, or related field. </li><li>5 years of experience conducting UX research on products and working with executive leadership (e.g., Director level and above). </li><li>3 years of experience managing projects, and working in a large, matrixed organization. </li><li>Excellent command of research questions within a given domain, and of technical tools for the analysis of data within that field. </li><li>Proficiency in programming computational and statistical algorithms for large data sets. </li><li>Demonstrated expertise in descriptive, inferential, and multivariate statistics, including t-test and ANOVA, and experimental design. 

</li></ul><strong>About The Job

</strong>At Google, we follow a simple but vital premise: ""Focus on the user and all else will follow."" Quantitative User Experience Researchers make this possible.

Google User Experience (UX) is made up of multi-disciplinary teams of UX Designers, Researchers, Writers, Content Strategists, Program Managers, and Engineers who care deeply about the people who use our products. The UX team plays an integral part in gathering insights about the attitudes, emotions, needs, and behaviors of people who use our products to inspire and inform design. We collaborate closely with each other and with engineering and product management to create industry-leading products that deliver value for the people who use them, and for Google’s businesses.

As a Quantitative User Experience Researcher (Quant UXR), you’ll help inform your team of UXers, product managers, and engineers about user needs. You’ll play a critical role in creating useful, usable, and delightful products. You’ll work with stakeholders across functions and levels and have impact at all stages of product development.

You will investigate user behavior and user needs using empirical research methods such as logs analysis, survey research, path modeling, and regression analysis. Quant UXRs vary in background using skills from computer science, quantitative social science, econometrics, data science, survey research, psychology, human-computer interaction, and other fields. You’ll combine skills in behavioral research design, statistical methods, and general programming to improve user experience.

The Quant UXR community at Google will help you do your best work. You’ll have the opportunity to work with and learn from UXRs across Google through regular meetups, mentor programs, and access to internal research tools.

Google Cloud accelerates organizations’ ability to digitally transform their business with the best infrastructure, platform, industry solutions and expertise. We deliver enterprise-grade solutions that leverage Google’s cutting-edge technology – all on the cleanest cloud in the industry. Customers in more than 200 countries and territories turn to Google Cloud as their trusted partner to enable growth and solve their most critical business problems.

The US base salary range for this full-time position is $139,000-$208,000 + bonus + equity + benefits. Our salary ranges are determined by role, level, and location. The range displayed on each job posting reflects the minimum and maximum target for new hire salaries for the position across all US locations. Within the range, individual pay is determined by work location and additional factors, including job-related skills, experience, and relevant education or training. Your recruiter can share more about the specific salary range for your preferred location during the hiring process.

Please note that the compensation details listed in US role postings reflect the base salary only, and do not include bonus, equity, or benefits. Learn more about benefits at Google .

<strong>Responsibilities

</strong><ul><li>Define and measure quantitative UX goals and metrics in collaboration with Designers, Qualitative Researchers, Data Scientists, Engineers and Program Managers. </li><li>Develop code and statistical models to understand user experience. </li><li>Conduct empirical research using methods from computer science, quantitative social science, statistics, econometrics, and other fields to understand user behavior and extract meaningful patterns from large data sets. </li><li>Examine existing data and product designs to generate hypotheses and plans for high-impact research. </li><li>Prioritize and drive research to improve user experience. Communicate findings to stakeholders in the company. Make research findings convincing and actionable for both research experts and non-experts. 


</li></ul>Google is proud to be an equal opportunity workplace and is an affirmative action employer. We are committed to equal employment opportunity regardless of race, color, ancestry, religion, sex, national origin, sexual orientation, age, citizenship, marital status, disability, gender identity or Veteran status. We also consider qualified applicants regardless of criminal histories, consistent with legal requirements. See also Google's EEO Policy and EEO is the Law. If you have a disability or special need that requires accommodation, please let us know by completing our Accommodations for Applicants form .","Google","https://www.linkedin.com/jobs/view/3831384835/","Cambridge, Massachusetts, United States","Skills: Statistical Computing, SQL, +8 more","10,001+ employees · Software Development
11 connections work here · 380 school alumni work here","LISTED","29326500","Google","https://media.licdn.com/dms/image/C4D0BAQHiNSL4Or29cg/company-logo_400_400/0/1631311446380?e=1716422400&v=beta&t=A3cqHeP5kyVo6oMZlsMAvz52nq9jgZ_6fK1pHKQ3ZN0","2024-02-15T22:25:58.000Z","2024-02-22T22:37:26.156Z"
"Advanced Analytics Manager","Description

At Audible, we believe stories have the power to transform lives. It’s why we work with some of the world’s leading creators to produce and share audio storytelling with our millions of global listeners. We are dreamers and inventors who come from a wide range of backgrounds and experiences to empower and inspire each other. Imagine your future with us.

About This Role

As an Advanced Analytics Manager within Audible’s Analytics and Data Science group, you'll be responsible for surfacing data-driven opportunities for the business functions (Content, Marketing, Product, and/or New Growth/International). You'll provide tactical, operational, economic, and financial analysis to frame and drive decisions, and develop KPIs and scorecards to track initiative progress/performance and scientific models to drive a focus on results and execution. You'll partner with engineering and data science to marketing and product management – and develop the knowledge and skill to be a trusted technical advisor across a wide range of business areas.

About You

You are a “doer”, someone that can code at an excellent level, and likes to take ownership of data products or prototypes (being involved in conception, to design, to specification, to code, to test, to measurement, to presentation). You are able to work with minimal instruction and oversight, conduct multiple tasks and projects simultaneously, maintain relationships with senior leaders, and own deliverables end to end. You have an ability to think intentionally, develop insightful analysis, communicate findings concisely to leadership, work effectively as part of a cross functional team, and analyze big data. You are self-motivated with the capacity to work under tight deadlines, have a passion for the accuracy, relevance, quality, and impact of deliverables and possess high attention to detail. You have good written and oral communication/presentation skills and an ability to reconcile information from and for multiple stakeholders, and to manage communication across different audiences (technical vs. business, junior vs. senior). You have an intellectual curiosity for what drives the business, along with the aptitude and drive to learn new tools quickly.

As an Advanced Analytics Manager, you will...

 Illustrate key business trends and drivers through effective problem framing, data analysis, interpretation and visualization Create well designed management scorecards and dashboards that ensure accurate and robust reporting across key business/project/initiative metrics Deliver impactful analysis based on robust economic, financial, and statistical analysis Estimate the impact of different scenarios using robust analytical/financial models Develop and validate methods to optimize the Who, When, Where and How of all our interactions with customers, and demonstrate a good command of data science techniques that can be drawn upon in that context Develop an in-depth knowledge of all relevant data sources, business intelligence technologies and analytical tools - Know to leverage all of our assets to answer senior executive questions fast Develop compelling presentations and documents - and communicate them with impact and intuition Proactively communicate factors affecting deliverables to senior management Explain assumptions and quantitative methodologies to colleagues in their and other teams

About Audible

Audible is the leading producer and provider of audio storytelling. We spark listeners’ imaginations, offering immersive, cinematic experiences full of inspiration and insight to enrich our customers daily lives. Our Hub+Home hybrid workplace model gives employees the flexibility between gathering in a common office space (work from hub) and remote work (work from home). For more information, please visit adbl.co/hybrid.

We are open to hiring candidates to work out of one of the following locations:

Newark, NJ, USA

Basic Qualifications

 3+ years of relevant experience in the areas of Strategic Analytics, Business Intelligence, Data Science, or Consulting in a digital environment or in a related field Quantitative degree (Sciences, Operations Research (OR), Economics, Mathematics, Engineering, or similar field) or equivalent experience in a data driven/analytical role Experience with data/analytical tools Strong experience with SQL Experience using data visualization tools like Tableau or Microstrategy Experience with statistics and modeling Experience with Python, R, Jupyter, other analytics/data science tools

Preferred Qualifications

 MS degree (Sciences, Operations Research (OR), Economics, Mathematics, Engineering, or similar field) or equivalent experience in a data driven/analytical role Proficiency in Python, R or other analytics/data science tools Excellent written and oral communication/presentation skills Background in content/media, marketing tech, subscription business, and/or internet industries An understanding of ecommerce analytics, marketing analytics, experimentation, membership/loyalty analytics and revenue management techniques

Amazon is committed to a diverse and inclusive workplace. Amazon is an equal opportunity employer and does not discriminate on the basis of race, national origin, gender, gender identity, sexual orientation, protected veteran status, disability, age, or other legally protected status. For individuals with disabilities who would like to request an accommodation, please visit https://www.amazon.jobs/en/disability/us.


Company - Audible, Inc. - B13

Job ID: A2560690","<strong>Description

</strong>At Audible, we believe stories have the power to transform lives. It’s why we work with some of the world’s leading creators to produce and share audio storytelling with our millions of global listeners. We are dreamers and inventors who come from a wide range of backgrounds and experiences to empower and inspire each other. Imagine your future with us.

<strong>About This Role

</strong>As an Advanced Analytics Manager within Audible’s Analytics and Data Science group, you'll be responsible for surfacing data-driven opportunities for the business functions (Content, Marketing, Product, and/or New Growth/International). You'll provide tactical, operational, economic, and financial analysis to frame and drive decisions, and develop KPIs and scorecards to track initiative progress/performance and scientific models to drive a focus on results and execution. You'll partner with engineering and data science to marketing and product management – and develop the knowledge and skill to be a trusted technical advisor across a wide range of business areas.

<strong>About You

</strong>You are a “doer”, someone that can code at an excellent level, and likes to take ownership of data products or prototypes (being involved in conception, to design, to specification, to code, to test, to measurement, to presentation). You are able to work with minimal instruction and oversight, conduct multiple tasks and projects simultaneously, maintain relationships with senior leaders, and own deliverables end to end. You have an ability to think intentionally, develop insightful analysis, communicate findings concisely to leadership, work effectively as part of a cross functional team, and analyze big data. You are self-motivated with the capacity to work under tight deadlines, have a passion for the accuracy, relevance, quality, and impact of deliverables and possess high attention to detail. You have good written and oral communication/presentation skills and an ability to reconcile information from and for multiple stakeholders, and to manage communication across different audiences (technical vs. business, junior vs. senior). You have an intellectual curiosity for what drives the business, along with the aptitude and drive to learn new tools quickly.

As an Advanced Analytics Manager, you will...

<ul><li> Illustrate key business trends and drivers through effective problem framing, data analysis, interpretation and visualization</li><li> Create well designed management scorecards and dashboards that ensure accurate and robust reporting across key business/project/initiative metrics</li><li> Deliver impactful analysis based on robust economic, financial, and statistical analysis</li><li> Estimate the impact of different scenarios using robust analytical/financial models</li><li> Develop and validate methods to optimize the Who, When, Where and How of all our interactions with customers, and demonstrate a good command of data science techniques that can be drawn upon in that context</li><li> Develop an in-depth knowledge of all relevant data sources, business intelligence technologies and analytical tools - Know to leverage all of our assets to answer senior executive questions fast</li><li> Develop compelling presentations and documents - and communicate them with impact and intuition</li><li> Proactively communicate factors affecting deliverables to senior management</li><li> Explain assumptions and quantitative methodologies to colleagues in their and other teams

</li></ul><strong>About Audible

</strong>Audible is the leading producer and provider of audio storytelling. We spark listeners’ imaginations, offering immersive, cinematic experiences full of inspiration and insight to enrich our customers daily lives. Our Hub+Home hybrid workplace model gives employees the flexibility between gathering in a common office space (work from hub) and remote work (work from home). For more information, please visit adbl.co/hybrid.

We are open to hiring candidates to work out of one of the following locations:

Newark, NJ, USA

<strong>Basic Qualifications

</strong><ul><li> 3+ years of relevant experience in the areas of Strategic Analytics, Business Intelligence, Data Science, or Consulting in a digital environment or in a related field</li><li> Quantitative degree (Sciences, Operations Research (OR), Economics, Mathematics, Engineering, or similar field) or equivalent experience in a data driven/analytical role</li><li> Experience with data/analytical tools</li><li> Strong experience with SQL</li><li> Experience using data visualization tools like Tableau or Microstrategy</li><li> Experience with statistics and modeling</li><li> Experience with Python, R, Jupyter, other analytics/data science tools

</li></ul><strong>Preferred Qualifications

</strong><ul><li> MS degree (Sciences, Operations Research (OR), Economics, Mathematics, Engineering, or similar field) or equivalent experience in a data driven/analytical role</li><li> Proficiency in Python, R or other analytics/data science tools</li><li> Excellent written and oral communication/presentation skills</li><li> Background in content/media, marketing tech, subscription business, and/or internet industries</li><li> An understanding of ecommerce analytics, marketing analytics, experimentation, membership/loyalty analytics and revenue management techniques

</li></ul>Amazon is committed to a diverse and inclusive workplace. Amazon is an equal opportunity employer and does not discriminate on the basis of race, national origin, gender, gender identity, sexual orientation, protected veteran status, disability, age, or other legally protected status. For individuals with disabilities who would like to request an accommodation, please visit https://www.amazon.jobs/en/disability/us.


<strong>Company</strong> - Audible, Inc. - B13

Job ID: A2560690","Audible","https://www.linkedin.com/jobs/view/3828513417/","Newark, New Jersey, United States","Skills: Data Analytics, Data Science, +8 more","1,001-5,000 employees · Software Development
11 school alumni work here","LISTED","7745488","Audible","https://media.licdn.com/dms/image/D4E0BAQGIudlumA3XZA/company-logo_400_400/0/1698329869546?e=1716422400&v=beta&t=rdYdDJEhiQ0YEcSjsfkRFbFPYlaorl20TchZPshMkfA","2024-02-15T22:33:58.000Z","2024-02-22T22:37:26.156Z"
