"Title","Description","Description HTML","Primary Description","Detail URL","Location","Skill","Insight","Job State","Poster Id","Company Name","Company Logo","Created At","Scraped At"
"People Scientist - Employee Listening Researcher","Every day, tens of millions of people come to Roblox to explore, create, play, learn, and connect with friends in 3D immersive digital experiences– all created by our global community of developers and creators.

At Roblox, we’re building the tools and platform that empower our community to bring any experience that they can imagine to life. Our vision is to reimagine the way people come together, from anywhere in the world, and on any device. We’re on a mission to connect a billion people with optimism and civility, and looking for amazing talent to help us get there.

A career at Roblox means you’ll be working to shape the future of human interaction, solving unique technical challenges at scale, and helping to create safer, more civil shared experiences for everyone.

The People Science & Analytics team at Roblox supports our People, Places, & Systems group in optimizing the talent lifecycle, encompassing talent identification, data-driven competency development, and the scientific management of learning, development, and well-being throughout their tenure with our company.

Our team works to deliver a wide range of insights and solutions for Roblox, from developing industry-leading hiring assessments and conducting job analysis to performing both quantitative and qualitative workforce research, as well as architecting data analytics systems and tools.

Reporting to the Senior Director, People Science and Analytics, in this role you will join a world-class group of people, learning, and data scientists who are focused on collecting and using qualitative and quantitative data to guide decisions and to design and support Roblox's approach to leadership, people development, and organizational design and culture.

This role is based onsite at our HQ in San Mateo, CA.

You Will

Lead the development, administration, and analysis of surveys to gather valuable insights into employee experiences, engagement, and satisfaction.Lead the development, administration, and analysis of employee based focus groups.Communicate the results of complex data analyzes to internal stakeholders, providing data-driven insights that inform company efforts, policies, and decisions.Work with a versatile team of scientists, software engineers, game designers, and cross-functional groups to implement science-based and data-driven solutions across the entire range of recruiting and human resources challenges.Design and execute research studies that use modern research methods to evaluate the effectiveness of workplace programs.

You Have

MA (with 4+ years experience) or a PhD (with 2+ years experience) in Statistics, Survey Research Methods, Industrial-Organizational Psychology, Cognitive Psychology, or related field.2+ years of experience in qualitative methods.Expertise in Qualtrics (or related survey software)A background in survey methodology, analytics, sampling, and techniques to account for non-response bias.Curiosity and self-drive to continuously learn new techniques and tools to improve the organization.The ability to be flexible and quickly adapt in a fast-paced and ever-changing environment.

For roles that are based at our headquarters in San Mateo, CA: The starting base pay for this position is as shown below. The actual base pay is dependent upon a variety of job-related factors such as professional background, training, work experience, location, business needs and market demand. Therefore, in some circumstances, the actual salary could fall outside of this expected range. This pay range is subject to change and may be modified in the future. All full-time employees are also eligible for equity compensation and for benefits.

Annual Salary Range

$206,190—$270,270 USD

Roles that are based in our San Mateo, CA Headquarters are in-office Tuesday, Wednesday, and Thursday, with optional in-office on Monday and Friday (unless otherwise noted).

You’ll Love

Industry-leading compensation packageExcellent medical, dental, and vision coverageA rewarding 401k programFlexible vacation policyRoflex - Flexible and supportive work policy Roblox Admin badge for your avatarAt Roblox HQ: Free catered lunches five times a week and several fully stocked kitchens with unlimited snacksOnsite fitness center and fitness program creditAnnual CalTrain Go Pass
Roblox provides equal employment opportunities to all employees and applicants for employment and prohibits discrimination and harassment of any type without regard to race, color, religion, age, sex, national origin, disability status, genetics, protected veteran status, sexual orientation, gender identity or expression, or any other characteristic protected by federal, state or local laws. This policy applies to all terms and conditions of employment, including recruiting, hiring, placement, promotion, termination, layoff, recall, transfer, leaves of absence, compensation and training.","Every day, tens of millions of people come to Roblox to explore, create, play, learn, and connect with friends in 3D immersive digital experiences– all created by our global community of developers and creators.

At Roblox, we’re building the tools and platform that empower our community to bring any experience that they can imagine to life. Our vision is to reimagine the way people come together, from anywhere in the world, and on any device. We’re on a mission to connect a billion people with optimism and civility, and looking for amazing talent to help us get there.

A career at Roblox means you’ll be working to shape the future of human interaction, solving unique technical challenges at scale, and helping to create safer, more civil shared experiences for everyone.

The People Science & Analytics team at Roblox supports our People, Places, & Systems group in optimizing the talent lifecycle, encompassing talent identification, data-driven competency development, and the scientific management of learning, development, and well-being throughout their tenure with our company.

Our team works to deliver a wide range of insights and solutions for Roblox, from developing industry-leading hiring assessments and conducting job analysis to performing both quantitative and qualitative workforce research, as well as architecting data analytics systems and tools.

Reporting to the Senior Director, People Science and Analytics, in this role you will join a world-class group of people, learning, and data scientists who are focused on collecting and using qualitative and quantitative data to guide decisions and to design and support Roblox's approach to leadership, people development, and organizational design and culture.

This role is based onsite at our HQ in San Mateo, CA.

<strong>You Will

</strong><ul><li>Lead the development, administration, and analysis of surveys to gather valuable insights into employee experiences, engagement, and satisfaction.</li><li>Lead the development, administration, and analysis of employee based focus groups.</li><li>Communicate the results of complex data analyzes to internal stakeholders, providing data-driven insights that inform company efforts, policies, and decisions.</li><li>Work with a versatile team of scientists, software engineers, game designers, and cross-functional groups to implement science-based and data-driven solutions across the entire range of recruiting and human resources challenges.</li><li>Design and execute research studies that use modern research methods to evaluate the effectiveness of workplace programs.

</li></ul><strong>You Have

</strong><ul><li>MA (with 4+ years experience) or a PhD (with 2+ years experience) in Statistics, Survey Research Methods, Industrial-Organizational Psychology, Cognitive Psychology, or related field.</li><li>2+ years of experience in qualitative methods.</li><li>Expertise in Qualtrics (or related survey software)</li><li>A background in survey methodology, analytics, sampling, and techniques to account for non-response bias.</li><li>Curiosity and self-drive to continuously learn new techniques and tools to improve the organization.</li><li>The ability to be flexible and quickly adapt in a fast-paced and ever-changing environment.

</li></ul>For roles that are based at our headquarters in San Mateo, CA: The starting base pay for this position is as shown below. The actual base pay is dependent upon a variety of job-related factors such as professional background, training, work experience, location, business needs and market demand. Therefore, in some circumstances, the actual salary could fall outside of this expected range. This pay range is subject to change and may be modified in the future. All full-time employees are also eligible for equity compensation and for benefits.

Annual Salary Range

$206,190—$270,270 USD

Roles that are based in our San Mateo, CA Headquarters are in-office Tuesday, Wednesday, and Thursday, with optional in-office on Monday and Friday (unless otherwise noted).

<strong>You’ll Love

</strong><ul><li>Industry-leading compensation package</li><li>Excellent medical, dental, and vision coverage</li><li>A rewarding 401k program</li><li>Flexible vacation policy</li><li>Roflex - Flexible and supportive work policy </li><li>Roblox Admin badge for your avatar</li><li>At Roblox HQ: </li><ul><li>Free catered lunches five times a week and several fully stocked kitchens with unlimited snacks</li><li>Onsite fitness center and fitness program credit</li><li>Annual CalTrain Go Pass
</li></ul></ul>Roblox provides equal employment opportunities to all employees and applicants for employment and prohibits discrimination and harassment of any type without regard to race, color, religion, age, sex, national origin, disability status, genetics, protected veteran status, sexual orientation, gender identity or expression, or any other characteristic protected by federal, state or local laws. This policy applies to all terms and conditions of employment, including recruiting, hiring, placement, promotion, termination, layoff, recall, transfer, leaves of absence, compensation and training.","Roblox · San Mateo, CA (Hybrid)","https://www.linkedin.com/jobs/view/3845886329/","San Mateo, California, United States","Skills: Survey Methodology, Cognitive Psychology, +8 more","1,001-5,000 employees · Software Development
11 school alumni work here","LISTED","37021929","Roblox","https://media.licdn.com/dms/image/C4E0BAQHcBSrlw3MI3g/company-logo_400_400/0/1661789836195/roblox_logo?e=1720656000&v=beta&t=UdSNwrYDAcdu4LLwFiYfOBE_FWPPEGQjoCWwbio7GcI","2024-03-08T21:31:58.000Z","2024-04-11T16:11:18.151Z"
