"Title","Description","Description HTML","Primary Description","Detail URL","Location","Skill","Insight","Job State","Poster Id","Company Name","Company Logo","Created At","Scraped At"
"Trust and Safety Intelligence Analyst","Note: By applying to this position you will have an opportunity to share your preferred working location from the following: Austin, TX, USA; Atlanta, GA, USA; Washington D.C., DC, USA.Minimum qualifications:

Bachelor's degree or equivalent practical experience.4 years of experience in Trust and Safety, intelligence, security analysis, threat or risk management, geopolitical forecasting, or a related field.

Preferred qualifications:

Master's degree or equivalent practical experience.Experience using investigative, data-driven approaches to answering questions.Experience synthesizing information and briefings to senior executives.Experience with automation and analytical methods to streamline workflows.Experience using SQL, building dashboards, and visualizing data.Knowledge across intelligence analysis, content moderation, and trust risk issues.

About The Job

Trust & Safety team members are tasked with identifying and taking on the biggest problems that challenge the safety and integrity of our products. They use technical know-how, excellent problem-solving skills, user insights, and proactive communication to protect users and our partners from abuse across Google products like Search, Maps, Gmail, and Google Ads. On this team, you're a big-picture thinker and strategic team-player with a passion for doing what’s right. You work globally and cross-functionally with Google engineers and product managers to identify and fight abuse and fraud cases at Google speed - with urgency. And you take pride in knowing that every day you are working hard to promote trust in Google and ensuring the highest levels of user safety.

The Intelligence Analysis team synthesizes cross-Google intelligence, and prioritizes threats that could harm Google or its users. Analysts deliver actionable assessments to Google stakeholders to drive decision making, risk preparedness, and mitigation.

At Google we work hard to earn our users’ trust every day. Trust & Safety is Google’s team of abuse fighting and user trust experts working daily to make the internet a safer place. We partner with teams across Google to deliver bold solutions in abuse areas such as malware, spam and account hijacking. A diverse team of Analysts, Policy Specialists, Engineers, and Program Managers, we work to reduce risk and fight abuse across all of Google’s products, protecting our users, advertisers, and publishers across the globe in over 40 languages.

The US base salary range for this full-time position is $108,000-$158,000 + bonus + equity + benefits. Our salary ranges are determined by role, level, and location. The range displayed on each job posting reflects the minimum and maximum target salaries for the position across all US locations. Within the range, individual pay is determined by work location and additional factors, including job-related skills, experience, and relevant education or training. Your recruiter can share more about the specific salary range for your preferred location during the hiring process.

Please note that the compensation details listed in US role postings reflect the base salary only, and do not include bonus, equity, or benefits. Learn more about benefits at Google .

Responsibilities

Anticipate and analyze risks to trust in Google and the safety of its users, regarding geopolitical developments and global elections.Identify emerging abuse or risk trends and forecast new forms of abuse.Synthesize information and data sources for executive stakeholders, and collaborate with trust and safety intel collections, investigations, and red teams.Use AI-enabled tooling and help develop innovative analytic capabilities.Work with sensitive content or situations and possibly graphic, controversial, or upsetting topics or content.


Google is proud to be an equal opportunity workplace and is an affirmative action employer. We are committed to equal employment opportunity regardless of race, color, ancestry, religion, sex, national origin, sexual orientation, age, citizenship, marital status, disability, gender identity or Veteran status. We also consider qualified applicants regardless of criminal histories, consistent with legal requirements. See also Google's EEO Policy and EEO is the Law. If you have a disability or special need that requires accommodation, please let us know by completing our Accommodations for Applicants form .","Note: By applying to this position you will have an opportunity to share your preferred working location from the following: <strong>Austin, TX, USA; Atlanta, GA, USA; Washington D.C., DC, USA</strong>.<strong>Minimum qualifications:

</strong><ul><li>Bachelor's degree or equivalent practical experience.</li><li>4 years of experience in Trust and Safety, intelligence, security analysis, threat or risk management, geopolitical forecasting, or a related field.

</li></ul><strong>Preferred qualifications:

</strong><ul><li>Master's degree or equivalent practical experience.</li><li>Experience using investigative, data-driven approaches to answering questions.</li><li>Experience synthesizing information and briefings to senior executives.</li><li>Experience with automation and analytical methods to streamline workflows.</li><li>Experience using SQL, building dashboards, and visualizing data.</li><li>Knowledge across intelligence analysis, content moderation, and trust risk issues.

</li></ul><strong>About The Job

</strong>Trust & Safety team members are tasked with identifying and taking on the biggest problems that challenge the safety and integrity of our products. They use technical know-how, excellent problem-solving skills, user insights, and proactive communication to protect users and our partners from abuse across Google products like Search, Maps, Gmail, and Google Ads. On this team, you're a big-picture thinker and strategic team-player with a passion for doing what’s right. You work globally and cross-functionally with Google engineers and product managers to identify and fight abuse and fraud cases at Google speed - with urgency. And you take pride in knowing that every day you are working hard to promote trust in Google and ensuring the highest levels of user safety.

The Intelligence Analysis team synthesizes cross-Google intelligence, and prioritizes threats that could harm Google or its users. Analysts deliver actionable assessments to Google stakeholders to drive decision making, risk preparedness, and mitigation.

At Google we work hard to earn our users’ trust every day. Trust & Safety is Google’s team of abuse fighting and user trust experts working daily to make the internet a safer place. We partner with teams across Google to deliver bold solutions in abuse areas such as malware, spam and account hijacking. A diverse team of Analysts, Policy Specialists, Engineers, and Program Managers, we work to reduce risk and fight abuse across all of Google’s products, protecting our users, advertisers, and publishers across the globe in over 40 languages.

The US base salary range for this full-time position is $108,000-$158,000 + bonus + equity + benefits. Our salary ranges are determined by role, level, and location. The range displayed on each job posting reflects the minimum and maximum target salaries for the position across all US locations. Within the range, individual pay is determined by work location and additional factors, including job-related skills, experience, and relevant education or training. Your recruiter can share more about the specific salary range for your preferred location during the hiring process.

Please note that the compensation details listed in US role postings reflect the base salary only, and do not include bonus, equity, or benefits. Learn more about benefits at Google .

<strong>Responsibilities

</strong><ul><li>Anticipate and analyze risks to trust in Google and the safety of its users, regarding geopolitical developments and global elections.</li><li>Identify emerging abuse or risk trends and forecast new forms of abuse.</li><li>Synthesize information and data sources for executive stakeholders, and collaborate with trust and safety intel collections, investigations, and red teams.</li><li>Use AI-enabled tooling and help develop innovative analytic capabilities.</li><li>Work with sensitive content or situations and possibly graphic, controversial, or upsetting topics or content.


</li></ul>Google is proud to be an equal opportunity workplace and is an affirmative action employer. We are committed to equal employment opportunity regardless of race, color, ancestry, religion, sex, national origin, sexual orientation, age, citizenship, marital status, disability, gender identity or Veteran status. We also consider qualified applicants regardless of criminal histories, consistent with legal requirements. See also Google's EEO Policy and EEO is the Law. If you have a disability or special need that requires accommodation, please let us know by completing our Accommodations for Applicants form .","Google · Washington, DC (On-site)","https://www.linkedin.com/jobs/view/3903893478/","Washington, District of Columbia, United States","Skills: Critical Thinking, Analytics, +8 more","10,001+ employees · Software Development
11 connections work here · 390 school alumni work here","LISTED","29326500","Google","https://media.licdn.com/dms/image/C4D0BAQHiNSL4Or29cg/company-logo_400_400/0/1631311446380?e=1721865600&v=beta&t=Ksi_3LkwDp2ehgpbUAlvcV8QqU5LJNuTsqL8gJWizsU","2024-04-19T04:30:02.000Z","2024-04-21T14:02:58.978Z"
"Design Operations Lead, AI","Overview

Working at Atlassian

Atlassians can choose where they work – whether in an office, from home, or a combination of the two. That way, Atlassians have more control over supporting their family, personal goals, and other priorities. We can hire people in any country where we have a legal entity. Interviews and onboarding are conducted virtually, a part of being a distributed-first company.

This is a remote position. To help our teams work together effectively, this role requires you to be located in the Pacific Timezone.

Your future team

Our Design Operations team is a multi-disciplinary team focused on ensuring more effective designers and a more efficient Design organization. We operationalize and improve design practices, systems, and tools that drive craft excellence and efficiency – at scale.

We are looking for an experienced Design Operations Lead, AI to join our team to support! You will report to the Head of Design Operations.

Responsibilities

As Design Operations Lead, you will:

Lead as a strategic partner: You will understand the big picture and drive overall success, while tactically delivering incremental value for the team and the company. As an embedded DesignOps partner, you will partner with the Head of Design, Atlassian Intelligence, and their leadership team on org-level design initiatives. You will focus on leading operating cadences, and scaling practices that improve quality and effectiveness. You will be a ""go-to"" partner – always one step ahead, anticipating needs, identifying painpoints, and implementing solutions to enhance the effectiveness of design teams.

Bring strategy to action: Leading multiple workstreams, you will lead collaborative efforts to improve work management practices, instill effective team practices, and ensure alignment on a global change strategy. You will run complex -- often ambiguous -- programs. You will establish processes and governance and partner with Leads to provide clear guardrails while empowering teams to move quickly.

Role model communication and influence: You will lead through influence. Promoting shared understanding, and collaboration across teammates, leadership, designers, and partners. You will know when to drive, when to coach, and when to dive in.

Improve Design Ops excellence: As a senior member of our team, you will help our Design Operations team improve operational best practices, strengthen feedback and learning loops, implement our long-term strategy, and lead efforts to deliver measurable outcomes within the team and across the broader Design organization.

Does this sound fun to you? You might just be the person we're looking for.

Qualifications

To be successful in this role, you:

Are a problem solver. You think fast on your feet, come up with solutions to important situations, are swift to decision, and take calculated risks. You seek out opportunities to improve - always searching for new knowledge and new ideas. You experiment, take lessons from failure, and iterate.Are an excellent communicator. You know how to connect with people all over the globe at multiple levels of seniority. You understand the importance of translation and you know how to communicate complex ideas.You are a multiplier at all levels. You are a team player who seamlessly collaborates with diverse teams to navigate challenges. You are a multiplier who recognizes the skills around you and you inspire and motivate others to deliver their best work.You are a systems thinker. You always have a line of sight to the big picture. You're constantly looking to connect the dots and solve the root problem – not just the immediate symptom.Love operations. You're organized, proactive, and excel in the details. You recognize the importance of long-term goals and are committed to success. You break down complex tasks and fine-tune operations to ensure that every piece of the puzzle fits just right.


Your background

8+ years of relevant professional experience delivering programs that affect people and processes, ideally in design operations, consulting, or business operationsExpertise in design practices and methodologies, product development lifecycle, and measurement & evaluationComfort in the level of learning and ambiguity needed to navigate fast-evolving emerging technologies like AIStrong program management and stakeholder management skillsExperience driving change management across a large, globally distributed organizationExpertise in measuring impact, identifying risks, and focusing projects on priorities that accomplish outcomes


Compensation

At Atlassian, we strive to design equitable, explainable, and competitive compensation programs. To support this goal, the baseline of our range is higher than that of the typical market range, but in turn we expect to hire most candidates near this baseline. Base pay within the range is ultimately determined by a candidate's skills, expertise, or experience. In the United States, we have three geographic pay zones. For this role, our current base pay ranges for new hires in each zone are:

Zone A: $188,800 - $251,700

Zone B: $169,900 - $226,500

Zone C: $156,700 - $208,900

This role may also be eligible for benefits, bonuses, commissions, and equity.

Please visit go.atlassian.com/payzones for more information on which locations are included in each of our geographic pay zones. However, please confirm the zone for your specific location with your recruiter.

Our Perks & Benefits

Atlassian offers a variety of perks and benefits to support you, your family and to help you engage with your local community. Our offerings include health coverage, paid volunteer days, wellness resources, and so much more. Visit go.atlassian.com/perksandbenefits to learn more.

About Atlassian

At Atlassian, we're motivated by a common goal: to unleash the potential of every team. Our software products help teams all over the planet and our solutions are designed for all types of work. Team collaboration through our tools makes what may be impossible alone, possible together.

We believe that the unique contributions of all Atlassians create our success. To ensure that our products and culture continue to incorporate everyone's perspectives and experience, we never discriminate based on race, religion, national origin, gender identity or expression, sexual orientation, age, or marital, veteran, or disability status. All your information will be kept confidential according to EEO guidelines.

To provide you the best experience, we can support with accommodations or adjustments at any stage of the recruitment process. Simply inform our Recruitment team during your conversation with them.

Pursuant to the San Francisco Fair Chance Ordinance, we will consider for employment qualified applicants with arrest and conviction records.

To learn more about our culture and hiring process, visit go.atlassian.com/crh .","<strong>Overview

</strong><strong>Working at Atlassian

</strong>Atlassians can choose where they work – whether in an office, from home, or a combination of the two. That way, Atlassians have more control over supporting their family, personal goals, and other priorities. We can hire people in any country where we have a legal entity. Interviews and onboarding are conducted virtually, a part of being a distributed-first company.

This is a remote position. To help our teams work together effectively, this role requires you to be located in the Pacific Timezone.

<strong>Your future team

</strong>Our Design Operations team is a multi-disciplinary team focused on ensuring more effective designers and a more efficient Design organization. We operationalize and improve design practices, systems, and tools that drive craft excellence and efficiency – at scale.

We are looking for an experienced Design Operations Lead, AI to join our team to support! You will report to the Head of Design Operations.

<strong>Responsibilities

</strong><strong>As Design Operations Lead, you will:

</strong><strong>Lead as a strategic partner: </strong>You will understand the big picture and drive overall success, while tactically delivering incremental value for the team and the company. As an embedded DesignOps partner, you will partner with the Head of Design, Atlassian Intelligence, and their leadership team on org-level design initiatives. You will focus on leading operating cadences, and scaling practices that improve quality and effectiveness. You will be a ""go-to"" partner – always one step ahead, anticipating needs, identifying painpoints, and implementing solutions to enhance the effectiveness of design teams.

<strong>Bring strategy to action:</strong> Leading multiple workstreams, you will lead collaborative efforts to improve work management practices, instill effective team practices, and ensure alignment on a global change strategy. You will run complex -- often ambiguous -- programs. You will establish processes and governance and partner with Leads to provide clear guardrails while empowering teams to move quickly.

<strong>Role model communication and influence:</strong> You will lead through influence. Promoting shared understanding, and collaboration across teammates, leadership, designers, and partners. You will know when to drive, when to coach, and when to dive in.

<strong>Improve Design Ops excellence: </strong>As a senior member of our team, you will help our Design Operations team improve operational best practices, strengthen feedback and learning loops, implement our long-term strategy, and lead efforts to deliver measurable outcomes within the team and across the broader Design organization.

Does this sound fun to you? You might just be the person we're looking for.

<strong>Qualifications

</strong><strong>To be successful in this role, you:

</strong><ul><li>Are a problem solver. You think fast on your feet, come up with solutions to important situations, are swift to decision, and take calculated risks. You seek out opportunities to improve - always searching for new knowledge and new ideas. You experiment, take lessons from failure, and iterate.</li><li>Are an excellent communicator. You know how to connect with people all over the globe at multiple levels of seniority. You understand the importance of translation and you know how to communicate complex ideas.</li><li>You are a multiplier at all levels. You are a team player who seamlessly collaborates with diverse teams to navigate challenges. You are a multiplier who recognizes the skills around you and you inspire and motivate others to deliver their best work.</li><li>You are a systems thinker. You always have a line of sight to the big picture. You're constantly looking to connect the dots and solve the root problem – not just the immediate symptom.</li><li>Love operations. You're organized, proactive, and excel in the details. You recognize the importance of long-term goals and are committed to success. You break down complex tasks and fine-tune operations to ensure that every piece of the puzzle fits just right.


</li></ul><strong>Your background

</strong><ul><li>8+ years of relevant professional experience delivering programs that affect people and processes, ideally in design operations, consulting, or business operations</li><li>Expertise in design practices and methodologies, product development lifecycle, and measurement & evaluation</li><li>Comfort in the level of learning and ambiguity needed to navigate fast-evolving emerging technologies like AI</li><li>Strong program management and stakeholder management skills</li><li>Experience driving change management across a large, globally distributed organization</li><li>Expertise in measuring impact, identifying risks, and focusing projects on priorities that accomplish outcomes


</li></ul><strong>Compensation

</strong>At Atlassian, we strive to design equitable, explainable, and competitive compensation programs. To support this goal, the baseline of our range is higher than that of the typical market range, but in turn we expect to hire most candidates near this baseline. Base pay within the range is ultimately determined by a candidate's skills, expertise, or experience. In the United States, we have three geographic pay zones. For this role, our current base pay ranges for new hires in each zone are:

Zone A: $188,800 - $251,700

Zone B: $169,900 - $226,500

Zone C: $156,700 - $208,900

This role may also be eligible for benefits, bonuses, commissions, and equity.

Please visit go.atlassian.com/payzones for more information on which locations are included in each of our geographic pay zones. However, please confirm the zone for your specific location with your recruiter.

<strong>Our Perks & Benefits

</strong>Atlassian offers a variety of perks and benefits to support you, your family and to help you engage with your local community. Our offerings include health coverage, paid volunteer days, wellness resources, and so much more. Visit <strong>go.atlassian.com/perksandbenefits</strong> to learn more.

<strong>About Atlassian

</strong>At Atlassian, we're motivated by a common goal: to unleash the potential of every team. Our software products help teams all over the planet and our solutions are designed for all types of work. Team collaboration through our tools makes what may be impossible alone, possible together.

We believe that the unique contributions of all Atlassians create our success. To ensure that our products and culture continue to incorporate everyone's perspectives and experience, we never discriminate based on race, religion, national origin, gender identity or expression, sexual orientation, age, or marital, veteran, or disability status. All your information will be kept confidential according to EEO guidelines.

To provide you the best experience, we can support with accommodations or adjustments at any stage of the recruitment process. Simply inform our Recruitment team during your conversation with them.

Pursuant to the San Francisco Fair Chance Ordinance, we will consider for employment qualified applicants with arrest and conviction records.

To learn more about our culture and hiring process, visit <strong>go.atlassian.com/crh</strong> <strong>.</strong>","Atlassian · San Francisco, CA","https://www.linkedin.com/jobs/view/3898700880/","San Francisco, California, United States","Skills: User Interface Design, User Experience (UX), +8 more","5,001-10,000 employees · Software Development
1 connection works here · 15 school alumni work here","LISTED","452769151","Atlassian","https://media.licdn.com/dms/image/C560BAQH5FOSGbPkisg/company-logo_400_400/0/1654721406036/atlassian_logo?e=1721865600&v=beta&t=GXAriqGVwAhuJFnzVAlA_h7W-_o8EtYIiHRHR2uQfp0","2024-04-15T22:05:33.000Z","2024-04-21T14:02:58.978Z"
