"Title","Description","Description HTML","Primary Description","Detail URL","Location","Skill","Insight","Job State","Poster Id","Company Name","Company Logo","Created At","Scraped At"
"Human Factors Engineer III","Human Factors Engineer III - Verathon® 
Verathon® is seeking a Human Factors Engineer become the newest member of our Visualization Business Unit R&D Team in Bothell, WA. 
The Human Factors Engineer is responsible for ensuring our products are safe and easy to use. As part of the new product development process, you will have primary responsibility for formative and summative usability studies to test understanding of our products and labeling. The Human Factors Engineer will work closely with product planning to test product concepts and feed this information back to the design teams to optimize use of our products. This person will also work closely with the quality and regulatory groups to create the usability and Human Factors documentation required for submission to medical device regulatory agencies.
Principal Responsibilities:· Participate and provide usability input during the initial product concept design process.· Create the user requirements and specification documents.· Create use and human factors plans and protocols· Conduct formative usability research and create appropriate documentation to inform needed design changes· Participate in efforts required to create and update usability risk analyses for VBU products.· Provide input to key use related documents and activities, including user needs, product labeling, and the system risk assessment.· Create plans and protocols to validate indications for use, user needs, usability risk mitigations, labeling, and product claims· Conduct summative usability validation studies, including ultimate responsibility for user recruiting and testing· Write usability validation reports· Support content transfer into summary V&V and Safety Risk Management reports· Perform document regression analyses for legacy product design changes· Prepare documentation for submission to regulatory agencies and notified bodies, including HFE/UE Reports· Maintain current knowledge of regulations and best practices for medical device human factors (e.g. IEC 62366, AAMI HE75, FDA Applying Human Factors and Usability Engineering to Medical Devices) · Conduct post-use usability testing, providing input to NPD and sustaining project prioritization.· Advise management regarding potential improvements to internal processes and regulatory issues related to usability engineering.
Knowledge, Skills, and Abilities:· Bachelor’s degree in relevant field; Master’s preferred.· Typically, a minimum of 5 years of human factors experience, Medical device experience is desired.· Familiarity with Use and Human Factors standards and regulatory guidelines regarding proper validation procedures· Ability to work on multiple projects at the same time - exceptional organizational and time management skills· Strong use and human factors research skills· Ability to analyze and synthesize large quantities of information· Superior ability to write accurate, clear, and concise protocols and reports in a timely manner· Excellent problem-solving skills· Self-motivated and strong attention to detail· Demonstrated computer skills preferably spreadsheets, word processing, database, internet research and other applicable software programs· 10% domestic and foreign travel is required· EIT highly preferred
About Verathon:Verathon is a global medical device company focused on supporting customers by being their trusted partner, delivering high-quality products that endure over time and ensure clinical and economic utility. Two areas where Verathon has significantly impacted patient care, and become the market leader in each, are bladder volume measurement and airway management. The company’s BladderScan portable ultrasound and GlideScope video laryngoscopy & bronchoscopy systems effectively address unmet needs for healthcare providers and meaningfully raise the standard of care for patients. Verathon, a subsidiary of Roper Technologies, is headquartered in Bothell, Washington, USA and has international subsidiaries in Canada, Europe and Asia Pacific. For more information, please visit www.verathon.com. Verathon is an equal opportunity employer and strongly supports diversity in the workplace. We believe that diverse ideas, opinions and perspectives will build a strong foundation for success. In order to provide equal employment and advancement opportunities to all individuals, employment decisions at Verathon will be based on merit, qualifications, and abilities. Verathon does not discriminate in employment opportunities or practices on the basis of race, color, religion, sexual orientation, gender identity, national origin, age, disability, or any other characteristic protected by law.","<p><strong>Human Factors Engineer III - Verathon® </strong></p><p>
</p><p><strong>Verathon®</strong> is seeking a Human Factors Engineer become the newest member of our Visualization Business Unit R&D Team in Bothell, WA. </p><p>
</p><p>The Human Factors Engineer is responsible for ensuring our products are safe and easy to use. As part of the new product development process, you will have primary responsibility for formative and summative usability studies to test understanding of our products and labeling. The Human Factors Engineer will work closely with product planning to test product concepts and feed this information back to the design teams to optimize use of our products. This person will also work closely with the quality and regulatory groups to create the usability and Human Factors documentation required for submission to medical device regulatory agencies.</p><p>
</p><p><strong>Principal Responsibilities:</strong></p><p>· Participate and provide usability input during the initial product concept design process.</p><p>· Create the user requirements and specification documents.</p><p>· Create use and human factors plans and protocols</p><p>· Conduct formative usability research and create appropriate documentation to inform needed design changes</p><p>· Participate in efforts required to create and update usability risk analyses for VBU products.</p><p>· Provide input to key use related documents and activities, including user needs, product labeling, and the system risk assessment.</p><p>· Create plans and protocols to validate indications for use, user needs, usability risk mitigations, labeling, and product claims</p><p>· Conduct summative usability validation studies, including ultimate responsibility for user recruiting and testing</p><p>· Write usability validation reports</p><p>· Support content transfer into summary V&V and Safety Risk Management reports</p><p>· Perform document regression analyses for legacy product design changes</p><p>· Prepare documentation for submission to regulatory agencies and notified bodies, including HFE/UE Reports</p><p>· Maintain current knowledge of regulations and best practices for medical device human factors (e.g. IEC 62366, AAMI HE75, FDA Applying Human Factors and Usability Engineering to Medical Devices) </p><p>· Conduct post-use usability testing, providing input to NPD and sustaining project prioritization.</p><p>· Advise management regarding potential improvements to internal processes and regulatory issues related to usability engineering.</p><p>
</p><p><strong>Knowledge, Skills, and Abilities:</strong></p><p>· Bachelor’s degree in relevant field; Master’s preferred.</p><p>· Typically, a minimum of 5 years of human factors experience, Medical device experience is desired.</p><p>· Familiarity with Use and Human Factors standards and regulatory guidelines regarding proper validation procedures</p><p>· Ability to work on multiple projects at the same time - exceptional organizational and time management skills</p><p>· Strong use and human factors research skills</p><p>· Ability to analyze and synthesize large quantities of information</p><p>· Superior ability to write accurate, clear, and concise protocols and reports in a timely manner</p><p>· Excellent problem-solving skills</p><p>· Self-motivated and strong attention to detail</p><p>· Demonstrated computer skills preferably spreadsheets, word processing, database, internet research and other applicable software programs</p><p>· 10% domestic and foreign travel is required</p><p>· EIT highly preferred</p><p>
</p><p><strong>About Verathon:</strong></p><p>Verathon is a global medical device company focused on supporting customers by being their trusted partner, delivering high-quality products that endure over time and ensure clinical and economic utility. Two areas where Verathon has significantly impacted patient care, and become the market leader in each, are bladder volume measurement and airway management. The company’s BladderScan portable ultrasound and GlideScope video laryngoscopy & bronchoscopy systems effectively address unmet needs for healthcare providers and meaningfully raise the standard of care for patients. Verathon, a subsidiary of Roper Technologies, is headquartered in Bothell, Washington, USA and has international subsidiaries in Canada, Europe and Asia Pacific. For more information, please visit <undefined>www.verathon.com</undefined>.</p><p><i> </i></p><p><i>Verathon is an equal opportunity employer and strongly supports diversity in the workplace. We believe that diverse ideas, opinions and perspectives will build a strong foundation for success. In order to provide equal employment and advancement opportunities to all individuals, employment decisions at Verathon will be based on merit, qualifications, and abilities. Verathon does not discriminate in employment opportunities or practices on the basis of race, color, religion, sexual orientation, gender identity, national origin, age, disability, or any other characteristic protected by law.</i></p>","Verathon · Bothell, WA (Hybrid)","https://www.linkedin.com/jobs/view/3880629537/","Bothell, Washington, United States","Skills: User Interface Design, Usability Engineering, +8 more","501-1,000 employees · Medical Equipment Manufacturing","LISTED","574959457","Verathon","https://media.licdn.com/dms/image/D4D0BAQGCRh7dqkcqjA/company-logo_400_400/0/1689796151761/verathon_logo?e=1722470400&v=beta&t=i6igv3murix70mcmSB9QXtr9DYNy2vLa55aRKfKk_JM","2024-04-03T20:14:41.000Z","2024-04-30T00:07:46.481Z"
"Head of People Analytics - Human Resources","Blackstone is the world’s largest alternative asset manager. We seek to create positive economic impact and long-term value for our investors, the companies we invest in, and the communities in which we work. We do this by using extraordinary people and flexible capital to help companies solve problems. Our $1 trillion in assets under management include investment vehicles focused on private equity, real estate, public debt and equity, infrastructure, life sciences, growth equity, opportunistic, non-investment grade credit, real assets and secondary funds, all on a global basis. Further information is available at www.blackstone.com. Follow @blackstone on LinkedIn, Twitter, and Instagram.

The People Analytics Team is focused on providing actionable insights to help our partners in Human Resources and the Strategic Incentives Group drive critical business decisions with data.

This position will serve as a strategic partner and leader for delivering the value of data-driven HR-SIG insights, employee and organizational predictions and trends, and compelling People Analytics business cases and data stories that enable enterprise decision-making for HRLT and firmwide leadership.

Primary responsibilities include:

Partner with CHRO/COO to identify strategic analytics needs and formulate the relevant people and organizational research, metrics and KPIs to enable execution of critical business decisionsLead and collaborate with key stakeholder teams (e.g. People Analytics, HRLT, etc) to solve for root issues/opportunities and interpret data-driven solutions -- distilling complex analytics into clear outcomes and actionable insights, plans, and recommendationsEmploy a structured approach in developing and executing analytical storytelling and change management techniques that drive meaningful transformationTranslate information into compelling executive reporting (e.g., crafting the narrative, PPT presentation design and build, data visualizations, etc.)Manage a team of data, reporting and analytics professionalsStrive for reporting excellence through continuous feedback and agile iterationsSteer executive level presentations, business meetings, and analytical discussionsAddress ad hoc firm leadership data-driven reporting requests with a sense of urgency and commitment to partner satisfactionShare thought leadership around the evolving People Analytics vision, incorporating new systems and methodologies as they reach maturityAdvance culture of analytical discipline and progress toward overarching HR-SIG data-driven goals that maximize strategic business outcomes with every deliverable

Qualifications:

Strong understanding of data, statistical knowledge, and analytical acumenProven consultative leader and advisorExpertise across HR subject matter domainsSound judgment and problem solving ability with dataIntellectually curious, creative and innovativeDisciplined project managerAttention to detail and design aestheticStrong work ethic; works well in a dynamic environmentFinancial Services and/or HR Consulting industry experience

The duties and responsibilities described here are not exhaustive and additional assignments, duties, or responsibilities may be required of this position. Assignments, duties, and responsibilities may be changed at any time, with or without notice, by Blackstone in its sole discretion.

Expected annual base salary range:

$200,000 - $275,000

Actual base salary within that range will be determined by several components including but not limited to the individual's experience, skills, qualifications and job location. For roles located outside of the US, please disregard the posted salary bands as these roles will follow a separate compensation process based on local market comparables.

Additional compensation: Base salary does not include other forms of compensation or benefits offered in connection with the advertised role.

Blackstone is committed to providing equal employment opportunities to all employees and applicants for employment without regard to race, color, creed, religion, sex, pregnancy, national origin, ancestry, citizenship status, age, marital or partnership status, sexual orientation, gender identity or expression, disability, genetic predisposition, veteran or military status, status as a victim of domestic violence, a sex offense or stalking, or any other class or status in accordance with applicable federal, state and local laws. This policy applies to all terms and conditions of employment, including but not limited to hiring, placement, promotion, termination, transfer, leave of absence, compensation, and training. All Blackstone employees, including but not limited to recruiting personnel and hiring managers, are required to abide by this policy.

If you need a reasonable accommodation to complete your application, please email Human Resources at HR-Recruiting-Americas@Blackstone.com.

Depending on the position, you may be required to obtain certain securities licenses if you are in a client facing role and/or if you are engaged in the following:

Attending client meetings where you are discussing Blackstone products and/or and client questions; Marketing Blackstone funds to new or existing clients; Supervising or training securities licensed employees; Structuring or creating Blackstone funds/products; andAdvising on marketing plans prepared by a sales team or developing and/or contributing information for marketing materials. 

Note: The above list is not the exhaustive list of activities requiring securities licenses and there may be roles that require review on a case-by-case basis. Please speak with your Blackstone Recruiting contact with any questions.

To submit your application please complete the form below. Fields marked with a red asterisk * must be completed to be considered for employment (although some can be answered ""prefer not to say""). Failure to provide this information may compromise the follow-up of your application. When you have finished click Submit at the bottom of this form.","Blackstone is the world’s largest alternative asset manager. We seek to create positive economic impact and long-term value for our investors, the companies we invest in, and the communities in which we work. We do this by using extraordinary people and flexible capital to help companies solve problems. Our $1 trillion in assets under management include investment vehicles focused on private equity, real estate, public debt and equity, infrastructure, life sciences, growth equity, opportunistic, non-investment grade credit, real assets and secondary funds, all on a global basis. Further information is available at www.blackstone.com. Follow @blackstone on LinkedIn, Twitter, and Instagram.

The People Analytics Team is focused on providing actionable insights to help our partners in Human Resources and the Strategic Incentives Group drive critical business decisions with data.

This position will serve as a strategic partner and leader for delivering the value of data-driven HR-SIG insights, employee and organizational predictions and trends, and compelling People Analytics business cases and data stories that enable enterprise decision-making for HRLT and firmwide leadership.

<strong>Primary responsibilities include:

</strong><ul><li>Partner with CHRO/COO to identify strategic analytics needs and formulate the relevant people and organizational research, metrics and KPIs to enable execution of critical business decisions</li><li>Lead and collaborate with key stakeholder teams (e.g. People Analytics, HRLT, etc) to solve for root issues/opportunities and interpret data-driven solutions -- distilling complex analytics into clear outcomes and actionable insights, plans, and recommendations</li><li>Employ a structured approach in developing and executing analytical storytelling and change management techniques that drive meaningful transformation</li><li>Translate information into compelling executive reporting (e.g., crafting the narrative, PPT presentation design and build, data visualizations, etc.)</li><li>Manage a team of data, reporting and analytics professionals</li><li>Strive for reporting excellence through continuous feedback and agile iterations</li><li>Steer executive level presentations, business meetings, and analytical discussions</li><li>Address ad hoc firm leadership data-driven reporting requests with a sense of urgency and commitment to partner satisfaction</li><li>Share thought leadership around the evolving People Analytics vision, incorporating new systems and methodologies as they reach maturity</li><li>Advance culture of analytical discipline and progress toward overarching HR-SIG data-driven goals that maximize strategic business outcomes with every deliverable

</li></ul><strong>Qualifications:

</strong><ul><li>Strong understanding of data, statistical knowledge, and analytical acumen</li><li>Proven consultative leader and advisor</li><li>Expertise across HR subject matter domains</li><li>Sound judgment and problem solving ability with data</li><li>Intellectually curious, creative and innovative</li><li>Disciplined project manager</li><li>Attention to detail and design aesthetic</li><li>Strong work ethic; works well in a dynamic environment</li><li>Financial Services and/or HR Consulting industry experience

</li></ul>The duties and responsibilities described here are not exhaustive and additional assignments, duties, or responsibilities may be required of this position. Assignments, duties, and responsibilities may be changed at any time, with or without notice, by Blackstone in its sole discretion.

<strong>Expected annual base salary range:

</strong>$200,000 - $275,000

Actual base salary within that range will be determined by several components including but not limited to the individual's experience, skills, qualifications and job location. For roles located outside of the US, please disregard the posted salary bands as these roles will follow a separate compensation process based on local market comparables.

Additional compensation: Base salary does not include other forms of compensation or benefits offered in connection with the advertised role.

Blackstone is committed to providing equal employment opportunities to all employees and applicants for employment without regard to race, color, creed, religion, sex, pregnancy, national origin, ancestry, citizenship status, age, marital or partnership status, sexual orientation, gender identity or expression, disability, genetic predisposition, veteran or military status, status as a victim of domestic violence, a sex offense or stalking, or any other class or status in accordance with applicable federal, state and local laws. This policy applies to all terms and conditions of employment, including but not limited to hiring, placement, promotion, termination, transfer, leave of absence, compensation, and training. All Blackstone employees, including but not limited to recruiting personnel and hiring managers, are required to abide by this policy.

If you need a reasonable accommodation to complete your application, please email Human Resources at HR-Recruiting-Americas@Blackstone.com.

Depending on the position, you may be required to obtain certain securities licenses if you are in a client facing role and/or if you are engaged in the following:

<ul><li>Attending client meetings where you are discussing Blackstone products and/or and client questions; </li><li>Marketing Blackstone funds to new or existing clients; </li><li>Supervising or training securities licensed employees; </li><li>Structuring or creating Blackstone funds/products; and</li><li>Advising on marketing plans prepared by a sales team or developing and/or contributing information for marketing materials. 

</li></ul>Note: The above list is not the exhaustive list of activities requiring securities licenses and there may be roles that require review on a case-by-case basis. Please speak with your Blackstone Recruiting contact with any questions.

To submit your application please complete the form below. Fields marked with a red asterisk * must be completed to be considered for employment (although some can be answered ""prefer not to say""). Failure to provide this information may compromise the follow-up of your application. When you have finished click Submit at the bottom of this form.","Blackstone · New York, NY","https://www.linkedin.com/jobs/view/3804449414/","New York, New York, United States","Skills: Key Performance Indicators, Business Meetings, +8 more","1,001-5,000 employees · Financial Services
9 school alumni work here","LISTED","67495374","Blackstone","https://media.licdn.com/dms/image/C4E0BAQHM1mo8m_ecGw/company-logo_400_400/0/1678125020983/blackstonegroup_logo?e=1722470400&v=beta&t=rWeMMiaEXLdNVqZoYSE_iBkAK7Ei4pAm47vpAs1T8d0","2024-01-11T21:40:25.000Z","2024-04-30T00:07:46.481Z"
