"Title","Description","Description HTML","Primary Description","Detail URL","Location","Skill","Insight","Job State","Poster Id","Company Name","Company Logo","Created At","Scraped At"
"People Scientist","Every day, tens of millions of people come to Roblox to explore, create, play, learn, and connect with friends in 3D immersive digital experiences– all created by our global community of developers and creators.

At Roblox, we’re building the tools and platform that empower our community to bring any experience that they can imagine to life. Our vision is to reimagine the way people come together, from anywhere in the world, and on any device. We’re on a mission to connect a billion people with optimism and civility, and looking for amazing talent to help us get there.

A career at Roblox means you’ll be working to shape the future of human interaction, solving unique technical challenges at scale, and helping to create safer, more civil shared experiences for everyone.

The People Science & Analytics team at Roblox supports our People, Places, & Systems group in all areas of applied statistics, data science for internal operations. Our team works to deliver a wide range of insights and solutions for Roblox, from developing industry-leading hiring assessments, to conducting job analysis and qualitative research, to architecting data analytics systems and tools. In this role you will join a world-class group of learning and data scientists who are focused on collecting and using qualitative and quantitative data to drive decisions and to design and support Roblox's approach to leadership, people development, and organizational design and culture.

You Will

Work with a diverse team of scientists, software engineers, game designers, and teams to implement science-based and data-driven solutions across the entire range of recruiting and human resources challenges.Partner with subject matter experts (SMEs) throughout the organization in defining, developing, and enhancing programs that identify and develop employee skills.Contribute to the design and development of assessments using test principles to evaluate and enhance talent acquisition and development processes.Support the development, administration, and analysis of surveys to gather valuable insights into employee experiences, engagement, and satisfaction.Design and build research studies that use modern research methods to evaluate the effectiveness of workplace programs.Communicate the results of complex data analyzes to team members, providing data-driven insights that inform company efforts, policies, and decisions.

You Have

PhD in Industrial-Organizational Psychology, Cognitive Psychology, Learning Science, or related field.2+ years of industry experience in applied research.Expertise across a wide range of industrial-organizational disciplines, with experience in their effective application to enhance organizational performance, talent management, and employee development.Experience developing tools to evaluate individual differences and content knowledge.A background in the application of psychology principles to problems faced by organizations and adult learners.Curiosity to learn new techniques and tools to improve the organization.A passion for using data to help make informed decisions and drive strategy.Proven track record working with and supporting non-technical cross-functional partners.Strong communicator capable of presenting analysis in a compelling way, engaging stakeholders in meaningful dialogue about the findings, and effectively explaining complex ideas to non-technical audiences.

For roles that are based at our headquarters in San Mateo, CA: The starting base pay for this position is as shown below. The actual base pay is dependent upon a variety of job-related factors such as professional background, training, work experience, location, business needs and market demand. Therefore, in some circumstances, the actual salary could fall outside of this expected range. This pay range is subject to change and may be modified in the future. All full-time employees are also eligible for equity compensation and for benefits.

Annual Salary Range

$147,010—$180,090 USD

Roles that are based in our San Mateo, CA Headquarters are in-office Tuesday, Wednesday, and Thursday, with optional in-office on Monday and Friday (unless otherwise noted).

You’ll Love

Industry-leading compensation packageExcellent medical, dental, and vision coverageA rewarding 401k programFlexible vacation policyRoflex - Flexible and supportive work policy Roblox Admin badge for your avatarAt Roblox HQ: Free catered lunches five times a week and several fully stocked kitchens with unlimited snacksOnsite fitness center and fitness program creditAnnual CalTrain Go Pass
Roblox provides equal employment opportunities to all employees and applicants for employment and prohibits discrimination and harassment of any type without regard to race, color, religion, age, sex, national origin, disability status, genetics, protected veteran status, sexual orientation, gender identity or expression, or any other characteristic protected by federal, state or local laws. This policy applies to all terms and conditions of employment, including recruiting, hiring, placement, promotion, termination, layoff, recall, transfer, leaves of absence, compensation and training.","Every day, tens of millions of people come to Roblox to explore, create, play, learn, and connect with friends in 3D immersive digital experiences– all created by our global community of developers and creators.

At Roblox, we’re building the tools and platform that empower our community to bring any experience that they can imagine to life. Our vision is to reimagine the way people come together, from anywhere in the world, and on any device. We’re on a mission to connect a billion people with optimism and civility, and looking for amazing talent to help us get there.

A career at Roblox means you’ll be working to shape the future of human interaction, solving unique technical challenges at scale, and helping to create safer, more civil shared experiences for everyone.

The People Science & Analytics team at Roblox supports our People, Places, & Systems group in all areas of applied statistics, data science for internal operations. Our team works to deliver a wide range of insights and solutions for Roblox, from developing industry-leading hiring assessments, to conducting job analysis and qualitative research, to architecting data analytics systems and tools. In this role you will join a world-class group of learning and data scientists who are focused on collecting and using qualitative and quantitative data to drive decisions and to design and support Roblox's approach to leadership, people development, and organizational design and culture.

<strong>You Will

</strong><ul><li>Work with a diverse team of scientists, software engineers, game designers, and teams to implement science-based and data-driven solutions across the entire range of recruiting and human resources challenges.</li><li>Partner with subject matter experts (SMEs) throughout the organization in defining, developing, and enhancing programs that identify and develop employee skills.</li><li>Contribute to the design and development of assessments using test principles to evaluate and enhance talent acquisition and development processes.</li><li>Support the development, administration, and analysis of surveys to gather valuable insights into employee experiences, engagement, and satisfaction.</li><li>Design and build research studies that use modern research methods to evaluate the effectiveness of workplace programs.</li><li>Communicate the results of complex data analyzes to team members, providing data-driven insights that inform company efforts, policies, and decisions.

</li></ul><strong>You Have

</strong><ul><li>PhD in Industrial-Organizational Psychology, Cognitive Psychology, Learning Science, or related field.</li><li>2+ years of industry experience in applied research.</li><li>Expertise across a wide range of industrial-organizational disciplines, with experience in their effective application to enhance organizational performance, talent management, and employee development.</li><li>Experience developing tools to evaluate individual differences and content knowledge.</li><li>A background in the application of psychology principles to problems faced by organizations and adult learners.</li><li>Curiosity to learn new techniques and tools to improve the organization.</li><li>A passion for using data to help make informed decisions and drive strategy.</li><li>Proven track record working with and supporting non-technical cross-functional partners.</li><li>Strong communicator capable of presenting analysis in a compelling way, engaging stakeholders in meaningful dialogue about the findings, and effectively explaining complex ideas to non-technical audiences.

</li></ul>For roles that are based at our headquarters in San Mateo, CA: The starting base pay for this position is as shown below. The actual base pay is dependent upon a variety of job-related factors such as professional background, training, work experience, location, business needs and market demand. Therefore, in some circumstances, the actual salary could fall outside of this expected range. This pay range is subject to change and may be modified in the future. All full-time employees are also eligible for equity compensation and for benefits.

Annual Salary Range

$147,010—$180,090 USD

Roles that are based in our San Mateo, CA Headquarters are in-office Tuesday, Wednesday, and Thursday, with optional in-office on Monday and Friday (unless otherwise noted).

<strong>You’ll Love

</strong><ul><li>Industry-leading compensation package</li><li>Excellent medical, dental, and vision coverage</li><li>A rewarding 401k program</li><li>Flexible vacation policy</li><li>Roflex - Flexible and supportive work policy </li><li>Roblox Admin badge for your avatar</li><li>At Roblox HQ: </li><ul><li>Free catered lunches five times a week and several fully stocked kitchens with unlimited snacks</li><li>Onsite fitness center and fitness program credit</li><li>Annual CalTrain Go Pass
</li></ul></ul>Roblox provides equal employment opportunities to all employees and applicants for employment and prohibits discrimination and harassment of any type without regard to race, color, religion, age, sex, national origin, disability status, genetics, protected veteran status, sexual orientation, gender identity or expression, or any other characteristic protected by federal, state or local laws. This policy applies to all terms and conditions of employment, including recruiting, hiring, placement, promotion, termination, layoff, recall, transfer, leaves of absence, compensation and training.","Roblox","https://www.linkedin.com/jobs/view/3811243339/","San Mateo, California, United States","Skills: Applied Research, Cognitive Psychology, +8 more","1,001-5,000 employees · Software Development
11 school alumni work here","LISTED","37021929","Roblox","https://media.licdn.com/dms/image/C4E0BAQHcBSrlw3MI3g/company-logo_400_400/0/1661789836195/roblox_logo?e=1716422400&v=beta&t=T6ZggwWMTVPw7qjILiRsVGg02VRCGR9FSbJrdS3Q7fk","2024-01-26T03:32:32.000Z","2024-02-22T22:37:26.156Z"
"Technical Program Manager II, Analytics, Google Data Centers","Note: By applying to this position you will have an opportunity to share your preferred working location from the following: San Francisco, CA, USA; Atlanta, GA, USA; Chicago, IL, USA; Seattle, WA, USA; Sunnyvale, CA, USA.Minimum qualifications:

Bachelor's degree in a technical field, or equivalent practical experience. 2 years of experience in program management.

Preferred qualifications:

Master's degree in Information Systems, Computer Science, Data Science, Analytics, Mathematics, or a related field.2 years of experience of developing batch and real time streaming data pipelines using GCP BigQuery, Dataflow, and Publish/Subscribe (Pub/Sub) from heterogeneous data sources (eg. Oracle, SAP, etc.). Experience in managing complex, global and cross functional projects with strong project management skills, Experience with advanced analytics along with the ability to synthesize data into actionable results.Experience in the Data Centers or electrical industry. Demonstrated thought-leadership, relationship building and management skills, with internal stakeholders and external partners.

About The Job

Google's projects, like our users, span the globe and require managers to keep the big picture in focus while being able to dive into the unique engineering challenges we face daily. As a Technical Program Manager at Google, you lead complex, multi-disciplinary engineering projects using your engineering expertise. You plan requirements with internal customers and usher projects through the entire project lifecycle. This includes managing project schedules, identifying risks and clearly communicating them to project stakeholders. You're equally at home explaining your team's analyses and recommendations to executives as you are discussing the technical trade-offs in product development with engineers.

Using your extensive technical and leadership expertise, you manage projects of various size and scope, identifying future opportunities, improving processes and driving the technical directions of your programs.

Behind everything our users see online is the architecture built by the Technical Infrastructure team to keep it running. From developing and maintaining our data centers to building the next generation of Google platforms, we make Google's product portfolio possible. We're proud to be our engineers' engineers and love voiding warranties by taking things apart so we can rebuild them. We keep our networks up and running, ensuring our users have the best and fastest experience possible.

The US base salary range for this full-time position is $118,000-$172,000 + bonus + equity + benefits. Our salary ranges are determined by role, level, and location. The range displayed on each job posting reflects the minimum and maximum target for new hire salaries for the position across all US locations. Within the range, individual pay is determined by work location and additional factors, including job-related skills, experience, and relevant education or training. Your recruiter can share more about the specific salary range for your preferred location during the hiring process.

Please note that the compensation details listed in US role postings reflect the base salary only, and do not include bonus, equity, or benefits. Learn more about benefits at Google .

Responsibilities

Collaborate with team members and stakeholders to understand or identify defined work problems and program goals, obtain prioritized deliverables, and discuss program impact.Prioritize program goals, understand and translate other stakeholders’ needs into program goals and prioritized deliverables with minimal assistance, and contribute to decisions on prioritizing goals and deliverables.Define the scope of projects and develop, execute, and/or manage project plans for supported program(s).Review key metrics pertaining to a program, monitor potential metric deviations, and define corrective actions for critical deviations.Identify, communicate, and collaborate with relevant stakeholders within one or more teams to drive impact and work toward mutual goals.


Google is proud to be an equal opportunity workplace and is an affirmative action employer. We are committed to equal employment opportunity regardless of race, color, ancestry, religion, sex, national origin, sexual orientation, age, citizenship, marital status, disability, gender identity or Veteran status. We also consider qualified applicants regardless of criminal histories, consistent with legal requirements. See also Google's EEO Policy and EEO is the Law. If you have a disability or special need that requires accommodation, please let us know by completing our Accommodations for Applicants form .","Note: By applying to this position you will have an opportunity to share your preferred working location from the following: <strong>San Francisco, CA, USA; Atlanta, GA, USA; Chicago, IL, USA; Seattle, WA, USA; Sunnyvale, CA, USA</strong>.<strong>Minimum qualifications:

</strong><ul><li>Bachelor's degree in a technical field, or equivalent practical experience. </li><li>2 years of experience in program management.

</li></ul><strong>Preferred qualifications:

</strong><ul><li>Master's degree in Information Systems, Computer Science, Data Science, Analytics, Mathematics, or a related field.</li><li>2 years of experience of developing batch and real time streaming data pipelines using GCP BigQuery, Dataflow, and Publish/Subscribe (Pub/Sub) from heterogeneous data sources (eg. Oracle, SAP, etc.).</li><li> Experience in managing complex, global and cross functional projects with strong project management skills, </li><li>Experience with advanced analytics along with the ability to synthesize data into actionable results.</li><li>Experience in the Data Centers or electrical industry.</li><li> Demonstrated thought-leadership, relationship building and management skills, with internal stakeholders and external partners.

</li></ul><strong>About The Job

</strong>Google's projects, like our users, span the globe and require managers to keep the big picture in focus while being able to dive into the unique engineering challenges we face daily. As a Technical Program Manager at Google, you lead complex, multi-disciplinary engineering projects using your engineering expertise. You plan requirements with internal customers and usher projects through the entire project lifecycle. This includes managing project schedules, identifying risks and clearly communicating them to project stakeholders. You're equally at home explaining your team's analyses and recommendations to executives as you are discussing the technical trade-offs in product development with engineers.

Using your extensive technical and leadership expertise, you manage projects of various size and scope, identifying future opportunities, improving processes and driving the technical directions of your programs.

Behind everything our users see online is the architecture built by the Technical Infrastructure team to keep it running. From developing and maintaining our data centers to building the next generation of Google platforms, we make Google's product portfolio possible. We're proud to be our engineers' engineers and love voiding warranties by taking things apart so we can rebuild them. We keep our networks up and running, ensuring our users have the best and fastest experience possible.

The US base salary range for this full-time position is $118,000-$172,000 + bonus + equity + benefits. Our salary ranges are determined by role, level, and location. The range displayed on each job posting reflects the minimum and maximum target for new hire salaries for the position across all US locations. Within the range, individual pay is determined by work location and additional factors, including job-related skills, experience, and relevant education or training. Your recruiter can share more about the specific salary range for your preferred location during the hiring process.

Please note that the compensation details listed in US role postings reflect the base salary only, and do not include bonus, equity, or benefits. Learn more about benefits at Google .

<strong>Responsibilities

</strong><ul><li>Collaborate with team members and stakeholders to understand or identify defined work problems and program goals, obtain prioritized deliverables, and discuss program impact.</li><li>Prioritize program goals, understand and translate other stakeholders’ needs into program goals and prioritized deliverables with minimal assistance, and contribute to decisions on prioritizing goals and deliverables.</li><li>Define the scope of projects and develop, execute, and/or manage project plans for supported program(s).</li><li>Review key metrics pertaining to a program, monitor potential metric deviations, and define corrective actions for critical deviations.</li><li>Identify, communicate, and collaborate with relevant stakeholders within one or more teams to drive impact and work toward mutual goals.


</li></ul>Google is proud to be an equal opportunity workplace and is an affirmative action employer. We are committed to equal employment opportunity regardless of race, color, ancestry, religion, sex, national origin, sexual orientation, age, citizenship, marital status, disability, gender identity or Veteran status. We also consider qualified applicants regardless of criminal histories, consistent with legal requirements. See also Google's EEO Policy and EEO is the Law. If you have a disability or special need that requires accommodation, please let us know by completing our Accommodations for Applicants form .","Google","https://www.linkedin.com/jobs/view/3836261219/","Sunnyvale, California, United States","Skills: Analytics, Project Management, +8 more","10,001+ employees · Software Development
11 connections work here · 380 school alumni work here","LISTED","29326500","Google","https://media.licdn.com/dms/image/C4D0BAQHiNSL4Or29cg/company-logo_400_400/0/1631311446380?e=1716422400&v=beta&t=A3cqHeP5kyVo6oMZlsMAvz52nq9jgZ_6fK1pHKQ3ZN0","2024-02-22T16:36:51.000Z","2024-02-22T22:37:26.156Z"
