"Title","Description","Description HTML","Primary Description","Detail URL","Location","Skill","Insight","Job State","Poster Id","Company Name","Company Logo","Created At","Scraped At"
"Head of People Analytics - Human Resources","Blackstone is the world’s largest alternative asset manager. We seek to create positive economic impact and long-term value for our investors, the companies we invest in, and the communities in which we work. We do this by using extraordinary people and flexible capital to help companies solve problems. Our $1 trillion in assets under management include investment vehicles focused on private equity, real estate, public debt and equity, infrastructure, life sciences, growth equity, opportunistic, non-investment grade credit, real assets and secondary funds, all on a global basis. Further information is available at www.blackstone.com. Follow @blackstone on LinkedIn, Twitter, and Instagram.

The People Analytics Team is focused on providing actionable insights to help our partners in Human Resources and the Strategic Incentives Group drive critical business decisions with data.

This position will serve as a strategic partner and leader for delivering the value of data-driven HR-SIG insights, employee and organizational predictions and trends, and compelling People Analytics business cases and data stories that enable enterprise decision-making for HRLT and firmwide leadership.

Primary responsibilities include:

Partner with CHRO/COO to identify strategic analytics needs and formulate the relevant people and organizational research, metrics and KPIs to enable execution of critical business decisionsLead and collaborate with key stakeholder teams (e.g. People Analytics, HRLT, etc) to solve for root issues/opportunities and interpret data-driven solutions -- distilling complex analytics into clear outcomes and actionable insights, plans, and recommendationsEmploy a structured approach in developing and executing analytical storytelling and change management techniques that drive meaningful transformationTranslate information into compelling executive reporting (e.g., crafting the narrative, PPT presentation design and build, data visualizations, etc.)Manage a team of data, reporting and analytics professionalsStrive for reporting excellence through continuous feedback and agile iterationsSteer executive level presentations, business meetings, and analytical discussionsAddress ad hoc firm leadership data-driven reporting requests with a sense of urgency and commitment to partner satisfactionShare thought leadership around the evolving People Analytics vision, incorporating new systems and methodologies as they reach maturityAdvance culture of analytical discipline and progress toward overarching HR-SIG data-driven goals that maximize strategic business outcomes with every deliverable

Qualifications:

Strong understanding of data, statistical knowledge, and analytical acumenProven consultative leader and advisorExpertise across HR subject matter domainsSound judgment and problem solving ability with dataIntellectually curious, creative and innovativeDisciplined project managerAttention to detail and design aestheticStrong work ethic; works well in a dynamic environmentFinancial Services and/or HR Consulting industry experience

The duties and responsibilities described here are not exhaustive and additional assignments, duties, or responsibilities may be required of this position. Assignments, duties, and responsibilities may be changed at any time, with or without notice, by Blackstone in its sole discretion.

Expected annual base salary range:

$200,000 - $275,000

Actual base salary within that range will be determined by several components including but not limited to the individual's experience, skills, qualifications and job location. For roles located outside of the US, please disregard the posted salary bands as these roles will follow a separate compensation process based on local market comparables.

Additional compensation: Base salary does not include other forms of compensation or benefits offered in connection with the advertised role.

Blackstone is committed to providing equal employment opportunities to all employees and applicants for employment without regard to race, color, creed, religion, sex, pregnancy, national origin, ancestry, citizenship status, age, marital or partnership status, sexual orientation, gender identity or expression, disability, genetic predisposition, veteran or military status, status as a victim of domestic violence, a sex offense or stalking, or any other class or status in accordance with applicable federal, state and local laws. This policy applies to all terms and conditions of employment, including but not limited to hiring, placement, promotion, termination, transfer, leave of absence, compensation, and training. All Blackstone employees, including but not limited to recruiting personnel and hiring managers, are required to abide by this policy.

If you need a reasonable accommodation to complete your application, please email Human Resources at HR-Recruiting-Americas@Blackstone.com.

Depending on the position, you may be required to obtain certain securities licenses if you are in a client facing role and/or if you are engaged in the following:

Attending client meetings where you are discussing Blackstone products and/or and client questions; Marketing Blackstone funds to new or existing clients; Supervising or training securities licensed employees; Structuring or creating Blackstone funds/products; andAdvising on marketing plans prepared by a sales team or developing and/or contributing information for marketing materials. 

Note: The above list is not the exhaustive list of activities requiring securities licenses and there may be roles that require review on a case-by-case basis. Please speak with your Blackstone Recruiting contact with any questions.

To submit your application please complete the form below. Fields marked with a red asterisk * must be completed to be considered for employment (although some can be answered ""prefer not to say""). Failure to provide this information may compromise the follow-up of your application. When you have finished click Submit at the bottom of this form.","Blackstone is the world’s largest alternative asset manager. We seek to create positive economic impact and long-term value for our investors, the companies we invest in, and the communities in which we work. We do this by using extraordinary people and flexible capital to help companies solve problems. Our $1 trillion in assets under management include investment vehicles focused on private equity, real estate, public debt and equity, infrastructure, life sciences, growth equity, opportunistic, non-investment grade credit, real assets and secondary funds, all on a global basis. Further information is available at www.blackstone.com. Follow @blackstone on LinkedIn, Twitter, and Instagram.

The People Analytics Team is focused on providing actionable insights to help our partners in Human Resources and the Strategic Incentives Group drive critical business decisions with data.

This position will serve as a strategic partner and leader for delivering the value of data-driven HR-SIG insights, employee and organizational predictions and trends, and compelling People Analytics business cases and data stories that enable enterprise decision-making for HRLT and firmwide leadership.

<strong>Primary responsibilities include:

</strong><ul><li>Partner with CHRO/COO to identify strategic analytics needs and formulate the relevant people and organizational research, metrics and KPIs to enable execution of critical business decisions</li><li>Lead and collaborate with key stakeholder teams (e.g. People Analytics, HRLT, etc) to solve for root issues/opportunities and interpret data-driven solutions -- distilling complex analytics into clear outcomes and actionable insights, plans, and recommendations</li><li>Employ a structured approach in developing and executing analytical storytelling and change management techniques that drive meaningful transformation</li><li>Translate information into compelling executive reporting (e.g., crafting the narrative, PPT presentation design and build, data visualizations, etc.)</li><li>Manage a team of data, reporting and analytics professionals</li><li>Strive for reporting excellence through continuous feedback and agile iterations</li><li>Steer executive level presentations, business meetings, and analytical discussions</li><li>Address ad hoc firm leadership data-driven reporting requests with a sense of urgency and commitment to partner satisfaction</li><li>Share thought leadership around the evolving People Analytics vision, incorporating new systems and methodologies as they reach maturity</li><li>Advance culture of analytical discipline and progress toward overarching HR-SIG data-driven goals that maximize strategic business outcomes with every deliverable

</li></ul><strong>Qualifications:

</strong><ul><li>Strong understanding of data, statistical knowledge, and analytical acumen</li><li>Proven consultative leader and advisor</li><li>Expertise across HR subject matter domains</li><li>Sound judgment and problem solving ability with data</li><li>Intellectually curious, creative and innovative</li><li>Disciplined project manager</li><li>Attention to detail and design aesthetic</li><li>Strong work ethic; works well in a dynamic environment</li><li>Financial Services and/or HR Consulting industry experience

</li></ul>The duties and responsibilities described here are not exhaustive and additional assignments, duties, or responsibilities may be required of this position. Assignments, duties, and responsibilities may be changed at any time, with or without notice, by Blackstone in its sole discretion.

<strong>Expected annual base salary range:

</strong>$200,000 - $275,000

Actual base salary within that range will be determined by several components including but not limited to the individual's experience, skills, qualifications and job location. For roles located outside of the US, please disregard the posted salary bands as these roles will follow a separate compensation process based on local market comparables.

Additional compensation: Base salary does not include other forms of compensation or benefits offered in connection with the advertised role.

Blackstone is committed to providing equal employment opportunities to all employees and applicants for employment without regard to race, color, creed, religion, sex, pregnancy, national origin, ancestry, citizenship status, age, marital or partnership status, sexual orientation, gender identity or expression, disability, genetic predisposition, veteran or military status, status as a victim of domestic violence, a sex offense or stalking, or any other class or status in accordance with applicable federal, state and local laws. This policy applies to all terms and conditions of employment, including but not limited to hiring, placement, promotion, termination, transfer, leave of absence, compensation, and training. All Blackstone employees, including but not limited to recruiting personnel and hiring managers, are required to abide by this policy.

If you need a reasonable accommodation to complete your application, please email Human Resources at HR-Recruiting-Americas@Blackstone.com.

Depending on the position, you may be required to obtain certain securities licenses if you are in a client facing role and/or if you are engaged in the following:

<ul><li>Attending client meetings where you are discussing Blackstone products and/or and client questions; </li><li>Marketing Blackstone funds to new or existing clients; </li><li>Supervising or training securities licensed employees; </li><li>Structuring or creating Blackstone funds/products; and</li><li>Advising on marketing plans prepared by a sales team or developing and/or contributing information for marketing materials. 

</li></ul>Note: The above list is not the exhaustive list of activities requiring securities licenses and there may be roles that require review on a case-by-case basis. Please speak with your Blackstone Recruiting contact with any questions.

To submit your application please complete the form below. Fields marked with a red asterisk * must be completed to be considered for employment (although some can be answered ""prefer not to say""). Failure to provide this information may compromise the follow-up of your application. When you have finished click Submit at the bottom of this form.","Blackstone · New York, NY","https://www.linkedin.com/jobs/view/3804449414/","New York, New York, United States","Skills: Key Performance Indicators, Business Meetings, +8 more","1,001-5,000 employees · Financial Services
9 school alumni work here","LISTED","67495374","Blackstone","https://media.licdn.com/dms/image/C4E0BAQHM1mo8m_ecGw/company-logo_400_400/0/1678125020983/blackstonegroup_logo?e=1720656000&v=beta&t=fIZGLiKdP00bMVgkcwjMAAqj63uGtaHMdkTkDg-jdw4","2024-01-11T21:40:25.000Z","2024-04-11T16:11:18.151Z"
"Senior Researcher, Product Experience (Growth)","Netflix is one of the world's leading streaming entertainment services, with over 260 million members in over 190 countries enjoying TV series, documentaries, feature films, and mobile games across various genres and languages. Members can play, pause, and resume watching as they want, anytime, anywhere, and change their plans anytime.

The Product Experience Research team is central in uncovering compelling ways to engage and entertain our global members. This Senior Research role supports Growth, which strives to better attract new members to Netflix and explore new monetization opportunities worldwide. Specifically, this role will focus on how Netflix can deliver better value to more members through new ad-supported offerings.

This is an opportunity to lead innovative research with demonstrable impact on a global scale. You will be responsible for defining, leading, analyzing, and socializing research studies that generate insights to empower business decisions across the company. You’ll partner with cross-functional teams passionate about delivering the most engaging, innovative, and inclusive experiences.


In This Role, You Will


Identify, prioritize, and lead research roadmaps that generate insights to inform monetization strategies across the company.Partner with cross-functional teams, including Product, Ads, Product Marketing, Design, Data Science, Strategy Planning & Analysis, and Brand to proactively develop research initiatives.Define, design, execute, and socialize a range of research studies that build a strong understanding of existing and future audiences and their experiences worldwide.Identify best practices in existing and emerging research methodologies.



About You


Demonstrable experience in product research and/or user experience (UX) research informing growth and monetization strategy. Experience supporting subscription businesses or ad-supported online products preferred.Mixed methods research expertise including hands-on experience leading end-to-end quantitative and qualitative research studiesA balance of creative and analytical skills with the ability to proactively define research questions, identify appropriate methods, execute studies, and synthesize findings.Strong communicator with a bias toward action to proactively collaborate with multiple teams across the company.Passionate about translating findings into actionable strategic business recommendationsGlobal research experience is highly preferred but not required.


Tags: ResearchSite

Our compensation structure consists solely of an annual salary; we do not have bonuses. You choose each year how much of your compensation you want in salary versus stock options. To determine your personal top of market compensation, we rely on market indicators and consider your specific job family, background, skills, and experience to determine your compensation in the market range. The range for this role is $110,000 - $440,000.

Netflix provides comprehensive benefits including Health Plans, Mental Health support, a 401(k) Retirement Plan with employer match, Stock Option Program, Disability Programs, Health Savings and Flexible Spending Accounts, Family-forming benefits, and Life and Serious Injury Benefits. We also offer paid leave of absence programs. Full-time hourly employees accrue 35 days annually for paid time off to be used for vacation, holidays, and sick paid time off. Full-time salaried employees are immediately entitled to flexible time off. See more detail about our Benefits here.

Netflix is a unique culture and environment. Learn more here.

We are an equal-opportunity employer and celebrate diversity, recognizing that diversity of thought and background builds stronger teams. We approach diversity and inclusion seriously and thoughtfully. We do not discriminate on the basis of race, religion, color, ancestry, national origin, caste, sex, sexual orientation, gender, gender identity or expression, age, disability, medical condition, pregnancy, genetic makeup, marital status, or military service.","Netflix is one of the world's leading streaming entertainment services, with over 260 million members in over 190 countries enjoying TV series, documentaries, feature films, and mobile games across various genres and languages. Members can play, pause, and resume watching as they want, anytime, anywhere, and change their plans anytime.

The Product Experience Research team is central in uncovering compelling ways to engage and entertain our global members. This Senior Research role supports Growth, which strives to better attract new members to Netflix and explore new monetization opportunities worldwide. Specifically, this role will focus on how Netflix can deliver better value to more members through new ad-supported offerings.

This is an opportunity to lead innovative research with demonstrable impact on a global scale. You will be responsible for defining, leading, analyzing, and socializing research studies that generate insights to empower business decisions across the company. You’ll partner with cross-functional teams passionate about delivering the most engaging, innovative, and inclusive experiences.


<strong>In This Role, You Will


</strong><ul><li>Identify, prioritize, and lead research roadmaps that generate insights to inform monetization strategies across the company.</li><li>Partner with cross-functional teams, including Product, Ads, Product Marketing, Design, Data Science, Strategy Planning & Analysis, and Brand to proactively develop research initiatives.</li><li>Define, design, execute, and socialize a range of research studies that build a strong understanding of existing and future audiences and their experiences worldwide.</li><li>Identify best practices in existing and emerging research methodologies.



</li></ul><strong>About You


</strong><ul><li>Demonstrable experience in product research and/or user experience (UX) research informing growth and monetization strategy. Experience supporting subscription businesses or ad-supported online products preferred.</li><li>Mixed methods research expertise including hands-on experience leading end-to-end quantitative and qualitative research studies</li><li>A balance of creative and analytical skills with the ability to proactively define research questions, identify appropriate methods, execute studies, and synthesize findings.</li><li>Strong communicator with a bias toward action to proactively collaborate with multiple teams across the company.</li><li>Passionate about translating findings into actionable strategic business recommendations</li><li>Global research experience is highly preferred but not required.


</li></ul>Tags: ResearchSite

Our compensation structure consists solely of an annual salary; we do not have bonuses. You choose each year how much of your compensation you want in salary versus stock options. To determine your personal top of market compensation, we rely on market indicators and consider your specific job family, background, skills, and experience to determine your compensation in the market range. The range for this role is $110,000 - $440,000.

Netflix provides comprehensive benefits including Health Plans, Mental Health support, a 401(k) Retirement Plan with employer match, Stock Option Program, Disability Programs, Health Savings and Flexible Spending Accounts, Family-forming benefits, and Life and Serious Injury Benefits. We also offer paid leave of absence programs. Full-time hourly employees accrue 35 days annually for paid time off to be used for vacation, holidays, and sick paid time off. Full-time salaried employees are immediately entitled to flexible time off. See more detail about our Benefits here.

Netflix is a unique culture and environment. Learn more here.

We are an equal-opportunity employer and celebrate diversity, recognizing that diversity of thought and background builds stronger teams. We approach diversity and inclusion seriously and thoughtfully. We do not discriminate on the basis of race, religion, color, ancestry, national origin, caste, sex, sexual orientation, gender, gender identity or expression, age, disability, medical condition, pregnancy, genetic makeup, marital status, or military service.","Netflix · Los Gatos, CA","https://www.linkedin.com/jobs/view/3819156659/","Los Gatos, California, United States","6 of 10 skills match your profile - you may be a good fit","10,001+ employees · Entertainment Providers
24 school alumni work here","LISTED","368130583","Netflix","https://media.licdn.com/dms/image/C4E0BAQEVb0ZISWk8vQ/company-logo_400_400/0/1631355051964?e=1720656000&v=beta&t=FnZ60VFZmq-mN9Zf1fo2c84CmsJNUQ3sokxfSL4eDPI","2024-02-01T02:38:03.000Z","2024-04-11T16:11:18.151Z"
