"Title","Description","Description HTML","Primary Description","Detail URL","Location","Skill","Insight","Job State","Poster Id","Company Name","Company Logo","Created At","Scraped At"
"People Analytics Lead","At Webflow, our mission is to bring development superpowers to everyone. Webflow is the leading visual development platform for building powerful websites without writing code. By combining modern web development technologies into one platform, Webflow enables people to build websites visually, saving engineering time, while clean code seamlessly generates in the background. From independent designers and creative agencies to Fortune 500 companies, millions worldwide use Webflow to be more nimble, creative, and collaborative. It’s the web, made better.

We’re looking for an enthusiastic People Analytics Lead who thrives at the intersection of data connectivity and impactful insights. You will bring your passion for connecting the dots across diverse data points to not just a role, but an opportunity significantly impact the future of People Analytics at Webflow. This role will be at the forefront of helping to architect the People Analytics function in harmony with our operating rhythm, you’ll get to be part of our exciting Workday People Analytics implementation, and you’ll significantly influence how we scale to meet long-term business needs.

About The Role 

Location: Remote-first (United States; BC & ON, Canada) Full-time Exempt The cash compensation for this role is tailored to align with the cost of labor in different geographic markets. We've structured the base pay ranges for this role into zones for our geographic markets, and the specific base pay within the range will be determined by the candidate’s geographic location, job-related experience, knowledge, qualifications, and skills.United States (all figures cited below in USD and pertain to workers in the United States)Zone A: [$147,600 - $203,050]Zone B: [$138,800 - $190,900]Zone C: [$129,900 - $178,650] Please visit our Careers page for more information on which locations are included in each of our geographic pay zones. However, please confirm the zone for your specific location with your recruiter. Reporting to the Director of People Operations
As a People Analytics Lead, you’ll …

In partnership with People leaders and other stakeholders implement a standard approach to reporting and identify key metrics and opportunities for leveraging people analytics to deliver insights that influence decision-making and drive business outcomesLead the creation and maintenance of data models that enhance our ability to understand and predict behavior, engagement and performanceDesign and maintain dashboards, ad-hoc, recurring, and on-demand reports and data solutions, as well as presentation-ready materials using analytics visualization tools Use your analytical superpowers to interpret and analyze people data, uncover trends, patterns, and correlations related to People metrics, then in turn, present data in a clear, compelling way, facilitating easy interpretation at various levelsEmpower and guide stakeholders across the people team on best practices, utilization of self-serve data tools and how to interpret and apply insights, through support tools, coaching and trainingIn partnership with People Tech and Operations, ensure the accuracy, integrity, and security of data in source systems by contributing to data governance practices within the people analytics function

In addition to the responsibilities outlined above, at Webflow we will support you in identifying where your interests and development opportunities lie and we'll help you incorporate them into your role.

About You

You’ll thrive as a People Analytics Lead if you:

Possess 5+ years hands-on people analytics experience, with a strong focus on predictive modeling and developing reporting frameworks for employee lifecycle metrics, employee experience and survey dataHave the ability to think strategically and translate business needs into actionable analytics solutionsPossess a strong understanding of scalability with people analytics and can successfully manage projects that span across the People functionCan use strong analytical and technical skills to manipulate, organize, and analyze large datasets, including the ability to write formulas, macros and pivot tables, with attention to detail and accuracyAre proficient at using data visualization tools (e.g. tableau or similar) and programming languages (e.g. SQL)Are able to leverage past experience with people technology (Workday strongly preferred) and employee experience and survey tools (e.g. Qualtrics)

Have excellent communication and storytelling skills and the ability to present complex information to employees at all levels

Even if you don’t meet 100% of the above qualifications, you should still seriously consider applying. Research shows that you may still be considered for a role if you meet just half of the requirements.

Our Core Behaviors

Obsess over customer experience. We deeply understand what we’re building and who we’re building for and serving. We define the leading edge of what’s possible in our industry and deliver the future for our customers.Move with heartfelt urgency. We have a healthy relationship with impatience, channeling it thoughtfully to show up better and faster for our customers and for each other. Time is the most limited thing we have, and we make the most of every moment.Say the hard thing with care. Our best work often comes from intelligent debate, critique, and even difficult conversations. We speak our minds and don’t sugarcoat things — and we do so with respect, maturity, and care.Make your mark. We seek out new and unique ways to create meaningful impact, and we champion the same from our colleagues. We work as a team to get the job done, and we go out of our way to celebrate and reward those going above and beyond for our customers and our teammates.

Benefits & Wellness

Equity ownership (RSUs) in a growing, privately-owned company100% employer-paid healthcare, vision, and dental insurance coverage for employees and dependents (US; full-time Canadian workers working 30+ hours per week), as well as Health Savings Account/Health Reimbursement Account, dependent on insurance plan selection. Employees also have voluntary insurance options, such as life, disability, hospital protection, accident, and critical illness12 weeks of paid parental leave for both birthing and non-birthing caregivers, as well as an additional 6-8 weeks of pregnancy disability for birthing parents to be used before child bonding leave. Employees also have access to family planning care and reimbursementFlexible PTO with an mandatory annual minimum of 10 days paid time off, and sabbatical programAccess to mental wellness coaching, therapy, and Employee Assistance ProgramMonthly stipends to support health and wellness, as well as smart work, and annual stipends to support professional growthProfessional career coaching, internal learning & development programs401k plan and financial wellness benefits, like CPA or financial advisor coverageCommuter benefits for in-office workers

Temporary employees are not eligible for paid holiday time off, accrued paid time off, paid leaves of absence, or company-sponsored perks.

Be you, with us

At Webflow, equality is a core tenet of our culture. We are committed to building an inclusive global team that represents a variety of backgrounds, perspectives, beliefs, and experiences. Employment decisions are made on the basis of job-related criteria without regard to race, color, religion, sex, sexual orientation, gender identity, national origin, disability, veteran status, or any other classification protected by applicable law.

Stay connected

Not ready to apply, but want to be part of the Webflow community? Consider following our story on our Webflow Blog, LinkedIn, Twitter, and/or Glassdoor.

Please Note

To join Webflow, you'll need valid U.S. or Canadian work authorization depending on the country of employment.

If you are extended an offer, that offer may be contingent upon your successful completion of a background check, which will be conducted in accordance with applicable laws. We may obtain one or more background screening reports about you, solely for employment purposes.

Protecting your privacy and the security of your data is a longstanding top priority for Webflow. Please consult our Applicant Privacy Notice to know more about how we collect, use and transfer the personal data of our candidates.","At Webflow, our mission is to bring development superpowers to everyone. Webflow is the leading visual development platform for building powerful websites without writing code. By combining modern web development technologies into one platform, Webflow enables people to build websites visually, saving engineering time, while clean code seamlessly generates in the background. From independent designers and creative agencies to Fortune 500 companies, millions worldwide use Webflow to be more nimble, creative, and collaborative. It’s the web, made better.

We’re looking for an enthusiastic People Analytics Lead who thrives at the intersection of data connectivity and impactful insights. You will bring your passion for connecting the dots across diverse data points to not just a role, but an opportunity significantly impact the future of People Analytics at Webflow. This role will be at the forefront of helping to architect the People Analytics function in harmony with our operating rhythm, you’ll get to be part of our exciting Workday People Analytics implementation, and you’ll significantly influence how we scale to meet long-term business needs.

<strong>About The Role</strong> 

<ul><li>Location: Remote-first (United States; BC & ON, Canada) </li><li>Full-time </li><li>Exempt </li><li>The cash compensation for this role is tailored to align with the cost of labor in different geographic markets. We've structured the base pay ranges for this role into zones for our geographic markets, and the specific base pay within the range will be determined by the candidate’s geographic location, job-related experience, knowledge, qualifications, and skills.</li><ul><ul><li>United States (all figures cited below in USD and pertain to workers in the United States)</li><ul><li>Zone A: [$147,600 - $203,050]</li><li>Zone B: [$138,800 - $190,900]</li><li>Zone C: [$129,900 - $178,650] Please visit our Careers page for more information on which locations are included in each of our geographic pay zones. However, please confirm the zone for your specific location with your recruiter. </li></ul></ul></ul><li>Reporting to the Director of People Operations
</li></ul>As a <strong>People Analytics Lead</strong>, you’ll …

<ul><li>In partnership with People leaders and other stakeholders implement a standard approach to reporting and identify key metrics and opportunities for leveraging people analytics to deliver insights that influence decision-making and drive business outcomes</li><li>Lead the creation and maintenance of data models that enhance our ability to understand and predict behavior, engagement and performance</li><li>Design and maintain dashboards, ad-hoc, recurring, and on-demand reports and data solutions, as well as presentation-ready materials using analytics visualization tools </li><li>Use your analytical superpowers to interpret and analyze people data, uncover trends, patterns, and correlations related to People metrics, then in turn, present data in a clear, compelling way, facilitating easy interpretation at various levels</li><li>Empower and guide stakeholders across the people team on best practices, utilization of self-serve data tools and how to interpret and apply insights, through support tools, coaching and training</li><li>In partnership with People Tech and Operations, ensure the accuracy, integrity, and security of data in source systems by contributing to data governance practices within the people analytics function

</li></ul>In addition to the responsibilities outlined above, at Webflow we will support you in identifying where your interests and development opportunities lie and we'll help you incorporate them into your role.

<strong>About You

</strong>You’ll thrive as a <strong>People Analytics Lead</strong> if you:

<ul><li>Possess 5+ years hands-on people analytics experience, with a strong focus on predictive modeling and developing reporting frameworks for employee lifecycle metrics, employee experience and survey data</li><li>Have the ability to think strategically and translate business needs into actionable analytics solutions</li><li>Possess a strong understanding of scalability with people analytics and can successfully manage projects that span across the People function</li><li>Can use strong analytical and technical skills to manipulate, organize, and analyze large datasets, including the ability to write formulas, macros and pivot tables, with attention to detail and accuracy</li><li>Are proficient at using data visualization tools (e.g. tableau or similar) and programming languages (e.g. SQL)</li><li>Are able to leverage past experience with people technology (Workday strongly preferred) and employee experience and survey tools (e.g. Qualtrics)

</li></ul>Have excellent communication and storytelling skills and the ability to present complex information to employees at all levels

Even if you don’t meet 100% of the above qualifications, you should still seriously consider applying. Research shows that you may still be considered for a role if you meet just half of the requirements.

<strong>Our Core Behaviors

</strong><ul><li>Obsess over customer experience. We deeply understand what we’re building and who we’re building for and serving. We define the leading edge of what’s possible in our industry and deliver the future for our customers.</li><li>Move with heartfelt urgency. We have a healthy relationship with impatience, channeling it thoughtfully to show up better and faster for our customers and for each other. Time is the most limited thing we have, and we make the most of every moment.</li><li>Say the hard thing with care. Our best work often comes from intelligent debate, critique, and even difficult conversations. We speak our minds and don’t sugarcoat things — and we do so with respect, maturity, and care.</li><li>Make your mark. We seek out new and unique ways to create meaningful impact, and we champion the same from our colleagues. We work as a team to get the job done, and we go out of our way to celebrate and reward those going above and beyond for our customers and our teammates.

</li></ul><strong>Benefits & Wellness

</strong><ul><li>Equity ownership (RSUs) in a growing, privately-owned company</li><li>100% employer-paid healthcare, vision, and dental insurance coverage for employees and dependents (US; full-time Canadian workers working 30+ hours per week), as well as Health Savings Account/Health Reimbursement Account, dependent on insurance plan selection. Employees also have voluntary insurance options, such as life, disability, hospital protection, accident, and critical illness</li><li>12 weeks of paid parental leave for both birthing and non-birthing caregivers, as well as an additional 6-8 weeks of pregnancy disability for birthing parents to be used before child bonding leave. Employees also have access to family planning care and reimbursement</li><li>Flexible PTO with an mandatory annual minimum of 10 days paid time off, and sabbatical program</li><li>Access to mental wellness coaching, therapy, and Employee Assistance Program</li><li>Monthly stipends to support health and wellness, as well as smart work, and annual stipends to support professional growth</li><li>Professional career coaching, internal learning & development programs</li><li>401k plan and financial wellness benefits, like CPA or financial advisor coverage</li><li>Commuter benefits for in-office workers

</li></ul><i>Temporary employees are not eligible for paid holiday time off, accrued paid time off, paid leaves of absence, or company-sponsored perks.

</i><strong>Be you, with us

</strong>At Webflow, equality is a core tenet of our culture. We are committed to building an inclusive global team that represents a variety of backgrounds, perspectives, beliefs, and experiences. Employment decisions are made on the basis of job-related criteria without regard to race, color, religion, sex, sexual orientation, gender identity, national origin, disability, veteran status, or any other classification protected by applicable law.

<strong>Stay connected

</strong>Not ready to apply, but want to be part of the Webflow community? Consider following our story on our Webflow Blog, LinkedIn, Twitter, and/or Glassdoor.

<strong>Please Note

</strong><i>To join Webflow, you'll need valid U.S. or Canadian work authorization depending on the country of employment.

</i><i>If you are extended an offer, that offer may be contingent upon your successful completion of a background check, which will be conducted in accordance with applicable laws. We may obtain one or more background screening reports about you, solely for employment purposes.

</i><i>Protecting your privacy and the security of your data is a longstanding top priority for Webflow. Please consult our Applicant Privacy Notice </i><i>to know more about how we collect, use and transfer the personal data of our candidates.</i>","Webflow · United States (Remote)","https://www.linkedin.com/jobs/view/3868188773/","United States","Skills: Strategic Thinking, Predictive Modeling, +8 more","501-1,000 employees · Software Development
2 school alumni work here","LISTED","285757000","Webflow","https://media.licdn.com/dms/image/D4E0BAQE9CrqNFzJEsw/company-logo_400_400/0/1696534636076/webflow_inc__logo?e=1720656000&v=beta&t=JdbViqslk3Yop52uu7LpB-2EIDjmkLvunk91AEVob68","2024-03-22T20:18:10.000Z","2024-04-11T16:11:18.151Z"
