"Title","Description","Description HTML","Primary Description","Detail URL","Location","Skill","Insight","Job State","Poster Id","Company Name","Company Logo","Created At","Scraped At"
"Snr Research Consultant","Job Description

Oracle, Life Sciences is seeking a qualified clinical researcher to join our data and analytics team in the Real-World Evidence Group. In this role you will have the opportunity to participate in the design, preparation, analysis, and publication of health outcome studies (e.g., large database studies electronic health records, claims, etc.) and provide research consultation to both internal and external clients.

Our research supports life science companies develop products that improve people’s lives and well-being. Our blend of consulting, data analytics, and real-world research and evidence enables clients to understand patients, physicians and payers, bring products to market quickly, navigate the regulatory pathway and negotiate payer reimbursement and coverage.

Responsibilities

Expectations

As a clinical researcher you will:

 Consult with internal teams and clients on data availability, quality leveraging clinical knowledge  Serve as a subject matter expert clinically to the data science team and others  Actively participates in the design and preparation for projects  Collaborate with teams to deliver data driven outcomes for multiple research initiatives  Prepares documents for the data science team in understanding clinical components to programmable project delivery.  Able to work in a multi-cultural and collaborative multi-disciplinary environment.  Eligible for licensure to practice in their field or comparable global training  Willing to travel up to 10% as needed  Willing to work additional or irregular hours as needed and allowed by local regulations  Work in accordance with corporate and organizational security policies and procedures, understand personal role in safeguarding corporate and client 


Qualifications

Disclaimer:

Certain US customer or client-facing roles may be required to comply with applicable requirements, such as immunization and occupational health mandates.

Range and benefit information provided in this posting are specific to the stated locations only

US: Hiring Range: from $70,600 - $141,300 per year. May be eligible for bonus and equity.

Oracle maintains broad salary ranges for its roles in order to account for variations in knowledge, skills, experience, market conditions and locations, as well as reflect Oracle’s differing products, industries and lines of business.

Candidates are typically placed into the range based on the preceding factors as well as internal peer equity.

Oracle US offers a comprehensive benefits package which includes the following:

 Medical, dental, and vision insurance, including expert medical opinion Short term disability and long term disability Life insurance and AD&D Supplemental life insurance (Employee/Spouse/Child) Health care and dependent care Flexible Spending Accounts Pre-tax commuter and parking benefits 401(k) Savings and Investment Plan with company match Paid time off: Flexible Vacation is provided to all eligible employees assigned to a salaried (non-overtime eligible) position. Accrued Vacation is provided to all other employees eligible for vacation benefits. For employees working at least 35 hours per week, the vacation accrual rate is 13 days annually for the first three years of employment and 18 days annually for subsequent years of employment. Vacation accrual is prorated for employees working between 20 and 34 hours per week. Employees working fewer than 20 hours per week are not eligible for vacation. 11 paid holidays Paid sick leave: 72 hours of paid sick leave upon date of hire. Refreshes each calendar year. Unused balance will carry over each year up to a maximum cap of 112 hours. Paid parental leave Adoption assistance Employee Stock Purchase Plan Financial planning and group legal Voluntary benefits including auto, homeowner and pet insurance


About Us

As a world leader in cloud solutions, Oracle uses tomorrow’s technology to tackle today’s problems. True innovation starts with diverse perspectives and various abilities and backgrounds.

When everyone’s voice is heard, we’re inspired to go beyond what’s been done before. It’s why we’re committed to expanding our inclusive workforce that promotes diverse insights and perspectives.

We’ve partnered with industry-leaders in almost every sector—and continue to thrive after 40+ years of change by operating with integrity.

Oracle careers open the door to global opportunities where work-life balance flourishes. We offer a highly competitive suite of employee benefits designed on the principles of parity and consistency. We put our people first with flexible medical, life insurance and retirement options. We also encourage employees to give back to their communities through our volunteer programs.

We’re committed to including people with disabilities at all stages of the employment process. If you require accessibility assistance or accommodation for a disability at any point, let us know by calling +1 888 404 2494, option one.

Disclaimer:

Oracle is an Equal Employment Opportunity Employer*. All qualified applicants will receive consideration for employment without regard to race, color, religion, sex, national origin, sexual orientation, gender identity, disability and protected veterans’ status, or any other characteristic protected by law. Oracle will consider for employment qualified applicants with arrest and conviction records pursuant to applicable law.

 Which includes being a United States Affirmative Action Employer","<strong>Job Description

</strong>Oracle, Life Sciences is seeking a qualified clinical researcher to join our data and analytics team in the Real-World Evidence Group. In this role you will have the opportunity to participate in the design, preparation, analysis, and publication of health outcome studies (e.g., large database studies electronic health records, claims, etc.) and provide research consultation to both internal and external clients.

Our research supports life science companies develop products that improve people’s lives and well-being. Our blend of consulting, data analytics, and real-world research and evidence enables clients to understand patients, physicians and payers, bring products to market quickly, navigate the regulatory pathway and negotiate payer reimbursement and coverage.

<strong>Responsibilities

</strong><strong>Expectations

</strong>As a clinical researcher you will:

<ul><li> Consult with internal teams and clients on data availability, quality leveraging clinical knowledge </li><li> Serve as a subject matter expert clinically to the data science team and others </li><li> Actively participates in the design and preparation for projects </li><li> Collaborate with teams to deliver data driven outcomes for multiple research initiatives </li><li> Prepares documents for the data science team in understanding clinical components to programmable project delivery. </li><li> Able to work in a multi-cultural and collaborative multi-disciplinary environment. </li><li> Eligible for licensure to practice in their field or comparable global training </li><li> Willing to travel up to 10% as needed </li><li> Willing to work additional or irregular hours as needed and allowed by local regulations </li><li> Work in accordance with corporate and organizational security policies and procedures, understand personal role in safeguarding corporate and client 


</li></ul><strong>Qualifications

</strong>Disclaimer:

<strong>Certain US customer or client-facing roles may be required to comply with applicable requirements, such as immunization and occupational health mandates.

</strong><strong>Range and benefit information provided in this posting are specific to the stated locations only

</strong>US: Hiring Range: from $70,600 - $141,300 per year. May be eligible for bonus and equity.

Oracle maintains broad salary ranges for its roles in order to account for variations in knowledge, skills, experience, market conditions and locations, as well as reflect Oracle’s differing products, industries and lines of business.

Candidates are typically placed into the range based on the preceding factors as well as internal peer equity.

Oracle US offers a comprehensive benefits package which includes the following:

<ul><li> Medical, dental, and vision insurance, including expert medical opinion</li><li> Short term disability and long term disability</li><li> Life insurance and AD&D</li><li> Supplemental life insurance (Employee/Spouse/Child)</li><li> Health care and dependent care Flexible Spending Accounts</li><li> Pre-tax commuter and parking benefits</li><li> 401(k) Savings and Investment Plan with company match</li><li> Paid time off: Flexible Vacation is provided to all eligible employees assigned to a salaried (non-overtime eligible) position. Accrued Vacation is provided to all other employees eligible for vacation benefits. For employees working at least 35 hours per week, the vacation accrual rate is 13 days annually for the first three years of employment and 18 days annually for subsequent years of employment. Vacation accrual is prorated for employees working between 20 and 34 hours per week. Employees working fewer than 20 hours per week are not eligible for vacation.</li><li> 11 paid holidays</li><li> Paid sick leave: 72 hours of paid sick leave upon date of hire. Refreshes each calendar year. Unused balance will carry over each year up to a maximum cap of 112 hours.</li><li> Paid parental leave</li><li> Adoption assistance</li><li> Employee Stock Purchase Plan</li><li> Financial planning and group legal</li><li> Voluntary benefits including auto, homeowner and pet insurance


</li></ul><strong>About Us

</strong>As a world leader in cloud solutions, Oracle uses tomorrow’s technology to tackle today’s problems. True innovation starts with diverse perspectives and various abilities and backgrounds.

When everyone’s voice is heard, we’re inspired to go beyond what’s been done before. It’s why we’re committed to expanding our inclusive workforce that promotes diverse insights and perspectives.

We’ve partnered with industry-leaders in almost every sector—and continue to thrive after 40+ years of change by operating with integrity.

Oracle careers open the door to global opportunities where work-life balance flourishes. We offer a highly competitive suite of employee benefits designed on the principles of parity and consistency. We put our people first with flexible medical, life insurance and retirement options. We also encourage employees to give back to their communities through our volunteer programs.

We’re committed to including people with disabilities at all stages of the employment process. If you require accessibility assistance or accommodation for a disability at any point, let us know by calling +1 888 404 2494, option one.

<strong>Disclaimer:

</strong>Oracle is an Equal Employment Opportunity Employer*. All qualified applicants will receive consideration for employment without regard to race, color, religion, sex, national origin, sexual orientation, gender identity, disability and protected veterans’ status, or any other characteristic protected by law. Oracle will consider for employment qualified applicants with arrest and conviction records pursuant to applicable law.

<ul><li> Which includes being a United States Affirmative Action Employer</li></ul>","Oracle · United States (Remote)","https://www.linkedin.com/jobs/view/3900537871/","United States","6 of 10 skills match your profile - you may be a good fit","10,001+ employees · IT Services and IT Consulting
4 connections work here · 329 school alumni work here","LISTED","963212","Oracle","https://media.licdn.com/dms/image/D4E0BAQHYCgYovUuPtQ/company-logo_400_400/0/1665755678957/oracle_logo?e=1721865600&v=beta&t=9QhGgyUE90ghNIUHmMtArTbmvWeJ4LRGC9FWrwk5LAA","2024-04-17T10:11:33.000Z","2024-04-21T14:02:58.978Z"
"Senior Product Analyst","Who Are We?

Postman is the world’s leading API platform, used by more than 25 million developers and 500,000 organizations, including 98% of the Fortune 500. Postman is helping developers and professionals across the globe build the API-first world by simplifying each step of the API lifecycle and streamlining collaboration—enabling users to create better APIs, faster.

The company is headquartered in San Francisco and has an office in Bangalore, where it was founded. Postman is privately held, with funding from Battery Ventures, BOND, Coatue, CRV, Insight Partners, and Nexus Venture Partners. Learn more at postman.com or connect with Postman on Twitter via @getpostman.

P.S: We highly recommend reading The ""API-First World"" graphic novel to understand the bigger picture and our vision at Postman.

The Opportunity

We are looking for a Product Analyst to drive data-driven decision-making and deliver actionable insights that will contribute to accelerating and scaling the next stage of user and ARR growth for Postman. In this role, you will work closely with cross-functional teams to analyze data, identify trends, and provide recommendations for product improvements. Your work will directly impact our product roadmap and overall user experience.

The position will be a key partner to help drive decision making in conjunction with cross functional teams, using the broad base of customer data available in our data warehouse(s). The person in this role will be expected to generate insights from the data on a proactive basis, while also being able to design and analyze experiments meant to better understand the motivations of a diverse customer base.

Ultimately, a successful person in this role will be expected to be a resident expert in their area of the business, and can work autonomously leading analytics efforts to encourage the team to improve the customer experience and metrics.

What You’ll Do

Data Analysis: Analyze large datasets to identify patterns, trends, and insights related to user behavior, product usage, and market trends.Reporting and Visualization: Create and maintain dashboards and reports to monitor key performance indicators (KPIs) and communicate findings to stakeholders.A/B Testing: Plan and conduct A/B tests to assess the impact of product changes, and provide recommendations based on the results.Product Strategy: Collaborate with product managers to align data analysis with product development, helping to define and prioritize features and improvements.Data Quality: Ensure data accuracy and consistency, and work with relevant teams to resolve data quality issues.Cross-functional Collaboration: Work closely with engineering, design, marketing, and other teams to drive product improvements and optimize user experiences.Forecasting: Develop forecasting models to estimate future product performance and identify potential opportunities and challenges.Mentorship: Provide guidance and mentorship to junior analysts and contribute to building a strong data-driven culture within the organization.

About You

Bachelor’s or Master’s degree in a relevant field (e.g., Statistics, Data Science, Business Analytics).4-6 years experience as a Product Analyst or similar role, with a focus on data analysis and product insights.Proficiency in data analysis tools and languages (e.g., SQL, Python, R) and data visualization tools (e.g., Tableau, Power BI).Strong understanding of A/B testing methodologies and statistical analysis.Excellent communication skills, both written and verbal, to effectively convey complex data insights to non-technical stakeholders.Experience with web and mobile analytics tools (e.g., Google Analytics, Amplitude) is a plus.Ability to work in a fast-paced environment, manage multiple tasks, and meet deadlines.Strong problem-solving and critical-thinking skills.A passion for product development and a customer-focused mindset.Knowledge of machine learning and predictive modeling is a bonus.Prior knowledge of developer tools, with emphasis on API development (preferred).

Our Values

At Postman, we create with the same curiosity that we see in our users. We value transparency & honest communication about not only successes, but also failures. In our work, we focus on specific goals that add up to a larger vision. Our inclusive work culture ensures that everyone is valued equally as important pieces of our final product. We are dedicated to delivering the best products we can.

What Else?

This role is based in the greater San Francisco Bay area, and the reasonably estimated salary for this role ranges from $155,635 to $190,220, plus a competitive equity package. Actual compensation is based on the candidate's skills, qualifications, and experience. In addition to our pay-on-performance philosophy, we offer a comprehensive set of benefits, including full medical coverage, flexible PTO, wellness reimbursement, and a monthly lunch stipend. Salaries will vary outside of the listed metropolitan areas & the U.S.

Equal Opportunity

Postman is an Equal Employment Opportunity and Affirmative Action Employer. Qualified applicants will receive consideration for employment without regard to race, color, religion, sex, sexual orientation, gender perception or identity, national origin, age, marital status, protected veteran status, or disability status. Headhunters and recruitment agencies may not submit resumes/CVs through this website or directly to managers. Postman does not accept unsolicited headhunter and agency resumes. Postman will not pay fees to any third-party agency or company that does not have a signed agreement with Postman.","<strong>Who Are We?

</strong>Postman is the world’s leading API platform, used by more than 25 million developers and 500,000 organizations, including 98% of the Fortune 500. Postman is helping developers and professionals across the globe build the API-first world by simplifying each step of the API lifecycle and streamlining collaboration—enabling users to create better APIs, faster.

The company is headquartered in San Francisco and has an office in Bangalore, where it was founded. Postman is privately held, with funding from Battery Ventures, BOND, Coatue, CRV, Insight Partners, and Nexus Venture Partners. Learn more at postman.com or connect with Postman on Twitter via @getpostman.

P.S: We highly recommend reading The ""API-First World"" graphic novel to understand the bigger picture and our vision at Postman.

<strong>The Opportunity

</strong>We are looking for a Product Analyst to drive data-driven decision-making and deliver actionable insights that will contribute to accelerating and scaling the next stage of user and ARR growth for Postman. In this role, you will work closely with cross-functional teams to analyze data, identify trends, and provide recommendations for product improvements. Your work will directly impact our product roadmap and overall user experience.

The position will be a key partner to help drive decision making in conjunction with cross functional teams, using the broad base of customer data available in our data warehouse(s). The person in this role will be expected to generate insights from the data on a proactive basis, while also being able to design and analyze experiments meant to better understand the motivations of a diverse customer base.

Ultimately, a successful person in this role will be expected to be a resident expert in their area of the business, and can work autonomously leading analytics efforts to encourage the team to improve the customer experience and metrics.

<strong>What You’ll Do

</strong><ul><li>Data Analysis: Analyze large datasets to identify patterns, trends, and insights related to user behavior, product usage, and market trends.</li><li>Reporting and Visualization: Create and maintain dashboards and reports to monitor key performance indicators (KPIs) and communicate findings to stakeholders.</li><li>A/B Testing: Plan and conduct A/B tests to assess the impact of product changes, and provide recommendations based on the results.</li><li>Product Strategy: Collaborate with product managers to align data analysis with product development, helping to define and prioritize features and improvements.</li><li>Data Quality: Ensure data accuracy and consistency, and work with relevant teams to resolve data quality issues.</li><li>Cross-functional Collaboration: Work closely with engineering, design, marketing, and other teams to drive product improvements and optimize user experiences.</li><li>Forecasting: Develop forecasting models to estimate future product performance and identify potential opportunities and challenges.</li><li>Mentorship: Provide guidance and mentorship to junior analysts and contribute to building a strong data-driven culture within the organization.

</li></ul><strong>About You

</strong><ul><li>Bachelor’s or Master’s degree in a relevant field (e.g., Statistics, Data Science, Business Analytics).</li><li>4-6 years experience as a Product Analyst or similar role, with a focus on data analysis and product insights.</li><li>Proficiency in data analysis tools and languages (e.g., SQL, Python, R) and data visualization tools (e.g., Tableau, Power BI).</li><li>Strong understanding of A/B testing methodologies and statistical analysis.</li><li>Excellent communication skills, both written and verbal, to effectively convey complex data insights to non-technical stakeholders.</li><li>Experience with web and mobile analytics tools (e.g., Google Analytics, Amplitude) is a plus.</li><li>Ability to work in a fast-paced environment, manage multiple tasks, and meet deadlines.</li><li>Strong problem-solving and critical-thinking skills.</li><li>A passion for product development and a customer-focused mindset.</li><li>Knowledge of machine learning and predictive modeling is a bonus.</li><li>Prior knowledge of developer tools, with emphasis on API development (preferred).

</li></ul><strong>Our Values

</strong>At Postman, we create with the same curiosity that we see in our users. We value transparency & honest communication about not only successes, but also failures. In our work, we focus on specific goals that add up to a larger vision. Our inclusive work culture ensures that everyone is valued equally as important pieces of our final product. We are dedicated to delivering the best products we can.

<strong>What Else?

</strong>This role is based in the greater San Francisco Bay area, and the reasonably estimated salary for this role ranges from $155,635 to $190,220, plus a competitive equity package. Actual compensation is based on the candidate's skills, qualifications, and experience. In addition to our pay-on-performance philosophy, we offer a comprehensive set of benefits, including full medical coverage, flexible PTO, wellness reimbursement, and a monthly lunch stipend. Salaries will vary outside of the listed metropolitan areas & the U.S.

<strong>Equal Opportunity

</strong>Postman is an Equal Employment Opportunity and Affirmative Action Employer. Qualified applicants will receive consideration for employment without regard to race, color, religion, sex, sexual orientation, gender perception or identity, national origin, age, marital status, protected veteran status, or disability status. Headhunters and recruitment agencies may not submit resumes/CVs through this website or directly to managers. Postman does not accept unsolicited headhunter and agency resumes. Postman will not pay fees to any third-party agency or company that does not have a signed agreement with Postman.","Postman · San Francisco, CA","https://www.linkedin.com/jobs/view/3905372497/","San Francisco, California, United States","6 of 10 skills match your profile - you may be a good fit","501-1,000 employees · Software Development
2 school alumni work here","LISTED","128227830","Postman","https://media.licdn.com/dms/image/C560BAQFf8sH83foEVg/company-logo_400_400/0/1654794308958/postman_platform_logo?e=1721865600&v=beta&t=2X0vMcQ4TFUQNRFJEw5u8r2UN6yfT2Xl8mOQDUc0AEQ","2024-04-19T03:07:32.000Z","2024-04-21T14:02:58.978Z"
