"Title","Description","Description HTML","Primary Description","Detail URL","Location","Skill","Insight","Job State","Poster Id","Company Name","Company Logo","Created At","Scraped At"
"User Experience Researcher","Day to day:• Work closely with researchers, designers, PMs & engineers, to define and execute user research studies that will directly inform product design• Submit potential projects through research review and privacy process• Strictly adhere to privacy and safety standards when working directly with participants or participant data• Collaboratively and independently develop and execute research roadmaps• Lead various research studies throughout all the phases of the product development cycle• Conduct original data analysis and prepare presentations to communicate research findings• Manage research vendors to help augment the work of the research team Must haves:• Bachelor’s degree in a human behavior related field, such as human-computer interaction, psychology, sociology, communication, information science, media studies, computer science, or economics• Experience in quantitative and qualitative UX research and study design.• Experience working directly with human subjects.• Extensive experience with data and utilizing numbers to define and support hypotheses.• Prior experience with Python, R, MATLAB, or equivalent for data analysis Plusses:• Masters degree or higher in a human behavior related field, such as human-computer interaction, psychology, sociology, communication, information science, media studies, computer science, or economics• Understanding of large database infrastructure (SQL)","<p>Day to day:</p><p>• Work closely with researchers, designers, PMs & engineers, to define and execute user research studies that will directly inform product design</p><p>• Submit potential projects through research review and privacy process</p><p>• Strictly adhere to privacy and safety standards when working directly with participants or participant data</p><p>• Collaboratively and independently develop and execute research roadmaps</p><p>• Lead various research studies throughout all the phases of the product development cycle</p><p>• Conduct original data analysis and prepare presentations to communicate research findings</p><p>• Manage research vendors to help augment the work of the research team</p><p> </p><p>Must haves:</p><p>• Bachelor’s degree in a human behavior related field, such as human-computer interaction, psychology, sociology, communication, information science, media studies, computer science, or economics</p><p>• Experience in<strong> quantitative and qualitative</strong> UX research and study design.</p><p>• Experience working directly with <strong>human subjects.</strong></p><p>• Extensive experience with data and utilizing numbers to define and support hypotheses.</p><p>• Prior experience with Python, R, MATLAB, or equivalent for data analysis</p><p> </p><p>Plusses:</p><p>• Masters degree or higher in a human behavior related field, such as human-computer interaction, psychology, sociology, communication, information science, media studies, computer science, or economics</p><p>• Understanding of large database infrastructure (SQL)</p>","Insight Global · Seattle, WA (On-site)","https://www.linkedin.com/jobs/view/3901902526/","Seattle, Washington, United States","2 of 3 skills match your profile - you may be a good fit","1,001-5,000 employees · Staffing and Recruiting
14 school alumni work here","LISTED","797672500","Insight Global","https://media.licdn.com/dms/image/C560BAQGUNIyRZFaj0g/company-logo_400_400/0/1657049194702/insight_global_logo?e=1721865600&v=beta&t=dGdf-8zdSWlLokKkmIn0RM3mcZc1X9r7aBnhmupdFig","2024-04-18T18:25:16.000Z","2024-04-21T14:02:58.978Z"
"Senior/Principal Survey Analyst","Principal Analyst, Scientific Research Group

Company Description

YouGov is an international research and data analytics group.

Our mission is to supply a continuous stream of accurate data and insight into what the world thinks so that companies, governments and institutions can better serve the people and communities that sustain them.

We have the best data and the best tools. We continuously challenge conventional approaches to research, and we disrupt our industry to ensure that our clients always get the best solutions.

We are driven by a set of shared values. We are fast, fearless and innovative. We work diligently to get it right. We are guided by accuracy, ethics and proven methodologies. We trust each other and bring these values into everything that we do.

Each day, our highly engaged proprietary global panel of over 8 million people provides us with thousands of data points on consumer opinions, attitudes and behavior. We combine this continuous stream of data with our research expertise to provide insights that enable intelligent decision-making and informed conversations.

With operations in the UK, North America, Mainland Europe, the Nordics, the Middle East and Asia Pacific, YouGov has one of the world’s largest research networks.

Job Description

YouGov is looking for a technically sophisticated Principal Analyst to join the Analytics team within the Scientific Research Group. SRG is a fast growing unit within YouGov focusing on custom surveys and trackers in technology, politics, health, and other research areas with complex designs and client needs.

The Principal Analyst will report directly to the VP of Analytics, and in collaboration with the Directors, supporting the development of the Analytics roadmap and scaling the operation to meet our high growth targets. All analysts own client work, but the Principal Analyst will be heavily focused on development and innovation. We are looking for an individual combining practical experience in quantitative research with data science tools and best practices. Work in a fast-paced and intellectually stimulating environment where innovative solutions to market research, financial, and political problems are developed.

Responsibilities

Use background in stats and advanced analytics to act as a consultant with research teams on best analytic approach to research questionsUtilize data handling and warehousing skills to lead efforts to streamline the ingestion and processing of external data (ie population studies)Help grow our catalog of population studies and methodological toolkit through external data sources, academic literature, and internal researchIdentify opportunities to transform routine processes with automation and generalization, and lead these developmentsRecognize unmet needs of the organization and propose and lead projects or resources that fill themProvide mentorship to more junior team members, engaging them as needed in development and analytics projects


Requirements

Advanced degree (PhD or Masters) in statistics, data science, mathematics, computer science, political or social science (methods emphasis) OR equivalent experienceAt least 5 years of industry experience in data-centric role in quantitative researchStrong background in statistical modeling and machine learning methodsFluent in programming fundamentals, with advanced proficiency in at least one programming language (eg R, Python)Proficiency in R is required, with the ability to work inside and outside of the tidyverse frameworkExperience in the following technologies is desired: SQL, Git, LinuxExperience with cloud computing and data warehousing platforms like AWS or Snowflake are desiredA self motivated attitude, and the ability to look beyond established practices to find solutions to novel problemsTolerant of the ambiguity inherent in survey researchThrives in and promotes an intellectually diverse, collaborative, low ego culture


For roles based in New York, Colorado or Washington State, the base salary hiring range for this position is $90,000 to 125,000. Compensation offered will be determined by multiple factors including location, job-related knowledge, skills and experience. Certain roles may be eligible for incentive compensation and additional benefits. All US based full time employees are eligible for the following benefits: 

Paid vacation, holidays and sick daysFlexible working arrangements availableGroup medical, dental and vision insuranceCompany-paid life and disability insurancePaid parental leave401(k) with company match


While we are interested in the stated requirements, we recognize that qualified candidates may not check every box. If you feel this position would be a good fit for you, we encourage you to apply!

Company Description And Culture

YouGov is a global online research company, offering insight into what the world thinks. 

We speak daily to our panel of over 24 million registered members to understand opinion and behaviors around the world. We have a strong reputation as a source of accurate data and we’re trusted by the world’s biggest brands to get it right, making us the most quoted market research source in the world.

Why join YouGov?

Join our global team to help us achieve our social mission: to make millions of people’s opinions heard for the benefit of our local, national, and international communities.

Understanding diversity of opinion requires diversity of background. Although our global panel of millions of people worldwide powers our research, our biggest asset is our people. If our research is to be truly representative of what the world thinks, we need people from all walks of life to be part of the team to bring their perspective to the work we do.

Life at YouGov

We are driven by a set of shared values. We are fast, fearless, and innovative. We work diligently to get it right. We are guided by accuracy, ethics, and proven methodologies. We respect and trust each other, bringing these values into everything that we do.

We strive to provide YouGovers with best-in-class benefits to support their physical, financial, and emotional wellbeing. We want our employees to have a sense of belonging and uniqueness in a supportive workplace, so they can bring their full selves to work.

Equal Opportunity Employer

As an Equal Opportunity Employer, qualified applicants will receive consideration for employment without regard to race, color, religion, sex (including pregnancy, gender identity or expression, and sexual orientation), parental status, national origin, marital status, age, disability, genetic information, HIV status, political affiliation, socioeconomic background, veteran status or any other characteristic protected by law or in line with our responsibilities as a fair and ethic employer. All employment decisions are made based on occupational qualifications, merit, and business need.

Data Privacy

To find out how we collect and use your personal data when you apply for a role at YouGov, please read our privacy notice at https://jobs.yougov.com/privacy","Principal Analyst, Scientific Research Group

<strong>Company Description

</strong>YouGov is an international research and data analytics group.

Our mission is to supply a continuous stream of accurate data and insight into what the world thinks so that companies, governments and institutions can better serve the people and communities that sustain them.

We have the best data and the best tools. We continuously challenge conventional approaches to research, and we disrupt our industry to ensure that our clients always get the best solutions.

We are driven by a set of shared values. We are fast, fearless and innovative. We work diligently to get it right. We are guided by accuracy, ethics and proven methodologies. We trust each other and bring these values into everything that we do.

Each day, our highly engaged proprietary global panel of over 8 million people provides us with thousands of data points on consumer opinions, attitudes and behavior. We combine this continuous stream of data with our research expertise to provide insights that enable intelligent decision-making and informed conversations.

With operations in the UK, North America, Mainland Europe, the Nordics, the Middle East and Asia Pacific, YouGov has one of the world’s largest research networks.

<strong>Job Description

</strong>YouGov is looking for a technically sophisticated Principal Analyst to join the Analytics team within the Scientific Research Group. SRG is a fast growing unit within YouGov focusing on custom surveys and trackers in technology, politics, health, and other research areas with complex designs and client needs.

The Principal Analyst will report directly to the VP of Analytics, and in collaboration with the Directors, supporting the development of the Analytics roadmap and scaling the operation to meet our high growth targets. All analysts own client work, but the Principal Analyst will be heavily focused on development and innovation. We are looking for an individual combining practical experience in quantitative research with data science tools and best practices. Work in a fast-paced and intellectually stimulating environment where innovative solutions to market research, financial, and political problems are developed.

<strong>Responsibilities

</strong><ul><li>Use background in stats and advanced analytics to act as a consultant with research teams on best analytic approach to research questions</li><li>Utilize data handling and warehousing skills to lead efforts to streamline the ingestion and processing of external data (ie population studies)</li><li>Help grow our catalog of population studies and methodological toolkit through external data sources, academic literature, and internal research</li><li>Identify opportunities to transform routine processes with automation and generalization, and lead these developments</li><li>Recognize unmet needs of the organization and propose and lead projects or resources that fill them</li><li>Provide mentorship to more junior team members, engaging them as needed in development and analytics projects


</li></ul><strong>Requirements

</strong><ul><li>Advanced degree (PhD or Masters) in statistics, data science, mathematics, computer science, political or social science (methods emphasis) OR equivalent experience</li><li>At least 5 years of industry experience in data-centric role in quantitative research</li><li>Strong background in statistical modeling and machine learning methods</li><li>Fluent in programming fundamentals, with advanced proficiency in at least one programming language (eg R, Python)</li><li>Proficiency in R is required, with the ability to work inside and outside of the tidyverse framework</li><li>Experience in the following technologies is desired: SQL, Git, Linux</li><li>Experience with cloud computing and data warehousing platforms like AWS or Snowflake are desired</li><li>A self motivated attitude, and the ability to look beyond established practices to find solutions to novel problems</li><li>Tolerant of the ambiguity inherent in survey research</li><li>Thrives in and promotes an intellectually diverse, collaborative, low ego culture


</li></ul><i>For roles based in New York, Colorado or Washington State, the base salary hiring range for this position is $90,000 to 125,000. Compensation offered will be determined by multiple factors including location, job-related knowledge, skills and experience. Certain roles may be eligible for incentive compensation and additional benefits. All US based full time employees are eligible for the following benefits: 

</i><ul><li>Paid vacation, holidays and sick days</li><li>Flexible working arrangements available</li><li>Group medical, dental and vision insurance</li><li>Company-paid life and disability insurance</li><li>Paid parental leave</li><li>401(k) with company match


</li></ul>While we are interested in the stated requirements, we recognize that qualified candidates may not check every box. If you feel this position would be a good fit for you, we encourage you to apply!

<strong>Company Description And Culture

</strong><strong>YouGov is a global online research company, offering insight into what the world thinks. 

</strong>We speak daily to our panel of over 24 million registered members to understand opinion and behaviors around the world. We have a strong reputation as a source of accurate data and we’re trusted by the world’s biggest brands to get it right, making us the most quoted market research source in the world.

<strong>Why join YouGov?

</strong>Join our global team to help us achieve our social mission: to make millions of people’s opinions heard for the benefit of our local, national, and international communities.

Understanding diversity of opinion requires diversity of background. Although our global panel of millions of people worldwide powers our research, our biggest asset is our people. If our research is to be truly representative of what the world thinks, we need people from all walks of life to be part of the team to bring their perspective to the work we do.

<strong>Life at YouGov

</strong>We are driven by a set of shared values. We are fast, fearless, and innovative. We work diligently to get it right. We are guided by accuracy, ethics, and proven methodologies. We respect and trust each other, bringing these values into everything that we do.

We strive to provide YouGovers with best-in-class benefits to support their physical, financial, and emotional wellbeing. We want our employees to have a sense of belonging and uniqueness in a supportive workplace, so they can bring their full selves to work.

<strong>Equal Opportunity Employer

</strong>As an Equal Opportunity Employer, qualified applicants will receive consideration for employment without regard to race, color, religion, sex (including pregnancy, gender identity or expression, and sexual orientation), parental status, national origin, marital status, age, disability, genetic information, HIV status, political affiliation, socioeconomic background, veteran status or any other characteristic protected by law or in line with our responsibilities as a fair and ethic employer. All employment decisions are made based on occupational qualifications, merit, and business need.

<strong>Data Privacy

</strong>To find out how we collect and use your personal data when you apply for a role at YouGov, please read our privacy notice at https://jobs.yougov.com/privacy","YouGov · United States (Remote)","https://www.linkedin.com/jobs/view/3900965367/","United States","Skills: Quantitative Research, Research Skills, +8 more","1,001-5,000 employees · Business Intelligence Platforms
1 connection works here","LISTED","354737595","YouGov","https://media.licdn.com/dms/image/C4D0BAQGRxed6OLCOKg/company-logo_400_400/0/1643788063754/yougov_logo?e=1721865600&v=beta&t=3VUVqQMonpFdf2q-0_o2yry7Qqcb4x8wkky1yFUrc0A","2024-04-17T22:50:01.000Z","2024-04-21T14:02:58.978Z"
