"Title","Description","Description HTML","Primary Description","Detail URL","Location","Skill","Insight","Job State","Poster Id","Company Name","Company Logo","Created At","Scraped At"
"Analytics Manager, PINS","Position Overview

We're seeking an Analytics Manager for PINS (Payee Identification and Network Security) to join our team, reporting to the Senior Director. In this role, you'll lead the PINS analytics team and drive the development of a structured analytics program. Your focus will be on managing ongoing and ad-hoc reporting, automation, and operational enhancements for the PINS team, ensuring data accuracy and consistent reporting. You'll also implement strategies to translate raw data into actionable insights for decision-making within the PINS department and across functional teams.

Key Responsibilities

Develop and implement a structured analytics program, including training, onboarding, and testing of skills for analysts, and documentation of reporting requirementsPrioritize requests from the PINS department and stakeholders, ensuring capture of business cases and effective management of deliverablesTransform raw data into meaningful business insights for decision-making and strategic planningPrepare data summaries and detailed reports for leadership, identifying trends, patterns, areas of concern, and overall business insightsEnsure accuracy of data and deliverables through established policies and processesCollaborate with data and analytics professionals to optimize and scale the PINS team, ensuring continuity of reporting and dashboardsIdentify areas for process improvements, including automation, dashboard development, and visualization toolsEnhance reporting of department KPIs and SLAs to provide visibility into team accomplishments and areas for improvementProvide detailed explanation and training to end-users of reporting and dashboardsManage day-to-day requests, enhancements, and tasks for yourself and your team, ensuring alignment with current departmental prioritiesThink creatively to solve complex problems and adapt dynamically to changing risks and business needs

Required Qualifications

Bachelor's degree in business and/or Computer Science; OR 7+ years of equivalent work experience3+ years of experience leading a team of analysts or data scientists

Preferred Qualifications

Advanced modeling skills in SQL, Python, or comparable query language competenciesHighly analytical and proficient with database and visualization tools such as Tableau and/or Power BIStrong Excel skills, including formulas, vlookups, and conditional formattingAbility to mine complex datasets and generate actionable business recommendationsAdaptability to change and effective response in a fast-paced, deadline-focused environmentProficiency in data-driven decision-making and storytellingExperience in fraud or risk prevention

As a leading payments company in healthcare, we guide, price, explain, and pay for care on behalf of insurers and their members. We’re Zelis in our pursuit to align the interests of payers, providers, and consumers to deliver a better financial experience and more affordable, transparent care for all. We partner with more than 700 payers, including the top-5 national health plans, BCBS insurers, regional health plans, TPAs and self-insured employers, over 4 million providers, and 100 million members, enabling the healthcare industry to pay for care, with care. Zelis brings adaptive technology, a deeply ingrained service culture, and a comprehensive navigation through adjudication and payment platform to manage the complete payment process.

Commitment to Diversity, Equity, Inclusion, and Belonging

At Zelis, we champion diversity, equity, inclusion, and belonging in all aspects of our operations. We embrace the power of diversity and create an environment where people can bring their authentic and best selves to work. We know that a sense of belonging is key not only to your success at Zelis, but also to your ability to bring your best each day.

Equal Employment Opportunity 

Zelis is proud to be an equal opportunity employer. All applicants will receive consideration for employment without regard to race, color, religion, age, sex, national origin, disability status, genetics, protected veteran status, sexual orientation, gender identity or expression, or any other characteristic protected by federal, state or local laws.

We encourage members of traditionally underrepresented communities to apply, even if you do not believe you 100% fit the qualifications of the position, including women, LGBTQIA people, people of color, and people with disabilities.

Accessibility Support

We are dedicated to ensuring our application process is accessible to all candidates. If you are a qualified individual with a disability or a disabled veteran and require a reasonable accommodation with any part of the application and/or interview process, please email TalentAcquisition@zelis.com

SCAM ALERT: There is an active nationwide employment scam which is now using Zelis to garner personal information or financial scams. This site is secure, and any applications made here are with our legitimate partner. If you’re contacted by a Zelis Recruiter, please ensure whomever is contacting you truly represents Zelis Healthcare. We will never asked for the exchange of any money or credit card details during the recruitment process. Please be aware of any suspicious email activity from people who could be pretending to be recruiters or senior professionals at Zelis.","<strong>Position Overview

</strong>We're seeking an Analytics Manager for PINS (Payee Identification and Network Security) to join our team, reporting to the Senior Director. In this role, you'll lead the PINS analytics team and drive the development of a structured analytics program. Your focus will be on managing ongoing and ad-hoc reporting, automation, and operational enhancements for the PINS team, ensuring data accuracy and consistent reporting. You'll also implement strategies to translate raw data into actionable insights for decision-making within the PINS department and across functional teams.

<strong>Key Responsibilities

</strong><ul><li>Develop and implement a structured analytics program, including training, onboarding, and testing of skills for analysts, and documentation of reporting requirements</li><li>Prioritize requests from the PINS department and stakeholders, ensuring capture of business cases and effective management of deliverables</li><li>Transform raw data into meaningful business insights for decision-making and strategic planning</li><li>Prepare data summaries and detailed reports for leadership, identifying trends, patterns, areas of concern, and overall business insights</li><li>Ensure accuracy of data and deliverables through established policies and processes</li><li>Collaborate with data and analytics professionals to optimize and scale the PINS team, ensuring continuity of reporting and dashboards</li><li>Identify areas for process improvements, including automation, dashboard development, and visualization tools</li><li>Enhance reporting of department KPIs and SLAs to provide visibility into team accomplishments and areas for improvement</li><li>Provide detailed explanation and training to end-users of reporting and dashboards</li><li>Manage day-to-day requests, enhancements, and tasks for yourself and your team, ensuring alignment with current departmental priorities</li><li>Think creatively to solve complex problems and adapt dynamically to changing risks and business needs

</li></ul><strong>Required Qualifications

</strong><ul><li>Bachelor's degree in business and/or Computer Science; OR 7+ years of equivalent work experience</li><li>3+ years of experience leading a team of analysts or data scientists

</li></ul><strong>Preferred Qualifications

</strong><ul><li>Advanced modeling skills in SQL, Python, or comparable query language competencies</li><li>Highly analytical and proficient with database and visualization tools such as Tableau and/or Power BI</li><li>Strong Excel skills, including formulas, vlookups, and conditional formatting</li><li>Ability to mine complex datasets and generate actionable business recommendations</li><li>Adaptability to change and effective response in a fast-paced, deadline-focused environment</li><li>Proficiency in data-driven decision-making and storytelling</li><li>Experience in fraud or risk prevention

</li></ul>As a leading payments company in healthcare, we guide, price, explain, and pay for care on behalf of insurers and their members. We’re Zelis in our pursuit to align the interests of payers, providers, and consumers to deliver a better financial experience and more affordable, transparent care for all. We partner with more than 700 payers, including the top-5 national health plans, BCBS insurers, regional health plans, TPAs and self-insured employers, over 4 million providers, and 100 million members, enabling the healthcare industry to pay for care, with care. Zelis brings adaptive technology, a deeply ingrained service culture, and a comprehensive navigation through adjudication and payment platform to manage the complete payment process.

Commitment to Diversity, Equity, Inclusion, and Belonging

At Zelis, we champion diversity, equity, inclusion, and belonging in all aspects of our operations. We embrace the power of diversity and create an environment where people can bring their authentic and best selves to work. We know that a sense of belonging is key not only to your success at Zelis, but also to your ability to bring your best each day.

<strong>Equal Employment Opportunity 

</strong>Zelis is proud to be an equal opportunity employer. All applicants will receive consideration for employment without regard to race, color, religion, age, sex, national origin, disability status, genetics, protected veteran status, sexual orientation, gender identity or expression, or any other characteristic protected by federal, state or local laws.

We encourage members of traditionally underrepresented communities to apply, even if you do not believe you 100% fit the qualifications of the position, including women, LGBTQIA people, people of color, and people with disabilities.

<strong>Accessibility Support

</strong>We are dedicated to ensuring our application process is accessible to all candidates. If you are a qualified individual with a disability or a disabled veteran and require a reasonable accommodation with any part of the application and/or interview process, please email TalentAcquisition@zelis.com

SCAM ALERT: There is an active nationwide employment scam which is now using Zelis to garner personal information or financial scams. This site is secure, and any applications made here are with our legitimate partner. If you’re contacted by a Zelis Recruiter, please ensure whomever is contacting you truly represents Zelis Healthcare. We will never asked for the exchange of any money or credit card details during the recruitment process. Please be aware of any suspicious email activity from people who could be pretending to be recruiters or senior professionals at Zelis.","Zelis · St Louis, MO","https://www.linkedin.com/jobs/view/3844087979/","St Louis, Missouri, United States","Skills: Business Insights, Query Languages, +8 more","1,001-5,000 employees · Technology, Information and Internet
2 school alumni work here","LISTED","163709798","Zelis","https://media.licdn.com/dms/image/C560BAQFqgU0iXMBu7g/company-logo_400_400/0/1633106754925/zelis_logo?e=1722470400&v=beta&t=5pdQr7Q2kir9MUD-L2s-sBOpAOnuEok9ykQyQVU2_j8","2024-03-07T02:08:14.000Z","2024-04-30T00:07:46.481Z"
"People Analytics, Reporting & Insights, AVP - Human Resources","Blackstone is the world’s largest alternative asset manager. We seek to create positive economic impact and long-term value for our investors, the companies we invest in, and the communities in which we work. We do this by using extraordinary people and flexible capital to help companies solve problems. Our $1 trillion in assets under management include investment vehicles focused on private equity, real estate, public debt and equity, infrastructure, life sciences, growth equity, opportunistic, non-investment grade credit, real assets and secondary funds, all on a global basis. Further information is available at www.blackstone.com. Follow @blackstone on LinkedIn, Twitter, and Instagram.

The People Analytics Team is focused on providing actionable insights to help our partners in HR and Blackstone’s businesses make faster, more sustainable, more strategic, and more cost-effective decisions. The role will report directly to and work in partnership with the Vice President of Reporting & Insights.

Primary responsibilities include:

Design, build, and deliver effective Tableau dashboards to communicate the most important information and insights to our Business and HR leadersCreate and deliver concise and effective executive-level presentations to communicate actionable insights to our stakeholdersApply analytical and problem-solving skills to navigate ambiguity and develop recommendations for better business decisionsServe as an analytics partner to several of our Business Units. This will require the team member to learn the needs of the business, scope out the right solutions, and roll up their sleeves to build high quality and sustainable products with help from their teammatesContinuously enhance our reporting and analytics framework, helping to shape our roadmap, document internal processes, and standardize metrics and definitionsSupport and improve our long-term headcount process in close collaboration with teammates across HRDeliver analyses focused on talent, diversity, recruiting leveraging analysis of both quantitative and qualitative dataDesign and build solutions in Workday to make teammates’ lives easier and to make processes more efficientAdvocate for clean HR data, and build tools and audits to help make this possibleEnhance teammates’ ability to use reporting tools and to identify key insights

Qualifications:

4+ years of professional experience in analytics, with a strong emphasis on providing analytics solutions to clients3+ years of experience in building Tableau dashboards with a focus on storytelling3+ years of experience using SQL and some knowledge of data warehousing best practices (experience building reporting views in Snowflake is preferred)Ability to generate clear, concise, and executive-ready actionable recommendationsStrong communication and data presentation skillsExperience building reports directly in an HRIS system using calculated fields, worklets, dashboards, and composite reports (preferably in Workday)Experience with technical documentation, project planning techniques, and logging work in project management software like JIRABachelor’s or Master’s Degree in HR, Technology, Analytics, Data Science or related field

Preferred, but not required:

Understanding and interest in industrial and organizational psychologyKnowledge of statistical concepts (correlation, regression, T-test, Annova), research methods and experimental designs

The duties and responsibilities described here are not exhaustive and additional assignments, duties, or responsibilities may be required of this position. Assignments, duties, and responsibilities may be changed at any time, with or without notice, by Blackstone in its sole discretion.

Expected annual base salary range:

$125,000 - $180,000

Actual base salary within that range will be determined by several components including but not limited to the individual's experience, skills, qualifications and job location. For roles located outside of the US, please disregard the posted salary bands as these roles will follow a separate compensation process based on local market comparables.

Additional compensation: Base salary does not include other forms of compensation or benefits offered in connection with the advertised role.

Blackstone is committed to providing equal employment opportunities to all employees and applicants for employment without regard to race, color, creed, religion, sex, pregnancy, national origin, ancestry, citizenship status, age, marital or partnership status, sexual orientation, gender identity or expression, disability, genetic predisposition, veteran or military status, status as a victim of domestic violence, a sex offense or stalking, or any other class or status in accordance with applicable federal, state and local laws. This policy applies to all terms and conditions of employment, including but not limited to hiring, placement, promotion, termination, transfer, leave of absence, compensation, and training. All Blackstone employees, including but not limited to recruiting personnel and hiring managers, are required to abide by this policy.

If you need a reasonable accommodation to complete your application, please email Human Resources at HR-Recruiting-Americas@Blackstone.com.

Depending on the position, you may be required to obtain certain securities licenses if you are in a client facing role and/or if you are engaged in the following:

Attending client meetings where you are discussing Blackstone products and/or and client questions; Marketing Blackstone funds to new or existing clients; Supervising or training securities licensed employees; Structuring or creating Blackstone funds/products; andAdvising on marketing plans prepared by a sales team or developing and/or contributing information for marketing materials. 

Note: The above list is not the exhaustive list of activities requiring securities licenses and there may be roles that require review on a case-by-case basis. Please speak with your Blackstone Recruiting contact with any questions.

To submit your application please complete the form below. Fields marked with a red asterisk * must be completed to be considered for employment (although some can be answered ""prefer not to say""). Failure to provide this information may compromise the follow-up of your application. When you have finished click Submit at the bottom of this form.","Blackstone is the world’s largest alternative asset manager. We seek to create positive economic impact and long-term value for our investors, the companies we invest in, and the communities in which we work. We do this by using extraordinary people and flexible capital to help companies solve problems. Our $1 trillion in assets under management include investment vehicles focused on private equity, real estate, public debt and equity, infrastructure, life sciences, growth equity, opportunistic, non-investment grade credit, real assets and secondary funds, all on a global basis. Further information is available at www.blackstone.com. Follow @blackstone on LinkedIn, Twitter, and Instagram.

The People Analytics Team is focused on providing actionable insights to help our partners in HR and Blackstone’s businesses make faster, more sustainable, more strategic, and more cost-effective decisions. The role will report directly to and work in partnership with the Vice President of Reporting & Insights.

<strong>Primary responsibilities include:

</strong><ul><li>Design, build, and deliver effective Tableau dashboards to communicate the most important information and insights to our Business and HR leaders</li><li>Create and deliver concise and effective executive-level presentations to communicate actionable insights to our stakeholders</li><li>Apply analytical and problem-solving skills to navigate ambiguity and develop recommendations for better business decisions</li><li>Serve as an analytics partner to several of our Business Units. This will require the team member to learn the needs of the business, scope out the right solutions, and roll up their sleeves to build high quality and sustainable products with help from their teammates</li><li>Continuously enhance our reporting and analytics framework, helping to shape our roadmap, document internal processes, and standardize metrics and definitions</li><li>Support and improve our long-term headcount process in close collaboration with teammates across HR</li><li>Deliver analyses focused on talent, diversity, recruiting leveraging analysis of both quantitative and qualitative data</li><li>Design and build solutions in Workday to make teammates’ lives easier and to make processes more efficient</li><li>Advocate for clean HR data, and build tools and audits to help make this possible</li><li>Enhance teammates’ ability to use reporting tools and to identify key insights

</li></ul><strong>Qualifications:

</strong><ul><li>4+ years of professional experience in analytics, with a strong emphasis on providing analytics solutions to clients</li><li>3+ years of experience in building Tableau dashboards with a focus on storytelling</li><li>3+ years of experience using SQL and some knowledge of data warehousing best practices (experience building reporting views in Snowflake is preferred)</li><li>Ability to generate clear, concise, and executive-ready actionable recommendations</li><li>Strong communication and data presentation skills</li><li>Experience building reports directly in an HRIS system using calculated fields, worklets, dashboards, and composite reports (preferably in Workday)</li><li>Experience with technical documentation, project planning techniques, and logging work in project management software like JIRA</li><li>Bachelor’s or Master’s Degree in HR, Technology, Analytics, Data Science or related field

</li></ul>Preferred, but not required:

<ul><li>Understanding and interest in industrial and organizational psychology</li><li>Knowledge of statistical concepts (correlation, regression, T-test, Annova), research methods and experimental designs

</li></ul>The duties and responsibilities described here are not exhaustive and additional assignments, duties, or responsibilities may be required of this position. Assignments, duties, and responsibilities may be changed at any time, with or without notice, by Blackstone in its sole discretion.

<strong>Expected annual base salary range:

</strong>$125,000 - $180,000

Actual base salary within that range will be determined by several components including but not limited to the individual's experience, skills, qualifications and job location. For roles located outside of the US, please disregard the posted salary bands as these roles will follow a separate compensation process based on local market comparables.

Additional compensation: Base salary does not include other forms of compensation or benefits offered in connection with the advertised role.

Blackstone is committed to providing equal employment opportunities to all employees and applicants for employment without regard to race, color, creed, religion, sex, pregnancy, national origin, ancestry, citizenship status, age, marital or partnership status, sexual orientation, gender identity or expression, disability, genetic predisposition, veteran or military status, status as a victim of domestic violence, a sex offense or stalking, or any other class or status in accordance with applicable federal, state and local laws. This policy applies to all terms and conditions of employment, including but not limited to hiring, placement, promotion, termination, transfer, leave of absence, compensation, and training. All Blackstone employees, including but not limited to recruiting personnel and hiring managers, are required to abide by this policy.

If you need a reasonable accommodation to complete your application, please email Human Resources at HR-Recruiting-Americas@Blackstone.com.

Depending on the position, you may be required to obtain certain securities licenses if you are in a client facing role and/or if you are engaged in the following:

<ul><li>Attending client meetings where you are discussing Blackstone products and/or and client questions; </li><li>Marketing Blackstone funds to new or existing clients; </li><li>Supervising or training securities licensed employees; </li><li>Structuring or creating Blackstone funds/products; and</li><li>Advising on marketing plans prepared by a sales team or developing and/or contributing information for marketing materials. 

</li></ul>Note: The above list is not the exhaustive list of activities requiring securities licenses and there may be roles that require review on a case-by-case basis. Please speak with your Blackstone Recruiting contact with any questions.

To submit your application please complete the form below. Fields marked with a red asterisk * must be completed to be considered for employment (although some can be answered ""prefer not to say""). Failure to provide this information may compromise the follow-up of your application. When you have finished click Submit at the bottom of this form.","Blackstone · New York, NY","https://www.linkedin.com/jobs/view/3854411289/","New York, New York, United States","Skills: Securities, Human Resources (HR), +8 more","1,001-5,000 employees · Financial Services
9 school alumni work here","LISTED","23552347","Blackstone","https://media.licdn.com/dms/image/C4E0BAQHM1mo8m_ecGw/company-logo_400_400/0/1678125020983/blackstonegroup_logo?e=1722470400&v=beta&t=rWeMMiaEXLdNVqZoYSE_iBkAK7Ei4pAm47vpAs1T8d0","2024-03-12T15:36:01.000Z","2024-04-30T00:07:46.481Z"
