"Title","Description","Description HTML","Primary Description","Detail URL","Location","Skill","Insight","Job State","Poster Id","Company Name","Company Logo","Created At","Scraped At"
"Fatigue Scientist / Human Factors Engineer","Job DescriptionThe Fatigue Scientist will serve as an integral part of Fort Hill Group’s Air Traffic Control Human Factors Team. The Fatigue scientist will support FAA projects related to analyzing potential impacts of fatigue on air traffic controllers and technicians, modeling work schedules, and providing guidance and training materials related to fatigue management. The candidate will work closely with other project team managers to support the needs of the client. The candidate will be expected to clearly present key research findings to stakeholders and contribute to the development of research reports. This position may be filled as a full-time or part-time position.
Potential Work ActivitiesConducting large-scale assessments, and/or event driven investigations of specific work schedules utilizing bio-mathematical fatigue analysis software to identify any potential impacts of schedule- related fatigue risksCollecting and analyzing actigraphy data to identify the potential impacts of fatigue on operational personnelProviding technical review and input to fatigue research being completed by other research organizationsProviding briefing materials and findings resulting from fatigue analysis to project stakeholders
Candidate RequirementsUS citizenship or permanent residenceAdvanced degree in Human Factors, Engineering, Psychology, or related discipline.6+ Years of relevant work experienceExperience collecting and analyzing physiological data in support of fatigue or human factors analysesExperience collecting fatigue or human performance data during live or simulated operational conditionsExcellent oral and written communication skills for presenting technical research resultsCandidate must be a U.S. citizen able to successfully complete a government security investigation
Desired AttributesExperience utilizing FAID Quantum, or other bio-mathematical software to conduct fatigue analysesExpertise applying human factors methods within the aviation and/or air traffic control domainExperience applying advanced statistical methods to large human performance data setsHistory of working directly with the FAA or aviation industry.","<p><strong>Job Description</strong></p><p>The Fatigue Scientist will serve as an integral part of Fort Hill Group’s Air Traffic Control Human Factors Team. The Fatigue scientist will support FAA projects related to analyzing potential impacts of fatigue on air traffic controllers and technicians, modeling work schedules, and providing guidance and training materials related to fatigue management. The candidate will work closely with other project team managers to support the needs of the client. The candidate will be expected to clearly present key research findings to stakeholders and contribute to the development of research reports. This position may be filled as a full-time or part-time position.</p><p>
</p><p><strong>Potential Work Activities</strong></p><ul><li>Conducting large-scale assessments, and/or event driven investigations of specific work schedules utilizing bio-mathematical fatigue analysis software to identify any potential impacts of schedule- related fatigue risks</li><li>Collecting and analyzing actigraphy data to identify the potential impacts of fatigue on operational personnel</li><li>Providing technical review and input to fatigue research being completed by other research organizations</li><li>Providing briefing materials and findings resulting from fatigue analysis to project stakeholders</li></ul><p>
</p><p><strong>Candidate Requirements</strong></p><ul><li>US citizenship or permanent residence</li><li>Advanced degree in Human Factors, Engineering, Psychology, or related discipline.</li><li>6+ Years of relevant work experience</li><li>Experience collecting and analyzing physiological data in support of fatigue or human factors analyses</li><li>Experience collecting fatigue or human performance data during live or simulated operational conditions</li><li>Excellent oral and written communication skills for presenting technical research results</li><li>Candidate must be a U.S. citizen able to successfully complete a government security investigation</li></ul><p>
</p><p><strong>Desired Attributes</strong></p><ul><li>Experience utilizing FAID Quantum, or other bio-mathematical software to conduct fatigue analyses</li><li>Expertise applying human factors methods within the aviation and/or air traffic control domain</li><li>Experience applying advanced statistical methods to large human performance data sets</li><li>History of working directly with the FAA or aviation industry.</li></ul>","Fort Hill Group LLC · Washington, DC (Hybrid)","https://www.linkedin.com/jobs/view/3911985823/","Washington, District of Columbia, United States","Skills: Data Analysis, Human Factors Engineering, +6 more","11-50 employees","LISTED","9872313","Fort Hill Group LLC","https://media.licdn.com/dms/image/C4E0BAQGCxdYVApTUDA/company-logo_400_400/0/1631331356465?e=1722470400&v=beta&t=CMI4Vq3UaT-TIpOStgKB_2v5V9cX62mhe6jULg1I4MY","2024-04-26T17:30:07.000Z","2024-04-30T00:07:46.481Z"
"Anthropometry & Human Factors R&D Engineer","Join Our Engineering Team as a - Specializing in Anthropometry & Human Factors R&D EngineerAre you passionate about cutting-edge research at the intersection of human factors and textile innovation? We're seeking a dynamic individual to join our team in a pivotal role as a Process Engineer, focusing on Anthropometry & Human Factors for VR/AR technologies.
Why You'll Love This Role:Impactful Work: As a Process Engineer, you'll play a crucial role in advancing our understanding of textiles through anthropometric data collection and in-person user testing.End-to-End Ownership: You'll have the exciting opportunity to take ownership of the entire workflow process, from data collection to analysis, and communicate your findings to our diverse cross-functional teams.Cutting-Edge Technology: Work with state-of-the-art equipment, including Artec Scanning systems and 3DMD scanning, with training opportunities provided.What We're Looking For:
Minimum Qualifications:Advanced Degree or Equivalent: M.S. or Ph.D. in Mechanical Engineering, Materials Science, Polymer Science, Textile Engineering, or a related field, or equivalent work experience.Technical Expertise: Demonstrated experience in 3D scanning data processing, mechanical characterization, and analyzing large datasets to derive meaningful insights.
Desired Qualifications:Innovative Mindset: Experience with virtual fit simulation tools like Clo3D or Optitex, and a strong background in mechanical modeling of soft material systems.Research Background: Previous involvement in research projects related to functionalized textiles and familiarity with 3D knitting or machine knitting are highly desirable.
Why Join Us:Collaborative Environment: Work alongside a passionate team of experts dedicated to pushing the boundaries of textile innovation.Continuous Learning: Benefit from ongoing training opportunities and access to cutting-edge technologies, allowing you to expand your skill set and expertise.Impactful Projects: Contribute to groundbreaking research initiatives that have real-world applications, shaping the future of textiles and human-centered design.
If you're ready to make a meaningful impact in a dynamic and collaborative environment, we want to hear from you!","<p><strong>Join Our Engineering Team as a - Specializing in Anthropometry & Human Factors R&D Engineer</strong></p><p>Are you passionate about cutting-edge research at the intersection of human factors and textile innovation? We're seeking a dynamic individual to join our team in a pivotal role as a Process Engineer, focusing on Anthropometry & Human Factors for VR/AR technologies.</p><p>
</p><p><strong>Why You'll Love This Role:</strong></p><ul><li>Impactful Work: As a Process Engineer, you'll play a crucial role in advancing our understanding of textiles through anthropometric data collection and in-person user testing.</li><li>End-to-End Ownership: You'll have the exciting opportunity to take ownership of the entire workflow process, from data collection to analysis, and communicate your findings to our diverse cross-functional teams.</li><li>Cutting-Edge Technology: Work with state-of-the-art equipment, including Artec Scanning systems and 3DMD scanning, with training opportunities provided.</li></ul><p><strong>What We're Looking For:</strong></p><p>
</p><p><strong>Minimum Qualifications:</strong></p><ul><li>Advanced Degree or Equivalent: M.S. or Ph.D. in Mechanical Engineering, Materials Science, Polymer Science, Textile Engineering, or a related field, or equivalent work experience.</li><li>Technical Expertise: Demonstrated experience in 3D scanning data processing, mechanical characterization, and analyzing large datasets to derive meaningful insights.</li></ul><li>
</li><p><strong>Desired Qualifications:</strong></p><ul><li>Innovative Mindset: Experience with virtual fit simulation tools like Clo3D or Optitex, and a strong background in mechanical modeling of soft material systems.</li><li>Research Background: Previous involvement in research projects related to functionalized textiles and familiarity with 3D knitting or machine knitting are highly desirable.</li></ul><li>
</li><p><strong>Why Join Us:</strong></p><ul><li>Collaborative Environment: Work alongside a passionate team of experts dedicated to pushing the boundaries of textile innovation.</li><li>Continuous Learning: Benefit from ongoing training opportunities and access to cutting-edge technologies, allowing you to expand your skill set and expertise.</li><li>Impactful Projects: Contribute to groundbreaking research initiatives that have real-world applications, shaping the future of textiles and human-centered design.</li></ul><p>
</p><p><strong>If you're ready to make a meaningful impact in a dynamic and collaborative environment, we want to hear from you!</strong></p>","NOISEFIGURE RESEARCH · Greater Seattle Area (On-site)","https://www.linkedin.com/jobs/view/3907973211/","Greater Seattle Area","Skills: User Interface Design, Human Factors, +7 more","11-50 employees","LISTED","555292628","NOISEFIGURE RESEARCH","https://media.licdn.com/dms/image/C4D0BAQG_i4tvSS__CQ/company-logo_400_400/0/1631324480558?e=1722470400&v=beta&t=nbi_IB-u7oov0awmdVjabBE23GSGseQSxYAXEO6BNuc","2024-04-26T23:50:04.000Z","2024-04-30T00:07:46.481Z"
"Quantitative Team Manager","Job DescriptionPOSITION SUMMARY:Quantitative Team Manager works closely with members of the Psychometrics and Quantitative Research team (PQR) to support and lead a broad range of complex, high-stakes large-scale research activities related to Psychometric and quantitative research projects in language testing and applied linguistics projects. The Quantitative Team Manager supervisees the Quantitative analysts on the PQR team who work with researchers and Psychometricians in analyzing data and generating reports for WIDA ACCESS, a large scale, high stakes K-12 assessment of English language proficiency. ESSENTIAL DUTIESManage and lead project teams in the preparation of data for analysis and reporting, including acting as the liaison with the client on data delivery, preparing data file layouts, collecting, entering, scoring, transforming, receiving, validating, cleaning, merging, restructuring of data while taking appropriate steps to ensure quality.Supervise PQR analysts.Manage and maintain team calendar and internal project timelines for the PQR team.Organize and manage the weekly PQR meeting and CAL-WIDA Psychometric meeting.Serve as PQR data specialist. Duties include serving as primary data point of contact with clients, managing master datasets and/or databases ensuring master datasets are created, saved and stored appropriately, and identifying, drafting, and updating procedures for producing and analyzing datasets.Lead the technical work as relates to the WIDA ACCESS Annual Technical Reports. Duties include orienting team members to processes and procedures for producing tables, managing staff assignments, documenting ATR QC, and supporting senior PQR staff as the client liaison.With the support of the Senior Director of Psychometrics and Quantitative Research, draft and revise quantitative analysis procedures.Conduct data analysis using statistical software such as SPSS, R and Winsteps.QualificationsEDUCATION AND EXPERIENCERequiredMaster’s degree from an accredited college or university, in Educational or Psychological Research, Applied Linguistics, Language Assessment, Educational or Psychological Assessment, or a related field, with at least six (6) years of relevant experience as technical lead or/and team management.Experience with advanced data processing and statistical analyses, research methodologies, and high-stakes large-scale assessments.Minimum of five years of extensive experience in programming using statistical software such as SPSS, R, Winsteps, Stata, and SAS.Experience working with MS Excel, in a professional position or extended research project.Extensive experience working with large quantitative data sets.Extensive experience with following quality control procedures and documenting workflow.Experience with educational assessment, especially language assessment and/or online adaptive assessment.Demonstrated experience supervising junior level staff/data analysts.Demonstrated experience in managing project tasks and timelines.KNOWLEDGE, SKILLS & ABILITIESProficient in programming using SPSS, R and IRT software such as Winsteps.Expertise in using advanced features of MS Excel.Expertise with Microsoft Office software, desktop publishing, and MS Project.Ability to work independently as well as cooperatively in a fast-paced team environment.Excellent organization, planning, and time management skills.Excellent oral and interpersonal communication.Background and interest in assessment.
","<p><strong>Job Description</strong></p><p><strong>POSITION SUMMARY:</strong></p><p>Quantitative Team Manager works closely with members of the Psychometrics and Quantitative Research team (PQR) to support and lead a broad range of complex, high-stakes large-scale research activities related to Psychometric and quantitative research projects in language testing and applied linguistics projects.<i> </i>The Quantitative Team Manager supervisees the Quantitative analysts on the PQR team who work with researchers and Psychometricians in analyzing data and generating reports for WIDA ACCESS, a large scale, high stakes K-12 assessment of English language proficiency.</p><p> </p><p><strong>ESSENTIAL DUTIES</strong></p><ul><li>Manage and lead project teams in the preparation of data for analysis and reporting, including acting as the liaison with the client on data delivery, preparing data file layouts, collecting, entering, scoring, transforming, receiving, validating, cleaning, merging, restructuring of data while taking appropriate steps to ensure quality.</li><li>Supervise PQR analysts.</li><li>Manage and maintain team calendar and internal project timelines for the PQR team.</li><li>Organize and manage the weekly PQR meeting and CAL-WIDA Psychometric meeting.</li><li>Serve as PQR data specialist. Duties include serving as primary data point of contact with clients, managing master datasets and/or databases ensuring master datasets are created, saved and stored appropriately, and identifying, drafting, and updating procedures for producing and analyzing datasets.</li><li>Lead the technical work as relates to the WIDA ACCESS Annual Technical Reports. Duties include orienting team members to processes and procedures for producing tables, managing staff assignments, documenting ATR QC, and supporting senior PQR staff as the client liaison.</li><li>With the support of the Senior Director of Psychometrics and Quantitative Research, draft and revise quantitative analysis procedures.</li><li>Conduct data analysis using statistical software such as SPSS, R and Winsteps.</li></ul><strong>Qualifications</strong><p><strong>EDUCATION AND EXPERIENCE</strong></p><p><undefined>Required</undefined></p><ul><li>Master’s degree from an accredited college or university, in Educational or Psychological Research, Applied Linguistics, Language Assessment, Educational or Psychological Assessment, or a related field, with at least six (6) years of relevant experience as technical lead or/and team management.</li><li>Experience with advanced data processing and statistical analyses, research methodologies, and high-stakes large-scale assessments.</li><li>Minimum of five years of extensive experience in programming using statistical software such as SPSS, R, Winsteps, Stata, and SAS.</li><li>Experience working with MS Excel, in a professional position or extended research project.</li><li>Extensive experience working with large quantitative data sets.</li><li>Extensive experience with following quality control procedures and documenting workflow.</li><li>Experience with educational assessment, especially language assessment and/or online adaptive assessment.</li><li>Demonstrated experience supervising junior level staff/data analysts.</li><li>Demonstrated experience in managing project tasks and timelines.</li></ul><p><strong>KNOWLEDGE, SKILLS & ABILITIES</strong></p><ul><li>Proficient in programming using SPSS, R and IRT software such as Winsteps.</li><li>Expertise in using advanced features of MS Excel.</li><li>Expertise with Microsoft Office software, desktop publishing, and MS Project.</li><li>Ability to work independently as well as cooperatively in a fast-paced team environment.</li><li>Excellent organization, planning, and time management skills.</li><li>Excellent oral and interpersonal communication.</li><li>Background and interest in assessment.</li></ul><li>
</li>","Center for Applied Linguistics · Washington DC-Baltimore Area (Hybrid)","https://www.linkedin.com/jobs/view/3906703771/","Washington DC-Baltimore Area","Skills: Leadership, Onboarding, +6 more","11-50 employees
2 school alumni work here","LISTED","658009838","Center for Applied Linguistics","https://media.licdn.com/dms/image/C4E0BAQGTAARoFbz8Qg/company-logo_400_400/0/1630580549211/center_for_applied_linguistics_logo?e=1722470400&v=beta&t=BP0a1_dcqNPNsOCCKGxUQqGpNR9w9lQfwa4kpcyIgX4","2024-04-20T12:12:50.000Z","2024-04-30T00:07:46.481Z"
