"Title","Description","Description HTML","Primary Description","Detail URL","Location","Skill","Insight","Job State","Poster Id","Company Name","Company Logo","Created At","Scraped At"
"Consumer Insights Manager","Overview

AARP is the nation’s largest nonprofit, nonpartisan organization dedicated to empowering people 50 and older to choose how they live as they age. With a nationwide presence, AARP strengthens communities and advocates for what matters most to the more than 100 million Americans 50-plus and their families health security, financial stability and personal fulfillment. AARP also produces the nation’s largest circulation publications AARP The Magazine and AARP Bulletin.

AARP’s Policy, Research and International Affairs leads the development and communication of AARP’s public policies and, research and insights on the issues that matter to people 50-plus.

The Consumer Insights Manager is responsible for conceptualizing, developing, and conducting primary and secondary research to generate valuable insights that shape departmental objectives. They evaluate programs and business priorities to identify areas for improvement and measure outcomes. Working closely with management, they identify opportunities to streamline consumer insights processes and develop new procedures that align with the needs of the business unit/department. Additionally, the Consumer Insights Manager takes the lead and collaborates on developing a research agenda to address critical questions and provide key data that supports the Association's priorities. This role specifically focuses on supporting AARP's Fun & Fulfillment strategy which includes events, entertainment, and social connection.

Responsibilities

Advises clients, stakeholders, and senior management on all phases of research, including conceptualization, recommendations for research methodology, and recommendations for action from research findings. Manages complex and conflicting relationships among multiple stakeholders. Represents Association’s research to external audiences including the media, legislators, and other organizations in venues including press conferences and professional meetings.Manages and collaborates on a major research portfolio with broad Association impact and synthesizes the complex array of data into clear, actionable insights. Develops and manages the overall research plan for the portfolio of work including specific project work plans, project budgets, requests for proposals, vendor selection and management of vendor work. Oversees the work of staff assigned to projects within the portfolio and provides direction, feedback, and contributions to staff performance reviews.Conceptualizes and designs complex research projects, including with high-risk or innovative methodologies and highly constrained timelines and resources. Selects the most appropriate data sources and collection methods to maximize the value and utility of the research across the organization, with the goal of building and aggregating a base of knowledge around key issues. Oversees vendors or supervises other staff who implement the data collection plan.Determines strategies for data analyses. Conducts and/or supervises data analyses including bivariate analysis, multivariate analysis, and other complex statistical techniques as required. Advises other research staff on statistical and data analytic issues.Communicates research findings, often from complex studies or from a program of research, by integrating related research and identifying implications of the research for action by decision-makers. Determines methods to communicate research results and works closely with others to develop clear, impactful deliverables for stakeholders including data visualization and graphics. Responds effectively to complex and challenging requests for clarification and elaboration of research results.Serves as an expert resource and is often responsible for work with high visibility and critical outcomes. Plays a role in managing knowledge resources by actively sharing knowledge, collaborating with others, synthesizing research to provide integration and context, and ensuring the maintenance of up-to-date research records that are accessible by others. Stays abreast of key news, policies, and consumer trends related to assigned core issue areas and research portfolio and applies that knowledge to proactively frame future research.Develops capacity by coaching and mentoring junior staff, participating in efforts to redesign workflow and systems, and providing peer review and technical assistance to other researchers.

Qualifications

Bachelor's degree in Social Science or Marketing. Additionally, a minimum of 5 years of experience in applied research.A solid understanding of social science or marketing theories and principles.Proficiency in conducting both primary and secondary research to gather relevant data and insights.Ability to analyze research findings and develop actionable recommendations that inform policies, programs, strategies, or product development.Excellent consultation and communication skills to effectively convey research findings and recommendations to stakeholders.

Preferred

Master's degree in a social science, Marketing, or a Master's in Business Administration (MBA).Strong background in both quantitative and qualitative research methods and data analysis.Strategic consultation and insight generation skills.

AARP will not sponsor an employment visa for this position at this time.

Additional Requirements

Regular and reliable job attendanceEffective verbal and written communication skillsExhibit respect and understanding of others to maintain professional relationshipsIndependent judgement in evaluation options to make sound decisionsIn office/open office environment with the ability to work effectively surrounded by moderate noise

Flexible Work Arrangement (FWA)

AARP observes Mondays and Fridays as telecommuting workdays, except for essential functions. Remote work and telecommuting can only be done within the United States and its territories.

Compensation And Benefits

AARP offers a competitive compensation and benefits package including a 401(k); 100% company-funded pension plan; health, dental, and vision plans; life insurance; paid time off to include company and individual holidays, vacation, sick, caregiving, and parental leave; performance-based and peer-based recognition and tuition reimbursement. 

Equal Employment Opportunity

AARP is an equal opportunity employer committed to hiring a diverse workforce and sustaining an inclusive culture. AARP does not discriminate on the basis of race, ethnicity, religion, sex, color, national origin, age, sexual orientation, gender identity or expression, mental or physical disability, genetic information, veteran status, or on any other basis prohibited by applicable law.","<strong>Overview

</strong>AARP is the nation’s largest nonprofit, nonpartisan organization dedicated to empowering people 50 and older to choose how they live as they age. With a nationwide presence, AARP strengthens communities and advocates for what matters most to the more than 100 million Americans 50-plus and their families health security, financial stability and personal fulfillment. AARP also produces the nation’s largest circulation publications AARP The Magazine and AARP Bulletin.

AARP’s Policy, Research and International Affairs leads the development and communication of AARP’s public policies and, research and insights on the issues that matter to people 50-plus.

The <strong>Consumer Insights Manager</strong> is responsible for conceptualizing, developing, and conducting primary and secondary research to generate valuable insights that shape departmental objectives. They evaluate programs and business priorities to identify areas for improvement and measure outcomes. Working closely with management, they identify opportunities to streamline consumer insights processes and develop new procedures that align with the needs of the business unit/department. Additionally, the Consumer Insights Manager takes the lead and collaborates on developing a research agenda to address critical questions and provide key data that supports the Association's priorities. This role specifically focuses on supporting AARP's Fun & Fulfillment strategy which includes events, entertainment, and social connection.

<strong>Responsibilities

</strong><ul><li>Advises clients, stakeholders, and senior management on all phases of research, including conceptualization, recommendations for research methodology, and recommendations for action from research findings. Manages complex and conflicting relationships among multiple stakeholders. Represents Association’s research to external audiences including the media, legislators, and other organizations in venues including press conferences and professional meetings.</li><li>Manages and collaborates on a major research portfolio with broad Association impact and synthesizes the complex array of data into clear, actionable insights. Develops and manages the overall research plan for the portfolio of work including specific project work plans, project budgets, requests for proposals, vendor selection and management of vendor work. Oversees the work of staff assigned to projects within the portfolio and provides direction, feedback, and contributions to staff performance reviews.</li><li>Conceptualizes and designs complex research projects, including with high-risk or innovative methodologies and highly constrained timelines and resources. Selects the most appropriate data sources and collection methods to maximize the value and utility of the research across the organization, with the goal of building and aggregating a base of knowledge around key issues. Oversees vendors or supervises other staff who implement the data collection plan.</li><li>Determines strategies for data analyses. Conducts and/or supervises data analyses including bivariate analysis, multivariate analysis, and other complex statistical techniques as required. Advises other research staff on statistical and data analytic issues.</li><li>Communicates research findings, often from complex studies or from a program of research, by integrating related research and identifying implications of the research for action by decision-makers. Determines methods to communicate research results and works closely with others to develop clear, impactful deliverables for stakeholders including data visualization and graphics. Responds effectively to complex and challenging requests for clarification and elaboration of research results.</li><li>Serves as an expert resource and is often responsible for work with high visibility and critical outcomes. Plays a role in managing knowledge resources by actively sharing knowledge, collaborating with others, synthesizing research to provide integration and context, and ensuring the maintenance of up-to-date research records that are accessible by others. Stays abreast of key news, policies, and consumer trends related to assigned core issue areas and research portfolio and applies that knowledge to proactively frame future research.</li><li>Develops capacity by coaching and mentoring junior staff, participating in efforts to redesign workflow and systems, and providing peer review and technical assistance to other researchers.

</li></ul><strong>Qualifications

</strong><ul><li>Bachelor's degree in Social Science or Marketing. Additionally, a minimum of 5 years of experience in applied research.</li><li>A solid understanding of social science or marketing theories and principles.</li><li>Proficiency in conducting both primary and secondary research to gather relevant data and insights.</li><li>Ability to analyze research findings and develop actionable recommendations that inform policies, programs, strategies, or product development.</li><li>Excellent consultation and communication skills to effectively convey research findings and recommendations to stakeholders.

</li></ul><strong>Preferred

</strong><ul><li>Master's degree in a social science, Marketing, or a Master's in Business Administration (MBA).</li><li>Strong background in both quantitative and qualitative research methods and data analysis.</li><li>Strategic consultation and insight generation skills.

</li></ul>AARP will not sponsor an employment visa for this position at this time.

<strong>Additional Requirements

</strong><ul><li>Regular and reliable job attendance</li><li>Effective verbal and written communication skills</li><li>Exhibit respect and understanding of others to maintain professional relationships</li><li>Independent judgement in evaluation options to make sound decisions</li><li>In office/open office environment with the ability to work effectively surrounded by moderate noise

</li></ul><strong>Flexible Work Arrangement (FWA)

</strong>AARP observes Mondays and Fridays as telecommuting workdays, except for essential functions. Remote work and telecommuting can only be done within the United States and its territories.

<strong>Compensation And Benefits

</strong>AARP offers a competitive compensation and benefits package including a 401(k); 100% company-funded pension plan; health, dental, and vision plans; life insurance; paid time off to include company and individual holidays, vacation, sick, caregiving, and parental leave; performance-based and peer-based recognition and tuition reimbursement. 

<strong>Equal Employment Opportunity

</strong>AARP is an equal opportunity employer committed to hiring a diverse workforce and sustaining an inclusive culture. AARP does not discriminate on the basis of race, ethnicity, religion, sex, color, national origin, age, sexual orientation, gender identity or expression, mental or physical disability, genetic information, veteran status, or on any other basis prohibited by applicable law.","AARP · Washington, DC (On-site)","https://www.linkedin.com/jobs/view/3904719610/","Washington, District of Columbia, United States","Skills: Social Sciences, Data Analytics, +8 more","1,001-5,000 employees · Non-profit Organizations
19 school alumni work here","LISTED","102049914","AARP","https://media.licdn.com/dms/image/C4D0BAQGrLdVnDetK2w/company-logo_400_400/0/1630512518306/aarp_logo?e=1721865600&v=beta&t=tfTk_GOMhqA7GVd-N8jYbsqMQIo-FRVSQafn4IfZ0kA","2024-04-19T22:13:48.000Z","2024-04-21T14:02:58.978Z"
"Senior User Researcher","Build the future of data. Join the Snowflake team.

A key driver behind Snowflake’s innovation is the commitment to putting customers first, and we’re seeking an experienced user researcher who is looking to lead research efforts with the potential for outsized impact on our most strategic pillars. This role is for you if you are looking to solve complex, ambiguous problems, and are looking to own a research program that deeply integrates into the team’s approach from vision to launch. You’d orchestrate cross-functional alignment around user needs, guide prioritization of high-value features, and play a key role in landing holistic experiences that our customers love. You’d be embedded as a key member of the cross-functional leads group, yet also be a part of a world-class team of tight-knit researchers with a culture of collaboration and knowledge sharing, where we continuously support and learn from each other in a safe and friendly environment.

RESPONSIBILITIES:

Collaborate closely with product, design, engineering, and data science teams to shape product roadmapping and visionBalance the strategic and tactical; ensuring the team is solving the most critical user needs while delivering holistic solutions that are intuitive and easy to useLead research planning and execution, effectively building alignment with cross-functional peers and stakeholders throughout the research processClearly communicate insights and learnings, tying directly to actionable next steps and impact on product direction


REQUIREMENTS:

5+ years of leading high-impact user research effortsExperience leveraging a broad range of research methodologies across the various stages of product developmentAbility to thrive in ambiguity, with a proven track record of setting and executing research roadmaps leading to meaningful product directionAbility to collaborate closely with cross-functional partners, driving alignment around user needs and incorporating peers into the research processThis is a hybrid position based in San Mateo, CA. 


Every Snowflake employee is expected to follow the company’s confidentiality and security standards for handling sensitive data. Snowflake employees must abide by the company’s data security plan as an essential part of their duties. It is every employee's duty to keep customer information secure and confidential.

The following represents the expected range of compensation for this role:

 The estimated base salary range for this role is $160,000 - $235,700.Additionally, this role is eligible to participate in Snowflake’s bonus and equity plan.


The successful candidate’s starting salary will be determined based on permissible, non-discriminatory factors such as skills, experience, and geographic location. This role is also eligible for a competitive benefits package that includes: medical, dental, vision, life, and disability insurance; 401(k) retirement plan; flexible spending & health savings account; at least 12 paid holidays; paid time off; parental leave; employee assistance program; and other company benefits.

Snowflake is growing fast, and we’re scaling our team to help enable and accelerate our growth. We are looking for people who share our values, challenge ordinary thinking, and push the pace of innovation while building a future for themselves and Snowflake.

How do you want to make your impact?","Build the future of data. Join the Snowflake team.

A key driver behind Snowflake’s innovation is the commitment to putting customers first, and we’re seeking an experienced user researcher who is looking to lead research efforts with the potential for outsized impact on our most strategic pillars. This role is for you if you are looking to solve complex, ambiguous problems, and are looking to own a research program that deeply integrates into the team’s approach from vision to launch. You’d orchestrate cross-functional alignment around user needs, guide prioritization of high-value features, and play a key role in landing holistic experiences that our customers love. You’d be embedded as a key member of the cross-functional leads group, yet also be a part of a world-class team of tight-knit researchers with a culture of collaboration and knowledge sharing, where we continuously support and learn from each other in a safe and friendly environment.

RESPONSIBILITIES:

<ul><li>Collaborate closely with product, design, engineering, and data science teams to shape product roadmapping and vision</li><li>Balance the strategic and tactical; ensuring the team is solving the most critical user needs while delivering holistic solutions that are intuitive and easy to use</li><li>Lead research planning and execution, effectively building alignment with cross-functional peers and stakeholders throughout the research process</li><li>Clearly communicate insights and learnings, tying directly to actionable next steps and impact on product direction


</li></ul>REQUIREMENTS:

<ul><li>5+ years of leading high-impact user research efforts</li><li>Experience leveraging a broad range of research methodologies across the various stages of product development</li><li>Ability to thrive in ambiguity, with a proven track record of setting and executing research roadmaps leading to meaningful product direction</li><li>Ability to collaborate closely with cross-functional partners, driving alignment around user needs and incorporating peers into the research process</li><li>This is a hybrid position based in San Mateo, CA. 


</li></ul><i>Every Snowflake employee is expected to follow the company’s confidentiality and security standards for handling sensitive data. Snowflake employees must abide by the company’s data security plan as an essential part of their duties. It is every employee's duty to keep customer information secure and confidential.

</i>The following represents the expected range of compensation for this role:

<ul><li> The estimated base salary range for this role is $160,000 - $235,700.</li><li>Additionally, this role is eligible to participate in Snowflake’s bonus and equity plan.


</li></ul>The successful candidate’s starting salary will be determined based on permissible, non-discriminatory factors such as skills, experience, and geographic location. This role is also eligible for a competitive benefits package that includes: medical, dental, vision, life, and disability insurance; 401(k) retirement plan; flexible spending & health savings account; at least 12 paid holidays; paid time off; parental leave; employee assistance program; and other company benefits.

Snowflake is growing fast, and we’re scaling our team to help enable and accelerate our growth. We are looking for people who share our values, challenge ordinary thinking, and push the pace of innovation while building a future for themselves and Snowflake.

How do you want to make your impact?","Snowflake · San Mateo, CA","https://www.linkedin.com/jobs/view/3904347503/","San Mateo, California, United States","Skills: Snowflake Cloud, Snowflake, +8 more","5,001-10,000 employees · Software Development
1 connection works here · 33 school alumni work here","LISTED","26137770","Snowflake","https://media.licdn.com/dms/image/D560BAQF3mYS3WqCB3g/company-logo_400_400/0/1688575708630/snowflake_computing_logo?e=1721865600&v=beta&t=Ihcq6qMio2mUMLuQ_0z1GKS88nhhV8fy_vkZUAnPM5g","2024-04-17T20:06:18.000Z","2024-04-21T14:02:58.978Z"
