"Title","Description","Description HTML","Primary Description","Detail URL","Location","Skill","Insight","Job State","Poster Id","Company Name","Company Logo","Created At","Scraped At"
"Director/Manager, Generative AI","Hiring for Director/Manager, Generative AIWe’re seeking an execution focused leader to lead applied initiatives for the Applied AI org. This person will be aseasoned machine learning practitioner and guide research in one or more of the areas of NLP, Speech, LLMs, andGenerative AI. They will drive cutting edge, product-oriented research in a hands-on manner. This leader will also direct theplanning and execution of initiatives for the team, as we set out to create large language models with multilingualcapabilities.In your role, you will:● Lead teams of applied scientists to deliver on applied research initiatives● Bring ideas from academia/industry research to production grade delivery● Create the best practices for operational adoption of emerging AI/ML technology● Communicate complex technological concepts in a clear and effective manner to senior leadership● Hire and develop teams of applied science researchers in the areas of speech, language models, and computervision● Drive core ML, infrastructure KPIs and metrics such as availability and latency SLAs● Drive large-scale distributed deployment of models across GPU nodes running in Kubernetes clusters acrossregionsBasic qualifications:● MS in Computer Science or related field and 10+ years of work experience in the field.● 5+ years of experience managing applied science and engineering teams● Publications in leading academic/industry journals● Knowledge of deep learning and transformer architectures for speech, NLP, and computer vision● Experience in building complex systems involving AI, ML, with successful delivery to customers.● Proficiency in one or more of Python, Java, or C/C++Preferred qualifications:● Ph.D. in Computer Science in the areas of LLMs, NLP, CV, Reinforcement Learning, and Generative models● Prior experience with large-scale distributed training and fine-tuning of foundation models such as GPT-3, LLaMA,AlphaFold, and DALL-E● Experience with language modeling evaluation, prompt tuning and engineering, instruction tuning, and/or RLHF● 3+ years of experience managing other managers and team leads● Expertise in large language models, speech, and computer vision or the demonstrated ability to develop thisquickly● Strong track record of research contributions in NLP, generative modeling, LLMs demonstrated throughpublications and products● Strong programming skills and proficiency in Python, TensorFlow/PyTorch, and other ML frameworks and tools● Experience in Information Extraction, Question Answering, Conversational Agents (Chatbots), Data Visualizationand/or text-to-image models● Excellent written and verbal technical communication with an ability to present complex technical information in aclear and concise manner to a variety of audience","<p>Hiring for Director/Manager, Generative AI</p><p>We’re seeking an execution focused leader to lead applied initiatives for the Applied AI org. This person will be a</p><p>seasoned machine learning practitioner and guide research in one or more of the areas of NLP, Speech, LLMs, and</p><p>Generative AI. They will drive cutting edge, product-oriented research in a hands-on manner. This leader will also direct the</p><p>planning and execution of initiatives for the team, as we set out to create large language models with multilingual</p><p>capabilities.</p><p>In your role, you will:</p><p>● Lead teams of applied scientists to deliver on applied research initiatives</p><p>● Bring ideas from academia/industry research to production grade delivery</p><p>● Create the best practices for operational adoption of emerging AI/ML technology</p><p>● Communicate complex technological concepts in a clear and effective manner to senior leadership</p><p>● Hire and develop teams of applied science researchers in the areas of speech, language models, and computer</p><p>vision</p><p>● Drive core ML, infrastructure KPIs and metrics such as availability and latency SLAs</p><p>● Drive large-scale distributed deployment of models across GPU nodes running in Kubernetes clusters across</p><p>regions</p><p>Basic qualifications:</p><p>● MS in Computer Science or related field and 10+ years of work experience in the field.</p><p>● 5+ years of experience managing applied science and engineering teams</p><p>● Publications in leading academic/industry journals</p><p>● Knowledge of deep learning and transformer architectures for speech, NLP, and computer vision</p><p>● Experience in building complex systems involving AI, ML, with successful delivery to customers.</p><p>● Proficiency in one or more of Python, Java, or C/C++</p><p>Preferred qualifications:</p><p>● Ph.D. in Computer Science in the areas of LLMs, NLP, CV, Reinforcement Learning, and Generative models</p><p>● Prior experience with large-scale distributed training and fine-tuning of foundation models such as GPT-3, LLaMA,</p><p>AlphaFold, and DALL-E</p><p>● Experience with language modeling evaluation, prompt tuning and engineering, instruction tuning, and/or RLHF</p><p>● 3+ years of experience managing other managers and team leads</p><p>● Expertise in large language models, speech, and computer vision or the demonstrated ability to develop this</p><p>quickly</p><p>● Strong track record of research contributions in NLP, generative modeling, LLMs demonstrated through</p><p>publications and products</p><p>● Strong programming skills and proficiency in Python, TensorFlow/PyTorch, and other ML frameworks and tools</p><p>● Experience in Information Extraction, Question Answering, Conversational Agents (Chatbots), Data Visualization</p><p>and/or text-to-image models</p><p>● Excellent written and verbal technical communication with an ability to present complex technical information in a</p><p>clear and concise manner to a variety of audience</p>","Tykhe Inc","https://www.linkedin.com/jobs/view/3825525329/","Palo Alto, California, United States","Skills: Natural Language Processing (NLP), Python (Programming Language), +4 more","1-10 employees · Staffing and Recruiting","LISTED","934162627","Tykhe Inc","https://media.licdn.com/dms/image/C560BAQG2CW2RtI9sQA/company-logo_400_400/0/1633892645711?e=1716422400&v=beta&t=kCodx1m8HKtr81gCrSlYbQEDCXz5PuTPwjF8S0s22VM","2024-02-12T19:03:13.000Z","2024-02-22T22:37:26.156Z"
"Human Factors Engineer","The “Apple of MedTech” revels in solving complex problems in healthcare with ground-breaking, well-designed solutions that save lives. Our clients range from the biggest names in healthcare, such as GE Healthcare and ThermoFischer Scientific, to innovative startups revolutionizing medicine. We are an employee-owned medical device product development firm that has led the industry for 25+ years and we are searching for our Human Factors Lead to join our Industrial Design team to support our growth and expansion. This position will serve as the Human Factors expert, while contributing to the ongoing Industrial Design or UX/UI Design work of Key Tech’s team.
ResponsibilitiesBecome the lead for Human Factors activities, including conducting VOC and user research, defining user needs and requirements, and performing usability studiesInform the product development process through human factors study, user research, contextual inquiry, ethnographic research.Enhance our Usability Engineering expertise by designing and running usability testing protocols.Manage projects, serving as main client point of contact, for programs that have a focus on Human Factors activitiesBecome the human factors expert within the firm, the go-to resource for the subject, and the person to expand our ability to support full scope development of medical devices.Collaborate with the Business Development team to generate new marketing material and interface with potential clients to promote our HF capabilitiesLead our portfolio growth into HF programs by helping to identify opportunities for our design processes to benefit clientsAudit and grow our existing HF processes, and identify other opportunities to expand related capabilities
Skills & ExperienceExcited about tackling complex usability challenges involving hardware, UI, and ecosystemsPassion for improving the usability of products and advocating for the end userDesire to conduct user research and usability testingStrong product design skills, including concept sketching and form development.Excellent communication skillsExperience with designing medical products (preferred)SolidWorks experience (preferred)Degree in Industrial Design, Product Design, UX/UI, or other design-related discipline","<p>The “Apple of MedTech” revels in solving complex problems in healthcare with ground-breaking, well-designed solutions that save lives. Our clients range from the biggest names in healthcare, such as GE Healthcare and ThermoFischer Scientific, to innovative startups revolutionizing medicine. We are an employee-owned medical device product development firm that has led the industry for 25+ years and we are searching for our Human Factors Lead to join our Industrial Design team to support our growth and expansion. This position will serve as the Human Factors expert, while contributing to the ongoing Industrial Design or UX/UI Design work of Key Tech’s team.</p><p>
</p><p><strong>Responsibilities</strong></p><ul><li>Become the lead for Human Factors activities, including conducting VOC and user research, defining user needs and requirements, and performing usability studies</li><li>Inform the product development process through human factors study, user research, contextual inquiry, ethnographic research.</li><li>Enhance our Usability Engineering expertise by designing and running usability testing protocols.</li><li>Manage projects, serving as main client point of contact, for programs that have a focus on Human Factors activities</li><li>Become the human factors expert within the firm, the go-to resource for the subject, and the person to expand our ability to support full scope development of medical devices.</li><li>Collaborate with the Business Development team to generate new marketing material and interface with potential clients to promote our HF capabilities</li><li>Lead our portfolio growth into HF programs by helping to identify opportunities for our design processes to benefit clients</li><li>Audit and grow our existing HF processes, and identify other opportunities to expand related capabilities</li></ul><p>
</p><p><strong>Skills & Experience</strong></p><ul><li>Excited about tackling complex usability challenges involving hardware, UI, and ecosystems</li><li>Passion for improving the usability of products and advocating for the end user</li><li>Desire to conduct user research and usability testing</li><li>Strong product design skills, including concept sketching and form development.</li><li>Excellent communication skills</li><li>Experience with designing medical products (preferred)</li><li>SolidWorks experience (preferred)</li><li>Degree in Industrial Design, Product Design, UX/UI, or other design-related discipline</li></ul>","MedTech Startup","https://www.linkedin.com/jobs/view/3834482736/","Baltimore, Maryland, United States","Skills: User Interface Design, Usability Engineering, +8 more","1-10 employees · Medical Device","LISTED","825068935","MedTech Startup","https://media.licdn.com/dms/image/D4E0BAQFrHi25mUFONQ/company-logo_400_400/0/1705024752537/medtech_startup_logo?e=1716422400&v=beta&t=eFP2aPet6mZYSSk31QCmg2UFZZevpJr1MZt0tu1oTFM","2024-02-19T18:04:07.000Z","2024-02-22T22:37:26.156Z"
"Principal People Scientist, People Strategy & Analytics","West Creek 2 (12072), United States of America, Richmond, VirginiaPrincipal People Scientist, People Strategy & Analytics

The People Strategy and Analytics team at Capital One is on a mission to transform the associate experience – from hiring to onboarding to career development – so that all talent can flourish. As a Principal People Scientist on the People Strategy & Analytics team, you will use organizational science, measurement techniques, behavioral insights, and advanced analytics to help drive that transformation.

Our ideal candidate will display a strong balance of analytical and problem solving skills, business consulting, and communication competencies, as well as the ability to work in a dynamic team environment. You’ll be on a cross-functional team that includes analysts, data scientists, and other people scientists.

This role will primarily specialize in enterprise surveying & measurement design, but will also have frequent opportunities to collaborate with key HR partners in areas like Talent & Performance Management, People Leadership and Diversity, Inclusion, & Belonging. Projects will focus on improving the associate experience and unlocking best practices in the talent strategy space. A typical day will include client consultation, measurement design, program design, insights generation, and analysis.

 Your main responsibilities include, but are not limited to: 

Consultation: Bring your expertise in organizational science principles and analysis to help our clients frame problems, answer questions, and design solutions to improve the associate experience Design : Build and drive key programs and solutions for our partners, including strategies for measurement and validation Experimentation : Partner with clients and teams across Capital One to design experiments to understand key drivers of associates and behavior Insights & analysis : Analyze the impact of our programs and combine those insights with the latest thinking in organizational science to help our clients make data-driven, informed decisions 

 Successful team members demonstrate competencies in these areas: 

Purpose : You feel a deep personal connection to improving the associate experience and are motivated by applying organizational science in a mission-driven way Analytical thinking : A proven track record of decision making and problem solving based in analytics. Conceptual thinking skills must be complemented by a strong quantitative orientation. Identify opportunities for improvement and use data to make strategic and tactical recommendations. Execution : Develop and test hypotheses, design solutions, assess operational feasibility, support implementation efforts, and develop plans and tools for monitoring outcomes Partnership : Collaborate effectively with other team members and HR clients Business communication : Strong written and oral communication skills, including visualization skills (i.e., able to “tell the story” and highlight key insights in a clear and concise manner that is easily understood by stakeholders) Results focus : Drives for results and achieves important goals; applies strong organizational skills and detail orientation, even amidst ambiguity 

 Basic Qualifications: 

 Master's degree  At least 1 year of professional work experience in Industrial and Organizational Psychology OR Organizational Behavior OR Behavioral Science  At least 1 year of experience building statistical models in R OR Python programming language 

 Preferred Qualifications: 

 PhD in Industrial and Organizational Psychology or Organizational Behavior  2+ years professional work experience in Industrial and Organizational Psychology or Organizational Behavior  Knowledge of advanced statistical methodologies advanced statistical methodologies, including regression, or longitudinal analysis, or Bayesian modeling 

At this time, Capital One will not sponsor a new applicant for employment authorization for this position.

Capital One offers a comprehensive, competitive, and inclusive set of health, financial and other benefits that support your total well-being. Learn more at the Capital One Careers website . Eligibility varies based on full or part-time status, exempt or non-exempt status, and management level.

This role is expected to accept applications for a minimum of 5 business days.No agencies please. Capital One is an equal opportunity employer committed to diversity and inclusion in the workplace. All qualified applicants will receive consideration for employment without regard to sex (including pregnancy, childbirth or related medical conditions), race, color, age, national origin, religion, disability, genetic information, marital status, sexual orientation, gender identity, gender reassignment, citizenship, immigration status, protected veteran status, or any other basis prohibited under applicable federal, state or local law. Capital One promotes a drug-free workplace. Capital One will consider for employment qualified applicants with a criminal history in a manner consistent with the requirements of applicable laws regarding criminal background inquiries, including, to the extent applicable, Article 23-A of the New York Correction Law; San Francisco, California Police Code Article 49, Sections 4901-4920; New York City’s Fair Chance Act; Philadelphia’s Fair Criminal Records Screening Act; and other applicable federal, state, and local laws and regulations regarding criminal background inquiries.

If you have visited our website in search of information on employment opportunities or to apply for a position, and you require an accommodation, please contact Capital One Recruiting at 1-800-304-9102 or via email at RecruitingAccommodation@capitalone.com . All information you provide will be kept confidential and will be used only to the extent required to provide needed reasonable accommodations.

For technical support or questions about Capital One's recruiting process, please send an email to Careers@capitalone.com

Capital One does not provide, endorse nor guarantee and is not liable for third-party products, services, educational tools or other information available through this site.

Capital One Financial is made up of several different entities. Please note that any position posted in Canada is for Capital One Canada, any position posted in the United Kingdom is for Capital One Europe and any position posted in the Philippines is for Capital One Philippines Service Corp. (COPSSC).","West Creek 2 (12072), United States of America, Richmond, VirginiaPrincipal People Scientist, People Strategy & Analytics

The People Strategy and Analytics team at Capital One is on a mission to transform the associate experience – from hiring to onboarding to career development – so that all talent can flourish. As a Principal People Scientist on the People Strategy & Analytics team, you will use organizational science, measurement techniques, behavioral insights, and advanced analytics to help drive that transformation.

Our ideal candidate will display a strong balance of analytical and problem solving skills, business consulting, and communication competencies, as well as the ability to work in a dynamic team environment. You’ll be on a cross-functional team that includes analysts, data scientists, and other people scientists.

This role will primarily specialize in enterprise surveying & measurement design, but will also have frequent opportunities to collaborate with key HR partners in areas like Talent & Performance Management, People Leadership and Diversity, Inclusion, & Belonging. Projects will focus on improving the associate experience and unlocking best practices in the talent strategy space. A typical day will include client consultation, measurement design, program design, insights generation, and analysis.

<strong> Your main responsibilities include, but are not limited to: 

</strong><ul><li>Consultation: Bring your expertise in organizational science principles and analysis to help our clients frame problems, answer questions, and design solutions to improve the associate experience </li><li>Design : Build and drive key programs and solutions for our partners, including strategies for measurement and validation </li><li>Experimentation : Partner with clients and teams across Capital One to design experiments to understand key drivers of associates and behavior </li><li>Insights & analysis : Analyze the impact of our programs and combine those insights with the latest thinking in organizational science to help our clients make data-driven, informed decisions 

</li></ul><strong> Successful team members demonstrate competencies in these areas: 

</strong><ul><li>Purpose : You feel a deep personal connection to improving the associate experience and are motivated by applying organizational science in a mission-driven way </li><li>Analytical thinking : A proven track record of decision making and problem solving based in analytics. Conceptual thinking skills must be complemented by a strong quantitative orientation. Identify opportunities for improvement and use data to make strategic and tactical recommendations. </li><li>Execution : Develop and test hypotheses, design solutions, assess operational feasibility, support implementation efforts, and develop plans and tools for monitoring outcomes </li><li>Partnership : Collaborate effectively with other team members and HR clients </li><li>Business communication : Strong written and oral communication skills, including visualization skills (i.e., able to “tell the story” and highlight key insights in a clear and concise manner that is easily understood by stakeholders) </li><li>Results focus : Drives for results and achieves important goals; applies strong organizational skills and detail orientation, even amidst ambiguity 

</li></ul><strong> Basic Qualifications: 

</strong><ul><li> Master's degree </li><li> At least 1 year of professional work experience in Industrial and Organizational Psychology OR Organizational Behavior OR Behavioral Science </li><li> At least 1 year of experience building statistical models in R OR Python programming language 

</li></ul><strong> Preferred Qualifications: 

</strong><ul><li> PhD in Industrial and Organizational Psychology or Organizational Behavior </li><li> 2+ years professional work experience in Industrial and Organizational Psychology or Organizational Behavior </li><li> Knowledge of advanced statistical methodologies advanced statistical methodologies, including regression, or longitudinal analysis, or Bayesian modeling 

</li></ul><i>At this time, Capital One will not sponsor a new applicant for employment authorization for this position.

</i>Capital One offers a comprehensive, competitive, and inclusive set of health, financial and other benefits that support your total well-being. Learn more at the Capital One Careers website . Eligibility varies based on full or part-time status, exempt or non-exempt status, and management level.

This role is expected to accept applications for a minimum of 5 business days.No agencies please. Capital One is an equal opportunity employer committed to diversity and inclusion in the workplace. All qualified applicants will receive consideration for employment without regard to sex (including pregnancy, childbirth or related medical conditions), race, color, age, national origin, religion, disability, genetic information, marital status, sexual orientation, gender identity, gender reassignment, citizenship, immigration status, protected veteran status, or any other basis prohibited under applicable federal, state or local law. Capital One promotes a drug-free workplace. Capital One will consider for employment qualified applicants with a criminal history in a manner consistent with the requirements of applicable laws regarding criminal background inquiries, including, to the extent applicable, Article 23-A of the New York Correction Law; San Francisco, California Police Code Article 49, Sections 4901-4920; New York City’s Fair Chance Act; Philadelphia’s Fair Criminal Records Screening Act; and other applicable federal, state, and local laws and regulations regarding criminal background inquiries.

If you have visited our website in search of information on employment opportunities or to apply for a position, and you require an accommodation, please contact Capital One Recruiting at 1-800-304-9102 or via email at RecruitingAccommodation@capitalone.com . All information you provide will be kept confidential and will be used only to the extent required to provide needed reasonable accommodations.

For technical support or questions about Capital One's recruiting process, please send an email to Careers@capitalone.com

Capital One does not provide, endorse nor guarantee and is not liable for third-party products, services, educational tools or other information available through this site.

Capital One Financial is made up of several different entities. Please note that any position posted in Canada is for Capital One Canada, any position posted in the United Kingdom is for Capital One Europe and any position posted in the Philippines is for Capital One Philippines Service Corp. (COPSSC).","Capital One","https://www.linkedin.com/jobs/view/3814443216/","McLean, Virginia, United States","Skills: Business Insights, Python (Programming Language), +8 more","10,001+ employees · Financial Services
75 school alumni work here","LISTED","355504302","Capital One","https://media.licdn.com/dms/image/C560BAQF0OgQyRZ9yAA/company-logo_400_400/0/1635782718446/capital_one_logo?e=1716422400&v=beta&t=8nAnd5uUdOosAu_cVMqwcYRT2XclZJodqwEPaH0xvPo","2024-01-26T19:14:09.000Z","2024-02-22T22:37:26.156Z"
