"Title","Description","Description HTML","Primary Description","Detail URL","Location","Skill","Insight","Job State","Poster Id","Company Name","Company Logo","Created At","Scraped At"
"Senior Data Analyst, External Games","Now is an amazing time to join Netflix as we seek to entertain the world. We have over 200 million paid members in over 190 countries, and we won’t stop there. Games are our next big frontier and an incredible opportunity for us to deliver new experiences to delight and entertain our quickly growing membership. You will be jumping in at the early stages of this adventure and be in a position to help us redefine what a Netflix subscription means for our members around the world.

Data Science and Engineering (‘DSE’) at Netflix is aimed at using data, analytics, and sciences to improve various aspects of our business. We are looking for a Senior Analytics Engineer to join our Games DSE team, leading end-to-end analytics & data needs for the Games space. This role will be partnering closely with our Game stakeholders to define key metrics, build and maintain key dashboards and analytic tools and scale data access across our stakeholder set. As an early member of the team, you will also help shape our overall Games Data Strategy at Netflix.


What You Will Do


Partner directly with our Game stakeholders (e.g., Netflix Games Studio, Games Product, Game Strategy, Planning & Analysis team) on data, metrics & analytics initiativesLead end-to-end development of reports/dashboards/tools used by your direct stakeholders and a diverse set of teams across the companyProactively perform data exploration and analytical deep dives to discover insights or future testing opportunitiesBe a bridge between the business and tech, scaling access to insights that can empower better decision-makingMaintain and rethink existing data solutions to service a wider variety of use cases Balance handling ad hoc requests while also driving larger projects forward



Who You Are


6+ years of experience in data analytics function in gaming industryExtensive experience in driving Live Service performance insightsYou are an engineering-minded analyst with a strong bias towards action, delivering results quickly with iteration instead of waiting for perfectionYou are comfortable taking vague requirements and crystallizing them into valuable tools, metrics, or analysis.You have strong technical skills in manipulating large data sets with complex SQL and Python (or similar languages), big data technologies (e.g., Hadoop, Spark) and visualization tools (e.g., Tableau)You are a self-starter that can work effectively in a fast-paced, ambiguous environment with changing priorities and minimally defined processesYou are experienced in managing stakeholder asks, expectations, and relationships across a variety of stakeholders


Our compensation structure consists solely of an annual salary; we do not have bonuses. You choose each year how much of your compensation you want in salary versus stock options. To determine your personal top of market compensation, we rely on market indicators and consider your specific job family, background, skills, and experience to determine your compensation in the market range. The range for this role is $170,000 - $720,000.

Netflix provides comprehensive benefits including Health Plans, Mental Health support, a 401(k) Retirement Plan with employer match, Stock Option Program, Disability Programs, Health Savings and Flexible Spending Accounts, Family-forming benefits, and Life and Serious Injury Benefits. We also offer paid leave of absence programs. Full-time hourly employees accrue 35 days annually for paid time off to be used for vacation, holidays, and sick paid time off. Full-time salaried employees are immediately entitled to flexible time off. See more detail about our Benefits here.

Netflix is a unique culture and environment. Learn more here.

We are an equal-opportunity employer and celebrate diversity, recognizing that diversity of thought and background builds stronger teams. We approach diversity and inclusion seriously and thoughtfully. We do not discriminate on the basis of race, religion, color, ancestry, national origin, caste, sex, sexual orientation, gender, gender identity or expression, age, disability, medical condition, pregnancy, genetic makeup, marital status, or military service.","Now is an amazing time to join Netflix as we seek to entertain the world. We have over 200 million paid members in over 190 countries, and we won’t stop there. Games are our next big frontier and an incredible opportunity for us to deliver new experiences to delight and entertain our quickly growing membership. You will be jumping in at the early stages of this adventure and be in a position to help us redefine what a Netflix subscription means for our members around the world.

Data Science and Engineering (‘DSE’) at Netflix is aimed at using data, analytics, and sciences to improve various aspects of our business. We are looking for a Senior Analytics Engineer to join our Games DSE team, leading end-to-end analytics & data needs for the Games space. This role will be partnering closely with our Game stakeholders to define key metrics, build and maintain key dashboards and analytic tools and scale data access across our stakeholder set. As an early member of the team, you will also help shape our overall Games Data Strategy at Netflix.


<strong>What You Will Do


</strong><ul><li>Partner directly with our Game stakeholders (e.g., Netflix Games Studio, Games Product, Game Strategy, Planning & Analysis team) on data, metrics & analytics initiatives</li><li>Lead end-to-end development of reports/dashboards/tools used by your direct stakeholders and a diverse set of teams across the company</li><li>Proactively perform data exploration and analytical deep dives to discover insights or future testing opportunities</li><li>Be a bridge between the business and tech, scaling access to insights that can empower better decision-making</li><li>Maintain and rethink existing data solutions to service a wider variety of use cases </li><li>Balance handling ad hoc requests while also driving larger projects forward



</li></ul><strong>Who You Are


</strong><ul><li>6+ years of experience in data analytics function in gaming industry</li><li>Extensive experience in driving Live Service performance insights</li><li>You are an engineering-minded analyst with a strong bias towards action, delivering results quickly with iteration instead of waiting for perfection</li><li>You are comfortable taking vague requirements and crystallizing them into valuable tools, metrics, or analysis.</li><li>You have strong technical skills in manipulating large data sets with complex SQL and Python (or similar languages), big data technologies (e.g., Hadoop, Spark) and visualization tools (e.g., Tableau)</li><li>You are a self-starter that can work effectively in a fast-paced, ambiguous environment with changing priorities and minimally defined processes</li><li>You are experienced in managing stakeholder asks, expectations, and relationships across a variety of stakeholders


</li></ul>Our compensation structure consists solely of an annual salary; we do not have bonuses. You choose each year how much of your compensation you want in salary versus stock options. To determine your personal top of market compensation, we rely on market indicators and consider your specific job family, background, skills, and experience to determine your compensation in the market range. The range for this role is $170,000 - $720,000.

Netflix provides comprehensive benefits including Health Plans, Mental Health support, a 401(k) Retirement Plan with employer match, Stock Option Program, Disability Programs, Health Savings and Flexible Spending Accounts, Family-forming benefits, and Life and Serious Injury Benefits. We also offer paid leave of absence programs. Full-time hourly employees accrue 35 days annually for paid time off to be used for vacation, holidays, and sick paid time off. Full-time salaried employees are immediately entitled to flexible time off. See more detail about our Benefits here.

Netflix is a unique culture and environment. Learn more here.

We are an equal-opportunity employer and celebrate diversity, recognizing that diversity of thought and background builds stronger teams. We approach diversity and inclusion seriously and thoughtfully. We do not discriminate on the basis of race, religion, color, ancestry, national origin, caste, sex, sexual orientation, gender, gender identity or expression, age, disability, medical condition, pregnancy, genetic makeup, marital status, or military service.","Netflix · Los Angeles, CA","https://www.linkedin.com/jobs/view/3818061255/","Los Angeles, California, United States","7 of 10 skills match your profile - you may be a good fit","10,001+ employees · Entertainment Providers
23 school alumni work here","LISTED","368130583","Netflix","https://media.licdn.com/dms/image/C4E0BAQEVb0ZISWk8vQ/company-logo_400_400/0/1631355051964?e=1722470400&v=beta&t=Nr9hwwd5ZP_uWNJjl22l3O5KQyD-xIgh5IN_TEiC5aI","2024-01-30T20:37:41.000Z","2024-04-30T00:08:16.455Z"
"Technical Operations & Insights Analyst, Product Support","Figma is growing our team of passionate people on a mission to make design accessible to all. Born on the Web, Figma helps entire product teams brainstorm, design and build better products — from start to finish. Whether it’s consolidating tools, simplifying workflows, or collaborating across teams and time zones, Figma makes the design process faster, more efficient, and fun while keeping everyone on the same page. From great products to long-lasting companies, we believe that nothing great is made alone—come make with us!

As a member of our Product Support Operations and Strategy team, the Operations and Insights Analyst will use data to refine our Product Support experience, build dashboards and data pipelines, and deliver reporting to ensure our leadership team has a clear pulse on the business. You’ll identify opportunities to optimize Figma’s product support operations. As a problem solver, you will dig into data to find root causes, identify trends, uncover blind spots, and help to answer questions about the customer and employee experience. YoYou will present data to the team in a manner that is effective, tangible, and tells a clear story.

This is a full time role that can be held from one of our US hubs or remotely in the United States.

What you’ll do at Figma:

Build data pipelines that enable reliable, accurate, and timely data insightsEnable product support to capture customer, product, and team performance insightsDevelop and maintain workforce capacity models to forecast staffing needsDesign scalable data pipelines, and communicate design recommendations to leadership and our internal partnersCollaborate with our data science and engineering teams to build, document, and manage our Product Support data structure and pipelines.

We'd love to hear from you if you have:

Proficiency in SQL and querying databases using tools like Tableau, Mode, Looker, or Zendesk Explore (we use Mode, Explore, and Hex)A deep understanding of statistical analysis and data modeling techniquesExperience building complex ETL jobsProven track record of presenting technical findings to non-technical stakeholdersExperience problem-solving through issues that impact the customer and product support teams

While not required, it’s an added plus if you also have:

Experience supporting a technical SaaS company in a senior analyst capacityExperience developing in DBTProficiency in R and/or PythonApplied ML experience

At Figma, one of our values is Grow as you go. We believe in hiring smart, curious people who are excited to learn and develop their skills. If you’re excited about this role but your past experience doesn’t align perfectly with the points outlined in the job description, we encourage you to apply anyways. You may be just the right candidate for this or other roles.

Pay Transparency Disclosure

If based in Figma’s San Francisco or New York hub offices, this role has the annual base salary range stated below.

Job level and actual compensation will be decided based on factors including, but not limited to, individual qualifications objectively assessed during the interview process (including skills and prior relevant experience, potential impact, and scope of role), market demands, and specific work location. The listed range is a guideline, and the range for this role may be modified. For roles that are available to be filled remotely, the pay range is localized according to employee work location by a factor of between 80% and 100% of range. Please discuss your specific work location with your recruiter for more information.

Figma offers equity to employees, as well a competitive package of additional benefits, including health, dental & vision, retirement with company contribution, parental leave & reproductive or family planning support, mental health & wellness benefits, generous PTO, company recharge days, a learning & development stipend, a work from home stipend, and cell phone reimbursement. Figma also offers sales incentive pay for most sales roles. Figma’s compensation and benefits are subject to change and may be modified in the future. You may view our Pay Transparency Policy by clicking on the corresponding link.

Annual Base Salary Range (SF/NY Hub):

$102,000—$215,000 USD

At Figma we celebrate and support our differences. We know employing a team rich in diverse thoughts, experiences, and opinions allows our employees, our product and our community to flourish. Figma is an equal opportunity workplace - we are dedicated to equal employment opportunities regardless of race, color, ancestry, religion, sex, national origin, sexual orientation, age, citizenship, marital status, disability, gender identity/expression, veteran status, or any other characteristic protected by law. We also consider qualified applicants regardless of criminal histories, consistent with legal requirements.

We will work to ensure individuals with disabilities are provided reasonable accommodation to apply for a role, participate in the interview process, perform essential job functions, and receive other benefits and privileges of employment. If you require accommodation, please reach out to accommodations-ext@figma.com. These modifications enable an individual with a disability to have an equal opportunity not only to get a job, but successfully perform their job tasks to the same extent as people without disabilities.

Examples of accommodations include but are not limited to:

Holding interviews in an accessible locationEnabling closed captioning on video conferencingEnsuring all written communication be compatible with screen readersChanging the mode or format of interviews 

By applying for this job, the candidate acknowledges and agrees that any personal data contained in their application or supporting materials will be processed in accordance with the applicable candidate section of Figma's Privacy Policy.","Figma is growing our team of passionate people on a mission to make design accessible to all. Born on the Web, Figma helps entire product teams brainstorm, design and build better products — from start to finish. Whether it’s consolidating tools, simplifying workflows, or collaborating across teams and time zones, Figma makes the design process faster, more efficient, and fun while keeping everyone on the same page. From great products to long-lasting companies, we believe that nothing great is made alone—come make with us!

As a member of our Product Support Operations and Strategy team, the Operations and Insights Analyst will use data to refine our Product Support experience, build dashboards and data pipelines, and deliver reporting to ensure our leadership team has a clear pulse on the business. You’ll identify opportunities to optimize Figma’s product support operations. As a problem solver, you will dig into data to find root causes, identify trends, uncover blind spots, and help to answer questions about the customer and employee experience. YoYou will present data to the team in a manner that is effective, tangible, and tells a clear story.

This is a full time role that can be held from one of our US hubs or remotely in the United States.

What you’ll do at Figma:

<ul><li>Build data pipelines that enable reliable, accurate, and timely data insights</li><li>Enable product support to capture customer, product, and team performance insights</li><li>Develop and maintain workforce capacity models to forecast staffing needs</li><li>Design scalable data pipelines, and communicate design recommendations to leadership and our internal partners</li><li>Collaborate with our data science and engineering teams to build, document, and manage our Product Support data structure and pipelines.

</li></ul>We'd love to hear from you if you have:

<ul><li>Proficiency in SQL and querying databases using tools like Tableau, Mode, Looker, or Zendesk Explore (we use Mode, Explore, and Hex)</li><li>A deep understanding of statistical analysis and data modeling techniques</li><li>Experience building complex ETL jobs</li><li>Proven track record of presenting technical findings to non-technical stakeholders</li><li>Experience problem-solving through issues that impact the customer and product support teams

</li></ul>While not required, it’s an added plus if you also have:

<ul><li>Experience supporting a technical SaaS company in a senior analyst capacity</li><li>Experience developing in DBT</li><li>Proficiency in R and/or Python</li><li>Applied ML experience

</li></ul>At Figma, one of our values is Grow as you go. We believe in hiring smart, curious people who are excited to learn and develop their skills. If you’re excited about this role but your past experience doesn’t align perfectly with the points outlined in the job description, we encourage you to apply anyways. You may be just the right candidate for this or other roles.

<strong>Pay Transparency Disclosure

</strong>If based in Figma’s San Francisco or New York hub offices, this role has the annual base salary range stated below.

Job level and actual compensation will be decided based on factors including, but not limited to, individual qualifications objectively assessed during the interview process (including skills and prior relevant experience, potential impact, and scope of role), market demands, and specific work location. The listed range is a guideline, and the range for this role may be modified. For roles that are available to be filled remotely, the pay range is localized according to employee work location by a factor of between 80% and 100% of range. Please discuss your specific work location with your recruiter for more information.

Figma offers equity to employees, as well a competitive package of additional benefits, including health, dental & vision, retirement with company contribution, parental leave & reproductive or family planning support, mental health & wellness benefits, generous PTO, company recharge days, a learning & development stipend, a work from home stipend, and cell phone reimbursement. Figma also offers sales incentive pay for most sales roles. Figma’s compensation and benefits are subject to change and may be modified in the future. You may view our Pay Transparency Policy by clicking on the corresponding link.

Annual Base Salary Range (SF/NY Hub):

$102,000—$215,000 USD

At Figma we celebrate and support our differences. We know employing a team rich in diverse thoughts, experiences, and opinions allows our employees, our product and our community to flourish. Figma is an equal opportunity workplace - we are dedicated to equal employment opportunities regardless of race, color, ancestry, religion, sex, national origin, sexual orientation, age, citizenship, marital status, disability, gender identity/expression, veteran status<strong>, </strong>or any other characteristic protected by law. We also consider qualified applicants regardless of criminal histories, consistent with legal requirements.

We will work to ensure individuals with disabilities are provided reasonable accommodation to apply for a role, participate in the interview process, perform essential job functions, and receive other benefits and privileges of employment. If you require accommodation, please reach out to accommodations-ext@figma.com. These modifications enable an individual with a disability to have an equal opportunity not only to get a job, but successfully perform their job tasks to the same extent as people without disabilities.

Examples of accommodations include but are not limited to:

<ul><li>Holding interviews in an accessible location</li><li>Enabling closed captioning on video conferencing</li><li>Ensuring all written communication be compatible with screen readers</li><li>Changing the mode or format of interviews 

</li></ul>By applying for this job, the candidate acknowledges and agrees that any personal data contained in their application or supporting materials will be processed in accordance with the applicable candidate section of Figma's Privacy Policy.","Figma · United States (Remote)","https://www.linkedin.com/jobs/view/3866851762/","United States","Skills: Looker (Software), Databases, +8 more","1,001-5,000 employees · Design Services
4 school alumni work here","LISTED","92944770","Figma","https://media.licdn.com/dms/image/D560BAQGjPX8xmdHxgw/company-logo_400_400/0/1690557728311/figma_logo?e=1722470400&v=beta&t=f0ANi8UPNY2j63R5pgdschlKwPFKjDoB9MxaIj3IcIs","2024-03-21T19:52:37.000Z","2024-04-30T00:08:16.455Z"
