"Title","Description","Description HTML","Primary Description","Detail URL","Location","Skill","Insight","Job State","Poster Id","Company Name","Company Logo","Created At","Scraped At"
"Customer Insights Analyst Intern","Job Description

The purpose of this position is to develop empathy for members of the Church of Jesus Christ of Latter-day Saints as we support them to bind themselves to Jesus Christ and Heavenly Father as they receive ordinances for themselves and deceased family members.

We are looking for a qualified contributor to join our team to assist in audience listening, user testing, and experience design. This role will look at the current journey a member takes to receive ordinances for themselves and deceased ancestors. In particular, look at the FamilySearch experience and propose data-driven improvements that will enhance the member experience. As temples are being constructed across the globe, it’s important that the candidate has experience with a culture outside of the intermountain west.

Our ideal candidate has exceptional communication skills and is comfortable giving formal presentations to business professionals. Strong writing skills and being able to clearly and simply articulate complex ideas for a global audience is important. She or he is strategically-minded, data-driven, well-spoken, and enjoys working within a team to create new ways to achieve goals. Self-directed, the ideal candidate can be successful if he or she understands the end goal and the parameters in which to work. Any experience with ordinances, the house of the Lord, and preparing family names is a plus.

Responsibilities

 Work alongside experience managers to conduct and review audience listening results.  Help plan and organize for audience listening interviews.  Create reports and presentations to be given to stakeholders.  Analyze web traffic reports and key performance indicators to make recommendations.  Write draft documents to test messaging with users.  Test products and experience. 

Qualifications

 Excellent verbal communication skills  Excellent writing skills  Proficient in Microsoft Word, Excel, Powerpoint, Outlook, and Teams.  Majoring in a technical, marketing, communication, business, or family history related degree.  Experience using FamilySearch.org and the Family Tree App a plus  Speaks a foreign language a plus. 

Paid Interns are qualified while enrolled in an educational institution and for one year following graduation. They must sign a Paid Internship Engagement Letter.

About Us

Church employees find joy and satisfaction in using their unique talents and abilities to further the Lord’s work. From the IT professional who develops an app that sends the gospel message worldwide, to the facilities manager who maintains our buildings— giving Church members places to worship, teach, learn, and receive sacred ordinances—our employees seek innovative ways to share the gospel of Jesus Christ with the world. They are literally working in His kingdom.

Only members of the Church who are worthy of a temple recommend qualify for employment. Apart from this, the Church is an equal opportunity employer and does not discriminate in its employment decisions on any basis that would violate U.S. or local law.

Qualified applicants will be considered for employment without regard to race, national origin, color, gender, pregnancy, marital status, age, disability, genetic information, veteran status, or other legally protected categories that apply to the Church. The Church will make reasonable accommodations for qualified individuals with known disabilities.","<strong>Job Description

</strong>The purpose of this position is to develop empathy for members of the Church of Jesus Christ of Latter-day Saints as we support them to bind themselves to Jesus Christ and Heavenly Father as they receive ordinances for themselves and deceased family members.

We are looking for a qualified contributor to join our team to assist in audience listening, user testing, and experience design. This role will look at the current journey a member takes to receive ordinances for themselves and deceased ancestors. In particular, look at the FamilySearch experience and propose data-driven improvements that will enhance the member experience. As temples are being constructed across the globe, it’s important that the candidate has experience with a culture outside of the intermountain west.

Our ideal candidate has exceptional communication skills and is comfortable giving formal presentations to business professionals. Strong writing skills and being able to clearly and simply articulate complex ideas for a global audience is important. She or he is strategically-minded, data-driven, well-spoken, and enjoys working within a team to create new ways to achieve goals. Self-directed, the ideal candidate can be successful if he or she understands the end goal and the parameters in which to work. Any experience with ordinances, the house of the Lord, and preparing family names is a plus.

<strong>Responsibilities

</strong><ul><li> Work alongside experience managers to conduct and review audience listening results. </li><li> Help plan and organize for audience listening interviews. </li><li> Create reports and presentations to be given to stakeholders. </li><li> Analyze web traffic reports and key performance indicators to make recommendations. </li><li> Write draft documents to test messaging with users. </li><li> Test products and experience. 

</li></ul><strong>Qualifications

</strong><ul><li> Excellent verbal communication skills </li><li> Excellent writing skills </li><li> Proficient in Microsoft Word, Excel, Powerpoint, Outlook, and Teams. </li><li> Majoring in a technical, marketing, communication, business, or family history related degree. </li><li> Experience using FamilySearch.org and the Family Tree App a plus </li><li> Speaks a foreign language a plus. 

</li></ul>Paid Interns are qualified while enrolled in an educational institution and for one year following graduation. They must sign a Paid Internship Engagement Letter.

<strong>About Us

</strong>Church employees find joy and satisfaction in using their unique talents and abilities to further the Lord’s work. From the IT professional who develops an app that sends the gospel message worldwide, to the facilities manager who maintains our buildings— giving Church members places to worship, teach, learn, and receive sacred ordinances—our employees seek innovative ways to share the gospel of Jesus Christ with the world. They are literally working in His kingdom.

Only members of the Church who are worthy of a temple recommend qualify for employment. Apart from this, the Church is an equal opportunity employer and does not discriminate in its employment decisions on any basis that would violate U.S. or local law.

Qualified applicants will be considered for employment without regard to race, national origin, color, gender, pregnancy, marital status, age, disability, genetic information, veteran status, or other legally protected categories that apply to the Church. The Church will make reasonable accommodations for qualified individuals with known disabilities.","The Church of Jesus Christ of Latter-day Saints · Salt Lake City, UT (Hybrid)","https://www.linkedin.com/jobs/view/3909852561/","Salt Lake City, Utah, United States","Skills: Key Performance Indicators, Web Analytics, +8 more","10,001+ employees · Religious Institutions
3 school alumni work here","LISTED","3289948","The Church of Jesus Christ of Latter-day Saints","https://media.licdn.com/dms/image/C4E0BAQFzZK4NZJfplA/company-logo_400_400/0/1630655134817?e=1722470400&v=beta&t=SeTQi1vmileqvDw2myoI4LZgI_4QvHGhn3HSGHs-M3Y","2024-04-24T16:54:43.000Z","2024-04-30T00:08:16.455Z"
"Data Analyst","DataAnnotation is committed to creating quality AI. Join our team to help train AI chatbots while gaining the flexibility of remote work and choosing your own schedule. 
We are looking for a proficient Data Analyst to join our team to train our AI chatbots. You will work with the chatbots that we are building in order to measure their progress, as well as write and evaluate code.
In this role you will need to be proficient in at least one programming language (Python, JavaScript, HTML, C++, C# and SQL) and able to solve coding problems (think LeetCode, HackerRank, etc). For each coding problem, you must be able to explain how your solution solves the problem.
Benefits:
This is a full-time or part-time REMOTE positionYou’ll be able to choose which projects you want to work onYou can work on your own scheduleProjects are paid hourly, starting at $40+ USD per hour, with bonuses for high-quality and high-volume work
Responsibilities:
Come up with diverse problems and solutions for a coding chatbotWrite high-quality answers and code snippetsEvaluate code quality produced by AI models for correctness and performance
Qualifications:
Fluency in English (native or bilingual)Proficient in at least one programming language (Python, JavaScript, HTML, C++, C# and SQL)Excellent writing and grammar skillsA bachelor's degree (completed or in progress)
Note: Data Annotation payment is made via PayPal. We will never ask for any money from you. PayPal will handle any currency conversions from USD.","<p>DataAnnotation is committed to creating quality AI. Join our team to help train AI chatbots while gaining the flexibility of remote work and choosing your own schedule. </p><p>
</p><p>We are looking for a proficient Data Analyst to join our team to train our AI chatbots. You will work with the chatbots that we are building in order to measure their progress, as well as write and evaluate code.</p><p>
</p><p>In this role you will need to be proficient in at least one programming language (Python, JavaScript, HTML, C++, C# and SQL) and able to solve coding problems (think LeetCode, HackerRank, etc). For each coding problem, you must be able to explain how your solution solves the problem.</p><p>
</p><p>Benefits:</p><p>
</p><ul><li>This is a full-time or part-time REMOTE position</li><li>You’ll be able to choose which projects you want to work on</li><li>You can work on your own schedule</li><li>Projects are paid hourly, starting at $40+ USD per hour, with bonuses for high-quality and high-volume work</li></ul><p>
</p><p>Responsibilities:</p><p>
</p><ul><li>Come up with diverse problems and solutions for a coding chatbot</li><li>Write high-quality answers and code snippets</li><li>Evaluate code quality produced by AI models for correctness and performance</li></ul><p>
</p><p>Qualifications:</p><p>
</p><ul><li>Fluency in English (native or bilingual)</li><li>Proficient in at least one programming language (Python, JavaScript, HTML, C++, C# and SQL)</li><li>Excellent writing and grammar skills</li><li>A bachelor's degree (completed or in progress)</li></ul><p>
</p><p>Note: Data Annotation payment is made via PayPal. We will never ask for any money from you. PayPal will handle any currency conversions from USD.</p>","DataAnnotation · Richmond, VA (Remote)","https://www.linkedin.com/jobs/view/3901938642/","Richmond, Virginia, United States","Skills: Python (Programming Language), SQL, +4 more","5,001-10,000 employees · Software Development
1 school alum works here","LISTED","1265882026","DataAnnotation","https://media.licdn.com/dms/image/D560BAQHHSLItnYjK1g/company-logo_400_400/0/1689651238543/dataannotationtech_logo?e=1722470400&v=beta&t=nZ3FZdB-_Xm4FTRNdrKAd_pUc6c_H8J7qtGnew2j8Hs","2024-04-18T19:55:58.000Z","2024-04-30T00:08:16.455Z"
"Data Analyst","DataAnnotation is committed to creating quality AI. Join our team to help train AI chatbots while gaining the flexibility of remote work and choosing your own schedule. 
We are looking for a proficient Data Analyst to join our team to train our AI chatbots. You will work with the chatbots that we are building in order to measure their progress, as well as write and evaluate code.
In this role you will need to be proficient in at least one programming language (Python, JavaScript, HTML, C++, C# and SQL) and able to solve coding problems (think LeetCode, HackerRank, etc). For each coding problem, you must be able to explain how your solution solves the problem.
Benefits:
This is a full-time or part-time REMOTE positionYou’ll be able to choose which projects you want to work onYou can work on your own scheduleProjects are paid hourly, starting at $40+ USD per hour, with bonuses for high-quality and high-volume work
Responsibilities:
Come up with diverse problems and solutions for a coding chatbotWrite high-quality answers and code snippetsEvaluate code quality produced by AI models for correctness and performance
Qualifications:
Fluency in English (native or bilingual)Proficient in at least one programming language (Python, JavaScript, HTML, C++, C# and SQL)Excellent writing and grammar skillsA bachelor's degree (completed or in progress)
Note: Data Annotation payment is made via PayPal. We will never ask for any money from you. PayPal will handle any currency conversions from USD.","<p>DataAnnotation is committed to creating quality AI. Join our team to help train AI chatbots while gaining the flexibility of remote work and choosing your own schedule. </p><p>
</p><p>We are looking for a proficient Data Analyst to join our team to train our AI chatbots. You will work with the chatbots that we are building in order to measure their progress, as well as write and evaluate code.</p><p>
</p><p>In this role you will need to be proficient in at least one programming language (Python, JavaScript, HTML, C++, C# and SQL) and able to solve coding problems (think LeetCode, HackerRank, etc). For each coding problem, you must be able to explain how your solution solves the problem.</p><p>
</p><p>Benefits:</p><p>
</p><ul><li>This is a full-time or part-time REMOTE position</li><li>You’ll be able to choose which projects you want to work on</li><li>You can work on your own schedule</li><li>Projects are paid hourly, starting at $40+ USD per hour, with bonuses for high-quality and high-volume work</li></ul><p>
</p><p>Responsibilities:</p><p>
</p><ul><li>Come up with diverse problems and solutions for a coding chatbot</li><li>Write high-quality answers and code snippets</li><li>Evaluate code quality produced by AI models for correctness and performance</li></ul><p>
</p><p>Qualifications:</p><p>
</p><ul><li>Fluency in English (native or bilingual)</li><li>Proficient in at least one programming language (Python, JavaScript, HTML, C++, C# and SQL)</li><li>Excellent writing and grammar skills</li><li>A bachelor's degree (completed or in progress)</li></ul><p>
</p><p>Note: Data Annotation payment is made via PayPal. We will never ask for any money from you. PayPal will handle any currency conversions from USD.</p>","DataAnnotation · Greater Chicago Area (Remote)","https://www.linkedin.com/jobs/view/3901389241/","Greater Chicago Area","Skills: Python (Programming Language), SQL, +4 more","5,001-10,000 employees · Software Development
1 school alum works here","LISTED","1265882026","DataAnnotation","https://media.licdn.com/dms/image/D560BAQHHSLItnYjK1g/company-logo_400_400/0/1689651238543/dataannotationtech_logo?e=1722470400&v=beta&t=nZ3FZdB-_Xm4FTRNdrKAd_pUc6c_H8J7qtGnew2j8Hs","2024-04-18T17:11:13.000Z","2024-04-30T00:08:16.455Z"
"Reporting & Insights Analyst ","The Aspen Group (TAG) is one of the largest and most trusted retail healthcare business support organizations in the U.S. and has supported over 20,000 healthcare professionals and team members at more than 1,300 health and wellness offices across 48 states in four distinct categories: dental care, urgent care, medical aesthetics, and animal health. Working in partnership with independent practice owners and clinicians, the team is united by a single purpose: to prove that healthcare can be better and smarter for everyone. TAG provides a comprehensive suite of centralized business support services that power the impact of five consumer-facing businesses: Aspen Dental, ClearChoice Dental Implant Centers, WellNow Urgent Care, Chapter Aesthetic Studio, and AZPetVet. Each brand has access to a deep community of experts, tools and resources to grow their practices, and an unwavering commitment to delivering high-quality consumer healthcare experiences at scale.
As a reflection of our current needs and planned growth we are very pleased to offer an opportunity to join our FP&A team as a Reporting & Insights Analyst supporting our Revenue Cycle Management function. Core responsibilities and expectations for this position include reporting and analyzing key revenue cycle data, driving financial transparency, and providing insight into business drivers and key metrics. This is an exciting opportunity for someone looking to build a strong foundation in analysis. You'll have the chance to learn and grow in a supportive environment, making meaningful contributions from day one.
Responsibilities:We are excited to present this position as part of one of the largest and most rapidly growing dental service organizations in the country. Reporting to the Manager of RCM Reporting & Data Analytics, this position will partner closely with business leadership to deliver regular RCM reporting packages, as well as support new projects and ad hoc analysis.• Supporting RCM (Revenue Cycle Management) & PSO (Practice Support Operations) management teams through comprehensive analyses of data and KPIs• Leading the timely and accurate development of regular RCM & PSO reports• Supporting leadership on new projects, strategic initiatives, and ad hoc requests• Communicating insights behind the numbers and anticipating challenges or opportunities• Developing a thorough understanding of key metrics and related drivers• Creating Tableau dashboards for the organization to derive insights and conclusions.• Building data models to gain insights, increase transparency, and provide recommendations to leadership.• Ensuring data integrity, accuracy, and governance in financial and management reporting
Qualifications and Experience:• BS in Data Analytics, Accounting, Finance, or another Business/Technical related field • 1-2 years of experience in data analysis or other reporting desired. Experience in the RCM insurance environment is a plus.• Strong analytical and technical mindset with demonstrated experience of handling large, complex data sets is desired.• Experience with SQL Server or BigQuery is desired. Tableau experience is a plus.• Exposure to business analytics (descriptive and predictive), statistics, and/or data discovery techniques• Advanced skills with Microsoft Excel and PowerPoint• Ability to excel in a fast-paced environment, take direction, and handle multiple priorities.• Excellent communication and interpersonal skills are required. Must be a team player.• Willingness to take on new projects and a desire to learn.
Salary Range $71,500 - $84,000 DOE
If you are an applicant residing in California, please view our privacy policy here: https://careers.aspendental.com/us/en/tag-privacy-policy-for-california-employees","<p>The Aspen Group (TAG) is one of the largest and most trusted retail healthcare business support organizations in the U.S. and has supported over 20,000 healthcare professionals and team members at more than 1,300 health and wellness offices across 48 states in four distinct categories: dental care, urgent care, medical aesthetics, and animal health. Working in partnership with independent practice owners and clinicians, the team is united by a single purpose: to prove that healthcare can be better and smarter for everyone. TAG provides a comprehensive suite of centralized business support services that power the impact of five consumer-facing businesses: Aspen Dental, ClearChoice Dental Implant Centers, WellNow Urgent Care, Chapter Aesthetic Studio, and AZPetVet. Each brand has access to a deep community of experts, tools and resources to grow their practices, and an unwavering commitment to delivering high-quality consumer healthcare experiences at scale.</p><p>
</p><p>As a reflection of our current needs and planned growth we are very pleased to offer an opportunity to join our FP&A team as a <strong>Reporting & Insights Analyst</strong> supporting our Revenue Cycle Management function. Core responsibilities and expectations for this position include reporting and analyzing key revenue cycle data, driving financial transparency, and providing insight into business drivers and key metrics. This is an exciting opportunity for someone looking to build a strong foundation in analysis. You'll have the chance to learn and grow in a supportive environment, making meaningful contributions from day one.</p><p>
</p><p><strong>Responsibilities:</strong></p><p>We are excited to present this position as part of one of the largest and most rapidly growing dental service organizations in the country. Reporting to the Manager of RCM Reporting & Data Analytics, this position will partner closely with business leadership to deliver regular RCM reporting packages, as well as support new projects and ad hoc analysis.</p><p>• Supporting RCM (Revenue Cycle Management) & PSO (Practice Support Operations) management teams through comprehensive analyses of data and KPIs</p><p>• Leading the timely and accurate development of regular RCM & PSO reports</p><p>• Supporting leadership on new projects, strategic initiatives, and ad hoc requests</p><p>• Communicating insights behind the numbers and anticipating challenges or opportunities</p><p>• Developing a thorough understanding of key metrics and related drivers</p><p>• Creating Tableau dashboards for the organization to derive insights and conclusions.</p><p>• Building data models to gain insights, increase transparency, and provide recommendations to leadership.</p><p>• Ensuring data integrity, accuracy, and governance in financial and management reporting</p><p>
</p><p><strong>Qualifications and Experience:</strong></p><p>• BS in Data Analytics, Accounting, Finance, or another Business/Technical related field </p><p>• 1-2 years of experience in data analysis or other reporting desired. Experience in the RCM insurance environment is a plus.</p><p>• Strong analytical and technical mindset with demonstrated experience of handling large, complex data sets is desired.</p><p>• Experience with SQL Server or BigQuery is desired. Tableau experience is a plus.</p><p>• Exposure to business analytics (descriptive and predictive), statistics, and/or data discovery techniques</p><p>• Advanced skills with Microsoft Excel and PowerPoint</p><p>• Ability to excel in a fast-paced environment, take direction, and handle multiple priorities.</p><p>• Excellent communication and interpersonal skills are required. Must be a team player.</p><p>• Willingness to take on new projects and a desire to learn.</p><p>
</p><p><strong>Salary Range $71,500 - $84,000 DOE</strong></p><p>
</p><p>If you are an applicant residing in California, please view our privacy policy here: https://careers.aspendental.com/us/en/tag-privacy-policy-for-california-employees</p>","Aspen Dental · Chicago, IL (Hybrid)","https://www.linkedin.com/jobs/view/3913560936/","Chicago, Illinois, United States","Skills: SQL, Google BigQuery","5,001-10,000 employees · Hospitals and Health Care
3 school alumni work here","LISTED","15851369","Aspen Dental","https://media.licdn.com/dms/image/C4E0BAQGmDnqxDSjg5g/company-logo_400_400/0/1649774366589?e=1722470400&v=beta&t=Vy3tLqfJ_yWAWWVfRkT_hu_hwOWuujPJRJgcNlddKb4","2024-04-29T18:10:57.000Z","2024-04-30T00:08:16.455Z"
