"Title","Description","Description HTML","Primary Description","Detail URL","Location","Skill","Insight","Job State","Poster Id","Company Name","Company Logo","Created At","Scraped At"
"Principal Quantitative Researcher (Remote, USA)","Principal Quantitative Researcher

A little about us. Splunk is here to build a safer and more resilient digital world. We’re proud to say that we’re the key to enterprise resilience for more than 11,000 enterprise organizations that use our Unified Security and Observability Platform to keep their systems secure and reliable. We’re also proud of our award-winning culture and our regular appearance on those “Best Places to Work” lists.

If you end up joining us, we’ll only ask one thing bring your whole, authentic self, what we call your million data points. So bring your work experience, problem-solving skills and talent, of course, but also bring your joy, your passion and all the things that make you, you. Because when you feel free to be you, it makes it a lot easier for us to be us.

About The Role

We’re looking for a Principal Quantitative Researcher to join Splunk’s Research & Insights team. The Research & Insights team is a new team focused on driving key product decisions through customer insight. This role underpins several organizational priorities focused on driving measurement of the product experience of Splunk overall and driving a more quantitative approach to customer centricity at Splunk. This role requires managing diverse partners across Design, Engineering, Product, Information Experiences (Content) and Design Systems as well as partnering closely with program management for a key strategic initiative.

What you’ll do

Be the organization’s thought leader on measuring the product experience and guiding product decisions with quantitative data- design, pilot and implement methods to measure the product experience in close partnership with Research, Design, Information Experience, Design Systems, Engineering and Product Management.Investigate user behavior and user needs using empirical research methods such as logs analysis, survey research, path modeling, and regression analysisWork cross-functionally with partners to implement the approach into a delivery tool and work through challenges, roadblocks adapting the approach as needed while upholding research integrity.Guide product decisions with quantitative data to improve the overall product experience and prioritize customer needs and consult on approaches to individual product and feature levelsDevelop high quality, high impact communications strategies and toolsPartner closely with Research and research leadership to advocate for and expand qualitative research approachesCreate best practices, training and enablement and a governance structure forScale Splunk’s quantitative research practice through mentorship, coaching and enabling Researchers, Designers, Product Managers and partnering with other quantitative practitioners, including Data Science.

What you’ll bring

8+ years of experience in applied Quantitative ResearchUndergraduate degree in computer science, quantitative social science, econometrics, data science, survey research, psychology, human-computer interaction, or other fields, or equivalent experienceDeep experience in quantitative research methods and analysis as well as UX metrics and KPIs including SUS, SEQ, UX-Lite, NPS, CSAT, design heuristics, and usage dataExcellent organization skills and the ability to manage multiple high-profile projects in a dynamic organization.Outstanding written and verbal communication skills. Strong analytical and presentation skills.Demonstrated success using Pendo and/or other in-app product feedback tools, to measure and communicate product experienceExperience in programming languages used for data manipulation and computational statistics (Python, R, MATLAB, C++, Java, Go), and with SQLPreferred expertise on measuring and communicating Research impactPreferred expertise with Jobs-To-Be-Done Frameworks, adding quantitative measures and measuring product value in the context of JTBD

What we offer you!

If you’d like to join one of the fastest-growing and most exciting tech companies in Silicon Valley, contact us!

Benefits are an important part of Splunk's Total Rewards package. This role is eligible for a competitive benefits package which includes medical, dental, vision, a 401(k) plan and match, paid time off, and much more! Learn more about our comprehensive benefits and wellbeing offering here.

Splunk is an Equal Opportunity Employer At Splunk, we believe creating a culture of belonging isn’t just the right thing to do; it’s also the smart thing. We prioritize diversity, equity, inclusion, and belonging to ensure our employees are supported to bring their best, most authentic selves to work where they can thrive. Qualified applicants receive consideration for employment without regard to race, religion, color, national origin, ancestry, sex, gender, gender identity, gender expression, sexual orientation, marital status, age, physical or mental disability or medical condition, genetic information, veteran status, or any other consideration made unlawful by federal, state, or local laws. We consider qualified applicants with criminal histories, consistent with legal requirements.

Note

Base Pay Range

SF Bay Area, Seattle Metro, and New York City Metro Area

Base Pay Range $181,200.00 - 249,150.00 per year

California (excludes SF Bay Area), Washington (excludes Seattle Metro), Washington DC Metro, and Massachusetts

Base Pay Range $163,080.00 - 224,235.00 per year

All other cities and states excluding California, Washington, Massachusetts, New York City Metro Area and Washington DC Metro Area.

Base Pay Range $144,960.00 - 199,320.00 per year

Splunk provides flexibility and choice in the working arrangement for most roles, including remote and/or in-office roles. We have a market-based pay structure which varies by location. Please note that the base pay range is a guideline and for candidates who receive an offer, the base pay will vary based on factors such as work location as set out above, as well as the knowledge, skills and experience of the candidate. In addition to base pay, this role is eligible for incentive compensation and may be eligible for equity or long-term cash awards.

Benefits are an important part of Splunk's Total Rewards package. This role is eligible for a competitive benefits package which includes medical, dental, vision, a 401(k) plan and match, paid time off and much more! Learn more about our comprehensive benefits and wellbeing offering at https //splunkbenefits.com.

","Principal Quantitative Researcher

A little about us. Splunk is here to build a safer and more resilient digital world. We’re proud to say that we’re the key to enterprise resilience for more than 11,000 enterprise organizations that use our Unified Security and Observability Platform to keep their systems secure and reliable. We’re also proud of our award-winning culture and our regular appearance on those “Best Places to Work” lists.

If you end up joining us, we’ll only ask one thing bring your whole, authentic self, what we call your million data points. So bring your work experience, problem-solving skills and talent, of course, but also bring your joy, your passion and all the things that make you, you. Because when you feel free to be you, it makes it a lot easier for us to be us.

<strong>About The Role

</strong>We’re looking for a Principal Quantitative Researcher to join Splunk’s Research & Insights team. The Research & Insights team is a new team focused on driving key product decisions through customer insight. This role underpins several organizational priorities focused on driving measurement of the product experience of Splunk overall and driving a more quantitative approach to customer centricity at Splunk. This role requires managing diverse partners across Design, Engineering, Product, Information Experiences (Content) and Design Systems as well as partnering closely with program management for a key strategic initiative.

What you’ll do

<ul><li>Be the organization’s thought leader on measuring the product experience and guiding product decisions with quantitative data- design, pilot and implement methods to measure the product experience in close partnership with Research, Design, Information Experience, Design Systems, Engineering and Product Management.</li><li>Investigate user behavior and user needs using empirical research methods such as logs analysis, survey research, path modeling, and regression analysis</li><li>Work cross-functionally with partners to implement the approach into a delivery tool and work through challenges, roadblocks adapting the approach as needed while upholding research integrity.</li><li>Guide product decisions with quantitative data to improve the overall product experience and prioritize customer needs and consult on approaches to individual product and feature levels</li><li>Develop high quality, high impact communications strategies and tools</li><li>Partner closely with Research and research leadership to advocate for and expand qualitative research approaches</li><li>Create best practices, training and enablement and a governance structure for</li><li>Scale Splunk’s quantitative research practice through mentorship, coaching and enabling Researchers, Designers, Product Managers and partnering with other quantitative practitioners, including Data Science.

</li></ul>What you’ll bring

<ul><li>8+ years of experience in applied Quantitative Research</li><li>Undergraduate degree in computer science, quantitative social science, econometrics, data science, survey research, psychology, human-computer interaction, or other fields, or equivalent experience</li><li>Deep experience in quantitative research methods and analysis as well as UX metrics and KPIs including SUS, SEQ, UX-Lite, NPS, CSAT, design heuristics, and usage data</li><li>Excellent organization skills and the ability to manage multiple high-profile projects in a dynamic organization.</li><li>Outstanding written and verbal communication skills. Strong analytical and presentation skills.</li><li>Demonstrated success using Pendo and/or other in-app product feedback tools, to measure and communicate product experience</li><li>Experience in programming languages used for data manipulation and computational statistics (Python, R, MATLAB, C++, Java, Go), and with SQL</li><li>Preferred expertise on measuring and communicating Research impact</li><li>Preferred expertise with Jobs-To-Be-Done Frameworks, adding quantitative measures and measuring product value in the context of JTBD

</li></ul>What we offer you!

If you’d like to join one of the fastest-growing and most exciting tech companies in Silicon Valley, contact us!

Benefits are an important part of Splunk's Total Rewards package. This role is eligible for a competitive benefits package which includes medical, dental, vision, a 401(k) plan and match, paid time off, and much more! Learn more about our comprehensive benefits and wellbeing offering here.

Splunk is an Equal Opportunity Employer At Splunk, we believe creating a culture of belonging isn’t just the right thing to do; it’s also the smart thing. We prioritize diversity, equity, inclusion, and belonging to ensure our employees are supported to bring their best, most authentic selves to work where they can thrive. Qualified applicants receive consideration for employment without regard to race, religion, color, national origin, ancestry, sex, gender, gender identity, gender expression, sexual orientation, marital status, age, physical or mental disability or medical condition, genetic information, veteran status, or any other consideration made unlawful by federal, state, or local laws. We consider qualified applicants with criminal histories, consistent with legal requirements.

Note

<strong>Base Pay Range

</strong>SF Bay Area, Seattle Metro, and New York City Metro Area

Base Pay Range $181,200.00 - 249,150.00 per year

California (excludes SF Bay Area), Washington (excludes Seattle Metro), Washington DC Metro, and Massachusetts

Base Pay Range $163,080.00 - 224,235.00 per year

All other cities and states excluding California, Washington, Massachusetts, New York City Metro Area and Washington DC Metro Area.

Base Pay Range $144,960.00 - 199,320.00 per year

Splunk provides flexibility and choice in the working arrangement for most roles, including remote and/or in-office roles. We have a market-based pay structure which varies by location. Please note that the base pay range is a guideline and for candidates who receive an offer, the base pay will vary based on factors such as work location as set out above, as well as the knowledge, skills and experience of the candidate. <strong>In addition to base pay, this role is eligible for incentive compensation and may be eligible for equity or long-term cash awards.

</strong>Benefits are an important part of Splunk's Total Rewards package. This role is eligible for a competitive benefits package which includes medical, dental, vision, a 401(k) plan and match, paid time off and much more! Learn more about our comprehensive benefits and wellbeing offering at https //splunkbenefits.com.

","Splunk · Texas, United States (Remote)","https://www.linkedin.com/jobs/view/3862529098/","Texas, United States","6 of 10 skills match your profile - you may be a good fit","5,001-10,000 employees · Software Development
1 connection works here · 13 school alumni work here","LISTED","609758200","Splunk","https://media.licdn.com/dms/image/D560BAQGRnOktWJ9EPQ/company-logo_400_400/0/1710767211917/splunk_logo?e=1718841600&v=beta&t=xEKRjf2pKvCWePcEejnwNrfcMIqZLW6P6s-tgGvhqwY","2024-03-18T16:32:44.000Z","2024-03-21T16:00:21.346Z"
