"Title","Description","Description HTML","Primary Description","Detail URL","Location","Skill","Insight","Job State","Poster Id","Company Name","Company Logo","Created At","Scraped At"
"Market Insights Analyst - Consumer Goods","Spate is seeking a detail-oriented, passionate Market Insights Analyst at Spate who is eager to make a substantial impact within our dynamic team. This role is ideal for someone who excels in data analysis, copywriting and editing, is detail-oriented, enthusiastic, and an exceptional presenter in both virtual and in-person settings. If you're ready to take on an exciting, challenging role in a flexible work environment, we'd love to welcome you aboard. We are looking for someone who is available 40 hours a week.With this being a hybrid role, there is the possibility to work from anywhere in the world, upon manager’s approval, depending on business projects & obligations of your role. The expectation is that you come to the NYC office 1 - 2 times a week when in town.About the Role:As our Market Insights Analyst, you'll contribute to the analytical powerhouse behind Spate, providing critical insights that drive decision-making and strategic planning for our clients. Your work will directly influence our marketing strategies and client interactions. Collaborating closely with various teams, you will ensure that our data-driven reports and marketing help Spate stay ahead in a competitive market.Responsibilities:Conduct detailed market research and analysis to identify consumer trends and insights relevant to the beauty, food, wellness, and personal care categories.Develop and present comprehensive reports on your findings to both internal teams and external clients, ensuring information is accessible and actionable.Confidently and accurately present findings to large audiences and key clients Manage the production of Spate’s weekly newsletter, including content coordination, distribution, and performance analysis.Support the content and marketing teams by providing data-driven insights to enhance client engagement, internal and external content, and marketing.Work with the Beauty Insights Coordinator with client engagement, reports, and scheduling Support ongoing partnerships and regular media outreach, communications, and external content 



Requirements

Minimum QualificationsA minimum of 3-5 years of experience in data analysis, market research, or a related field.Ability to effectively and efficiently explore large data sets and gather insights that are actionable and accessible for brands, distributors, marketers, and other professionalsExceptional analytical and quantitative problem-solving skills.Strong presentation and communication skills, with the ability to convey complex data in a clear and persuasive manner.Detail-oriented, organized, and capable of managing multiple projects simultaneously.A proactive ""can do"" attitude and a positive team player mentality.Located in New York and able to come into the office 1 to 2 times/week

Preferred QualificationsProficient in using data analytics tools and software (e.g., Excel, Tableau, Google Analytics)Familiarity with marketing tools (HubSpot CRM, email marketing platforms, Canva).Experience with project management tools (e.g., Asana, Trello).Professional proficiency in FrenchEducational background including market research, statistics, data analysis or marketingExpertise in the consumer goods space, especially regarding beauty and food/beverage 



Benefits

Spate offers:Health Care Plan (Medical, Dental & Vision)Paid Time Off (Vacation, Sick & Public Holidays)Work From Anywhere flexibilitySalary for this role → $75k/year to $80k/year

About SpateAt Spate, we use data science to predict the next big consumer trend in beauty, personal care & food.Spate was founded in 2018 by Yarden Horwitz & Olivier Zimmer, two ex-Googlers who led the trendspotting division at Google and uncovered trends such as turmeric, cold brew, and face masks. Spate has been funded by the prestigious Y Combinator incubator and Initialized Capital. We currently have ~180 clients in the U.S., mainly in the beauty space from direct-to-consumer brands to big names such as L’Oréal, Estée Lauder, Unilever. As two ex-Googlers with a passion for using data to spot new patterns in consumer behavior, and we have made it our mission to build the world’s greatest consumer trends prediction platform of all time. And not just because we want to be trendy, but because we want to help brands get better at giving consumers what they really want. Brands waste over $200BN every year due to product launch failures and inventory waste. By spotting Turmeric, we were able to tell brands to stop wasting money on kale products and provide consumers with glorious golden milk lattes instead - because that’s what consumers want.How do we do this? We tap into publicly available consumer data (anonymous and aggregated) to identify interesting shifts in consumer behavior. We leverage the latest available technology in ML to solve problems in ways that have never been explored before.Why Spate?Join a well-funded company that is working with the top brands in consumer goodsWork directly with the founders to set the direction of the companyGrow in a fast-paced environmentAlways be up-to-date on the latest trends!

We enjoy a casual atmosphere, but our culture is about getting things done. We are passionate yet pragmatic when it comes to solving problems in a fast-paced environment. Our standards are high, but we thrive on working with people we respect and can learn from. We’re flexible on work styles, as long as everyone is getting their work done - and getting it done well.We are an equal opportunity employer where our diversity and inclusion are central pillars of our company strategy. We look for applicants who understand, embrace, and thrive in a multicultural and increasingly globalized world. We do not discriminate based on race, religion, color, national origin, gender, sexual orientation, age, marital status, veteran status, or disability status.We're excited to find a Market Insights Analyst who is passionate about consumer trends and data analysis and ready to make a meaningful impact at Spate. If you meet the criteria above, please apply to join our team and help shape the future of our company.","<p>Spate is seeking a detail-oriented, passionate Market Insights Analyst at Spate who is eager to make a substantial impact within our dynamic team. This role is ideal for someone who excels in data analysis, copywriting and editing, is detail-oriented, enthusiastic, and an exceptional presenter in both virtual and in-person settings. If you're ready to take on an exciting, challenging role in a flexible work environment, we'd love to welcome you aboard. We are looking for someone who is available 40 hours a week.</p><p>With this being a hybrid role, there is the possibility to work from anywhere in the world, upon manager’s approval, depending on business projects & obligations of your role. The expectation is that you come to the NYC office 1 - 2 times a week when in town.</p><p><strong>About the Role:</strong></p><p>As our Market Insights Analyst, you'll contribute to the analytical powerhouse behind Spate, providing critical insights that drive decision-making and strategic planning for our clients. Your work will directly influence our marketing strategies and client interactions. Collaborating closely with various teams, you will ensure that our data-driven reports and marketing help Spate stay ahead in a competitive market.</p><p><strong>Responsibilities:</strong></p><ul><li>Conduct detailed market research and analysis to identify consumer trends and insights relevant to the beauty, food, wellness, and personal care categories.</li><li>Develop and present comprehensive reports on your findings to both internal teams and external clients, ensuring information is accessible and actionable.</li><li>Confidently and accurately present findings to large audiences and key clients </li><li>Manage the production of Spate’s weekly newsletter, including content coordination, distribution, and performance analysis.</li><li>Support the content and marketing teams by providing data-driven insights to enhance client engagement, internal and external content, and marketing.</li><li>Work with the Beauty Insights Coordinator with client engagement, reports, and scheduling </li><li>Support ongoing partnerships and regular media outreach, communications, and external content 

</li></ul><p>

</p><strong>Requirements

</strong><p><strong>Minimum Qualifications</strong></p><ul><li>A minimum of 3-5 years of experience in data analysis, market research, or a related field.</li><li>Ability to effectively and efficiently explore large data sets and gather insights that are actionable and accessible for brands, distributors, marketers, and other professionals</li><li>Exceptional analytical and quantitative problem-solving skills.</li><li>Strong presentation and communication skills, with the ability to convey complex data in a clear and persuasive manner.</li><li>Detail-oriented, organized, and capable of managing multiple projects simultaneously.</li><li>A proactive ""can do"" attitude and a positive team player mentality.</li><li>Located in New York and able to come into the office 1 to 2 times/week

</li></ul><p><strong>Preferred Qualifications</strong></p><ul><li>Proficient in using data analytics tools and software (e.g., Excel, Tableau, Google Analytics)</li><li>Familiarity with marketing tools (HubSpot CRM, email marketing platforms, Canva).</li><li>Experience with project management tools (e.g., Asana, Trello).</li><li>Professional proficiency in French</li><li>Educational background including market research, statistics, data analysis or marketing</li><li>Expertise in the consumer goods space, especially regarding beauty and food/beverage 



</li></ul><strong>Benefits

</strong><p><strong>Spate offers:</strong></p><ul><li>Health Care Plan (Medical, Dental & Vision)</li><li>Paid Time Off (Vacation, Sick & Public Holidays)</li><li>Work From Anywhere flexibility</li><li>Salary for this role → $75k/year to $80k/year

</li></ul><p><strong>About </strong><strong>Spate</strong></p><p>At Spate, we use data science to predict the next big consumer trend in beauty, personal care & food.</p><p>Spate was founded in 2018 by Yarden Horwitz & Olivier Zimmer, two ex-Googlers who led the trendspotting division at Google and uncovered trends such as turmeric, cold brew, and face masks. Spate has been funded by the prestigious Y Combinator incubator and Initialized Capital. We currently have ~180 clients in the U.S., mainly in the beauty space from direct-to-consumer brands to big names such as L’Oréal, Estée Lauder, Unilever.</p><p> </p><p>As two ex-Googlers with a passion for using data to spot new patterns in consumer behavior, and we have made it our mission to build the world’s greatest consumer trends prediction platform of all time. And not just because we want to be trendy, but because we want to help brands get better at giving consumers what they really want. </p><p>Brands waste over $200BN every year due to product launch failures and inventory waste. By spotting Turmeric, we were able to tell brands to stop wasting money on kale products and provide consumers with glorious golden milk lattes instead - because that’s what consumers want.</p><p>How do we do this? We tap into publicly available consumer data (anonymous and aggregated) to identify interesting shifts in consumer behavior. We leverage the latest available technology in ML to solve problems in ways that have never been explored before.</p><p><strong>Why Spate?</strong></p><ul><li>Join a well-funded company that is working with the top brands in consumer goods</li><li>Work directly with the founders to set the direction of the company</li><li>Grow in a fast-paced environment</li><li>Always be up-to-date on the latest trends!

</li></ul><p>We enjoy a casual atmosphere, but our culture is about getting things done. We are passionate yet pragmatic when it comes to solving problems in a fast-paced environment. Our standards are high, but we thrive on working with people we respect and can learn from. We’re flexible on work styles, as long as everyone is getting their work done - and getting it done well.</p><p>We are an equal opportunity employer where our diversity and inclusion are central pillars of our company strategy. We look for applicants who understand, embrace, and thrive in a multicultural and increasingly globalized world. We do not discriminate based on race, religion, color, national origin, gender, sexual orientation, age, marital status, veteran status, or disability status.</p><p>We're excited to find a Market Insights Analyst who is passionate about consumer trends and data analysis and ready to make a meaningful impact at Spate. If you meet the criteria above, please apply to join our team and help shape the future of our company.</p>","SPATE · New York, NY (Hybrid)","https://www.linkedin.com/jobs/view/3913263003/","New York, New York, United States","Skills: Data Analytics, Market Research, +8 more","1-10 employees · Market Research","LISTED","150438999","SPATE","https://media.licdn.com/dms/image/C4D0BAQFtRuYDadwHMw/company-logo_400_400/0/1631361819384/spatenyc_logo?e=1722470400&v=beta&t=hJBo9IXxhf9PIzhtzJzL4Zy0q44hf7lqN7kLVLyvFnc","2024-04-29T05:53:12.000Z","2024-04-30T00:08:16.455Z"
"Quantitative Researcher","Quantitative Researcher
Our client is a small, somewhat under the radar trading firm (~300 people) who are actively looking to scale their Quant Research population in their NYC office. 
You'll benefit from stunning offices, working alongside industry acclaimed colleagues within a flat structured, highly meritocratic environment devoid of organizational silos. 
Exceptional P&L linked pay for top performers on offer on top of a generous base salary as well as a comprehensive benefits program. 
To apply you'll need the following: 
Hold a Bachelor's degree in a STEM disciplineHave a minimum of two years' experience in developing quantitative trading strategiesBe skilled in analyzing large financial datasets for signals in mid- to high-frequency tradingDemonstrate exceptional mathematical proficiencyPossess a passion for solving complex mathematical challengesBe proficient in statistical languages/packages such as R, Python, or similar tools","<p><undefined><strong>Quantitative Researcher</undefined></strong></p><p>
</p><p>Our client is a small, somewhat under the radar trading firm (~300 people) who are actively looking to scale their Quant Research population in their NYC office. </p><p>
</p><p>You'll benefit from stunning offices, working alongside industry acclaimed colleagues within a flat structured, highly meritocratic environment devoid of organizational silos. </p><p>
</p><p>Exceptional P&L linked pay for top performers on offer on top of a generous base salary as well as a comprehensive benefits program. </p><p>
</p><p>To apply you'll need the following: </p><p>
</p><ul><li>Hold a Bachelor's degree in a STEM discipline</li><li>Have a minimum of two years' experience in developing quantitative trading strategies</li><li>Be skilled in analyzing large financial datasets for signals in mid- to high-frequency trading</li><li>Demonstrate exceptional mathematical proficiency</li><li>Possess a passion for solving complex mathematical challenges</li><li>Be proficient in statistical languages/packages such as R, Python, or similar tools</li></ul>","Acquire Me · New York, United States (Hybrid)","https://www.linkedin.com/jobs/view/3828219967/","New York, United States","Skills: Quantitative Research, Analytical Skills, +8 more","11-50 employees · Staffing and Recruiting","LISTED","200107747","Acquire Me","https://media.licdn.com/dms/image/C4E0BAQEW2q-DTIXkQA/company-logo_400_400/0/1638548572631/acquireme_logo?e=1722470400&v=beta&t=YwXQVfSa3j7QINCm3hMCwxYJ2XLg2ZzJJQ2BkB861tg","2024-02-12T20:36:56.000Z","2024-04-30T00:08:16.455Z"
