"Title","Description","Description HTML","Primary Description","Detail URL","Location","Skill","Insight","Job State","Poster Id","Company Name","Company Logo","Created At","Scraped At"
"Senior Data Analyst, Platform Product","ABOUT ROCKET MONEY 🔮Rocket Money’s mission is to empower people to live their best financial lives. Rocket Money offers members a unique understanding of their finances and a suite of valuable services that save them time and money – ultimately giving them a leg up on their financial journey.
We’re looking for a Senior Data Analyst with expertise in monetization and/or user onboarding analytics to join our growing team. As a member of the Rocket Money Data team, you’ll collaborate closely with product and engineering teams to foster a culture of data-driven decision-making across the organizations. As a senior individual contributor, you’ll proactively work with the product teams to recommend how we analyze the performance of the onboarding and monetization funnel and drive strategies for growth.
You’ll partner with colleagues across, Product, Engineering, Research, CRM, and Data, to build a mature set of reporting and analytics. This requires being forward-looking and thinking through the team and company’s initiatives to better understand user journey behavior, while building tooling and frameworks that not only measure performance, but also ladder up to key company KPIs.

ABOUT THE ROLE 🤹In this role, you will:Independently lead the analysis for our Platform product group; focusing on user onboarding and monetization performance metrics such as onboarding completion rates, ASP, and payments.Leverage your expertise in user onboarding and/or monetization to identify trends, patterns, and anomalies in our data, and ultimately help provide actionable insights to inform and recommend strategies to optimize product offerings and customer experiences.Be the expert on new user journey and monetization data, understanding the nitty gritty details of the program, and partnering with Analytics Engineering to ensure accurate and timely availability of data for analysis.Form strong relationships between Data Analytics and the Product teams by proactively identifying and driving analytics projects that help inform the strategic direction and becoming an integral part of the product planning process.Float from thinking about big strategic data questions to getting your hands dirty building out the processes, systems, and ultimately analyses to answer those questions. Be the person responsible for ongoing maintenance of what you have built.Translate complex analytical findings into clear and concise reports, dashboards, and presentations for stakeholders at all levels of the organization.Continue to improve our culture of experimentation. You’ll be the go-to person for the product platform team to guide the design of experiments and jump in to analyze particularly complex or important experiments yourself. Within the data team, you’ll help us think of new ways to improve our experimentation systems and processes across the company.

 ABOUT YOU 🦄5+ years of experience in the analytics space, taking on progressively more complex work and senior roles.Experience in SAAS companies and particularly around user onboarding, user journey flows, and/or monetization analytics.Have a good understanding of experimental design and statistics and can leverage that for analysis and assessment of A/B tests.Intuitively understand how to measure a monetization and users journeys and how various KPIs are interrelated.Have a strong SQL background. You are comfortable spinning up a quick analysis or proof of concept data model.Expertise in data visualization tools (e.g., Looker, Tableau, Power BI).Excellent communication skills, with the ability to explain complex analytical findings to non-technical stakeholders and comfortable speaking with senior/executive level leadership.
Bonus points if:Experience with our stack (BigQuery/GCP, Fivetran, Looker, Amplitude)Proficient in using python and R for statistical analysis

WE OFFER 💫Health, Dental & Vision PlansCompetitive PayMatching 401kUnlimited PTOLunch dailySnacks, Kombucha & Coffee on tapCommuter benefits

Additional information: Salary range of $125,000 - $150,000 + bonus + benefits. Base pay offered may vary depending on job-related knowledge, skills, and experience.
Rocket Money, Inc. is an Affirmative Action and Equal Opportunity Employer. All qualified applicants will receive consideration for employment without regard to race, color, religion, sex, sexual orientation, gender identity, national origin, or protected veteran status and will not be discriminated against on the basis of disability.
Pursuant to the San Francisco Fair Chance Ordinance, we will consider for employment qualified applicants with arrest and conviction records.","<p><strong>ABOUT ROCKET MONEY �</strong></p><p>�Rocket Money’s mission is to empower people to live their best financial lives. Rocket Money offers members a unique understanding of their finances and a suite of valuable services that save them time and money – ultimately giving them a leg up on their financial journey</p><p>.</p><p>
We’re looking for a Senior Data Analyst with expertise in monetization and/or user onboarding analytics to join our growing team. As a member of the Rocket Money Data team, you’ll collaborate closely with product and engineering teams to foster a culture of data-driven decision-making across the organizations. As a senior individual contributor, you’ll proactively work with the product teams to recommend how we analyze the performance of the onboarding and monetization funnel and drive strategies for growth</p><p>.</p><p>
You’ll partner with colleagues across, Product, Engineering, Research, CRM, and Data, to build a mature set of reporting and analytics. This requires being forward-looking and thinking through the team and company’s initiatives to better understand user journey behavior, while building tooling and frameworks that not only measure performance, but also ladder up to key company KPIs</p><p>.</p><p>
</p><p><strong>
ABOUT THE ROLE </strong></p><p>🤹In this role, you wil</p><ul><li>l:Independently lead the analysis for our Platform product group; focusing on user onboarding and monetization performance metrics such as onboarding completion rates, ASP, and payment</li><li>s.Leverage your expertise in user onboarding and/or monetization to identify trends, patterns, and anomalies in our data, and ultimately help provide actionable insights to inform and recommend strategies to optimize product offerings and customer experience</li><li>s.Be the expert on new user journey and monetization data, understanding the nitty gritty details of the program, and partnering with Analytics Engineering to ensure accurate and timely availability of data for analysi</li><li>s.Form strong relationships between Data Analytics and the Product teams by proactively identifying and driving analytics projects that help inform the strategic direction and becoming an integral part of the product planning proces</li><li>s.Float from thinking about big strategic data questions to getting your hands dirty building out the processes, systems, and ultimately analyses to answer those questions. Be the person responsible for ongoing maintenance of what you have buil</li><li>t.Translate complex analytical findings into clear and concise reports, dashboards, and presentations for stakeholders at all levels of the organizatio</li><li>n.Continue to improve our culture of experimentation. You’ll be the go-to person for the product platform team to guide the design of experiments and jump in to analyze particularly complex or important experiments yourself. Within the data team, you’ll help us think of new ways to improve our experimentation systems and processes across the compan</li></ul><p>y</p><p>.</p><p><strong>

 ABOUT YOU</strong></p><ul><li> 🦄5+ years of experience in the analytics space, taking on progressively more complex work and senior rol</li><li>es.Experience in SAAS companies and particularly around user onboarding, user journey flows, and/or monetization analyti</li><li>cs.Have a good understanding of experimental design and statistics and can leverage that for analysis and assessment of A/B tes</li><li>ts.Intuitively understand how to measure a monetization and users journeys and how various KPIs are interrelat</li><li>ed.Have a strong SQL background. You are comfortable spinning up a quick analysis or proof of concept data mod</li><li>el.Expertise in data visualization tools (e.g., Looker, Tableau, Power B</li><li>I).Excellent communication skills, with the ability to explain complex analytical findings to non-technical stakeholders and comfortable speaking with senior/executive level leadersh</li></ul><p>i</p><p>p.
Bonus points </p><ul><li>if:Experience with our stack (BigQuery/GCP, Fivetran, Looker, Amplitu</li><li>de)Proficient in using python and R for statistical analy</li></ul><p>s</p><p>i</p><p><strong>s

WE OFFE</strong></p><ul><li>R 💫Health, Dental & Vision P</li><li>lansCompetitive</li><li> PayMatching </li><li>401kUnlimited</li><li> PTOLunch d</li><li>ailySnacks, Kombucha & Coffee on</li><li> tapCommuter bene</li></ul><p>f</p><p>i</p><p>ts

Additional information: Salary range of $125,000 - $150,000 + bonus + benefits. Base pay offered may vary depending on job-related knowledge, skills, and experie</p><p>n</p><p>ce.
Rocket Money, Inc. is an Affirmative Action and Equal Opportunity Employer. All qualified applicants will receive consideration for employment without regard to race, color, religion, sex, sexual orientation, gender identity, national origin, or protected veteran status and will not be discriminated against on the basis of disabil</p><p>i</p><p>ty.
Pursuant to the San Francisco Fair Chance Ordinance, we will consider for employment qualified applicants with arrest and conviction reco</p>rds.","Rocket Money · United States (Remote)","https://www.linkedin.com/jobs/view/3870701847/","United States","Skills: Analytics, Key Performance Indicators, +8 more","201-500 employees · Financial Services","LISTED","691218236","Rocket Money","https://media.licdn.com/dms/image/C4E0BAQEIvwsuURIwfg/company-logo_400_400/0/1660582160116/truebill_logo?e=1722470400&v=beta&t=mkAs0XNwLxiSYWm9oAkJQuX0vg0DCVmJVBBIbCSUEl0","2024-03-27T22:20:17.000Z","2024-04-30T00:08:16.455Z"
"Data Analyst","About Stripe

Stripe is a financial infrastructure platform for businesses. Millions of companies—from the world’s largest enterprises to the most ambitious startups—use Stripe to accept payments, grow their revenue, and accelerate new business opportunities. Our mission is to increase the GDP of the internet, and we have a staggering amount of work ahead. That means you have an unprecedented opportunity to put the global economy within everyone’s reach while doing the most important work of your career.

About The Team

Data Science at Stripe is a vibrant community where data analysts, data scientists and engineers learn and grow together. You will work with some of Stripe’s most fundamental and exciting data, and use that data to help drive company-wide initiatives. We have a variety of Data Analytics roles and teams across Stripe and will seek to align you to the most relevant team based on your background.

What you'll do

In this role, you will partner deeply with teams across Stripe to ensure that our users, our products, and our business have the models, data products, and insights needed to make decisions and grow responsibly. You will work closely with partners to extract insights from Stripe's rich and complex data. You will also work with leaders to translate business needs into data problems. You will build metrics, scalable data pipelines, dashboards, and reports to inform and run the business. You will deliver actionable business recommendations through analyses and data storytelling.

Who you are

We’re looking for someone who meets the minimum requirements to be considered for the role. If you meet these requirements, you are encouraged to apply. The preferred qualifications are a bonus, not a requirement.

Minimum Requirements

2-8+ years experience in Business Intelligence Engineering, Data Engineering, Data Analysis or Data Science roles, building data pipelines and analyzing large datasets to solve problemsProficiency in SQL and PythonStrong statistical knowledgeExpertise in visualization and using data insights to make recommendations and achieve goalsProven ability to manage and deliver on multiple projects with great attention to detailAbility to clearly communicate results and drive impactComfortable collaborating across functions to identify data analytics problems and execute solutions with technical rigor and data-driven insights.


Preferred Qualifications

Master’s degree in Mathematics, Statistics, Economics, Engineering, or a related technical field.Prior experience at a growth stage internet or software company.Experience with distributed data frameworks like Hadoop and Spark to write and debug data pipelines.Good understanding of development processes and best practices like engineering standards, code reviews, and testing.


Hybrid work at Stripe

This role is available either in an office or a remote location (typically, 35+ miles or 56+ km from a Stripe office).

Office-assigned Stripes spend at least 50% of the time in a given month in their local office or with users. This hits a balance between bringing people together for in-person collaboration and learning from each other, while supporting flexibility about how to do this in a way that makes sense for individuals and their teams.

A remote location, in most cases, is defined as being 35 miles (56 kilometers) or more from one of our offices. While you would be welcome to come into the office for team/business meetings, on-sites, meet-ups, and events, our expectation is you would regularly work from home rather than a Stripe office. Stripe does not cover the cost of relocating to a remote location. We encourage you to apply for roles that match the location where you currently or plan to live.

Pay and benefits

The annual US base salary range for this role is $121,800 - $220,300. For sales roles, the range provided is the role’s On Target Earnings (""OTE"") range, meaning that the range includes both the sales commissions/sales bonuses target and annual base salary for the role. This salary range may be inclusive of several career levels at Stripe and will be narrowed during the interview process based on a number of factors, including the candidate’s experience, qualifications, and location. Applicants interested in this role and who are not located in the US may request the annual salary range for their location during the interview process.

Additional benefits for this role may include: equity, company bonus or sales commissions/bonuses; 401(k) plan; medical, dental, and vision benefits; and wellness stipends.","<strong>About Stripe

</strong>Stripe is a financial infrastructure platform for businesses. Millions of companies—from the world’s largest enterprises to the most ambitious startups—use Stripe to accept payments, grow their revenue, and accelerate new business opportunities. Our mission is to increase the GDP of the internet, and we have a staggering amount of work ahead. That means you have an unprecedented opportunity to put the global economy within everyone’s reach while doing the most important work of your career.

<strong>About The Team

</strong>Data Science at Stripe is a vibrant community where data analysts, data scientists and engineers learn and grow together. You will work with some of Stripe’s most fundamental and exciting data, and use that data to help drive company-wide initiatives. We have a variety of Data Analytics roles and teams across Stripe and will seek to align you to the most relevant team based on your background.

What you'll do

In this role, you will partner deeply with teams across Stripe to ensure that our users, our products, and our business have the models, data products, and insights needed to make decisions and grow responsibly. You will work closely with partners to extract insights from Stripe's rich and complex data. You will also work with leaders to translate business needs into data problems. You will build metrics, scalable data pipelines, dashboards, and reports to inform and run the business. You will deliver actionable business recommendations through analyses and data storytelling.

Who you are

We’re looking for someone who meets the minimum requirements to be considered for the role. If you meet these requirements, you are encouraged to apply. The preferred qualifications are a bonus, not a requirement.

<strong>Minimum Requirements

</strong><ul><li>2-8+ years experience in Business Intelligence Engineering, Data Engineering, Data Analysis or Data Science roles, building data pipelines and analyzing large datasets to solve problems</li><li>Proficiency in SQL and Python</li><li>Strong statistical knowledge</li><li>Expertise in visualization and using data insights to make recommendations and achieve goals</li><li>Proven ability to manage and deliver on multiple projects with great attention to detail</li><li>Ability to clearly communicate results and drive impact</li><li>Comfortable collaborating across functions to identify data analytics problems and execute solutions with technical rigor and data-driven insights.


</li></ul><strong>Preferred Qualifications

</strong><ul><li>Master’s degree in Mathematics, Statistics, Economics, Engineering, or a related technical field.</li><li>Prior experience at a growth stage internet or software company.</li><li>Experience with distributed data frameworks like Hadoop and Spark to write and debug data pipelines.</li><li>Good understanding of development processes and best practices like engineering standards, code reviews, and testing.


</li></ul>Hybrid work at Stripe

This role is available either in an office or a remote location (typically, 35+ miles or 56+ km from a Stripe office).

Office-assigned Stripes spend at least 50% of the time in a given month in their local office or with users. This hits a balance between bringing people together for in-person collaboration and learning from each other, while supporting flexibility about how to do this in a way that makes sense for individuals and their teams.

A remote location, in most cases, is defined as being 35 miles (56 kilometers) or more from one of our offices. While you would be welcome to come into the office for team/business meetings, on-sites, meet-ups, and events, our expectation is you would regularly work from home rather than a Stripe office. Stripe does not cover the cost of relocating to a remote location. We encourage you to apply for roles that match the location where you currently or plan to live.

Pay and benefits

The annual US base salary range for this role is $121,800 - $220,300. For sales roles, the range provided is the role’s On Target Earnings (""OTE"") range, meaning that the range includes both the sales commissions/sales bonuses target and annual base salary for the role. This salary range may be inclusive of several career levels at Stripe and will be narrowed during the interview process based on a number of factors, including the candidate’s experience, qualifications, and location. Applicants interested in this role and who are not located in the US may request the annual salary range for their location during the interview process.

Additional benefits for this role may include: equity, company bonus or sales commissions/bonuses; 401(k) plan; medical, dental, and vision benefits; and wellness stipends.","Stripe · United States (Remote)","https://www.linkedin.com/jobs/view/3802580013/","United States","6 of 10 skills match your profile - you may be a good fit","1,001-5,000 employees · Technology, Information and Internet
14 school alumni work here","LISTED","113060463","Stripe","https://media.licdn.com/dms/image/C560BAQF1NNJs-2xA5g/company-logo_400_400/0/1630643399686/stripe_logo?e=1722470400&v=beta&t=_anhm8BD_E51tVAjD_PGLO7ifYuKaCraAEhmDxaYXPc","2024-01-10T05:03:34.000Z","2024-04-30T00:08:16.455Z"
