"Title","Description","Description HTML","Primary Description","Detail URL","Location","Skill","Insight","Job State","Poster Id","Company Name","Company Logo","Created At","Scraped At"
"Lead UX Quant Researcher","Turo is the world’s largest car sharing marketplace where you can book the perfect car for wherever you’re going from a vibrant community of trusted hosts across the US, UK, Canada, Australia, and France. Whether you're flying in from afar or looking for a car down the street, searching for a rugged truck or something smooth and swanky, Turo puts you in the driver's seat of an extraordinary selection of cars shared by local hosts.

About The Role

We are hiring a Lead UX Quant Researcher who will be the first quantitative researcher at Turo. We are excited for this person to bring a new level of discipline and expertise, elevate the impact of research, and evangelize the benefits of quantitative research. You will be joining a team of five qualitative researchers and one research operations specialist.

As the newest member of our growing research team, you will also influence the culture and vision of UX Research at Turo, and help us optimize our tools and process as we strive to execute best-in-class research and consistently deliver breakthrough insights.

What You’ll Do

Research Planning: Collaborate with UX researchers, product managers, data analysts, and designers to define research objectives, hypotheses, and key performance indicators (KPIs) for quantitative studies.Data Collection: Design and implement surveys, experiments, A/B tests, and other quantitative research methods to gather user insights and data.Data Analysis: Analyze large datasets to identify patterns, trends, and correlations that provide actionable insights into user behavior and satisfaction.User Segmentation: Create user segments and personas based on quantitative data to inform product strategies and personalized user experiences.Usability Metrics: Develop and track usability metrics, including task success rates, error rates, and task completion times.Competitive Analysis: Conduct competitive analysis to benchmark Turo's user experience against industry standards and identify opportunities for improvement.Reporting: Prepare and present clear, concise, and actionable reports of research findings to stakeholders, including recommendations for product enhancements.Cross-functional Collaboration: Collaborate with UX researchers, designers, data scientists, engineers, and product managers to drive user-centered decisions and solutions.Continuous Learning: Stay current with industry best practices and emerging trends in quantitative user experience research to ensure Turo remains at the forefront of user-centered design.

Your Profile

6+ years of professional experience with 4 of those years of practical UX research experience with experience testing consumer software across multiple surfaces (Desktop, Mobile Web, iOS and, Android)Proven experience in quantitative user experience research, with a strong portfolio of successful projects.Proficiency in statistical analysis tools such as R, Python, SQL, or similar.Experience with survey design, usability testing, experimentation, and A/B testing.Excellent communication and presentation skills.Ability to work effectively in a fast-paced, collaborative, and agile environment.

Bonus If You Have

Masters or PhD in a relevant field (e.g., Human-Computer Interaction, Psychology, Data Science, Statistics). Experience conducting research for consumer marketplaces, transportation or travel.A passion and history of mentoring and coaching other researchers on quantitative methods.Has been the first quantitative researcher on a team or at an organization in the past.Familiarity with car-sharing or mobility-related industries. 

Why you’ll love being a part of our team:

At Turo, there's no need to sell the value of user research; we're already devotees. We're pioneering, challenging the status quo, and always striving to try new things without fear of failure.We're efficient, letting data inform our decisions and prioritizing our work based on impact.We're supportive, always striving to connect, collaborate, and lift each other up.We're down-to-earth, leading confidently without arrogance, and maintaining humility in our work, our culture, and our product.We are a high-growth company with strong financial performance and plentiful opportunities for career growth.

The San Francisco base salary target range for this full-time position is $176,000 - $198,000 + equity + benefits. Our salary ranges are determined by role, level, and location. The range displayed on each job posting reflects the minimum and maximum target for new hire salaries for the position in this location. Within the range, individual pay is determined by work location and additional factors, including job-related skills, experience, and relevant education or training. Your recruiter can share more about the specific salary range for your work location during the hiring process.

Benefits

Competitive salary, equity, benefits, and perks for all full-time employeesEmployer-paid medical, dental, and vision insurance (Country specific)Retirement employer match$2,000 Learning & Development stipend to invest in your professional development$1,000 USD Turo host matching and $1,500 USD vehicle reimbursement program$100 USD Monthly Turo travel creditCell phone, internet and Fringe benefit stipendPaid time off to relax and rechargePaid holidays, volunteer time off, and parental leaveFor those who are in the office full-time or hybrid we have weekly in-office lunch, office snacks, and fun activitiesAnnual Turbo Week (week-long, company-wide conference)

We are committed to building a diverse team. If you are from a background that's underrepresented in tech, we'd love to meet you.

Aside from an award winning work environment and the opportunity to be part of the world’s largest car sharing marketplace, we are also growing the team quickly - join us! Even if you don't meet every qualification, we are looking for people with enthusiasm for what we do and we will consider you for this and other possibilities.

Turo is an Equal Opportunity Employer and a participant in the U.S. Federal E-Verify program. Women, minorities, individuals with disabilities and protected veterans are encouraged to apply. We welcome people of different backgrounds, experiences, abilities and perspectives.

Turo will consider qualified applicants with criminal histories in a manner consistent with the San Francisco Fair Chance Ordinance, as applicable.

We welcome candidates with physical, mental, and/or neurological disabilities. If you require assistance applying for an open position, or need accommodation during the recruiting process due to a disability, please submit a request to People Operations by emailing PeopleOps@turo.com.

About Turo

Turo is the world’s largest car sharing marketplace where you can book the perfect car for wherever you’re going from a vibrant community of trusted hosts across the US, UK, Canada, Australia, and France. Whether you're flying in from afar or looking for a car down the street, searching for a rugged truck or something smooth and swanky, Turo puts you in the driver's seat of an extraordinary selection of cars shared by local hosts.

Discover Turo at https://turo.com, the App Store, and Google Play, and check out our blog, Field Notes.

Read more about the Turo culture according to Turo CEO, Andre Haddad.

","Turo is the world’s largest car sharing marketplace where you can book the perfect car for wherever you’re going from a vibrant community of trusted hosts across the US, UK, Canada, Australia, and France. Whether you're flying in from afar or looking for a car down the street, searching for a rugged truck or something smooth and swanky, Turo puts you in the driver's seat of an extraordinary selection of cars shared by local hosts.

<strong>About The Role

</strong>We are hiring a Lead UX Quant Researcher who will be the first quantitative researcher at Turo. We are excited for this person to bring a new level of discipline and expertise, elevate the impact of research, and evangelize the benefits of quantitative research. You will be joining a team of five qualitative researchers and one research operations specialist.

As the newest member of our growing research team, you will also influence the culture and vision of UX Research at Turo, and help us optimize our tools and process as we strive to execute best-in-class research and consistently deliver breakthrough insights.

<strong>What You’ll Do

</strong><ul><li>Research Planning: Collaborate with UX researchers, product managers, data analysts, and designers to define research objectives, hypotheses, and key performance indicators (KPIs) for quantitative studies.</li><li>Data Collection: Design and implement surveys, experiments, A/B tests, and other quantitative research methods to gather user insights and data.</li><li>Data Analysis: Analyze large datasets to identify patterns, trends, and correlations that provide actionable insights into user behavior and satisfaction.</li><li>User Segmentation: Create user segments and personas based on quantitative data to inform product strategies and personalized user experiences.</li><li>Usability Metrics: Develop and track usability metrics, including task success rates, error rates, and task completion times.</li><li>Competitive Analysis: Conduct competitive analysis to benchmark Turo's user experience against industry standards and identify opportunities for improvement.</li><li>Reporting: Prepare and present clear, concise, and actionable reports of research findings to stakeholders, including recommendations for product enhancements.</li><li>Cross-functional Collaboration: Collaborate with UX researchers, designers, data scientists, engineers, and product managers to drive user-centered decisions and solutions.</li><li>Continuous Learning: Stay current with industry best practices and emerging trends in quantitative user experience research to ensure Turo remains at the forefront of user-centered design.

</li></ul><strong>Your Profile

</strong><ul><li>6+ years of professional experience with 4 of those years of practical UX research experience with experience testing consumer software across multiple surfaces (Desktop, Mobile Web, iOS and, Android)</li><li>Proven experience in quantitative user experience research, with a strong portfolio of successful projects.</li><li>Proficiency in statistical analysis tools such as R, Python, SQL, or similar.</li><li>Experience with survey design, usability testing, experimentation, and A/B testing.</li><li>Excellent communication and presentation skills.</li><li>Ability to work effectively in a fast-paced, collaborative, and agile environment.

</li></ul><strong>Bonus If You Have

</strong><ul><li>Masters or PhD in a relevant field (e.g., Human-Computer Interaction, Psychology, Data Science, Statistics). </li><li>Experience conducting research for consumer marketplaces, transportation or travel.</li><li>A passion and history of mentoring and coaching other researchers on quantitative methods.</li><li>Has been the first quantitative researcher on a team or at an organization in the past.</li><li>Familiarity with car-sharing or mobility-related industries. 

</li></ul><strong>Why you’ll love being a part of our team:

</strong><ul><li>At Turo, there's no need to sell the value of user research; we're already devotees. </li><li>We're pioneering, challenging the status quo, and always striving to try new things without fear of failure.</li><li>We're efficient, letting data inform our decisions and prioritizing our work based on impact.</li><li>We're supportive, always striving to connect, collaborate, and lift each other up.</li><li>We're down-to-earth, leading confidently without arrogance, and maintaining humility in our work, our culture, and our product.</li><li>We are a high-growth company with strong financial performance and plentiful opportunities for career growth.

</li></ul>The San Francisco base salary target range for this full-time position is $176,000 - $198,000 + equity + benefits. Our salary ranges are determined by role, level, and location. The range displayed on each job posting reflects the minimum and maximum target for new hire salaries for the position in this location. Within the range, individual pay is determined by work location and additional factors, including job-related skills, experience, and relevant education or training. Your recruiter can share more about the specific salary range for your work location during the hiring process.

<strong>Benefits

</strong><ul><li>Competitive salary, equity, benefits, and perks for all full-time employees</li><li>Employer-paid medical, dental, and vision insurance (Country specific)</li><li>Retirement employer match</li><li>$2,000 Learning & Development stipend to invest in your professional development</li><li>$1,000 USD Turo host matching and $1,500 USD vehicle reimbursement program</li><li>$100 USD Monthly Turo travel credit</li><li>Cell phone, internet and Fringe benefit stipend</li><li>Paid time off to relax and recharge</li><li>Paid holidays, volunteer time off, and parental leave</li><li>For those who are in the office full-time or hybrid we have weekly in-office lunch, office snacks, and fun activities</li><li>Annual Turbo Week (week-long, company-wide conference)

</li></ul>We are committed to building a diverse team. If you are from a background that's underrepresented in tech, we'd love to meet you.

Aside from an award winning work environment and the opportunity to be part of the world’s largest car sharing marketplace, we are also growing the team quickly - join us! Even if you don't meet every qualification, we are looking for people with enthusiasm for what we do and we will consider you for this and other possibilities.

Turo is an Equal Opportunity Employer and a participant in the U.S. Federal E-Verify program. Women, minorities, individuals with disabilities and protected veterans are encouraged to apply. We welcome people of different backgrounds, experiences, abilities and perspectives.

Turo will consider qualified applicants with criminal histories in a manner consistent with the San Francisco Fair Chance Ordinance, as applicable.

We welcome candidates with physical, mental, and/or neurological disabilities. If you require assistance applying for an open position, or need accommodation during the recruiting process due to a disability, please submit a request to People Operations by emailing PeopleOps@turo.com.

<strong>About Turo

</strong>Turo is the world’s largest car sharing marketplace where you can book the perfect car for wherever you’re going from a vibrant community of trusted hosts across the US, UK, Canada, Australia, and France. Whether you're flying in from afar or looking for a car down the street, searching for a rugged truck or something smooth and swanky, Turo puts you in the driver's seat of an extraordinary selection of cars shared by local hosts.

Discover Turo at https://turo.com, the App Store, and Google Play, and check out our blog, Field Notes.

Read more about the Turo culture according to Turo CEO, Andre Haddad.

","Turo · San Francisco, CA (Hybrid)","https://www.linkedin.com/jobs/view/3762336796/","San Francisco, California, United States","Skills: UX Research, User Experience (UX), +8 more","501-1,000 employees · Technology, Information and Internet
4 school alumni work here","LISTED","14556538","Turo","https://media.licdn.com/dms/image/C560BAQFU0tg6hK11Ng/company-logo_400_400/0/1648590615368/turo_logo?e=1718841600&v=beta&t=1UcRgirz2W2mRu1p5WLK6dQ1aR4USk3mfc72EfTD2zA","2023-11-09T23:19:27.000Z","2024-03-21T16:00:21.346Z"
