"Title","Description","Description HTML","Primary Description","Detail URL","Location","Skill","Insight","Job State","Poster Id","Company Name","Company Logo","Created At","Scraped At"
"Database Marketing Performance Analyst","Agua Caliente Casinos, a collection of three award-winning casino, resort and entertainment destinations in the Coachella Valley, has an opportunity for a Database Marketing Performance Analyst to join their team! The opportunity is a full-time position, on-site in the Palm Springs, California area. 
Job Description Summary Database Marketing Performance Analyst The Database Marketing Performance Analyst tracks, analyzes and maintains all implemented marketing programs, offers and special events with emphasis on hosted and other premium players.
Essential Duties and Responsibilities (other duties may be assigned)Create and analyze ongoing reinvestment reporting for Marketing Efforts.Create and analyze reporting for Player Development programs for high end players.Create Pro Analysis for Promotions, Entertainment and Events.Create Analysis for ongoing Direct Mail, Promotions/Events, Entertainment and Email Offers.Responsible for maintaining database files on all aspects and activities of all direct marketing programs that enhance customer-loyalty, support strategic and tactical objectives that drive repeat business, increase brand recognition and recall, drive volume and increase revenue.Track and analyze direct marketing programs and prepare proformas and post analysis for promotions, tournaments and player recognition events for hosted and other premium players.Extract data and lists for marketing direct mail and promotional offers, with emphasis on hosted and other premium players.Create and Maintain Database Dashboards as needed for Marketing Programs.Coordinate with necessary external vendors and internal departments to ensure accuracy of Database.Maintain all customer list criterion and develop criteria for additional Marketing Programs.Maintain integrity of the database through data entry standardization and cleanliness programs. (Group one/Group One or similar products)Provide excellent guest service.Must comply with all applicable System of Internal Controls, Standard Operating Procedures and all Tribal Regulations.
Qualifications: Database Marketing Performance AnalystRequired Education and/or ExperienceMinimum of an Associates degree (AA) or equivalent from a two-year college or technical school; or at least three (3) years’ experience in a Marketing Department, Casino Marketing Department, or Casino Finance Department.Database Marketing experience required.Strong analytical and problem-solving skill required.Must be able to use and understand SQL, Excel and other Microsoft Office Suite products.Strong technical skills with the demonstrated ability to learn computer languages and /or software systems.Knowledge of Casino Operations database management Knowledge of Casino Operations database management Experience with reporting or query programming language, other relational databases, and /or related software packages; demonstrated ability to learn other computer languages and /or software systems.
 Working Conditions/Physical DemandsTo perform this job successfully, the individual must be able to stand, move and work throughout theoffice area and properties, including walking up to 1 mile, climbing stairs and sitting at a desk/workstation for the duration of the shift. The individual may also be subjected to a smoke-filled environment.Typically, the individual will be housed in an office environment. The noise level in the work environment is usually moderate, but will escalate when located in the casino environment. The individual must be able to grasp, bend, lift and/or carry or otherwise move goods weighing a minimum of 25 lbs. on an intermittent basis, and sufficient dexterity of hand in order to use office equipment including, but not limited to: a computer keyboard, calculator, general office equipment and multi-line telephone.","<p><strong>Agua Caliente Casinos, a collection of three award-winning casino, resort and entertainment destinations in the Coachella Valley, has an opportunity for a Database Marketing Performance Analyst to join their team! The opportunity is a full-time position, on-site in the Palm Springs, California area. </strong></p><p>
</p><p><undefined><strong>Job Description Summary Database Marketing Performance Analyst </undefined></strong></p><p>The Database Marketing Performance Analyst tracks, analyzes and maintains all implemented marketing programs, offers and special events with emphasis on hosted and other premium players.</p><p>
</p><p><undefined><strong>Essential Duties and Responsibilities</undefined></strong><undefined> (other duties may be assigned)</undefined></p><ul><li>Create and analyze ongoing reinvestment reporting for Marketing Efforts.</li><li>Create and analyze reporting for Player Development programs for high end players.</li><li>Create Pro Analysis for Promotions, Entertainment and Events.</li><li>Create Analysis for ongoing Direct Mail, Promotions/Events, Entertainment and Email Offers.</li><li>Responsible for maintaining database files on all aspects and activities of all direct marketing programs that enhance customer-loyalty, support strategic and tactical objectives that drive repeat business, increase brand recognition and recall, drive volume and increase revenue.</li><li>Track and analyze direct marketing programs and prepare proformas and post analysis for promotions, tournaments and player recognition events for hosted and other premium players.</li><li>Extract data and lists for marketing direct mail and promotional offers, with emphasis on hosted and other premium players.</li><li>Create and Maintain Database Dashboards as needed for Marketing Programs.</li><li>Coordinate with necessary external vendors and internal departments to ensure accuracy of Database.</li><li>Maintain all customer list criterion and develop criteria for additional Marketing Programs.</li><li>Maintain integrity of the database through data entry standardization and cleanliness programs. (Group one/Group One or similar products)</li><li>Provide excellent guest service.</li><li>Must comply with all applicable System of Internal Controls, Standard Operating Procedures and all Tribal Regulations.</li></ul><p>
</p><p>Qualifications: Database Marketing Performance Analyst</p><p><undefined><strong>Required Education and/or Experience</undefined></strong></p><ul><li>Minimum of an Associates degree (AA) or equivalent from a two-year college or technical school; or at least three (3) years’ experience in a Marketing Department, Casino Marketing Department, or Casino Finance Department.</li><li>Database Marketing experience required.</li><li>Strong analytical and problem-solving skill required.</li><li>Must be able to use and understand SQL, Excel and other Microsoft Office Suite products.</li><li>Strong technical skills with the demonstrated ability to learn computer languages and /or software systems.</li><li>Knowledge of Casino Operations database management Knowledge of Casino Operations database management Experience with reporting or query programming language, other relational databases, and /or related software packages; demonstrated ability to learn other computer languages and /or software systems.</li></ul><p>
</p><p><undefined><strong> Working Conditions/Physical Demands</undefined></strong></p><p>To perform this job successfully, the individual must be able to stand, move and work throughout theoffice area and properties, including walking up to 1 mile, climbing stairs and sitting at a desk/workstation for the duration of the shift. The individual may also be subjected to a smoke-filled environment.</p><p>Typically, the individual will be housed in an office environment. The noise level in the work environment is usually moderate, but will escalate when located in the casino environment. The individual must be able to grasp, bend, lift and/or carry or otherwise move goods weighing a minimum of 25 lbs. on an intermittent basis, and sufficient dexterity of hand in order to use office equipment including, but not limited to: a computer keyboard, calculator, general office equipment and multi-line telephone.</p>","Agua Caliente Casinos","https://www.linkedin.com/jobs/view/3826269887/","Palm Springs, California, United States","Skills: SQL, Database Marketing, +2 more","1,001-5,000 employees","LISTED","148919266","Agua Caliente Casinos","https://media.licdn.com/dms/image/C560BAQGZOPScEgjPDg/company-logo_400_400/0/1677199890314/aguacalientecasinos_logo?e=1716422400&v=beta&t=BVFrSEahRuHoWCfVt0d2Te_brZhQNmjVtBCorqB7I9w","2024-02-14T00:45:48.000Z","2024-02-16T02:41:33.050Z"
"Amazon PPC Analyst","This person will manage a portion of our company's amazon advertising portfolios. They will be responsible for setting up campaigns, determining high-value keywords, setting bids and budgets, and analyzing the data daily to optimize and evolve the advertising strategy. Your analysis and recommendations will help make our marketing strategies more impactful and effective.ResponsibilitiesConduct Advertising campaign research and analysis related to competitive landscape, market trends, and business developmentDevelop keywords lists for campaignsUncover insights and make recommendations based off of this analysis and researchDistill complex marketing analysis into clear, simple presentationsTrack, analyze, and report advertising initiativesOptimize bids, budgets, campaign types within a portfolio to drive sales growth and optimize ad spendQualificationsBachelor's degree or equivalent experience1-2 years' experience holding an analytical roleAdvertising or PPC experience preferredAmazon experience preferredStrong analytical skills & an ability to make sense of large sets of dataProficient in Microsoft Office SuiteMust be organized, driven and reliablePlease note, this is an in-office position, 5 days a week. We are located off the Avenue P stop of the F train in Brooklyn, NY. Please only apply if this is a manageable commute for you.","<p>This person will manage a portion of our company's amazon advertising portfolios. They will be responsible for setting up campaigns, determining high-value keywords, setting bids and budgets, and analyzing the data daily to optimize and evolve the advertising strategy. Your analysis and recommendations will help make our marketing strategies more impactful and effective.</p><p><strong>Responsibilities</strong></p><ul><li>Conduct Advertising campaign research and analysis related to competitive landscape, market trends, and business development</li><li>Develop keywords lists for campaigns</li><li>Uncover insights and make recommendations based off of this analysis and research</li><li>Distill complex marketing analysis into clear, simple presentations</li><li>Track, analyze, and report advertising initiatives</li><li>Optimize bids, budgets, campaign types within a portfolio to drive sales growth and optimize ad spend</li></ul><p><strong>Qualifications</strong></p><ul><li>Bachelor's degree or equivalent experience</li><li>1-2 years' experience holding an analytical role</li><li>Advertising or PPC experience preferred</li><li>Amazon experience preferred</li><li>Strong analytical skills & an ability to make sense of large sets of data</li><li>Proficient in Microsoft Office Suite</li><li>Must be organized, driven and reliable</li></ul><p>Please note, this is an in-office position, 5 days a week. We are located off the Avenue P stop of the F train in Brooklyn, NY. Please only apply if this is a manageable commute for you.</p>","Real Essentials","https://www.linkedin.com/jobs/view/3828191861/","Brooklyn, New York, United States","Skills: Microsoft Office, Analytical Skills, +8 more","11-50 employees","LISTED","781055790","Real Essentials","https://media.licdn.com/dms/image/C560BAQH-0OZSmnAv-g/company-logo_400_400/0/1653063575521/realessentials_logo?e=1716422400&v=beta&t=-at8wOaq7qDT4mR9sln4CKlsdLtYGkPbDhPyWXz1QVM","2024-02-12T17:09:36.000Z","2024-02-16T02:41:33.050Z"
"Senior Analyst, Marketing","POSITION SNAPSHOT:We are seeking a highly motivated and experienced Senior Analyst to join our dynamic team. The Senior Analyst will play a key role in analyzing and interpreting data, providing valuable insights, and supporting strategic decision-making within the organization. You will need to possess strong analytical skills, a keen attention to detail, and the ability to communicate complex findings in a clear and actionable manner.
KEY RESPONSIBLE:Data Analysis:Conduct thorough and accurate data analysis using various tools and methodologies.Interpret complex datasets to identify trends, patterns, and insights.Collaborate with cross-functional teams to gather relevant data and ensure data accuracy.Reporting and Visualization:Generate clear and concise reports to communicate key findings to stakeholders.Create visually compelling dashboards and presentations to support decision-making.Utilize data visualization tools to enhance the understanding of analytical results.Strategic Insight:Provide strategic insights based on data analysis to support business objectives.Collaborate with leadership to identify opportunities for improvement and growth.Offer recommendations to optimize processes and drive efficiency.Forecasting and Modeling:Develop and maintain forecasting models to predict future trends and outcomes.Conduct scenario analysis to assess potential impacts on business operations.Monitor and analyze key performance indicators to track organizational performance.Cross-functional Collaboration:Work closely with departments across the organization to understand business needs.Collaborate with IT and other relevant teams to ensure data integrity and accessibility.Foster a collaborative and data-driven culture within the organization.QUALIFICATIONS:Bachelor's degree in a related field (e.g., Business, Economics, Statistics, or a relevant quantitative discipline).3+ experience as an Analyst, with a focus on data analysis and interpretation.Strong proficiency in data analysis tools (e.g., SQL, Python, R) and data visualization tools (e.g., Tableau, Power BI).Excellent analytical, problem-solving, and critical-thinking skills.Effective communication skills, with the ability to convey complex findings to non-technical stakeholders.Experience with forecasting and modeling is a plus.Ability to work independently and collaboratively in a fast-paced environment.
WHAT’S IN IT FOR ME?:Dave & Buster’s is an imaginative and dynamic company dedicated to creating innovative entertainment experiences that bring joy, laughter, and excitement to people of all ages. Our mission is to foster a culture of fun and creativity, and we take pride in our commitment to delivering memorable and unique entertainment solutions.
Exclusive discounts on food and games at D&B & Main Event.Paid Time Off (PTO) that increases with tenure.11 Company Holidays (Including your Birthday) & 2 Floating Holidays per year.Medical, dental, vision and voluntary benefits Part Time/Full Time benefits availableSub Benefits:Livongo, SurgeryPlus, and Telehealth benefits401k with company match following 6 months of employment.Buster’s Legacy Fund (Support Team Members during difficult Times)Employee Assistance Program (EAP) Offerings.Work out facility on-site.Employee Power Card | Free Video Games.
 We work hard, play hard and have FUN!","<p><undefined><strong>POSITION SNAPSHOT:</undefined></strong></p><p>We are seeking a highly motivated and experienced Senior Analyst to join our dynamic team. The Senior Analyst will play a key role in analyzing and interpreting data, providing valuable insights, and supporting strategic decision-making within the organization. You will need to possess strong analytical skills, a keen attention to detail, and the ability to communicate complex findings in a clear and actionable manner.</p><p>
</p><p><undefined><strong>KEY RESPONSIBLE:</undefined></strong></p><p><strong>Data Analysis:</strong></p><ul><li>Conduct thorough and accurate data analysis using various tools and methodologies.</li><li>Interpret complex datasets to identify trends, patterns, and insights.</li><li>Collaborate with cross-functional teams to gather relevant data and ensure data accuracy.</li></ul><p><strong>Reporting and Visualization:</strong></p><ul><li>Generate clear and concise reports to communicate key findings to stakeholders.</li><li>Create visually compelling dashboards and presentations to support decision-making.</li><li>Utilize data visualization tools to enhance the understanding of analytical results.</li></ul><p><strong>Strategic Insight:</strong></p><ul><li>Provide strategic insights based on data analysis to support business objectives.</li><li>Collaborate with leadership to identify opportunities for improvement and growth.</li><li>Offer recommendations to optimize processes and drive efficiency.</li></ul><p><strong>Forecasting and Modeling:</strong></p><ul><li>Develop and maintain forecasting models to predict future trends and outcomes.</li><li>Conduct scenario analysis to assess potential impacts on business operations.</li><li>Monitor and analyze key performance indicators to track organizational performance.</li></ul><p><strong>Cross-functional Collaboration:</strong></p><ul><li>Work closely with departments across the organization to understand business needs.</li><li>Collaborate with IT and other relevant teams to ensure data integrity and accessibility.</li><li>Foster a collaborative and data-driven culture within the organization.</li></ul><p><undefined><strong>QUALIFICATIONS:</undefined></strong></p><ul><li>Bachelor's degree in a related field (e.g., Business, Economics, Statistics, or a relevant quantitative discipline).</li><li>3+ experience as an Analyst, with a focus on data analysis and interpretation.</li><li>Strong proficiency in data analysis tools (e.g., SQL, Python, R) and data visualization tools (e.g., Tableau, Power BI).</li><li>Excellent analytical, problem-solving, and critical-thinking skills.</li><li>Effective communication skills, with the ability to convey complex findings to non-technical stakeholders.</li><li>Experience with forecasting and modeling is a plus.</li><li>Ability to work independently and collaboratively in a fast-paced environment.</li></ul><p>
</p><p><undefined><strong>WHAT’S IN IT FOR ME?:</undefined></strong></p><p>Dave & Buster’s is an imaginative and dynamic company dedicated to creating innovative entertainment experiences that bring joy, laughter, and excitement to people of all ages. Our mission is to foster a culture of fun and creativity, and we take pride in our commitment to delivering memorable and unique entertainment solutions.</p><p>
</p><ul><li>Exclusive discounts on food and games at D&B & Main Event.</li><li>Paid Time Off (PTO) that increases with tenure.</li><li>11 Company Holidays (Including your Birthday) & 2 Floating Holidays per year.</li><li>Medical, dental, vision and voluntary benefits </li><li>Part Time/Full Time benefits available</li><li>Sub Benefits:</li><li>Livongo, SurgeryPlus, and Telehealth benefits</li><li>401k with company match following 6 months of employment.</li><li>Buster’s Legacy Fund (Support Team Members during difficult Times)</li><li>Employee Assistance Program (EAP) Offerings.</li><li>Work out facility on-site.</li><li>Employee Power Card | <strong>Free Video Games.</strong></li></ul><p>
</p><p><strong> </strong></p><p><strong>We work hard, play hard and have FUN!</strong></p>","Dave & Buster's Inc.","https://www.linkedin.com/jobs/view/3784040793/","Dallas-Fort Worth Metroplex","Skills: Strategic Thinking, Python (Programming Language), +9 more","10,001+ employees · Restaurants
2 school alumni work here","LISTED","1082011144","Dave & Buster's Inc.","https://media.licdn.com/dms/image/C4E0BAQH8-QJ0ybNe4g/company-logo_400_400/0/1630654843265/daveandbusters_logo?e=1716422400&v=beta&t=y9q-igSCGLjwAqnt0fT0XBqNRbEfGFkK1nNQlwDlG0w","2023-12-18T22:17:27.000Z","2024-02-16T02:41:33.050Z"
