"Title","Description","Description HTML","Primary Description","Detail URL","Location","Skill","Insight","Job State","Poster Id","Company Name","Company Logo","Created At","Scraped At"
"Senior Market Research Analyst","JOOLA is for looking for an experienced Senior Market Research Analyst with a passion for growth and interest in pickleball and table tennis!
JOOLA was first established in 1952 and built a global reputation as a pioneer in table tennis. In 2022, JOOLA expanded into the rapidly growing pickleball scene and quickly attracted the biggest names in the sport. As an official table tennis sponsor for three Summer Olympic Games and the official sponsor of pickleball's top athletes and the Professional Pickleball Association (PPA), the team at JOOLA combines its storied expertise with fresh perspectives to bring innovation to both sports. JOOLA creates a variety of equipment, apparel, and accessories for both table tennis and pickleball players, professional and recreational. With offices in US, Germany, Brazil, and China, JOOLA has a global presence and wide distributor network.
We are seeking an experienced and analytical Senior Marketing Research Analyst to lead our market research efforts. The Senior Marketing Research Analyst will be responsible for designing and executing research studies, analyzing data, and providing actionable insights to support strategic marketing decisions. The ideal candidate will have a strong background in quantitative and qualitative research methods, excellent analytical skills, and the ability to communicate findings effectively to stakeholders.
Responsibilities:Design research studies to address key business questions and objectives, utilizing both qualitative and quantitative research methods.Work with Business intelligence team to synthesize quantitative and qualitative insights to develop action items in partnership with the marketing department.Analyze research data using statistical techniques, data visualization tools, and qualitative analysis methods.Identify patterns, trends, and insights from data to inform marketing strategy and decision-making.Monitor industry trends, competitive landscape, and market dynamics to identify opportunities and threats.Conduct detailed analyses and produce reports and presentations summarizing the findings of the analyses.Collaborate with marketing, product development, sales, and other departments to integrate research insights into strategic planning and decision-making processes.Support additional market research that would provide insight to JOOLA’s new opportunities in the market.Additional tasks as assigned.Requirements:Bachelor's degree in marketing, market research, statistics, business, or a related field; master's degree preferred.Minimum of 5 years of experience in marketing research or related roles, with a proven track record of leading research projects from conception to completion.Proficiency in quantitative research methods, statistical analysis software (e.g., SPSS, SAS, R), and data visualization tools (e.g., Tableau, Power BI).Strong analytical and critical thinking skills, with the ability to interpret complex data sets and draw actionable insights.Excellent written and verbal communication skills, with the ability to convey technical information to non-technical audiences.","<p>JOOLA is for looking for an experienced<strong> Senior Market Research Analyst</strong> with a passion for growth and interest in pickleball and table tennis!</p><p>
</p><p>JOOLA was first established in 1952 and built a global reputation as a pioneer in table tennis. In 2022, JOOLA expanded into the rapidly growing pickleball scene and quickly attracted the biggest names in the sport. As an official table tennis sponsor for three Summer Olympic Games and the official sponsor of pickleball's top athletes and the Professional Pickleball Association (PPA), the team at JOOLA combines its storied expertise with fresh perspectives to bring innovation to both sports. JOOLA creates a variety of equipment, apparel, and accessories for both table tennis and pickleball players, professional and recreational. With offices in US, Germany, Brazil, and China, JOOLA has a global presence and wide distributor network.</p><p>
</p><p>We are seeking an experienced and analytical Senior Marketing Research Analyst to lead our market research efforts. The Senior Marketing Research Analyst will be responsible for designing and executing research studies, analyzing data, and providing actionable insights to support strategic marketing decisions. The ideal candidate will have a strong background in quantitative and qualitative research methods, excellent analytical skills, and the ability to communicate findings effectively to stakeholders.</p><p>
</p><p><strong>Responsibilities:</strong></p><ul><li>Design research studies to address key business questions and objectives, utilizing both qualitative and quantitative research methods.</li><li>Work with Business intelligence team to synthesize quantitative and qualitative insights to develop action items in partnership with the marketing department.</li><li>Analyze research data using statistical techniques, data visualization tools, and qualitative analysis methods.</li><li>Identify patterns, trends, and insights from data to inform marketing strategy and decision-making.</li><li>Monitor industry trends, competitive landscape, and market dynamics to identify opportunities and threats.</li><li>Conduct detailed analyses and produce reports and presentations summarizing the findings of the analyses.</li><li>Collaborate with marketing, product development, sales, and other departments to integrate research insights into strategic planning and decision-making processes.</li><li>Support additional market research that would provide insight to JOOLA’s new opportunities in the market.</li><li>Additional tasks as assigned.</li></ul><p><strong>Requirements:</strong></p><ul><li>Bachelor's degree in marketing, market research, statistics, business, or a related field; master's degree preferred.</li><li>Minimum of 5 years of experience in marketing research or related roles, with a proven track record of leading research projects from conception to completion.</li><li>Proficiency in quantitative research methods, statistical analysis software (e.g., SPSS, SAS, R), and data visualization tools (e.g., Tableau, Power BI).</li><li>Strong analytical and critical thinking skills, with the ability to interpret complex data sets and draw actionable insights.</li><li>Excellent written and verbal communication skills, with the ability to convey technical information to non-technical audiences.</li></ul>","JOOLA","https://www.linkedin.com/jobs/view/3830509567/","Rockville, Maryland, United States","7 of 10 skills match your profile - you may be a good fit","51-200 employees","LISTED","442737619","JOOLA","https://media.licdn.com/dms/image/C4E0BAQE-Kz07LLd9hg/company-logo_400_400/0/1648837884331/joolaglobal_logo?e=1716422400&v=beta&t=yuBzI4uOy-lt-1j_Q4m7WBodHvmWaDzrCLAboQWlIl4","2024-02-14T20:26:51.000Z","2024-02-16T02:41:33.050Z"
"Marketing Analyst","Microplex Printware Corporation is looking for a full-time Marketing Analyst to join our team. Microplex has been in business since 1998, servicing clients nationally and internationally. We are a close-knit team that believes in being family-friendly and having a work-life balance. We are looking for a Marketing Analyst who will research and identify ways to build our brand and acquire new clients.  What can Microplex offer you?Competitive pay: $50,000 – $60,000/year, offer dependent on experienceAll benefits start day 1:Medical insuranceDental insuranceVision insurancePaid time offSimple IRA with annual company contributionSupplemental Insurance availableThe right candidate will have:Previous experience with PPC campaigns and be comfortable with processing and analyzing marketing dataAgency collaboration experienceExpertise in Google AnalyticsIn-depth understanding of SEM campaign strategies and SEO practicesPrevious experience as a Marketing Analyst or within similar roleBS in Marketing or relevant fieldLocated close to Solon preferable, but not requiredCreative and writing skillsGood knowledge of Microsoft ExcelAnalytical abilitiesOur Marketing Analyst will:Analyze sales funnels and customer intentMeasure performance of online and offline campaignsReport on marketing KPIs like leads, conversion rates, website traffic and social media engagementResearch consumer behavior and exploring market trends and opportunitiesTrack email campaign metrics (delivery, open, click-through rates)Monitor budget distribution and performance of paid ad campaignsConduct competitive research and analyze benchmarking dataRecommend website and campaign optimizationsResearch and implement marketing tools to support our promotional projects (direct marketing, social media scheduling, etc.)Work closely with sales and marketing teams to identify opportunities for new client acquisitionDoes this sound like the position for you? Apply with a current resume to join our team!","<p><strong>Microplex</strong> <strong>Printware Corporation</strong> is looking for a full-time<strong> Marketing Analyst </strong>to join our team. Microplex has been in business since 1998, servicing clients nationally and internationally. We are a close-knit team that believes in being family-friendly and having a work-life balance. We are looking for a Marketing Analyst who will research and identify ways to build our brand and acquire new clients. </p><p> </p><p><strong>What can Microplex offer you?</strong></p><ul><li><strong>Competitive pay:</strong> $50,000 – $60,000/year, offer dependent on experience</li></ul><p><strong>All benefits start day 1:</strong></p><ul><li>Medical insurance</li><li>Dental insurance</li><li>Vision insurance</li><li>Paid time off</li><li>Simple IRA with annual company contribution</li><li>Supplemental Insurance available</li></ul><p><strong>The right candidate will have:</strong></p><ul><li>Previous experience with PPC campaigns and be comfortable with processing and analyzing marketing data</li><li>Agency collaboration experience</li><li>Expertise in Google Analytics</li><li>In-depth understanding of SEM campaign strategies and SEO practices</li><li>Previous experience as a Marketing Analyst or within similar role</li><li>BS in Marketing or relevant field</li><li>Located close to Solon preferable, but not required</li><li>Creative and writing skills</li><li>Good knowledge of Microsoft Excel</li><li>Analytical abilities</li></ul><p><strong>Our Marketing Analyst will:</strong></p><ul><li>Analyze sales funnels and customer intent</li><li>Measure performance of online and offline campaigns</li><li>Report on marketing KPIs like leads, conversion rates, website traffic and social media engagement</li><li>Research consumer behavior and exploring market trends and opportunities</li><li>Track email campaign metrics (delivery, open, click-through rates)</li><li>Monitor budget distribution and performance of paid ad campaigns</li><li>Conduct competitive research and analyze benchmarking data</li><li>Recommend website and campaign optimizations</li><li>Research and implement marketing tools to support our promotional projects (direct marketing, social media scheduling, etc.)</li><li>Work closely with sales and marketing teams to identify opportunities for new client acquisition</li><i><strong><li>Does this sound like the position for you? Apply with a current resume to join our team!</i></strong></li></ul>","Microplex Printware","https://www.linkedin.com/jobs/view/3829265987/","Solon, Ohio, United States","Skills: Google Analytics","51-200 employees · IT Services and IT Consulting","LISTED","145391178","Microplex Printware","https://media.licdn.com/dms/image/C4D0BAQEVWguiKvx_Rw/company-logo_400_400/0/1639060318200/microplexprintware_logo?e=1716422400&v=beta&t=PvdFMEnS8rkggSEwqp8UlTujVLRiFGgTtINYrL8A1kE","2024-02-13T18:31:40.000Z","2024-02-16T02:41:33.050Z"
"Marketing Science Analyst (Hiring for April 2024)","Analytic Partners Recognized as a Leader by The Forrester Wave, Marketing Measurement & Optimization, Q3 2023 Report “Analytic Partners dominates with data-driven marketing insights.”

We are the Commercial Intelligence industry leader and the first to do it! We help brands use data to drive business growth, and we do this using a combination of technology and expert guidance that helps companies make the best possible decisions. Our Commercial Decision Platform GPS-Enterprise is the machine that turns data into actionable insights and our ROI Genome is our proprietary intelligence layer comprised of 20+ years of Analysis, Insights, and Learning. We measure the impact of Product, Sales, Operations, Customer Data and outside factors such as competitors, economic changes, seasonality, consumer mobility, and more to deliver impact. Our customers drive business growth by leveraging our technology and expert analyst!

We’re growing fast, with global operations across our full-service offices in New York City, Miami, Broomfield, Charlottesville, Dallas, Dublin, London, Paris, Hamburg, Munich, Sydney, Melbourne, Singapore, and Shanghai.

What You’ll Be Doing

Collect and analyze data related to consumer behavior, market trends, and campaign performance. Using proprietary tools and techniques to prep, mine and format customer data, analyze, produce models to develop insight dashboards and customer presentations.Develop and maintain statistical models that predict consumer behavior, campaign performance, and other key metrics. Collaborate as part of a team to drive analyses and insights, walking customers through dashboards and developing narratives that explain results and aid in more informed decisions and improved business performance.

What We Look For In You

Bachelor’s degree or above (ideal areas of study: Business Analytics and Management, Economics, Statistics, Mathematics, and/or Marketing)Recent graduates and those with 1-3 years of internship or professional work experience across any combination of advanced and predictive analytics, marketing analytics, and analytic techniques for marketing, customer, and business applications. Strong working knowledge of Microsoft PowerPoint and ExcelYou demonstrate analytical principles, strong problem-solving skills and attention to detail.Experience working independently on analytical tasks, building, and optimizing ‘big data’ data pipelines, architectures, and data sets.Comfortable working with a team developing and presenting presentations using insights derived from analytics.Experience using data to solve business questions and drive business solutions.You bring strong written and verbal communication appropriate for a professional work environment.

Our Leadership Values For Marketing Science Analysts and Company Culture:

Results Driven Anticipates roadblocks and appropriately seeks assistance to plan around them.Effective Communication Considers the audience and communicates appropriately.Accountability & Integrity Actively looks to offer ways to contribute during downtime.Creative Collaboration Builds relationships with team and contributes regularly.Harnessing Innovation Seeks opportunities to try out new approaches.

Our differentiator is – Our People! We hire the brightest talent and develop them into leaders. We foster a culture of PEOPLE, PASSION and GROWTH.

People: We value our people, customers, and partners

Passion: We love what we do

Growth: Unlimited growth means unlimited potential

AP is a customer-focused, team-oriented organization where innovation and results are rewarded, and individuals can chart the course of their own careers.

As a woman founded and led company, this has meant supporting a meritocracy where everyone has opportunities to achieve their best and ensure we foster an environment of diversity, equity, and inclusion. In practice this means we will not only work to recruit a diverse workforce, but also maximize the full potential of all of our people. You can read more about our commitment to DEI here

Additionally, Analytic Partners participates in the E-Verify program in certain locations, as required by law.

Country Specific Benefits

We provide comprehensive benefits package that includes medical, dental, vision, 401k matching, commuter benefits, gym membership reimbursement, open PTO, and company paid holidays.

","Analytic Partners Recognized as a Leader by The Forrester Wave, Marketing Measurement & Optimization, Q3 2023 Report “Analytic Partners dominates with data-driven marketing insights.”

We are the Commercial Intelligence industry leader and the first to do it! We help brands use data to drive business growth, and we do this using a combination of technology and expert guidance that helps companies make the best possible decisions. Our Commercial Decision Platform GPS-Enterprise is the machine that turns data into actionable insights and our ROI Genome is our proprietary intelligence layer comprised of 20+ years of Analysis, Insights, and Learning. We measure the impact of Product, Sales, Operations, Customer Data and outside factors such as competitors, economic changes, seasonality, consumer mobility, and more to deliver impact. Our customers drive business growth by leveraging our technology and expert analyst!

We’re growing fast, with global operations across our full-service offices in New York City, Miami, Broomfield, Charlottesville, Dallas, Dublin, London, Paris, Hamburg, Munich, Sydney, Melbourne, Singapore, and Shanghai.

<strong>What You’ll Be Doing

</strong><ul><li>Collect and analyze data related to consumer behavior, market trends, and campaign performance. Using proprietary tools and techniques to prep, mine and format customer data, analyze, produce models to develop insight dashboards and customer presentations.</li><li>Develop and maintain statistical models that predict consumer behavior, campaign performance, and other key metrics. </li><li>Collaborate as part of a team to drive analyses and insights, walking customers through dashboards and developing narratives that explain results and aid in more informed decisions and improved business performance.

</li></ul><strong>What We Look For In You

</strong><ul><li>Bachelor’s degree or above (ideal areas of study: Business Analytics and Management, Economics, Statistics, Mathematics, and/or Marketing)</li><li>Recent graduates and those with 1-3 years of internship or professional work experience across any combination of advanced and predictive analytics, marketing analytics, and analytic techniques for marketing, customer, and business applications. </li><li>Strong working knowledge of Microsoft PowerPoint and Excel</li><li>You demonstrate analytical principles, strong problem-solving skills and attention to detail.</li><li>Experience working independently on analytical tasks, building, and optimizing ‘big data’ data pipelines, architectures, and data sets.</li><li>Comfortable working with a team developing and presenting presentations using insights derived from analytics.</li><li>Experience using data to solve business questions and drive business solutions.</li><li>You bring strong written and verbal communication appropriate for a professional work environment.

</li></ul><strong>Our Leadership Values For Marketing Science Analysts and Company Culture:

</strong><ul><li>Results Driven Anticipates roadblocks and appropriately seeks assistance to plan around them.</li><li>Effective Communication Considers the audience and communicates appropriately.</li><li>Accountability & Integrity Actively looks to offer ways to contribute during downtime.</li><li>Creative Collaboration Builds relationships with team and contributes regularly.</li><li>Harnessing Innovation Seeks opportunities to try out new approaches.

</li></ul><strong>Our differentiator is – Our People!</strong> We hire the brightest talent and develop them into leaders. We foster a culture of PEOPLE, PASSION and GROWTH.

<strong>People</strong>: We value our people, customers, and partners

<strong>Passion</strong>: We love what we do

<strong>Growth</strong>: Unlimited growth means unlimited potential

AP is a customer-focused, team-oriented organization where innovation and results are rewarded, and individuals can chart the course of their own careers.

As a woman founded and led company, this has meant supporting a meritocracy where everyone has opportunities to achieve their best and ensure we foster an environment of diversity, equity, and inclusion. In practice this means we will not only work to recruit a diverse workforce, but also maximize the full potential of all of our people. You can read more about our commitment to DEI here

Additionally, Analytic Partners participates in the E-Verify program in certain locations, as required by law.

<strong>Country Specific Benefits

</strong>We provide comprehensive benefits package that includes medical, dental, vision, 401k matching, commuter benefits, gym membership reimbursement, open PTO, and company paid holidays.

","Analytic Partners","https://www.linkedin.com/jobs/view/3732167758/","Charlottesville, Virginia, United States","","201-500 employees · Advertising Services
Actively recruiting","LISTED","91847496","Analytic Partners","https://media.licdn.com/dms/image/C4E0BAQGIZC2iH-fP_A/company-logo_400_400/0/1677859492136/analytic_partners_logo?e=1716422400&v=beta&t=F3AfCwe2coRxTYvGTQwzkqI8wf3IDkAU-gXOWpe57MA","2023-10-03T16:15:32.000Z","2024-02-16T02:41:33.050Z"
