"Title","Description","Description HTML","Primary Description","Detail URL","Location","Skill","Insight","Job State","Poster Id","Company Name","Company Logo","Created At","Scraped At"
"Marketing Analyst","Are you innovative and passionate about current trends and creating digital marketing campaigns? Our client is looking to hire a digital marketing manager to support the marketing team in effectively promoting its message across all digital channels. On a daily basis, they will manage the company's social media, including Facebook, Twitter, and Instagram, and create email blast campaigns to target key customers. They will also delegate responsibilities to copywriters, content creators, and other members of the marketing team, and stay up to date on the latest social media trends.
This is a hybrid role based in Portland, OR
Digital Marketing Analyst Requirements:Social media savvy, with a passion for staying on top of trendsStrong sense of creativity, imagination, and innovationExcellent interpersonal skills, with the ability to collaborate with other departmentsIn-depth knowledge of various social media platforms and best practicesAbility to analyze consumer metrics, reports, and trendsStrong project management and managerial skillsDigital Marketing Analyst Responsibilities:Plan, execute, and manage all digital marketing, including SEO, SEM, email marketing, and social mediaEstablish and execute a digital marketing strategy to distribute contentWork with and manage a team of writers, marketers, and other stakeholders to maintain the company's digital presenceMaintain consistent brand messaging across all social channelsIdentify, analyze, and measure trends and content to assess how well it’s performing and optimize user experienceCreate and maintain an editorial calendar to deliver targeted content
About Profiles An award-winning creative and marketing workforce solutions provider. Profiles places the highest caliber candidates in Fortune 500 companies and leading brands, nationwide. Our specialized recruiters represent an elite group of skilled professionals for contract, contract-to-hire, and direct hire positions. Profiles is headquartered in Baltimore, MD with a remote staff of entrepreneurial individuals across the nation. Have you considered a contract position? Profiles offers the following benefits: competitive salary; 401(k) plan; weekly paycheck and bonus pay; health, vision and dental insurance; online software and soft skill training.
New job opportunities are listed daily – www.careerprofiles.com.","<p>Are you innovative and passionate about current trends and creating digital marketing campaigns? Our client is looking to hire a digital marketing manager to support the marketing team in effectively promoting its message across all digital channels. On a daily basis, they will manage the company's social media, including Facebook, Twitter, and Instagram, and create email blast campaigns to target key customers. They will also delegate responsibilities to copywriters, content creators, and other members of the marketing team, and stay up to date on the latest social media trends.</p><p>
</p><p>This is a hybrid role based in Portland, OR</p><p>
</p><ul><li><strong>Digital Marketing Analyst Requirements:</strong>Social media savvy, with a passion for staying on top of trends</li><li>Strong sense of creativity, imagination, and innovation</li><li>Excellent interpersonal skills, with the ability to collaborate with other departments</li><li>In-depth knowledge of various social media platforms and best practices</li><li>Ability to analyze consumer metrics, reports, and trends</li><li>Strong project management and managerial skills</li></ul><p><strong>Digital Marketing Analyst Responsibilities:</strong></p><ul><li>Plan, execute, and manage all digital marketing, including SEO, SEM, email marketing, and social media</li><li>Establish and execute a digital marketing strategy to distribute content</li><li>Work with and manage a team of writers, marketers, and other stakeholders to maintain the company's digital presence</li><li>Maintain consistent brand messaging across all social channels</li><li>Identify, analyze, and measure trends and content to assess how well it’s performing and optimize user experience</li><li>Create and maintain an editorial calendar to deliver targeted content</li></ul><p>
</p><p><strong>About Profiles</strong> </p><p>An award-winning creative and marketing workforce solutions provider. Profiles places the highest caliber candidates in Fortune 500 companies and leading brands, nationwide. Our specialized recruiters represent an elite group of skilled professionals for contract, contract-to-hire, and direct hire positions. Profiles is headquartered in Baltimore, MD with a remote staff of entrepreneurial individuals across the nation.</p><p> </p><p>Have you considered a contract position? Profiles offers the following benefits: competitive salary; 401(k) plan; weekly paycheck and bonus pay; health, vision and dental insurance; online software and soft skill training.</p><p>
</p><p>New job opportunities are listed daily – www.careerprofiles.com.</p>","Profiles","https://www.linkedin.com/jobs/view/3816608540/","Portland, Oregon Metropolitan Area","","51-200 employees · Staffing and Recruiting
Actively recruiting","LISTED","5689285","Profiles","https://media.licdn.com/dms/image/C560BAQEEUtHVba5lKg/company-logo_400_400/0/1656689784022/profiles_logo?e=1716422400&v=beta&t=z1fZNDeB1tRKeZUQYSp9Zervwi7EznopjI9ptDUixwU","2024-01-28T23:57:11.000Z","2024-02-16T02:41:33.050Z"
"Vertical Search Product Analyst - USDS","Responsibilities

 About TikTok
TikTok is the leading destination for short-form mobile video. Our mission is to inspire creativity and bring joy. TikTok has global offices including Los Angeles, New York, London, Paris, Berlin, Dubai, Singapore, Jakarta, Seoul and Tokyo.

Why Join Us
Creation is the core of TikTok's purpose. Our platform is built to help imaginations thrive. This is doubly true of the teams that make TikTok possible. 
Together, we inspire creativity and bring joy - a mission we all believe in and aim towards achieving every day. 
To us, every challenge, no matter how difficult, is an opportunity; to learn, to innovate, and to grow as one team. Status quo? Never. Courage? Always. 
At TikTok, we create together and grow together. That's how we drive impact - for ourselves, our company, and the communities we serve. 
Join us.

About USDS
At TikTok, we're committed to a process of continuous innovation and improvement in our user experience and safety controls. We're proud to be able to serve a global community of more than a billion people who use TikTok to creatively express themselves and be entertained, and we're dedicated to giving them a platform that builds opportunity and fosters connection. We also take our responsibility to safeguard our community seriously, both in how we address potentially harmful content and how we protect against unauthorized access to user data.

U.S. Data Security (“USDS”) is a standalone department of TikTok in the U.S. This new security-first division was created to bring heightened focus and governance to our data protection policies and content assurance protocols to keep U.S. users safe. Our focus is on providing oversight and protection of the TikTok platform and user data in the U.S., so millions of Americans can continue turning to TikTok to learn something new, earn a living, express themselves creatively, or be entertained. The teams within USDS that deliver on this commitment daily span Trust & Safety, Security & Privacy, Engineering, User & Product Ops, Corporate Functions and more.

About the Team
Our TikTok Search Operation team plays a key role in improving TikTok users’ search experience by investigating user feedback, evaluating search results, analyzing data, etc.

Responsibilities - What You'll do
1. In-depth understanding and mining of users' needs in the search direction through user research, competitive product analysis and other methods;
2. Optimization iterations such as search intent recognition, word segmentation, recall and sorting to improve search conversion and traffic revenue;
3. Collect, analyze and locate problems, formulate improvement plans and priorities, and follow up and measure improvement effects;
4. Cooperate with product and technical parties to promote the continuous improvement of search quality and user experience. 

Qualifications

 1. Bachelor's degree or above;
2. 2 years+ Search product domain experience required
3. Experience with data analysis, identifying trends and reporting out on findings

Even Better If You Have 
- Familiarity with SEO business, understanding recommended products or experience in product data analysis is preferred
- Experience in data labeling, user feedback, content moderation or similar operation jobs

TikTok is committed to creating an inclusive space where employees are valued for their skills, experiences, and unique perspectives. Our platform connects people from across the globe and so does our workplace. At TikTok, our mission is to inspire creativity and bring joy. To achieve that goal, we are committed to celebrating our diverse voices and to creating an environment that reflects the many communities we reach. We are passionate about this and hope you are too.

TikTok is committed to providing reasonable accommodations in our recruitment processes for candidates with disabilities, pregnancy, sincerely held religious beliefs or other reasons protected by applicable laws. If you need assistance or a reasonable accommodation, please reach out to us at usds.accommodations@tiktokusds.com

This role requires the ability to work with and support systems designed to protect sensitive data and information. As such, this role will be subject to strict national security-related screening. 

Job Information:

【For Pay Transparency】Compensation Description (annually) The base salary range for this position in the selected city is $65866 - $146666 annually.Compensation may vary outside of this range depending on a number of factors, including a candidate’s qualifications, skills, competencies and experience, and location. Base pay is one part of the Total Package that is provided to compensate and recognize employees for their work, and this role may be eligible for additional discretionary bonuses/incentives, and restricted stock units.Our company benefits are designed to convey company culture and values, to create an efficient and inspiring work environment, and to support our employees to give their best in both work and life. We offer the following benefits to eligible employees: We cover 100% premium coverage for employee medical insurance, approximately 75% premium coverage for dependents and offer a Health Savings Account(HSA) with a company match. As well as Dental, Vision, Short/Long term Disability, Basic Life, Voluntary Life and AD&D insurance plans. In addition to Flexible Spending Account(FSA) Options like Health Care, Limited Purpose and Dependent Care. Our time off and leave plans are: 10 paid holidays per year plus 17 days of Paid Personal Time Off (PPTO) (prorated upon hire and increased by tenure) and 10 paid sick days per year as well as 12 weeks of paid Parental leave and 8 weeks of paid Supplemental Disability. We also provide generous benefits like mental and emotional health benefits through our EAP and Lyra. A 401K company match, gym and cellphone service reimbursements. The Company reserves the right to modify or change these benefits programs at any time, with or without notice.","<strong>Responsibilities

</strong> About TikTok
TikTok is the leading destination for short-form mobile video. Our mission is to inspire creativity and bring joy. TikTok has global offices including Los Angeles, New York, London, Paris, Berlin, Dubai, Singapore, Jakarta, Seoul and Tokyo.

Why Join Us
Creation is the core of TikTok's purpose. Our platform is built to help imaginations thrive. This is doubly true of the teams that make TikTok possible. 
Together, we inspire creativity and bring joy - a mission we all believe in and aim towards achieving every day. 
To us, every challenge, no matter how difficult, is an opportunity; to learn, to innovate, and to grow as one team. Status quo? Never. Courage? Always. 
At TikTok, we create together and grow together. That's how we drive impact - for ourselves, our company, and the communities we serve. 
Join us.

About USDS
At TikTok, we're committed to a process of continuous innovation and improvement in our user experience and safety controls. We're proud to be able to serve a global community of more than a billion people who use TikTok to creatively express themselves and be entertained, and we're dedicated to giving them a platform that builds opportunity and fosters connection. We also take our responsibility to safeguard our community seriously, both in how we address potentially harmful content and how we protect against unauthorized access to user data.

U.S. Data Security (“USDS”) is a standalone department of TikTok in the U.S. This new security-first division was created to bring heightened focus and governance to our data protection policies and content assurance protocols to keep U.S. users safe. Our focus is on providing oversight and protection of the TikTok platform and user data in the U.S., so millions of Americans can continue turning to TikTok to learn something new, earn a living, express themselves creatively, or be entertained. The teams within USDS that deliver on this commitment daily span Trust & Safety, Security & Privacy, Engineering, User & Product Ops, Corporate Functions and more.

About the Team
Our TikTok Search Operation team plays a key role in improving TikTok users’ search experience by investigating user feedback, evaluating search results, analyzing data, etc.

Responsibilities - What You'll do
1. In-depth understanding and mining of users' needs in the search direction through user research, competitive product analysis and other methods;
2. Optimization iterations such as search intent recognition, word segmentation, recall and sorting to improve search conversion and traffic revenue;
3. Collect, analyze and locate problems, formulate improvement plans and priorities, and follow up and measure improvement effects;
4. Cooperate with product and technical parties to promote the continuous improvement of search quality and user experience. 

<strong>Qualifications

</strong> 1. Bachelor's degree or above;
2. 2 years+ Search product domain experience required
3. Experience with data analysis, identifying trends and reporting out on findings

Even Better If You Have 
- Familiarity with SEO business, understanding recommended products or experience in product data analysis is preferred
- Experience in data labeling, user feedback, content moderation or similar operation jobs

TikTok is committed to creating an inclusive space where employees are valued for their skills, experiences, and unique perspectives. Our platform connects people from across the globe and so does our workplace. At TikTok, our mission is to inspire creativity and bring joy. To achieve that goal, we are committed to celebrating our diverse voices and to creating an environment that reflects the many communities we reach. We are passionate about this and hope you are too.

TikTok is committed to providing reasonable accommodations in our recruitment processes for candidates with disabilities, pregnancy, sincerely held religious beliefs or other reasons protected by applicable laws. If you need assistance or a reasonable accommodation, please reach out to us at usds.accommodations@tiktokusds.com

This role requires the ability to work with and support systems designed to protect sensitive data and information. As such, this role will be subject to strict national security-related screening. 

<strong>Job Information:

</strong>【For Pay Transparency】Compensation Description (annually) <p>The base salary range for this position in the selected city is $65866 - $146666 annually.</p><p>Compensation may vary outside of this range depending on a number of factors, including a candidate’s qualifications, skills, competencies and experience, and location. Base pay is one part of the Total Package that is provided to compensate and recognize employees for their work, and this role may be eligible for additional discretionary bonuses/incentives, and restricted stock units.</p><p>Our company benefits are designed to convey company culture and values, to create an efficient and inspiring work environment, and to support our employees to give their best in both work and life. We offer the following benefits to eligible employees: </p><p>We cover 100% premium coverage for employee medical insurance, approximately 75% premium coverage for dependents and offer a Health Savings Account(HSA) with a company match. As well as Dental, Vision, Short/Long term Disability, Basic Life, Voluntary Life and AD&D insurance plans. In addition to Flexible Spending Account(FSA) Options like Health Care, Limited Purpose and Dependent Care. </p><p>Our time off and leave plans are: 10 paid holidays per year plus 17 days of Paid Personal Time Off (PPTO) (prorated upon hire and increased by tenure) and 10 paid sick days per year as well as 12 weeks of paid Parental leave and 8 weeks of paid Supplemental Disability. </p><p>We also provide generous benefits like mental and emotional health benefits through our EAP and Lyra. A 401K company match, gym and cellphone service reimbursements. The Company reserves the right to modify or change these benefits programs at any time, with or without notice.</p>","TikTok","https://www.linkedin.com/jobs/view/3482410009/","Mountain View, California, United States","","10,001+ employees · Entertainment Providers
4 connections work here · 36 school alumni work here
Actively recruiting","LISTED","949072262","TikTok","https://media.licdn.com/dms/image/C510BAQGCdThXIss7UQ/company-logo_400_400/0/1630606162248/tiktok_logo?e=1716422400&v=beta&t=Y4reYzwt2AbzMgHFMLyTqiYsb8x-14b1SHn_1Rb2iwU","2023-02-14T10:12:30.000Z","2024-02-16T02:41:33.050Z"
"Senior SEO Analyst - Recommends","At Fortune Media, we are reinventing how a storied brand, steeped in journalism and business, adapts to today’s digital-first world. The digital transformation of Fortune from a print magazine to a multi-channel media company is in full swing, and we want you to be a part of it.

The Product team oversees all digital properties at Fortune including our new e-commerce offering - Recommends. Our goal is to optimize our Recommends product and evolve the diversification of new revenue and improve the user experience and monetization of existing functionality.

We are seeking a Senior SEO Analyst to join the Product team to focus on the Recommends product. You will work with other Product team members and stakeholders throughout the company.

You will be hands-on, collaborative, and pivotal in facilitating the next step in Fortune’s evolution by focusing on driving site performance and organic search traffic for our products.   

This role will operationalize the tactics associated with the strategic direction for all search optimization efforts as well as perform content audits and optimizations to improve search traffic as well and support the maintenance of the content roadmap.

You will review web page content, identify content opportunities, and create competitive analyses.

You will support technical SEO efforts to improve indexing and crawling, as well as enhance internal linking and the overall user experience. Additionally, you will build reports to measure KPIs on content performance, help create content templates, and spread awareness of best practices.

This role will report to the Director of Search Strategy, on the Product Team.

Requirements:

 2-3 years of direct working experience as a Search Engine Optimization professional with a focus on holistic SEO content  Hands-on experience with Google Analytics, Tag Manager, and Search Console  Proficiency in Ahrefs, Conductor, Screaming Frog, and other SEO tools.  Experience with E-commerce, a plus  Understanding of HTML, CSS, and how SPA sites affect SEO    Solid understanding of SEO core concepts and techniques   Strong team player with a proven ability to work cross-functionally, especially with development and editorial teams.   Relentless prioritization and organizational ability    Ability to develop tactics that are actionable and measurable as well as communicate strategic importance to all stakeholders  Outstanding written and verbal communication skills  Excellent written skills and editorial experience are a plus  Diligence and attention to detail  Collaborative, diplomatic, and excellent communicator  Preferred but not required, bachelor's degree in areas of study such as Engineering, Marketing or Product Management 

 Compensation Range: 

$90,000.00 - 105,000.00","At Fortune Media, we are reinventing how a storied brand, steeped in journalism and business, adapts to today’s digital-first world. The digital transformation of Fortune from a print magazine to a multi-channel media company is in full swing, and we want you to be a part of it.

The Product team oversees all digital properties at Fortune including our new e-commerce offering - Recommends. Our goal is to optimize our Recommends product and evolve the diversification of new revenue and improve the user experience and monetization of existing functionality.

We are seeking a Senior SEO Analyst to join the Product team to focus on the Recommends product. You will work with other Product team members and stakeholders throughout the company.

You will be hands-on, collaborative, and pivotal in facilitating the next step in Fortune’s evolution by focusing on driving site performance and organic search traffic for our products.   

This role will operationalize the tactics associated with the strategic direction for all search optimization efforts as well as perform content audits and optimizations to improve search traffic as well and support the maintenance of the content roadmap.

You will review web page content, identify content opportunities, and create competitive analyses.

You will support technical SEO efforts to improve indexing and crawling, as well as enhance internal linking and the overall user experience. Additionally, you will build reports to measure KPIs on content performance, help create content templates, and spread awareness of best practices.

This role will report to the Director of Search Strategy, on the Product Team.

Requirements:

<ul><li> 2-3 years of direct working experience as a Search Engine Optimization professional with a focus on holistic SEO content </li><li> Hands-on experience with Google Analytics, Tag Manager, and Search Console </li><li> Proficiency in Ahrefs, Conductor, Screaming Frog, and other SEO tools. </li><li> Experience with E-commerce, a plus </li><li> Understanding of HTML, CSS, and how SPA sites affect SEO   </li><li> Solid understanding of SEO core concepts and techniques  </li><li> Strong team player with a proven ability to work cross-functionally, especially with development and editorial teams.  </li><li> Relentless prioritization and organizational ability   </li><li> Ability to develop tactics that are actionable and measurable as well as communicate strategic importance to all stakeholders </li><li> Outstanding written and verbal communication skills </li><li> Excellent written skills and editorial experience are a plus </li><li> Diligence and attention to detail </li><li> Collaborative, diplomatic, and excellent communicator </li><li> Preferred but not required, bachelor's degree in areas of study such as Engineering, Marketing or Product Management 

</li></ul><strong> Compensation Range: 

</strong>$90,000.00 - 105,000.00","Fortune","https://www.linkedin.com/jobs/view/3810554180/","New York, New York, United States","Skills: Web Analytics, Organizational Talent, +8 more","201-500 employees · Book and Periodical Publishing
1 school alum works here","LISTED","6555485","Fortune","https://media.licdn.com/dms/image/D4E0BAQGbzeqKbqy8Qw/company-logo_400_400/0/1707171899185/fortune_logo?e=1716422400&v=beta&t=FZ2bU08ugFjDS9t61t0sb0oy4sGKCawbFdjsZRn7IuA","2024-01-19T21:09:22.000Z","2024-02-16T02:41:33.050Z"
