"Title","Description","Description HTML","Primary Description","Detail URL","Location","Skill","Insight","Job State","Poster Id","Company Name","Company Logo","Created At","Scraped At"
"Marketing Operations Analyst","The Marketing Operations Analyst will support the end-to-end management of our marketing processes and KPIs to improve the performance and efficiency of our marketing teams. This role will partner closely with stakeholders in Marketing, Business Development, and Sales Operations to identify ways to strategically drive incremental pipeline through data-driven recommendations, analytics, best practices, and efficient processes aligned to our marketing and organizational goals. Through rigorous data analysis, this role will also focus on maintaining marketing KPIs, reporting, and driving insights for the Marketing team.

Origami Risk is proud to be an equal opportunity employer. We thrive and benefit from diversity and are committed to creating an inclusive and equitable environment for all employees. We do not discriminate against any individual based upon race, religion, gender (including pregnancy, childbirth, or related medical conditions), sexual orientation, gender identity, gender expression, color, sex, national origin, age, marital status, military or veteran status, disability, or any other characteristic protected by applicable law.

Responsibilities

 Provides proactive, accurate, and prescriptive intelligence to the Marketing and Sales departments.  Supports and builds the roadmap for the marketing technology stack to support pipeline growth and marketing objectives.  Creates, maintains, and analyzes standard reports and dashboards to provide visibility to Marketing and Senior Leadership.  Maintains all marketing data and drive usage of current and future marketing technology.  Partners across Operations teams on marketing integrations with CRM (Salesforce) to ensure proper data flow from lead to sales qualified opportunities.  Builds and maintains global reporting and intelligence models to understand, inform, and drive marketing effectiveness throughout cross-functional teams.  Responsible for marketing cadence packages for reporting and overall performance management.  Analyzes each stage of the marketing and sales funnel to optimize lead generation and provide areas for improvement.  Tracks and reports on marketing campaigns and lifecycle stages providing detailed and summary presentations for Leadership team.  Works closely with Vice President of Marketing, Demand Generation, and Sales Leadership to provide status updates and report performance to goals.  Contributes to the marketing planning and budgeting related processes.  Other duties as assigned. 

Qualifications

 Bachelor's degree in Business Analytics, Marketing, Finance, Statistics, Economics, Mathematics, or another related field.  3+ years of experience in marketing operations, marketing analytics, or similar roles; preferably in a B2B SaaS environment.  Experience with Salesforce and Marketo (or similar marketing automation tool) required; Experience with Bizible, Demandbase, PowerBI/Tableau preferred.  Strong critical thinking skills, efficient with limited resources and information.  Excellent verbal and written communication skills, comfortable with communicating upwards.  Entrepreneurial approach to solving ambiguous or complex problems.  Proven experience analyzing, organizing, and interpreting data for the design and implementation of strategic plans.  Superior attention to detail.  Skillful in Microsoft Office Suite, particularly Excel and PowerPoint. 

Who We Are

Origami Risk provides integrated SaaS solutions to organizations across the risk and insurance ecosystem — from insured corporate and public entities to brokers and risk consultants, insurers, third party claims administrators (TPAs), and risk pools. We deliver our risk management and insurance core system solutions from a cloud-based platform that is highly configurable, completely scalable, and accessible via web browser and mobile app.

Dais Technology, a subsidiary of Origami Risk, provides a no-code platform that revolutionizes insurance product creation for MGAs, insurers, and reinsurers. Dais’ event-based architecture enables AI-driven bundling, automation, and real-time deployment.

Solutions from Origami Risk and Dais Technology are backed by a best-in-class service team of experienced risk and insurance professionals who possess a balance of industry knowledge and technological expertise. A singular focus on helping clients achieve their business objectives underlies our approach to developing, implementing, and supporting our risk management, safety, compliance, and insurance core system technology solutions.","The Marketing Operations Analyst will support the end-to-end management of our marketing processes and KPIs to improve the performance and efficiency of our marketing teams. This role will partner closely with stakeholders in Marketing, Business Development, and Sales Operations to identify ways to strategically drive incremental pipeline through data-driven recommendations, analytics, best practices, and efficient processes aligned to our marketing and organizational goals. Through rigorous data analysis, this role will also focus on maintaining marketing KPIs, reporting, and driving insights for the Marketing team.

Origami Risk is proud to be an equal opportunity employer. We thrive and benefit from diversity and are committed to creating an inclusive and equitable environment for all employees. We do not discriminate against any individual based upon race, religion, gender (including pregnancy, childbirth, or related medical conditions), sexual orientation, gender identity, gender expression, color, sex, national origin, age, marital status, military or veteran status, disability, or any other characteristic protected by applicable law.

<strong>Responsibilities

</strong><ul><li> Provides proactive, accurate, and prescriptive intelligence to the Marketing and Sales departments. </li><li> Supports and builds the roadmap for the marketing technology stack to support pipeline growth and marketing objectives. </li><li> Creates, maintains, and analyzes standard reports and dashboards to provide visibility to Marketing and Senior Leadership. </li><li> Maintains all marketing data and drive usage of current and future marketing technology. </li><li> Partners across Operations teams on marketing integrations with CRM (Salesforce) to ensure proper data flow from lead to sales qualified opportunities. </li><li> Builds and maintains global reporting and intelligence models to understand, inform, and drive marketing effectiveness throughout cross-functional teams. </li><li> Responsible for marketing cadence packages for reporting and overall performance management. </li><li> Analyzes each stage of the marketing and sales funnel to optimize lead generation and provide areas for improvement. </li><li> Tracks and reports on marketing campaigns and lifecycle stages providing detailed and summary presentations for Leadership team. </li><li> Works closely with Vice President of Marketing, Demand Generation, and Sales Leadership to provide status updates and report performance to goals. </li><li> Contributes to the marketing planning and budgeting related processes. </li><li> Other duties as assigned. 

</li></ul><strong>Qualifications

</strong><ul><li> Bachelor's degree in Business Analytics, Marketing, Finance, Statistics, Economics, Mathematics, or another related field. </li><li> 3+ years of experience in marketing operations, marketing analytics, or similar roles; preferably in a B2B SaaS environment. </li><li> Experience with Salesforce and Marketo (or similar marketing automation tool) required; Experience with Bizible, Demandbase, PowerBI/Tableau preferred. </li><li> Strong critical thinking skills, efficient with limited resources and information. </li><li> Excellent verbal and written communication skills, comfortable with communicating upwards. </li><li> Entrepreneurial approach to solving ambiguous or complex problems. </li><li> Proven experience analyzing, organizing, and interpreting data for the design and implementation of strategic plans. </li><li> Superior attention to detail. </li><li> Skillful in Microsoft Office Suite, particularly Excel and PowerPoint. 

</li></ul><strong>Who We Are

</strong>Origami Risk provides integrated SaaS solutions to organizations across the risk and insurance ecosystem — from insured corporate and public entities to brokers and risk consultants, insurers, third party claims administrators (TPAs), and risk pools. We deliver our risk management and insurance core system solutions from a cloud-based platform that is highly configurable, completely scalable, and accessible via web browser and mobile app.

Dais Technology, a subsidiary of Origami Risk, provides a no-code platform that revolutionizes insurance product creation for MGAs, insurers, and reinsurers. Dais’ event-based architecture enables AI-driven bundling, automation, and real-time deployment.

Solutions from Origami Risk and Dais Technology are backed by a best-in-class service team of experienced risk and insurance professionals who possess a balance of industry knowledge and technological expertise. A singular focus on helping clients achieve their business objectives underlies our approach to developing, implementing, and supporting our risk management, safety, compliance, and insurance core system technology solutions.","Origami Risk","https://www.linkedin.com/jobs/view/3826833885/","Chicago, Illinois, United States","Skills: Marketing Analytics, Analytics, +8 more","501-1,000 employees · Software Development
2 school alumni work here","LISTED","316871121","Origami Risk","https://media.licdn.com/dms/image/C4E0BAQGfNDeKOzu3Zw/company-logo_400_400/0/1630616999118/origami_risk_logo?e=1716422400&v=beta&t=xGc1sBvKsTSuGL0QeU5Wtk7keYN5pKG4iqPMxVsss2Q","2024-02-09T21:05:21.000Z","2024-02-16T02:41:33.050Z"
"Marketing Science Analyst (Hiring for April 2024)","Analytic Partners Recognized as a Leader by The Forrester Wave, Marketing Measurement & Optimization, Q3 2023 Report “Analytic Partners dominates with data-driven marketing insights.”

We are the Commercial Intelligence industry leader and the first to do it! We help brands use data to drive business growth, and we do this using a combination of technology and expert guidance that helps companies make the best possible decisions. Our Commercial Decision Platform GPS-Enterprise is the machine that turns data into actionable insights and our ROI Genome is our proprietary intelligence layer comprised of 20+ years of Analysis, Insights, and Learning. We measure the impact of Product, Sales, Operations, Customer Data and outside factors such as competitors, economic changes, seasonality, consumer mobility, and more to deliver impact. Our customers drive business growth by leveraging our technology and expert analyst!

We’re growing fast, with global operations across our full-service offices in New York City, Miami, Broomfield, Charlottesville, Dallas, Dublin, London, Paris, Hamburg, Munich, Sydney, Melbourne, Singapore, and Shanghai.

What You’ll Be Doing

Collect and analyze data related to consumer behavior, market trends, and campaign performance. Using proprietary tools and techniques to prep, mine and format customer data, analyze, produce models to develop insight dashboards and customer presentations.Develop and maintain statistical models that predict consumer behavior, campaign performance, and other key metrics. Collaborate as part of a team to drive analyses and insights, walking customers through dashboards and developing narratives that explain results and aid in more informed decisions and improved business performance.

What We Look For In You

Bachelor’s degree or above (ideal areas of study: Business Analytics and Management, Economics, Statistics, Mathematics, and/or Marketing)Recent graduates and those with 1-3 years of internship or professional work experience across any combination of advanced and predictive analytics, marketing analytics, and analytic techniques for marketing, customer, and business applications. Strong working knowledge of Microsoft PowerPoint and ExcelYou demonstrate analytical principles, strong problem-solving skills and attention to detail.Experience working independently on analytical tasks, building, and optimizing ‘big data’ data pipelines, architectures, and data sets.Comfortable working with a team developing and presenting presentations using insights derived from analytics.Experience using data to solve business questions and drive business solutions.You bring strong written and verbal communication appropriate for a professional work environment.

Our Leadership Values For Marketing Science Analysts and Company Culture:

Results Driven Anticipates roadblocks and appropriately seeks assistance to plan around them.Effective Communication Considers the audience and communicates appropriately.Accountability & Integrity Actively looks to offer ways to contribute during downtime.Creative Collaboration Builds relationships with team and contributes regularly.Harnessing Innovation Seeks opportunities to try out new approaches.

$65,000 - $83,000 a year

The shared salary range is based on our good-faith belief at the time of posting. While the range is for the expectations as laid out in the job description, we are often open to a wide variety of candidates and recognize that the person we hire may be less experienced or more senior than this job description as posted. Total compensation may vary based on work experience, geographic location, market conditions, education/training, and skill level. Compensation Range: Base $65,000- $83,000/yearly + annual cash bonus + benefits such as paid holidays, open PTO, medical, dental, and vision.

Our differentiator is – Our People! We hire the brightest talent and develop them into leaders. We foster a culture of PEOPLE, PASSION and GROWTH.

People: We value our people, customers, and partners

Passion: We love what we do

Growth: Unlimited growth means unlimited potential

AP is a customer-focused, team-oriented organization where innovation and results are rewarded, and individuals can chart the course of their own careers.

As a woman founded and led company, this has meant supporting a meritocracy where everyone has opportunities to achieve their best and ensure we foster an environment of diversity, equity, and inclusion. In practice this means we will not only work to recruit a diverse workforce, but also maximize the full potential of all of our people. You can read more about our commitment to DEI here

Additionally, Analytic Partners participates in the E-Verify program in certain locations, as required by law.

Country Specific Benefits

We provide comprehensive benefits package that includes medical, dental, vision, 401k matching, commuter benefits, gym membership reimbursement, open PTO, and company paid holidays.

","Analytic Partners Recognized as a Leader by The Forrester Wave, Marketing Measurement & Optimization, Q3 2023 Report “Analytic Partners dominates with data-driven marketing insights.”

We are the Commercial Intelligence industry leader and the first to do it! We help brands use data to drive business growth, and we do this using a combination of technology and expert guidance that helps companies make the best possible decisions. Our Commercial Decision Platform GPS-Enterprise is the machine that turns data into actionable insights and our ROI Genome is our proprietary intelligence layer comprised of 20+ years of Analysis, Insights, and Learning. We measure the impact of Product, Sales, Operations, Customer Data and outside factors such as competitors, economic changes, seasonality, consumer mobility, and more to deliver impact. Our customers drive business growth by leveraging our technology and expert analyst!

We’re growing fast, with global operations across our full-service offices in New York City, Miami, Broomfield, Charlottesville, Dallas, Dublin, London, Paris, Hamburg, Munich, Sydney, Melbourne, Singapore, and Shanghai.

<strong>What You’ll Be Doing

</strong><ul><li>Collect and analyze data related to consumer behavior, market trends, and campaign performance. Using proprietary tools and techniques to prep, mine and format customer data, analyze, produce models to develop insight dashboards and customer presentations.</li><li>Develop and maintain statistical models that predict consumer behavior, campaign performance, and other key metrics. </li><li>Collaborate as part of a team to drive analyses and insights, walking customers through dashboards and developing narratives that explain results and aid in more informed decisions and improved business performance.

</li></ul><strong>What We Look For In You

</strong><ul><li>Bachelor’s degree or above (ideal areas of study: Business Analytics and Management, Economics, Statistics, Mathematics, and/or Marketing)</li><li>Recent graduates and those with 1-3 years of internship or professional work experience across any combination of advanced and predictive analytics, marketing analytics, and analytic techniques for marketing, customer, and business applications. </li><li>Strong working knowledge of Microsoft PowerPoint and Excel</li><li>You demonstrate analytical principles, strong problem-solving skills and attention to detail.</li><li>Experience working independently on analytical tasks, building, and optimizing ‘big data’ data pipelines, architectures, and data sets.</li><li>Comfortable working with a team developing and presenting presentations using insights derived from analytics.</li><li>Experience using data to solve business questions and drive business solutions.</li><li>You bring strong written and verbal communication appropriate for a professional work environment.

</li></ul><strong>Our Leadership Values For Marketing Science Analysts and Company Culture:

</strong><ul><li>Results Driven Anticipates roadblocks and appropriately seeks assistance to plan around them.</li><li>Effective Communication Considers the audience and communicates appropriately.</li><li>Accountability & Integrity Actively looks to offer ways to contribute during downtime.</li><li>Creative Collaboration Builds relationships with team and contributes regularly.</li><li>Harnessing Innovation Seeks opportunities to try out new approaches.

</li></ul>$65,000 - $83,000 a year

The shared salary range is based on our good-faith belief at the time of posting. While the range is for the expectations as laid out in the job description, we are often open to a wide variety of candidates and recognize that the person we hire may be less experienced or more senior than this job description as posted. Total compensation may vary based on work experience, geographic location, market conditions, education/training, and skill level. Compensation Range: Base $65,000- $83,000/yearly + annual cash bonus + benefits such as paid holidays, open PTO, medical, dental, and vision.

<strong>Our differentiator is – Our People!</strong> We hire the brightest talent and develop them into leaders. We foster a culture of PEOPLE, PASSION and GROWTH.

<strong>People</strong>: We value our people, customers, and partners

<strong>Passion</strong>: We love what we do

<strong>Growth</strong>: Unlimited growth means unlimited potential

AP is a customer-focused, team-oriented organization where innovation and results are rewarded, and individuals can chart the course of their own careers.

As a woman founded and led company, this has meant supporting a meritocracy where everyone has opportunities to achieve their best and ensure we foster an environment of diversity, equity, and inclusion. In practice this means we will not only work to recruit a diverse workforce, but also maximize the full potential of all of our people. You can read more about our commitment to DEI here

Additionally, Analytic Partners participates in the E-Verify program in certain locations, as required by law.

<strong>Country Specific Benefits

</strong>We provide comprehensive benefits package that includes medical, dental, vision, 401k matching, commuter benefits, gym membership reimbursement, open PTO, and company paid holidays.

","Analytic Partners","https://www.linkedin.com/jobs/view/3792402191/","Broomfield, Colorado, United States","","201-500 employees · Advertising Services
Actively recruiting","LISTED","91847496","Analytic Partners","https://media.licdn.com/dms/image/C4E0BAQGIZC2iH-fP_A/company-logo_400_400/0/1677859492136/analytic_partners_logo?e=1716422400&v=beta&t=F3AfCwe2coRxTYvGTQwzkqI8wf3IDkAU-gXOWpe57MA","2023-12-22T22:24:52.000Z","2024-02-16T02:41:33.050Z"
"Performance Marketing Analyst ","Now Hiring: Performance Marketing Analyst HQ Location: Palm Beach Co. FL area (Hybrid/Onsite most of the work week)Perm, FTE only. This is not a contract.Salary Range: $80-85K max + Benefits + Relo Asst.Hybrid model: 4 days per wk onsite/1 day WFHWe have partnered with a Retail Apparel & Fashion company that is seeking a candidate who is self-motivated and curious with a passion for understanding the why. This individual will combine their passion with expertise in digital marketing analytics to optimize campaign targeting, measure performance, and drive overall marketing efficiencyBachelor's Degree required, Business, Finance, Marketing, Statistics, or a related fieldExperience working in a small, fast-paced company where cross-functional partnerships are critical to driving a direct and tangible business impactMinimum 3+ years in an analysis role with experience in a retail/e-commerce business (Hard Requirement)Experience working with marketing data, user growth and acquisition across consumer products is preferredExcellent communication skills with the ability to convey complex data-driven findings to non-technical cross-functional team members and build cross-functional relationshipsSolid understanding of model building and forecasting with experience in statistical analysis and tools a plusHigh proficiency with Excel required with experience in systems such as NetSuite, Shopify, Google Analytics, Monetate, and Northbeam a strong plusProficiency in data visualization tools (i.e. Tableau, Power BI) and strong SQL skills a plus","<p><undefined><strong>Now Hiring: Performance Marketing Analyst </undefined></strong></p><ul><strong><li>HQ Location: Palm Beach Co. FL area (Hybrid/Onsite most of the work week)</strong></li><li>Perm, FTE only. This is not a contract.</li><li>Salary Range: $80-85K max + Benefits + Relo Asst.</li><strong><li>Hybrid model: 4 days per wk onsite/1 day WFH</strong></li><li>We have partnered with a Retail Apparel & Fashion company that is seeking a candidate who is self-motivated and curious with a passion for understanding the why. This individual will combine their passion with expertise in digital marketing analytics to optimize campaign targeting, measure performance, and drive overall marketing efficiency</li><li>Bachelor's Degree required, Business, Finance, Marketing, Statistics, or a related field</li><li>Experience working in a small, fast-paced company where cross-functional partnerships are critical to driving a direct and tangible business impact</li><strong><li>Minimum 3+ years in an analysis role with experience in a retail/e-commerce business (Hard Requirement)</strong></li><li>Experience working with marketing data, user growth and acquisition across consumer products is preferred</li><li>Excellent communication skills with the ability to convey complex data-driven findings to non-technical cross-functional team members and build cross-functional relationships</li><li>Solid understanding of model building and forecasting with experience in statistical analysis and tools a plus</li><li>High proficiency with Excel required with experience in systems such as NetSuite, Shopify, Google Analytics, Monetate, and Northbeam a strong plus</li><li>Proficiency in data visualization tools (i.e. Tableau, Power BI) and strong SQL skills a plus</li></ul>","Engage Partners Inc.","https://www.linkedin.com/jobs/view/3824940264/","Palm Beach County, Florida, United States","Skills: Data Analytics, Digital Marketing, +8 more","51-200 employees · Staffing and Recruiting","LISTED","9546344","Engage Partners Inc.","https://media.licdn.com/dms/image/C4E0BAQEuS4kbUuatww/company-logo_400_400/0/1630649308343/engage_partners_inc__logo?e=1716422400&v=beta&t=iyfbdm4laEiA3VaiyUD3QYYDLgEoPwVmfIo1D7COf2Q","2024-02-07T16:35:44.000Z","2024-02-16T02:41:33.050Z"
