"Title","Description","Description HTML","Primary Description","Detail URL","Location","Skill","Insight","Job State","Poster Id","Company Name","Company Logo","Created At","Scraped At"
"People Analytics Lead","We are looking for an experienced People Analytics Lead to help build a stellar data and insights function supporting our dynamic workforce. You'll craft our people analytics strategy from the ground up, serving as an expert advisor to leadership on all things talent data. The ideal candidate thrives on diving deep into complex workforce questions, proposing and measuring people programs, and translating insights into strategic recommendations to optimize how we attract, engage, develop and retain our innovative teams.

About Anthropic

Anthropic is an AI safety and research company that’s working to build reliable, interpretable, and steerable AI systems. We want AI to be safe and beneficial for our customers and for society as a whole. Our interdisciplinary team has experience across ML, physics, policy, business and product.

Responsibilities:

Build our people analytics program, developing interactive dashboards, automated reporting and visualizations to track key HR and workforce metrics for department leadersCollect, analyze, and interpret HR, talent, and workforce data to uncover insights and trends related to headcount, diversity & inclusion, employee lifecycle, performance management, engagement, retention, etc. Identify opportunities for process improvements through data analysis, making recommendations to optimize talent acquisition, development, retention, employee experience, and workforce planningClearly communicate key takeaways from people analytics reports to inform leadership's strategic decision-making around talentTrain HR colleagues, people managers, and employees on how to leverage HR data and analytics to optimize talent practicesStay current on latest trends in HR analytics, workforce planning, and people analytics technology to ensure our organization stays at the forefront

You may be a good fit if you:

5+ years experience in talent acquisition or HR focused on reporting, analytics or dataExpert skills in data tools (SQL, Excel, Tableau, Looker, etc.) and experience working with HR systems such as Workday Proficiency extracting and manipulating large, complex datasetsStrong critical thinking, analytical and problem solving abilitiesExcellent written and verbal communication skillsA sense of humor, a preference for fast-paced work, and a bias towards action

Strong candidates may also:

Have built a people analytics function from the ground up, identifying what’s most important and performing multivariate and statistical analysis on people dataHave a growth mindset with a passion for AI's potential to positively impact the world and realistic assessment of its risks and limitations

Annual Salary (USD)

The expected salary range for this position is $220k - $275k

Logistics

Location-based hybrid policy: Currently, we expect all staff to be in our office at least 25% of the time.

Deadline to apply: None. Applications will be reviewed on a rolling basis.

US visa sponsorship: We do sponsor visas! However, we aren't able to successfully sponsor visas for every role and every candidate; operations roles are especially difficult to support. But if we make you an offer, we will make every effort to get you into the United States, and we retain an immigration lawyer to help with this.

We encourage you to apply even if you do not believe you meet every single qualification. Not all strong candidates will meet every single qualification as listed. Research shows that people who identify as being from underrepresented groups are more prone to experiencing imposter syndrome and doubting the strength of their candidacy, so we urge you not to exclude yourself prematurely and to submit an application if you're interested in this work. We think AI systems like the ones we're building have enormous social and ethical implications. We think this makes representation even more important, and we strive to include a range of diverse perspectives on our team.

Compensation and Benefits*

Anthropic’s compensation package consists of three elements: salary, equity, and benefits. We are committed to pay fairness and aim for these three elements collectively to be highly competitive with market rates.

Equity - On top of this position's salary (listed above), equity will be a major component of the total compensation. We aim to offer higher-than-average equity compensation for a company of our size, and communicate equity amounts at the time of offer issuance.

US Benefits - The following benefits are for our US-based employees:

 Optional equity donation matching at a 3:1 ratio, up to 50% of your equity grant.  Comprehensive health, dental, and vision insurance for you and all your dependents.  401(k) plan with 4% matching.  22 weeks of paid parental leave.  Unlimited PTO – most staff take between 4-6 weeks each year, sometimes more! Stipends for education, home office improvements, commuting, and wellness.  Fertility benefits via Carrot.  Daily lunches and snacks in our office.  Relocation support for those moving to the Bay Area. 

UK Benefits - The following benefits are for our UK-based employees:

 Optional equity donation matching at a 3:1 ratio, up to 50% of your equity grant.  Private health, dental, and vision insurance for you and your dependents.  Pension contribution (matching 4% of your salary).  22 weeks of paid parental leave.  Unlimited PTO – most staff take between 4-6 weeks each year, sometimes more! Health cash plan.  Life insurance and income protection.  Daily lunches and snacks in our office.  This compensation and benefits information is based on Anthropic’s good faith estimate for this position as of the date of publication and may be modified in the future. Employees based outside of the UK or US will receive a different benefits package. The level of pay within the range will depend on a variety of job-related factors, including where you place on our internal performance ladders, which is based on factors including past work experience, relevant education, and performance on our interviews or in a work trial. 

How We're Different

We believe that the highest-impact AI research will be big science. At Anthropic we work as a single cohesive team on just a few large-scale research efforts. And we value impact — advancing our long-term goals of steerable, trustworthy AI — rather than work on smaller and more specific puzzles. We view AI research as an empirical science, which has as much in common with physics and biology as with traditional efforts in computer science. We're an extremely collaborative group, and we host frequent research discussions to ensure that we are pursuing the highest-impact work at any given time. As such, we greatly value communication skills. We do not have boundaries between engineering and research, and we expect all of our technical staff to contribute to both as needed.

The easiest way to understand our research directions is to read our recent research . This research continues many of the directions our team worked on prior to Anthropic, including: GPT-3 , Circuit-Based Interpretability , Multimodal Neurons , Scaling Laws , AI & Compute , Concrete Problems in AI Safety , and Learning from Human Preferences .

Come work with us!

Anthropic is a public benefit corporation based in San Francisco. We offer competitive compensation and benefits, optional equity donation matching, generous vacation and parental leave, flexible working hours, and a lovely office space in which to collaborate with colleagues.","We are looking for an experienced People Analytics Lead to help build a stellar data and insights function supporting our dynamic workforce. You'll craft our people analytics strategy from the ground up, serving as an expert advisor to leadership on all things talent data. The ideal candidate thrives on diving deep into complex workforce questions, proposing and measuring people programs, and translating insights into strategic recommendations to optimize how we attract, engage, develop and retain our innovative teams.

<strong>About Anthropic

</strong>Anthropic is an AI safety and research company that’s working to build reliable, interpretable, and steerable AI systems. We want AI to be safe and beneficial for our customers and for society as a whole. Our interdisciplinary team has experience across ML, physics, policy, business and product.

<strong>Responsibilities:

</strong><ul><li>Build our people analytics program, developing interactive dashboards, automated reporting and visualizations to track key HR and workforce metrics for department leaders</li><li>Collect, analyze, and interpret HR, talent, and workforce data to uncover insights and trends related to headcount, diversity & inclusion, employee lifecycle, performance management, engagement, retention, etc. </li><li>Identify opportunities for process improvements through data analysis, making recommendations to optimize talent acquisition, development, retention, employee experience, and workforce planning</li><li>Clearly communicate key takeaways from people analytics reports to inform leadership's strategic decision-making around talent</li><li>Train HR colleagues, people managers, and employees on how to leverage HR data and analytics to optimize talent practices</li><li>Stay current on latest trends in HR analytics, workforce planning, and people analytics technology to ensure our organization stays at the forefront

</li></ul><strong>You may be a good fit if you:

</strong><ul><li>5+ years experience in talent acquisition or HR focused on reporting, analytics or data</li><li>Expert skills in data tools (SQL, Excel, Tableau, Looker, etc.) and experience working with HR systems such as Workday </li><li>Proficiency extracting and manipulating large, complex datasets</li><li>Strong critical thinking, analytical and problem solving abilities</li><li>Excellent written and verbal communication skills</li><li>A sense of humor, a preference for fast-paced work, and a bias towards action

</li></ul><strong>Strong candidates may also:

</strong><ul><li>Have built a people analytics function from the ground up, identifying what’s most important and performing multivariate and statistical analysis on people data</li><li>Have a growth mindset with a passion for AI's potential to positively impact the world and realistic assessment of its risks and limitations

</li></ul><strong>Annual Salary (USD)

</strong><ul><li>The expected salary range for this position is $220k - $275k

</li></ul><strong>Logistics

</strong><strong>Location-based hybrid policy: </strong>Currently, we expect all staff to be in our office at least 25% of the time.

<strong>Deadline to apply</strong>: None. Applications will be reviewed on a rolling basis.

<strong>US visa sponsorship: </strong>We do sponsor visas! However, we aren't able to successfully sponsor visas for every role and every candidate; operations roles are especially difficult to support. But if we make you an offer, we will make every effort to get you into the United States, and we retain an immigration lawyer to help with this.

<strong>We encourage you to apply even if you do not believe you meet every single qualification.</strong> Not all strong candidates will meet every single qualification as listed. Research shows that people who identify as being from underrepresented groups are more prone to experiencing imposter syndrome and doubting the strength of their candidacy, so we urge you not to exclude yourself prematurely and to submit an application if you're interested in this work. We think AI systems like the ones we're building have enormous social and ethical implications. We think this makes representation even more important, and we strive to include a range of diverse perspectives on our team.

<strong>Compensation and Benefits*

</strong>Anthropic’s compensation package consists of three elements: salary, equity, and benefits. We are committed to pay fairness and aim for these three elements collectively to be highly competitive with market rates.

<strong>Equity</strong> - On top of this position's salary (listed above), equity will be a major component of the total compensation. We aim to offer higher-than-average equity compensation for a company of our size, and communicate equity amounts at the time of offer issuance.

<strong>US Benefits</strong> - The following benefits are for our US-based employees:

<ul><li> Optional equity donation matching at a 3:1 ratio, up to 50% of your equity grant. </li><li> Comprehensive health, dental, and vision insurance for you and all your dependents. </li><li> 401(k) plan with 4% matching. </li><li> 22 weeks of paid parental leave. </li><li> Unlimited PTO – most staff take between 4-6 weeks each year, sometimes more!</li><li> Stipends for education, home office improvements, commuting, and wellness. </li><li> Fertility benefits via Carrot. </li><li> Daily lunches and snacks in our office. </li><li> Relocation support for those moving to the Bay Area. 

</li></ul><strong>UK Benefits</strong> - The following benefits are for our UK-based employees:

<ul><li> Optional equity donation matching at a 3:1 ratio, up to 50% of your equity grant. </li><li> Private health, dental, and vision insurance for you and your dependents. </li><li> Pension contribution (matching 4% of your salary). </li><li> 22 weeks of paid parental leave. </li><li> Unlimited PTO – most staff take between 4-6 weeks each year, sometimes more!</li><li> Health cash plan. </li><li> Life insurance and income protection. </li><li> Daily lunches and snacks in our office. </li><li> This compensation and benefits information is based on Anthropic’s good faith estimate for this position as of the date of publication and may be modified in the future. Employees based outside of the UK or US will receive a different benefits package. The level of pay within the range will depend on a variety of job-related factors, including where you place on our internal performance ladders, which is based on factors including past work experience, relevant education, and performance on our interviews or in a work trial. 

</li></ul><strong>How We're Different

</strong>We believe that the highest-impact AI research will be big science. At Anthropic we work as a single cohesive team on just a few large-scale research efforts. And we value impact — advancing our long-term goals of steerable, trustworthy AI — rather than work on smaller and more specific puzzles. We view AI research as an empirical science, which has as much in common with physics and biology as with traditional efforts in computer science. We're an extremely collaborative group, and we host frequent research discussions to ensure that we are pursuing the highest-impact work at any given time. As such, we greatly value communication skills. We do not have boundaries between engineering and research, and we expect all of our technical staff to contribute to both as needed.

The easiest way to understand our research directions is to read our recent research . This research continues many of the directions our team worked on prior to Anthropic, including: GPT-3 , Circuit-Based Interpretability , Multimodal Neurons , Scaling Laws , AI & Compute , Concrete Problems in AI Safety , and Learning from Human Preferences .

<strong>Come work with us!

</strong>Anthropic is a public benefit corporation based in San Francisco. We offer competitive compensation and benefits, optional equity donation matching, generous vacation and parental leave, flexible working hours, and a lovely office space in which to collaborate with colleagues.","Anthropic","https://www.linkedin.com/jobs/view/3826847512/","San Francisco, California, United States","Skills: HR Analytics, Analytics, +8 more","51-200 employees · Research Services","LISTED","215398573","Anthropic","https://media.licdn.com/dms/image/C560BAQGaorhzD06jYg/company-logo_400_400/0/1630655391241/anthropicresearch_logo?e=1716422400&v=beta&t=tKAikxO5lMRXa2u3dUo5UdhWf9EATuYD-KQfGDwNj5k","2024-02-09T21:34:48.000Z","2024-02-16T02:40:23.434Z"
"Human Resources Manager","Job Summary: Responsible for the development and administration of strategic company staffing programs and initiatives for non-exempt, and exempt recruitment efforts. Demonstrates outstanding leadership skills combined with excellent interpersonal skills and communication abilities. Works with BU Managers to fulfill current and future staffing needs. Provides expertise, direction, and development in executing company staffing programs and initiatives. Establishes and maintains confidential records and critical information systems. Administers, monitors and manages all employee benefits programs. Key Areas of Responsibility: · Oversee human resource management, support executive leadership in HR decisions· Develop and manage company onboarding program, employee development and termination procedures· Provides objective and thorough investigations in response to manager and/or employee relations matters· Assures compliance of ADA, Affirmative Action, EEO, company rules and protocols; maintains accountability· Assists BU Managers in recruiting, interviews, and selection of employees to fill open positions at all levels· Maintains currency on company job description catalog; writes new job descriptions as needed· Assist BU Managers with the performance review process for all employees· Onboard new-employees; administers pre-employment screening; including drug screen and reference checksSkills & Experience: · 5-7 years’ experience in manufacturing company HR role (Aerospace, Fabrication, Machining )· Places strong emphasis on confidentiality· Ability to initiate / manage multiple projects and tasks· Working knowledge of HR department best practices· Possesses critical thinking, decision making, and problem solving skills· Proven mediation skills and abilities; adept at conflict resolution· Excellent personal communication skills (written and verbal)· Experience working in an AS9100 regulated environment a plus· Microsoft Suite proficiency Academic Requirements: · Bachelor’s Degree desired; (or combination of education and work experience) Travel & Physical Requirements: · Work environment is a combination of office and machine and fabrication shop floor· Appropriate attire and closed toed shoes required Note: Nothing in this job description restricts management's right to assign or reassign duties and responsibilities to this job at any time. By signing below, I can perform any or all job functions with or without reasonable accommodation. ","<p><strong>Job Summary: </strong>Responsible for the development and administration of strategic company staffing programs and initiatives for non-exempt, and exempt recruitment efforts. Demonstrates outstanding leadership skills combined with excellent interpersonal skills and communication abilities. Works with BU Managers to fulfill current and future staffing needs. Provides expertise, direction, and development in executing company staffing programs and initiatives. Establishes and maintains confidential records and critical information systems. Administers, monitors and manages all employee benefits programs.</p><p> </p><p><strong>Key Areas of Responsibility: </strong></p><p>· Oversee human resource management, support executive leadership in HR decisions</p><p>· Develop and manage company onboarding program, employee development and termination procedures</p><p>· Provides objective and thorough investigations in response to manager and/or employee relations matters</p><p>· Assures compliance of ADA, Affirmative Action, EEO, company rules and protocols; maintains accountability</p><p>· Assists BU Managers in recruiting, interviews, and selection of employees to fill open positions at all levels</p><p>· Maintains currency on company job description catalog; writes new job descriptions as needed</p><p>· Assist BU Managers with the performance review process for all employees</p><p>· Onboard new-employees; administers pre-employment screening; including drug screen and reference checks</p><p><strong>Skills & Experience: </strong></p><p>· 5-7 years’ experience in manufacturing company HR role (Aerospace, Fabrication, Machining )</p><p>· Places strong emphasis on confidentiality</p><p>· Ability to initiate / manage multiple projects and tasks</p><p>· Working knowledge of HR department best practices</p><p>· Possesses critical thinking, decision making, and problem solving skills</p><p>· Proven mediation skills and abilities; adept at conflict resolution</p><p>· Excellent personal communication skills (written and verbal)</p><p>· Experience working in an AS9100 regulated environment a plus</p><p>· Microsoft Suite proficiency</p><p><strong> </strong></p><p><strong>Academic Requirements: </strong></p><p>· Bachelor’s Degree desired; (or combination of education and work experience)</p><p><strong> </strong></p><p><strong>Travel & Physical Requirements: </strong></p><p>· Work environment is a combination of office and machine and fabrication shop floor</p><p>· Appropriate attire and closed toed shoes required</p><p><strong> </strong></p><p><strong>Note</strong>: Nothing in this job description restricts management's right to assign or reassign duties and responsibilities to this job at any time. By signing below, I can perform any or all job functions with or without reasonable accommodation. </p>","EMF Engineered Components, LLC","https://www.linkedin.com/jobs/view/3831086506/","Merritt Island, Florida, United States","Skills: HR Policies, Attention to Detail, +8 more","","LISTED","1073463871","","","2024-02-15T14:07:09.000Z","2024-02-16T02:40:23.434Z"
