"Title","Description","Description HTML","Primary Description","Detail URL","Location","Skill","Insight","Job State","Poster Id","Company Name","Company Logo","Created At","Scraped At"
"Director, People Analytics","Director, People Analytics Location: Mason, OH. This position will work a hybrid model (remote and office). The Ideal candidate will live within 50 miles of one of our Elevance Health PulsePoint locations. As the Director, People Analytics, you will be responsible for overseeing data, analytics and insights related to various talent functions, including Talent Management, Enterprise Learning & Leadership Development, Organizational Development & Effectiveness, Associate Experience, Talent Acquisition and Skills-based Talent Planning. The primary objective is to identify trends and patterns to drive informed business decisions while ensuring the accuracy and integrity of data. Working collaboratively with other departments to understand their talent needs and provide guidance and recommendations. Ultimately, the goal is to optimize talent utilization and performance by using data-driven insights to make informed decisions. It is critical this role forecast the future vs report the news. How you will make an impact:Oversee and lead the development and execution of talent insights analytics strategies and initiatives.Design and implement data-driven solutions to support talent management, performance, organizational development, learning and associate experience.Manage and analyze large sets of data to provide insights and storytelling to improve decision making.Collaborate with internal and external stakeholders to develop and implement best practices in talent analytics and data management.Leverage data to drive better outcomes for Elevance Health's talent management, learning & development, talent acquisition, and organizational development efforts.Leads learning measurement design, reporting and analytics to inform training and development programs and enhance employee skills and knowledge.Leads research studies and experiments related to employees' behavior and attitudes in the workplace. This involves designing, implementing, and analyzing research projects to understand factors influencing associate experience, engagement, leader effectiveness and team effectiveness.Uses research findings to consult to develop effective HR policies, offer solutions to complex organizational problems, and, ultimately, improve organizational effectiveness.Coaches and develops key business and HR partners to understand the value of and integrate human capital analytics into the way we do business, tied to direct business improvements.Hires, trains, coaches, counsels, and evaluates performance of direct reports. Minimum Requirements:Requires BA/BS degree, 10 years related experience including 5 years of direct human capital measurement experience; or any combination of education and experience, which would provide an equivalent background. Preferred Skills, Capabilities, and Experiences:MBA, Master or PhD in I/O Psychology preferred.Strong leadership, analytical and communications skills strongly preferred.Specific knowledge of and exposure to various human capital reporting tools; experience in strategy setting, management, continuous improvement, and working with senior leaders strongly preferred.Experience with Workday preferred.Experience with AWS preferred.
 
Please be advised that Elevance Health only accepts resumes for compensation from agencies that have a signed agreement with Elevance Health. Any unsolicited resumes, including those submitted to hiring managers, are deemed to be the property of Elevance Health.
Who We Are
Elevance Health is a health company dedicated to improving lives and communities - and making healthcare simpler. We are a Fortune 25 company with a longstanding history in the healthcare industry, looking for leaders at all levels of the organization who are passionate about making an impact on our members and the communities we serve.
How We Work
At Elevance Health, we are creating a culture that is designed to advance our strategy but will also lead to personal and professional growth for our associates. Our values and behaviors are the root of our culture. They are how we achieve our strategy, power our business outcomes and drive our shared success - for our consumers, our associates, our communities and our business.
We offer a range of market-competitive total rewards that include merit increases, paid holidays, Paid Time Off, and incentive bonus programs (unless covered by a collective bargaining agreement), medical, dental, vision, short and long term disability benefits, 401(k) +match, stock purchase plan, life insurance, wellness programs and financial education resources, to name a few.
Elevance Health operates in a Hybrid Workforce Strategy. Unless specified as primarily virtual by the hiring manager, associates are required to work at an Elevance Health location at least once per week, and potentially several times per week. Specific requirements and expectations for time onsite will be discussed as part of the hiring process. Candidates must reside within 50 miles or 1-hour commute each way of a relevant Elevance Health location.
The health of our associates and communities is a top priority for Elevance Health. We require all new candidates in certain patient/member-facing roles to become vaccinated against COVID-19. If you are not vaccinated, your offer will be rescinded unless you provide an acceptable explanation. Elevance Health will also follow all relevant federal, state and local laws.
Elevance Health is an Equal Employment Opportunity employer and all qualified applicants will receive consideration for employment without regard to age, citizenship status, color, creed, disability, ethnicity, genetic information, gender (including gender identity and gender expression), marital status, national origin, race, religion, sex, sexual orientation, veteran status or any other status or condition protected by applicable federal, state, or local laws. Applicants who require accommodation to participate in the job application process may contact elevancehealthjobssupport@elevancehealth.comfor assistance.","<p><strong>Director, People Analytics</strong></p><p> </p><p><strong>Location:</strong> Mason, OH. This position will work a hybrid model (remote and office). The Ideal candidate will live within 50 miles of one of our Elevance Health PulsePoint locations.</p><p> </p><p>As the <strong>Director, People Analytics</strong>, you will be responsible for overseeing data, analytics and insights related to various talent functions, including Talent Management, Enterprise Learning & Leadership Development, Organizational Development & Effectiveness, Associate Experience, Talent Acquisition and Skills-based Talent Planning. The primary objective is to identify trends and patterns to drive informed business decisions while ensuring the accuracy and integrity of data. Working collaboratively with other departments to understand their talent needs and provide guidance and recommendations. Ultimately, the goal is to optimize talent utilization and performance by using data-driven insights to make informed decisions. It is critical this role forecast the future vs report the news.</p><p> </p><p><strong>How you will make an impact:</strong></p><ul><li>Oversee and lead the development and execution of talent insights analytics strategies and initiatives.</li><li>Design and implement data-driven solutions to support talent management, performance, organizational development, learning and associate experience.</li><li>Manage and analyze large sets of data to provide insights and storytelling to improve decision making.</li><li>Collaborate with internal and external stakeholders to develop and implement best practices in talent analytics and data management.</li><li>Leverage data to drive better outcomes for Elevance Health's talent management, learning & development, talent acquisition, and organizational development efforts.</li><li>Leads learning measurement design, reporting and analytics to inform training and development programs and enhance employee skills and knowledge.</li><li>Leads research studies and experiments related to employees' behavior and attitudes in the workplace. This involves designing, implementing, and analyzing research projects to understand factors influencing associate experience, engagement, leader effectiveness and team effectiveness.</li><li>Uses research findings to consult to develop effective HR policies, offer solutions to complex organizational problems, and, ultimately, improve organizational effectiveness.</li><li>Coaches and develops key business and HR partners to understand the value of and integrate human capital analytics into the way we do business, tied to direct business improvements.</li><li>Hires, trains, coaches, counsels, and evaluates performance of direct reports.</li></ul><p> </p><p><strong>Minimum Requirements:</strong></p><p>Requires BA/BS degree, 10 years related experience including 5 years of direct human capital measurement experience; or any combination of education and experience, which would provide an equivalent background.</p><p> </p><p><strong>Preferred Skills, Capabilities, and Experiences:</strong></p><ul><li>MBA, Master or PhD in I/O Psychology preferred.</li><li>Strong leadership, analytical and communications skills strongly preferred.</li><li>Specific knowledge of and exposure to various human capital reporting tools; experience in strategy setting, management, continuous improvement, and working with senior leaders strongly preferred.</li><li>Experience with Workday preferred.</li><li>Experience with AWS preferred.
</li></ul><p> </p>
<p>Please be advised that Elevance Health only accepts resumes for compensation from agencies that have a signed agreement with Elevance Health. Any unsolicited resumes, including those submitted to hiring managers, are deemed to be the property of Elevance Health.</p>
<p>Who We Are</p>
<p>Elevance Health is a health company dedicated to improving lives and communities - and making healthcare simpler. We are a Fortune 25 company with a longstanding history in the healthcare industry, looking for leaders at all levels of the organization who are passionate about making an impact on our members and the communities we serve.</p>
<p>How We Work</p>
<p>At Elevance Health, we are creating a culture that is designed to advance our strategy but will also lead to personal and professional growth for our associates. Our values and behaviors are the root of our culture. They are how we achieve our strategy, power our business outcomes and drive our shared success - for our consumers, our associates, our communities and our business.</p>
<p>We offer a range of market-competitive total rewards that include merit increases, paid holidays, Paid Time Off, and incentive bonus programs (unless covered by a collective bargaining agreement), medical, dental, vision, short and long term disability benefits, 401(k) +match, stock purchase plan, life insurance, wellness programs and financial education resources, to name a few.</p>
<p>Elevance Health operates in a Hybrid Workforce Strategy. Unless specified as primarily virtual by the hiring manager, associates are required to work at an Elevance Health location at least once per week, and potentially several times per week. Specific requirements and expectations for time onsite will be discussed as part of the hiring process. Candidates must reside within 50 miles or 1-hour commute each way of a relevant Elevance Health location.</p>
<p>The health of our associates and communities is a top priority for Elevance Health. We require all new candidates in certain patient/member-facing roles to become vaccinated against COVID-19. If you are not vaccinated, your offer will be rescinded unless you provide an acceptable explanation. Elevance Health will also follow all relevant federal, state and local laws.</p>
<p>Elevance Health is an Equal Employment Opportunity employer and all qualified applicants will receive consideration for employment without regard to age, citizenship status, color, creed, disability, ethnicity, genetic information, gender (including gender identity and gender expression), marital status, national origin, race, religion, sex, sexual orientation, veteran status or any other status or condition protected by applicable federal, state, or local laws. Applicants who require accommodation to participate in the job application process may contact elevancehealthjobssupport@elevancehealth.comfor assistance.</p>","Elevance Health · Mason, OH (Hybrid)","https://www.linkedin.com/jobs/view/3907948797/","Mason, Ohio, United States","Skills: Analytics, Human Capital Management, +8 more","10,001+ employees · Hospitals and Health Care
42 school alumni work here","LISTED","83619483","Elevance Health","https://media.licdn.com/dms/image/C560BAQHUCH2Q9_rJ2A/company-logo_400_400/0/1656408548309/elevance_health_logo?e=1722470400&v=beta&t=3i-X76BE7ka4hMHDUO2vtar2rZKh-7_ttCgAwoc8TWA","2024-04-26T21:23:21.000Z","2024-04-30T00:09:12.550Z"
"Analytics Manager, PINS","Position Overview

We're seeking an Analytics Manager for PINS (Payee Identification and Network Security) to join our team, reporting to the Senior Director. In this role, you'll lead the PINS analytics team and drive the development of a structured analytics program. Your focus will be on managing ongoing and ad-hoc reporting, automation, and operational enhancements for the PINS team, ensuring data accuracy and consistent reporting. You'll also implement strategies to translate raw data into actionable insights for decision-making within the PINS department and across functional teams.

Key Responsibilities

Develop and implement a structured analytics program, including training, onboarding, and testing of skills for analysts, and documentation of reporting requirementsPrioritize requests from the PINS department and stakeholders, ensuring capture of business cases and effective management of deliverablesTransform raw data into meaningful business insights for decision-making and strategic planningPrepare data summaries and detailed reports for leadership, identifying trends, patterns, areas of concern, and overall business insightsEnsure accuracy of data and deliverables through established policies and processesCollaborate with data and analytics professionals to optimize and scale the PINS team, ensuring continuity of reporting and dashboardsIdentify areas for process improvements, including automation, dashboard development, and visualization toolsEnhance reporting of department KPIs and SLAs to provide visibility into team accomplishments and areas for improvementProvide detailed explanation and training to end-users of reporting and dashboardsManage day-to-day requests, enhancements, and tasks for yourself and your team, ensuring alignment with current departmental prioritiesThink creatively to solve complex problems and adapt dynamically to changing risks and business needs

Required Qualifications

Bachelor's degree in business and/or Computer Science; OR 7+ years of equivalent work experience3+ years of experience leading a team of analysts or data scientists

Preferred Qualifications

Advanced modeling skills in SQL, Python, or comparable query language competenciesHighly analytical and proficient with database and visualization tools such as Tableau and/or Power BIStrong Excel skills, including formulas, vlookups, and conditional formattingAbility to mine complex datasets and generate actionable business recommendationsAdaptability to change and effective response in a fast-paced, deadline-focused environmentProficiency in data-driven decision-making and storytellingExperience in fraud or risk prevention

As a leading payments company in healthcare, we guide, price, explain, and pay for care on behalf of insurers and their members. We’re Zelis in our pursuit to align the interests of payers, providers, and consumers to deliver a better financial experience and more affordable, transparent care for all. We partner with more than 700 payers, including the top-5 national health plans, BCBS insurers, regional health plans, TPAs and self-insured employers, over 4 million providers, and 100 million members, enabling the healthcare industry to pay for care, with care. Zelis brings adaptive technology, a deeply ingrained service culture, and a comprehensive navigation through adjudication and payment platform to manage the complete payment process.

Commitment to Diversity, Equity, Inclusion, and Belonging

At Zelis, we champion diversity, equity, inclusion, and belonging in all aspects of our operations. We embrace the power of diversity and create an environment where people can bring their authentic and best selves to work. We know that a sense of belonging is key not only to your success at Zelis, but also to your ability to bring your best each day.

Equal Employment Opportunity 

Zelis is proud to be an equal opportunity employer. All applicants will receive consideration for employment without regard to race, color, religion, age, sex, national origin, disability status, genetics, protected veteran status, sexual orientation, gender identity or expression, or any other characteristic protected by federal, state or local laws.

We encourage members of traditionally underrepresented communities to apply, even if you do not believe you 100% fit the qualifications of the position, including women, LGBTQIA people, people of color, and people with disabilities.

Accessibility Support

We are dedicated to ensuring our application process is accessible to all candidates. If you are a qualified individual with a disability or a disabled veteran and require a reasonable accommodation with any part of the application and/or interview process, please email TalentAcquisition@zelis.com

SCAM ALERT: There is an active nationwide employment scam which is now using Zelis to garner personal information or financial scams. This site is secure, and any applications made here are with our legitimate partner. If you’re contacted by a Zelis Recruiter, please ensure whomever is contacting you truly represents Zelis Healthcare. We will never asked for the exchange of any money or credit card details during the recruitment process. Please be aware of any suspicious email activity from people who could be pretending to be recruiters or senior professionals at Zelis.","<strong>Position Overview

</strong>We're seeking an Analytics Manager for PINS (Payee Identification and Network Security) to join our team, reporting to the Senior Director. In this role, you'll lead the PINS analytics team and drive the development of a structured analytics program. Your focus will be on managing ongoing and ad-hoc reporting, automation, and operational enhancements for the PINS team, ensuring data accuracy and consistent reporting. You'll also implement strategies to translate raw data into actionable insights for decision-making within the PINS department and across functional teams.

<strong>Key Responsibilities

</strong><ul><li>Develop and implement a structured analytics program, including training, onboarding, and testing of skills for analysts, and documentation of reporting requirements</li><li>Prioritize requests from the PINS department and stakeholders, ensuring capture of business cases and effective management of deliverables</li><li>Transform raw data into meaningful business insights for decision-making and strategic planning</li><li>Prepare data summaries and detailed reports for leadership, identifying trends, patterns, areas of concern, and overall business insights</li><li>Ensure accuracy of data and deliverables through established policies and processes</li><li>Collaborate with data and analytics professionals to optimize and scale the PINS team, ensuring continuity of reporting and dashboards</li><li>Identify areas for process improvements, including automation, dashboard development, and visualization tools</li><li>Enhance reporting of department KPIs and SLAs to provide visibility into team accomplishments and areas for improvement</li><li>Provide detailed explanation and training to end-users of reporting and dashboards</li><li>Manage day-to-day requests, enhancements, and tasks for yourself and your team, ensuring alignment with current departmental priorities</li><li>Think creatively to solve complex problems and adapt dynamically to changing risks and business needs

</li></ul><strong>Required Qualifications

</strong><ul><li>Bachelor's degree in business and/or Computer Science; OR 7+ years of equivalent work experience</li><li>3+ years of experience leading a team of analysts or data scientists

</li></ul><strong>Preferred Qualifications

</strong><ul><li>Advanced modeling skills in SQL, Python, or comparable query language competencies</li><li>Highly analytical and proficient with database and visualization tools such as Tableau and/or Power BI</li><li>Strong Excel skills, including formulas, vlookups, and conditional formatting</li><li>Ability to mine complex datasets and generate actionable business recommendations</li><li>Adaptability to change and effective response in a fast-paced, deadline-focused environment</li><li>Proficiency in data-driven decision-making and storytelling</li><li>Experience in fraud or risk prevention

</li></ul>As a leading payments company in healthcare, we guide, price, explain, and pay for care on behalf of insurers and their members. We’re Zelis in our pursuit to align the interests of payers, providers, and consumers to deliver a better financial experience and more affordable, transparent care for all. We partner with more than 700 payers, including the top-5 national health plans, BCBS insurers, regional health plans, TPAs and self-insured employers, over 4 million providers, and 100 million members, enabling the healthcare industry to pay for care, with care. Zelis brings adaptive technology, a deeply ingrained service culture, and a comprehensive navigation through adjudication and payment platform to manage the complete payment process.

Commitment to Diversity, Equity, Inclusion, and Belonging

At Zelis, we champion diversity, equity, inclusion, and belonging in all aspects of our operations. We embrace the power of diversity and create an environment where people can bring their authentic and best selves to work. We know that a sense of belonging is key not only to your success at Zelis, but also to your ability to bring your best each day.

<strong>Equal Employment Opportunity 

</strong>Zelis is proud to be an equal opportunity employer. All applicants will receive consideration for employment without regard to race, color, religion, age, sex, national origin, disability status, genetics, protected veteran status, sexual orientation, gender identity or expression, or any other characteristic protected by federal, state or local laws.

We encourage members of traditionally underrepresented communities to apply, even if you do not believe you 100% fit the qualifications of the position, including women, LGBTQIA people, people of color, and people with disabilities.

<strong>Accessibility Support

</strong>We are dedicated to ensuring our application process is accessible to all candidates. If you are a qualified individual with a disability or a disabled veteran and require a reasonable accommodation with any part of the application and/or interview process, please email TalentAcquisition@zelis.com

SCAM ALERT: There is an active nationwide employment scam which is now using Zelis to garner personal information or financial scams. This site is secure, and any applications made here are with our legitimate partner. If you’re contacted by a Zelis Recruiter, please ensure whomever is contacting you truly represents Zelis Healthcare. We will never asked for the exchange of any money or credit card details during the recruitment process. Please be aware of any suspicious email activity from people who could be pretending to be recruiters or senior professionals at Zelis.","Zelis · Atlanta, GA","https://www.linkedin.com/jobs/view/3844087982/","Atlanta, Georgia, United States","Skills: Business Insights, Query Languages, +8 more","1,001-5,000 employees · Technology, Information and Internet
2 school alumni work here","LISTED","163709798","Zelis","https://media.licdn.com/dms/image/C560BAQFqgU0iXMBu7g/company-logo_400_400/0/1633106754925/zelis_logo?e=1722470400&v=beta&t=5pdQr7Q2kir9MUD-L2s-sBOpAOnuEok9ykQyQVU2_j8","2024-03-07T02:08:14.000Z","2024-04-30T00:09:12.550Z"
