"Title","Description","Description HTML","Primary Description","Detail URL","Location","Skill","Insight","Job State","Poster Id","Company Name","Company Logo","Created At","Scraped At"
"Human Resources Business Partner","HR Business Partner Contango Resources, LLC, an operating subsidiary of Crescent Energy Company 
Position can be in Fort Worth, Texas or Casper, Wyoming
Who is Crescent Energy (NYSE: CRGY)? • Crescent is a well-capitalized, U.S. independent energy company with a portfolio of low-decline assets in proven regions across the lower 48 states that generate substantial cash flow supported by a predictable base of production.• Strong Cash Flow, Production, Return of Capital, and Balance Sheet. 
Who is Contango Resources? • An operating subsidiary of Crescent Energy with ~500 employees and ~50k boe/d with a production mix of ~40% oil, ~40% natural gas, and ~20% NGL’s. • Our operating footprint consists of assets in the Gulf Coast, Permian, Rockies, and Oklahoma. • In addition to maximizing production and cash flow through existing stable (low decline) assets, Contango is also focused on a consolidation strategy to pursue PDP-heavy opportunities that offer attractive valuations from stressed or distressed situations. • Our Values: Excellence, Integrity, Stewardship, Teamwork.
Why Work for us? It’s an EXCITING time to join our growing team –• Opportunity to impact lives for the better. YOU get to help develop and administer key processes, programs, etc., that will help teammates to flourish…which, in turn, helps families and communities to flourish.• Opportunity for personal and professional growth, as well as potential for increased responsibility in the future.• Opportunity to generate wealth through our compensation and benefits programs.• Opportunity to be part of a safety-focused, collaborative, energized, solution-oriented TEAM. We ALL work together to create a responsible energy future. 
The Specific Role Where You Can Make a Difference?We are looking for an energetic, self-motivated, and driven HR Business Partner / Senior HR Business Partner to help lead us forward. Some of the things you will do in this role to help create value:• Serve ~300 employees located in WY (~250), TX and NM (~40) by handling general employee inquiries, employee relations and engagement, leave administration, recruitment, onboarding, policy interpretation, etc. • Serve as a business partner, assisting leaders with things like organizational design (structure, people, etc.), compensation, training and development, data analysis and reporting, etc. • Be a great Teammate, helping all of us (Contango, as well as the broader Crescent Energy portfolio) continuously improve our processes, policies, and programs. (You will work on numerous projects and M&A activity to help us grow.)• Travel, to develop meaningful relationships and identify opportunities/solutions. o Estimated travel to locations throughout WY will be ~1 week/month (~5 days/month). Locations you will visit include Rock Springs/Monell, Salt Creek, Lost Cabin Gas Plant and Madden field, Gilette, Elk Basin, and Worland. Frequency of travel to these locations will depend on various factors such as where you live, activity taking place, weather permitting, etc. For example, if you live in Casper, you may base at Salt Creek (~90 employees), you may travel to Worland (~15 employees) ~once a quarter and you may travel to the Lost Cabin Gas Plant (~100 employees) for ~1-2 days every ~2-3 weeks. Some months may have more travel, some less. Discretion and independent judgement will be expected to manage time/schedules as you deem most appropriate. o Travel to Midland will be ~1 week/quarter. o Up front travel to establish initial relationships will be heavier and can then decline. 
Qualifications / Experience• Demonstrated HR proficiency in at least two or more of the following operational areas: HRBP, recruitment, training, onboarding, HRIS/Data Management, M&A integration, compensation analysis/planning, performance management, HSE. • Experience in both larger and smaller organizations is ideal. Also, experience in oil & gas, manufacturing, and/or construction is ideal.• Demonstrated ability to gather, analyze and appropriately utilize data in planning and decision-making. (Proficiency with MS Excel.)• Proficiency with an HRIS system (preferably ADP) and other software (PPT, Word, Excel, etc.).• The ability to:o “Live out” our Core Values and Leadership Behaviors.o Maintain confidentiality of information and cultivate trust and credibility. o Communicate effectively (both verbal and written) and work well with different types of people. o Solve problems, generate ideas and new solutions with critical thinking and sound judgement.o Plan and prioritize with relative ease. Strong project management and prioritization will be needed.o Pay attention to the details in mundane, administrative tasks. (There is an administrative component to the job requiring a passion for the details.)o Use data to help drive continuous improvement. • While experience may be considered in lieu of a degree, a bachelor’s degree is typically a requirement for this role. Education specific to business administration, economics, human resources, marketing, math, accounting/finance, or similar/related degree is preferred. • This role can base anywhere in WY (Casper is preferred) or in Fort Worth. (If based in WY, could be eligible for a company vehicle.)• To apply, please go to www.contango.com and follow the prompts. Or, you can email a resume directly to phil.coyle@contango.com. 
EEO StatementContango Resources is an equal opportunity employer. All qualified applicants will receive consideration for employment without regard to race, color, religion, national origin, sex, gender identity, sexual orientation, age, genetic information, or pregnancy, status as a protected veteran, status as a qualified individual with a disability, or any other status protected by federal, state or local law.
If you are a qualified individual with a disability or a disabled veteran, you may request a reasonable accommodation if you are unable or limited in your ability to use or access Contango's online application as a result of your disability. ","<p>HR Business Partner </p><p>Contango Resources, LLC, an operating subsidiary of Crescent Energy Company </p><p>
</p><p>Position can be in Fort Worth, Texas or Casper, Wyoming</p><p>
</p><p>Who is Crescent Energy (NYSE: CRGY)? </p><p>• Crescent is a well-capitalized, U.S. independent energy company with a portfolio of low-decline assets in proven regions across the lower 48 states that generate substantial cash flow supported by a predictable base of production.</p><p>• Strong Cash Flow, Production, Return of Capital, and Balance Sheet. </p><p>
</p><p>Who is Contango Resources? </p><p>• An operating subsidiary of Crescent Energy with ~500 employees and ~50k boe/d with a production mix of ~40% oil, ~40% natural gas, and ~20% NGL’s. </p><p>• Our operating footprint consists of assets in the Gulf Coast, Permian, Rockies, and Oklahoma. </p><p>• In addition to maximizing production and cash flow through existing stable (low decline) assets, Contango is also focused on a consolidation strategy to pursue PDP-heavy opportunities that offer attractive valuations from stressed or distressed situations. </p><p>• Our Values: Excellence, Integrity, Stewardship, Teamwork.</p><p>
</p><p>Why Work for us? It’s an EXCITING time to join our growing team –</p><p>• Opportunity to impact lives for the better. YOU get to help develop and administer key processes, programs, etc., that will help teammates to flourish…which, in turn, helps families and communities to flourish.</p><p>• Opportunity for personal and professional growth, as well as potential for increased responsibility in the future.</p><p>• Opportunity to generate wealth through our compensation and benefits programs.</p><p>• Opportunity to be part of a safety-focused, collaborative, energized, solution-oriented TEAM. We ALL work together to create a responsible energy future. </p><p>
</p><p>The Specific Role Where You Can Make a Difference?</p><p>We are looking for an energetic, self-motivated, and driven HR Business Partner / Senior HR Business Partner to help lead us forward. Some of the things you will do in this role to help create value:</p><p>• Serve ~300 employees located in WY (~250), TX and NM (~40) by handling general employee inquiries, employee relations and engagement, leave administration, recruitment, onboarding, policy interpretation, etc. </p><p>• Serve as a business partner, assisting leaders with things like organizational design (structure, people, etc.), compensation, training and development, data analysis and reporting, etc. </p><p>• Be a great Teammate, helping all of us (Contango, as well as the broader Crescent Energy portfolio) continuously improve our processes, policies, and programs. (You will work on numerous projects and M&A activity to help us grow.)</p><p>• Travel, to develop meaningful relationships and identify opportunities/solutions. </p><p>o Estimated travel to locations throughout WY will be ~1 week/month (~5 days/month). Locations you will visit include Rock Springs/Monell, Salt Creek, Lost Cabin Gas Plant and Madden field, Gilette, Elk Basin, and Worland. Frequency of travel to these locations will depend on various factors such as where you live, activity taking place, weather permitting, etc. For example, if you live in Casper, you may base at Salt Creek (~90 employees), you may travel to Worland (~15 employees) ~once a quarter and you may travel to the Lost Cabin Gas Plant (~100 employees) for ~1-2 days every ~2-3 weeks. Some months may have more travel, some less. Discretion and independent judgement will be expected to manage time/schedules as you deem most appropriate. </p><p>o Travel to Midland will be ~1 week/quarter. </p><p>o Up front travel to establish initial relationships will be heavier and can then decline. </p><p>
</p><p>Qualifications / Experience</p><p>• Demonstrated HR proficiency in at least two or more of the following operational areas: HRBP, recruitment, training, onboarding, HRIS/Data Management, M&A integration, compensation analysis/planning, performance management, HSE. </p><p>• Experience in both larger and smaller organizations is ideal. Also, experience in oil & gas, manufacturing, and/or construction is ideal.</p><p>• Demonstrated ability to gather, analyze and appropriately utilize data in planning and decision-making. (Proficiency with MS Excel.)</p><p>• Proficiency with an HRIS system (preferably ADP) and other software (PPT, Word, Excel, etc.).</p><p>• The ability to:</p><p>o “Live out” our Core Values and Leadership Behaviors.</p><p>o Maintain confidentiality of information and cultivate trust and credibility. </p><p>o Communicate effectively (both verbal and written) and work well with different types of people. </p><p>o Solve problems, generate ideas and new solutions with critical thinking and sound judgement.</p><p>o Plan and prioritize with relative ease. Strong project management and prioritization will be needed.</p><p>o Pay attention to the details in mundane, administrative tasks. (There is an administrative component to the job requiring a passion for the details.)</p><p>o Use data to help drive continuous improvement. </p><p>• While experience may be considered in lieu of a degree, a bachelor’s degree is typically a requirement for this role. Education specific to business administration, economics, human resources, marketing, math, accounting/finance, or similar/related degree is preferred. </p><p>• This role can base anywhere in WY (Casper is preferred) or in Fort Worth. (If based in WY, could be eligible for a company vehicle.)</p><p>• To apply, please go to www.contango.com and follow the prompts. Or, you can email a resume directly to phil.coyle@contango.com. </p><p>
</p><p>EEO Statement</p><p>Contango Resources is an equal opportunity employer. All qualified applicants will receive consideration for employment without regard to race, color, religion, national origin, sex, gender identity, sexual orientation, age, genetic information, or pregnancy, status as a protected veteran, status as a qualified individual with a disability, or any other status protected by federal, state or local law.</p><p>
</p><p>If you are a qualified individual with a disability or a disabled veteran, you may request a reasonable accommodation if you are unable or limited in your ability to use or access Contango's online application as a result of your disability. </p>","Contango Resources","https://www.linkedin.com/jobs/view/3828519240/","Casper, Wyoming, United States","Skills: Employee Benefits, Employer Branding, +8 more","501-1,000 employees","LISTED","605136236","Contango Resources","https://media.licdn.com/dms/image/C4E0BAQF-zAfstD8Zjg/company-logo_400_400/0/1630599435660/contango_oil__gas_company_logo?e=1716422400&v=beta&t=j8cuxy1LUDTebXTho6HpnLQq2iDfrK06UZV479jGZ14","2024-02-15T23:38:40.000Z","2024-02-16T02:40:23.434Z"
