"Title","Description","Description HTML","Primary Description","Detail URL","Location","Skill","Insight","Job State","Poster Id","Company Name","Company Logo","Created At","Scraped At"
"Technical Operations & Insights Analyst, Product Support","Figma is growing our team of passionate people on a mission to make design accessible to all. Born on the Web, Figma helps entire product teams brainstorm, design and build better products — from start to finish. Whether it’s consolidating tools, simplifying workflows, or collaborating across teams and time zones, Figma makes the design process faster, more efficient, and fun while keeping everyone on the same page. From great products to long-lasting companies, we believe that nothing great is made alone—come make with us!

As a member of our Product Support Operations and Strategy team, the Operations and Insights Analyst will use data to refine our Product Support experience, build dashboards and data pipelines, and deliver reporting to ensure our leadership team has a clear pulse on the business. You’ll identify opportunities to optimize Figma’s product support operations. As a problem solver, you will dig into data to find root causes, identify trends, uncover blind spots, and help to answer questions about the customer and employee experience. YoYou will present data to the team in a manner that is effective, tangible, and tells a clear story.

This is a full time role that can be held from one of our US hubs or remotely in the United States.

What you’ll do at Figma:

Build data pipelines that enable reliable, accurate, and timely data insightsEnable product support to capture customer, product, and team performance insightsDevelop and maintain workforce capacity models to forecast staffing needsDesign scalable data pipelines, and communicate design recommendations to leadership and our internal partnersCollaborate with our data science and engineering teams to build, document, and manage our Product Support data structure and pipelines.

We'd love to hear from you if you have:

Proficiency in SQL and querying databases using tools like Tableau, Mode, Looker, or Zendesk Explore (we use Mode, Explore, and Hex)A deep understanding of statistical analysis and data modeling techniquesExperience building complex ETL jobsProven track record of presenting technical findings to non-technical stakeholdersExperience problem-solving through issues that impact the customer and product support teams

While not required, it’s an added plus if you also have:

Experience supporting a technical SaaS company in a senior analyst capacityExperience developing in DBTProficiency in R and/or PythonApplied ML experience

At Figma, one of our values is Grow as you go. We believe in hiring smart, curious people who are excited to learn and develop their skills. If you’re excited about this role but your past experience doesn’t align perfectly with the points outlined in the job description, we encourage you to apply anyways. You may be just the right candidate for this or other roles.

Pay Transparency Disclosure

If based in Figma’s San Francisco or New York hub offices, this role has the annual base salary range stated below.

Job level and actual compensation will be decided based on factors including, but not limited to, individual qualifications objectively assessed during the interview process (including skills and prior relevant experience, potential impact, and scope of role), market demands, and specific work location. The listed range is a guideline, and the range for this role may be modified. For roles that are available to be filled remotely, the pay range is localized according to employee work location by a factor of between 80% and 100% of range. Please discuss your specific work location with your recruiter for more information.

Figma offers equity to employees, as well a competitive package of additional benefits, including health, dental & vision, retirement with company contribution, parental leave & reproductive or family planning support, mental health & wellness benefits, generous PTO, company recharge days, a learning & development stipend, a work from home stipend, and cell phone reimbursement. Figma also offers sales incentive pay for most sales roles. Figma’s compensation and benefits are subject to change and may be modified in the future. You may view our Pay Transparency Policy by clicking on the corresponding link.

Annual Base Salary Range (SF/NY Hub):

$102,000—$215,000 USD

At Figma we celebrate and support our differences. We know employing a team rich in diverse thoughts, experiences, and opinions allows our employees, our product and our community to flourish. Figma is an equal opportunity workplace - we are dedicated to equal employment opportunities regardless of race, color, ancestry, religion, sex, national origin, sexual orientation, age, citizenship, marital status, disability, gender identity/expression, veteran status, or any other characteristic protected by law. We also consider qualified applicants regardless of criminal histories, consistent with legal requirements.

We will work to ensure individuals with disabilities are provided reasonable accommodation to apply for a role, participate in the interview process, perform essential job functions, and receive other benefits and privileges of employment. If you require accommodation, please reach out to accommodations-ext@figma.com. These modifications enable an individual with a disability to have an equal opportunity not only to get a job, but successfully perform their job tasks to the same extent as people without disabilities.

Examples of accommodations include but are not limited to:

Holding interviews in an accessible locationEnabling closed captioning on video conferencingEnsuring all written communication be compatible with screen readersChanging the mode or format of interviews 

By applying for this job, the candidate acknowledges and agrees that any personal data contained in their application or supporting materials will be processed in accordance with the applicable candidate section of Figma's Privacy Policy.","Figma is growing our team of passionate people on a mission to make design accessible to all. Born on the Web, Figma helps entire product teams brainstorm, design and build better products — from start to finish. Whether it’s consolidating tools, simplifying workflows, or collaborating across teams and time zones, Figma makes the design process faster, more efficient, and fun while keeping everyone on the same page. From great products to long-lasting companies, we believe that nothing great is made alone—come make with us!

As a member of our Product Support Operations and Strategy team, the Operations and Insights Analyst will use data to refine our Product Support experience, build dashboards and data pipelines, and deliver reporting to ensure our leadership team has a clear pulse on the business. You’ll identify opportunities to optimize Figma’s product support operations. As a problem solver, you will dig into data to find root causes, identify trends, uncover blind spots, and help to answer questions about the customer and employee experience. YoYou will present data to the team in a manner that is effective, tangible, and tells a clear story.

This is a full time role that can be held from one of our US hubs or remotely in the United States.

What you’ll do at Figma:

<ul><li>Build data pipelines that enable reliable, accurate, and timely data insights</li><li>Enable product support to capture customer, product, and team performance insights</li><li>Develop and maintain workforce capacity models to forecast staffing needs</li><li>Design scalable data pipelines, and communicate design recommendations to leadership and our internal partners</li><li>Collaborate with our data science and engineering teams to build, document, and manage our Product Support data structure and pipelines.

</li></ul>We'd love to hear from you if you have:

<ul><li>Proficiency in SQL and querying databases using tools like Tableau, Mode, Looker, or Zendesk Explore (we use Mode, Explore, and Hex)</li><li>A deep understanding of statistical analysis and data modeling techniques</li><li>Experience building complex ETL jobs</li><li>Proven track record of presenting technical findings to non-technical stakeholders</li><li>Experience problem-solving through issues that impact the customer and product support teams

</li></ul>While not required, it’s an added plus if you also have:

<ul><li>Experience supporting a technical SaaS company in a senior analyst capacity</li><li>Experience developing in DBT</li><li>Proficiency in R and/or Python</li><li>Applied ML experience

</li></ul>At Figma, one of our values is Grow as you go. We believe in hiring smart, curious people who are excited to learn and develop their skills. If you’re excited about this role but your past experience doesn’t align perfectly with the points outlined in the job description, we encourage you to apply anyways. You may be just the right candidate for this or other roles.

<strong>Pay Transparency Disclosure

</strong>If based in Figma’s San Francisco or New York hub offices, this role has the annual base salary range stated below.

Job level and actual compensation will be decided based on factors including, but not limited to, individual qualifications objectively assessed during the interview process (including skills and prior relevant experience, potential impact, and scope of role), market demands, and specific work location. The listed range is a guideline, and the range for this role may be modified. For roles that are available to be filled remotely, the pay range is localized according to employee work location by a factor of between 80% and 100% of range. Please discuss your specific work location with your recruiter for more information.

Figma offers equity to employees, as well a competitive package of additional benefits, including health, dental & vision, retirement with company contribution, parental leave & reproductive or family planning support, mental health & wellness benefits, generous PTO, company recharge days, a learning & development stipend, a work from home stipend, and cell phone reimbursement. Figma also offers sales incentive pay for most sales roles. Figma’s compensation and benefits are subject to change and may be modified in the future. You may view our Pay Transparency Policy by clicking on the corresponding link.

Annual Base Salary Range (SF/NY Hub):

$102,000—$215,000 USD

At Figma we celebrate and support our differences. We know employing a team rich in diverse thoughts, experiences, and opinions allows our employees, our product and our community to flourish. Figma is an equal opportunity workplace - we are dedicated to equal employment opportunities regardless of race, color, ancestry, religion, sex, national origin, sexual orientation, age, citizenship, marital status, disability, gender identity/expression, veteran status<strong>, </strong>or any other characteristic protected by law. We also consider qualified applicants regardless of criminal histories, consistent with legal requirements.

We will work to ensure individuals with disabilities are provided reasonable accommodation to apply for a role, participate in the interview process, perform essential job functions, and receive other benefits and privileges of employment. If you require accommodation, please reach out to accommodations-ext@figma.com. These modifications enable an individual with a disability to have an equal opportunity not only to get a job, but successfully perform their job tasks to the same extent as people without disabilities.

Examples of accommodations include but are not limited to:

<ul><li>Holding interviews in an accessible location</li><li>Enabling closed captioning on video conferencing</li><li>Ensuring all written communication be compatible with screen readers</li><li>Changing the mode or format of interviews 

</li></ul>By applying for this job, the candidate acknowledges and agrees that any personal data contained in their application or supporting materials will be processed in accordance with the applicable candidate section of Figma's Privacy Policy.","Figma · San Francisco, CA","https://www.linkedin.com/jobs/view/3866855291/","San Francisco, California, United States","Skills: Looker (Software), Databases, +8 more","1,001-5,000 employees · Design Services
4 school alumni work here","LISTED","92944770","Figma","https://media.licdn.com/dms/image/D560BAQGjPX8xmdHxgw/company-logo_400_400/0/1690557728311/figma_logo?e=1722470400&v=beta&t=f0ANi8UPNY2j63R5pgdschlKwPFKjDoB9MxaIj3IcIs","2024-03-21T19:52:38.000Z","2024-04-30T00:09:12.550Z"
"Analytics Manager, PINS","Position Overview

We're seeking an Analytics Manager for PINS (Payee Identification and Network Security) to join our team, reporting to the Senior Director. In this role, you'll lead the PINS analytics team and drive the development of a structured analytics program. Your focus will be on managing ongoing and ad-hoc reporting, automation, and operational enhancements for the PINS team, ensuring data accuracy and consistent reporting. You'll also implement strategies to translate raw data into actionable insights for decision-making within the PINS department and across functional teams.

Key Responsibilities

Develop and implement a structured analytics program, including training, onboarding, and testing of skills for analysts, and documentation of reporting requirementsPrioritize requests from the PINS department and stakeholders, ensuring capture of business cases and effective management of deliverablesTransform raw data into meaningful business insights for decision-making and strategic planningPrepare data summaries and detailed reports for leadership, identifying trends, patterns, areas of concern, and overall business insightsEnsure accuracy of data and deliverables through established policies and processesCollaborate with data and analytics professionals to optimize and scale the PINS team, ensuring continuity of reporting and dashboardsIdentify areas for process improvements, including automation, dashboard development, and visualization toolsEnhance reporting of department KPIs and SLAs to provide visibility into team accomplishments and areas for improvementProvide detailed explanation and training to end-users of reporting and dashboardsManage day-to-day requests, enhancements, and tasks for yourself and your team, ensuring alignment with current departmental prioritiesThink creatively to solve complex problems and adapt dynamically to changing risks and business needs

Required Qualifications

Bachelor's degree in business and/or Computer Science; OR 7+ years of equivalent work experience3+ years of experience leading a team of analysts or data scientists

Preferred Qualifications

Advanced modeling skills in SQL, Python, or comparable query language competenciesHighly analytical and proficient with database and visualization tools such as Tableau and/or Power BIStrong Excel skills, including formulas, vlookups, and conditional formattingAbility to mine complex datasets and generate actionable business recommendationsAdaptability to change and effective response in a fast-paced, deadline-focused environmentProficiency in data-driven decision-making and storytellingExperience in fraud or risk prevention

As a leading payments company in healthcare, we guide, price, explain, and pay for care on behalf of insurers and their members. We’re Zelis in our pursuit to align the interests of payers, providers, and consumers to deliver a better financial experience and more affordable, transparent care for all. We partner with more than 700 payers, including the top-5 national health plans, BCBS insurers, regional health plans, TPAs and self-insured employers, over 4 million providers, and 100 million members, enabling the healthcare industry to pay for care, with care. Zelis brings adaptive technology, a deeply ingrained service culture, and a comprehensive navigation through adjudication and payment platform to manage the complete payment process.

Commitment to Diversity, Equity, Inclusion, and Belonging

At Zelis, we champion diversity, equity, inclusion, and belonging in all aspects of our operations. We embrace the power of diversity and create an environment where people can bring their authentic and best selves to work. We know that a sense of belonging is key not only to your success at Zelis, but also to your ability to bring your best each day.

Equal Employment Opportunity 

Zelis is proud to be an equal opportunity employer. All applicants will receive consideration for employment without regard to race, color, religion, age, sex, national origin, disability status, genetics, protected veteran status, sexual orientation, gender identity or expression, or any other characteristic protected by federal, state or local laws.

We encourage members of traditionally underrepresented communities to apply, even if you do not believe you 100% fit the qualifications of the position, including women, LGBTQIA people, people of color, and people with disabilities.

Accessibility Support

We are dedicated to ensuring our application process is accessible to all candidates. If you are a qualified individual with a disability or a disabled veteran and require a reasonable accommodation with any part of the application and/or interview process, please email TalentAcquisition@zelis.com

SCAM ALERT: There is an active nationwide employment scam which is now using Zelis to garner personal information or financial scams. This site is secure, and any applications made here are with our legitimate partner. If you’re contacted by a Zelis Recruiter, please ensure whomever is contacting you truly represents Zelis Healthcare. We will never asked for the exchange of any money or credit card details during the recruitment process. Please be aware of any suspicious email activity from people who could be pretending to be recruiters or senior professionals at Zelis.","<strong>Position Overview

</strong>We're seeking an Analytics Manager for PINS (Payee Identification and Network Security) to join our team, reporting to the Senior Director. In this role, you'll lead the PINS analytics team and drive the development of a structured analytics program. Your focus will be on managing ongoing and ad-hoc reporting, automation, and operational enhancements for the PINS team, ensuring data accuracy and consistent reporting. You'll also implement strategies to translate raw data into actionable insights for decision-making within the PINS department and across functional teams.

<strong>Key Responsibilities

</strong><ul><li>Develop and implement a structured analytics program, including training, onboarding, and testing of skills for analysts, and documentation of reporting requirements</li><li>Prioritize requests from the PINS department and stakeholders, ensuring capture of business cases and effective management of deliverables</li><li>Transform raw data into meaningful business insights for decision-making and strategic planning</li><li>Prepare data summaries and detailed reports for leadership, identifying trends, patterns, areas of concern, and overall business insights</li><li>Ensure accuracy of data and deliverables through established policies and processes</li><li>Collaborate with data and analytics professionals to optimize and scale the PINS team, ensuring continuity of reporting and dashboards</li><li>Identify areas for process improvements, including automation, dashboard development, and visualization tools</li><li>Enhance reporting of department KPIs and SLAs to provide visibility into team accomplishments and areas for improvement</li><li>Provide detailed explanation and training to end-users of reporting and dashboards</li><li>Manage day-to-day requests, enhancements, and tasks for yourself and your team, ensuring alignment with current departmental priorities</li><li>Think creatively to solve complex problems and adapt dynamically to changing risks and business needs

</li></ul><strong>Required Qualifications

</strong><ul><li>Bachelor's degree in business and/or Computer Science; OR 7+ years of equivalent work experience</li><li>3+ years of experience leading a team of analysts or data scientists

</li></ul><strong>Preferred Qualifications

</strong><ul><li>Advanced modeling skills in SQL, Python, or comparable query language competencies</li><li>Highly analytical and proficient with database and visualization tools such as Tableau and/or Power BI</li><li>Strong Excel skills, including formulas, vlookups, and conditional formatting</li><li>Ability to mine complex datasets and generate actionable business recommendations</li><li>Adaptability to change and effective response in a fast-paced, deadline-focused environment</li><li>Proficiency in data-driven decision-making and storytelling</li><li>Experience in fraud or risk prevention

</li></ul>As a leading payments company in healthcare, we guide, price, explain, and pay for care on behalf of insurers and their members. We’re Zelis in our pursuit to align the interests of payers, providers, and consumers to deliver a better financial experience and more affordable, transparent care for all. We partner with more than 700 payers, including the top-5 national health plans, BCBS insurers, regional health plans, TPAs and self-insured employers, over 4 million providers, and 100 million members, enabling the healthcare industry to pay for care, with care. Zelis brings adaptive technology, a deeply ingrained service culture, and a comprehensive navigation through adjudication and payment platform to manage the complete payment process.

Commitment to Diversity, Equity, Inclusion, and Belonging

At Zelis, we champion diversity, equity, inclusion, and belonging in all aspects of our operations. We embrace the power of diversity and create an environment where people can bring their authentic and best selves to work. We know that a sense of belonging is key not only to your success at Zelis, but also to your ability to bring your best each day.

<strong>Equal Employment Opportunity 

</strong>Zelis is proud to be an equal opportunity employer. All applicants will receive consideration for employment without regard to race, color, religion, age, sex, national origin, disability status, genetics, protected veteran status, sexual orientation, gender identity or expression, or any other characteristic protected by federal, state or local laws.

We encourage members of traditionally underrepresented communities to apply, even if you do not believe you 100% fit the qualifications of the position, including women, LGBTQIA people, people of color, and people with disabilities.

<strong>Accessibility Support

</strong>We are dedicated to ensuring our application process is accessible to all candidates. If you are a qualified individual with a disability or a disabled veteran and require a reasonable accommodation with any part of the application and/or interview process, please email TalentAcquisition@zelis.com

SCAM ALERT: There is an active nationwide employment scam which is now using Zelis to garner personal information or financial scams. This site is secure, and any applications made here are with our legitimate partner. If you’re contacted by a Zelis Recruiter, please ensure whomever is contacting you truly represents Zelis Healthcare. We will never asked for the exchange of any money or credit card details during the recruitment process. Please be aware of any suspicious email activity from people who could be pretending to be recruiters or senior professionals at Zelis.","Zelis · Boston, MA","https://www.linkedin.com/jobs/view/3844088899/","Boston, Massachusetts, United States","Skills: Business Insights, Query Languages, +8 more","1,001-5,000 employees · Technology, Information and Internet
2 school alumni work here","LISTED","163709798","Zelis","https://media.licdn.com/dms/image/C560BAQFqgU0iXMBu7g/company-logo_400_400/0/1633106754925/zelis_logo?e=1722470400&v=beta&t=5pdQr7Q2kir9MUD-L2s-sBOpAOnuEok9ykQyQVU2_j8","2024-03-07T02:08:14.000Z","2024-04-30T00:09:12.550Z"
