"Title","Description","Description HTML","Primary Description","Detail URL","Location","Skill","Insight","Job State","Poster Id","Company Name","Company Logo","Created At","Scraped At"
"Senior Global Human Resources Data Analyst (R1890)","Are you looking for your next opportunity?

Sompo is offering a distinctive opportunity for a Senior Global HR Data Analyst within our Talent Management Center of Excellence, situated in our Global Human Resources team.
The ideal candidate for this role will demonstrate a diverse skill set, encompassing proficiency in mining and manipulating extensive and diverse datasets, mastery of data software and visualization tools, and a knack for crafting compelling narratives from data insights. Additionally, collaboration and relationship-building are essential traits, as the candidate will need to work closely with various teams and stakeholders to effectively leverage data for informed decision-making.
Location: This position will be a hybrid role based out of our Boston Massachusetts office.
Our business, your impact, our opportunity:
What you’ll be doing:
Advanced Analysis:Conducting analysis of HR data using statistical methodologies such as regression analysis, hypothesis testing, and machine learning algorithms. You'll uncover nuanced patterns, correlations, and trends within HR datasets to extract actionable insights that drive strategic initiatives.
Data Visualization and Reporting:Harnessing the power of visualization tools like Workday Discovery Boards, Tableau or Power BI to create visually compelling dashboards and reports. Your aim is to translate complex analytical findings into easily understandable visual narratives, empowering HR professionals and key stakeholders to make informed decisions.
Communication and Storytelling:You'll articulate complex analytical findings in a clear and compelling manner, tailoring communication to resonate with diverse audiences across the organization. Developing visually engaging presentations and reports will distill complex insights into actionable recommendations, facilitating data-driven decision-making.
Technology and Tools:Staying at the forefront of HR analytics tools, you'll evaluate and implement software solutions to enhance data collection, analysis, and reporting capabilities. Ensuring adherence to ethical guidelines and data privacy regulations is crucial to safeguard the integrity and confidentiality of sensitive employee data throughout the analytics process.


Collaboration and Consultation:Fostering collaborative partnerships with HR stakeholders, key internal partners, vendors, and business leaders is key. By understanding their unique requirements, you'll provide tailored analytical guidance and translate business challenges into actionable analytical approaches, delivering insights that drive outcomes and inform strategic direction.
Staying Updated on Industry Trends:Maintaining a pulse on industry trends and emerging best practices in people analytics is essential. You'll proactively incorporate innovative techniques to enhance analytical capabilities and contribute to thought leadership within the field of HR analytics, continuously elevating the organization's analytical maturity.
What you’ll bring:
Bachelor’s degree in Industrial / Organizational Psychology, Statistics, Data Science, Computer Science, or a related field; Master’s degree preferred.
Minimum of seven (7) years of experience in HR analytics, data analysis, or a similar role, with a demonstrated track record of manipulating and analyzing large datasets.
Proficiency in data manipulation languages and data visualization tools (e.g., Workday Discovery Boards, Tableau, Power BI).
Strong analytical and problem-solving skills, with the ability to translate business requirements into analytical solutions.
Excellent communication and storytelling abilities, with the capacity to convey complex data insights to diverse audiences in a clear and compelling manner.
Proven experience in strategic planning and project management, with the ability to balance long-term vision with tactical execution.Proficiency in establishing and developing analytics functions, coupled with a strong aptitude for influencing stakeholders across all levels. Demonstrated ability to excel in dynamic, collaborative environments, adeptly managing multiple priorities and stakeholders with efficiency.""
Our Benefits We continuously evaluate and update our benefit programs to ensure that our plans meet the needs of our employees and their dependents. Below are a few highlights of our inclusive benefit programs:Expansive Health & Wellness BenefitsGenerous Retirement & Savings PlansGlobal Parental Leave & Adoption Assistance
In today’s world, what do we stand for?Ethics and integrity are the foundation of delivering on our commitment to you. We believe that core values drive success, and that when relationships are held in the highest regard, there is nothing that cannot be accomplished.

At Sompo International, our ring is more than a logo, it is a symbol of our promise. Click here to learn more about life at Sompo.Sompo is an equal opportunity employer and we intentionally value inclusion and diversity. Above all, we want you to work in an environment that respects everyone’s unique contributions – we are passionately committed to equal opportunities. We do not discriminate based on race, color, religion, sex orientation, national origin, or age.

About Us
Sompo is a specialty provider of property and casualty insurance and reinsurance, established in March 2017 as the result of the acquisition of Endurance Specialty Holdings Ltd. by Sompo Holdings Ltd. (Sompo).
Sompo's core business encompasses one of the largest property and casualty insurance groups in the Japanese domestic market. In addition, Sompo is engaged in the provision of insurance services as well as other related services through its global network of businesses operating in 32 countries around the world. 
Sompo is the international operation and a wholly owned subsidiary of Sompo, which trades on the Tokyo Stock Exchange. Through our operating subsidiaries, Sompo International underwrites agriculture, professional lines, property, marine and energy, and casualty and other specialty lines of insurance and catastrophe, property, casualty, professional lines, weather risk and specialty lines of reinsurance.
As a leading global provider of insurance and reinsurance, we recognize that our success is derived directly from those who matter most: our people. Sompo International’s headquarters are in Bermuda, and we currently have offices in the U.S., U.K., Continental Europe, and Asia. At Sompo International, a shared commitment to integrity, teamwork, agility, execution, and excellence defines our culture, and we strive to create exceptional value for our clients and shareholders and maintain Sompo International as a desirable place to work.
To learn more about Sompo International visit our website at www.sompo-intl.com","<p><strong>Are you looking for your next opportunity?</strong></p><p>
</p><p>
</p><p>Sompo is offering a distinctive opportunity for a <undefined><strong>Senior Global HR Data Analyst</undefined></strong> within our Talent Management Center of Excellence, situated in our Global Human Resources team.</p><p>
</p><p>The ideal candidate for this role will demonstrate a diverse skill set, encompassing proficiency in mining and manipulating extensive and diverse datasets, mastery of data software and visualization tools, and a knack for crafting compelling narratives from data insights. Additionally, collaboration and relationship-building are essential traits, as the candidate will need to work closely with various teams and stakeholders to effectively leverage data for informed decision-making.</p><p>
</p><p><strong>Location:</strong> This position will be a <undefined>hybrid role</undefined> based out of our <undefined><strong>Boston Massachusetts</undefined></strong> office.</p><p>
</p><p><strong>Our business, your impact, our opportunity:</strong></p><p>
</p><p><strong>What you’ll be doing:</strong></p><p>
</p><p><strong>Advanced Analysis:</strong></p><p>Conducting analysis of HR data using statistical methodologies such as regression analysis, hypothesis testing, and machine learning algorithms. You'll uncover nuanced patterns, correlations, and trends within HR datasets to extract actionable insights that drive strategic initiatives.</p><p>
</p><p><strong>Data Visualization and Reporting:</strong></p><p>Harnessing the power of visualization tools like Workday Discovery Boards, Tableau or Power BI to create visually compelling dashboards and reports. Your aim is to translate complex analytical findings into easily understandable visual narratives, empowering HR professionals and key stakeholders to make informed decisions.</p><p>
</p><p><strong>Communication and Storytelling:</strong></p><p>You'll articulate complex analytical findings in a clear and compelling manner, tailoring communication to resonate with diverse audiences across the organization. Developing visually engaging presentations and reports will distill complex insights into actionable recommendations, facilitating data-driven decision-making.</p><p>
</p><p><strong>Technology and Tools:</strong></p><p>Staying at the forefront of HR analytics tools, you'll evaluate and implement software solutions to enhance data collection, analysis, and reporting capabilities. Ensuring adherence to ethical guidelines and data privacy regulations is crucial to safeguard the integrity and confidentiality of sensitive employee data throughout the analytics process.</p><p>
</p><p>
</p><p>
</p><p><strong>Collaboration and Consultation:</strong></p><p>Fostering collaborative partnerships with HR stakeholders, key internal partners, vendors, and business leaders is key. By understanding their unique requirements, you'll provide tailored analytical guidance and translate business challenges into actionable analytical approaches, delivering insights that drive outcomes and inform strategic direction.</p><p>
</p><p><strong>Staying Updated on Industry Trends:</strong></p><p>Maintaining a pulse on industry trends and emerging best practices in people analytics is essential. You'll proactively incorporate innovative techniques to enhance analytical capabilities and contribute to thought leadership within the field of HR analytics, continuously elevating the organization's analytical maturity.</p><p>
</p><p><strong>What you’ll bring:</strong></p><p>
</p><ul><li>Bachelor’s degree in Industrial / Organizational Psychology, Statistics, Data Science, Computer Science, or a related field; Master’s degree preferred.</li></ul><p>
</p><ul><li>Minimum of seven (7) years of experience in HR analytics, data analysis, or a similar role, with a demonstrated track record of manipulating and analyzing large datasets.</li></ul><p>
</p><ul><li>Proficiency in data manipulation languages and data visualization tools (e.g., Workday Discovery Boards, Tableau, Power BI).</li></ul><p>
</p><ul><li>Strong analytical and problem-solving skills, with the ability to translate business requirements into analytical solutions.</li></ul><p>
</p><ul><li>Excellent communication and storytelling abilities, with the capacity to convey complex data insights to diverse audiences in a clear and compelling manner.</li></ul><p>
</p><ul><li>Proven experience in strategic planning and project management, with the ability to balance long-term vision with tactical execution.</li><li>Proficiency in establishing and developing analytics functions, coupled with a strong aptitude for influencing stakeholders across all levels. Demonstrated ability to excel in dynamic, collaborative environments, adeptly managing multiple priorities and stakeholders with efficiency.""</li></ul><p>
</p><p><strong>Our Benefits </strong></p><p>We continuously evaluate and update our benefit programs to ensure that our plans meet the needs of our employees and their dependents. Below are a few highlights of our inclusive benefit programs:</p><ul><li>Expansive Health & Wellness Benefits</li><li>Generous Retirement & Savings Plans</li><li>Global Parental Leave & Adoption Assistance</li></ul><p>
</p><p><strong>In today’s world, what do we stand for?</strong></p><p>Ethics and integrity are the foundation of delivering on our commitment to you. We believe that core values drive success, and that when relationships are held in the highest regard, there is nothing that cannot be accomplished.</p><p>
</p><p>
</p><p>At Sompo International, our ring is more than a logo, it is a symbol of our promise. Click <undefined>here</undefined> to learn more about life at Sompo.</p><p>Sompo is an equal opportunity employer and we intentionally value inclusion and diversity. Above all, we want you to work in an environment that respects everyone’s unique contributions – we are passionately committed to equal opportunities. We do not discriminate based on race, color, religion, sex orientation, national origin, or age.</p><p>
</p><p>
</p><p><strong>About Us</strong></p><p>
</p><p>Sompo is a specialty provider of property and casualty insurance and reinsurance, established in March 2017 as the result of the acquisition of Endurance Specialty Holdings Ltd. by Sompo Holdings Ltd. (Sompo).</p><p>
</p><p>Sompo's core business encompasses one of the largest property and casualty insurance groups in the Japanese domestic market. In addition, Sompo is engaged in the provision of insurance services as well as other related services through its global network of businesses operating in 32 countries around the world. </p><p>
</p><p>Sompo is the international operation and a wholly owned subsidiary of Sompo, which trades on the Tokyo Stock Exchange. Through our operating subsidiaries, Sompo International underwrites agriculture, professional lines, property, marine and energy, and casualty and other specialty lines of insurance and catastrophe, property, casualty, professional lines, weather risk and specialty lines of reinsurance.</p><p>
</p><p>As a leading global provider of insurance and reinsurance, we recognize that our success is derived directly from those who matter most: our people. Sompo International’s headquarters are in Bermuda, and we currently have offices in the U.S., U.K., Continental Europe, and Asia. At Sompo International, a shared commitment to integrity, teamwork, agility, execution, and excellence defines our culture, and we strive to create exceptional value for our clients and shareholders and maintain Sompo International as a desirable place to work.</p><p>
</p><p><strong>To learn more about Sompo International visit our website at <undefined>www.sompo-intl.com</undefined></strong></p>","Sompo · Boston, MA (On-site)","https://www.linkedin.com/jobs/view/3909648432/","Boston, Massachusetts, United States","Skills: HR Analytics, Data Analytics, +8 more","5,001-10,000 employees · Insurance
8 school alumni work here","LISTED","85412395","Sompo","https://media.licdn.com/dms/image/D4E0BAQFvWV9lNqTDIQ/company-logo_400_400/0/1709517991806/sompo_international_logo?e=1722470400&v=beta&t=7Girw1dePJC8dvsKyXg2lYev2CrZGGKo_2hexvPgkr0","2024-04-24T12:43:53.000Z","2024-04-30T00:09:12.550Z"
"People Research Scientist","Who we are

About Stripe

Stripe is a financial infrastructure platform for businesses. Millions of companies—from the world’s largest enterprises to the most ambitious startups—use Stripe to accept payments, grow their revenue, and accelerate new business opportunities. Our mission is to increase the GDP of the internet, and we have a staggering amount of work ahead. That means you have an unprecedented opportunity to put the global economy within everyone’s reach while doing the most important work of your career.

About The Team

Our mission on the People Research & Insights team is to improve Stripe’s performance by understanding what’s moving the needle on our people strategy, clarifying the link between our people strategy and business outcomes, and using these insights to drive data-informed decisions throughout the employee lifecycle. We’re a collection of individuals with backgrounds in people science and organizational behavior, who are obsessed with delivering high-value output to our users.

What you’ll do

Responsibilities

Use qualitative and quantitative research methods to contribute valuable insights to our evolving people processes and programs.Develop and present comprehensive storylines from organizational data, influencing and enabling decision-making for leaders.Articulate and present complex research findings effectively to diverse audiences ranging from program designers to executives.Design, implement, and evaluate complex organizational interventions to enhance the growth and success of Stripes.Collaborate seamlessly with cross functional partner teams, internal stakeholders, and business leaders, using data and insights to inform decisions.Leverage structured and unstructured data efficiently to support key organizational initiatives and processes.


Who you are

We’re looking for someone who meets the minimum requirements to be considered for the role. If you meet these requirements, you are encouraged to apply. The preferred qualifications are a bonus, not a requirement.

Minimum Requirements

Master’s or Doctoral degree in a field emphasizing the science of human behavior at work (e.g., Organizational Behavior, Industrial/Organizational Psychology, or a related field).5+ years of experience conducting research in an organization or consulting environment, including formulating questions with customers, collecting and analyzing data, generating insights, and sharing results with various types of audiences.Proficient in organizational research methodology, statistics, predictive analytics, and statistical programming software (e.g., R or Python).Ability to manage competing priorities and timelines to deliver high-quality solutions, as-promised and on-timeExperience communicating technical concepts clearly, with all audiences.Flexible and comfortable with ambiguity (our environment changes rapidly, and your work might too!).Stay up to date on best practices, scientific findings, and case studies in the world of people science.


Working remotely at Stripe

A remote location, in most cases, is defined as being 35 miles (56 kilometers) or more from one of our offices. While you would be welcome to come into the office for team/business meetings, on-sites, meet-ups, and events, our expectation is you would regularly work from home rather than a Stripe office. Stripe does not cover the cost of relocating to a remote location. We encourage you to apply for roles that match the location where you currently or plan to live.

Pay and benefits

The annual US base salary range for this role is $147,300 - $221,000. For sales roles, the range provided is the role’s On Target Earnings (""OTE"") range, meaning that the range includes both the sales commissions/sales bonuses target and annual base salary for the role. This salary range may be inclusive of several career levels at Stripe and will be narrowed during the interview process based on a number of factors, including the candidate’s experience, qualifications, and location. Applicants interested in this role and who are not located in the US may request the annual salary range for their location during the interview process.

Additional benefits for this role may include: equity, company bonus or sales commissions/bonuses; 401(k) plan; medical, dental, and vision benefits; and wellness stipends.","Who we are

<strong>About Stripe

</strong>Stripe is a financial infrastructure platform for businesses. Millions of companies—from the world’s largest enterprises to the most ambitious startups—use Stripe to accept payments, grow their revenue, and accelerate new business opportunities. Our mission is to increase the GDP of the internet, and we have a staggering amount of work ahead. That means you have an unprecedented opportunity to put the global economy within everyone’s reach while doing the most important work of your career.

<strong>About The Team

</strong>Our mission on the People Research & Insights team is to improve Stripe’s performance by understanding what’s moving the needle on our people strategy, clarifying the link between our people strategy and business outcomes, and using these insights to drive data-informed decisions throughout the employee lifecycle. We’re a collection of individuals with backgrounds in people science and organizational behavior, who are obsessed with delivering high-value output to our users.

What you’ll do

<strong>Responsibilities

</strong><ul><li>Use qualitative and quantitative research methods to contribute valuable insights to our evolving people processes and programs.</li><li>Develop and present comprehensive storylines from organizational data, influencing and enabling decision-making for leaders.</li><li>Articulate and present complex research findings effectively to diverse audiences ranging from program designers to executives.</li><li>Design, implement, and evaluate complex organizational interventions to enhance the growth and success of Stripes.</li><li>Collaborate seamlessly with cross functional partner teams, internal stakeholders, and business leaders, using data and insights to inform decisions.</li><li>Leverage structured and unstructured data efficiently to support key organizational initiatives and processes.


</li></ul>Who you are

We’re looking for someone who meets the minimum requirements to be considered for the role. If you meet these requirements, you are encouraged to apply. The preferred qualifications are a bonus, not a requirement.

<strong>Minimum Requirements

</strong><ul><li>Master’s or Doctoral degree in a field emphasizing the science of human behavior at work (e.g., Organizational Behavior, Industrial/Organizational Psychology, or a related field).</li><li>5+ years of experience conducting research in an organization or consulting environment, including formulating questions with customers, collecting and analyzing data, generating insights, and sharing results with various types of audiences.</li><li>Proficient in organizational research methodology, statistics, predictive analytics, and statistical programming software (e.g., R or Python).</li><li>Ability to manage competing priorities and timelines to deliver high-quality solutions, as-promised and on-time</li><li>Experience communicating technical concepts clearly, with all audiences.</li><li>Flexible and comfortable with ambiguity (our environment changes rapidly, and your work might too!).</li><li>Stay up to date on best practices, scientific findings, and case studies in the world of people science.


</li></ul>Working remotely at Stripe

A remote location, in most cases, is defined as being 35 miles (56 kilometers) or more from one of our offices. While you would be welcome to come into the office for team/business meetings, on-sites, meet-ups, and events, our expectation is you would regularly work from home rather than a Stripe office. Stripe does not cover the cost of relocating to a remote location. We encourage you to apply for roles that match the location where you currently or plan to live.

Pay and benefits

The annual US base salary range for this role is $147,300 - $221,000. For sales roles, the range provided is the role’s On Target Earnings (""OTE"") range, meaning that the range includes both the sales commissions/sales bonuses target and annual base salary for the role. This salary range may be inclusive of several career levels at Stripe and will be narrowed during the interview process based on a number of factors, including the candidate’s experience, qualifications, and location. Applicants interested in this role and who are not located in the US may request the annual salary range for their location during the interview process.

Additional benefits for this role may include: equity, company bonus or sales commissions/bonuses; 401(k) plan; medical, dental, and vision benefits; and wellness stipends.","Stripe · United States (Remote)","https://www.linkedin.com/jobs/view/3877691201/","United States","Skills: Quantitative Research, Data Science, +8 more","1,001-5,000 employees · Technology, Information and Internet
14 school alumni work here","LISTED","113060463","Stripe","https://media.licdn.com/dms/image/C560BAQF1NNJs-2xA5g/company-logo_400_400/0/1630643399686/stripe_logo?e=1722470400&v=beta&t=_anhm8BD_E51tVAjD_PGLO7ifYuKaCraAEhmDxaYXPc","2024-03-30T10:35:19.000Z","2024-04-30T00:09:12.550Z"
