"Title","Description","Description HTML","Primary Description","Detail URL","Location","Skill","Insight","Job State","Poster Id","Company Name","Company Logo","Created At","Scraped At"
"Senior Researcher, Product Experience (Growth)","Netflix is one of the world's leading streaming entertainment services, with over 260 million members in over 190 countries enjoying TV series, documentaries, feature films, and mobile games across various genres and languages. Members can play, pause, and resume watching as they want, anytime, anywhere, and change their plans anytime.

The Product Experience Research team is central in uncovering compelling ways to engage and entertain our global members. This Senior Research role supports Growth, which strives to better attract new members to Netflix and explore new monetization opportunities worldwide. Specifically, this role will focus on how Netflix can deliver better value to more members through new ad-supported offerings.

This is an opportunity to lead innovative research with demonstrable impact on a global scale. You will be responsible for defining, leading, analyzing, and socializing research studies that generate insights to empower business decisions across the company. You’ll partner with cross-functional teams passionate about delivering the most engaging, innovative, and inclusive experiences.


In This Role, You Will


Identify, prioritize, and lead research roadmaps that generate insights to inform monetization strategies across the company.Partner with cross-functional teams, including Product, Ads, Product Marketing, Design, Data Science, Strategy Planning & Analysis, and Brand to proactively develop research initiatives.Define, design, execute, and socialize a range of research studies that build a strong understanding of existing and future audiences and their experiences worldwide.Identify best practices in existing and emerging research methodologies.



About You


Demonstrable experience in product research and/or user experience (UX) research informing growth and monetization strategy. Experience supporting subscription businesses or ad-supported online products preferred.Mixed methods research expertise including hands-on experience leading end-to-end quantitative and qualitative research studiesA balance of creative and analytical skills with the ability to proactively define research questions, identify appropriate methods, execute studies, and synthesize findings.Strong communicator with a bias toward action to proactively collaborate with multiple teams across the company.Passionate about translating findings into actionable strategic business recommendationsGlobal research experience is highly preferred but not required.


Tags: ResearchSite

Our compensation structure consists solely of an annual salary; we do not have bonuses. You choose each year how much of your compensation you want in salary versus stock options. To determine your personal top of market compensation, we rely on market indicators and consider your specific job family, background, skills, and experience to determine your compensation in the market range. The range for this role is $110,000 - $440,000.

Netflix provides comprehensive benefits including Health Plans, Mental Health support, a 401(k) Retirement Plan with employer match, Stock Option Program, Disability Programs, Health Savings and Flexible Spending Accounts, Family-forming benefits, and Life and Serious Injury Benefits. We also offer paid leave of absence programs. Full-time hourly employees accrue 35 days annually for paid time off to be used for vacation, holidays, and sick paid time off. Full-time salaried employees are immediately entitled to flexible time off. See more detail about our Benefits here.

Netflix is a unique culture and environment. Learn more here.

We are an equal-opportunity employer and celebrate diversity, recognizing that diversity of thought and background builds stronger teams. We approach diversity and inclusion seriously and thoughtfully. We do not discriminate on the basis of race, religion, color, ancestry, national origin, caste, sex, sexual orientation, gender, gender identity or expression, age, disability, medical condition, pregnancy, genetic makeup, marital status, or military service.","Netflix is one of the world's leading streaming entertainment services, with over 260 million members in over 190 countries enjoying TV series, documentaries, feature films, and mobile games across various genres and languages. Members can play, pause, and resume watching as they want, anytime, anywhere, and change their plans anytime.

The Product Experience Research team is central in uncovering compelling ways to engage and entertain our global members. This Senior Research role supports Growth, which strives to better attract new members to Netflix and explore new monetization opportunities worldwide. Specifically, this role will focus on how Netflix can deliver better value to more members through new ad-supported offerings.

This is an opportunity to lead innovative research with demonstrable impact on a global scale. You will be responsible for defining, leading, analyzing, and socializing research studies that generate insights to empower business decisions across the company. You’ll partner with cross-functional teams passionate about delivering the most engaging, innovative, and inclusive experiences.


<strong>In This Role, You Will


</strong><ul><li>Identify, prioritize, and lead research roadmaps that generate insights to inform monetization strategies across the company.</li><li>Partner with cross-functional teams, including Product, Ads, Product Marketing, Design, Data Science, Strategy Planning & Analysis, and Brand to proactively develop research initiatives.</li><li>Define, design, execute, and socialize a range of research studies that build a strong understanding of existing and future audiences and their experiences worldwide.</li><li>Identify best practices in existing and emerging research methodologies.



</li></ul><strong>About You


</strong><ul><li>Demonstrable experience in product research and/or user experience (UX) research informing growth and monetization strategy. Experience supporting subscription businesses or ad-supported online products preferred.</li><li>Mixed methods research expertise including hands-on experience leading end-to-end quantitative and qualitative research studies</li><li>A balance of creative and analytical skills with the ability to proactively define research questions, identify appropriate methods, execute studies, and synthesize findings.</li><li>Strong communicator with a bias toward action to proactively collaborate with multiple teams across the company.</li><li>Passionate about translating findings into actionable strategic business recommendations</li><li>Global research experience is highly preferred but not required.


</li></ul>Tags: ResearchSite

Our compensation structure consists solely of an annual salary; we do not have bonuses. You choose each year how much of your compensation you want in salary versus stock options. To determine your personal top of market compensation, we rely on market indicators and consider your specific job family, background, skills, and experience to determine your compensation in the market range. The range for this role is $110,000 - $440,000.

Netflix provides comprehensive benefits including Health Plans, Mental Health support, a 401(k) Retirement Plan with employer match, Stock Option Program, Disability Programs, Health Savings and Flexible Spending Accounts, Family-forming benefits, and Life and Serious Injury Benefits. We also offer paid leave of absence programs. Full-time hourly employees accrue 35 days annually for paid time off to be used for vacation, holidays, and sick paid time off. Full-time salaried employees are immediately entitled to flexible time off. See more detail about our Benefits here.

Netflix is a unique culture and environment. Learn more here.

We are an equal-opportunity employer and celebrate diversity, recognizing that diversity of thought and background builds stronger teams. We approach diversity and inclusion seriously and thoughtfully. We do not discriminate on the basis of race, religion, color, ancestry, national origin, caste, sex, sexual orientation, gender, gender identity or expression, age, disability, medical condition, pregnancy, genetic makeup, marital status, or military service.","Netflix · Los Gatos, CA","https://www.linkedin.com/jobs/view/3819156659/","Los Gatos, California, United States","6 of 10 skills match your profile - you may be a good fit","10,001+ employees · Entertainment Providers
23 school alumni work here","LISTED","368130583","Netflix","https://media.licdn.com/dms/image/C4E0BAQEVb0ZISWk8vQ/company-logo_400_400/0/1631355051964?e=1722470400&v=beta&t=Nr9hwwd5ZP_uWNJjl22l3O5KQyD-xIgh5IN_TEiC5aI","2024-02-01T02:38:03.000Z","2024-04-30T00:09:12.550Z"
"Global People Analytics Director – Professional Services – New York City","Based in New York City, we are collaborating with a leading professional services firm in the search for an accomplished Global Director of People Analytics, who will lead the human capital data analytics processes and practices, including HRIS, compensation, and operations.

This is a unique opportunity tailored for seasoned professionals who have led comparable global professional services firms through HR transformation and change management.

Newly Created Role Leading a team of 30 in a Global Top Tier FirmOverseeing HRIS, People Analytics, and CompensationPlaying a significant role in change management and HR transformation


In this role, the HR professional drives the firm's growth through strategic use of people analytics, leading data-driven decision-making aligned with company culture. They excel in storytelling with data, leveraging expertise in people management systems and processes to deliver compliant human capital insights. Additionally, they collaborate with Human Capital leaders and the Office of the General Counsel to evolve HR policies and processes.

Develop and execute a comprehensive people analytics strategy aligned with organizational goals, identifying key metrics and data sources for measuring workforce performance, engagement, and productivity. Align existing HR systems with the strategy, ensuring synchronization and working on reporting, rebuilding the compensation framework, and job architecture.Lead and mentor a global people analytics team of 30, fostering a collaborative and innovative environment for continuous learning and professional growth.Conduct in-depth analysis to uncover patterns, correlations, and trends in HR data, utilizing data visualization tools to effectively communicate complex findings to stakeholders.Stay updated on advancements in HR technology and analytics methodologies, evaluating and implementing appropriate software and systems to enhance data collection, analysis, and reporting capabilities.Clearly communicate analytical insights to non-technical stakeholders, ensuring compliance with data privacy regulations and ethical guidelines throughout the analytics process.Collaborate with HR stakeholders and business leaders to understand requirements and provide analytical guidance, translating business problems into actionable insights.Stay informed about industry trends and best practices in people analytics, continuously enhancing skills and contributing innovative solutions to HR challenges.


Key Requirements:

Bachelor’s degree or advanced degree is preferred.Master’s degree or equivalent in Industrial-Organizational Psychology or a related field is preferred.Minimum of 12 years’ experience in people analytics, reporting, and HR best practices is required.Expertise in legal and regulatory factors related to Human Resources.Strategic thinking ability and the capability to influence business objectives.Strong organizational skills and professional interpersonal skills to manage multiple requests and interact effectively at all levels.Team player with a focus on customer service.Ability to handle confidential information discreetly.Excellent leadership skills for managing multiple teams.Proficiency in PC applications, including MS Office.


For further details please contact Roshan Jayawardena on rj@elliottscotthr.com.

Job Code RJ/17698

Personal data collected will be used for recruitment purposes only. By applying for this position, you consent to the collection, use and disclosure of your personal data to Elliott Scott HR Recruitment Ltd. and all relevant third parties for the purpose of processing your application for this job position. You understand and acknowledge that your personal data will be processed in accordance with our Privacy Policy https://www.elliottscotthr.com/privacy-policy

Please note that only short-listed candidates will be contacted.","Based in New York City, we are collaborating with a leading professional services firm in the search for an accomplished Global Director of People Analytics, who will lead the human capital data analytics processes and practices, including HRIS, compensation, and operations.

This is a unique opportunity tailored for seasoned professionals who have led comparable global professional services firms through HR transformation and change management.

<ul><li>Newly Created Role </li><li>Leading a team of 30 in a Global Top Tier Firm</li><li>Overseeing HRIS, People Analytics, and Compensation</li><li>Playing a significant role in change management and HR transformation


</li></ul>In this role, the HR professional drives the firm's growth through strategic use of people analytics, leading data-driven decision-making aligned with company culture. They excel in storytelling with data, leveraging expertise in people management systems and processes to deliver compliant human capital insights. Additionally, they collaborate with Human Capital leaders and the Office of the General Counsel to evolve HR policies and processes.

<ul><li>Develop and execute a comprehensive people analytics strategy aligned with organizational goals, identifying key metrics and data sources for measuring workforce performance, engagement, and productivity. </li><li>Align existing HR systems with the strategy, ensuring synchronization and working on reporting, rebuilding the compensation framework, and job architecture.</li><li>Lead and mentor a global people analytics team of 30, fostering a collaborative and innovative environment for continuous learning and professional growth.</li><li>Conduct in-depth analysis to uncover patterns, correlations, and trends in HR data, utilizing data visualization tools to effectively communicate complex findings to stakeholders.</li><li>Stay updated on advancements in HR technology and analytics methodologies, evaluating and implementing appropriate software and systems to enhance data collection, analysis, and reporting capabilities.</li><li>Clearly communicate analytical insights to non-technical stakeholders, ensuring compliance with data privacy regulations and ethical guidelines throughout the analytics process.</li><li>Collaborate with HR stakeholders and business leaders to understand requirements and provide analytical guidance, translating business problems into actionable insights.</li><li>Stay informed about industry trends and best practices in people analytics, continuously enhancing skills and contributing innovative solutions to HR challenges.


</li></ul>Key Requirements:

<ul><li>Bachelor’s degree or advanced degree is preferred.</li><li>Master’s degree or equivalent in Industrial-Organizational Psychology or a related field is preferred.</li><li>Minimum of 12 years’ experience in people analytics, reporting, and HR best practices is required.</li><li>Expertise in legal and regulatory factors related to Human Resources.</li><li>Strategic thinking ability and the capability to influence business objectives.</li><li>Strong organizational skills and professional interpersonal skills to manage multiple requests and interact effectively at all levels.</li><li>Team player with a focus on customer service.</li><li>Ability to handle confidential information discreetly.</li><li>Excellent leadership skills for managing multiple teams.</li><li>Proficiency in PC applications, including MS Office.


</li></ul>For further details please contact Roshan Jayawardena on rj@elliottscotthr.com.

Job Code RJ/17698

Personal data collected will be used for recruitment purposes only. By applying for this position, you consent to the collection, use and disclosure of your personal data to Elliott Scott HR Recruitment Ltd. and all relevant third parties for the purpose of processing your application for this job position. You understand and acknowledge that your personal data will be processed in accordance with our Privacy Policy https://www.elliottscotthr.com/privacy-policy

<i>Please note that only short-listed candidates will be contacted.</i>","Elliott Scott HR · New York, NY","https://www.linkedin.com/jobs/view/3913780731/","New York, New York, United States","Skills: Strategic Thinking, Analytics, +8 more","11-50 employees · Staffing and Recruiting","LISTED","42059368","Elliott Scott HR","https://media.licdn.com/dms/image/C4D0BAQEAJ-5zs96vAA/company-logo_400_400/0/1631343286523?e=1722470400&v=beta&t=AKKuNenHg-_0gWMRIoo3lmO7phRLYWwJQeswCps57L8","2024-04-29T21:15:43.000Z","2024-04-30T00:09:12.550Z"
