"Title","Description","Description HTML","Primary Description","Detail URL","Location","Skill","Insight","Job State","Poster Id","Company Name","Company Logo","Created At","Scraped At"
"Associate Director, Data Analytics","Who We Are

SiriusXM and its brands (Pandora, SXM Media, AdsWizz, Simplecast, and SiriusXM Connected Vehicle Services) are leading a new era of audio entertainment and services by delivering the most compelling subscription and ad-supported audio entertainment experience for listeners -- in the car, at home, and anywhere on the go with connected devices. Our vision is to shape the future of audio, where everyone can be effortlessly connected to the voices, stories and music they love wherever they are.

This is the place where a diverse group of emerging talent and legends alike come to share authentic and purposeful songs, stories, sounds and insights through some of the best programming and technology in the world. Our critically-acclaimed, industry-leading audio entertainment encompasses music, sports, comedy, news, talk, live events, and podcasting. No matter their individual role, each of our employees plays a vital part in bringing SiriusXM’s vision to life every day.

SiriusXM Connected Vehicle

SiriusXM Connected Vehicle (SiriusXM CV) is a leading provider of connected services to vehicle manufacturers, delivering one of the most broadly adopted connected vehicle platforms in North America for the last 25 years. Named the 2020 Company of the Year in the Telematics Industry by Frost & Sullivan, we provide safety, security and convenience services to millions of vehicle owners across major automotive brands. Our teams are continuously working to develop leading-edge technology that can not only add convenience to the daily lives of so many drivers across the country but our advancements in safety and security could also help save their lives.

How You’ll Make An Impact

As our Associate Director of Data Analytics at SiriusXM Connected Vehicles you will be directly responsible for our data and analytics offerings and services. You will be a key part of our transformational journey to a modernized data-driven company. The data and analytics platform will be the key enablement technology used by our marketing, sales, and financial services to provide near real-time data for analysis and decision making. You will evangelize, teach, and grow a data-driven culture across the business, working with key executives and stakeholders along the way to better understand the needs of the business, as well as to better educate and provide insight and exposure to the opportunities a modern data platform will provide to a business.

What You’ll Do

As our Associate Director of Data Analytics at SiriusXM Connected Vehicles you will take direct ownership of our freshly launched analytics platform. You will work directly with executive and functional leadership across the business to include sales, marketing, business development, finance, our B2B customers and more to ensure delivery of strategic initiatives that will directly impact our bottom line.

Additionally, you will build and develop a team of engineers, analysts and data scientists to continually build and improve upon our data capabilities. You will be directly responsible for building and implementing a long-term strategic vision for ever expanding data capabilities. You will establish and drive the culture across the business for what data is and how we manage it.

What You’ll Need

10+ years in Software Engineering and/or Data AnalyticsAt least 4 years of experience managing and mentoring software engineering and/or data analytics teams.Strong communication skills and a demonstrated ability to communicate effectively and efficiently both up, down, and laterally across the organization.Demonstrated ability to coordinate.Collaborate with all functions of the company to ensure data needs are addressed and the required data is modeled and available to analysts and end-users.Provide leadership and consistency regarding standard processes to handle and answer recurring & ad-hoc reporting requests by different stakeholders.Continuously develop and improve procedures to enforce analytics approach that will lead to more strategic/insightful learnings and recommendations and/or workflow improvementsPartner with key stakeholders to develop test & learn strategies related to customer acquisition and retention to drive business impactDevelop a roadmap for the data and analytics function that clearly defines ownership and responsibility between the central data function and the functional groupsWork cross-functionally with executives and high-level stakeholders to understand their problems and deliver data-driven solutions.Strong communication and prioritization skills, attention to detail, and ability to manage multiple projects and stakeholders in a fast-paced environment.Experience with customer acquisition, churn, LTV, ROI, and re-engagementAgile with the ability to speak and relate to each business function. Can quickly come up to speed and understand support services sales, operations, HR, and all other areas.Strong communicator who can take complex ideas and methodologies, and simplify them for non-technical audiencesMust have legal right to work in the U.S.

Our goal at SiriusXM is to provide and maintain a work environment that fosters mutual respect, professionalism and cooperation. SiriusXM is an equal opportunity employer that does not discriminate on the basis of actual or perceived race, creed, color, religion, national origin, ancestry, alienage or citizenship status, age, disability or handicap, sex, gender identity, marital status, familial status, veteran status, sexual orientation or any other characteristic protected by applicable federal, state or local laws.

The requirements and duties described above may be modified or waived by the Company in its sole discretion without notice.

R-2023-11-41","<strong>Who We Are

</strong>SiriusXM and its brands (Pandora, SXM Media, AdsWizz, Simplecast, and SiriusXM Connected Vehicle Services) are leading a new era of audio entertainment and services by delivering the most compelling subscription and ad-supported audio entertainment experience for listeners -- in the car, at home, and anywhere on the go with connected devices. Our vision is to shape the future of audio, where everyone can be effortlessly connected to the voices, stories and music they love wherever they are.

This is the place where a diverse group of emerging talent and legends alike come to share authentic and purposeful songs, stories, sounds and insights through some of the best programming and technology in the world. Our critically-acclaimed, industry-leading audio entertainment encompasses music, sports, comedy, news, talk, live events, and podcasting. No matter their individual role, each of our employees plays a vital part in bringing SiriusXM’s vision to life every day.

<strong>SiriusXM Connected Vehicle

</strong>SiriusXM Connected Vehicle (SiriusXM CV) is a leading provider of connected services to vehicle manufacturers, delivering one of the most broadly adopted connected vehicle platforms in North America for the last 25 years. Named the 2020 Company of the Year in the Telematics Industry by Frost & Sullivan, we provide safety, security and convenience services to millions of vehicle owners across major automotive brands. Our teams are continuously working to develop leading-edge technology that can not only add convenience to the daily lives of so many drivers across the country but our advancements in safety and security could also help save their lives.

<strong>How You’ll Make An Impact

</strong>As our Associate Director of Data Analytics at SiriusXM Connected Vehicles you will be directly responsible for our data and analytics offerings and services. You will be a key part of our transformational journey to a modernized data-driven company. The data and analytics platform will be the key enablement technology used by our marketing, sales, and financial services to provide near real-time data for analysis and decision making. You will evangelize, teach, and grow a data-driven culture across the business, working with key executives and stakeholders along the way to better understand the needs of the business, as well as to better educate and provide insight and exposure to the opportunities a modern data platform will provide to a business.

<strong>What You’ll Do

</strong>As our Associate Director of Data Analytics at SiriusXM Connected Vehicles you will take direct ownership of our freshly launched analytics platform. You will work directly with executive and functional leadership across the business to include sales, marketing, business development, finance, our B2B customers and more to ensure delivery of strategic initiatives that will directly impact our bottom line.

Additionally, you will build and develop a team of engineers, analysts and data scientists to continually build and improve upon our data capabilities. You will be directly responsible for building and implementing a long-term strategic vision for ever expanding data capabilities. You will establish and drive the culture across the business for what data is and how we manage it.

<strong>What You’ll Need

</strong><ul><li>10+ years in Software Engineering and/or Data Analytics</li><li>At least 4 years of experience managing and mentoring software engineering and/or data analytics teams.</li><li>Strong communication skills and a demonstrated ability to communicate effectively and efficiently both up, down, and laterally across the organization.</li><li>Demonstrated ability to coordinate.</li><li>Collaborate with all functions of the company to ensure data needs are addressed and the required data is modeled and available to analysts and end-users.</li><li>Provide leadership and consistency regarding standard processes to handle and answer recurring & ad-hoc reporting requests by different stakeholders.</li><li>Continuously develop and improve procedures to enforce analytics approach that will lead to more strategic/insightful learnings and recommendations and/or workflow improvements</li><li>Partner with key stakeholders to develop test & learn strategies related to customer acquisition and retention to drive business impact</li><li>Develop a roadmap for the data and analytics function that clearly defines ownership and responsibility between the central data function and the functional groups</li><li>Work cross-functionally with executives and high-level stakeholders to understand their problems and deliver data-driven solutions.</li><li>Strong communication and prioritization skills, attention to detail, and ability to manage multiple projects and stakeholders in a fast-paced environment.</li><li>Experience with customer acquisition, churn, LTV, ROI, and re-engagement</li><li>Agile with the ability to speak and relate to each business function. Can quickly come up to speed and understand support services sales, operations, HR, and all other areas.</li><li>Strong communicator who can take complex ideas and methodologies, and simplify them for non-technical audiences</li><li>Must have legal right to work in the U.S.

</li></ul>Our goal at SiriusXM is to provide and maintain a work environment that fosters mutual respect, professionalism and cooperation. SiriusXM is an equal opportunity employer that does not discriminate on the basis of actual or perceived race, creed, color, religion, national origin, ancestry, alienage or citizenship status, age, disability or handicap, sex, gender identity, marital status, familial status, veteran status, sexual orientation or any other characteristic protected by applicable federal, state or local laws.

The requirements and duties described above may be modified or waived by the Company in its sole discretion without notice.

R-2023-11-41","SiriusXM","https://www.linkedin.com/jobs/view/3827253795/","Farmington Hills, Michigan, United States","Skills: Data Analytics, Analytics, +8 more","1,001-5,000 employees · Entertainment Providers
8 school alumni work here","LISTED","4272982","SiriusXM","https://media.licdn.com/dms/image/D560BAQGZYZJBUsuzbg/company-logo_400_400/0/1700146850253/siriusxm_logo?e=1716422400&v=beta&t=q-W_h6EljdobGEds6uSQjxSN1A9EwkANPW89ha3rpw0","2024-02-15T02:52:41.000Z","2024-02-16T02:40:23.434Z"
"Assistant Manager Human Resources","SMF (an Etnyre International Company) is a full-service heavy metal manufacturing facility that specializes in heavy and light fabrication for original equipment manufacturers (OEMs). With two locations, Minonk, IL and Anderson, SC, our organization has a fifty-year history servicing the construction, power generation, agriculture, and mining industries. Ninety-five percent of SMF’s business is as a Tier One supplier to OEMs, so we are held to high standards by our Fortune 500 clients. Our high-quality production and outstanding reputation can be attributed to our longevity in the industry, as well as our skilled members. That’s why we are in the top ½ percent of machine shops nationwide. With more than 200,000 square feet of manufacturing capabilities between our two facilities. Our processes include everything from engineering and fabrication to multiple finishing options. In late 2020, SMF joined the Etnyre International team and is now part of a larger organization with exciting growth opportunities. 
SMF has what YOU are looking for in a CAREER!! Our mission is to provide superior products and services to our customers through meaningful investments in our members and capabilities. We succeed based on the care and value we place in our members that provide services to our customers and communities around the world. Our Total Rewards Package includes:A stellar ANNUAL BONUS Program for ALL MembersCompetitive Starting Pay Based on ExperienceExcellent Benefits Package including LOW & NO COST Insurance programs and other Company Paid Benefits13 PAID Holidays (10 regular paid holidays + 3 paid Holiday Break days)A Generous Paid Vacation Package401K Plan with Company Match & Profit Sharing
JOB SUMMARY: The Assistant Human Resources Manager’s primary objective is to promote a highly talented and engaged workforce in support of Etnyre’s Mission to deliver superior products and services. In partnership with this person's manager, this person is responsible for deploying employee engagement, performance and retention programs, championing organizational change, identifying timely staffing solutions, and providing consultation and training on implementation and application of Human Resources policies and procedures.
MAJOR DUTIES:Execute timely and effective recruiting solutionsDeploy retention programs such as new hire orientation, recognition events, succession planning and trainingCollect data on effectiveness of programs such as job satisfaction and make recommendations for improvement Responsible for delivery of KPIs (Key Performance Indicators) such as turnover, time to fill job vacancies, internal  promotion rates, and participation in training programsMaintain employee personnel file recordsGenerate reports, update plan documents and conduct/participate in audits for EEO, Vets, AAP, and any other  programs in accordance with state and/or federal requirementsInfluence the application of Company Values, Mission and Vision and alignment of organizational objectives;  champion organizational change and implementation of policies and programsProvide council and guidance to management in developing high performing teams to include succession  planning, training, coaching, performance management, and disciplinary actionRepresent Company with exceptional service to employees and appropriate partnership with management  regarding inquiries, requests, and concernsConduct complaint investigations in a fair and impartial mannerGenerate reports to make recommendations on employee compensation and benefitsInterpret policies and procedures to ensure fair treatment and local, state, and federal legal compliance Perform other duties as assigned
QUALIFICATIONS:A bachelor’s degree in business with an emphasis in Human Resources or related field or equivalent experience in HR activities is required. Exceptional communication and interpersonal skills and proficiency in the use of personal computer applications are essential. PHR or SHRM certification is a plus. Working knowledge of local, state, and federal employment laws and regulations.","<p>SMF (an Etnyre International Company) is a full-service heavy metal manufacturing facility that specializes in heavy and light fabrication for original equipment manufacturers (OEMs). With two locations, Minonk, IL and Anderson, SC, our organization has a fifty-year history servicing the construction, power generation, agriculture, and mining industries. Ninety-five percent of SMF’s business is as a Tier One supplier to OEMs, so we are held to high standards by our Fortune 500 clients. Our high-quality production and outstanding reputation can be attributed to our longevity in the industry, as well as our skilled members. That’s why we are in the top ½ percent of machine shops nationwide. With more than 200,000 square feet of manufacturing capabilities between our two facilities. Our processes include everything from engineering and fabrication to multiple finishing options. In late 2020, SMF joined the Etnyre International team and is now part of a larger organization with exciting growth opportunities. </p><p>
</p><p>SMF has what YOU are looking for in a CAREER!! Our mission is to provide superior products and services to our customers through meaningful investments in our members and capabilities. We succeed based on the care and value we place in our members that provide services to our customers and communities around the world. </p><p><strong>Our Total Rewards Package includes:</strong></p><ul><li>A stellar ANNUAL BONUS Program for ALL Members</li><li>Competitive Starting Pay Based on Experience</li><li>Excellent Benefits Package including LOW & NO COST Insurance programs and other Company Paid Benefits</li><li>13 PAID Holidays (10 regular paid holidays + 3 paid Holiday Break days)</li><li>A Generous Paid Vacation Package</li><li>401K Plan with Company Match & Profit Sharing</li></ul><p>
</p><p>JOB SUMMARY: The Assistant Human Resources Manager’s primary objective is to promote a highly talented and engaged workforce in support of Etnyre’s Mission to deliver superior products and services. In partnership with this person's manager, this person is responsible for deploying employee engagement, performance and retention programs, championing organizational change, identifying timely staffing solutions, and providing consultation and training on implementation and application of Human Resources policies and procedures.</p><p>
</p><p>MAJOR DUTIES:</p><ul><li>Execute timely and effective recruiting solutions</li><li>Deploy retention programs such as new hire orientation, recognition events, succession planning and training</li><li>Collect data on effectiveness of programs such as job satisfaction and make recommendations for improvement </li><li>Responsible for delivery of KPIs (Key Performance Indicators) such as turnover, time to fill job vacancies, internal </li></ul><p> promotion rates, and participation in training programs</p><ul><li>Maintain employee personnel file records</li><li>Generate reports, update plan documents and conduct/participate in audits for EEO, Vets, AAP, and any other </li></ul><p> programs in accordance with state and/or federal requirements</p><ul><li>Influence the application of Company Values, Mission and Vision and alignment of organizational objectives; </li></ul><p> champion organizational change and implementation of policies and programs</p><ul><li>Provide council and guidance to management in developing high performing teams to include succession </li></ul><p> planning, training, coaching, performance management, and disciplinary action</p><ul><li>Represent Company with exceptional service to employees and appropriate partnership with management </li></ul><p> regarding inquiries, requests, and concerns</p><ul><li>Conduct complaint investigations in a fair and impartial manner</li><li>Generate reports to make recommendations on employee compensation and benefits</li><li>Interpret policies and procedures to ensure fair treatment and local, state, and federal legal compliance </li><li>Perform other duties as assigned</li></ul><p>
</p><p>QUALIFICATIONS:</p><p>A bachelor’s degree in business with an emphasis in Human Resources or related field or equivalent experience in HR activities is required. Exceptional communication and interpersonal skills and proficiency in the use of personal computer applications are essential. PHR or SHRM certification is a plus. Working knowledge of local, state, and federal employment laws and regulations.</p>","SMF (An Etnyre International Company)","https://www.linkedin.com/jobs/view/3827911717/","Minonk, Illinois, United States","Skills: Recruiting, Employee Relations, +2 more","201-500 employees","LISTED","1192898608","SMF (An Etnyre International Company)","https://media.licdn.com/dms/image/C4D0BAQFW0MbrlEChfA/company-logo_400_400/0/1630504266108/smf_inc_logo?e=1716422400&v=beta&t=HzwL4hioglh0S4Pq1zm7YkYRvUvVJ9i3hHvl4Ltf4_E","2024-02-15T12:42:11.000Z","2024-02-16T02:40:23.434Z"
