"Title","Description","Description HTML","Primary Description","Detail URL","Location","Skill","Insight","Job State","Poster Id","Company Name","Company Logo","Created At","Scraped At"
"Senior Policy Analyst / Senior Economist","Duties and ResponsibilitiesThe Center for AI Policy is looking for a senior policy analyst or senior economist who can educate Congress about the benefits of our proposed AI safety policies. Your primary job duties would be designing and creating substantive policy documents such as:Explanations of how our model legislation would function and why it is desirableQuestions and testimony to be presented at Congressional committee hearingsCost-benefit analyses, including analyses of what it would cost businesses to comply with our proposed legislationSuggested line-item budgets for programs recommended in our model legislationMemos comparing and contrasting our proposed risk management scheme to other risk management systems that are used or being considered by the federal governmentResponses to requests for comment from the executive branch and independent agenciesOther team members may sometimes offer feedback on style or request specific documents to support a particular briefing, but this is a relatively autonomous position: you will be expected to identify, propose, and create the documents that seem most valuable to you for advancing our cause. Similarly, we may occasionally ask you to help explain your documents in person to particular Congressional staffers or to journalists, but your primary work product would be written.
Ideal CandidateThe ideal candidate will have:Published policy memos or analyses that offered substantive analysis of a high-tech topicA background in economics, finance, business operations, compliance, or quality controlAt least 3 years of work experience after graduationThe ability to quickly write coherent and easily readable prose for a wide range of document lengths, ranging from 1 page handouts to 50 page reportsPrior familiarity with specific arguments for why artificial intelligence poses takeover risks, proliferation risks, and risks to essential infrastructure – we want you to be able to immediately start diving into the policy details that support our legislation, not to learn the basics of AI governance on the job.﻿LogisticsHybrid Office Schedule: We ask team members to come in person to our downtown DC office for six hours each on Mondays and Thursdays, and we try to schedule most of our internal team meetings on those days. If you don’t have a scheduled meeting, you are welcome to work from wherever you like. 
Immediate Availability Preferred: We are looking for candidates who can start work as soon as possible, so it is unlikely that we would be able to sponsor a visa.Compensation & Benefits: The annual salary range for this role is $90,000 - $130,000, depending on experience. We also provide basic health insurance, a $2,500/year stipend for conferences, 22 days paid time off, and a Capital BikeShare membership.","<p><strong>Duties and Responsibilities</strong></p><p>The Center for AI Policy is looking for a senior policy analyst or senior economist who can educate Congress about the benefits of our proposed AI safety policies. Your primary job duties would be designing and creating substantive policy documents such as:</p><ul><li>Explanations of how our model legislation would function and why it is desirable</li><li>Questions and testimony to be presented at Congressional committee hearings</li><li>Cost-benefit analyses, including analyses of what it would cost businesses to comply with our proposed legislation</li><li>Suggested line-item budgets for programs recommended in our model legislation</li><li>Memos comparing and contrasting our proposed risk management scheme to other risk management systems that are used or being considered by the federal government</li><li>Responses to requests for comment from the executive branch and independent agencies</li></ul><p>Other team members may sometimes offer feedback on style or request specific documents to support a particular briefing, but this is a relatively autonomous position: you will be expected to identify, propose, and create the documents that seem most valuable to you for advancing our cause. Similarly, we may occasionally ask you to help explain your documents in person to particular Congressional staffers or to journalists, but your primary work product would be written.</p><p>
</p><p><strong>Ideal Candidate</strong></p><p>The ideal candidate will have:</p><ul><li>Published policy memos or analyses that offered substantive analysis of a high-tech topic</li><li>A background in economics, finance, business operations, compliance, or quality control</li><li>At least 3 years of work experience after graduation</li><li>The ability to quickly write coherent and easily readable prose for a wide range of document lengths, ranging from 1 page handouts to 50 page reports</li><li>Prior familiarity with specific arguments for why artificial intelligence poses takeover risks, proliferation risks, and risks to essential infrastructure – we want you to be able to immediately start diving into the policy details that support our legislation, not to learn the basics of AI governance on the job.</li></ul><p>﻿</p><p><strong>Logistics</strong></p><ul><li><strong>Hybrid Office Schedule: </strong>We ask team members to come in person to our downtown DC office for six hours each on Mondays and Thursdays, and we try to schedule most of our internal team meetings on those days. If you don’t have a scheduled meeting, you are welcome to work from wherever you like. </li><li>
</li><li><strong>Immediate Availability Preferred: </strong>We are looking for candidates who can start work as soon as possible, so it is unlikely that we would be able to sponsor a visa.</li><li><strong>Compensation & Benefits:</strong> The annual salary range for this role is $90,000 - $130,000, depending on experience. We also provide basic health insurance, a $2,500/year stipend for conferences, 22 days paid time off, and a Capital BikeShare membership.</li></ul>","Center for AI Policy · Washington, DC (Hybrid)","https://www.linkedin.com/jobs/view/3882983881/","Washington, District of Columbia, United States","Skills: Analytical Skills, Qualitative Research, +8 more","1-10 employees","LISTED","1285546108","Center for AI Policy","https://media.licdn.com/dms/image/D4E0BAQHdryfSoUTNWQ/company-logo_400_400/0/1710800486704/aipolicyus_logo?e=1720656000&v=beta&t=dDuYh8_DpnyM2iBUtcqKgGlBXRKAbsTaDh4Ar3ki5RQ","2024-04-03T10:00:26.000Z","2024-04-11T16:23:44.964Z"
"Political Research Analyst","Job Description

Americans for Prosperity (AFP) is the premier grassroots organization focused on advocating solutions to the country’s greatest challenges. We recognize that tens of millions of Americans are frustrated with the extreme partisanship in government that keeps common-sense reforms from being passed, and instead seek to stand with policy leaders who are committed to finding a better way.

You are excited to build a career in politics – to help improve people’s lives and society. You recognize that principled elected officials can be part of our society’s transformation but that elections aren’t the whole solution.

You have incredible attention to detail, having noticed the typo in the book you’re reading. You scroll through social media and are frustrated by the lack of fact-checking and intellectual integrity in the various listicles and “research” going viral among your friends and family.

You thrive in a fast-paced, high-energy environment and are up to the challenge of juggling multiple projects while delivering products on time.

You have an insatiable curiosity for the facts and are effective at synthesizing ideas quickly, accurately, and clearly in writing.

Does this sound like you? Apply today to join Americans for Prosperity (AFP) as our next Senior Political Research Analyst!

This role is based in our Arlington, VA office

Your Responsibilities Include

You will perform policy and legislative research on political candidates and analyze research findingsYou will communicate with internal teams on policy perspectives and priorities to help inform their work and collaboration across the organizationYou will perform open-source research on a variety of individuals to inform our decision-makingYou will write, edit, and substantiate claims made in a variety of research documentsYou will continuously develop and expand your knowledge base on legislation at the federal and state levelsYou will track and identify changing candidate positions on a variety of priority issuesYou will generate and inform product development with other internal teams

Knowledge and Skills You Bring to the Organization

You have 2+ years of political research experience You’re an effective oral and written communicatorYou have incredible, unrelenting attention to detailYou’re able to juggle multiple projects, customers, and deadlines amidst shifting priorities and embrace change High degree of digital literacy and social media knowledgeExperience with lesser utilized and not mainstream social media platformsYou are a self-starter and have demonstrated experience learning and adapting to changing plans and environmentsYou have a keen desire to assist in driving impactful changes across all levels of society and appreciate that while politics and elected officials are part of that transformation, they aren’t the only solutionIntegrity and humility are of utmost importance to you You have an incessant curiosity to find the answer and facts and present information in an unbiased, accurate mannerYou have experience performing and critically analyzing open-source research Knowledge of domestic political landscapes

Standout Candidates May Also Bring

You have a background in political engagement, including paid work for a campaign or PAC

What We Offer

A meaningful career where your work will improve the lives of millions of Americans – especially the least fortunateA vision-driven organization of over 1,000 employees across the country who are dedicated to improving the lives of othersCompetitive salaries and bonuses. Our salary and bonus strategies are aligned to the value you create, not a standardized bell curveGenerous 401K match - 6% match with immediate vestingCompetitive health and wellness benefitsOur flexible time-off policy allows all employees to take leave as neededA purchasing credit card to use for business expenses Mileage reimbursement for business travel separate from your commuteCommuter assistance plans to offset the cost of commuting into our headquarters (on-site parking or metro)Opportunities for professional development and mentorship that can strengthen your effectiveness through Principle Based Management and other industry specific programs

Americans for Prosperity is driving long-term solutions to the country's biggest problems through broad-based grassroots outreach. Our activists engage friends and neighbors on key issues and encourage them to take an active role in building a culture of mutual benefit. We have an on-the-ground infrastructure in 36 states that recruits and unites citizens behind a common goal of advancing policies that help people improve their lives.

Americans for Prosperity Foundation is dedicated to educating and training citizens to be courageous advocates for the ideas, principles, and policies in a society of mutual benefit--knowing that leads to the greatest prosperity and well-being for all. Our educational programs break barriers standing in the way of people realizing their potential. By eliminating these obstacles to opportunity, in areas like occupational licensing, free speech, K-12 education, and free trade, we are supporting and working to lift up the lives of individuals and local communities.

We believe that diversity in experiences, perspectives, knowledge and ideas fuels creativity, broadens knowledge, and helps drive success. That’s why we’re proud to be an equal opportunity employer and strive to treat all employees and applicants with honesty, dignity, respect and sensitivity. We welcome all qualified applicants regardless of color, race, religion, religious creed, sex, gender or gender identity, gender expression, sexual orientation, national origin, citizenship, ethnicity, ancestry, age, physical disability, mental disability, medical condition, pregnancy (including medical needs which may arise from pregnancy, childbirth, or related medical conditions), military and veteran status, genetic information, marital or familial status, political affiliation, or any other legally recognized protected basis under federal, state or local laws, regulations or ordinances.","<strong>Job Description

</strong>Americans for Prosperity (AFP) is the premier grassroots organization focused on advocating solutions to the country’s greatest challenges. We recognize that tens of millions of Americans are frustrated with the extreme partisanship in government that keeps common-sense reforms from being passed, and instead seek to stand with policy leaders who are committed to finding a better way.

You are excited to build a career in politics – to help improve people’s lives and society. You recognize that principled elected officials can be part of our society’s transformation but that elections aren’t the whole solution.

You have incredible attention to detail, having noticed the typo in the book you’re reading. You scroll through social media and are frustrated by the lack of fact-checking and intellectual integrity in the various listicles and “research” going viral among your friends and family.

You thrive in a fast-paced, high-energy environment and are up to the challenge of juggling multiple projects while delivering products on time.

You have an insatiable curiosity for the facts and are effective at synthesizing ideas quickly, accurately, and clearly in writing.

Does this sound like you? Apply today to join Americans for Prosperity (AFP) as our next Senior Political Research Analyst!

<i>This role is based in our Arlington, VA office

</i>Your Responsibilities Include

<ul><li>You will perform policy and legislative research on political candidates and analyze research findings</li><li>You will communicate with internal teams on policy perspectives and priorities to help inform their work and collaboration across the organization</li><li>You will perform open-source research on a variety of individuals to inform our decision-making</li><li>You will write, edit, and substantiate claims made in a variety of research documents</li><li>You will continuously develop and expand your knowledge base on legislation at the federal and state levels</li><li>You will track and identify changing candidate positions on a variety of priority issues</li><li>You will generate and inform product development with other internal teams

</li></ul>Knowledge and Skills You Bring to the Organization

<ul><li>You have 2+ years of political research experience </li><li>You’re an effective oral and written communicator</li><li>You have incredible, unrelenting attention to detail</li><li>You’re able to juggle multiple projects, customers, and deadlines amidst shifting priorities and embrace change </li><li>High degree of digital literacy and social media knowledge</li><li>Experience with lesser utilized and not mainstream social media platforms</li><li>You are a self-starter and have demonstrated experience learning and adapting to changing plans and environments</li><li>You have a keen desire to assist in driving impactful changes across all levels of society and appreciate that while politics and elected officials are part of that transformation, they aren’t the only solution</li><li>Integrity and humility are of utmost importance to you </li><li>You have an incessant curiosity to find the answer and facts and present information in an unbiased, accurate manner</li><li>You have experience performing and critically analyzing open-source research </li><li>Knowledge of domestic political landscapes

</li></ul>Standout Candidates May Also Bring

<ul><li>You have a background in political engagement, including paid work for a campaign or PAC

</li></ul>What We Offer

<ul><li>A meaningful career where your work will improve the lives of millions of Americans – especially the least fortunate</li><li>A vision-driven organization of over 1,000 employees across the country who are dedicated to improving the lives of others</li><li>Competitive salaries and bonuses. Our salary and bonus strategies are aligned to the value you create, not a standardized bell curve</li><li>Generous 401K match - 6% match with immediate vesting</li><li>Competitive health and wellness benefits</li><li>Our flexible time-off policy allows all employees to take leave as needed</li><li>A purchasing credit card to use for business expenses </li><li>Mileage reimbursement for business travel separate from your commute</li><li>Commuter assistance plans to offset the cost of commuting into our headquarters (on-site parking or metro)</li><li>Opportunities for professional development and mentorship that can strengthen your effectiveness through Principle Based Management and other industry specific programs

</li></ul>Americans for Prosperity is driving long-term solutions to the country's biggest problems through broad-based grassroots outreach. Our activists engage friends and neighbors on key issues and encourage them to take an active role in building a culture of mutual benefit. We have an on-the-ground infrastructure in 36 states that recruits and unites citizens behind a common goal of advancing policies that help people improve their lives.

Americans for Prosperity Foundation is dedicated to educating and training citizens to be courageous advocates for the ideas, principles, and policies in a society of mutual benefit--knowing that leads to the greatest prosperity and well-being for all. Our educational programs break barriers standing in the way of people realizing their potential. By eliminating these obstacles to opportunity, in areas like occupational licensing, free speech, K-12 education, and free trade, we are supporting and working to lift up the lives of individuals and local communities.

We believe that diversity in experiences, perspectives, knowledge and ideas fuels creativity, broadens knowledge, and helps drive success. That’s why we’re proud to be an equal opportunity employer and strive to treat all employees and applicants with honesty, dignity, respect and sensitivity. We welcome all qualified applicants regardless of color, race, religion, religious creed, sex, gender or gender identity, gender expression, sexual orientation, national origin, citizenship, ethnicity, ancestry, age, physical disability, mental disability, medical condition, pregnancy (including medical needs which may arise from pregnancy, childbirth, or related medical conditions), military and veteran status, genetic information, marital or familial status, political affiliation, or any other legally recognized protected basis under federal, state or local laws, regulations or ordinances.","Americans for Prosperity · Arlington, VA (On-site)","https://www.linkedin.com/jobs/view/3843529791/","Arlington, Virginia, United States","Skills: Analytical Skills, Research Skills, +8 more","501-1,000 employees · Government Administration
2 school alumni work here","LISTED","244282407","Americans for Prosperity","https://media.licdn.com/dms/image/C560BAQGytL4H043tKQ/company-logo_400_400/0/1678970207190/americans_for_prosperity_logo?e=1720656000&v=beta&t=l6ZveWYthLrPy1iYR9WEXBFtT2PHsf9-yxmcxa3r7Wc","2024-03-01T02:32:06.000Z","2024-04-11T16:23:44.964Z"
