"Title","Description","Description HTML","Primary Description","Detail URL","Location","Skill","Insight","Job State","Poster Id","Company Name","Company Logo","Created At","Scraped At"
"Senior Climate Policy Analyst (Operations and Policy Analyst 4) – Hybrid Remote Work Opportunity","WORKING AT THE OREGON DEPARTMENT OF ENERGYAt the Oregon Department of Energy, we're helping shape the state's energy future. Our team is dedicated to keeping Oregon on the leading edge of renewable energy and efficiency while supporting energy innovation, investment, equity, and resilience. From helping Oregonians save energy at home; to overseeing the state's interests in the world's largest environmental cleanup at the Hanford nuclear site in Washington, our work is challenging, rewarding, and diverse. We work with developers and communities on proposed energy facilities, with schools and manufacturers looking to save energy and money, and with other agencies and stakeholders on meeting the challenges of climate change. Oregon is one of the most energy-efficient states in the country, routinely landing near the top of annual national rankings. ODOE is committed to helping Oregon remain an energy leader, and that starts with hiring engaged team members ready to deliver for all Oregonians.
The Energy Planning & Innovation (P&I) Division supports the agency mission by pursuing programs and policies that help Oregonians conserve energy, use energy more efficiently, and produce energy using renewable sources. The Division’s two sections: Energy Efficiency & Conservation and Energy Technology & Policy collaborate with the Department’s other divisions and stakeholders to help support the development of clean energy resources and integrate those resources into the State’s transmission and distribution system. The division offers energy expertise across sectors, including efficiency in buildings and manufacturing as well as alternative fuels and infrastructure, while helping Oregon build a more resilient energy system – one that is well prepared to respond to issues such as climate change and natural disasters. The division also helps the State pursue strategies to reduce greenhouse gas emissions through energy efficiency, renewable energy, and sustainable transportation.
We encourage people from all backgrounds to apply for our positions and hope you will join us on our path to diversity, equity, and inclusion. We are an agency that embraces social equity through our values, strategic planning, and actions. Leaning into our equity priorities means we continually examine what we do, the impact we have, and our progress toward weaving social equity into who we are.
WHAT YOU WILL BE DOINGThe purpose of this position is to serve as an expert on climate change specifically relating to policy, technical aspects, and markets for the agency. Additionally, this position provides staff support to the Oregon Climate Action Commission, including technical expertise in climate-related studies and policies, and by providing administrative assistance to the Commission. 
This position is eligible for a hybrid remote work schedule. The incumbent will be expected to work at the central workplace located at 550 Capitol St. NE in Salem, Oregon, at least eight times per year. This generally includes attendance at pre-scheduled in-person all-staff meetings. The position may also be required to work at the central workplace on a more frequent basis with advance notice, as needed. 
For a complete listing of the duties and responsibilities for this position, please review the position description by clicking here.
WHAT’S IN IT FOR YOUYou will be a member of a diverse team built on collaboration and support.  We offer full medical, vision, and dental benefits with paid sick leave, vacation leave, personal leave, and 11 paid holidays a year. This is a full-time, permanent position that is not represented by a union.
WHAT WE ARE LOOKING FOR A Bachelor's Degree in Business or Public Administration, Behavioral or Social Sciences, Finance, Political Science, or any degree demonstrating the capacity for the knowledge and skills; and five years of professional-level evaluative, analytical, and planning work.-OR-Any combination of experience and education equivalent to eight years of experience that typically supports the knowledge and skills for the classification.
The most successful candidate will also have the following skills, experience, and background: Demonstrated proficiency in conducting comprehensive research, modeling, and technical analysis in climate, energy, and natural resources domains, including experience in policy analysis, program design, and program evaluation.Proven ability to effectively collaborate with government agencies and other diverse stakeholder groups, fostering productive partnerships, and constructive dialogue to advance program initiatives.Strong track record of conducting through research and analysis, translating findings into actionable recommendations, policies, and strategic initiatives to address complex program challenges. Demonstrated leadership capabilities in managing large project teams with diverse interests, effectively encouraging knowledge sharing, leveraging strengths, and fostering collaboration to ensure timely project completion. Exceptional communication skills, including public speaking proficiency, with the ability to distill complex information and policy concepts into accessible formats for diverse audiences, facilitating widespread understanding and engagement in climate and energy issues. 
Studies have shown that women, trans, non-binary, Black, Indigenous, and other People of Color are less likely to apply for positions unless they believe they meet all the desired attributes. We are most interested in finding the best candidate for the position. We strongly encourage candidates to apply, even those who might not believe they possess every one of the desired attributes. Applicants who most closely exhibit the desired attributes will be invited to continue in the application process.
HOW TO APPLYVisit the State of Oregon Career Site by clicking this link: Senior Energy Policy AnalystA resume and cover letter are required for this job posting. Please attach both documents to the “My Experience” section under Resume/CV in the application.Eligible veterans who meet the qualifications will be given veterans’ preference. For further information, please visit the following website: Veterans Resources. You may also call the Oregon Department of Veterans Affairs at 1-800-692-9666.Answer all the supplemental questions.
GET NOTICEDHelp your application rise to the top! Don’t forget to showcase your amazing skills and experience in your application package that makes you the best candidate for the position. Submissions will be screened for consistency of information and communication skills at the professional level (attention to detail, spelling, grammar, etc.).
Employment will be contingent upon passing a criminal background check.
The Oregon Department of Energy does not offer VISA sponsorships. On your first day you will be required to complete the US Department of Homeland Security’s I-9 form confirming authorization to work in the United States.
QUESTIONS/NEED HELP?If you have questions about the recruitment and selection process or need assistance to participate in the application process, including an accommodation under the Americans with Disabilities Act, please contact Karlene Ashby, at karlene.ashby@energy.oregon.gov or call (971) 209-6209.
Candidates from diverse backgrounds are encouraged to apply.
THE OREGON DEPARTMENT OF ENERGY IS AN EQUAL OPPORTUNITY EMPLOYER AND DOES NOT DISCRIMINATE BASED ON THE BASIS OF RACE, COLOR, NATIONAL ORIGIN, ETHNICITY, GENDER, SEXUAL ORIENTATION, RELIGION, AGE, OR DISABILITY AND IS COMMITTED TO WORKPLACE DIVERSITY.  ","<p><strong>WORKING AT THE OREGON DEPARTMENT OF ENERGY</strong></p><p>At the Oregon Department of Energy, we're helping shape the state's energy future. Our team is dedicated to keeping Oregon on the leading edge of renewable energy and efficiency while supporting energy innovation, investment, equity, and resilience. From helping Oregonians save energy at home; to overseeing the state's interests in the world's largest environmental cleanup at the Hanford nuclear site in Washington, our work is challenging, rewarding, and diverse. We work with developers and communities on proposed energy facilities, with schools and manufacturers looking to save energy and money, and with other agencies and stakeholders on meeting the challenges of climate change. Oregon is one of the most energy-efficient states in the country, routinely landing near the top of annual national rankings. ODOE is committed to helping Oregon remain an energy leader, and that starts with hiring engaged team members ready to deliver for all Oregonians.</p><p>
</p><p>The Energy Planning & Innovation (P&I) Division supports the agency mission by pursuing programs and policies that help Oregonians conserve energy, use energy more efficiently, and produce energy using renewable sources. The Division’s two sections: Energy Efficiency & Conservation and Energy Technology & Policy collaborate with the Department’s other divisions and stakeholders to help support the development of clean energy resources and integrate those resources into the State’s transmission and distribution system. The division offers energy expertise across sectors, including efficiency in buildings and manufacturing as well as alternative fuels and infrastructure, while helping Oregon build a more resilient energy system – one that is well prepared to respond to issues such as climate change and natural disasters. The division also helps the State pursue strategies to reduce greenhouse gas emissions through energy efficiency, renewable energy, and sustainable transportation.</p><p>
</p><p>We encourage people from all backgrounds to apply for our positions and hope you will join us on our path to diversity, equity, and inclusion. We are an agency that embraces social equity through our values, strategic planning, and actions. Leaning into our equity priorities means we continually examine what we do, the impact we have, and our progress toward weaving social equity into who we are.</p><p>
</p><p><strong>WHAT YOU WILL BE DOING</strong></p><p>The purpose of this position is to serve as an expert on climate change specifically relating to policy, technical aspects, and markets for the agency. Additionally, this position provides staff support to the Oregon Climate Action Commission, including technical expertise in climate-related studies and policies, and by providing administrative assistance to the Commission. </p><p>
</p><p><strong>This position is eligible for a hybrid remote work schedule. The incumbent will be expected to work at the central workplace located at 550 Capitol St. NE in Salem, Oregon, at least eight times per year. This generally includes attendance at pre-scheduled in-person all-staff meetings. The position may also be required to work at the central workplace on a more frequent basis with advance notice, as needed. </strong></p><p>
</p><p>For a complete listing of the duties and responsibilities for this position, please review the position description by clicking here.</p><p>
</p><p><strong>WHAT’S IN IT FOR YOU</strong></p><p>You will be a member of a diverse team built on collaboration and support. </p><p> </p><p>We offer full medical, vision, and dental benefits with paid sick leave, vacation leave, personal leave, and 11 paid holidays a year.</p><p> </p><p><i>This is a full-time, permanent position that is not represented by a union.</i></p><p>
</p><p><strong>WHAT WE ARE LOOKING FOR </strong></p><ul><li>A Bachelor's Degree in Business or Public Administration, Behavioral or Social Sciences, Finance, Political Science, or any degree demonstrating the capacity for the knowledge and skills; and five years of professional-level evaluative, analytical, and planning work.</li></ul><p><strong>-OR-</strong></p><ul><li>Any combination of experience and education equivalent to eight years of experience that typically supports the knowledge and skills for the classification.</li></ul><p>
</p><p><i>The most successful candidate will also have the following skills, experience, and background:</i></p><p><i> </i></p><ul><li>Demonstrated proficiency in conducting comprehensive research, modeling, and technical analysis in climate, energy, and natural resources domains, including experience in policy analysis, program design, and program evaluation.</li><li>Proven ability to effectively collaborate with government agencies and other diverse stakeholder groups, fostering productive partnerships, and constructive dialogue to advance program initiatives.</li><li>Strong track record of conducting through research and analysis, translating findings into actionable recommendations, policies, and strategic initiatives to address complex program challenges. </li><li>Demonstrated leadership capabilities in managing large project teams with diverse interests, effectively encouraging knowledge sharing, leveraging strengths, and fostering collaboration to ensure timely project completion. </li><li>Exceptional communication skills, including public speaking proficiency, with the ability to distill complex information and policy concepts into accessible formats for diverse audiences, facilitating widespread understanding and engagement in climate and energy issues. </li></ul><p>
</p><p>Studies have shown that women, trans, non-binary, Black, Indigenous, and other People of Color are less likely to apply for positions unless they believe they meet all the desired attributes. We are most interested in finding the best candidate for the position. We strongly encourage candidates to apply, even those who might not believe they possess every one of the desired attributes. Applicants who most closely exhibit the desired attributes will be invited to continue in the application process.</p><p>
</p><p><strong>HOW TO APPLY</strong></p><ul><li>Visit the State of Oregon Career Site by clicking this link: Senior Energy Policy Analyst</li><li>A resume and cover letter are required for this job posting. Please attach both documents to the “My Experience” section under Resume/CV in the application.</li><li>Eligible veterans who meet the qualifications will be given veterans’ preference. For further information, please visit the following website: Veterans Resources. You may also call the Oregon Department of Veterans Affairs at 1-800-692-9666.</li><li>Answer all the supplemental questions.</li></ul><p>
</p><p><strong>GET NOTICED</strong></p><p>Help your application rise to the top! Don’t forget to showcase your amazing skills and experience in your application package that makes you the best candidate for the position. Submissions will be screened for consistency of information and communication skills at the professional level (attention to detail, spelling, grammar, etc.).</p><p>
</p><p>Employment will be contingent upon passing a criminal background check.</p><p>
</p><p>The Oregon Department of Energy does not offer VISA sponsorships. On your first day you will be required to complete the US Department of Homeland Security’s I-9 form confirming authorization to work in the United States.</p><p>
</p><p><strong>QUESTIONS/NEED HELP?</strong></p><p>If you have questions about the recruitment and selection process or need assistance to participate in the application process, including an accommodation under the Americans with Disabilities Act, please contact Karlene Ashby, at karlene.ashby@energy.oregon.gov or call (971) 209-6209.</p><p>
</p><p><strong>Candidates from diverse backgrounds are encouraged to apply.</strong></p><p>
</p><p><strong>THE OREGON DEPARTMENT OF ENERGY IS AN EQUAL OPPORTUNITY EMPLOYER AND DOES NOT DISCRIMINATE BASED ON THE BASIS OF RACE, COLOR, NATIONAL ORIGIN, ETHNICITY, GENDER, SEXUAL ORIENTATION, RELIGION, AGE, OR DISABILITY AND IS COMMITTED TO WORKPLACE DIVERSITY.</strong></p><p><strong> </strong></p><p><strong> </strong></p>","Oregon Department of Energy · Salem, OR (Hybrid)","https://www.linkedin.com/jobs/view/3868988658/","Salem, Oregon, United States","Skills: Social Sciences, Program Evaluation, +8 more","51-200 employees","LISTED","496151309","Oregon Department of Energy","https://media.licdn.com/dms/image/D560BAQHZ38jWP9wGNg/company-logo_400_400/0/1688677061174/oregon_department_of_energy_logo?e=1720656000&v=beta&t=rraK-mnSkhnivZV4HVFCa_ROyu2jJSupEiG3YDIeOKw","2024-03-26T22:12:00.000Z","2024-04-11T16:23:44.964Z"
