"Title","Description","Description HTML","Primary Description","Detail URL","Location","Skill","Insight","Job State","Poster Id","Company Name","Company Logo","Created At","Scraped At"
"User Experience Researcher (1935327)","Job Title: User Experience ResearcherLocation: Milwaukee, WI, or RemoteDuration: Long-term contract (1+ year with likely extension)
Company Overview: Join a Fortune 100 client based in Milwaukee as a User Experience Researcher. This role involves working within a growing team, with a substantial focus on researching and enhancing the onboarding experience. Approximately 50% of the work will revolve around achieving the team's objectives for the onboarding journey in 2024. This position can be done remotely in the US or you can work onsite hybrid in Milwaukee.
Role Overview:
As a User Experience Researcher, you will play a crucial role in collaborating with product, design, and development teams. Your primary responsibility will be to advocate for user needs, pain points, and behaviors to create exceptional user experiences. You will be instrumental in understanding stakeholder research needs and employing suitable research methodologies to address them.
This position involves:Leading and executing research projects from inception to completion as the primary researcher.Creating UX research artifacts such as proposals, moderator's guides, and result summaries.Synthesizing research findings effectively and succinctly.Identifying untapped research opportunities that can enhance value and executing them efficiently.Building and maintaining lists of targeted research participants from internal and external sources.Being the go-to resource for user knowledge within the organization.
Requirements:2+ years of experience conducting formal research in the field of User Experience around Employee Experience.Proficiency in qualitative and quantitative research techniques like contextual inquiry, usability testing, competitive benchmarking, interviews, focus groups, and surveys.Strong passion for creating exceptional experiences for users.Experience with UX Research tools such as OptimalSort, UserZoom, UserTesting.com, or similar platforms.Familiarity with survey platforms like Qualtrics, SurveyMonkey, or equivalent tools.Willingness to challenge conventional approaches in addressing user needs.Comfortable navigating ambiguity and uncertainty.Ability to work autonomously while collaborating effectively with cross-functional teams.
Nice To HaveAgile MethodologyEmpathyindustry~insurance
Why Join:Opportunity to contribute significantly to the enhancement of the onboarding experience within a Fortune 100 company.Collaborate with diverse teams of product, design, and development professionals.Long-term contract role with the possibility of extension, offering a chance to make a lasting impact.
This is an exciting opportunity for a driven Senior User Experience Researcher to join a forward-thinking team dedicated to improving user experiences in a Fortune 100 setting. If you are passionate about research, human-centered design, and creating exceptional user experiences, we encourage you to apply and be part of this dynamic team in Milwaukee or remotely.","<p><strong>Job Title: User Experience Researcher</strong></p><p><strong>Location: Milwaukee, WI, or Remote</strong></p><p><strong>Duration: Long-term contract (1+ year with likely extension)</strong></p><p>
</p><p>Company Overview: Join a Fortune 100 client based in Milwaukee as a User Experience Researcher. This role involves working within a growing team, with a substantial focus on researching and enhancing the onboarding experience. Approximately 50% of the work will revolve around achieving the team's objectives for the onboarding journey in 2024. This position can be done remotely in the US or you can work onsite hybrid in Milwaukee.</p><p>
</p><p>Role Overview:</p><p>
</p><p>As a User Experience Researcher, you will play a crucial role in collaborating with product, design, and development teams. Your primary responsibility will be to advocate for user needs, pain points, and behaviors to create exceptional user experiences. You will be instrumental in understanding stakeholder research needs and employing suitable research methodologies to address them.</p><p>
</p><p>This position involves:</p><ul><li>Leading and executing research projects from inception to completion as the primary researcher.</li><li>Creating UX research artifacts such as proposals, moderator's guides, and result summaries.</li><li>Synthesizing research findings effectively and succinctly.</li><li>Identifying untapped research opportunities that can enhance value and executing them efficiently.</li><li>Building and maintaining lists of targeted research participants from internal and external sources.</li><li>Being the go-to resource for user knowledge within the organization.</li></ul><p>
</p><p>Requirements:</p><ul><li>2+ years of experience conducting formal research in the field of User Experience around Employee Experience.</li><li>Proficiency in qualitative and quantitative research techniques like contextual inquiry, usability testing, competitive benchmarking, interviews, focus groups, and surveys.</li><li>Strong passion for creating exceptional experiences for users.</li><li>Experience with UX Research tools such as OptimalSort, UserZoom, UserTesting.com, or similar platforms.</li><li>Familiarity with survey platforms like Qualtrics, SurveyMonkey, or equivalent tools.</li><li>Willingness to challenge conventional approaches in addressing user needs.</li><li>Comfortable navigating ambiguity and uncertainty.</li><li>Ability to work autonomously while collaborating effectively with cross-functional teams.</li></ul><p>
</p><p>Nice To Have</p><ul><li>Agile Methodology</li><li>Empathy</li><li>industry~insurance</li></ul><p>
</p><p>Why Join:</p><ul><li>Opportunity to contribute significantly to the enhancement of the onboarding experience within a Fortune 100 company.</li><li>Collaborate with diverse teams of product, design, and development professionals.</li><li>Long-term contract role with the possibility of extension, offering a chance to make a lasting impact.</li></ul><p>
</p><p>This is an exciting opportunity for a driven Senior User Experience Researcher to join a forward-thinking team dedicated to improving user experiences in a Fortune 100 setting. If you are passionate about research, human-centered design, and creating exceptional user experiences, we encourage you to apply and be part of this dynamic team in Milwaukee or remotely.</p>","Tier4 Group · United States (Remote)","https://www.linkedin.com/jobs/view/3903418847/","United States","Skills: User Interface Design, UX Research, +3 more","51-200 employees · IT Services and IT Consulting","LISTED","31351712","Tier4 Group","https://media.licdn.com/dms/image/D560BAQEGHYyiWOuXsw/company-logo_400_400/0/1688447026016/tier4group_logo?e=1721865600&v=beta&t=xMdoAeKwPpVUBpEPByyJeO_RaL8IlurQfIrWJzHHY90","2024-04-18T13:14:16.000Z","2024-04-21T14:07:32.654Z"
"Senior User Researcher","Build the future of data. Join the Snowflake team.

A key driver behind Snowflake’s innovation is the commitment to putting customers first, and we’re seeking an experienced user researcher who is looking to lead research efforts with the potential for outsized impact on our most strategic pillars. This role is for you if you are looking to solve complex, ambiguous problems, and are looking to own a research program that deeply integrates into the team’s approach from vision to launch. You’d orchestrate cross-functional alignment around user needs, guide prioritization of high-value features, and play a key role in landing holistic experiences that our customers love. You’d be embedded as a key member of the cross-functional leads group, yet also be a part of a world-class team of tight-knit researchers with a culture of collaboration and knowledge sharing, where we continuously support and learn from each other in a safe and friendly environment.

RESPONSIBILITIES:

Collaborate closely with product, design, engineering, and data science teams to shape product roadmapping and visionBalance the strategic and tactical; ensuring the team is solving the most critical user needs while delivering holistic solutions that are intuitive and easy to useLead research planning and execution, effectively building alignment with cross-functional peers and stakeholders throughout the research processClearly communicate insights and learnings, tying directly to actionable next steps and impact on product direction


REQUIREMENTS:

5+ years of leading high-impact user research effortsExperience leveraging a broad range of research methodologies across the various stages of product developmentAbility to thrive in ambiguity, with a proven track record of setting and executing research roadmaps leading to meaningful product directionAbility to collaborate closely with cross-functional partners, driving alignment around user needs and incorporating peers into the research processThis is a hybrid position based in San Mateo, CA. 


Every Snowflake employee is expected to follow the company’s confidentiality and security standards for handling sensitive data. Snowflake employees must abide by the company’s data security plan as an essential part of their duties. It is every employee's duty to keep customer information secure and confidential.

The following represents the expected range of compensation for this role:

 The estimated base salary range for this role is $160,000 - $235,700.Additionally, this role is eligible to participate in Snowflake’s bonus and equity plan.


The successful candidate’s starting salary will be determined based on permissible, non-discriminatory factors such as skills, experience, and geographic location. This role is also eligible for a competitive benefits package that includes: medical, dental, vision, life, and disability insurance; 401(k) retirement plan; flexible spending & health savings account; at least 12 paid holidays; paid time off; parental leave; employee assistance program; and other company benefits.

Snowflake is growing fast, and we’re scaling our team to help enable and accelerate our growth. We are looking for people who share our values, challenge ordinary thinking, and push the pace of innovation while building a future for themselves and Snowflake.

How do you want to make your impact?","Build the future of data. Join the Snowflake team.

A key driver behind Snowflake’s innovation is the commitment to putting customers first, and we’re seeking an experienced user researcher who is looking to lead research efforts with the potential for outsized impact on our most strategic pillars. This role is for you if you are looking to solve complex, ambiguous problems, and are looking to own a research program that deeply integrates into the team’s approach from vision to launch. You’d orchestrate cross-functional alignment around user needs, guide prioritization of high-value features, and play a key role in landing holistic experiences that our customers love. You’d be embedded as a key member of the cross-functional leads group, yet also be a part of a world-class team of tight-knit researchers with a culture of collaboration and knowledge sharing, where we continuously support and learn from each other in a safe and friendly environment.

RESPONSIBILITIES:

<ul><li>Collaborate closely with product, design, engineering, and data science teams to shape product roadmapping and vision</li><li>Balance the strategic and tactical; ensuring the team is solving the most critical user needs while delivering holistic solutions that are intuitive and easy to use</li><li>Lead research planning and execution, effectively building alignment with cross-functional peers and stakeholders throughout the research process</li><li>Clearly communicate insights and learnings, tying directly to actionable next steps and impact on product direction


</li></ul>REQUIREMENTS:

<ul><li>5+ years of leading high-impact user research efforts</li><li>Experience leveraging a broad range of research methodologies across the various stages of product development</li><li>Ability to thrive in ambiguity, with a proven track record of setting and executing research roadmaps leading to meaningful product direction</li><li>Ability to collaborate closely with cross-functional partners, driving alignment around user needs and incorporating peers into the research process</li><li>This is a hybrid position based in San Mateo, CA. 


</li></ul><i>Every Snowflake employee is expected to follow the company’s confidentiality and security standards for handling sensitive data. Snowflake employees must abide by the company’s data security plan as an essential part of their duties. It is every employee's duty to keep customer information secure and confidential.

</i>The following represents the expected range of compensation for this role:

<ul><li> The estimated base salary range for this role is $160,000 - $235,700.</li><li>Additionally, this role is eligible to participate in Snowflake’s bonus and equity plan.


</li></ul>The successful candidate’s starting salary will be determined based on permissible, non-discriminatory factors such as skills, experience, and geographic location. This role is also eligible for a competitive benefits package that includes: medical, dental, vision, life, and disability insurance; 401(k) retirement plan; flexible spending & health savings account; at least 12 paid holidays; paid time off; parental leave; employee assistance program; and other company benefits.

Snowflake is growing fast, and we’re scaling our team to help enable and accelerate our growth. We are looking for people who share our values, challenge ordinary thinking, and push the pace of innovation while building a future for themselves and Snowflake.

How do you want to make your impact?","Snowflake · San Mateo, CA","https://www.linkedin.com/jobs/view/3904347503/","San Mateo, California, United States","Skills: Snowflake Cloud, Snowflake, +8 more","5,001-10,000 employees · Software Development
1 connection works here · 33 school alumni work here","LISTED","26137770","Snowflake","https://media.licdn.com/dms/image/D560BAQF3mYS3WqCB3g/company-logo_400_400/0/1688575708630/snowflake_computing_logo?e=1721865600&v=beta&t=Ihcq6qMio2mUMLuQ_0z1GKS88nhhV8fy_vkZUAnPM5g","2024-04-17T20:06:18.000Z","2024-04-21T14:07:32.654Z"
