"Title","Description","Description HTML","Primary Description","Detail URL","Location","Skill","Insight","Job State","Poster Id","Company Name","Company Logo","Created At","Scraped At"
"User Experience Researcher","Day to day:• Work closely with researchers, designers, PMs & engineers, to define and execute user research studies that will directly inform product design• Submit potential projects through research review and privacy process• Strictly adhere to privacy and safety standards when working directly with participants or participant data• Collaboratively and independently develop and execute research roadmaps• Lead various research studies throughout all the phases of the product development cycle• Conduct original data analysis and prepare presentations to communicate research findings• Manage research vendors to help augment the work of the research team Must haves:• Bachelor’s degree in a human behavior related field, such as human-computer interaction, psychology, sociology, communication, information science, media studies, computer science, or economics• Experience in quantitative and qualitative UX research and study design.• Experience working directly with human subjects.• Extensive experience with data and utilizing numbers to define and support hypotheses.• Prior experience with Python, R, MATLAB, or equivalent for data analysis Plusses:• Masters degree or higher in a human behavior related field, such as human-computer interaction, psychology, sociology, communication, information science, media studies, computer science, or economics• Understanding of large database infrastructure (SQL)","<p>Day to day:</p><p>• Work closely with researchers, designers, PMs & engineers, to define and execute user research studies that will directly inform product design</p><p>• Submit potential projects through research review and privacy process</p><p>• Strictly adhere to privacy and safety standards when working directly with participants or participant data</p><p>• Collaboratively and independently develop and execute research roadmaps</p><p>• Lead various research studies throughout all the phases of the product development cycle</p><p>• Conduct original data analysis and prepare presentations to communicate research findings</p><p>• Manage research vendors to help augment the work of the research team</p><p> </p><p>Must haves:</p><p>• Bachelor’s degree in a human behavior related field, such as human-computer interaction, psychology, sociology, communication, information science, media studies, computer science, or economics</p><p>• Experience in<strong> quantitative and qualitative</strong> UX research and study design.</p><p>• Experience working directly with <strong>human subjects.</strong></p><p>• Extensive experience with data and utilizing numbers to define and support hypotheses.</p><p>• Prior experience with Python, R, MATLAB, or equivalent for data analysis</p><p> </p><p>Plusses:</p><p>• Masters degree or higher in a human behavior related field, such as human-computer interaction, psychology, sociology, communication, information science, media studies, computer science, or economics</p><p>• Understanding of large database infrastructure (SQL)</p>","Insight Global · Seattle, WA (On-site)","https://www.linkedin.com/jobs/view/3901902526/","Seattle, Washington, United States","2 of 3 skills match your profile - you may be a good fit","1,001-5,000 employees · Staffing and Recruiting
14 school alumni work here","LISTED","797672500","Insight Global","https://media.licdn.com/dms/image/C560BAQGUNIyRZFaj0g/company-logo_400_400/0/1657049194702/insight_global_logo?e=1721865600&v=beta&t=dGdf-8zdSWlLokKkmIn0RM3mcZc1X9r7aBnhmupdFig","2024-04-18T18:25:16.000Z","2024-04-21T14:07:32.654Z"
"Sr. UX Researcher, Amazon Business","Description

Amazon Business is looking for a Senior UX Researcher to help reinvent how employees buy for work.

Businesses buy more than $1 trillion of everything from paper clips to DNA sequencers in the US alone. Launched in 2015, Amazon Business aims to do for offices, factories, hospitals, schools, and public agencies what Amazon.com did for everyday consumers—make buying easier, faster, and more efficient.

As a Senior UX Researcher, you’ll join a fun, growing global team of user experience experts taking a fresh-eyed look at the complex world of business purchasing and trying to make it easier and more intuitive for everyone from receptionists to CEOs.

We’re looking for an enthusiastic researcher to explore the world of business customers and generate insights that connect product experiences to business customers. Your focus will cover all aspects of UX research, from learning more about our customers to uncover problems that need to be solved to validating the impact of our designs. You will work with other UX researchers to build the skills of the entire UX team to create a research-driven organization.

If you love getting to the “a-ha” moment, when the solution to a customer problem reveals itself in the data—then let’s talk.

Key job responsibilities

 Plan and execute research a wide variety of research activities with customers with a focus on quantitative and qualitative studies. Generate insights from business analytics and customer feedback. Generate ideas on new or more efficient ways to answer questions that we have about customers. Collaborate with designers and product managers to solve problems with data. Oversee research projects conducted by outside vendors. Work across all of Amazon to drive better research practices and bring attention to business customers.

We are open to hiring candidates to work out of one of the following locations:

Austin, TX, USA | Seattle, WA, USA

Basic Qualifications

8+ years of experience in the field of research and/or design

Bachelor's degree or equivalent experience

Experience across both qualitative and quantitative research methods

Preferred Qualifications

Experience in B2B or B2C e-commerce or financial services

Ability to use research to influence strategic direction—and the portfolio to prove it

Experience with continuous delivery and an understanding of how to impact design and product decisions in a fast-moving and fast-changing development environment

Broad knowledge of research methodologies and the proven ability to execute the right methodology to get the needed result

A deep understanding of UX research, agile UX, and user-centered design

Master's degree in HCI or related field

Interest in data visualization and dashboards

Amazon is committed to a diverse and inclusive workplace. Amazon is an equal opportunity employer and does not discriminate on the basis of race, national origin, gender, gender identity, sexual orientation, protected veteran status, disability, age, or other legally protected status. For individuals with disabilities who would like to request an accommodation, please visit https://www.amazon.jobs/en/disability/us.

Our compensation reflects the cost of labor across several US geographic markets. The base pay for this position ranges from $121,800/year in our lowest geographic market up to $226,500/year in our highest geographic market. Pay is based on a number of factors including market location and may vary depending on job-related knowledge, skills, and experience. Amazon is a total compensation company. Dependent on the position offered, equity, sign-on payments, and other forms of compensation may be provided as part of a total compensation package, in addition to a full range of medical, financial, and/or other benefits. For more information, please visit https://www.aboutamazon.com/workplace/employee-benefits. This position will remain posted until filled. Applicants should apply via our internal or external career site.


Company - Amazon.com Services LLC

Job ID: A2613018","<strong>Description

</strong>Amazon Business is looking for a Senior UX Researcher to help reinvent how employees buy for work.

Businesses buy more than $1 trillion of everything from paper clips to DNA sequencers in the US alone. Launched in 2015, Amazon Business aims to do for offices, factories, hospitals, schools, and public agencies what Amazon.com did for everyday consumers—make buying easier, faster, and more efficient.

As a Senior UX Researcher, you’ll join a fun, growing global team of user experience experts taking a fresh-eyed look at the complex world of business purchasing and trying to make it easier and more intuitive for everyone from receptionists to CEOs.

We’re looking for an enthusiastic researcher to explore the world of business customers and generate insights that connect product experiences to business customers. Your focus will cover all aspects of UX research, from learning more about our customers to uncover problems that need to be solved to validating the impact of our designs. You will work with other UX researchers to build the skills of the entire UX team to create a research-driven organization.

If you love getting to the “a-ha” moment, when the solution to a customer problem reveals itself in the data—then let’s talk.

Key job responsibilities

<ul><li> Plan and execute research a wide variety of research activities with customers with a focus on quantitative and qualitative studies.</li><li> Generate insights from business analytics and customer feedback.</li><li> Generate ideas on new or more efficient ways to answer questions that we have about customers.</li><li> Collaborate with designers and product managers to solve problems with data.</li><li> Oversee research projects conducted by outside vendors.</li><li> Work across all of Amazon to drive better research practices and bring attention to business customers.

</li></ul>We are open to hiring candidates to work out of one of the following locations:

Austin, TX, USA | Seattle, WA, USA

<strong>Basic Qualifications

</strong>8+ years of experience in the field of research and/or design

Bachelor's degree or equivalent experience

Experience across both qualitative and quantitative research methods

<strong>Preferred Qualifications

</strong>Experience in B2B or B2C e-commerce or financial services

Ability to use research to influence strategic direction—and the portfolio to prove it

Experience with continuous delivery and an understanding of how to impact design and product decisions in a fast-moving and fast-changing development environment

Broad knowledge of research methodologies and the proven ability to execute the right methodology to get the needed result

A deep understanding of UX research, agile UX, and user-centered design

Master's degree in HCI or related field

Interest in data visualization and dashboards

Amazon is committed to a diverse and inclusive workplace. Amazon is an equal opportunity employer and does not discriminate on the basis of race, national origin, gender, gender identity, sexual orientation, protected veteran status, disability, age, or other legally protected status. For individuals with disabilities who would like to request an accommodation, please visit https://www.amazon.jobs/en/disability/us.

Our compensation reflects the cost of labor across several US geographic markets. The base pay for this position ranges from $121,800/year in our lowest geographic market up to $226,500/year in our highest geographic market. Pay is based on a number of factors including market location and may vary depending on job-related knowledge, skills, and experience. Amazon is a total compensation company. Dependent on the position offered, equity, sign-on payments, and other forms of compensation may be provided as part of a total compensation package, in addition to a full range of medical, financial, and/or other benefits. For more information, please visit https://www.aboutamazon.com/workplace/employee-benefits. This position will remain posted until filled. Applicants should apply via our internal or external career site.


<strong>Company</strong> - Amazon.com Services LLC

Job ID: A2613018","Amazon · Seattle, WA","https://www.linkedin.com/jobs/view/3900252869/","Seattle, Washington, United States","7 of 10 skills match your profile - you may be a good fit","10,001+ employees · Software Development
16 connections work here · 481 school alumni work here","LISTED","7745488","Amazon","https://media.licdn.com/dms/image/C560BAQHTvZwCx4p2Qg/company-logo_400_400/0/1630640869849/amazon_logo?e=1721865600&v=beta&t=XdpjjyespDbxN-2GuD0_fEx1lL5WZ5KMfYcBXLGsnZo","2024-04-15T23:59:41.000Z","2024-04-21T14:07:32.654Z"
"User Experience Designer","Job Summary:Product Owners across the different area of Salesforce continue to direct functionality and enable our teams to engage efficiently and productivity with our clients leading to quicker sales and stronger retention. Our team is focused on creating the best user experience for salesforce users and teams with processes enabled through salesforce.com to drive this retention and set the stage for strategic guidance and experience that needs development and design efforts. Please note that we are unable to sponsor applicants requiring work authorization or visas for the positions currently available. We kindly request that only candidates who already possess the legal right to work in the United States apply for consideration.Responsibilities:Work closely with the user group to conduct research, user interviews, contextual analysis, usability studies, etc. and be able to synthesize user experience workflows for salesforce.com functionality.Collaborate with product owners, software engineers, and cross-functional stakeholders to understand requirements, and provide creative, thoughtful user experience and layout solutions.Communicate the user experience at various stages of the design process with wireframes, flow diagrams, storyboards, and prototypes.Integrate user feedback, enterprise processes and business requirements into ongoing user experience changes and functionality.Designs need to be interactive, intuitive and align with agile approach to functionality development.Designs need to rely first on out of the box functionality within salesforce.com – customization is only used when necessary.Support multiple projects while actively prioritizing workflow based on ROI, and business value.Analyze and incorporate quantitative data and qualitative insights into design.Advocate for the prioritization of design centered changes, refinements, and improvements focusing on user-centric while driving value based on user experience.","<p><strong>Job Summary</strong>:</p><p>Product Owners across the different area of Salesforce continue to direct functionality and enable our teams to engage efficiently and productivity with our clients leading to quicker sales and stronger retention. Our team is focused on creating the best user experience for salesforce users and teams with processes enabled through salesforce.com to drive this retention and set the stage for strategic guidance and experience that needs development and design efforts. Please note that we are unable to sponsor applicants requiring work authorization or visas for the positions currently available. We kindly request that only candidates who already possess the legal right to work in the United States apply for consideration.</p><p><strong>Responsibilities</strong>:</p><ul><li>Work closely with the user group to conduct research, user interviews, contextual analysis, usability studies, etc. and be able to synthesize user experience workflows for salesforce.com functionality.</li><li>Collaborate with product owners, software engineers, and cross-functional stakeholders to understand requirements, and provide creative, thoughtful user experience and layout solutions.</li><li>Communicate the user experience at various stages of the design process with wireframes, flow diagrams, storyboards, and prototypes.</li><li>Integrate user feedback, enterprise processes and business requirements into ongoing user experience changes and functionality.</li><li>Designs need to be interactive, intuitive and align with agile approach to functionality development.</li><li>Designs need to rely first on out of the box functionality within salesforce.com – customization is only used when necessary.</li><li>Support multiple projects while actively prioritizing workflow based on ROI, and business value.</li><li>Analyze and incorporate quantitative data and qualitative insights into design.</li><li>Advocate for the prioritization of design centered changes, refinements, and improvements focusing on user-centric while driving value based on user experience.</li></ul>","swipejobs · Stamford, CT (On-site)","https://www.linkedin.com/jobs/view/3899981189/","Stamford, Connecticut, United States","Skills: User Experience (UX), User Interface Design, +9 more","201-500 employees · Software Development","LISTED","381326744","swipejobs","https://media.licdn.com/dms/image/C510BAQFYMnBBRucMVg/company-logo_400_400/0/1631400544320/swipejobs_logo?e=1721865600&v=beta&t=eM5g5bJJiDlHPO8cdXzsMYcNn8V0VkuTUOdWQMdnwmU","2024-04-17T00:27:36.000Z","2024-04-21T14:07:32.654Z"
"Sr UX Researcher","Job Description

We're looking for a Senior UX Researcher to lead user research efforts that inform the design and development of mobile and responsive digital experiences for our users. With over 8 years of experience in UX research, you will leverage your expertise to uncover valuable insights, advocate for user-centric design principles, and collaborate closely with cross-functional teams to deliver best-in-class digital solutions.

Responsibilities:

Lead end-to-end user research initiatives, including planning, executing, and synthesizing findings to inform product strategy and design decisions.Conduct qualitative and quantitative research methods such as user interviews, surveys, usability testing, and analytics analysis to gain deep insights into user behaviors, needs, and preferences.Champion a user-centered design approach throughout the product development lifecycle, advocating for the voice of the customer and ensuring that user needs are at the forefront of decision-making.Collaborate closely with product managers, designers, engineers, and other stakeholders to translate research findings into actionable recommendations and design solutions.Drive continuous improvement of our research methodologies, tools, and processes to ensure rigor and effectiveness in uncovering user insights.Mentor and coach junior members of the UX research team, fostering a culture of learning and professional growth.

Qualifications:

8+ years of experience in UX research, with a focus on mobile and responsive design within B2C financial services and/or technology industries.Proven track record of leading successful user research initiatives that have directly influenced product strategy and design decisions.Expertise in a wide range of qualitative and quantitative research methods, with proficiency in tools such as user testing platforms, survey tools, and analytics platforms.Strong analytical and critical thinking skills, with the ability to synthesize complex data and distill insights into actionable recommendations.Excellent communication and collaboration skills, with the ability to effectively engage and influence stakeholders at all levels of the organization.Experience working in agile environments and collaborating with cross-functional teams in a fast-paced, iterative product development process.Strong portfolio showcasing past research projects and the impact on product outcomes.","<strong>Job Description

</strong>We're looking for a Senior UX Researcher to lead user research efforts that inform the design and development of mobile and responsive digital experiences for our users. With over 8 years of experience in UX research, you will leverage your expertise to uncover valuable insights, advocate for user-centric design principles, and collaborate closely with cross-functional teams to deliver best-in-class digital solutions.

<strong><strong>Responsibilities</strong></strong>:

<ul><li>Lead end-to-end user research initiatives, including planning, executing, and synthesizing findings to inform product strategy and design decisions.</li><li>Conduct qualitative and quantitative research methods such as user interviews, surveys, usability testing, and analytics analysis to gain deep insights into user behaviors, needs, and preferences.</li><li>Champion a user-centered design approach throughout the product development lifecycle, advocating for the voice of the customer and ensuring that user needs are at the forefront of decision-making.</li><li>Collaborate closely with product managers, designers, engineers, and other stakeholders to translate research findings into actionable recommendations and design solutions.</li><li>Drive continuous improvement of our research methodologies, tools, and processes to ensure rigor and effectiveness in uncovering user insights.</li><li>Mentor and coach junior members of the UX research team, fostering a culture of learning and professional growth.

</li></ul><strong><strong>Qualifications</strong></strong>:

<ul><li>8+ years of experience in UX research, with a focus on mobile and responsive design within B2C financial services and/or technology industries.</li><li>Proven track record of leading successful user research initiatives that have directly influenced product strategy and design decisions.</li><li>Expertise in a wide range of qualitative and quantitative research methods, with proficiency in tools such as user testing platforms, survey tools, and analytics platforms.</li><li>Strong analytical and critical thinking skills, with the ability to synthesize complex data and distill insights into actionable recommendations.</li><li>Excellent communication and collaboration skills, with the ability to effectively engage and influence stakeholders at all levels of the organization.</li><li>Experience working in agile environments and collaborating with cross-functional teams in a fast-paced, iterative product development process.</li><li>Strong portfolio showcasing past research projects and the impact on product outcomes.</li></ul>","Braintrust · Washington DC-Baltimore Area (Hybrid)","https://www.linkedin.com/jobs/view/3882170244/","Washington DC-Baltimore Area","6 of 10 skills match your profile - you may be a good fit","11-50 employees · Technology, Information and Internet
1 school alum works here","LISTED","266197637","Braintrust","https://media.licdn.com/dms/image/C560BAQHbQYFSQsK__A/company-logo_400_400/0/1630511738029/usebraintrust_logo?e=1721865600&v=beta&t=FIFByqA3JV5hI3kyUbu608dU3rrOSH4rowyroeuKn54","2024-04-02T20:15:15.000Z","2024-04-21T14:07:32.654Z"
