"Title","Description","Description HTML","Primary Description","Detail URL","Location","Skill","Insight","Job State","Poster Id","Company Name","Company Logo","Created At","Scraped At"
"UX Researcher","OUR CLIENT: WunderLand is partnered with a Chicago-based healthcare organization. Partnering with WunderLand for contract positions offers you ongoing advocacy and placement services, as well as competitive benefits once you are placed, including medical, dental, and 401K match.

JOB TITLE:  UX Researcher

LOCATION:  Hybrid onsite in downtown Chicago 2 days/week.

ROLE TYPE/DURATION:  6-month contract

COMPENSATION:  $40/hr-$50/hr, commensurate with experience

IMPORTANT NOTE: A background check, drug screen, immunizations and a healthcare screening are required for this position, due to healthcare setting

JOB SUMMARY:  Seeking a UX Researcher with about 2-3 years of experience. Primarily responsible for research and testing. You will have the opportunity to contribute to the ongoing evaluation and improvement of the website and native mobile app.

WHAT’S REQUIRED TO APPLY: 

2-3+ years of experience conducting user research, testing and analysis for responsive websites and mobile applicationsWorking knowledge of testing platforms, analytics tools and design softwareExperience with a variety of research techniques including: ethnographic research, quantitative/qualitative analysis, online experiments (A/B and usability testing), card sorting, surveys, and benchmark studies Proficiency in interpreting data to identify user trends and pain pointsMust have a portfolio demonstrating your research work and if applicable, design work, is a plus

NEXT STEPS: We will reach out to qualified candidates for this position, but may not be able to get back to everyone based on volume. That said, we will keep you in mind for other relevant positions, as well!

WunderLand Group is the destination for digital, marketing, and creative talent. We deliver on our promise to provide companies with in-demand, highly-qualified talent for contract and full-time positions. WunderLand Group invests time to understand our clients' business and resource challenges and connects them with exceptional talent in today's fast-paced digital, marketing, and creative landscape.

The industry has verified WunderLand Group's reputation for loyalty and quality through numerous awards and recognitions, most recently the Best of Staffing® Client Award and Talent Award.

It is our practice not to discriminate against any employee or applicant because of sex, race, color, age, national origin, religion, gender identity or expression, sexual orientation or sexual preference, pregnancy or maternity, genetic information, marital status, disability, veteran status, or any other basis protected by applicable federal, state or local law. If you have a disability or handicap and would like us to accommodate you in any reasonable way, please inform your recruiter so that we can discuss the appropriate alternatives available.

Please visit www.wunderlandgroup.com to view available jobs and register with us or for more information.

At WunderLand we’re zealous about helping our customers increase customer reach, engagement, advocacy, and brand loyalty through digital, creative, marketing and communications channels. WunderLand’s mission is to be the go-to partner for digital, creative, and sales enablement services, and a premier employer for creative and digital specialists. It is WunderLand Group’s practice not to discriminate against any employee or applicant because of sex, race, color, age, national origin, religion, gender identity or expression, sexual orientation or sexual preference, pregnancy or maternity, genetic information, marital status, disability, veteran status, or any other basis protected by applicable federal, state or local law. If you have a disability or handicap and would like us to accommodate you in any reasonable way, please inform your recruiter so that we can discuss the appropriate alternatives available. WunderLand Group is part of the Advanced Group, a talent acquisition and management, consulting, outsourcing, and professional services organization.

","<strong>OUR CLIENT:</strong> WunderLand is partnered with a Chicago-based healthcare organization. Partnering with WunderLand for contract positions offers you ongoing advocacy and placement services, as well as competitive benefits once you are placed, including medical, dental, and 401K match.

<strong>JOB TITLE: </strong> UX Researcher

<strong>LOCATION: </strong> Hybrid onsite in downtown Chicago 2 days/week.

<strong>ROLE TYPE/DURATION: </strong> 6-month contract

<strong>COMPENSATION: </strong> $40/hr-$50/hr, commensurate with experience

<strong>IMPORTANT NOTE: </strong>A background check, drug screen, immunizations and a healthcare screening are required for this position, due to healthcare setting

<strong>JOB SUMMARY: </strong> Seeking a UX Researcher with about 2-3 years of experience. Primarily responsible for research and testing. You will have the opportunity to contribute to the ongoing evaluation and improvement of the website and native mobile app.

<strong>WHAT’S REQUIRED TO APPLY: 

</strong><ul><li>2-3+ years of experience conducting user research, testing and analysis for responsive websites and mobile applications</li><li>Working knowledge of testing platforms, analytics tools and design software</li><li>Experience with a variety of research techniques including: ethnographic research, quantitative/qualitative analysis, online experiments (A/B and usability testing), card sorting, surveys, and benchmark studies </li><li>Proficiency in interpreting data to identify user trends and pain points</li><li>Must have a portfolio demonstrating your research work and if applicable, design work, is a plus

</li></ul><strong>NEXT STEPS</strong>: We will reach out to qualified candidates for this position, but may not be able to get back to everyone based on volume. That said, we will keep you in mind for other relevant positions, as well!

<strong>WunderLand Group is the destination for digital, marketing, and creative talent.</strong> We deliver on our promise to provide companies with in-demand, highly-qualified talent for contract and full-time positions. WunderLand Group invests time to understand our clients' business and resource challenges and connects them with exceptional talent in today's fast-paced digital, marketing, and creative landscape.

The industry has verified WunderLand Group's reputation for loyalty and quality through numerous awards and recognitions, most recently the Best of Staffing® Client Award and Talent Award.

It is our practice not to discriminate against any employee or applicant because of sex, race, color, age, national origin, religion, gender identity or expression, sexual orientation or sexual preference, pregnancy or maternity, genetic information, marital status, disability, veteran status, or any other basis protected by applicable federal, state or local law. If you have a disability or handicap and would like us to accommodate you in any reasonable way, please inform your recruiter so that we can discuss the appropriate alternatives available.

Please visit www.wunderlandgroup.com to view available jobs and register with us or for more information.

At WunderLand we’re zealous about helping our customers increase customer reach, engagement, advocacy, and brand loyalty through digital, creative, marketing and communications channels. WunderLand’s mission is to be the go-to partner for digital, creative, and sales enablement services, and a premier employer for creative and digital specialists. It is WunderLand Group’s practice not to discriminate against any employee or applicant because of sex, race, color, age, national origin, religion, gender identity or expression, sexual orientation or sexual preference, pregnancy or maternity, genetic information, marital status, disability, veteran status, or any other basis protected by applicable federal, state or local law. If you have a disability or handicap and would like us to accommodate you in any reasonable way, please inform your recruiter so that we can discuss the appropriate alternatives available. WunderLand Group is part of the Advanced Group, a talent acquisition and management, consulting, outsourcing, and professional services organization.

","WunderLand Group","https://www.linkedin.com/jobs/view/3825307653/","Chicago, Illinois, United States","Skills: Qualitative Research, User Experience (UX), +8 more","11-50 employees · Staffing and Recruiting","LISTED","270385266","WunderLand Group","https://media.licdn.com/dms/image/D560BAQGDPgtDgjeKwA/company-logo_400_400/0/1690555582377/wunderland_logo?e=1718236800&v=beta&t=zpNKXn1HBPyJFAlu6Al3XTT2wQMioOcL4gpQLukGTUE","2024-02-08T22:11:28.000Z","2024-03-08T02:16:37.643Z"
"Sr. Experience Designer, Associate","Job Description

As a Senior UX Designer in the Design and Customer Experience Authentication team, you will be tasked with collaborating with various teams, utilizing your expertise in user-centered design to create products that are not only useful and usable, but also desirable to meet both customer and business needs. You will be a part of a dedicated experience team, which includes experience researchers and content designers, all working towards designing the future of financial services. Your daily responsibilities will include making product design decisions and re-designing product experiences across our Consumer and Community Banking Authentication offerings, using data and user research to pinpoint opportunities for improvement. Additionally, you will be expected to champion the users’ perspective when working with Product Managers and Engineers to plan roadmaps, gather requirements, and organize the work.

Job Responsibilities

Make daily product design decisions and re-design product experiences across our Authentication offerings. Using data and user research to identify opportunities for making improvements.

Advocate for the users’ perspective when collaborating with Product Managers and Engineers to plan roadmaps, gather requirements, and structure the work. 

Uses storytelling, user journey, conceptual prototypes and other strategies to articulate complex concepts, customer problems, and potential solutions to varying stakeholders and partners across disciplines and the organization 

Designs and facilitates workshops to extract hypothesis, potential solutions, generate excitement, ensure a common understanding, and foster team alignment.

Required Qualifications, Capabilities, And Skills

Able to form a tangible user experience vision with clear objectives and desired outcomes from the nebulous

Excellent communicator able to concisely explain complex systems and concepts to various partners and stakeholders 

Understands and uses collaborative activities to foster alignment and actionable next steps

Comfortable working closely with UX Researchers and Data Analysts to gather customer feedback and analytics, and use that information to drive improvements to the customer’s journey.

Insatiable curiosity about customers, technology, the business, and the future of the industry.

A natural connector of people, ideas, and technology to identify and solve the right problem. 

Preferred Qualifications, Capabilities And Skills

Previous experience shipping multiple successful digital products

Self-directed; in both planning and structuring your effort, and executing and expected levels of quality, you don’t need someone guiding you through the work

UX design background with strong propensity for experimentation

About Us

Chase is a leading financial services firm, helping nearly half of America’s households and small businesses achieve their financial goals through a broad range of financial products. Our mission is to create engaged, lifelong relationships and put our customers at the heart of everything we do. We also help small businesses, nonprofits and cities grow, delivering solutions to solve all their financial needs.

We offer a competitive total rewards package including base salary determined based on the role, experience, skill set, and location. For those in eligible roles, discretionary incentive compensation which may be awarded in recognition of individual achievements and contributions. We also offer a range of benefits and programs to meet employee needs, based on eligibility. These benefits include comprehensive health care coverage, on-site health and wellness centers, a retirement savings plan, backup childcare, tuition reimbursement, mental health support, financial coaching and more. Additional details about total compensation and benefits will be provided during the hiring process.

We recognize that our people are our strength and the diverse talents they bring to our global workforce are directly linked to our success. We are an equal opportunity employer and place a high value on diversity and inclusion at our company. We do not discriminate on the basis of any protected attribute, including race, religion, color, national origin, gender, sexual orientation, gender identity, gender expression, age, marital or veteran status, pregnancy or disability, or any other basis protected under applicable law. We also make reasonable accommodations for applicants’ and employees’ religious practices and beliefs, as well as mental health or physical disability needs. Visit our FAQs for more information about requesting an accommodation.

Equal Opportunity Employer/Disability/Veterans

About The Team

Our Consumer & Community Banking division serves our Chase customers through a range of financial services, including personal banking, credit cards, mortgages, auto financing, investment advice, small business loans and payment processing. We’re proud to lead the U.S. in credit card sales and deposit growth and have the most-used digital solutions – all while ranking first in customer satisfaction.

The Digital team is dedicated to creating innovative, industry-leading products and experiences that help customers access, share and control their financial data so they can make smart decisions with their money. Teams enable innovation while adhering to the firm’s data sharing principles of security, customer control and convenience, and privacy.","<strong>Job Description

</strong>As a Senior UX Designer in the Design and Customer Experience Authentication team, you will be tasked with collaborating with various teams, utilizing your expertise in user-centered design to create products that are not only useful and usable, but also desirable to meet both customer and business needs. You will be a part of a dedicated experience team, which includes experience researchers and content designers, all working towards designing the future of financial services. Your daily responsibilities will include making product design decisions and re-designing product experiences across our Consumer and Community Banking Authentication offerings, using data and user research to pinpoint opportunities for improvement. Additionally, you will be expected to champion the users’ perspective when working with Product Managers and Engineers to plan roadmaps, gather requirements, and organize the work.

<strong>Job Responsibilities

</strong>Make daily product design decisions and re-design product experiences across our Authentication offerings. Using data and user research to identify opportunities for making improvements.

Advocate for the users’ perspective when collaborating with Product Managers and Engineers to plan roadmaps, gather requirements, and structure the work. 

Uses storytelling, user journey, conceptual prototypes and other strategies to articulate complex concepts, customer problems, and potential solutions to varying stakeholders and partners across disciplines and the organization 

Designs and facilitates workshops to extract hypothesis, potential solutions, generate excitement, ensure a common understanding, and foster team alignment.

<strong>Required Qualifications, Capabilities, And Skills

</strong>Able to form a tangible user experience vision with clear objectives and desired outcomes from the nebulous

Excellent communicator able to concisely explain complex systems and concepts to various partners and stakeholders 

Understands and uses collaborative activities to foster alignment and actionable next steps

Comfortable working closely with UX Researchers and Data Analysts to gather customer feedback and analytics, and use that information to drive improvements to the customer’s journey.

Insatiable curiosity about customers, technology, the business, and the future of the industry.

A natural connector of people, ideas, and technology to identify and solve the right problem. 

<strong>Preferred Qualifications, Capabilities And Skills

</strong>Previous experience shipping multiple successful digital products

Self-directed; in both planning and structuring your effort, and executing and expected levels of quality, you don’t need someone guiding you through the work

UX design background with strong propensity for experimentation

<strong>About Us

</strong>Chase is a leading financial services firm, helping nearly half of America’s households and small businesses achieve their financial goals through a broad range of financial products. Our mission is to create engaged, lifelong relationships and put our customers at the heart of everything we do. We also help small businesses, nonprofits and cities grow, delivering solutions to solve all their financial needs.

We offer a competitive total rewards package including base salary determined based on the role, experience, skill set, and location. For those in eligible roles, discretionary incentive compensation which may be awarded in recognition of individual achievements and contributions. We also offer a range of benefits and programs to meet employee needs, based on eligibility. These benefits include comprehensive health care coverage, on-site health and wellness centers, a retirement savings plan, backup childcare, tuition reimbursement, mental health support, financial coaching and more. Additional details about total compensation and benefits will be provided during the hiring process.

We recognize that our people are our strength and the diverse talents they bring to our global workforce are directly linked to our success. We are an equal opportunity employer and place a high value on diversity and inclusion at our company. We do not discriminate on the basis of any protected attribute, including race, religion, color, national origin, gender, sexual orientation, gender identity, gender expression, age, marital or veteran status, pregnancy or disability, or any other basis protected under applicable law. We also make reasonable accommodations for applicants’ and employees’ religious practices and beliefs, as well as mental health or physical disability needs. Visit our FAQs for more information about requesting an accommodation.

Equal Opportunity Employer/Disability/Veterans

<strong>About The Team

</strong>Our Consumer & Community Banking division serves our Chase customers through a range of financial services, including personal banking, credit cards, mortgages, auto financing, investment advice, small business loans and payment processing. We’re proud to lead the U.S. in credit card sales and deposit growth and have the most-used digital solutions – all while ranking first in customer satisfaction.

The Digital team is dedicated to creating innovative, industry-leading products and experiences that help customers access, share and control their financial data so they can make smart decisions with their money. Teams enable innovation while adhering to the firm’s data sharing principles of security, customer control and convenience, and privacy.","JPMorgan Chase & Co.","https://www.linkedin.com/jobs/view/3827218739/","Columbus, Ohio, United States","Skills: User Experience Design (UED), User Experience (UX), +8 more","10,001+ employees · Financial Services
175 school alumni work here","LISTED","6077559","JPMorgan Chase & Co.","https://media.licdn.com/dms/image/C4E0BAQFN7ZGRjNcgeA/company-logo_400_400/0/1656681489601/jpmorganchase_logo?e=1718236800&v=beta&t=BrYF2vuWuNBc74XLrNLRS1jbueSOx6X29gCaScZxmRE","2024-02-14T22:05:40.000Z","2024-03-08T02:16:37.643Z"
