"Title","Description","Description HTML","Primary Description","Detail URL","Location","Skill","Insight","Job State","Poster Id","Company Name","Company Logo","Created At","Scraped At"
"UX Researcher","We pioneered the online dating industry as Match.com in 1995. Even though we’ve dropped the “.com”, Match is still bringing millions of singles together to find love. Creating a sense of belonging doesn’t stop at our products - it’s the foundation of every team we hire.

Match is hiring a mixed methods UX Researcher to drive innovation through deep insights into the needs of singles navigating the complexity of dating today. You'll use generative and evaluative research methods in close partnership with Product Designers and Product Managers to identify new opportunities to improve the dating journey, validate product solutions, and help us understand the ""why"" behind quantitative data uncovered by our analytics team.

 When it comes to dating, the connection starts online, but the real magic happens once you meet in real life (IRL). We think the same is true for creating the best platforms, so we work together IRL in our New York office 3 days/week.

How you'll make an impact:

You will lead research initiatives that drive Match towards making dating delightful and rewarding for singles, using rigorous qualitative and quantitative research methods.You will generate actionable insights to drive stakeholder decision making across the product organization. You will partner with Design and Product to make research an essential part of our practice and culture (i.e., creating documentation on best practices, advocacy of methods, partnering and mentoring on tests run by design or PMs).Aside from working on the Match product you will have the chance to drive research for exciting and innovative social and dating opportunities. 


We could be a Match if: 

You have at least 4 years of industry experience conducting mixed methods UX research. You have a wide range of both qualitative (e.g., in depth user interviews, diary studies, concept testing) and quantitative (survey design, statistical analysis, usability testing) methodologies in your toolkit. You have experience leading research projects throughout the product development lifecycle in collaboration with cross-discipline stakeholders.You know when to recommend what research method in order to balance accuracy against speed.


Bonus points if you have: 

A Masters or PhD in Human Computer Interaction, Psychology, Information Science, Anthropology, Sociology, STS, or another related technical field.Experience developing a research practice (e.g., setting up more streamlined research operations, evangelizing UX research, and increasing research impact within your company)Experience working with executive leadership (e.g., Director level and above).


What's the team like? 

In this role, you’ll report to our Director of Product Design and work alongside product, design, analytics, and development professionalsOur team is lean, resourceful, and scrappy - you'll be joining us as the sole researcher, allowing you a tremendous opportunity to make a huge impact in a space that is so fundamental to people's lives.You will have the opportunity to partner alongside other researchers within the Affinity and New Verticals brands and help build the research culture.


$115,000 - $135,000 a year

 Factors such as scope and responsibilities of the position, candidate's work experience, education/training, job-related skills, internal peer equity, as well as market and business considerations may influence base pay offered. This salary range is reflective of a position based in New York City, NY. This salary will be subject to a geographic adjustment (according to a specific city and state), if an authorization is granted to work outside of the location listed in this posting.

Why Match Group?

Our mission is simple – to help people find love and happiness! We love our employees too and understand the importance of all life's milestones. Here are some of the benefits we are proud to offer:

 Mind & Body – Medical, mental health, and wellness benefits to support your overall health and well-being

 Financial Wellness – Competitive compensation, 100% employer match on 401k contributions up to 10% (cap at $10,000), as well as an employee stock purchase program to help you feel supported in your financial security

 Unplug  – Generous PTO and 18 paid holidays so you can unplug

 Career – Annual training allowance for professional development and ERG membership opportunities and events so you feel connected and empowered in your work

 Family  – Families come in all shapes and sizes so we offer 20 weeks of 100% paid parental leave, fertility, adoption, and child care resources, as well as pet insurance and discounts

 Company Gatherings  – We host fun happy hours and company events where our employees get to know each other and build a sense of connection and belonging!

 We are proud to be an equal opportunity employer and we value the rich dynamics that diversity brings to our company. We do not discriminate on the basis of race, religion, color, creed, national origin, ancestry, disability, marital status, age, sexual orientation, sex (including pregnancy and sexual harassment), gender identity or expression, uniformed service or veteran status, genetic information, or any other legally protected characteristic. Period. 

 If you require reasonable accommodation to complete a job application, pre-employment testing, or a job interview or to otherwise participate in the hiring process, please contact employeebenefits@matchgroup.com .

","We pioneered the online dating industry as Match.com in 1995. Even though we’ve dropped the “.com”, Match is still bringing millions of singles together to find love. Creating a sense of belonging doesn’t stop at our products - it’s the foundation of every team we hire.

Match is hiring a mixed methods UX Researcher to drive innovation through deep insights into the needs of singles navigating the complexity of dating today. You'll use generative and evaluative research methods in close partnership with Product Designers and Product Managers to identify new opportunities to improve the dating journey, validate product solutions, and help us understand the ""why"" behind quantitative data uncovered by our analytics team.

 When it comes to dating, the connection starts online, but the real magic happens once you meet in real life (IRL). We think the same is true for creating the best platforms, so we work together IRL in our New York office 3 days/week.

<strong>How you'll make an impact:

</strong><li>You will lead research initiatives that drive Match towards making dating delightful and rewarding for singles, using rigorous qualitative and quantitative research methods.</li><li>You will generate actionable insights to drive stakeholder decision making across the product organization. </li><li>You will partner with Design and Product to make research an essential part of our practice and culture (i.e., creating documentation on best practices, advocacy of methods, partnering and mentoring on tests run by design or PMs).</li><li>Aside from working on the Match product you will have the chance to drive research for exciting and innovative social and dating opportunities. 


</li><strong>We could be a Match if: 

</strong><li>You have at least 4 years of industry experience conducting mixed methods UX research. </li><li>You have a wide range of both qualitative (e.g., in depth user interviews, diary studies, concept testing) and quantitative (survey design, statistical analysis, usability testing) methodologies in your toolkit. </li><li>You have experience leading research projects throughout the product development lifecycle in collaboration with cross-discipline stakeholders.</li><li>You know when to recommend what research method in order to balance accuracy against speed.


</li><strong>Bonus points if you have: 

</strong><li>A Masters or PhD in Human Computer Interaction, Psychology, Information Science, Anthropology, Sociology, STS, or another related technical field.</li><li>Experience developing a research practice (e.g., setting up more streamlined research operations, evangelizing UX research, and increasing research impact within your company)</li><li>Experience working with executive leadership (e.g., Director level and above).


</li><strong>What's the team like? 

</strong><li>In this role, you’ll report to our Director of Product Design and work alongside product, design, analytics, and development professionals</li><li>Our team is lean, resourceful, and scrappy - you'll be joining us as the sole researcher, allowing you a tremendous opportunity to make a huge impact in a space that is so fundamental to people's lives.</li><li>You will have the opportunity to partner alongside other researchers within the Affinity and New Verticals brands and help build the research culture.


</li>$115,000 - $135,000 a year

 Factors such as scope and responsibilities of the position, candidate's work experience, education/training, job-related skills, internal peer equity, as well as market and business considerations may influence base pay offered. This salary range is reflective of a position based in New York City, NY. This salary will be subject to a geographic adjustment (according to a specific city and state), if an authorization is granted to work outside of the location listed in this posting.

<strong>Why Match Group?

</strong>Our mission is simple – to help people find love and happiness! We love our employees too and understand the importance of all life's milestones. Here are some of the benefits we are proud to offer:

 <strong>Mind & Body</strong> – Medical, mental health, and wellness benefits to support your overall health and well-being

 <strong>Financial Wellness</strong> – Competitive compensation, 100% employer match on 401k contributions up to 10% (cap at $10,000), as well as an employee stock purchase program to help you feel supported in your financial security

<strong> Unplug </strong> – Generous PTO and 18 paid holidays so you can unplug

 <strong>Career</strong> – Annual training allowance for professional development and ERG membership opportunities and events so you feel connected and empowered in your work

 <strong>Family </strong> – Families come in all shapes and sizes so we offer 20 weeks of 100% paid parental leave, fertility, adoption, and child care resources, as well as pet insurance and discounts

 <strong>Company Gatherings </strong> – We host fun happy hours and company events where our employees get to know each other and build a sense of connection and belonging!

 We are proud to be an equal opportunity employer and we value the rich dynamics that diversity brings to our company. We do not discriminate on the basis of race, religion, color, creed, national origin, ancestry, disability, marital status, age, sexual orientation, sex (including pregnancy and sexual harassment), gender identity or expression, uniformed service or veteran status, genetic information, or any other legally protected characteristic. Period. 

 <strong>If you require reasonable accommodation to complete a job application, pre-employment testing, or a job interview or to otherwise participate in the hiring process, please contact employeebenefits@matchgroup.com .

</strong>","Match","https://www.linkedin.com/jobs/view/3845725230/","New York, New York, United States","Skills: UX Research, User Experience (UX), +8 more","1,001-5,000 employees · Software Development
1 school alum works here","LISTED","355602316","Match","https://media.licdn.com/dms/image/C560BAQFv2n_dsTnjSg/company-logo_400_400/0/1630670798221/match_com_logo?e=1718236800&v=beta&t=9-YKORnEtvXBG9SiEMAi2iptwMBlQSU0r0paSx5wuFY","2024-03-04T03:57:43.000Z","2024-03-08T02:16:37.643Z"
