"Title","Description","Description HTML","Primary Description","Detail URL","Location","Skill","Insight","Job State","Poster Id","Company Name","Company Logo","Created At","Scraped At"
"UX Researcher","Your work days are brighter here.

At Workday, it all began with a conversation over breakfast. When our founders met at a sunny California diner, they came up with an idea to revolutionize the enterprise software market. And when we began to rise, one thing that really set us apart was our culture. A culture which was driven by our value of putting our people first. And ever since, the happiness, development, and contribution of every Workmate is central to who we are. Our Workmates believe a healthy employee-centric, collaborative culture is the essential mix of ingredients for success in business. That’s why we look after our people, communities and the planet while still being profitable. Feel encouraged to shine, however that manifests: you don’t need to hide who you are. You can feel the energy and the passion, it's what makes us unique. Inspired to make a brighter work day for all and transform with us to the next stage of our growth journey? Bring your brightest version of you and have a brighter work day here.

About The Team

Research : We are a diverse and dynamic research organization, responsible for applying insights to influence design, product, and strategic business decisions. We’re passionate about crafting an outstanding research organization at Workday, known for delivering high quality, timely insights that help Workday deliver solutions that support thousands of employees around the world. Our team includes people from non-traditional research backgrounds, as well people from academia. We invite you to reach out and talk with us; we love research and researchers and genuinely celebrate the quirkiness that abounds across our diverse backgrounds - we’ve researched everything from authoritarian regimes to local food to software billions of people use every day. We’d love to add your research stories, too.

Productivity Technology: Our Productivity Technology team has the unique opportunity to develop the next generation of Workday’s foundational products supporting a customer base of more than 50 million. You will tackle challenging research problems and influence teams across Workday as you help create accessible, internationalized, and reliable software. Thrive in our people-first culture and do your best work. Join us as we change the way millions of people work!

About The Role

As a Researcher at Workday you will work closely with your design and product partners for features in a particular product or area. Your research focus will be on both long and near term decisions. You will be empowered to help craft a research roadmap to ensure research efforts are aligned with priorities. Our ideal candidate is comfortable in at least one research method and can demonstrate ability in several others. We are looking for someone who can illustrate skills connecting research insights to business and product solutions. We are looking for a researcher with a consistent record of executing research projects and delivering on high quality, impactful insights. Building and maintaining strong, purposeful relationships with design, product, engineering, and research partners is crucial.

Areas of responsibility include:

Work closely with cross-functional teams to identify research questions and objectives.In partnership with design and product partners develop a research roadmap for a product or area that supports high priority efforts.Design and implement research using appropriate methods for the project, timelines, and business needs.Create durable research insights that align with user-centered design principles.Analyze data and findings to deliver actionable insights that inform business, product and design decisions.Socialize, collaborate, and present research work and findings to multiple teams and leaders, across the organization.

About You

Basic Qualifications: 

4+ years of professional experience conducting research 2+ years of research experience with a Master's degree in anthropology, sociology, psychology, human-computer interaction. Strong knowledge and understanding of evaluative, generative, quantitative and secondary research methods, and proficiency in at least one research methodology.Strong familiarity with the product development process.Ph.D. in anthropology, sociology, psychology, human-computer interaction (preferred) 

Other Qualifications:

Track record of translating research into business impact.Effective interpersonal skills with experience presenting to diverse audiences.A flexible and effective influencing style.Ability to meet bold timelines.Self-starter and strong finisher with a positive demeanor.Excellent collaborator, at ease partnering with other researchers, designers, product managers, and developers.Open to Flex-Hybrid reporting with 50% in our Boulder office. 

Workday Pay Transparency Statement

The annualized base salary ranges for the primary location and any additional locations are listed below. Workday pay ranges vary based on work location. As a part of the total compensation package, this role may be eligible for the Workday Bonus Plan or a role-specific commission/bonus, as well as annual refresh stock grants. Recruiters can share more detail during the hiring process. Each candidate’s compensation offer will be based on multiple factors including, but not limited to, geography, experience, skills, job duties, and business need, among other things. For more information regarding Workday’s comprehensive benefits, please click here.

Primary Location: USA.CO.Boulder

Primary Location Base Pay Range: $117,600 USD - $176,400 USD

Additional US Location(s) Base Pay Range: $111,700 USD - $198,000 USD

Our Approach to Flexible Work

With Flex Work, we’re combining the best of both worlds: in-person time and remote. Our approach enables our teams to deepen connections, maintain a strong community, and do their best work. We know that flexibility can take shape in many ways, so rather than a number of required days in-office each week, we simply spend at least half (50%) of our time each quarter in the office or in the field with our customers, prospects, and partners (depending on role). This means you'll have the freedom to create a flexible schedule that caters to your business, team, and personal needs, while being intentional to make the most of time spent together. Those in our remote ""home office"" roles also have the opportunity to come together in our offices for important moments that matter.

Pursuant to applicable Fair Chance law, Workday will consider for employment qualified applicants with arrest and conviction records.

Workday is an Equal Opportunity Employer including individuals with disabilities and protected veterans.

Are you being referred to one of our roles? If so, ask your connection at Workday about our Employee Referral process!

","<strong><strong>Your work days are brighter here.

</strong></strong>At Workday, it all began with a conversation over breakfast. When our founders met at a sunny California diner, they came up with an idea to revolutionize the enterprise software market. And when we began to rise, one thing that really set us apart was our culture. A culture which was driven by our value of putting our people first. And ever since, the happiness, development, and contribution of every Workmate is central to who we are. Our Workmates believe a healthy employee-centric, collaborative culture is the essential mix of ingredients for success in business. That’s why we look after our people, communities and the planet while still being profitable. Feel encouraged to shine, however that manifests: you don’t need to hide who you are. You can feel the energy and the passion, it's what makes us unique. Inspired to make a brighter work day for all and transform with us to the next stage of our growth journey? Bring your brightest version of you and have a brighter work day here.

<strong>About The Team

</strong>Research : We are a diverse and dynamic research organization, responsible for applying insights to influence design, product, and strategic business decisions. We’re passionate about crafting an outstanding research organization at Workday, known for delivering high quality, timely insights that help Workday deliver solutions that support thousands of employees around the world. Our team includes people from non-traditional research backgrounds, as well people from academia. We invite you to reach out and talk with us; we love research and researchers and genuinely celebrate the quirkiness that abounds across our diverse backgrounds - we’ve researched everything from authoritarian regimes to local food to software billions of people use every day. We’d love to add your research stories, too.

Productivity Technology: Our Productivity Technology team has the unique opportunity to develop the next generation of Workday’s foundational products supporting a customer base of more than 50 million. You will tackle challenging research problems and influence teams across Workday as you help create accessible, internationalized, and reliable software. Thrive in our people-first culture and do your best work. Join us as we change the way millions of people work!

<strong>About The Role

</strong>As a Researcher at Workday you will work closely with your design and product partners for features in a particular product or area. Your research focus will be on both long and near term decisions. You will be empowered to help craft a research roadmap to ensure research efforts are aligned with priorities. Our ideal candidate is comfortable in at least one research method and can demonstrate ability in several others. We are looking for someone who can illustrate skills connecting research insights to business and product solutions. We are looking for a researcher with a consistent record of executing research projects and delivering on high quality, impactful insights. Building and maintaining strong, purposeful relationships with design, product, engineering, and research partners is crucial.

<strong>Areas of responsibility include:

</strong><ul><li>Work closely with cross-functional teams to identify research questions and objectives.</li><li>In partnership with design and product partners develop a research roadmap for a product or area that supports high priority efforts.</li><li>Design and implement research using appropriate methods for the project, timelines, and business needs.</li><li>Create durable research insights that align with user-centered design principles.</li><li>Analyze data and findings to deliver actionable insights that inform business, product and design decisions.</li><li>Socialize, collaborate, and present research work and findings to multiple teams and leaders, across the organization.

</li></ul><strong>About You

</strong><strong><strong>Basic Qualifications</strong>: 

</strong><ul><li>4+ years of professional experience conducting research </li><li>2+ years of research experience with a Master's degree in anthropology, sociology, psychology, human-computer interaction. </li><li>Strong knowledge and understanding of evaluative, generative, quantitative and secondary research methods, and proficiency in at least one research methodology.</li><li>Strong familiarity with the product development process.</li><li>Ph.D. in anthropology, sociology, psychology, human-computer interaction (preferred) 

</li></ul><strong><strong>Other Qualifications</strong>:

</strong><ul><li>Track record of translating research into business impact.</li><li>Effective interpersonal skills with experience presenting to diverse audiences.</li><li>A flexible and effective influencing style.</li><li>Ability to meet bold timelines.</li><li>Self-starter and strong finisher with a positive demeanor.</li><li>Excellent collaborator, at ease partnering with other researchers, designers, product managers, and developers.</li><li>Open to Flex-Hybrid reporting with 50% in our Boulder office. 

</li></ul><strong>Workday Pay Transparency Statement

</strong>The annualized base salary ranges for the primary location and any additional locations are listed below. Workday pay ranges vary based on work location. As a part of the total compensation package, this role may be eligible for the Workday Bonus Plan or a role-specific commission/bonus, as well as annual refresh stock grants. Recruiters can share more detail during the hiring process. Each candidate’s compensation offer will be based on multiple factors including, but not limited to, geography, experience, skills, job duties, and business need, among other things. For more information regarding Workday’s comprehensive benefits, please click here.

Primary Location: USA.CO.Boulder

Primary Location Base Pay Range: $117,600 USD - $176,400 USD

Additional US Location(s) Base Pay Range: $111,700 USD - $198,000 USD

<strong>Our Approach to Flexible Work

</strong>With Flex Work, we’re combining the best of both worlds: in-person time and remote. Our approach enables our teams to deepen connections, maintain a strong community, and do their best work. We know that flexibility can take shape in many ways, so rather than a number of required days in-office each week, we simply <strong>spend at least half (50%) of our time each quarter in the office or in the field</strong> with our customers, prospects, and partners (depending on role). This means you'll have the freedom to create a flexible schedule that caters to your business, team, and personal needs, while being intentional to make the most of time spent together. Those in our remote ""home office"" roles also have the opportunity to come together in our offices for important moments that matter.

Pursuant to applicable Fair Chance law, Workday will consider for employment qualified applicants with arrest and conviction records.

Workday is an Equal Opportunity Employer including individuals with disabilities and protected veterans.

<strong>Are you being referred to one of our roles? If so, ask your connection at Workday about our Employee Referral process!

</strong>","Workday · Denver, CO (Hybrid)","https://www.linkedin.com/jobs/view/3903117746/","Denver, Colorado, United States","Skills: Anthropology, User Experience (UX), +8 more","10,001+ employees · Software Development
24 school alumni work here","LISTED","27434682","Workday","https://media.licdn.com/dms/image/C560BAQFpt1PjH2h4pA/company-logo_400_400/0/1656686709493/workday_logo?e=1721865600&v=beta&t=AUAmRutAQCOnj4-fBaIq5g-zTy1B6b_WBIuoggiZZg0","2024-04-16T16:52:53.000Z","2024-04-21T14:07:32.654Z"
