"Title","Description","Description HTML","Primary Description","Detail URL","Location","Skill","Insight","Job State","Poster Id","Company Name","Company Logo","Created At","Scraped At"
"UX Researcher, Quantitative","Our UX Research team is designing for the global diversity of human needs, which requires us to deeply understand the behaviors of the people behind them. Our researchers tackle some of the most complex challenges to gain deeper insights into how people interact with each other and the world around them, and work collaboratively to contribute new ideas to products that impact the experiences of billions of people on a global scale. This job description represents different full-time roles across Meta.We use a variety of qualitative and quantitative methods to accomplish our goals, including surveys, focus groups, field studies, usability tests, and 1:1 interviews. We value a diverse range of perspectives and stem from many different backgrounds.We’re looking for excellent communicators who are knowledgeable about research devoted to understanding people, and curious about the relationship between technology and society. They will also need to be comfortable in a fast-moving organization, open-minded about learning new research methods, committed to high-quality and rigorous research, and focused on influencing the future of Meta.

UX Researcher, Quantitative Responsibilities:

Work closely with product and business teams to identify research topicsAct as a thought leader in the domain of research, while advocating for the people who could use our productsDesign and execute end-to-end custom primary research using a wide variety of methodsDesign studies that address both user behavior and attitudesAbility to work independently and autonomouslyEffectively manage and prioritize research plans through ambiguous and fast-changing environments, align and efficiently execute critical insights and work with a large group of stakeholdersCommunicate results and illustrate suggestions in compelling and creative waysWork cross-functionally with design, product management, content strategy, engineering and marketingGenerate insights that both fuel ideation and evaluate designs

Minimum Qualifications:

Bachelor’s degree with 10+ years’ of relevant experience in user experience, applied research and/or product research and development or a Master’s degree and 8+ years’ relevant experience, or PhD and 5+ year relevant experienceExperience coding with R, SQL, STATA, SPSS or equivalentExperience with survey design and response effectsExperience applying statistical analysis methods such as Regressions, ANOVA, and T-TestsInterest in and experience executing hands-on, primary researchExperience translating research findings into strategic narratives

Preferred Qualifications:

Degrees in a human behavior related field, such as Human-Computer Interaction, Psychology, Sociology, Communication, Information Science, Media Studies, Computer Science, or EconomicsExperience with consumer products, consumer insights, or product development

About Meta:

Meta builds technologies that help people connect, find communities, and grow businesses. When Facebook launched in 2004, it changed the way people connect. Apps like Messenger, Instagram and WhatsApp further empowered billions around the world. Now, Meta is moving beyond 2D screens toward immersive experiences like augmented and virtual reality to help build the next evolution in social technology. People who choose to build their careers by building with us at Meta help shape a future that will take us beyond what digital connection makes possible today—beyond the constraints of screens, the limits of distance, and even the rules of physics.

Meta is proud to be an Equal Employment Opportunity and Affirmative Action employer. We do not discriminate based upon race, religion, color, national origin, sex (including pregnancy, childbirth, or related medical conditions), sexual orientation, gender, gender identity, gender expression, transgender status, sexual stereotypes, age, status as a protected veteran, status as an individual with a disability, or other applicable legally protected characteristics. We also consider qualified applicants with criminal histories, consistent with applicable federal, state and local law. Meta participates in the E-Verify program in certain locations, as required by law. Please note that Meta may leverage artificial intelligence and machine learning technologies in connection with applications for employment.

Meta is committed to providing reasonable accommodations for candidates with disabilities in our recruiting process. If you need any assistance or accommodations due to a disability, please let us know at accommodations-ext@fb.com.","Our UX Research team is designing for the global diversity of human needs, which requires us to deeply understand the behaviors of the people behind them. Our researchers tackle some of the most complex challenges to gain deeper insights into how people interact with each other and the world around them, and work collaboratively to contribute new ideas to products that impact the experiences of billions of people on a global scale. This job description represents different full-time roles across Meta.We use a variety of qualitative and quantitative methods to accomplish our goals, including surveys, focus groups, field studies, usability tests, and 1:1 interviews. We value a diverse range of perspectives and stem from many different backgrounds.We’re looking for excellent communicators who are knowledgeable about research devoted to understanding people, and curious about the relationship between technology and society. They will also need to be comfortable in a fast-moving organization, open-minded about learning new research methods, committed to high-quality and rigorous research, and focused on influencing the future of Meta.

UX Researcher, Quantitative Responsibilities:

<ul><li>Work closely with product and business teams to identify research topics</li><li>Act as a thought leader in the domain of research, while advocating for the people who could use our products</li><li>Design and execute end-to-end custom primary research using a wide variety of methods</li><li>Design studies that address both user behavior and attitudes</li><li>Ability to work independently and autonomously</li><li>Effectively manage and prioritize research plans through ambiguous and fast-changing environments, align and efficiently execute critical insights and work with a large group of stakeholders</li><li>Communicate results and illustrate suggestions in compelling and creative ways</li><li>Work cross-functionally with design, product management, content strategy, engineering and marketing</li><li>Generate insights that both fuel ideation and evaluate designs

</li></ul>Minimum Qualifications:

<ul><li>Bachelor’s degree with 10+ years’ of relevant experience in user experience, applied research and/or product research and development or a Master’s degree and 8+ years’ relevant experience, or PhD and 5+ year relevant experience</li><li>Experience coding with R, SQL, STATA, SPSS or equivalent</li><li>Experience with survey design and response effects</li><li>Experience applying statistical analysis methods such as Regressions, ANOVA, and T-Tests</li><li>Interest in and experience executing hands-on, primary research</li><li>Experience translating research findings into strategic narratives

</li></ul>Preferred Qualifications:

<ul><li>Degrees in a human behavior related field, such as Human-Computer Interaction, Psychology, Sociology, Communication, Information Science, Media Studies, Computer Science, or Economics</li><li>Experience with consumer products, consumer insights, or product development

</li></ul>About Meta:

Meta builds technologies that help people connect, find communities, and grow businesses. When Facebook launched in 2004, it changed the way people connect. Apps like Messenger, Instagram and WhatsApp further empowered billions around the world. Now, Meta is moving beyond 2D screens toward immersive experiences like augmented and virtual reality to help build the next evolution in social technology. People who choose to build their careers by building with us at Meta help shape a future that will take us beyond what digital connection makes possible today—beyond the constraints of screens, the limits of distance, and even the rules of physics.

Meta is proud to be an Equal Employment Opportunity and Affirmative Action employer. We do not discriminate based upon race, religion, color, national origin, sex (including pregnancy, childbirth, or related medical conditions), sexual orientation, gender, gender identity, gender expression, transgender status, sexual stereotypes, age, status as a protected veteran, status as an individual with a disability, or other applicable legally protected characteristics. We also consider qualified applicants with criminal histories, consistent with applicable federal, state and local law. Meta participates in the E-Verify program in certain locations, as required by law. Please note that Meta may leverage artificial intelligence and machine learning technologies in connection with applications for employment.

Meta is committed to providing reasonable accommodations for candidates with disabilities in our recruiting process. If you need any assistance or accommodations due to a disability, please let us know at accommodations-ext@fb.com.","Meta","https://www.linkedin.com/jobs/view/3830551489/","Washington, District of Columbia, United States","Skills: User Experience (UX), User Interface Design, +8 more","10,001+ employees · Software Development
4 connections work here · 159 school alumni work here","LISTED","257321375","Meta","https://media.licdn.com/dms/image/C4E0BAQFdNatYGiBelg/company-logo_400_400/0/1636138754252/facebook_logo?e=1718236800&v=beta&t=VZFky8-mrMkf751TLZjQ_uPW_piMgmanx107IhZu4P8","2024-02-14T22:08:09.000Z","2024-03-08T02:16:37.643Z"
"Principal UX Researcher","The Microsoft Compass Program is a customer engagement Research and Development (R&D) program that serves Microsoft's Experiences & Devices division (imagine: all our collaboration experiences including Office, Teams, OneDrive/SharePoint, Windows, Devices, and more). As part of our User Research team, we enable any individual within the Experiences & Devices organization to connect directly with customers to understand who they are building for, what they need and why, and how to design the best experiences to meet those needs. The Compass program includes more than 100 of Microsoft's strategic enterprise customers from around the world and was the first place Microsoft customers could test Copilot.

If you have a passion for effective customer relationship management, collaborative program management, and meaningful research experience and impact, we would love for you to apply.

As a Principal UX Researcher on the Compass team, you will be a key part of a growing team that enables the growth and operation of Compass, including our AIX00 panel where a selection of our key customers work closely with us to define the future of Copilot and generative AI.

The Keys To Success In This Role Are

Outstanding project management skillsA deep understanding of and experience with customer-centric product development research processes Customer empathy and relationship management skills. 

You will partner with a set of global customers and facilitate deep engagement between IT, leadership, and end users (both knowledge workers and first line workers) so that we understand their business needs. You will also craft a regular cadence of engagement to ensure lasting, effective relationships with our customers and the enablement of Microsoft’s impactful R&D value.

Join us in growing the Microsoft Compass Program and help shape the future of Copilot!

Responsibilities

Identifying and onboarding new customersPitching the program (internally and externally) Helping us support our broader org at scale through efficient processesManaging relationships and engagements with internal product group stakeholders to ensure their research needs are metManaging relationships and engagements with a set of external customersPlanning and executing our events that feature roadmap discussions, customer roundtables and extensive customer co-design sprintsCoordinating engagement projects and research for our team and partners, including helping to operate our AIX00 panel Managing our internal and external communications to create awareness and use of our programContributing key, horizontal research projects yourself

Qualifications

Required/Minimum Qualifications:

Bachelor's Degree in Human-Computer Interaction, Human Factors Engineering, Computer Science, Technical Communications, Information Science, Information Architecture, User Experience Design, Behavioral Science, Social Sciences, or related field AND 6+ years User Experience Research experienceOR Master's Degree in Human-Computer Interaction, Human Factors Engineering, Computer Science, Technical Communications, Information Science, Information Architecture, User Experience Design, Behavioral Science, Social Sciences, or related field AND 4+ years User Experience Research experienceOR Doctorate in Human-Computer Interaction, Human Factors Engineering, Computer Science, Technical Communications, Information Science, Information Architecture, User Experience Design, Behavioral Science, Social Sciences, or related field AND 3+ years User Experience Research experienceOR equivalent experience.
Preferred Qualifications

5-7 years of program or product management experience 5-7 years of experience working directly with customers; managing customer relationships  5+ years of hands-on product or market research and/or product planning experience, with demonstrated skill in collecting and analyzing qualitative data to improve plans and UX in a technology industry setting. Confident, capable and persuasive presentation of ideas and executive presence (envision yourself presenting to execs at the customer and at Microsoft) Excitement and capability to coach and teach others about effective research through engaging storytelling and captivating presentionsAbility to synthesize qualitative and quantitative data into salient and compelling go dos for our product teams and executives Research experience and aptitude with an ability to develop new skills and work with new methods as needed Experience effectively managing customer panels or research programs Attention to details and deadlines Experience managing vendors and budgets Dedication to refining and building upon your existing research skills as well as learning new research methods A growth mindset; one who is willing to positively impact our culture by investing in oneself and others through effective collaboration and empathy for others Commitment to a culture of diversity, equity, inclusion and allyship as part of a globally distributed team 

UX Research IC5 - The typical base pay range for this role across the U.S. is USD $133,600 - $256,800 per year. There is a different range applicable to specific work locations, within the San Francisco Bay area and New York City metropolitan area, and the base pay range for this role in those locations is USD $173,200 - $282,200 per year.

Certain roles may be eligible for benefits and other compensation. Find additional benefits and pay information here: https://careers.microsoft.com/us/en/us-corporate-pay

#JoinX3 #OPGJobs

Microsoft is an equal opportunity employer. Consistent with applicable law, all qualified applicants will receive consideration for employment without regard to age, ancestry, citizenship, color, family or medical care leave, gender identity or expression, genetic information, immigration status, marital status, medical condition, national origin, physical or mental disability, political affiliation, protected veteran or military status, race, ethnicity, religion, sex (including pregnancy), sexual orientation, or any other characteristic protected by applicable local laws, regulations and ordinances. If you need assistance and/or a reasonable accommodation due to a disability during the application process, read more about requesting accommodations.","The Microsoft Compass Program is a customer engagement Research and Development (R&D) program that serves Microsoft's Experiences & Devices division (imagine: all our collaboration experiences including Office, Teams, OneDrive/SharePoint, Windows, Devices, and more). As part of our User Research team, we enable any individual within the Experiences & Devices organization to connect directly with customers to understand who they are building for, what they need and why, and how to design the best experiences to meet those needs. The Compass program includes more than 100 of Microsoft's strategic enterprise customers from around the world and was the first place Microsoft customers could test Copilot.

If you have a passion for effective customer relationship management, collaborative program management, and meaningful research experience and impact, we would love for you to apply.

As a Principal UX Researcher on the Compass team, you will be a key part of a growing team that enables the growth and operation of Compass, including our AIX00 panel where a selection of our key customers work closely with us to define the future of Copilot and generative AI.

<strong>The Keys To Success In This Role Are

</strong><ul><li>Outstanding project management skills</li><li>A deep understanding of and experience with customer-centric product development research processes </li><li>Customer empathy and relationship management skills. 

</li></ul>You will partner with a set of global customers and facilitate deep engagement between IT, leadership, and end users (both knowledge workers and first line workers) so that we understand their business needs. You will also craft a regular cadence of engagement to ensure lasting, effective relationships with our customers and the enablement of Microsoft’s impactful R&D value.

Join us in growing the Microsoft Compass Program and help shape the future of Copilot!

<strong>Responsibilities

</strong><ul><li>Identifying and onboarding new customers</li><li>Pitching the program (internally and externally) </li><li>Helping us support our broader org at scale through efficient processes</li><li>Managing relationships and engagements with internal product group stakeholders to ensure their research needs are met</li><li>Managing relationships and engagements with a set of external customers</li><li>Planning and executing our events that feature roadmap discussions, customer roundtables and extensive customer co-design sprints</li><li>Coordinating engagement projects and research for our team and partners, including helping to operate our AIX00 panel </li><li>Managing our internal and external communications to create awareness and use of our program</li><li>Contributing key, horizontal research projects yourself

</li></ul><strong>Qualifications

</strong><strong>Required/Minimum Qualifications:

</strong><ul><li>Bachelor's Degree in Human-Computer Interaction, Human Factors Engineering, Computer Science, Technical Communications, Information Science, Information Architecture, User Experience Design, Behavioral Science, Social Sciences, or related field AND 6+ years User Experience Research experience</li><ul><li>OR Master's Degree in Human-Computer Interaction, Human Factors Engineering, Computer Science, Technical Communications, Information Science, Information Architecture, User Experience Design, Behavioral Science, Social Sciences, or related field AND 4+ years User Experience Research experience</li><li>OR Doctorate in Human-Computer Interaction, Human Factors Engineering, Computer Science, Technical Communications, Information Science, Information Architecture, User Experience Design, Behavioral Science, Social Sciences, or related field AND 3+ years User Experience Research experience</li><li>OR equivalent experience.
</li></ul></ul><strong>Preferred Qualifications

</strong><ul><li>5-7 years of program or product management experience </li><li>5-7 years of experience working directly with customers; managing customer relationships </li><li> 5+ years of hands-on product or market research and/or product planning experience, with demonstrated skill in collecting and analyzing qualitative data to improve plans and UX in a technology industry setting. </li><li>Confident, capable and persuasive presentation of ideas and executive presence (envision yourself presenting to execs at the customer and at Microsoft) </li><li>Excitement and capability to coach and teach others about effective research through engaging storytelling and captivating presentions</li><li>Ability to synthesize qualitative and quantitative data into salient and compelling go dos for our product teams and executives </li><li>Research experience and aptitude with an ability to develop new skills and work with new methods as needed </li><li>Experience effectively managing customer panels or research programs </li><li>Attention to details and deadlines </li><li>Experience managing vendors and budgets </li><li>Dedication to refining and building upon your existing research skills as well as learning new research methods </li><li>A growth mindset; one who is willing to positively impact our culture by investing in oneself and others through effective collaboration and empathy for others </li><li>Commitment to a culture of diversity, equity, inclusion and allyship as part of a globally distributed team 

</li></ul>UX Research IC5 - The typical base pay range for this role across the U.S. is USD $133,600 - $256,800 per year. There is a different range applicable to specific work locations, within the San Francisco Bay area and New York City metropolitan area, and the base pay range for this role in those locations is USD $173,200 - $282,200 per year.

Certain roles may be eligible for benefits and other compensation. Find additional benefits and pay information here: https://careers.microsoft.com/us/en/us-corporate-pay

#JoinX3 #OPGJobs

Microsoft is an equal opportunity employer. Consistent with applicable law, all qualified applicants will receive consideration for employment without regard to age, ancestry, citizenship, color, family or medical care leave, gender identity or expression, genetic information, immigration status, marital status, medical condition, national origin, physical or mental disability, political affiliation, protected veteran or military status, race, ethnicity, religion, sex (including pregnancy), sexual orientation, or any other characteristic protected by applicable local laws, regulations and ordinances. If you need assistance and/or a reasonable accommodation due to a disability during the application process, read more about requesting accommodations.","Microsoft","https://www.linkedin.com/jobs/view/3825574772/","Redmond, Washington, United States","Skills: UX Research, User Experience (UX), +8 more","10,001+ employees · Software Development
4 connections work here · 339 school alumni work here","LISTED","823990701","Microsoft","https://media.licdn.com/dms/image/C560BAQE88xCsONDULQ/company-logo_400_400/0/1630652622688/microsoft_logo?e=1718236800&v=beta&t=nQ34Q2Q4MY47vq_g76ovgORErIiGTth9KlCGupfk-ME","2024-02-12T19:34:50.000Z","2024-03-08T02:16:37.643Z"
