"Title","Description","Description HTML","Primary Description","Detail URL","Location","Skill","Insight","Job State","Poster Id","Company Name","Company Logo","Created At","Scraped At"
"Senior User Experience Researcher (Branch)","Job Description

Become a Senior Experience Researcher for Branch and Teller experiences.

The Design and Customer Experience (DCE) team is responsible for creating exceptional experiences for Chase’s Consumer and Community Bank. We are a group of creative collaborators who are passionate about crafting experiences that have meaningful impact on the financial, physical, and emotional wellbeing of our customers. At Chase, we’re proud to serve nearly half of America’s households with a broad range of financial services, including personal banking, credit cards, mortgages, auto financing, investment advice, small business loans and payment processing. Our company is built around making a real difference for our communities, doing what's right for our customers, providing our employees with the opportunity to define unique career paths and sharing ideas that will help propel us into the future.

As an Experience Researcher in our consumer banking team, you will scope and craft research strategy, conduct research, and deliver actionable insights on research initiatives related to our Consumer Banking Products. You will be part of multi-disciplinary teams, including Product Designers and Content Designers, committed to designing the future of banking. You will participate in cross-functional collaboration with Product Managers, Data Analysts, and Engineers, informing prioritization, planning, and decisions along the way to execution. We expect you to have strengths in the core user research parts of this process, and a desire to continually broaden and improve your skills.

Job Responsibilities

Structure and plan simple evaluative research initiatives that address the needs of Product teamsDesign, administer, and report on these research studies, producing associated materials (e.g., screeners, discussion guides, toplines, etc.) with some guidanceSupport generative and formative researchPresent work, and the rationale behind research findings, to product leadershipTake a question or a problem and be able to translate it into a testable hypothesis—complete with a specific method and tasks that appropriately respond to research, project, and business objectivesHelp non-researchers (Product Designers, Content Designers, Product Managers) in taking part in user research work

Required Qualifications, Capabilities And Skills

Bachelor’s Degree in relevant research or design discipline (e.g., Interaction Design, HCI, Anthropology, Cognitive Science), certification from credible bootcamp or similar accelerated learning program, or equivalent work experienceAbility to lead a research study from beginning to end independentlyExperience conducting evaluative research, and supporting generative and formative researchDemonstrates strong User Research skills; and development in adjacent skills such as UX Writing, Information Architecture, and Interaction DesignFoundational comfort in presenting findings and insights to team members and stakeholders from multi-disciplinary backgroundsFoundational experience with key UX Research tools for studies such as remote research, usability testing

Preferred Qualifications, Capabilities And Skills

Foundational understanding of Accessibility Guidelines and Inclusive Design practicesFoundational project planning and management skillsPrior work involves collaboration within design teams (with UX Researchers, Product Designers and Content Designers)

ABOUT US

Chase is a leading financial services firm, helping nearly half of America’s households and small businesses achieve their financial goals through a broad range of financial products. Our mission is to create engaged, lifelong relationships and put our customers at the heart of everything we do. We also help small businesses, nonprofits and cities grow, delivering solutions to solve all their financial needs.

We offer a competitive total rewards package including base salary determined based on the role, experience, skill set, and location. For those in eligible roles, discretionary incentive compensation which may be awarded in recognition of individual achievements and contributions. We also offer a range of benefits and programs to meet employee needs, based on eligibility. These benefits include comprehensive health care coverage, on-site health and wellness centers, a retirement savings plan, backup childcare, tuition reimbursement, mental health support, financial coaching and more. Additional details about total compensation and benefits will be provided during the hiring process.

We recognize that our people are our strength and the diverse talents they bring to our global workforce are directly linked to our success. We are an equal opportunity employer and place a high value on diversity and inclusion at our company. We do not discriminate on the basis of any protected attribute, including race, religion, color, national origin, gender, sexual orientation, gender identity, gender expression, age, marital or veteran status, pregnancy or disability, or any other basis protected under applicable law. We also make reasonable accommodations for applicants’ and employees’ religious practices and beliefs, as well as mental health or physical disability needs. Visit our FAQs for more information about requesting an accommodation.

Equal Opportunity Employer/Disability/Veterans

About The Team

Our Consumer & Community Banking division serves our Chase customers through a range of financial services, including personal banking, credit cards, mortgages, auto financing, investment advice, small business loans and payment processing. We’re proud to lead the U.S. in credit card sales and deposit growth and have the most-used digital solutions – all while ranking first in customer satisfaction.

The Digital team is dedicated to creating innovative, industry-leading products and experiences that help customers access, share and control their financial data so they can make smart decisions with their money. Teams enable innovation while adhering to the firm’s data sharing principles of security, customer control and convenience, and privacy.","<strong>Job Description

</strong>Become a Senior Experience Researcher for Branch and Teller experiences.

The Design and Customer Experience (DCE) team is responsible for creating exceptional experiences for Chase’s Consumer and Community Bank. We are a group of creative collaborators who are passionate about crafting experiences that have meaningful impact on the financial, physical, and emotional wellbeing of our customers. At Chase, we’re proud to serve nearly half of America’s households with a broad range of financial services, including personal banking, credit cards, mortgages, auto financing, investment advice, small business loans and payment processing. Our company is built around making a real difference for our communities, doing what's right for our customers, providing our employees with the opportunity to define unique career paths and sharing ideas that will help propel us into the future.

As an Experience Researcher in our consumer banking team, you will scope and craft research strategy, conduct research, and deliver actionable insights on research initiatives related to our Consumer Banking Products. You will be part of multi-disciplinary teams, including Product Designers and Content Designers, committed to designing the future of banking. You will participate in cross-functional collaboration with Product Managers, Data Analysts, and Engineers, informing prioritization, planning, and decisions along the way to execution. We expect you to have strengths in the core user research parts of this process, and a desire to continually broaden and improve your skills.

<strong>Job Responsibilities

</strong><ul><li>Structure and plan simple evaluative research initiatives that address the needs of Product teams</li><li>Design, administer, and report on these research studies, producing associated materials (e.g., screeners, discussion guides, toplines, etc.) with some guidance</li><li>Support generative and formative research</li><li>Present work, and the rationale behind research findings, to product leadership</li><li>Take a question or a problem and be able to translate it into a testable hypothesis—complete with a specific method and tasks that appropriately respond to research, project, and business objectives</li><li>Help non-researchers (Product Designers, Content Designers, Product Managers) in taking part in user research work

</li></ul><strong>Required Qualifications, Capabilities And Skills

</strong><ul><li>Bachelor’s Degree in relevant research or design discipline (e.g., Interaction Design, HCI, Anthropology, Cognitive Science), certification from credible bootcamp or similar accelerated learning program, or equivalent work experience</li><li>Ability to lead a research study from beginning to end independently</li><li>Experience conducting evaluative research, and supporting generative and formative research</li><li>Demonstrates strong User Research skills; and development in adjacent skills such as UX Writing, Information Architecture, and Interaction Design</li><li>Foundational comfort in presenting findings and insights to team members and stakeholders from multi-disciplinary backgrounds</li><li>Foundational experience with key UX Research tools for studies such as remote research, usability testing

</li></ul><strong>Preferred Qualifications, Capabilities And Skills

</strong><ul><li>Foundational understanding of Accessibility Guidelines and Inclusive Design practices</li><li>Foundational project planning and management skills</li><li>Prior work involves collaboration within design teams (with UX Researchers, Product Designers and Content Designers)

</li></ul><strong>ABOUT US

</strong>Chase is a leading financial services firm, helping nearly half of America’s households and small businesses achieve their financial goals through a broad range of financial products. Our mission is to create engaged, lifelong relationships and put our customers at the heart of everything we do. We also help small businesses, nonprofits and cities grow, delivering solutions to solve all their financial needs.

We offer a competitive total rewards package including base salary determined based on the role, experience, skill set, and location. For those in eligible roles, discretionary incentive compensation which may be awarded in recognition of individual achievements and contributions. We also offer a range of benefits and programs to meet employee needs, based on eligibility. These benefits include comprehensive health care coverage, on-site health and wellness centers, a retirement savings plan, backup childcare, tuition reimbursement, mental health support, financial coaching and more. Additional details about total compensation and benefits will be provided during the hiring process.

We recognize that our people are our strength and the diverse talents they bring to our global workforce are directly linked to our success. We are an equal opportunity employer and place a high value on diversity and inclusion at our company. We do not discriminate on the basis of any protected attribute, including race, religion, color, national origin, gender, sexual orientation, gender identity, gender expression, age, marital or veteran status, pregnancy or disability, or any other basis protected under applicable law. We also make reasonable accommodations for applicants’ and employees’ religious practices and beliefs, as well as mental health or physical disability needs. Visit our FAQs for more information about requesting an accommodation.

Equal Opportunity Employer/Disability/Veterans

<strong>About The Team

</strong>Our Consumer & Community Banking division serves our Chase customers through a range of financial services, including personal banking, credit cards, mortgages, auto financing, investment advice, small business loans and payment processing. We’re proud to lead the U.S. in credit card sales and deposit growth and have the most-used digital solutions – all while ranking first in customer satisfaction.

The Digital team is dedicated to creating innovative, industry-leading products and experiences that help customers access, share and control their financial data so they can make smart decisions with their money. Teams enable innovation while adhering to the firm’s data sharing principles of security, customer control and convenience, and privacy.","JPMorgan Chase & Co.","https://www.linkedin.com/jobs/view/3841491435/","Plano, Texas, United States","Skills: UX Research, Usability Testing, +8 more","10,001+ employees · Financial Services
175 school alumni work here","LISTED","6077559","JPMorgan Chase & Co.","https://media.licdn.com/dms/image/C4E0BAQFN7ZGRjNcgeA/company-logo_400_400/0/1656681489601/jpmorganchase_logo?e=1718236800&v=beta&t=BrYF2vuWuNBc74XLrNLRS1jbueSOx6X29gCaScZxmRE","2024-03-03T22:04:30.000Z","2024-03-08T02:16:37.643Z"
"UX Researcher","Dice is the leading career destination for tech experts at every stage of their careers. Our client, Info Origin Inc., is seeking the following. Apply via Dice today!

Interview Process: First Video Than In Person

Skills/Requirements:

Five or more years of UX research experience.Strong understanding of UI Design.

Experience with:

Creating wireframes and prototypes and using various tools (Figma, Sketch, or equivalent).Creating user personas and user journey maps.Empathy mapping development.Leading user workshops and facilitating sessions.Generating insights from data and effectively sharing research results.Planning and conducting usability testing.Research-related tasks including research, planning, evaluating, and iteration.Formulating specific, answerable, and practical questions.Collaborating effectively with stakeholders and acting as a strategic partner in decisions.Remote testing tools.Creating formal presentations and user finding reportsPresenting findings and recommendations to executive sponsors and business stakeholders

UX Researcher","Dice is the leading career destination for tech experts at every stage of their careers. Our client, Info Origin Inc., is seeking the following. Apply via Dice today!

<strong>Interview Process:</strong> First Video Than In Person

<strong>Skills/Requirements:

</strong><ul><li>Five or more years of UX research experience.</li><li>Strong understanding of UI Design.

</li></ul><strong>Experience with:

</strong><ul><li>Creating wireframes and prototypes and using various tools (Figma, Sketch, or equivalent).</li><li>Creating user personas and user journey maps.</li><li>Empathy mapping development.</li><li>Leading user workshops and facilitating sessions.</li><li>Generating insights from data and effectively sharing research results.</li><li>Planning and conducting usability testing.</li><li>Research-related tasks including research, planning, evaluating, and iteration.</li><li>Formulating specific, answerable, and practical questions.</li><li>Collaborating effectively with stakeholders and acting as a strategic partner in decisions.</li><li>Remote testing tools.</li><li>Creating formal presentations and user finding reports</li><li>Presenting findings and recommendations to executive sponsors and business stakeholders

</li></ul>UX Researcher","Dice","https://www.linkedin.com/jobs/view/3848451046/","Lansing, Michigan, United States","Skills: UX Research, User Interface Design, +8 more","1,001-5,000 employees · Software Development","LISTED","1307337","Dice","https://media.licdn.com/dms/image/C560BAQEYK67Tel_mng/company-logo_400_400/0/1630655500596/dice_logo?e=1718236800&v=beta&t=3zazMM9_SvnwtJ_Qe3iGU1mZIBgQfP_9otzYsAK_gWo","2024-03-06T15:14:47.000Z","2024-03-08T02:16:37.643Z"
"User Experience (UX) Researcher","Dice is the leading career destination for tech experts at every stage of their careers. Our client, Swanktek, is seeking the following. Apply via Dice today!

Skills/Requirements:

 Five or more years of UX research experience. Strong understanding of UI Design. Experience with:Creating wireframes and prototypes and using various tools (Figma, Sketch, or equivalent).Creating user personas and user journey maps.Empathy mapping development.Leading user workshops and facilitating sessions.Generating insights from data and effectively sharing research results.Planning and conducting usability testing.Research-related tasks including research, planning, evaluating, and iteration.Formulating specific, answerable, and practical questions.Collaborating effectively with stakeholders and acting as a strategic partner in decisions.Remote testing tools. Creating formal presentations and user finding reports Presenting findings and recommendations to executive sponsors and business stakeholders

User Experience (UX) Researcher","Dice is the leading career destination for tech experts at every stage of their careers. Our client, Swanktek, is seeking the following. Apply via Dice today!

Skills/Requirements:

<ul><li> Five or more years of UX research experience.</li><li> Strong understanding of UI Design.</li><li> Experience with:</li><li>Creating wireframes and prototypes and using various tools (Figma, Sketch, or equivalent).</li><li>Creating user personas and user journey maps.</li><li>Empathy mapping development.</li><li>Leading user workshops and facilitating sessions.</li><li>Generating insights from data and effectively sharing research results.</li><li>Planning and conducting usability testing.</li><li>Research-related tasks including research, planning, evaluating, and iteration.</li><li>Formulating specific, answerable, and practical questions.</li><li>Collaborating effectively with stakeholders and acting as a strategic partner in decisions.</li><li>Remote testing tools.</li><li> Creating formal presentations and user finding reports</li><li> Presenting findings and recommendations to executive sponsors and business stakeholders

</li></ul>User Experience (UX) Researcher","Dice","https://www.linkedin.com/jobs/view/3848444989/","Lansing, Michigan, United States","Skills: UX Research, User Interface Design, +8 more","1,001-5,000 employees · Software Development","LISTED","1307337","Dice","https://media.licdn.com/dms/image/C560BAQEYK67Tel_mng/company-logo_400_400/0/1630655500596/dice_logo?e=1718236800&v=beta&t=3zazMM9_SvnwtJ_Qe3iGU1mZIBgQfP_9otzYsAK_gWo","2024-03-06T15:14:43.000Z","2024-03-08T02:16:37.643Z"
